,link,Tip,Površina,Broj soba,Uknjiženost,Grejanje,Stanje,Spratnost,Infrastruktura,Unutrašnje prostorije,Nameštenost,Opremljenost,Useljivo,Šifra oglasa,Oglas ažuriran,price,street,address,description,title,end_date,Lift,Garaža,Godina izgradnje,Parking,Pogled na,Autobuske linije,Internet,Orijentacija nekretnine,Trolejbuske linije
92,https://www.4zida.rs/prodaja-stanova/mladenovac-centar-mladenovac-opstina-beograd/trosoban-stan/63e913acbc42c5b6690c0a1b,,70 m² ,3 sobe ,uknjiženo ,grejanje na gas ,novo ,4,terasa ,kupatilo ,prazno ,telefon,useljivo ,1336 ,pre 2 meseca ,76.000,Mladenovac centar,"Mladenovac centar, Mladenovac opština, Beograd",,"Trosoban stan na prodaju, Mladenovac centar, 76.000€, 70m² - 4zida",2023-07-10,,,2022,,,,,,
93,https://www.4zida.rs/prodaja-stanova/jajinci-vozdovac-opstina-beograd/dvosoban-stan/644af1a5150bd389010c316a,Stan u zgradi ,35 m² ,2 sobe ,uknjiženo ,etažno grejanje ,novo ,2,terasa ,,prazno ,kablovska,,585 ,pre 12 minuta ,57.200,Bulevar Jna,"Jajinci, Voždovac opština, Beograd","Stan 35m2 sa terasom, vrhunskog kvaliteta gradnje,  hrastov parket, granitna keramika, 6-komorna Pvc stolarija, etažno i podno grejanje, video-nadzor. Funkcionalan raspored, odvojena spavaća soba, komforan dnevni boravak sa trepezaarijskim delom, kuhinja, kupatilo, terasa. Nov stan,  cena + Pdv, (kupci prvog stana ostvaruju pravo povraćaja Pdv-a)mogućnost kupovine garažnog mesta. Odlična lokacija u neposrednoj blizini Banjice, Doma Zdravlja, više prodavnica i javnog prevoza. Uredna dokumentacija, mogućnost kupovine preko stambenog kredita, za svaku preporuku.... Posrednička naknada je u skladu sa Opštim uslovima poslovanja Posrednika ""SM nekretnine"" Beograd.","Dvosoban stan na prodaju, Bulevar Jna, 57.200€, 35m² - 4zida",2023-07-10,ima lift ,1 garažno mesto ,,,,,,,
94,https://www.4zida.rs/prodaja-stanova/karaburma-palilula-opstina-beograd/garsonjera/64abf62ea4da3539830ca837,,20 m² ,0,uknjiženo ,grejanje na struju ,uobičajeno stanje ,3,podrum,kupatilo ,prazno ,telefon,useljivo ,5739 ,pre 9 sati ,45.000,Stevana Dukića,"Karaburma, Palilula opština, Beograd",,"Garsonjera na prodaju, Stevana Dukića, 45.000€, 20m² - 4zida",2023-07-10,,,1975,,,,,,
95,https://www.4zida.rs/prodaja-stanova/sava-kovacevic-zemun-zemun-opstina-beograd/jednoiposoban-stan/64846b73c19b8bb74d01a5ba,,38 m² ,1,uknjiženo ,,,visoko prizemlje,,kupatilo ,prazno ,telefon ,,13227 ,pre 18 dana ,91.000,Rade Končara,"Sava Kovačević, Zemun, Zemun opština, Beograd",,"Jednoiposoban stan na prodaju, Rade Končara, 91.000€, 38m² - 4zida",2023-07-10,,,,,,,,,
96,https://www.4zida.rs/prodaja-stanova/blok-63-bezanijski-blokovi-novi-beograd-beograd/jednoiposoban-stan/648c682066d0e762300881cc,Stan u zgradi ,50 m² ,1,uknjiženo ,centralno grejanje ,,1,,,,,useljivo ,96893 ,pre 24 dana ,137.000,Gandijeva,"Blok 63, Bežanijski Blokovi, Novi Beograd, Beograd","Agencijski ID: 96893, I/IX, uknjižen. Agent Milica. Više informacija na: www.beocitynekretnine.rs Agencijska provizija 2%. Telefoni: 060/555-3901 • 060/555-2146 • 011/408-5754. Kontakt van radnog vremena: kancelarija@beocitynekretnine.rs","Jednoiposoban stan na prodaju, Gandijeva, 137.000€, 50m² - 4zida",2023-07-10,,,,,,,,,
97,https://www.4zida.rs/prodaja-stanova/vidikovac-rakovica-opstina-beograd/trosoban-stan/648467a3ebad1a9f0109acfd,,68 m² ,3 sobe ,uknjiženo ,centralno grejanje ,uobičajeno stanje ,9,,kupatilo ,prazno ,telefon,useljivo ,1143 ,pre 30 dana ,102.000,Vidikovački venac,"Vidikovac, Rakovica opština, Beograd","Uknjižen trosoban stan, očuvan, funkcionalan. Ima dve spavaće sobe, proatran dnevni boravak, kuhinju i trpezariju, hodnik, kupatilo. Stan je IX spratu nadogradnje. Lift do VII sprata. Blizina prevoza, pijace, tržnih centara i dr. Kontakt: 063/623-596 Agencijska provizija 2%","Trosoban stan na prodaju, Vidikovački venac, 102.000€, 68m² - 4zida",2023-07-10,ima lift ,,,,,,,,
98,https://www.4zida.rs/prodaja-stanova/krnjaca-palilula-opstina-beograd/dvoiposoban-stan/64257b0479f7f37b4905ed5e,Stan u zgradi ,49 m² ,2,uknjiženo ,etažno grejanje ,novo ,visoko prizemlje ,terasa ,,prazno ,kablovska,,568 ,pre 12 minuta ,74.778,Partizanski blok,"Krnjača, Palilula opština, Beograd","Stan 49m2 sa terasom, u izgradnji,  funkcionalan raspored, 2 spavaće sobe, komforan dnevni boravak sa trepezarijskim delom, kuhinja, kupatilo i terasa. Prvoklasnog kvaliteta gradnje, hrastov parket, granitna keramika,  šestokomorna PVC stolarija sa roletnama, etažno grejanje, mali komunalni troškovi. odlična lokacija u neposrednoj blizini Metro-a i javnog prevoza. Uredna dokumentacija, moguća kupovina preko stambenog kredita, cena + PDV od 10%, mogućnost kupovine parking mesta, za svaku preporuku... .. Posrednička naknada je u skladu sa Opštim uslovima poslovanja Posrednika ""SM nekretnine"" Beograd.","Dvoiposoban stan na prodaju, Partizanski blok, 74.778€, 49m² - 4zida",2023-07-10,,,,1 parking mesto ,,,,,
99,https://www.4zida.rs/prodaja-stanova/karaburma-palilula-opstina-beograd/dvosoban-stan/645cda40718c53132d018f5e,,49 m² ,2 sobe ,uknjiženo ,grejanje na struju ,novo ,2,terasa ,kupatilo ,prazno ,telefon,,8599 ,pre 1 mesec ,99.999,Karaburma,"Karaburma, Palilula opština, Beograd",,"Dvosoban stan na prodaju, Karaburma, 99.999€, 49m² - 4zida",2023-07-10,,,,,,,,,
100,https://www.4zida.rs/prodaja-stanova/krnjaca-palilula-opstina-beograd/dvosoban-stan/63874b40c0a4bed45206fad5,Stan u zgradi ,40 m² ,2 sobe ,uknjiženo ,etažno grejanje ,novo ,2,terasa ,,prazno ,kablovska,,412 ,pre 11 minuta ,61.800,Partizanski blok,"Krnjača, Palilula opština, Beograd","Stan 40m2 sa terasom, u izgradnji, funkcionalan raspored, 1 spavaća soba, komforan dnevni boravak sa trepezarijskim delom, kuhinja, kupatilo i terasa. Prvoklasnog kvaliteta gradnje, hrastov parket, granitna keramika,  šestokomorna PVC stolarija sa roletnama, etažno grejanje, mali komunalni troškovi. odlična lokacija u neposrednoj blizini Metro-a i javnog prevoza. Uredna dokumentacija, cena + PDV, mogućnost kupovine parking mesta, za svaku preporuku... Posrednička naknada je u skladu sa Opštim uslovima poslovanja Posrednika ""SM nekretnine"" Beograd.","Dvosoban stan na prodaju, Partizanski blok, 61.800€, 40m² - 4zida",2023-07-10,,,,1 parking mesto ,,,,,
101,https://www.4zida.rs/prodaja-stanova/stepa-stepanovic-vozdovac-opstina-beograd/trosoban-stan/64ac2c5f9b81f36298077495,,83 m² ,3 sobe ,,centralno grejanje ,novo ,1,lođa ,kupatilo ,prazno ,telefon,,889 ,pre 5 sati ,225.000,2. srpske armije,"Stepa Stepanović, Voždovac opština, Beograd",,"Trosoban stan na prodaju, 2. srpske armije, 225.000€, 83m² - 4zida",2023-07-10,ima lift ,,,,,,,,
102,https://www.4zida.rs/prodaja-stanova/miljakovac-iii-miljakovac-rakovica-opstina-beograd/trosoban-stan/64ac4c9eaeb587c80c09b2b9,,50 m² ,3 sobe ,uknjiženo ,etažno grejanje ,u izgradnji ,1,terasa ,kupatilo ,prazno ,telefon ,,124671 ,pre 59 minuta ,85.000,Miljakovačke staze,"Miljakovac III, Miljakovac, Rakovica opština, Beograd",,"Trosoban stan na prodaju, Miljakovačke staze, 85.000€, 50m² - 4zida",2023-07-10,,,,,,,,,
103,https://www.4zida.rs/prodaja-stanova/bajlonijeva-pijaca-stari-grad-opstina-beograd/dvoiposoban-stan/645cda65718c53132d018f6f,,92 m² ,2,uknjiženo ,centralno grejanje ,,5,terasa ,kupatilo ,prazno ,telefon ,useljivo ,2637 ,pre 1 mesec ,230.000,Drinčićeva,"Bajlonijeva Pijaca, Stari Grad opština, Beograd",,"Dvoiposoban stan na prodaju, Drinčićeva, 230.000€, 92m² - 4zida",2023-07-10,,,,,,,,,
104,https://www.4zida.rs/prodaja-stanova/juzni-bulevar-vracar-beograd/trosoban-stan/64359377f126ae93cc005957,Stan u zgradi ,69 m² ,3 sobe ,u procesu uknjižavanja ,centralno grejanje ,,4,terasa ,,prazno ,,,20126 ,pre 9 dana ,220.000,Gospodara Vučića,"Južni Bulevar, Vračar, Beograd",,"Trosoban stan na prodaju, Gospodara Vučića, 220.000€, 69m² - 4zida",2023-07-10,ima lift ,,2007,1 parking mesto ,,,,,
105,https://www.4zida.rs/prodaja-stanova/vojvode-vlahovica-vozdovac-opstina-beograd/garsonjera/64ac2fbd9b81f36298077534,Stan u zgradi ,26 m² ,0,nije uknjiženo ,norveški radijatori ,novo ,visoko prizemlje,,,,,useljivo ,100036 ,pre 5 sati ,46.400,Vojvode Vlahovića,"Vojvode Vlahovića, Voždovac opština, Beograd","Agencijski ID: 100036, VPR/III, lift, nov, novogradnja, stambena zgrada. Novogradnja, stambena zgrada. u centru naselja Vojvode Vlahovića u neposrednoj blizini Shop&amp; Go prodavnice i autobuske stanice za mini buseve . Objekat se gradi sa građevinskom dozvolom, po proceduri za dobijaje upotrebne dozvole i uknjiženja objekta po izgradnji .Gradi se savremenim materijalima sa prvoklasnom termo izolacijom i stolarijom koju proizvodi sam investitor .Stan je izuzetno funkcionalno projektovan sa minimalnim gubitkom korisnog prostora sa plafonom visine 2.80m koji doprinosi većem volumenu prostora i prijatnom osećanju boravljenja.  Ispod stana je predviđen poslovni prostor , Projektovani su veliki prozori što doprinosi puno svetlosti u sobama. . Zgrada će biti useljiva najkasnije u septembru ove godine . Cena je sa PDV -om , kupci prvog stana imaju pravo na povraćaj poreza . Stepen izgrađenosti objekta je 80% , banke odobravaju kredit. Agent Saša. Više informacija na: www.beocitynekretnine.rs Agencijska provizija 2%. Telefoni: 060/328-3901 • 060/555-9720 • 011/328-3901. Kontakt van radnog vremena: kancelarija@beocitynekretnine.rs","Garsonjera na prodaju, Vojvode Vlahovića, 46.400€, 26m² - 4zida",2023-07-10,ima lift ,,2023,,,,,,
106,https://www.4zida.rs/prodaja-stanova/vojvode-vlahovica-vozdovac-opstina-beograd/dvosoban-stan/64ac2fbd9b81f36298077525,Stan u zgradi ,40 m² ,2 sobe ,nije uknjiženo ,norveški radijatori ,novo ,3,,,,,useljivo ,100042 ,pre 5 sati ,70.000,Vojvode Vlahovića,"Vojvode Vlahovića, Voždovac opština, Beograd","Agencijski ID: 100042, III/III, lift, nov, novogradnja, stambena zgrada. Agent Saša. Više informacija na: www.beocitynekretnine.rs Agencijska provizija 2%. Telefoni: 060/328-3901 • 060/555-9720 • 011/328-3901. Kontakt van radnog vremena: kancelarija@beocitynekretnine.rs","Dvosoban stan na prodaju, Vojvode Vlahovića, 70.000€, 40m² - 4zida",2023-07-10,ima lift ,,2023,,,,,,
107,https://www.4zida.rs/prodaja-stanova/visnjicka-banja-palilula-opstina-beograd/garsonjera/64a6ae1e7a6369d24c007dd3,,24 m² ,0,uknjiženo ,grejanje na struju ,novo ,visoko prizemlje,terasa ,kupatilo ,prazno ,telefon,useljivo ,1219 ,pre 7 sati ,60.000,Batočinska,"Višnjička Banja, Palilula opština, Beograd",,"Garsonjera na prodaju, Batočinska, 60.000€, 24m² - 4zida",2023-07-10,,,2016,1 parking mesto ,,,,,
108,https://www.4zida.rs/prodaja-stanova/beograd-centar-stari-grad-opstina-beograd/dvosoban-stan/6346f9c825454c59490e22f6,Stan u zgradi ,53 m² ,2 sobe ,uknjiženo ,grejanje na struju ,,2,podrum,,,,useljivo ,89331 ,pre 2 meseca ,185.000,Cetinjska,"Beograd centar, Stari Grad opština, Beograd",,"Dvosoban stan na prodaju, Cetinjska, 185.000€, 53m² - 4zida",2023-07-10,,,,,,,,,
109,https://www.4zida.rs/prodaja-stanova/blok-11c-stari-merkator-blok-11-novi-beograd-beograd/trosoban-stan/645cf11badedcc5167089e46,Stan u zgradi ,86 m² ,3 sobe ,uknjiženo ,centralno grejanje ,renovirano ,6,terasa,kupatilo,,telefon,useljivo ,,pre 9 sati ,249.500,Luja Adamiča,"Blok 11c - Stari Merkator, Blok 11, Novi Beograd, Beograd",,"Trosoban stan na prodaju, Luja Adamiča, 249.500€, 86m² - 4zida",2023-07-10,ima lift ,,,,,,,,
110,https://www.4zida.rs/prodaja-stanova/kalenic-vracar-beograd/dvosoban-stan/648c647a66d0e76230087b4e,Stan u zgradi ,75 m² ,2 sobe ,uknjiženo ,etažno grejanje ,,2,podrum,,,klima ,useljivo ,95490 ,pre 24 dana ,286.000,Kalenić,"Kalenić, Vračar, Beograd","Agencijski ID: 95490, II/V, klima, terasa(2), uknjižen, luks renoviran, parking, podrum, može zamena(), stambena zgrada. Kvalitetno renoviran 2.0 stan od 75m2 (uknjižen na 62m2), polunamešten, dvostrano orijentisan, u centru Vračara, na par koraka od Kalenić pijace. Veoma je svetao, sa lepim pogledom, po strukturi je bio 3.0, a adaptacijom je  pretvoren u 2.0. Miks fotografija nakon renoviranja od pre 2 godine bez nameštaja i sadašnje stanje kada je polunamešten. Sastoji se iz komfornog dnevnog boravka od oko 40m2 sa trpezarijom i izlazom na dve terase, spavaće sobe sa izlazom na zastakljenu lođu i kupatila. Pvc stolarija sa roletnama i komarnicima, keramika, sanitarije, sigurnosna vrata, sve je vrhunskog kvaliteta. Pre 2 godine je kompletno renoviran, kada su zamenjene i vodovodne i elektro instalacije. Etažno grejanje na struju, infostan oko 1.500 din. Ugradna kuhinja, trpezarijski sto i ostatak nameštaja na fotografijama, sve ostaje u stanu i uključeno je u cenu. Zgrada sa malim brojem stanova, uredno održavana, bez lifta. Stan ima veliki pripadajući podrum kao i svoje parking mesto obezbeđeno u dvorištu zgrade. Blizina Kalenić pijace, brojnih marketa, apoteka, kafića, restorana. Gradski prevoz odlično povezan sa svim delovima grada. Odlična investicija za život, za izdavanje ili za poslovni prostor. Uknjižen 1/1, bez tereta, USELJIV ODMAH. Moguća zamena za manji stan uz doplatu. Agent Nela. Više informacija na: www.beocitynekretnine.rs Agencijska provizija 2%. Telefoni: 060/328-3901 • 060/555-9720 • 011/328-3901. Kontakt van radnog vremena: kancelarija@beocitynekretnine.rs","Dvosoban stan na prodaju, Kalenić, 286.000€, 75m² - 4zida",2023-07-10,,,,1 parking mesto ,,,,,
111,https://www.4zida.rs/prodaja-stanova/banjica-vozdovac-opstina-beograd/dvosoban-stan/64a4495e1ea9b0dda709027b,,70 m² ,2 sobe ,uknjiženo ,centralno grejanje ,novo ,1,terasa ,,prazno ,kablovska,useljivo ,58892 ,pre 5 sati ,150.000,Bulevar oslobođenja,"Banjica, Voždovac opština, Beograd",,"Dvosoban stan na prodaju, Bulevar oslobođenja, 150.000€, 70m² - 4zida",2023-07-10,ima lift ,,,,,,,,
112,https://www.4zida.rs/prodaja-stanova/vidikovacka-padina-vidikovac-rakovica-opstina-beograd/jednosoban-stan/648c7168ce223806a60adc83,Stan u zgradi ,30 m² ,1 soba ,nije uknjiženo ,grejanje na struju ,,3,terasa ,,,,useljivo ,75178 ,pre 24 dana ,59.700,Kneževačka,"Vidikovačka Padina, Vidikovac, Rakovica opština, Beograd","Agencijski ID: 75178, III/IV, terasa. Agent Ranka. Više informacija na: www.beocitynekretnine.rs Agencijska provizija 2%. Telefoni: 060/328-3901 • 060/555-9720 • 011/328-3901. Kontakt van radnog vremena: kancelarija@beocitynekretnine.rs","Jednosoban stan na prodaju, Kneževačka, 59.700€, 30m² - 4zida",2023-07-10,,,,,,,,,
113,https://www.4zida.rs/prodaja-stanova/cerak-cukarica-cukarica-opstina-beograd/dvosoban-stan/64ac090aafa96206280869cc,,58 m² ,2 sobe ,uknjiženo ,grejanje na gas ,,visoko prizemlje,terasa ,kupatilo ,prazno ,telefon ,,1514 ,pre 7 sati ,120.000,Ratka Mitrovića,"Cerak, Čukarica, Čukarica opština, Beograd",,"Dvosoban stan na prodaju, Ratka Mitrovića, 120.000€, 58m² - 4zida",2023-07-10,,,,,,,,,
114,https://www.4zida.rs/prodaja-stanova/banjica-vozdovac-opstina-beograd/cetvorosoban-stan/642f28b943ef3f2f74019c98,,90 m² ,4 sobe ,uknjiženo ,centralno grejanje ,renovirano ,3,terasa,kupatila ,prazno ,telefon,useljivo ,3726 ,pre 5 sati ,189.000,Bulevar oslobođenja,"Banjica, Voždovac opština, Beograd","Prodaja stana - Banjica. Odličan četvorosoban stan u dobroj zgradi sa urednim ulazom i dva lifta. Stan je sunčan, svetao, sa otvorenim pogledom. Funkcionalan raspored prostorija.  Veliki dnevni boravk koji je povezan sa trpezarijom i kuhinjom. Iz kuhinje se izlazi na terasu i iz dnevnog boravka se izlazi na veliku lodju - drugu tersu. Zaseban spavaći blok koji se sastoji od tri spavaće sobe i kupatila. Stan ima dva mokra čvora, kupatilo i gostinjski toalet. U stanu je protočna topla voda i centralno grejanje. Stan je renoviran. Promenjene vodovodne instalacije, odlična keramika. Stan ima pripadajući podrum. I na svakom spratu se nalazi sušionica.  U blizini su : sprtski centar Banjica, prodavnice, pijaca, dve škole, vrtić, tržni centar, Lidal, VMA,  fakulteti (političkih nauka, FON, saobrćajni fakultet). Odlična povezanost sa drugim delovima grada. Veliki parking. Retko u ponudi.  Uskoro slike stana. 14 Oznaka na mapi pokazuje deo grada, ne i tačan položaj zgrade.","Četvorosoban stan na prodaju, Bulevar oslobođenja, 189.000€, 90m² - 4zida",2023-07-10,ima lift ,,,,,,,,
115,https://www.4zida.rs/prodaja-stanova/autokomanda-vozdovac-opstina-beograd/jednosoban-stan/645ced0eb0587d37f309e9d1,Stan u zgradi ,31 m² ,1 soba ,,centralno grejanje ,renovirano ,4,lođa ,,prazno ,interfon ,,6002 ,pre 1 mesec ,85.000,Vojvode Stepe,"Autokomanda, Voždovac opština, Beograd",,"Jednosoban stan na prodaju, Vojvode Stepe, 85.000€, 31m² - 4zida",2023-07-10,ima lift ,,,1 parking mesto ,,,,,
116,https://www.4zida.rs/prodaja-stanova/hram-svetog-save-neimar-vracar-beograd/trosoban-stan/64abf8d8a4da3539830ca8aa,,82 m² ,3 sobe ,uknjiženo ,centralno grejanje ,uobičajeno stanje ,1,podrum,kupatilo ,prazno ,telefon,,14793 ,pre 8 sati ,309.000,Kneginje Zorke,"Hram Svetog Save, Neimar, Vračar, Beograd",,"Trosoban stan na prodaju, Kneginje Zorke, 309.000€, 82m² - 4zida",2023-07-10,ima lift ,,,,,,,,
117,https://www.4zida.rs/prodaja-stanova/knezevac-vidikovac-rakovica-opstina-beograd/jednoiposoban-stan/64ac090aafa96206280869c6,,37 m² ,1,,etažno grejanje ,,4,terasa ,kupatilo ,prazno ,telefon ,,1516 ,pre 5 sati ,72.000,Muminovačka,"Kneževac, Vidikovac, Rakovica opština, Beograd",,"Jednoiposoban stan na prodaju, Muminovačka, 72.000€, 37m² - 4zida",2023-07-10,,,,1 parking mesto ,,,,,
118,https://www.4zida.rs/prodaja-stanova/borca-palilula-opstina-beograd/jednoiposoban-stan/648c635966d0e76230087947,Stan u zgradi ,40 m² ,1,nije uknjiženo ,grejanje na struju ,,prizemlje ,,,,,useljivo ,85685 ,pre 24 dana ,45.000,Borča,"Borča, Palilula opština, Beograd",,"Jednoiposoban stan na prodaju, Borča, 45.000€, 40m² - 4zida",2023-07-10,,,,,,,,,
119,https://www.4zida.rs/prodaja-stanova/petlovo-brdo-rakovica-opstina-beograd/petosoban-stan/649458311fe40fcac704927a,,150 m² ,5 soba ,uknjiženo ,etažno grejanje ,novo ,2,terasa ,kupatilo ,prazno ,telefon,,3854 ,pre 6 sati ,225.000,Hablova,"Petlovo Brdo, Rakovica opština, Beograd",,"Petosoban stan na prodaju, Hablova, 225.000€, 150m² - 4zida",2023-07-10,,,,1 parking mesto ,,,,,
120,https://www.4zida.rs/prodaja-stanova/krnjaca-palilula-opstina-beograd/dvosoban-stan/64ac1558ea531d4d0a02fa03,Stan u zgradi ,60 m² ,2 sobe ,uknjiženo ,centralno grejanje ,renovirano ,4,lođa ,,prazno ,kablovska,,16176 ,pre 6 sati ,90.000,Koste Josipovića,"Krnjača, Palilula opština, Beograd",,"Dvosoban stan na prodaju, Koste Josipovića, 90.000€, 60m² - 4zida",2023-07-10,,,,,,,,,
121,https://www.4zida.rs/prodaja-stanova/rusanj-cukarica-opstina-beograd/trosoban-stan/64ac358663a7d72d4308f1f9,Stan u zgradi ,51 m² ,3 sobe ,uknjiženo ,grejanje na struju ,,4,dvorište,kupatilo,prazno ,telefon,useljivo ,,pre 3 sata ,37.900,Oslobodjenja 1 deo,"Rušanj, Čukarica opština, Beograd",,"Trosoban stan na prodaju, Oslobodjenja 1 deo, 37.900€, 51m² - 4zida",2023-07-10,,,2000,,dvorište ,,ADSL ,,
122,https://www.4zida.rs/prodaja-stanova/mirijevo-zvezdara-opstina-beograd/dvoiposoban-stan/64ac188be7ea48d37e08a3b3,Stan u zgradi ,56 m² ,2,uknjiženo ,etažno grejanje ,novo ,6,,kupatilo ,prazno ,telefon,useljivo ,03,pre 21 minuta ,97.000,Mirijevo,"Mirijevo, Zvezdara opština, Beograd",,"Dvoiposoban stan na prodaju, Mirijevo, 97.000€, 56m² - 4zida",2023-07-10,ima lift ,,,,,da ,,,
123,https://www.4zida.rs/prodaja-stanova/cukarica-cukarica-opstina-beograd/dvosoban-stan/5ffde467e6feec1bc50e944a,,71 m² ,2 sobe ,uknjiženo ,grejanje na gas ,novo ,prizemlje,,kupatilo ,prazno ,,useljivo ,52551 ,pre 20 dana ,106.500,Vojislava Lubarde,"Čukarica, Čukarica opština, Beograd",,"Dvosoban stan na prodaju, Vojislava Lubarde, 106.500€, 71m² - 4zida",2023-07-10,,,,,,,,,
124,https://www.4zida.rs/prodaja-stanova/zeleni-venac-savski-venac-beograd/dvosoban-stan/6412dc4d442e2604fb0aace0,Stan u zgradi ,61 m² ,2 sobe ,uknjiženo ,TA peć ,uobičajeno stanje ,3,podrum,,prazno ,kablovska,,4803 ,pre 3 sata ,183.000,Lomina,"Zeleni Venac, Savski Venac, Beograd",,"Dvosoban stan na prodaju, Lomina, 183.000€, 61m² - 4zida",2023-07-10,,,1935,,,,,,
125,https://www.4zida.rs/prodaja-stanova/lion-zvezdara-opstina-beograd/dvosoban-stan/645ce177718c53132d019128,Stan u zgradi ,70 m² ,2 sobe ,uknjiženo ,centralno grejanje ,novo ,visoko prizemlje,,,prazno ,interfon ,useljivo ,306 ,pre 7 dana ,190.000,Koste Abraševića,"Lion, Zvezdara opština, Beograd",,"Dvosoban stan na prodaju, Koste Abraševića, 190.000€, 70m² - 4zida",2023-07-10,ima lift ,,,,,,,,
126,https://www.4zida.rs/prodaja-stanova/dusanovac-vozdovac-opstina-beograd/dvosoban-stan/6410d3f60b82ec9cc101845c,Stan u zgradi ,59 m² ,2 sobe ,,centralno grejanje ,renovirano ,1,,,prazno ,kablovska,useljivo ,4800 ,pre 3 sata ,141.600,Ustanička,"Dušanovac, Voždovac opština, Beograd",,"Dvosoban stan na prodaju, Ustanička, 141.600€, 59m² - 4zida",2023-07-10,,,1950,,,,,,
127,https://www.4zida.rs/prodaja-stanova/stari-kosutnjak-rakovica-opstina-beograd/cetvorosoban-stan/64ac31809b81f362980775b4,Dupleks ,111 m² ,4 sobe ,,centralno grejanje ,,5,terasa ,,prazno ,,,2643 ,pre 4 sata ,185.000,Luke Vojvodića,"Stari Košutnjak, Rakovica opština, Beograd",,"Četvorosoban stan na prodaju, Luke Vojvodića, 185.000€, 111m² - 4zida",2023-07-10,ima lift ,,1985,,,,,,
128,https://www.4zida.rs/prodaja-stanova/beograd-na-vodi-savski-venac-beograd/dvosoban-stan/645d13ff399424b65f056394,,78 m² ,2 sobe ,,centralno grejanje ,u izgradnji ,18,terasa ,kupatila ,prazno ,telefon ,,7206 ,pre 12 dana ,536.888,Hercegovačka,"Beograd na vodi, Savski Venac, Beograd",,"Dvosoban stan na prodaju, Hercegovačka, 536.888€, 78m² - 4zida",2023-07-10,ima lift ,1 garažno mesto ,,,,,,,
129,https://www.4zida.rs/prodaja-stanova/cvetni-trg-vracar-beograd/jednosoban-stan/64ac237286a00488f508a1e8,,20 m² ,1 soba ,uknjiženo ,centralno grejanje ,uobičajeno stanje ,nisko prizemlje,,kupatilo ,prazno ,telefon ,,2116 ,pre 5 sati ,82.000,Svetozara Markovića,"Cvetni Trg, Vračar, Beograd",,"Jednosoban stan na prodaju, Svetozara Markovića, 82.000€, 20m² - 4zida",2023-07-10,,,,,,,,,
130,https://www.4zida.rs/prodaja-stanova/mirijevo-ii-mirijevo-zvezdara-opstina-beograd/dvosoban-stan/64ac091cafa96206280869da,Stan u zgradi ,49 m² ,2 sobe ,u procesu uknjižavanja ,centralno grejanje ,novo ,1,terasa ,kuhinja ,prazno ,kablovska,useljivo ,74 ,pre 7 sati ,78.400,Mirijevo II,"Mirijevo II, Mirijevo, Zvezdara opština, Beograd",,"Dvosoban stan na prodaju, Mirijevo II, 78.400€, 49m² - 4zida",2023-07-10,,,,1 parking mesto ,,,,,
131,https://www.4zida.rs/prodaja-stanova/lion-zvezdara-opstina-beograd/trosoban-stan/648486507bac51da110f6e4e,,99 m² ,3 sobe ,uknjiženo ,etažno grejanje ,,2,terasa ,kupatila ,prazno ,telefon,,3830 ,pre 30 dana ,185.000,Ravanička,"Lion, Zvezdara opština, Beograd","Prodaja stana - Lion- Ravanička U prilici smo da Vam ponudimo četvrorosoban stan u dva nivoa, sa dva kupatila. Kompletno je renoviran i ne zahteva nikakva ulaganja. Ugrađena je PVC stolarija i etažno grejanje. Dvostrano je orijentisan i svetao, sa velikom tersom od 15m2. Ima klimu. Na donjoj  etaži nalazi se  dnevni boravak, kupatilo, veliku kuhinju i trpezariju. Na gornjoj etaži nalaze se tri spavaće sobe, kupatilo i velika terasa. Stan poseduje i ostavu u suterenu zgrade. Ima male režujske troškove. Odlična lokacija, miran i lep porodični kraj, između Bulevara Kralja Aleksandra  i ulice Vojislava Ilića u delu kod Liona. U blizini su prodavnice, osnovna škola, vrtić, dve srednje škole, pijace i sportski centar Olimp stajališta za veliki broj autobuskih, tramvaskih i trolebuskih linija. Odlična povezanost sa ostalim delovima grada. 35 Oznaka na mapi pokazuje deo grada, ne i tačan položaj zgrade.","Trosoban stan na prodaju, Ravanička, 185.000€, 99m² - 4zida",2023-07-10,,,,,,,,,
132,https://www.4zida.rs/prodaja-stanova/blok-34-novi-beograd-beograd/trosoban-stan/64ac1043ea531d4d0a02f8cb,Stan u zgradi ,85 m² ,3 sobe ,uknjiženo ,centralno grejanje ,,6,podrum,,prazno ,interfon,,19129 ,pre 7 sati ,245.000,Bulevar Zorana Đinđića,"Blok 34, Novi Beograd, Beograd",,"Trosoban stan na prodaju, Bulevar Zorana Đinđića, 245.000€, 85m² - 4zida",2023-07-10,ima lift ,,2015,1 parking mesto ,,,,,
133,https://www.4zida.rs/prodaja-stanova/mirijevo-zvezdara-opstina-beograd/trosoban-stan/6435674834cb3f76720b68b0,Stan u zgradi ,60 m² ,3 sobe ,u procesu uknjižavanja ,etažno grejanje ,luksuzno ,2,terasa ,kupatilo,prazno ,,,,pre 17 dana ,101.000,Rudi Cajevca,"Mirijevo, Zvezdara opština, Beograd",,"Trosoban stan na prodaju, Rudi Cajevca, 101.000€, 60m² - 4zida",2023-07-10,,,,1 parking mesto ,,,,,
134,https://www.4zida.rs/prodaja-stanova/mali-mokri-lug-zvezdara-opstina-beograd/jednoiposoban-stan/64ac2fbf9b81f36298077543,Stan u zgradi ,31 m² ,1,uknjiženo ,grejanje na struju ,novo ,1,terasa ,,,,useljivo ,99999 ,pre 5 sati ,54.250,Prvomajska,"Mali Mokri Lug, Zvezdara opština, Beograd","Agencijski ID: 99999, I/IV, terasa, uknjižen, nov, novogradnja, stambena zgrada. +PDV. Odlično pozicionirani stanovi, autobusko stajaliste odmah pored zgrade, blizina doma zdravlja, prodavnica, vrtića. Agent Olivera. Više informacija na: www.beocitynekretnine.rs Agencijska provizija 2%. Telefoni: 060/328-3901 • 060/555-9720 • 011/328-3901. Kontakt van radnog vremena: kancelarija@beocitynekretnine.rs","Jednoiposoban stan na prodaju, Prvomajska, 54.250€, 31m² - 4zida",2023-07-10,,,,,,,,,
