,link,title,end_date,Površina,Broj soba,Grejanje,Stanje,Spratnost,Unutrašnje prostorije,Nameštenost,Opremljenost,Šifra oglasa,Oglas ažuriran,price,street,address,Uknjiženost,Godina izgradnje,Lift,Parking,Infrastruktura,Tip,Garaža,Useljivo,Orijentacija nekretnine,Autobuske linije,Internet,Useljivo od,Pogled na,Tramvajske linije,Trolejbuske linije,Dozvoljeni kućni ljubimci
700,https://www.4zida.rs/prodaja-stanova/lesnina-gradske-lokacije-zrenjanin/jednosoban-stan/64e4dd39bf0eefa2db039d09,"Jednosoban stan na prodaju, Lesnina, 41.000€, 39m² - 4zida",2023-08-29,39 m² ,1 soba ,centralno grejanje ,uobičajeno stanje ,visoko prizemlje/3 sprata ,"kupatilo, kuhinja, ostava ",prazno ,"kablovska, klima ",N875 ,pre 7 dana ,41.000,Lesnina,"Lesnina, Gradske lokacije, Zrenjanin",uknjiženo ,,,,terasa ,Stan u zgradi ,,useljivo ,,1 ,Kablovska ,,dvorište ,,,
701,https://www.4zida.rs/prodaja-stanova/stari-majur-majur-petrovaradin-gradske-lokacije-novi-sad/dvoiposoban-stan/64e9ad092f6bd3719b0e8b2d,"Dvoiposoban stan na prodaju, Stari Majur, 121.400€, 55m² - 4zida",2023-08-29,55 m² ,2.5 soba ,grejanje na gas ,u izgradnji ,1/4 sprata ,"kupatilo, kuhinja, ostava ",,,502104 ,pre 3 dana ,121.400,Stari Majur,"Stari Majur, Majur, Petrovaradin, Gradske lokacije, Novi Sad",nije uknjiženo ,,ima lift (1) ,,terasa ,Stan u zgradi ,,,,,,,,,,
702,https://www.4zida.rs/prodaja-stanova/cair-medijana-gradske-lokacije-nis/dvoiposoban-stan/64e873cdaeb53926a7004e68,"Dvoiposoban stan na prodaju, Ljube Nenadovića, 108.800€, 64m² - 4zida",2023-08-29,64 m² ,2.5 soba ,grejanje na struju ,novo ,prizemlje/4 sprata ,"kupatilo, toalet ",,"kablovska, interfon, klima ",p,pre 4 dana ,108.800,Ljube Nenadovića,"Čair, Medijana, Gradske lokacije, Niš",uknjiženo ,,ima lift (1) ,,"prilaz za invalide, terasa ",,1 garažno mesto ,,,,,,,,,
703,https://www.4zida.rs/prodaja-stanova/stepa-stepanovic-vozdovac-opstina-beograd/dvosoban-stan/64ea267d861012963b0c6d79,"Dvosoban stan na prodaju, Kaplara Momčila Gavrića, 220.000€, 50m² - 4zida",2023-08-29,50 m² ,2 sobe ,centralno grejanje ,,3/5 spratova ,kupatilo ,prazno ,telefon ,125401 ,pre 3 dana ,220.000,Kaplara Momčila Gavrića,"Stepa Stepanović, Voždovac opština, Beograd",uknjiženo ,,ima lift (1) ,,lođa ,,,,,,,,,,,
704,https://www.4zida.rs/prodaja-stanova/telep-gradske-lokacije-novi-sad/cetvorosoban-stan/647de1ce42ea270ee0020e5f,"Prodaja stanova Telep, Gradske lokacije, Novi Sad - 4zida",2023-08-29,,,,,,,,,,,,,,,,,,,,,,,,,,,,,
705,https://www.4zida.rs/prodaja-stanova/bulevar-evrope-gradske-lokacije-novi-sad/dvosoban-stan/64edd3620225e929650f9343,"Dvosoban stan na prodaju, 747, 98.700€, 41m² - 4zida",2023-08-29,41 m² ,2 sobe ,etažno grejanje ,,,,,,72362 ,pre 9 sati ,98.700,747,"Bulevar Evrope, Gradske lokacije, Novi Sad",,,,,,Stan u zgradi ,,,,,,,,,,
706,https://www.4zida.rs/prodaja-stanova/stanoja-banusevca-palilula-gradske-lokacije-nis/cetvorosoban-stan/647de2f342ea270ee002193e,"Prodaja stanova Stanoja Banuševca, Palilula, Gradske lokacije, Niš - 4zida",2023-08-29,,,,,,,,,,,,,,,,,,,,,,,,,,,,,
707,https://www.4zida.rs/prodaja-stanova/vidikovacka-padina-vidikovac-rakovica-opstina-beograd/jednoiposoban-stan/64edd3e1fce17a88d208dd92,"Jednoiposoban stan na prodaju, Prvoboraca, 63.500€, 35m² - 4zida",2023-08-29,35 m² ,1.5 soba ,etažno grejanje ,renovirano ,2/4 sprata ,kupatilo ,namešteno ,,,pre 9 sati ,63.500,Prvoboraca,"Vidikovačka Padina, Vidikovac, Rakovica opština, Beograd",uknjiženo ,,,,terasa ,Stan u zgradi ,,useljivo ,,,,,,,,
708,https://www.4zida.rs/prodaja-stanova/vozdovacka-crkva-vozdovac-opstina-beograd/cetvorosoban-stan/647de02542ea270ee002079d,"Prodaja stanova Voždovačka crkva, Voždovac opština, Beograd - 4zida",2023-08-29,,,,,,,,,,,,,,,,,,,,,,,,,,,,,
709,https://www.4zida.rs/prodaja-stanova/sajmiste-gradske-lokacije-novi-sad/troiposoban-stan/647de23a42ea270ee002121f,"Prodaja stanova Sajmište, Gradske lokacije, Novi Sad - 4zida",2023-08-29,,,,,,,,,,,,,,,,,,,,,,,,,,,,,
710,https://www.4zida.rs/prodaja-stanova/zarkovo-cukarica-cukarica-opstina-beograd/garsonjera/64e5d94f3279c775e909c784,"Garsonjera na prodaju, Milana Delića, 47.000€, 28m² - 4zida",2023-08-29,28 m² ,0.5 soba ,grejanje na struju ,potrebno renoviranje ,1/1 sprat ,,prazno ,,,pre 5 dana ,47.000,Milana Delića,"Žarkovo, Čukarica, Čukarica opština, Beograd",uknjiženo ,,,,"podrum, terasa ",Stan u zgradi ,,useljivo ,,,,,,,,
711,https://www.4zida.rs/prodaja-stanova/zemun-centar-zemun-zemun-opstina-beograd/dvosoban-stan/64eca9fae2e89301bb04a3b0,"Dvosoban stan na prodaju, Banatska, 160.450€, 64m² - 4zida",2023-08-29,64 m² ,2 sobe ,centralno grejanje ,novo ,6/6 spratova ,kupatilo ,prazno ,telefon ,2869 ,pre 1 dan ,160.450,Banatska,"Zemun - Centar, Zemun, Zemun opština, Beograd",,,,,,,,,,,,,,,,
712,https://www.4zida.rs/prodaja-stanova/kalenic-vracar-beograd/petosoban-stan/64e0eae06c305c491301b0f4,"Petosoban stan na prodaju, Ljubostinjska, 620.000€, 221m² - 4zida",2023-08-29,221 m² ,5 soba ,etažno grejanje ,novo ,3/4 sprata ,,,klima ,36191 ,pre 7 dana ,620.000,Ljubostinjska,"Kalenić, Vračar, Beograd",uknjiženo ,2006,ima lift (1) ,,terasa ,Stan u zgradi ,1 garažno mesto ,useljivo ,,,,,,,,
713,https://www.4zida.rs/prodaja-stanova/nova-detelinara-detelinara-gradske-lokacije-novi-sad/garsonjera/64e374620556bd24210ae44f,"Garsonjera na prodaju, Nova Detelinara, 65.800€, 24m² - 4zida",2023-08-29,24 m² ,0.5 soba ,centralno grejanje ,uobičajeno stanje ,4/5 spratova ,,namešteno ,klima ,44143 ,pre 8 dana ,65.800,Nova Detelinara,"Nova Detelinara, Detelinara, Gradske lokacije, Novi Sad",uknjiženo ,,ima lift (1) ,,terasa ,,,useljivo ,,,,,,,,
714,https://www.4zida.rs/prodaja-stanova/blok-64-bezanijski-blokovi-novi-beograd-beograd/troiposoban-stan/64db6946248c921ae500c514,"Prodaja stanova Blok 64, Bežanijski Blokovi, Novi Beograd, Beograd - 4zida",2023-08-29,,,,,,,,,,,,,,,,,,,,,,,,,,,,,
715,https://www.4zida.rs/prodaja-stanova/kaludjerica-grocka-opstina-beograd/dvoiposoban-stan/64c9075af890722c4a082c0b,"Dvoiposoban stan na prodaju, Vojvode Stepe Stepanovića, 78.000€, 52m² - 4zida",2023-08-29,52 m² ,2.5 soba ,etažno grejanje ,novo ,2/3 sprata ,kupatilo ,prazno ,telefon ,18627 ,pre 13 dana ,78.000,Vojvode Stepe Stepanovića,"Kaluđerica, Grocka opština, Beograd",,2023,ima lift (1) ,,terasa ,,1 garažno mesto ,,,,,,,,,
716,https://www.4zida.rs/prodaja-stanova/senjak-savski-venac-beograd/cetvorosoban-stan/649019971742e6a501076790,"Prodaja stanova Senjak, Savski Venac, Beograd - 4zida",2023-08-29,,,,,,,,,,,,,,,,,,,,,,,,,,,,,
717,https://www.4zida.rs/prodaja-stanova/zeleznicka-stanica-banatic-gradske-lokacije-novi-sad/garsonjera/64e390dfe218cd0b240b8e39,"Garsonjera na prodaju, Železnička stanica, 65.780€, 32m² - 4zida",2023-08-29,32 m² ,0.5 soba ,centralno grejanje ,,5/5 spratova ,,,,515751 ,pre 8 dana ,65.780,Železnička stanica,"Železnička stanica, Banatić, Gradske lokacije, Novi Sad",uknjiženo ,,,,,Stan u zgradi ,,,,,,,,,,
718,https://www.4zida.rs/prodaja-stanova/blok-64-bezanijski-blokovi-novi-beograd-beograd/dvosoban-stan/64e8a750106ec264f9000e42,"Dvosoban stan na prodaju, Gandijeva, 147.500€, 66m² - 4zida",2023-08-29,66 m² ,2 sobe ,,,9/10 spratova ,,,,7614 ,pre 4 dana ,147.500,Gandijeva,"Blok 64, Bežanijski Blokovi, Novi Beograd, Beograd",uknjiženo ,,,,terasa ,Stan u zgradi ,,,,,,,,,,
719,https://www.4zida.rs/prodaja-stanova/lipov-gaj-adice-gradske-lokacije-novi-sad/jednosoban-stan/64ecd5ea20e38ba7ac07cb99,"Jednosoban stan na prodaju, 657, 35.000€, 21m² - 4zida",2023-08-29,21 m² ,1 soba ,etažno grejanje ,,,,,,72351 ,pre 1 dan ,35.000,657,"Lipov Gaj, Adice, Gradske lokacije, Novi Sad",,,,,,Stan u zgradi ,,,,,,,,,,
720,https://www.4zida.rs/prodaja-stanova/vojvode-vlahovica-vozdovac-opstina-beograd/trosoban-stan/64e4eae89a9bf56b8902102f,"Trosoban stan na prodaju, Predraga Tomića, 117.000€, 51m² - 4zida",2023-08-29,51 m² ,3 sobe ,grejanje na gas ,u izgradnji ,2/3 sprata ,kupatilo ,prazno ,telefon ,,pre 7 dana ,117.000,Predraga Tomića,"Vojvode Vlahovića, Voždovac opština, Beograd",nije uknjiženo ,,,1 parking mesto ,terasa ,Stan u zgradi ,,,,,,,,,,
721,https://www.4zida.rs/prodaja-stanova/novi-sad-centar-stari-grad-gradske-lokacije-novi-sad/trosoban-stan/64ed46e8baefa02f930ea38d,"Trosoban stan na prodaju, Novi Sad - Centar, 170.980€, 70m² - 4zida",2023-08-29,70 m² ,3 sobe ,,u izgradnji ,3/6 spratova ,,,,1096475 ,pre 19 sati ,170.980,Novi Sad - Centar,"Novi Sad - Centar, Stari Grad, Gradske lokacije, Novi Sad",uknjiženo ,2004,ima lift (1) ,,terasa ,Stan u zgradi ,,,,,,,,,,
722,https://www.4zida.rs/prodaja-stanova/zelengora-gradske-lokacije-kraljevo/dvosoban-stan/64ede31b9549bbad270a82bc,"Dvosoban stan na prodaju, zelengora, 68.000€, 57m² - 4zida",2023-08-29,57 m² ,2 sobe ,centralno grejanje ,uobičajeno stanje ,3/4 sprata ,,,,,pre 8 sati ,68.000,zelengora,"Zelengora, Gradske lokacije, Kraljevo",uknjiženo ,,,,,Stan u zgradi ,,useljivo ,,,,,,,,
723,https://www.4zida.rs/prodaja-stanova/vracar-beograd/jednosoban-stan/64e8e3053578792528036e29,"Jednosoban stan na prodaju, Nebojšina, 99.900€, 29m² - 4zida",2023-08-29,29 m² ,1 soba ,centralno grejanje ,renovirano ,3/3 sprata ,,,,8922 ,pre 4 dana ,99.900,Nebojšina,"Vračar, Beograd",uknjiženo ,,,,,,,useljivo ,,,,,,,,
724,https://www.4zida.rs/prodaja-stanova/zemun-centar-zemun-zemun-opstina-beograd/dvosoban-stan/64eca9f9e2e89301bb04a380,"Dvosoban stan na prodaju, Banatska, 164.400€, 65m² - 4zida",2023-08-29,65 m² ,2 sobe ,centralno grejanje ,novo ,2/6 spratova ,kupatilo ,prazno ,telefon ,2885 ,pre 1 dan ,164.400,Banatska,"Zemun - Centar, Zemun, Zemun opština, Beograd",,,,,,,,,,,,,,,,
725,https://www.4zida.rs/prodaja-stanova/vojvode-vlahovica-vozdovac-opstina-beograd/jednosoban-stan/64edce1a3c0ffbedd4089334,"Jednosoban stan na prodaju, Predraga Simiča 10, 70.000€, 34m² - 4zida",2023-08-29,34 m² ,1 soba ,norveški radijatori ,novo ,prizemlje/4 sprata ,"kupatilo, toalet, kuhinja ",namešteno ,"telefon, kablovska, TV, klima, ventilacija, veš mašina, kuhinjski elementi, frižider, ležaj ",,pre 9 sati ,70.000,Predraga Simiča 10,"Vojvode Vlahovića, Voždovac opština, Beograd",uknjiženo ,2010,,,,Stan u zgradi ,4 garažna mesta ,useljivo ,,"26, 50 ",Optički ,,dvorište ,,,
726,https://www.4zida.rs/prodaja-stanova/centar-gradske-lokacije-zlatibor/dvosoban-stan/647de20042ea270ee00210fc,"Prodaja stanova Centar, Gradske lokacije, Zlatibor - 4zida",2023-08-29,,,,,,,,,,,,,,,,,,,,,,,,,,,,,
727,https://www.4zida.rs/prodaja-stanova/centar-medijana-gradske-lokacije-nis/dvosoban-stan/646cb06d7f7461a87c0ef6d5,"Dvosoban stan na prodaju, Centar, 115.000€, 71m² - 4zida",2023-08-29,71 m² ,2 sobe ,centralno grejanje ,uobičajeno stanje ,2. sprat ,kupatilo ,prazno ,telefon ,1886 ,pre 3 meseca ,115.000,Centar,"Centar, Medijana, Gradske lokacije, Niš",uknjiženo ,,,,,,,useljivo ,,,,,,,,
728,https://www.4zida.rs/prodaja-stanova/blok-61-bezanijski-blokovi-novi-beograd-beograd/trosoban-stan/64db8670a2f609c4310abd15,"Trosoban stan na prodaju, Jurija Gagarina, 164.300€, 76m² - 4zida",2023-08-29,76 m² ,3 sobe ,centralno grejanje ,,1. sprat ,,,,81697 ,pre 7 dana ,164.300,Jurija Gagarina,"Blok 61, Bežanijski Blokovi, Novi Beograd, Beograd",uknjiženo ,,ima lift (1) ,,terasa ,Stan u zgradi ,,useljivo ,,,,,,,,
729,https://www.4zida.rs/prodaja-stanova/sneznik-gradske-lokacije-vrnjacka-banja/jednosoban-stan/64e5fc6827da19dbce021125,"Jednosoban stan na prodaju, Snežnik, 59.692€, 34m² - 4zida",2023-08-29,34 m² ,1 soba ,grejanje na struju ,u izgradnji ,,,,,,pre 6 dana ,59.692,Snežnik,"Snežnik, Gradske lokacije, Vrnjačka Banja",u procesu uknjižavanja ,,ima lift (1) ,,,Stan u zgradi ,,,,,,,,,,
730,https://www.4zida.rs/prodaja-stanova/salajka-gradske-lokacije-novi-sad/cetvorosoban-stan/647de1cf42ea270ee0020e72,"Prodaja stanova Salajka, Gradske lokacije, Novi Sad - 4zida",2023-08-29,,,,,,,,,,,,,,,,,,,,,,,,,,,,,
731,https://www.4zida.rs/prodaja-stanova/vojvode-stepe-vozdovac-opstina-beograd/dvosoban-stan/647de2ea42ea270ee00218b4,"Prodaja stanova Vojvode Stepe, Voždovac opština, Beograd - 4zida",2023-08-29,,,,,,,,,,,,,,,,,,,,,,,,,,,,,
732,https://www.4zida.rs/prodaja-stanova/centar-gradske-lokacije-pancevo/troiposoban-stan/649addde6904f1dc5f0a78f3,"Prodaja stanova Centar, Gradske lokacije, Pančevo - 4zida",2023-08-29,,,,,,,,,,,,,,,,,,,,,,,,,,,,,
733,https://www.4zida.rs/prodaja-stanova/blok-64-bezanijski-blokovi-novi-beograd-beograd/cetvoroiposoban-stan/64db6944248c921ae500c506,"Prodaja stanova Blok 64, Bežanijski Blokovi, Novi Beograd, Beograd - 4zida",2023-08-29,,,,,,,,,,,,,,,,,,,,,,,,,,,,,
734,https://www.4zida.rs/prodaja-stanova/kraljevi-cardaci-okolne-lokacije-kopaonik/dvosoban-stan/64e4cca718e274d84f0ed2f6,"Dvosoban stan na prodaju, Jolly Kop, Vikend naselje, 85.000€, 40m² - 4zida",2023-08-29,40 m² ,2 sobe ,grejanje na struju ,novo ,1/4 sprata ,"kupatilo, kuhinja ",,"TV, ventilacija, veš mašina, kuhinjski elementi, frižider, rerna, ležaj, plakar ",,pre 7 dana ,85.000,"Jolly Kop, Vikend naselje","Kraljevi Čardaci, Okolne lokacije, Kopaonik",uknjiženo ,2020,,,"dvorište, terasa, recepcija ",Apartman ,,useljivo ,,,Kablovska ,,dvorište ,,,
735,https://www.4zida.rs/prodaja-stanova/liman-4-liman-gradske-lokacije-novi-sad/trosoban-stan/64e611543237ce243206171f,"Trosoban stan na prodaju, Liman 4, 143.220€, 79m² - 4zida",2023-08-29,79 m² ,3 sobe ,centralno grejanje ,,1/6 spratova ,"kupatilo, toalet, ostava ",,,515877 ,pre 6 dana ,143.220,Liman 4,"Liman 4, Liman, Gradske lokacije, Novi Sad",uknjiženo ,,ima lift (1) ,,"podrum, terase (2) ",Stan u zgradi ,,,,4.7.9.13 ,,,,,,
736,https://www.4zida.rs/prodaja-stanova/barajevo-barajevo-opstina-beograd/jednosoban-stan/64e5f9aca150d7877502048b,"Jednosoban stan na prodaju, 20. oktobra, 27.750€, 25m² - 4zida",2023-08-29,25 m² ,1 soba ,centralno grejanje ,uobičajeno stanje ,prizemlje/5 spratova ,,,,8905 ,pre 6 dana ,27.750,20. oktobra,"Barajevo, Barajevo opština, Beograd",uknjiženo ,,,,,,,useljivo ,,,,,,,,
737,https://www.4zida.rs/prodaja-stanova/kertvaros-gradske-lokacije-subotica/trosoban-stan/64edc218dd508318cf0e7f74,"Prodaja stanova Kertvaroš, Gradske lokacije, Subotica - 4zida",2023-08-29,,,,,,,,,,,,,,,,,,,,,,,,,,,,,
738,https://www.4zida.rs/prodaja-stanova/blok-65-west-65-novi-beograd-beograd/trosoban-stan/64e5d5df5fc46c131405c72f,"Trosoban stan na prodaju, Omladinskih brigada, 401.700€, 78m² - 4zida",2023-08-29,78 m² ,3 sobe ,centralno grejanje ,novo ,9/29 spratova ,"kupatilo, toalet ",prazno ,,,pre 6 dana ,401.700,Omladinskih brigada,"Blok 65 - WEST 65, Novi Beograd, Beograd",uknjiženo ,,ima lift (2) ,,,Stan u zgradi ,2 garažna mesta ,,,,,,,,,
739,https://www.4zida.rs/prodaja-stanova/centar-gradske-lokacije-pancevo/jednoiposoban-stan/647de1e842ea270ee0020f75,"Prodaja stanova Centar, Gradske lokacije, Pančevo - 4zida",2023-08-29,,,,,,,,,,,,,,,,,,,,,,,,,,,,,
740,https://www.4zida.rs/prodaja-stanova/crveni-krst-vracar-vracar-beograd/dvosoban-stan/647de2c042ea270ee0021656,"Prodaja stanova Crveni Krst Vračar, Vračar, Beograd - 4zida",2023-08-29,,,,,,,,,,,,,,,,,,,,,,,,,,,,,
741,https://www.4zida.rs/prodaja-stanova/blok-64-bezanijski-blokovi-novi-beograd-beograd/dvoiposoban-stan/64db5b3d4afa93e86a052fad,"Prodaja stanova Blok 64, Bežanijski Blokovi, Novi Beograd, Beograd - 4zida",2023-08-29,,,,,,,,,,,,,,,,,,,,,,,,,,,,,
742,https://www.4zida.rs/prodaja-stanova/pivara-gradske-lokacije-jagodina/jednoiposoban-stan/64e74b9b34d261852f0c86b7,"Jednoiposoban stan na prodaju, Pivara, 50.000€, 50m² - 4zida",2023-08-29,50 m² ,1.5 soba ,,,2/3 sprata ,,namešteno ,,7244 ,pre 5 dana ,50.000,Pivara,"Pivara, Gradske lokacije, Jagodina",,,,,,Stan u zgradi ,,,,,,,,,,
743,https://www.4zida.rs/prodaja-stanova/cvetanova-cuprija-zvezdara-opstina-beograd/jednoiposoban-stan/64ee37073d7da1e92d0bd783,"Jednoiposoban stan na prodaju, Ristin Potok, 83.000€, 39m² - 4zida",2023-08-29,39 m² ,1.5 soba ,etažno grejanje ,,3/3 sprata ,kupatilo ,prazno ,telefon ,125402 ,pre 2 sata ,83.000,Ristin Potok,"Cvetanova Ćuprija, Zvezdara opština, Beograd",uknjiženo ,,,1 parking mesto ,terasa ,,,,,,,,,,,
744,https://www.4zida.rs/prodaja-stanova/somborska-pantelej-gradske-lokacije-nis/troiposoban-stan/64c0fd4ba4ac4baf740f87a9,"Prodaja stanova Somborska, Pantelej, Gradske lokacije, Niš - 4zida",2023-08-29,,,,,,,,,,,,,,,,,,,,,,,,,,,,,
745,https://www.4zida.rs/prodaja-stanova/blok-64-bezanijski-blokovi-novi-beograd-beograd/dvoiposoban-stan/64db5b2c4afa93e86a052f21,"Prodaja stanova Blok 64, Bežanijski Blokovi, Novi Beograd, Beograd - 4zida",2023-08-29,,,,,,,,,,,,,,,,,,,,,,,,,,,,,
746,https://www.4zida.rs/prodaja-stanova/novo-naselje-gradske-lokacije-novi-sad/dvosoban-stan/64bfba3a38640c411c05122c,"Dvosoban stan na prodaju, Novo Naselje, 87.650€, 46m² - 4zida",2023-08-29,46 m² ,2 sobe ,,novo ,2/2 sprata ,kupatilo ,prazno ,"telefon, kablovska, klima ",514782 ,pre 13 dana ,87.650,Novo Naselje,"Novo Naselje, Gradske lokacije, Novi Sad",uknjiženo ,,,1 parking mesto ,terasa ,Stan u zgradi ,,useljivo ,,,,,,,,
747,https://www.4zida.rs/prodaja-stanova/juzni-bulevar-vracar-beograd/dvoiposoban-stan/64e4a4c804e13de7060543dc,"Dvoiposoban stan na prodaju, Šumatovačka, 225.280€, 64m² - 4zida",2023-08-29,64 m² ,2.5 soba ,centralno grejanje ,novo ,3/4 sprata ,kupatilo ,prazno ,"telefon, kablovska, internet, interfon ",8816 ,pre 7 dana ,225.280,Šumatovačka,"Južni Bulevar, Vračar, Beograd",,,ima lift (1) ,,terasa ,,,,,,,,,,,
748,https://www.4zida.rs/prodaja-stanova/zemun-centar-zemun-zemun-opstina-beograd/trosoban-stan/64eca9f8e2e89301bb04a368,"Trosoban stan na prodaju, Banatska, 214.550€, 87m² - 4zida",2023-08-29,87 m² ,3 sobe ,centralno grejanje ,novo ,5/6 spratova ,kupatilo ,prazno ,telefon ,2893 ,pre 1 dan ,214.550,Banatska,"Zemun - Centar, Zemun, Zemun opština, Beograd",,,,,,,,,,,,,,,,
749,https://www.4zida.rs/prodaja-stanova/pijaca-palilula-palilula-gradske-lokacije-nis/dvoiposoban-stan/647de2e642ea270ee002186f,"Prodaja stanova Pijaca Palilula, Palilula, Gradske lokacije, Niš - 4zida",2023-08-29,,,,,,,,,,,,,,,,,,,,,,,,,,,,,
750,https://www.4zida.rs/prodaja-stanova/centar-2-gradske-lokacije-subotica/trosoban-stan/64e5cae37f1b6cf499022382,"Trosoban stan na prodaju, Šandora Petefija, 190.000€, 87m² - 4zida",2023-08-29,87 m² ,3 sobe ,centralno grejanje ,novo ,1/5 spratova ,"kupatila (2), toaleti (2), kuhinja ",namešteno ,"TV, klima, veš mašina, kuhinjski elementi, sudo mašina, frižider, zamrzivač, rerna, šporet, ležaj, plakar ",,pre 6 dana ,190.000,Šandora Petefija,"Centar 2, Gradske lokacije, Subotica",uknjiženo ,2020,ima lift (1) ,,"dvorište, terasa ",Stan u zgradi ,,useljivo ,,,,,dvorište ,,,
751,https://www.4zida.rs/prodaja-stanova/bubanj-palilula-gradske-lokacije-nis/trosoban-stan/6480475b0dc622074301e023,"Prodaja stanova Bubanj, Palilula, Gradske lokacije, Niš - 4zida",2023-08-29,,,,,,,,,,,,,,,,,,,,,,,,,,,,,
752,https://www.4zida.rs/prodaja-stanova/brace-jerkovic-vozdovac-opstina-beograd/dvoiposoban-stan/64e37d83be56d617c10ed436,"Dvoiposoban stan na prodaju, Braće Jerković, 149.500€, 61m² - 4zida",2023-08-29,61 m² ,2.5 soba ,centralno grejanje ,,8/11 spratova ,,,telefon ,85771 ,pre 7 dana ,149.500,Braće Jerković,"Braće Jerković, Voždovac opština, Beograd",uknjiženo ,,ima lift (1) ,,"podrum, terasa ",Stan u zgradi ,,useljivo ,,,,,,,,
753,https://www.4zida.rs/prodaja-stanova/telep-gradske-lokacije-novi-sad/dvoiposoban-stan/647de29f42ea270ee00214a8,"Prodaja stanova Telep, Gradske lokacije, Novi Sad - 4zida",2023-08-29,,,,,,,,,,,,,,,,,,,,,,,,,,,,,
754,https://www.4zida.rs/prodaja-stanova/cara-dusana-adamovicevo-naselje-gradske-lokacije-novi-sad/petosoban-stan/64ec7dfec8bf8e246706ba90,"Petosoban stan na prodaju, Cara Dušana, 451.530€, 219m² - 4zida",2023-08-29,219 m² ,5 soba ,grejanje na gas ,luksuzno ,2/2 sprata ,kupatila (3,namešteno ,"kablovska, klima ",,pre 1 dan ,451.530,Cara Dušana,"Cara Dušana, Adamovićevo Naselje, Gradske lokacije, Novi Sad",uknjiženo ,,ima lift (1) ,1 parking mesto ,"prilaz za invalide, terasa, lođa ",Stan u zgradi ,,useljivo ,,,,,,,,
755,https://www.4zida.rs/prodaja-stanova/stari-majur-majur-petrovaradin-gradske-lokacije-novi-sad/dvoiposoban-stan/64e34a284c66f4ceb7062af2,"Dvoiposoban stan na prodaju, Stari majur, 126.430€, 65m² - 4zida",2023-08-29,65 m² ,2.5 soba ,grejanje na gas ,u izgradnji ,4/5 spratova ,kupatilo ,,,513647 ,pre 8 dana ,126.430,Stari majur,"Stari Majur, Majur, Petrovaradin, Gradske lokacije, Novi Sad",nije uknjiženo ,,ima lift (1) ,,terasa ,Stan u zgradi ,,,,,,30.05.2025 ,,,,
756,https://www.4zida.rs/prodaja-stanova/pantelej-gradske-lokacije-nis/jednoiposoban-stan/64e373520556bd24210ae360,"Jednoiposoban stan na prodaju, Pantelej, 53.100€, 41m² - 4zida",2023-08-29,41 m² ,1.5 soba ,centralno grejanje ,renovirano ,1/9 spratova ,,namešteno ,"kablovska, internet, klima ",10049 ,pre 7 dana ,53.100,Pantelej,"Pantelej, Gradske lokacije, Niš",uknjiženo ,,,,,,,useljivo ,,,,,,,,
757,https://www.4zida.rs/prodaja-stanova/lion-zvezdara-opstina-beograd/petosoban-stan/64ec7307b0f264ba2a0a5f55,"Petosoban stan na prodaju, Silvija Kranjčevića, 598.000€, 172m² - 4zida",2023-08-29,172 m² ,5 soba ,centralno grejanje ,uobičajeno stanje ,1/2 sprata ,kupatila (3,polunamešteno ,"telefon, interfon, klima ",5956 ,pre 10 sati ,598.000,Silvija Kranjčevića,"Lion, Zvezdara opština, Beograd",uknjiženo ,1938,,,podrum ,,1 garažno mesto ,,,,,,,,,
758,https://www.4zida.rs/prodaja-stanova/somborska-pantelej-gradske-lokacije-nis/dvosoban-stan/64c0fd4ba4ac4baf740f87a3,"Prodaja stanova Somborska, Pantelej, Gradske lokacije, Niš - 4zida",2023-08-29,,,,,,,,,,,,,,,,,,,,,,,,,,,,,
759,https://www.4zida.rs/prodaja-stanova/banjica-vozdovac-opstina-beograd/trosoban-stan/647de24142ea270ee002126a,"Prodaja stanova Banjica, Voždovac opština, Beograd - 4zida",2023-08-29,,,,,,,,,,,,,,,,,,,,,,,,,,,,,
760,https://www.4zida.rs/prodaja-stanova/centar-gradske-lokacije-zlatibor/dvosoban-stan/647de0c242ea270ee0020d3e,"Prodaja stanova Centar, Gradske lokacije, Zlatibor - 4zida",2023-08-29,,,,,,,,,,,,,,,,,,,,,,,,,,,,,
761,https://www.4zida.rs/prodaja-stanova/popovica-sremska-kamenica-gradske-lokacije-novi-sad/dvosoban-stan/64ec8b07f7431a071700132f,"Dvosoban stan na prodaju, sremska kamenica, 101.560€, 58m² - 4zida",2023-08-29,58 m² ,2 sobe ,grejanje na gas ,novo ,visoko prizemlje/3 sprata ,kupatilo ,prazno ,,514917 ,pre 1 dan ,101.560,sremska kamenica,"Popovica, Sremska Kamenica, Gradske lokacije, Novi Sad",uknjiženo ,,,,terasa ,Stan u zgradi ,,,,,,,,,,
762,https://www.4zida.rs/prodaja-stanova/nova-detelinara-detelinara-gradske-lokacije-novi-sad/troiposoban-stan/64e5cceff15da1cde0079520,"Troiposoban stan na prodaju, Nova Detelinara, 190.000€, 91m² - 4zida",2023-08-29,91 m² ,3.5 soba ,centralno grejanje ,novo ,4/5 spratova ,,prazno ,"kablovska, internet, interfon, klima ",1624 ,pre 6 dana ,190.000,Nova Detelinara,"Nova Detelinara, Detelinara, Gradske lokacije, Novi Sad",uknjiženo ,,ima lift (1) ,1 parking mesto ,terasa ,Stan u zgradi ,,,,,,,,,,
763,https://www.4zida.rs/prodaja-stanova/gradske-lokacije-ruma/dvoiposoban-stan/64ecf5873cc3178f14040917,"Dvoiposoban stan na prodaju, 15. Avgusta, 68.000€, 55m² - 4zida",2023-08-29,55 m² ,2.5 soba ,centralno grejanje ,novo ,1/6 spratova ,,prazno ,,,pre 11 sati ,68.000,15. Avgusta,"Gradske lokacije, Ruma",uknjiženo ,2020,ima lift (1) ,,terasa ,Stan u zgradi ,,useljivo ,zapad ,,,,dvorište ,,,
764,https://www.4zida.rs/prodaja-stanova/nova-detelinara-detelinara-gradske-lokacije-novi-sad/dvosoban-stan/64e73a5e1cd2f60ab8091357,"Dvosoban stan na prodaju, Nova Detelinara, 107.120€, 47m² - 4zida",2023-08-29,47 m² ,2 sobe ,,uobičajeno stanje ,3/5 spratova ,,,,1059533 ,pre 5 dana ,107.120,Nova Detelinara,"Nova Detelinara, Detelinara, Gradske lokacije, Novi Sad",uknjiženo ,2006,ima lift (1) ,,terasa ,Stan u zgradi ,,,,,,,,,,
765,https://www.4zida.rs/prodaja-stanova/riblja-pijaca-stari-grad-gradske-lokacije-novi-sad/jednoiposoban-stan/64ecab8ce2e89301bb04a4ae,"Jednoiposoban stan na prodaju, Riblja Pijaca, 119.500€, 37m² - 4zida",2023-08-29,37 m² ,1.5 soba ,centralno grejanje ,,visoko prizemlje/5 spratova ,,,,1047325 ,pre 1 dan ,119.500,Riblja Pijaca,"Riblja Pijaca, Stari Grad, Gradske lokacije, Novi Sad",,1970,ima lift (1) ,,,,,,,,,,,,,
766,https://www.4zida.rs/prodaja-stanova/sajmiste-gradske-lokacije-novi-sad/dvosoban-stan/647de23a42ea270ee0021225,"Prodaja stanova Sajmište, Gradske lokacije, Novi Sad - 4zida",2023-08-29,,,,,,,,,,,,,,,,,,,,,,,,,,,,,
767,https://www.4zida.rs/prodaja-stanova/vasariste-gradske-lokacije-kragujevac/dvosoban-stan/64e86a54600f1ca5d40db5b1,"Dvosoban stan na prodaju, Vašarište, 56.000€, 41m² - 4zida",2023-08-29,41 m² ,2 sobe ,grejanje na gas ,,1/3 sprata ,kupatilo ,prazno ,klima ,,pre 4 dana ,56.000,Vašarište,"Vašarište, Gradske lokacije, Kragujevac",uknjiženo ,,,1 parking mesto ,terasa ,Stan u zgradi ,,useljivo ,,,,,,,,
768,https://www.4zida.rs/prodaja-stanova/podbara-gradske-lokacije-novi-sad/dvosoban-stan/647de23442ea270ee00211e2,"Prodaja stanova Podbara, Gradske lokacije, Novi Sad - 4zida",2023-08-29,,,,,,,,,,,,,,,,,,,,,,,,,,,,,
769,https://www.4zida.rs/prodaja-stanova/cvetanova-cuprija-zvezdara-opstina-beograd/jednoiposoban-stan/64e87e58385a7e321a06d54b,"Jednoiposoban stan na prodaju, Generala Božidara Jankovića, 64.000€, 30m² - 4zida",2023-08-29,30 m² ,1.5 soba ,etažno grejanje ,novo ,4/4 sprata ,kupatilo ,namešteno ,"telefon, internet, interfon ",5950 ,pre 4 dana ,64.000,Generala Božidara Jankovića,"Cvetanova Ćuprija, Zvezdara opština, Beograd",uknjiženo ,2020,ima lift (1) ,,lođa ,,,,,,,,,,,
