,link,Površina,Broj soba,Uknjiženost,Grejanje,Spratnost,Nameštenost,Šifra oglasa,Oglas ažuriran,price,street,address,description,title,end_date,Tip,Stanje,Lift,Garaža,Parking,Infrastruktura,Opremljenost,Useljivo,Unutrašnje prostorije,Internet,Godina izgradnje,Orijentacija nekretnine,Pogled na,Autobuske linije,Tramvajske linije,Trolejbuske linije,Useljivo od
255,https://www.4zida.rs/prodaja-stanova/telep-gradske-lokacije-novi-sad/jednoiposoban-stan/65b3783208d8214cac029bc0,37 m² ,1.5 soba ,,etažno grejanje ,visoko prizemlje/3 sprata ,prazno ,2280 ,pre 3 sata ,89.500,Telep,"Telep, Gradske lokacije, Novi Sad","<h2 _ngcontent-ng-c3151048826 class=""mat-headline-5"">Opis oglasa</h2><div _ngcontent-ng-c3151048826 class=""prose max-h-64 overflow-hidden text-gray-800 ng-star-inserted""><p>Prodajemo 1.5 stan u NOVOM SADU, TELEP površine 37m2. Stan je u izgradnji. Cena stana sa PDV-om. Mirna ulica u blizini Limana 4. Kvalitetna gradnja. Izuzetno funkcionalan stan. Pozovite da pogledate.","Jednoiposoban stan na prodaju, Telep, 89.500€, 37m² - 4zida",2024-01-26,Stan u zgradi ,u izgradnji ,,,,terasa ,"kablovska, internet, interfon ",,,,,,,,,,
256,https://www.4zida.rs/prodaja-stanova/novi-sad-centar-stari-grad-gradske-lokacije-novi-sad/dvosoban-stan/65b27acadbedc2afcf0c6366,51 m² ,2 sobe ,uknjiženo ,centralno grejanje ,7/11 spratova ,,s,pre 21 sati ,189.520,Radnička,"Novi Sad - Centar, Stari Grad, Gradske lokacije, Novi Sad","<h2 _ngcontent-ng-c3151048826 class=""mat-headline-5"">Opis oglasa</h2><div _ngcontent-ng-c3151048826 class=""prose max-h-64 overflow-hidden text-gray-800 ng-star-inserted""><p>🌟 <strong>Luksuzan Stan u Novom Sadu - Uskoro Useljenje! 🏡</strong>","Dvosoban stan na prodaju, Radnička, 189.520€, 51m² - 4zida",2024-01-26,Stan u zgradi ,novo ,ima lift (1) ,,,"prilaz za invalide, dvorište, alarm, terasa, fitnes, recepcija ",,,kupatilo ,,,,,,,,
257,https://www.4zida.rs/prodaja-stanova/altina-zemun-zemun-opstina-beograd/dvosoban-stan/65b3a06aa791815a2204581c,53 m² ,2 sobe ,uknjiženo ,etažno grejanje ,2/4 sprata ,,77829 ,pre 47 minuta ,149.000,Ugrinovačka,"Altina, Zemun, Zemun opština, Beograd","<h2 _ngcontent-ng-c3151048826 class=""mat-headline-5"">Opis oglasa</h2><div _ngcontent-ng-c3151048826 class=""prose max-h-64 overflow-hidden text-gray-800 ng-star-inserted""><p>Komforan, svetao stan u zgradi novije gradnje, prodaje se namešten. Otvoren pogled sa terase, na samom ulazu u naselje Altina. Ispred zgrade su marketi, autobusko stajalište, trafike, menjačnice. Blizina autoputa za ZG, Pupinovog mosta ,Novosadskog autoputa kao i Zemuna. Odlična lokacija. Može kredit.<br>Agencijska provizija 2% 2/4 Ugrinovačka  -imamo slicne NEKRETNINE BEOGRAD https://www.gigant.rs/property-detail.php?id=77829","Dvosoban stan na prodaju, Ugrinovačka, 149.000€, 53m² - 4zida",2024-01-26,Stan u zgradi ,,,,,terasa ,,useljivo ,,,2017,,,,,,
258,https://www.4zida.rs/prodaja-stanova/gradske-lokacije-vrnjacka-banja/jednosoban-stan/65b26f4318dc8f6c8c097fef,41 m² ,1 soba ,uknjiženo ,grejanje na struju ,,namešteno ,,pre 22 sati ,83.000,Gradske lokacije,"Gradske lokacije, Vrnjačka Banja","<h2 _ngcontent-ng-c3151048826 class=""mat-headline-5"">Opis oglasa</h2><div _ngcontent-ng-c3151048826 class=""prose max-h-64 overflow-hidden text-gray-800 ng-star-inserted""><p>Na prodaju je prelep jednosoban stan idealno pozicioniran na I spratu zgrade koja se nalazi nedaleko od osnovne škole. Površina stana je 42m2, sastoji se iz dnevne sobe, kuhinje, spavace sobe, hodnika, kupatila i terase. Unutar stana ćete pronaći dobro osmišljen prostor sa svim neophodnim sadržajem.","Jednosoban stan na prodaju, Gradske lokacije, 83.000€, 41m² - 4zida",2024-01-26,Stan u zgradi ,,,,,terasa ,,,kupatilo ,,,,,,,,
259,https://www.4zida.rs/prodaja-stanova/adice-gradske-lokacije-novi-sad/jednoiposoban-stan/65b3603d62af072f11028622,42 m² ,1.5 soba ,,,2/2 sprata ,prazno ,1745 ,pre 5 sati ,71.400,Adice,"Adice, Gradske lokacije, Novi Sad","<h2 _ngcontent-ng-c3151048826 class=""mat-headline-5"">Opis oglasa</h2><div _ngcontent-ng-c3151048826 class=""prose max-h-64 overflow-hidden text-gray-800 ng-star-inserted""><p>Prodaje se jednoiposoban stan u urbanoj vili u izgradnji na Adicama..Useljenje u martu 2024.<br>Grejanje na toplotne pumpe.Pored ovog stana,na istom spratu su u ponudi još i dva jednoiposobna stana od 45m2 i 48m2.<br>U cenu je uračunat PDV,tako da je moguć odbitak ukoliko kupac ima pravo na to.<br>U sklopu zgrade se nalaze i garaže /16m2/ koje se prodaju po ceni od 8000 e,kao i parking mesta koja se prodaju po ceni od 2000 e.","Jednoiposoban stan na prodaju, Adice, 71.400€, 42m² - 4zida",2024-01-26,Stan u zgradi ,,,,,,,,,,,,,,,,
260,https://www.4zida.rs/prodaja-stanova/petrovaradin-gradske-lokacije-novi-sad/jednoiposoban-stan/65b20818f9c4915c1c0e3459,34 m² ,1.5 soba ,uknjiženo ,grejanje na gas ,prizemlje/2 sprata ,prazno ,1000034 ,pre 37 minuta ,44.300,Petrovaradin,"Petrovaradin, Gradske lokacije, Novi Sad","<h2 _ngcontent-ng-c3151048826 class=""mat-headline-5"">Opis oglasa</h2><div _ngcontent-ng-c3151048826 class=""prose max-h-64 overflow-hidden text-gray-800 ng-star-inserted""><p>Jednoiposoban stan sa terasom, u prizemlju zgrade. Zgrada se nalazi na veoma dobroj lokaciji, na par minuta hoda od glavne ulice u kojoj se nalaze svi sadržaji i gradski prevoz. Za više informacija pozvati 060/4717-520.","Jednoiposoban stan na prodaju, Petrovaradin, 44.300€, 34m² - 4zida",2024-01-26,Stan u zgradi ,uobičajeno stanje ,,,,"terasa, lođa ",,useljivo ,,,,,,,,,
261,https://www.4zida.rs/prodaja-stanova/blok-72-novi-beograd-beograd/jednoiposoban-stan/65b38c176f17bbf1530be23f,50 m² ,1.5 soba ,uknjiženo ,centralno grejanje ,5/7 spratova ,prazno ,1438 ,pre 2 sata ,127.000,Dr Ivana Ribara,"Blok 72, Novi Beograd, Beograd","<h2 _ngcontent-ng-c3151048826 class=""mat-headline-5"">Opis oglasa</h2><div _ngcontent-ng-c3151048826 class=""prose max-h-64 overflow-hidden text-gray-800 ng-star-inserted""><p>Jednoiposoban stan, na lepoj lokaciji na Novom Beogradu, u neposrednoj blizini svih infrastrukturnih objekata, neophodnih za kvalitetan život ( TC, pijaca, marketi, škola, obdanište). Održavan stan, sa većom spavaćom sobom koja je naknadno proširena, uknjižen na 50 m2 korisne, tj. 56 m2 građevinske površine. Uredna svojinska dokumentacija, uknjižen 1/1. Preporuka! ","Jednoiposoban stan na prodaju, Dr Ivana Ribara, 127.000€, 50m² - 4zida",2024-01-26,,renovirano ,ima lift (1) ,,,"podrum, lođa ","telefon, kablovska, internet, interfon, klima ",,kupatilo ,,,,,,,,
262,https://www.4zida.rs/prodaja-stanova/visnjicka-banja-palilula-opstina-beograd/jednoiposoban-stan/65b3a07ba791815a22045835,52 m² ,1.5 soba ,uknjiženo ,etažno grejanje ,2/3 sprata ,,86883 ,pre 47 minuta ,104.000,Mihaila Vujića,"Višnjička Banja, Palilula opština, Beograd","<h2 _ngcontent-ng-c3151048826 class=""mat-headline-5"">Opis oglasa</h2><div _ngcontent-ng-c3151048826 class=""prose max-h-64 overflow-hidden text-gray-800 ng-star-inserted""><p>Stvarna površina-52m2 , ugovorna površina-52.00m2,<br>Prodajemo uknjižen jednoiposoban stan u Višnjičkoj banji, na svega 15 minuta od centra Beograda. Nalazi se na drugom spratu trospratne zgrade, u mirnom i porodičnom kraju. Stan ima podno grejanje, dvostrano je orijentisan, prozračan i vrlo svetao, sa dobrim rasporedom.  Poseduje i 2 terase - moguće je jednu od njih zastakliti čime bi se dobila još jedna prostorija. Veća terasa ima izuzetno lep pogled na Dunav. Parking za stanare zgrade.","Jednoiposoban stan na prodaju, Mihaila Vujića, 104.000€, 52m² - 4zida",2024-01-26,Stan u zgradi ,,,,,terasa ,,useljivo ,,,2013,,,,,,
263,https://www.4zida.rs/prodaja-stanova/telep-gradske-lokacije-novi-sad/troiposoban-stan/65b386416f17bbf1530be150,73 m² ,3.5 soba ,,etažno grejanje ,1/3 sprata ,prazno ,2282 ,pre 2 sata ,169.700,Telep,"Telep, Gradske lokacije, Novi Sad","<h2 _ngcontent-ng-c3151048826 class=""mat-headline-5"">Opis oglasa</h2><div _ngcontent-ng-c3151048826 class=""prose max-h-64 overflow-hidden text-gray-800 ng-star-inserted""><p>Prodaje se 3.5 stan u NOVOM SADU, TELEP površine 73m2. Izuzetno funkcionalan, tri odvojene spavaće sobe, dva mokra čvora, komotan dnevni boravak sa izlazkom na prelepu terasu.. Cena sa PDV. Nadomak Limana 4. Vredi pogledati.","Troiposoban stan na prodaju, Telep, 169.700€, 73m² - 4zida",2024-01-26,Stan u zgradi ,u izgradnji ,ima lift (1) ,,,terasa ,"kablovska, internet, interfon ",,,,,,,,,,
264,https://www.4zida.rs/prodaja-stanova/grbavica-gradske-lokacije-novi-sad/trosoban-stan/65b37a974e8d7ff56807657c,72 m² ,3 sobe ,uknjiženo ,grejanje na gas ,3/4 sprata ,polunamešteno ,523184 ,pre 3 sata ,136.990,Grbavica,"Grbavica, Gradske lokacije, Novi Sad","<h2 _ngcontent-ng-c3151048826 class=""mat-headline-5"">Opis oglasa</h2><div _ngcontent-ng-c3151048826 class=""prose max-h-64 overflow-hidden text-gray-800 ng-star-inserted""><p>Trosoban stan na fenomenalnoj lokaciji! Mirna ulica, stan bez ulaganja, prodaje se sa većinom nameštaja. Preporuka!","Trosoban stan na prodaju, Grbavica, 136.990€, 72m² - 4zida",2024-01-26,Stan u zgradi ,,,,,terasa ,,useljivo ,"kupatilo, kuhinja, ostava ",,,,,,,,
265,https://www.4zida.rs/prodaja-stanova/bulevar-oslobodjenja-gradske-lokacije-novi-sad/dvoiposoban-stan/65b3932da791815a2204569e,54 m² ,2.5 soba ,uknjiženo ,,5/7 spratova ,,1060051 ,pre 1 sat ,111.240,Bulevar Oslobođenja,"Bulevar Oslobođenja, Gradske lokacije, Novi Sad","<h2 _ngcontent-ng-c3151048826 class=""mat-headline-5"">Opis oglasa</h2><div _ngcontent-ng-c3151048826 class=""prose max-h-64 overflow-hidden text-gray-800 ng-star-inserted""><p>RENOVIRAN, KOMPLET NAMEŠTEN SA BELOM TEHNIKOM U CENI+++  Agencijska oznaka-1060051Na prodaju RENOVIRAN dvoiposoban stan na bulevaru Kralja Petra. Stan se sastoji od prostranog dnevnog boravka sa kuhinjom i trpezarijom, dve spavaće sobe, kupatila i hodnika. Stan se prodaje KOMPLETNO NAMEŠTEN. Uknjižen 1/1, može se prometovati putem stambenog kredita. Centralno gradsko grejanje, lift. Dovoljno parking mesta u okruženju zgrade. Kontakt 0638901299 Nataša","Dvoiposoban stan na prodaju, Bulevar Oslobođenja, 111.240€, 54m² - 4zida",2024-01-26,Stan u zgradi ,uobičajeno stanje ,ima lift (1) ,,,,,,,,,,,,,,
266,https://www.4zida.rs/prodaja-stanova/telep-gradske-lokacije-novi-sad/dvoiposoban-stan/65b386416f17bbf1530be14c,56 m² ,2.5 soba ,,etažno grejanje ,visoko prizemlje/3 sprata ,prazno ,2283 ,pre 2 sata ,126.800,Telep,"Telep, Gradske lokacije, Novi Sad","<h2 _ngcontent-ng-c3151048826 class=""mat-headline-5"">Opis oglasa</h2><div _ngcontent-ng-c3151048826 class=""prose max-h-64 overflow-hidden text-gray-800 ng-star-inserted""><p>Prodaje se 2.5 stan u NOVOM SADU, TELEP površine 56m2. Stan je u izgradnji. Odličnog je rasporeda. Lokacija objekta u blizini Limana 4. Cena stana sa PDV-om. Vredi pogledati.","Dvoiposoban stan na prodaju, Telep, 126.800€, 56m² - 4zida",2024-01-26,Stan u zgradi ,u izgradnji ,,,,terasa ,"kablovska, internet, interfon ",,,,,,,,,,
267,https://www.4zida.rs/prodaja-stanova/cvijiceva-palilula-opstina-beograd/trosoban-stan/65b28b53cd8ad30c74059c82,66 m² ,3 sobe ,uknjiženo ,grejanje na struju ,2/5 spratova ,,9674 ,pre 18 sati ,199.000,Cvijićeva,"Cvijićeva, Palilula opština, Beograd","<h2 _ngcontent-ng-c3151048826 class=""mat-headline-5"">Opis oglasa</h2><div _ngcontent-ng-c3151048826 class=""prose max-h-64 overflow-hidden text-gray-800 ng-star-inserted""><p>Na prodaju uknjižen 3,0 stan, 66 m2 sa terasom, korisne površine 60 m2, na Paliluli, u Cvijićevoj ulici, u zgradi koja je uredno održavana sa liftom. Stan je dvostrano orijentisan, sunčan, sa kompletno renoviranim kupatilom. Postoji ograđeni parking koji koriste samo stanari zgrade, u dvorištu zgrade. Stanu pripada i podrumska prostorija. Ovaj stan je izuzetnog rasporeda, komforan je, i može da se pretvori u dobar stambeni prostor ili kao investicija. Prostorije: hodnik, dnevna soba, kuhinja, dve spavaće sobe, kupatilo, terasa Nalazi se u blizini svih potrebnih infrastruktura za udoban i miran život. Agencijska provizija 2%","Trosoban stan na prodaju, Cvijićeva, 199.000€, 66m² - 4zida",2024-01-26,,potrebno renoviranje ,ima lift (1) ,,,terasa ,,useljivo ,,,,,,,,,
268,https://www.4zida.rs/prodaja-stanova/telep-gradske-lokacije-novi-sad/trosoban-stan/65b27096e4d2e9c5e104bd2e,109 m² ,3 sobe ,,grejanje na gas ,2/2 sprata ,,1006731 ,pre 22 sati ,264.460,Telep,"Telep, Gradske lokacije, Novi Sad","<h2 _ngcontent-ng-c3151048826 class=""mat-headline-5"">Opis oglasa</h2><div _ngcontent-ng-c3151048826 class=""prose max-h-64 overflow-hidden text-gray-800 ng-star-inserted""><p>Agencijska šifra: 1006730Predstavljamo vam prostran trosoban stan smešten na drugom spratu urbane vile u mirnom i atraktivnom delu Telepa. Izgrađen od strane pouzdanog investitora, objekat pruža odličan kvalitet koji će zadovoljiti visoke standarde gradnje. Stan se sastoji od dnevnog boravka u čijem je sklopu trpezarija i kuhinja sa ostavom (50m2), 2 spavaće sobe, kupatila, toaleta, garderobera i terase. Idealnog je rasporeda, iz hodnika se ide u sve prostorije. Iznad celog stana se nalazi krovna terasa koja ne ulazi u kvadraturu i samo iz ovog stana postoji pristup. Za kupce prve nekretnine postoji mogućnost povrata PDV-a, što ovu nekretninu čini još boljom investicijom. Za više informacija pozovite na 060/141-68-69. ","Trosoban stan na prodaju, Telep, 264.460€, 109m² - 4zida",2024-01-26,Stan u zgradi ,u izgradnji ,,,,terasa ,,,,,2024,,,,,,
269,https://www.4zida.rs/prodaja-stanova/borca-i-borca-palilula-opstina-beograd/jednoiposoban-stan/65b2b4f91ab4db74690868ac,36 m² ,1.5 soba ,,grejanje na struju ,2/3 sprata ,namešteno ,1973 ,pre 17 sati ,61.000,Branislava Kojića,"Borča I, Borča, Palilula opština, Beograd","<h2 _ngcontent-ng-c3151048826 class=""mat-headline-5"">Opis oglasa</h2><div _ngcontent-ng-c3151048826 class=""prose max-h-64 overflow-hidden text-gray-800 ng-star-inserted""><p>U ponudi stan u naselju Borča centar 1 ukupne površine 36,72 m2. Odlična lokacija, priključak na   vodovodnu i kanalizacionu mrežu i strujno brojilo. Ima parking mesto. U fazi ozakonjenja.","Jednoiposoban stan na prodaju, Branislava Kojića, 61.000€, 36m² - 4zida",2024-01-26,,novo ,,,1 parking mesto ,terasa ,"telefon, kablovska, internet ",,kupatilo ,,,,,,,,
270,https://www.4zida.rs/prodaja-stanova/cacak-centar-gradske-lokacije-cacak/jednoiposoban-stan/65b22a1ce20527122d015e10,42 m² ,1.5 soba ,uknjiženo ,grejanje na gas ,4/5 spratova ,prazno ,,pre 1 dan ,59.000,Čačak - Centar,"Čačak - Centar, Gradske lokacije, Čačak","<h2 _ngcontent-ng-c3151048826 class=""mat-headline-5"">Opis oglasa</h2><div _ngcontent-ng-c3151048826 class=""prose max-h-64 overflow-hidden text-gray-800 ng-star-inserted""><p>Prodaje se jednoiposoban stan u Čačku od 42m2.","Jednoiposoban stan na prodaju, Čačak - Centar, 59.000€, 42m² - 4zida",2024-01-26,Stan u zgradi ,renovirano ,,,,terasa ,,useljivo ,"kupatilo, kuhinja ",,,,dvorište ,,,,
271,https://www.4zida.rs/prodaja-stanova/bulevar-oslobodjenja-gradske-lokacije-novi-sad/garsonjera/65b37f8a56b0788e3c006816,27 m² ,0.5 soba ,uknjiženo ,centralno grejanje ,2/5 spratova ,,523212 ,pre 3 sata ,79.000,Bulevar Oslobođenja,"Bulevar Oslobođenja, Gradske lokacije, Novi Sad","<h2 _ngcontent-ng-c3151048826 class=""mat-headline-5"">Opis oglasa</h2><div _ngcontent-ng-c3151048826 class=""prose max-h-64 overflow-hidden text-gray-800 ng-star-inserted""><p>Predstavljamo vam garsonjeru na jednoj od najtraženijih logacija u Novom Sadu. Nalaizi se na 10 minuta hoda od centra i katedrale ,u neposrednoj blizini Trga Mladenaca. Garsonjera je kompletno renovirana prošče godine i prodaje sa stvarima i tehnikom kao na slikama. Izuzetno pogodna za izdavanje ali i za život. Za više informacija pozovite naš tim agenata...","Garsonjera na prodaju, Bulevar Oslobođenja, 79.000€, 27m² - 4zida",2024-01-26,Stan u zgradi ,,,,,,,,,,,,,,,,
272,https://www.4zida.rs/prodaja-stanova/bulevar-patrijarha-pavla-somborski-bulevar-telep-gradske-lokacije-novi-sad/garsonjera/65b39cbaaf3a86496004217b,27 m² ,0.5 soba ,uknjiženo ,grejanje na gas ,3/4 sprata ,,523036 ,pre 1 sat ,75.190,Bulevar Patrijarha Pavla (Somborski Bulevar),"Bulevar Patrijarha Pavla (Somborski Bulevar), Telep, Gradske lokacije, Novi Sad","<h2 _ngcontent-ng-c3151048826 class=""mat-headline-5"">Opis oglasa</h2><div _ngcontent-ng-c3151048826 class=""prose max-h-64 overflow-hidden text-gray-800 ng-star-inserted""><p>Prodaje se odlična garsonjera u blizini Bulevara patrijarha Pavla. Stan je bez ikakvih ulaganja i prodaje se kompletno namešten. Zgrada je malo uvučena sa Bulevara patrijarha Pavla, pa daje lep osećaj u mirnom okruženju. Idealna kako za život, tako i za izdavanje. Za više informacija, pozovite! Naša preporuka.","Garsonjera na prodaju, Bulevar Patrijarha Pavla (Somborski Bulevar), 75.190€, 27m² - 4zida",2024-01-26,Stan u zgradi ,,,,,,,,,,,,,,,,
273,https://www.4zida.rs/prodaja-stanova/sumarice-gradske-lokacije-kragujevac/dvosoban-stan/65b24ecb4c511bbe9b024459,40 m² ,2 sobe ,nije uknjiženo ,podno grejanje ,2/6 spratova ,,7780 ,pre 1 dan ,74.670,Kralja Milana IV,"Šumarice, Gradske lokacije, Kragujevac","<h2 _ngcontent-ng-c3151048826 class=""mat-headline-5"">Opis oglasa</h2><div _ngcontent-ng-c3151048826 class=""prose max-h-64 overflow-hidden text-gray-800 ng-star-inserted""><p>Jednoiposoban stan u izgradnji u zgradi koja se gradi u ekstra lux varijanti. Lokacijski u blizini stadiona ""Cika Daca"". Stan svetao i suncan, istocno orjentisan. Stambeno-poslovni ojekar ""PARK PALACE"" je idealno mesto za zivot i uzivanje u svim pogodnostima koje nudi ovaj moderan i funkcionalan objekat. Gradi se sa najkvalitetnijim materijalima i ugradnom opremom  najrenomiranijih proizvodjaca. Grejanje podno na gas,. Podne obloge tarket parket, i granitna italijanska keramika. Fasadna stolarija PVC+ALU sa roletnama i komarnicima. Ulazna Italijanska vrata sa protivprovalnom bravom. Najkvalitetnija fasada. Zgrada poseduje atrijumski hol,  recepciju , dva lifta od cega je jedan panoramski. Rok zavrsetka radova je decembar 2025 godine . Cena sa uracunatim PDV-om. Mogucnost kupovine garaznog nesta po ceni od  12000 eura i parking mesta po ceni od 8400 eura sa uracunati PDV-om. Isi stanovi u prodaji na trecem i cetvrtom spratu. hodnik, dnevna soba sa kuhinjom i trpezarijom, spavaca soba, kupatilo, terasa. potpuna Broj u reg:105 Posrednicka provizija 2% 2/6 Kralja Milana IV","Dvosoban stan na prodaju, Kralja Milana IV, 74.670€, 40m² - 4zida",2024-01-26,Stan u zgradi ,u izgradnji ,ima lift (1) ,,,terasa ,telefon ,useljivo ,,,2023,,,,,,
274,https://www.4zida.rs/prodaja-stanova/nova-detelinara-detelinara-gradske-lokacije-novi-sad/cetvorosoban-stan/65b36b5b64241eee5e0cf721,96 m² ,4 sobe ,uknjiženo ,centralno grejanje ,3/6 spratova ,namešteno ,523218 ,pre 4 sata ,195.000,Pasterova,"Nova Detelinara, Detelinara, Gradske lokacije, Novi Sad","<h2 _ngcontent-ng-c3151048826 class=""mat-headline-5"">Opis oglasa</h2><div _ngcontent-ng-c3151048826 class=""prose max-h-64 overflow-hidden text-gray-800 ng-star-inserted""><p>Na prodaju je četvorosobni stan površine 96m2, smešten na Novoj Detelinari. Stan se nalazi u mirnom kraju, okružen zelenilom, što pruža idealno okruženje za opuštanje i uživanje u prirodi. Opremljen je PVC stolarijom. Sa ukupno četiri sobe, ovaj stan pruža dovoljno prostora za udoban život. Prostrani dnevni boravak je idealan za okupljanje sa porodicom ili prijateljima, dok su tri spavaće sobe savršene za odmor i privatnost. Stan se nalazi u blizini svih potrebnih sadržaja, kao što su prodavnice, restorani, škole i vrtići, što čini ovu lokaciju vrlo praktičnom za svakodnevni život. Takođe, dobro je povezan sa gradskim prevozom, što omogućava jednostavan pristup svim delovima grada.Ukoliko tražite prostran stan u mirnom okruženju na Novoj Detelinari je idealan izbor za vas. Ne propustite priliku da se preselite u ovaj prelepi stan i uživate u svim pogodnostima koje pruža.064/1494114","Četvorosoban stan na prodaju, Pasterova, 195.000€, 96m² - 4zida",2024-01-26,Stan u zgradi ,uobičajeno stanje ,ima lift (1) ,,,terase (2) ,klima ,,"kupatilo, toalet, ostava ",,,,,,,,
275,https://www.4zida.rs/prodaja-stanova/liman-3-liman-gradske-lokacije-novi-sad/trosoban-stan/65b19f997dc46ff12a0a4292,107 m² ,3 sobe ,uknjiženo ,centralno grejanje ,3/3 sprata ,prazno ,43253 ,pre 3 sata ,210.000,Liman 3,"Liman 3, Liman, Gradske lokacije, Novi Sad","<h2 _ngcontent-ng-c3151048826 class=""mat-headline-5"">Opis oglasa</h2><div _ngcontent-ng-c3151048826 class=""prose max-h-64 overflow-hidden text-gray-800 ng-star-inserted""><p>LIMAN 3, 107m2, TROSOBAN<br>Prodaje se trosoban stan koji se nalazi na trećem spratu zgrade sa liftom. Odličnog je rasporeda i sačinjen je od ulaznog hodnika, prostorije koja može biti u funkciji dnevnog boravka ili kancelarijskog prostora, dve prostorije koje mogu biti spavaće sobe ili kancelarije, kupatilo, WC, terasu koja ulazi u kvadraturu stana, kao i predsoblje koje se nalazi na donjoj etaži. Ovo je idealna prilika za porodični život. Stan je uknjižen 1/1 i bez tereta je.<br>Cena 210.000eura + 3% posrednička naknada<br>Za više informacija, možete nas kontaktirati na 063/343-200 ili 021/2300-900, agencija za nekretnine ""Šćepanović i saradnici"", upisana u Registar posrednika pod brojem 1573, Bulevar oslobođenja 78, Novi Sad.<br>  ID oglasa: 43253.","Trosoban stan na prodaju, Liman 3, 210.000€, 107m² - 4zida",2024-01-26,,novo ,ima lift (1) ,,,terasa ,"telefon, kablovska, internet, klima ",useljivo ,,,,,,,,,
276,https://www.4zida.rs/prodaja-stanova/centar-medijana-gradske-lokacije-nis/dvosoban-stan/65b244c8a3a667922f0bd390,53 m² ,2 sobe ,uknjiženo ,centralno grejanje ,15. sprat ,prazno ,4345 ,pre 22 sati ,80.000,Centar,"Centar, Medijana, Gradske lokacije, Niš","<h2 _ngcontent-ng-c3151048826 class=""mat-headline-5"">Opis oglasa</h2><div _ngcontent-ng-c3151048826 class=""prose max-h-64 overflow-hidden text-gray-800 ng-star-inserted""><p>Ako tražite pravi porodičan stan koji se nalazi na jednoj od najatraktivnijih lokacija u gradu, onda je ovo idealna ponuda za vas.  Prodaje se stan površine 53m2 koji se nalazi na XV spratu stambene zgrade koja poseduje dva lifta. Stan je klasične dvosobne strukture sa funkcionalnim rasporedom prostorija i sastoji se od: ulaznog hodnika, dnevne sobe, odvojene kuhinje, spavaće sobe, kupatila i terase. Grejanje u stanu je centralno. U stanu je renovirano kupatilo i zamenjena je stolarija. Podovi su obloženi parketom i laminatom, stolarija je PVC profila. Ono što ovaj stan čini jedinstvenim je prelep pogled na grad koji se pruža iz svake prostorije i terase. Nalazi se na odličnoj lokaciji, u strogom centru grada, u blizini svih važnih institucija i gradskih dešavanja i ima sve što je potrebno za kvalitetan i komforan život. Hvala Vam što ste pogledali oglas. Za više informacija o ovoj ili drugim nekretninama i zakazivanje razgledanja kontaktirajte agenta na broj telefona iz oglasa (poziv, sms, viber) ili putem e-maila. Kompletnu ponudu dostupnih nekretnina možete pronaći na našem sajtu. Agencija Proagent nekretnine je upisana u Registru posrednika pod brojem: 940.","Dvosoban stan na prodaju, Centar, 80.000€, 53m² - 4zida",2024-01-26,,,ima lift (1) ,,,terasa ,,,,,,,,,,,
277,https://www.4zida.rs/prodaja-stanova/banovo-brdo-cukarica-cukarica-opstina-beograd/dvosoban-stan/65b296d6430e7564a209d169,,,,,,,,,,,,,Pretraga Nekretnina za Prodaju i Izdavanje · 4zida,2024-01-26,,,,,,,,,,,,,,,,,
278,https://www.4zida.rs/prodaja-stanova/sumice-vozdovac-opstina-beograd/jednosoban-stan/658b399158c978eb3f0fade3,,,,,,,,,,,,,Pretraga Nekretnina za Prodaju i Izdavanje · 4zida,2024-01-26,,,,,,,,,,,,,,,,,
279,https://www.4zida.rs/prodaja-stanova/kanarevo-brdo-rakovica-opstina-beograd/dvosoban-stan/65b393f2a791815a220456c3,48 m² ,2 sobe ,uknjiženo ,centralno grejanje ,2/3 sprata ,prazno ,6969 ,pre 1 sat ,75.000,Kanarevo Brdo,"Kanarevo Brdo, Rakovica opština, Beograd","<h2 _ngcontent-ng-c3151048826 class=""mat-headline-5"">Opis oglasa</h2><div _ngcontent-ng-c3151048826 class=""prose max-h-64 overflow-hidden text-gray-800 ng-star-inserted""><p>Zgrada u samom centru Kanarevog brda, u okruženju pošte, maxija, škole, lakom šetnjom stiže se do Doma zdravlja i novog buvljaka. ","Dvosoban stan na prodaju, Kanarevo Brdo, 75.000€, 48m² - 4zida",2024-01-26,,,,,1 parking mesto ,"podrum, terasa ","telefon, interfon, klima ",,kupatilo ,,1951,,,,,,
280,https://www.4zida.rs/prodaja-stanova/zitni-trg-gradske-lokacije-zrenjanin/dvosoban-stan/65b25f129a6556b81e088d3f,,,,,,,,,,,,,503 Backend fetch failed,2024-01-26,,,,,,,,,,,,,,,,,
281,https://www.4zida.rs/prodaja-stanova/crveni-krst-gradske-lokacije-nis/jednoiposoban-stan/65b2c740a79051e17f0f01fa,,,,,,,,,,,,,503 Backend fetch failed,2024-01-26,,,,,,,,,,,,,,,,,
282,https://www.4zida.rs/prodaja-stanova/nova-detelinara-detelinara-gradske-lokacije-novi-sad/garsonjera/65b298af430e7564a209d1ba,,,,,,,,,,,,,503 Backend fetch failed,2024-01-26,,,,,,,,,,,,,,,,,
283,https://www.4zida.rs/prodaja-stanova/zeleznicka-stanica-banatic-gradske-lokacije-novi-sad/dvoiposoban-stan/65b369cd35b87a43bc0c4f1f,,,,,,,,,,,,,503 Backend fetch failed,2024-01-26,,,,,,,,,,,,,,,,,
284,https://www.4zida.rs/prodaja-stanova/bagdala-gradske-lokacije-krusevac/dvoiposoban-stan/65b297051c8c805014080b14,,,,,,,,,,,,,503 Backend fetch failed,2024-01-26,,,,,,,,,,,,,,,,,
285,https://www.4zida.rs/prodaja-stanova/bistrica-novo-naselje-gradske-lokacije-novi-sad/trosoban-stan/65b2b7bea11a6518c3079cf1,,,,,,,,,,,,,503 Backend fetch failed,2024-01-26,,,,,,,,,,,,,,,,,
286,https://www.4zida.rs/prodaja-stanova/aerodrom-gradske-lokacije-kragujevac/dvosoban-stan/65b2def9a7b615785205a361,,,,,,,,,,,,,503 Backend fetch failed,2024-01-26,,,,,,,,,,,,,,,,,
