,link,Površina,Broj soba,Grejanje,Stanje,Spratnost,Lift,Unutrašnje prostorije,Nameštenost,Opremljenost,Šifra oglasa,Oglas ažuriran,price,street,address,title,end_date,Tip,Uknjiženost,Godina izgradnje,Infrastruktura,Useljivo,Orijentacija nekretnine,Pogled na,Garaža,Internet,Parking,Autobuske linije,Tramvajske linije,Useljivo od,Trolejbuske linije
694,https://www.4zida.rs/prodaja-stanova/sajmiste-gradske-lokacije-novi-sad/trosoban-stan/63fcc78899c714074f0ae182,100 m² ,3 sobe ,,uobičajeno stanje ,4/4 sprata ,ima lift (1) ,,,,1016225 ,pre 4 meseca ,267.800,Sajmište,"Sajmište, Gradske lokacije, Novi Sad","Trosoban stan na prodaju, Sajmište, 267.800€, 100m² - 4zida",2023-08-21,Stan u zgradi ,uknjiženo ,,terasa ,,,,,,,,,,
695,https://www.4zida.rs/prodaja-stanova/palilulska-rampa-palilula-gradske-lokacije-nis/dvosoban-stan/64da1c5669376b5ed4027c93,48 m² ,2 sobe ,grejanje na struju ,renovirano ,prizemlje/3 sprata ,,kupatilo ,prazno ,,,pre 6 dana ,65.000,Palilulska Rampa,"Palilulska Rampa, Palilula, Gradske lokacije, Niš","Dvosoban stan na prodaju, Palilulska Rampa, 65.000€, 48m² - 4zida",2023-08-21,Stan u zgradi ,uknjiženo ,,,,,,,,,,,,
696,https://www.4zida.rs/prodaja-stanova/nova-zeleznicka-kolonija-palilula-gradske-lokacije-nis/garsonjera/64e0b58e16c1f1325904e9fb,31 m² ,0.5 soba ,centralno grejanje ,,3. sprat ,,kupatilo ,,interfon ,p,pre 1 dan ,53.760,Stara železnička kolonija,"Nova Železnička Kolonija, Palilula, Gradske lokacije, Niš","Garsonjera na prodaju, Stara železnička kolonija, 53.760€, 31m² - 4zida",2023-08-21,,uknjiženo ,,terasa ,,,,,,1 parking mesto ,,,,
697,https://www.4zida.rs/prodaja-stanova/centar-medijana-gradske-lokacije-nis/troiposoban-stan/64dbba90fe1811c18c037c8f,82 m² ,3.5 soba ,kaljeva peć ,renovirano ,visoko prizemlje/3 sprata ,,kupatilo ,prazno ,,,pre 5 dana ,159.000,Centar,"Centar, Medijana, Gradske lokacije, Niš","Troiposoban stan na prodaju, Centar, 159.000€, 82m² - 4zida",2023-08-21,Stan u zgradi ,uknjiženo ,1980,"podrum, terase (2) ",useljivo ,,,,,,,,,
698,https://www.4zida.rs/prodaja-stanova/centar-medijana-gradske-lokacije-nis/dvoiposoban-stan/64d4e2cc7946d788630a33d9,69 m² ,2.5 soba ,TA peć ,uobičajeno stanje ,1/5 spratova ,,kuhinja ,prazno ,,1073 ,pre 5 dana ,86.000,Centar,"Centar, Medijana, Gradske lokacije, Niš","Dvoiposoban stan na prodaju, Centar, 86.000€, 69m² - 4zida",2023-08-21,Stan u zgradi ,uknjiženo ,,"podrum, terasa ",,,,,,,,,,
699,https://www.4zida.rs/prodaja-stanova/calije-pantelej-gradske-lokacije-nis/jednoiposoban-stan/64dcf710f4e35712b8086a2a,40 m² ,1.5 soba ,,,4. sprat ,,,prazno ,,3740 ,pre 4 dana ,41.000,Čalije,"Čalije, Pantelej, Gradske lokacije, Niš","Jednoiposoban stan na prodaju, Čalije, 41.000€, 40m² - 4zida",2023-08-21,,uknjiženo ,,,,,,,,,,,,
700,https://www.4zida.rs/prodaja-stanova/brace-jerkovic-vozdovac-opstina-beograd/cetvorosoban-stan/646ddbac64f299cf8d056705,77 m² ,4 sobe ,centralno grejanje ,renovirano ,7/10 spratova ,ima lift (2) ,"kupatilo, kuhinja, ostava ",namešteno ,"telefon, kablovska, TV, klima, veš mašina, ležaj, plakar ",EXTRA LUX RENOVIRAN OPREMLJEN STAN,pre 13 dana ,164.900,bgd,"Braće Jerković, Voždovac opština, Beograd","Četvorosoban stan na prodaju, bgd, 164.900€, 77m² - 4zida",2023-08-21,Stan u zgradi ,uknjiženo ,,"podrum, terasa ",,,,,,1 parking mesto ,,,,
701,https://www.4zida.rs/prodaja-stanova/socijalno-rotkvarija-gradske-lokacije-novi-sad/cetvorosoban-stan/64bcf47163ab9e99180f70af,94 m² ,4 sobe ,centralno grejanje ,luksuzno ,2/7 spratova ,ima lift (1) ,"kupatila (2), kuhinja ",namešteno ,klima ,,pre 28 dana ,320.000,Socijalno,"Socijalno, Rotkvarija, Gradske lokacije, Novi Sad","Četvorosoban stan na prodaju, Socijalno, 320.000€, 94m² - 4zida",2023-08-21,Stan u zgradi ,uknjiženo ,2020,terasa ,useljivo ,,,1 garažno mesto ,,,,,,
702,https://www.4zida.rs/prodaja-stanova/nova-detelinara-detelinara-gradske-lokacije-novi-sad/trosoban-stan/63e6ced92baf2a8d070d9036,59 m² ,3 sobe ,centralno grejanje ,u izgradnji ,2/3 sprata ,ima lift (1) ,,,,1039390 ,pre 4 meseca ,146.550,Nova Detelinara,"Nova Detelinara, Detelinara, Gradske lokacije, Novi Sad","Trosoban stan na prodaju, Nova Detelinara, 146.550€, 59m² - 4zida",2023-08-21,Stan u zgradi ,,2023,terasa ,,,,,,,,,,
703,https://www.4zida.rs/prodaja-stanova/mokranjcev-palilula-gradske-lokacije-nis/dvoiposoban-stan/64bcfbd2ba3ee2a51f091f07,46 m² ,2.5 soba ,grejanje na struju ,,1/3 sprata ,,"kupatilo, kuhinja ",namešteno ,"telefon, kablovska, TV, veš mašina, kuhinjski elementi, frižider, zamrzivač, rerna, šporet, ležaj ",,pre 14 dana ,68.000,Mokranjčeva,"Mokranjčev, Palilula, Gradske lokacije, Niš","Dvoiposoban stan na prodaju, Mokranjčeva, 68.000€, 46m² - 4zida",2023-08-21,Stan u zgradi ,uknjiženo ,2010,"podrum, terasa ",useljivo ,,dvorište ,,,,,,,
704,https://www.4zida.rs/prodaja-stanova/cigota-okolne-lokacije-zlatibor/dvosoban-stan/64d66ffa9c199cafac0826fe,37 m² ,2 sobe ,,novo ,5/8 spratova ,ima lift (1) ,kupatilo ,prazno ,"telefon, internet, interfon, klima ",1352 ,pre 9 dana ,89.830,Sportova,"Čigota, Okolne lokacije, Zlatibor","Dvosoban stan na prodaju, Sportova, 89.830€, 37m² - 4zida",2023-08-21,,uknjiženo ,,,,,,,,1 parking mesto ,,,,
705,https://www.4zida.rs/prodaja-stanova/centar-gradske-lokacije-paracin/trosoban-stan/644d2da4907868fcdb0b5179,63 m² ,3 sobe ,,,1/6 spratova ,,,prazno ,,6073 ,pre 3 meseca ,61.500,Centar,"Centar, Gradske lokacije, Paraćin","Trosoban stan na prodaju, Centar, 61.500€, 63m² - 4zida",2023-08-21,Stan u zgradi ,,,,,,,,,,,,,
706,https://www.4zida.rs/prodaja-stanova/suvi-do-palilula-gradske-lokacije-nis/cetvorosoban-stan/63ff41fa881c89841b0f76e8,170 m² ,4 sobe ,TA peć ,u izgradnji ,prizemlje ,,"kupatilo, toalet ",,,p,pre 4 meseca ,42.500,Maršala Tita,"Suvi Do, Palilula, Gradske lokacije, Niš","Četvorosoban stan na prodaju, Maršala Tita, 42.500€, 170m² - 4zida",2023-08-21,,uknjiženo ,,terase (5) ,,,,1 garažno mesto ,,,,,,
707,https://www.4zida.rs/prodaja-stanova/nova-detelinara-detelinara-gradske-lokacije-novi-sad/cetvorosoban-stan/64df438ef94cc779e7089c10,96 m² ,4 sobe ,,uobičajeno stanje ,5/6 spratova ,ima lift (1) ,,,,1018485 ,pre 2 dana ,151.400,Nova Detelinara,"Nova Detelinara, Detelinara, Gradske lokacije, Novi Sad","Četvorosoban stan na prodaju, Nova Detelinara, 151.400€, 96m² - 4zida",2023-08-21,Stan u zgradi ,uknjiženo ,2008,terasa ,,,,,,,,,,
708,https://www.4zida.rs/prodaja-stanova/cara-dusana-adamovicevo-naselje-gradske-lokacije-novi-sad/trosoban-stan/63f4da5538e92f161a0a13d6,67 m² ,3 sobe ,centralno grejanje ,uobičajeno stanje ,,ima lift (1) ,"kupatila (2), kuhinja, ostava ",prazno ,"telefon, kablovska ",469225 ,pre 5 meseci ,139.050,Cara Dušana,"Cara Dušana, Adamovićevo Naselje, Gradske lokacije, Novi Sad","Trosoban stan na prodaju, Cara Dušana, 139.050€, 67m² - 4zida",2023-08-21,Stan u zgradi ,uknjiženo ,,terasa ,useljivo ,,,,,,,,,
709,https://www.4zida.rs/prodaja-stanova/bulevar-zona-3-bulevar-nemanjica-medijana-gradske-lokacije-nis/jednoiposoban-stan/64d5e3f7f60de3985100c5f6,,,,,,,,,,,,,,,"Prodaja stanova Bulevar Zona 3, Bulevar Nemanjića, Medijana, Gradske lokacije, Niš - 4zida",2023-08-21,,,,,,,,,,,,,,
710,https://www.4zida.rs/prodaja-stanova/cukaricka-padina-cukarica-cukarica-opstina-beograd/garsonjera/64de3bac7a063dca900017c8,31 m² ,0.5 soba ,,renovirano ,3/7 spratova ,,,,,177 ,pre 3 dana ,79.000,Nikole Vučete,"Čukarička Padina, Čukarica, Čukarica opština, Beograd","Garsonjera na prodaju, Nikole Vučete, 79.000€, 31m² - 4zida",2023-08-21,Stan u zgradi ,uknjiženo ,,lođa ,,,,,,,,,,
711,https://www.4zida.rs/prodaja-stanova/bistrica-novo-naselje-gradske-lokacije-novi-sad/jednoiposoban-stan/64de1da73628167cc00b013b,37 m² ,1.5 soba ,,u izgradnji ,2/7 spratova ,ima lift (1) ,,,,1096565 ,pre 3 dana ,93.730,Bistrica,"Bistrica, Novo Naselje, Gradske lokacije, Novi Sad","Jednoiposoban stan na prodaju, Bistrica, 93.730€, 37m² - 4zida",2023-08-21,Stan u zgradi ,uknjiženo ,2021,terasa ,,,,,,,,,,
712,https://www.4zida.rs/prodaja-stanova/sarajevska-savski-venac-beograd/dvoiposoban-stan/63f792a54d7266f19508dc1a,62 m² ,2.5 soba ,grejanje na struju ,uobičajeno stanje ,3/3 sprata ,,,,,7869 ,pre 3 dana ,115.000,Durmitorska,"Sarajevska, Savski Venac, Beograd","Dvoiposoban stan na prodaju, Durmitorska, 115.000€, 62m² - 4zida",2023-08-21,,uknjiženo ,,,useljivo ,,,,,,,,,
713,https://www.4zida.rs/prodaja-stanova/konjarnik-zvezdara-opstina-beograd/dvosoban-stan/647de09342ea270ee0020b83,,,,,,,,,,,,,,,"Prodaja stanova Konjarnik, Zvezdara opština, Beograd - 4zida",2023-08-21,,,,,,,,,,,,,,
714,https://www.4zida.rs/prodaja-stanova/crveni-krst-vracar-vracar-beograd/jednoiposoban-stan/64b64c2e1ee8d13800076f6a,,,,,,,,,,,,,,,"Prodaja stanova Crveni Krst Vračar, Vračar, Beograd - 4zida",2023-08-21,,,,,,,,,,,,,,
715,https://www.4zida.rs/prodaja-stanova/cigota-okolne-lokacije-zlatibor/dvosoban-stan/64d66ff79c199cafac0826f5,37 m² ,2 sobe ,,novo ,5/8 spratova ,ima lift (1) ,kupatilo ,prazno ,"telefon, internet, interfon, klima ",1355 ,pre 9 dana ,90.050,Sportova,"Čigota, Okolne lokacije, Zlatibor","Dvosoban stan na prodaju, Sportova, 90.050€, 37m² - 4zida",2023-08-21,,uknjiženo ,,,,,,,,1 parking mesto ,,,,
716,https://www.4zida.rs/prodaja-stanova/cigota-okolne-lokacije-zlatibor/dvosoban-stan/64d66feb9c199cafac0826ce,37 m² ,2 sobe ,,novo ,7/8 spratova ,ima lift (1) ,kupatilo ,prazno ,"telefon, internet, interfon, klima ",1368 ,pre 9 dana ,98.185,Sportova,"Čigota, Okolne lokacije, Zlatibor","Dvosoban stan na prodaju, Sportova, 98.185€, 37m² - 4zida",2023-08-21,,uknjiženo ,,,,,,,,1 parking mesto ,,,,
717,https://www.4zida.rs/prodaja-stanova/blok-31-opstina-novi-beograd-beograd/jednoiposoban-stan/63aeef6d3c82f44dd5073eb8,35 m² ,1.5 soba ,centralno grejanje ,renovirano ,14/14 spratova ,,,prazno ,,,pre 7 meseci ,170.000,Blok 31 - Opština,"Blok 31 - Opština, Novi Beograd, Beograd","Jednoiposoban stan na prodaju, Blok 31 - Opština, 170.000€, 35m² - 4zida",2023-08-21,Penthaus ,uknjiženo ,,terasa ,useljivo ,,,,,,,,,
718,https://www.4zida.rs/prodaja-stanova/zemun-centar-zemun-zemun-opstina-beograd/jednoiposoban-stan/64db6dda0b2e991c950e4cd6,40 m² ,1.5 soba ,grejanje na struju ,renovirano ,prizemlje ,,kupatilo ,prazno ,telefon ,18703 ,pre 4 dana ,93.900,Zmaj Jovina,"Zemun - Centar, Zemun, Zemun opština, Beograd","Jednoiposoban stan na prodaju, Zmaj Jovina, 93.900€, 40m² - 4zida",2023-08-21,,uknjiženo ,,,,,,,,,,,,
719,https://www.4zida.rs/prodaja-stanova/liman-4-liman-gradske-lokacije-novi-sad/dvoiposoban-stan/64df49b6a071c6ed1a0ee959,57 m² ,2.5 soba ,centralno grejanje ,renovirano ,visoko prizemlje/5 spratova ,ima lift (1) ,,prazno ,,515686 ,pre 2 dana ,124.630,Liman 4,"Liman 4, Liman, Gradske lokacije, Novi Sad","Dvoiposoban stan na prodaju, Liman 4, 124.630€, 57m² - 4zida",2023-08-21,Stan u zgradi ,uknjiženo ,,terasa ,,,,,,1 parking mesto ,,,,
720,https://www.4zida.rs/prodaja-stanova/bezanijska-kosa-2-bezanijska-kosa-novi-beograd-beograd/dvosoban-stan/648c688a66d0e762300882a1,,,,,,,,,,,,,,,"Prodaja stanova Bežanijska kosa 2, Bežanijska kosa, Novi Beograd, Beograd - 4zida",2023-08-21,,,,,,,,,,,,,,
721,https://www.4zida.rs/prodaja-stanova/cara-dusana-adamovicevo-naselje-gradske-lokacije-novi-sad/jednoiposoban-stan/64e10a7e29ba0588d20a52fc,32 m² ,1.5 soba ,grejanje na gas ,,3/5 spratova ,ima lift (1) ,"kupatilo, kuhinja ",prazno ,"telefon, kablovska, TV, klima, kuhinjski elementi, rerna, šporet, plakar ",515690 ,pre 1 dan ,80.630,Cara Dušana,"Cara Dušana, Adamovićevo Naselje, Gradske lokacije, Novi Sad","Jednoiposoban stan na prodaju, Cara Dušana, 80.630€, 32m² - 4zida",2023-08-21,Stan u zgradi ,uknjiženo ,2000,"dvorište, terasa ",,,,1 garažno mesto ,,1 parking mesto ,,,,
722,https://www.4zida.rs/prodaja-stanova/centar-gradske-lokacije-krusevac/troiposoban-stan/64d611c39b944a1da5099b97,132 m² ,3.5 soba ,centralno grejanje ,novo ,3/4 sprata ,,,,,,pre 9 dana ,84.000,Centar,"Centar, Gradske lokacije, Kruševac","Troiposoban stan na prodaju, Centar, 84.000€, 132m² - 4zida",2023-08-21,Stan u zgradi ,uknjiženo ,,terasa ,useljivo ,,,,,,,,,
723,https://www.4zida.rs/prodaja-stanova/brace-jerkovic-vozdovac-opstina-beograd/dvoiposoban-stan/64df7a9cab91826292072e89,76 m² ,2.5 soba ,,,1/5 spratova ,,,namešteno ,"kablovska, TV, klima, Kanalizacija ",5271 ,pre 2 dana ,142.000,Dragice Končar,"Braće Jerković, Voždovac opština, Beograd","Dvoiposoban stan na prodaju, Dragice Končar, 142.000€, 76m² - 4zida",2023-08-21,Stan u zgradi ,nije uknjiženo ,1960,terasa ,,,,,,,,,,
724,https://www.4zida.rs/prodaja-stanova/salajka-gradske-lokacije-novi-sad/garsonjera/63de5ad03d81f31f9400a497,27 m² ,0.5 soba ,,uobičajeno stanje ,3/4 sprata ,,kupatilo ,,,1058139 ,pre 4 meseca ,77.250,"SALAJKA, NOVI SAD","Salajka, Gradske lokacije, Novi Sad","Garsonjera na prodaju, SALAJKA, NOVI SAD, 77.250€, 27m² - 4zida",2023-08-21,Stan u zgradi ,uknjiženo ,2012,terasa ,useljivo ,,,,,,,,,
725,https://www.4zida.rs/prodaja-stanova/novo-naselje-gradske-lokacije-novi-sad/cetvorosoban-stan/64e0eae46c305c491301b10a,130 m² ,4 sobe ,centralno grejanje ,novo ,,,,,,101223 ,pre 1 dan ,273.000,Novo Naselje,"Novo Naselje, Gradske lokacije, Novi Sad","Četvorosoban stan na prodaju, Novo Naselje, 273.000€, 130m² - 4zida",2023-08-21,Stan u zgradi ,uknjiženo ,2022,terasa ,useljivo ,,,1 garažno mesto ,,,,,,
726,https://www.4zida.rs/prodaja-stanova/gradske-lokacije-ruma/trosoban-stan/61bc3e66c0ecfa2f410937d8,66 m² ,3 sobe ,,,2/2 sprata ,,"kupatilo, toalet ",,"internet, klima ",76683299 ,pre 4 meseca ,81.700,Iriška,"Gradske lokacije, Ruma","Trosoban stan na prodaju, Iriška, 81.700€, 66m² - 4zida",2023-08-21,,,,"lođa, Bazen za plivanje ",,,,2 garažna mesta ,,1 parking mesto ,,,,
727,https://www.4zida.rs/prodaja-stanova/bistrica-novo-naselje-gradske-lokacije-novi-sad/trosoban-stan/64dcc80bdda15d22d6012c7e,71 m² ,3 sobe ,centralno grejanje ,novo ,6/6 spratova ,ima lift (1) ,"kupatilo, kuhinja, ostava ",prazno ,,456175 ,pre 4 dana ,149.350,Anđe Ranković,"Bistrica, Novo Naselje, Gradske lokacije, Novi Sad","Trosoban stan na prodaju, Anđe Ranković, 149.350€, 71m² - 4zida",2023-08-21,Stan u zgradi ,uknjiženo ,,terasa ,useljivo ,,,,,,,,,
728,https://www.4zida.rs/prodaja-stanova/grbavica-gradske-lokacije-novi-sad/dvosoban-stan/6388bdaa98ca6fbcaf07975a,52 m² ,2 sobe ,centralno grejanje ,,3/5 spratova ,,"kupatilo, ostava ",prazno ,,,pre 15 dana ,113.000,Miše Dimitrijevića,"Grbavica, Gradske lokacije, Novi Sad","Dvosoban stan na prodaju, Miše Dimitrijevića, 113.000€, 52m² - 4zida",2023-08-21,Stan u zgradi ,uknjiženo ,,terasa ,,,,,,1 parking mesto ,,,,
729,https://www.4zida.rs/prodaja-stanova/centar-gradske-lokacije-vrnjacka-banja/jednosoban-stan/64d5eb02e418828563059e11,,,,,,,,,,,,,,,"Prodaja stanova Centar, Gradske lokacije, Vrnjačka Banja - 4zida",2023-08-21,,,,,,,,,,,,,,
730,https://www.4zida.rs/prodaja-stanova/satelit-novo-naselje-gradske-lokacije-novi-sad/dvosoban-stan/640bc6cf52eccb7e31051f69,50 m² ,2 sobe ,centralno grejanje ,uobičajeno stanje ,3/4 sprata ,,,,"kablovska, internet, interfon ",1035920 ,pre 4 meseca ,103.000,Satelit,"Satelit, Novo Naselje, Gradske lokacije, Novi Sad","Dvosoban stan na prodaju, Satelit, 103.000€, 50m² - 4zida",2023-08-21,Stan u zgradi ,uknjiženo ,2007,terasa ,,,,,,,,,,
731,https://www.4zida.rs/prodaja-stanova/petlovo-brdo-rakovica-opstina-beograd/dvosoban-stan/6411df752c6f6e55130ee240,55 m² ,2 sobe ,grejanje na struju ,,1/1 sprat ,,,,telefon ,2025 ,pre 1 mesec ,102.000,Oplenacka,"Petlovo Brdo, Rakovica opština, Beograd","Dvosoban stan na prodaju, Oplenacka, 102.000€, 55m² - 4zida",2023-08-21,Stan u zgradi ,uknjiženo ,,"podrum, terasa ",useljivo ,,,1 garažno mesto ,,,,,,
732,https://www.4zida.rs/prodaja-stanova/novi-sad-centar-stari-grad-gradske-lokacije-novi-sad/petosoban-stan/64e0eae36c305c491301b100,116 m² ,5 soba ,grejanje na struju ,u izgradnji ,4/4 sprata ,,,,,101225 ,pre 1 dan ,255.200,Kisačka,"Novi Sad - Centar, Stari Grad, Gradske lokacije, Novi Sad","Petosoban stan na prodaju, Kisačka, 255.200€, 116m² - 4zida",2023-08-21,Stan u zgradi ,nije uknjiženo ,,terasa ,useljivo ,,,,,,,,,
733,https://www.4zida.rs/prodaja-stanova/kluz-zvezdara-opstina-beograd/cetvorosoban-stan/63efd1a4cfd02f0d630f3a41,89 m² ,4 sobe ,etažno grejanje ,uobičajeno stanje ,visoko prizemlje/1 sprat ,,kupatilo ,prazno ,"telefon, klima ",4689 ,pre 33 dana ,220.000,Dušana Popovića,"Kluz, Zvezdara opština, Beograd","Četvorosoban stan na prodaju, Dušana Popovića, 220.000€, 89m² - 4zida",2023-08-21,,uknjiženo ,1968,podrum ,,,,1 garažno mesto ,,1 parking mesto ,,,,
734,https://www.4zida.rs/prodaja-stanova/kanarevo-brdo-rakovica-opstina-beograd/trosoban-stan/63cd2c7ea46575c2a904e4d6,64 m² ,3 sobe ,etažno grejanje ,,4/4 sprata ,,kupatilo ,prazno ,telefon ,3461 ,pre 12 dana ,70.000,Vukasovićeva,"Kanarevo Brdo, Rakovica opština, Beograd","Trosoban stan na prodaju, Vukasovićeva, 70.000€, 64m² - 4zida",2023-08-21,,uknjiženo ,1960,,,,,,,,,,,
735,https://www.4zida.rs/prodaja-stanova/miljakovac-rakovica-opstina-beograd/dvoiposoban-stan/64df397b4aa6286e5609230b,61 m² ,2.5 soba ,centralno grejanje ,uobičajeno stanje ,2/4 sprata ,,,prazno ,interfon ,2688 ,pre 2 dana ,130.000,Borska,"Miljakovac, Rakovica opština, Beograd","Dvoiposoban stan na prodaju, Borska, 130.000€, 61m² - 4zida",2023-08-21,Stan u zgradi ,uknjiženo ,1970,"podrum, terasa ",useljivo ,,,,,,,,,
736,https://www.4zida.rs/prodaja-stanova/meandri-zemun-zemun-opstina-beograd/jednoiposoban-stan/64e237fbc95709356304c702,37 m² ,1.5 soba ,centralno grejanje ,renovirano ,4/22 sprata ,ima lift (3) ,"kupatilo, kuhinja, ostava ",prazno ,"telefon, kablovska, klima ",,pre 16 sati ,91.000,Banijska 30,"Meandri, Zemun, Zemun opština, Beograd","Jednoiposoban stan na prodaju, Banijska 30, 91.000€, 37m² - 4zida",2023-08-21,Stan u zgradi ,uknjiženo ,1980,"prilaz za invalide, podrum, terasa ",useljivo ,"istok, sever ",dvorište ,100 garažna mesta ,Optički ,1 parking mesto ,"15, 78, 45, 18, 85, 83, 612 ",,,
737,https://www.4zida.rs/prodaja-stanova/telep-gradske-lokacije-novi-sad/jednoiposoban-stan/63f5e9b369e939636e0e616c,38 m² ,1.5 soba ,grejanje na gas ,u izgradnji ,2/3 sprata ,ima lift (1) ,"kupatilo, ostava ",prazno ,klima ,506029 ,pre 5 meseci ,90.130,Telep,"Telep, Gradske lokacije, Novi Sad","Jednoiposoban stan na prodaju, Telep, 90.130€, 38m² - 4zida",2023-08-21,Stan u zgradi ,nije uknjiženo ,,terasa ,,,,,,1 parking mesto ,,,30.06.2023 ,
738,https://www.4zida.rs/prodaja-stanova/telep-gradske-lokacije-novi-sad/trosoban-stan/6430276c77c9e6d470049516,61 m² ,3 sobe ,,u izgradnji ,3/4 sprata ,ima lift (1) ,,,,1005373 ,pre 4 meseca ,204.970,Telep,"Telep, Gradske lokacije, Novi Sad","Trosoban stan na prodaju, Telep, 204.970€, 61m² - 4zida",2023-08-21,Stan u zgradi ,uknjiženo ,2022,terasa ,,,,,,,,,,
739,https://www.4zida.rs/prodaja-stanova/gradske-lokacije-pancevo/cetvorosoban-stan/64d9ed8034403498cd0f8a03,,,,,,,,,,,,,,,"Prodaja stanova Gradske lokacije, Pančevo - 4zida",2023-08-21,,,,,,,,,,,,,,
740,https://www.4zida.rs/prodaja-stanova/centar-preko-lepenice-pivara-gradske-lokacije-kragujevac/dvosoban-stan/64d359869e1a647b610319c1,48 m² ,2 sobe ,centralno grejanje ,uobičajeno stanje ,2/4 sprata ,,kupatilo ,prazno ,interfon ,2883 ,pre 11 dana ,46.000,Centar preko Lepenice,"Centar preko Lepenice, Pivara, Gradske lokacije, Kragujevac","Dvosoban stan na prodaju, Centar preko Lepenice, 46.000€, 48m² - 4zida",2023-08-21,,nije uknjiženo ,1969,terasa ,,,,,,,,,,
741,https://www.4zida.rs/prodaja-stanova/grbavica-gradske-lokacije-novi-sad/dvosoban-stan/630f263cd8578a1ac9078cf7,,,,,,,,,,,,,,,"Prodaja stanova Grbavica, Gradske lokacije, Novi Sad - 4zida",2023-08-21,,,,,,,,,,,,,,
742,https://www.4zida.rs/prodaja-stanova/mala-amerika-gradske-lokacije-zrenjanin/troiposoban-stan/64d0fd3844c91cba70057d28,76 m² ,3.5 soba ,grejanje na gas ,,,,kupatilo ,prazno ,telefon ,1202 ,pre 13 dana ,59.000,Mala Amerika,"Mala Amerika, Gradske lokacije, Zrenjanin","Troiposoban stan na prodaju, Mala Amerika, 59.000€, 76m² - 4zida",2023-08-21,,uknjiženo ,,,useljivo ,,,,,,,,,
743,https://www.4zida.rs/prodaja-stanova/duvaniste-medijana-gradske-lokacije-nis/jednosoban-stan/64db88a0a2f609c4310abda2,44 m² ,1 soba ,centralno grejanje ,uobičajeno stanje ,4/10 spratova ,ima lift (1) ,kupatilo ,,interfon ,p,pre 5 dana ,72.600,Majakovskog,"Duvanište, Medijana, Gradske lokacije, Niš","Jednosoban stan na prodaju, Majakovskog, 72.600€, 44m² - 4zida",2023-08-21,,uknjiženo ,,terase (2) ,,,,,,1 parking mesto ,,,,
744,https://www.4zida.rs/prodaja-stanova/klisa-gradske-lokacije-novi-sad/garsonjera/641f8dac72a31d16a80e1074,23 m² ,0.5 soba ,centralno grejanje ,uobičajeno stanje ,prizemlje/3 sprata ,,,,,1039006 ,pre 4 meseca ,37.900,Klisa,"Klisa, Gradske lokacije, Novi Sad","Garsonjera na prodaju, Klisa, 37.900€, 23m² - 4zida",2023-08-21,Stan u zgradi ,uknjiženo ,2018,,,,,,,,,,,
745,https://www.4zida.rs/prodaja-stanova/veternicka-rampa-veternik-gradske-lokacije-novi-sad/cetvoroiposoban-stan/64da303eb77ba0d1d5057ac8,106 m² ,4.5 soba ,,novo ,2/2 sprata ,,,prazno ,"kablovska, internet, interfon, Kanalizacija ",269 ,pre 1 dan ,153.890,Veternička Rampa,"Veternička Rampa, Veternik, Gradske lokacije, Novi Sad","Četvoroiposoban stan na prodaju, Veternička Rampa, 153.890€, 106m² - 4zida",2023-08-21,Stan u zgradi ,,,terasa ,useljivo ,,,,,1 parking mesto ,,,,
746,https://www.4zida.rs/prodaja-stanova/nova-detelinara-detelinara-gradske-lokacije-novi-sad/trosoban-stan/64df35c91901ec101a0c4a63,83 m² ,3 sobe ,centralno grejanje ,uobičajeno stanje ,5/5 spratova ,ima lift (1) ,,,"kablovska, internet, interfon ",1021691 ,pre 2 dana ,128.500,Nova Detelinara,"Nova Detelinara, Detelinara, Gradske lokacije, Novi Sad","Trosoban stan na prodaju, Nova Detelinara, 128.500€, 83m² - 4zida",2023-08-21,Stan u zgradi ,uknjiženo ,2005,terasa ,,,,,,,,,,
747,https://www.4zida.rs/prodaja-stanova/karaburma-palilula-opstina-beograd/garsonjera/64e0be2f43675bbce2092826,20 m² ,0.5 soba ,,renovirano ,4/4 sprata ,,,namešteno ,"interfon, Kanalizacija ",20567 ,pre 1 dan ,55.000,Mirijevski bulevar,"Karaburma, Palilula opština, Beograd","Garsonjera na prodaju, Mirijevski bulevar, 55.000€, 20m² - 4zida",2023-08-21,Stan u zgradi ,uknjiženo ,,podrum ,,,,,,,,,,
748,https://www.4zida.rs/prodaja-stanova/centar-gradske-lokacije-zlatibor/jednoiposoban-stan/64bf73862efa1ff0040b8a5f,,,,,,,,,,,,,,,"Prodaja stanova Centar, Gradske lokacije, Zlatibor - 4zida",2023-08-21,,,,,,,,,,,,,,
749,https://www.4zida.rs/prodaja-stanova/hram-svetog-save-neimar-vracar-beograd/trosoban-stan/64b13e80282af645f5074aff,76 m² ,3 sobe ,centralno grejanje ,,2/6 spratova ,ima lift (1) ,kupatilo ,prazno ,telefon ,123178 ,pre 1 mesec ,306.000,Svetog Save,"Hram Svetog Save, Neimar, Vračar, Beograd","Trosoban stan na prodaju, Svetog Save, 306.000€, 76m² - 4zida",2023-08-21,,uknjiženo ,,terasa ,useljivo ,,,,,,,,,
750,https://www.4zida.rs/prodaja-stanova/mladenovac-centar-mladenovac-opstina-beograd/trosoban-stan/6434617fad4f6abc2f027d89,72 m² ,3 sobe ,TA peć ,,4/4 sprata ,,"kupatila (2), kuhinja ",namešteno ,"telefon, kablovska ",,pre 5 dana ,65.000,Mladenovac centar,"Mladenovac centar, Mladenovac opština, Beograd","Trosoban stan na prodaju, Mladenovac centar, 65.000€, 72m² - 4zida",2023-08-21,Stan u zgradi ,uknjiženo ,2000,,useljivo ,,,,Kablovska ,,,,,
751,https://www.4zida.rs/prodaja-stanova/blok-1-fontana-novi-beograd-beograd/jednoiposoban-stan/64df70f60d6fef116f0a3058,38 m² ,1.5 soba ,centralno grejanje ,uobičajeno stanje ,visoko prizemlje/8 spratova ,ima lift (1) ,,prazno ,"interfon, klima ",2691 ,pre 8 minuta ,93.000,Bulevar Zorana Đinđića,"Blok 1 - Fontana, Novi Beograd, Beograd","Jednoiposoban stan na prodaju, Bulevar Zorana Đinđića, 93.000€, 38m² - 4zida",2023-08-21,Stan u zgradi ,uknjiženo ,,podrum ,,,,,,,,,,
752,https://www.4zida.rs/prodaja-stanova/centar-medijana-gradske-lokacije-nis/jednosoban-stan/64de2092a004f4dc3d07db14,34 m² ,1 soba ,grejanje na struju ,luksuzno ,5/5 spratova ,,"kupatilo, kuhinja ",namešteno ,"TV, klima, kuhinjski elementi ",500041006,pre 3 dana ,70.000,Centar,"Centar, Medijana, Gradske lokacije, Niš","Jednosoban stan na prodaju, Centar, 70.000€, 34m² - 4zida",2023-08-21,Stan u zgradi ,uknjiženo ,,,useljivo ,,,,,,,,,
753,https://www.4zida.rs/prodaja-stanova/bubanj-palilula-gradske-lokacije-nis/trosoban-stan/64d634750a50583e1a08c06c,70 m² ,3 sobe ,TA peć ,uobičajeno stanje ,2. sprat ,,"kupatilo, toalet ",namešteno ,,p,pre 9 dana ,85.000,Milentija Popovića,"Bubanj, Palilula, Gradske lokacije, Niš","Trosoban stan na prodaju, Milentija Popovića, 85.000€, 70m² - 4zida",2023-08-21,,uknjiženo ,,terase (2) ,,,,1 garažno mesto ,,,,,,
754,https://www.4zida.rs/prodaja-stanova/petlovo-brdo-rakovica-opstina-beograd/dvosoban-stan/64d27b8604b3e96e0302caa1,56 m² ,2 sobe ,grejanje na struju ,,prizemlje/1 sprat ,,kupatilo ,prazno ,telefon ,1549 ,pre 12 dana ,135.000,Nićifora Ninkovića,"Petlovo Brdo, Rakovica opština, Beograd","Dvosoban stan na prodaju, Nićifora Ninkovića, 135.000€, 56m² - 4zida",2023-08-21,,uknjiženo ,,terasa ,,,,,,,,,,
755,https://www.4zida.rs/prodaja-stanova/krunski-venac-vracar-beograd/dvosoban-stan/64da1adea8b7819dc40705d2,57 m² ,2 sobe ,grejanje na struju ,,1/5 spratova ,,kupatilo ,prazno ,"telefon, internet, interfon ",3935 ,pre 6 dana ,190.000,Smiljanićeva,"Krunski Venac, Vračar, Beograd","Dvosoban stan na prodaju, Smiljanićeva, 190.000€, 57m² - 4zida",2023-08-21,,uknjiženo ,,terasa ,useljivo ,,,,,,,,,
