,link,Površina,Broj soba,Uknjiženost,Grejanje,Spratnost,Nameštenost,Šifra oglasa,Oglas ažuriran,price,street,address,description,title,end_date,Tip,Stanje,Lift,Garaža,Parking,Infrastruktura,Opremljenost,Useljivo,Unutrašnje prostorije,Internet,Godina izgradnje,Orijentacija nekretnine,Pogled na,Autobuske linije,Tramvajske linije,Trolejbuske linije,Useljivo od
108,https://www.4zida.rs/prodaja-stanova/adice-gradske-lokacije-novi-sad/cetvorosoban-stan/65b26dc5c7298f10c301f2e7,78 m² ,4 sobe ,uknjiženo ,,1/2 sprata ,namešteno ,,pre 3 sata ,159.650,Marije Bursac,"Adice, Gradske lokacije, Novi Sad","<h2 _ngcontent-ng-c3151048826 class=""mat-headline-5"">Opis oglasa</h2><div _ngcontent-ng-c3151048826 class=""prose max-h-64 overflow-hidden text-gray-800 ng-star-inserted""><p>Prodaja cetvorosobnog stana u Telepskoj dolini - Novi Sad. Nekretnina se nalazi u novoj zgradi, odlicna bez ulaganja. Sastoji se od prostranog dnevnog boravka sa kuhinjom, tri spavace sobe, kupatila i dve terase. Stan je uknjizen te je moguca kupovina putem stambenog kredita.U cenu uracunat namestaj. Odlicna nekretnina.","Četvorosoban stan na prodaju, Marije Bursac, 159.650€, 78m² - 4zida",2024-01-26,Stan u zgradi ,novo ,,,,terase (2) ,"telefon, kablovska ",,"kupatilo, kuhinja ",,2020,,,,,,
109,https://www.4zida.rs/prodaja-stanova/centar-gradske-lokacije-vrnjacka-banja/jednosoban-stan/65b2a05e0635fbc01a0a5f1e,37 m² ,1 soba ,uknjiženo ,centralno grejanje ,3/3 sprata ,,,pre 18 sati ,72.000,Centar,"Centar, Gradske lokacije, Vrnjačka Banja","<h2 _ngcontent-ng-c3151048826 class=""mat-headline-5"">Opis oglasa</h2><div _ngcontent-ng-c3151048826 class=""prose max-h-64 overflow-hidden text-gray-800 ng-star-inserted""><p>Prodaje se kompletno opremljen Jednosoban stan u extra stanju , na prelepoj lokaciji , Vredi videti!!!!","Jednosoban stan na prodaju, Centar, 72.000€, 37m² - 4zida",2024-01-26,Stan u zgradi ,,ima lift (1) ,1 garažno mesto ,u dvorištu zgrade ,terasa ,"TV, klima, veš mašina, kuhinjski elementi, sudo mašina, frižider, rerna, ležaj, plakar ",,"kupatilo, kuhinja ",,2010,,,,,,
110,https://www.4zida.rs/prodaja-stanova/karaburma-palilula-opstina-beograd/trosoban-stan/65b3a07ea791815a22045847,97 m² ,3 sobe ,nije uknjiženo ,etažno grejanje ,5/5 spratova ,,87304 ,pre 41 minuta ,130.000,Pere Ćetkovića,"Karaburma, Palilula opština, Beograd","<h2 _ngcontent-ng-c3151048826 class=""mat-headline-5"">Opis oglasa</h2><div _ngcontent-ng-c3151048826 class=""prose max-h-64 overflow-hidden text-gray-800 ng-star-inserted""><p>Stvarna površina-97m2 , ugovorna površina-56.48m2,<br>U osnovi stana dnevna soba,spavaća soba, kupatilo, kuhinja sa trpezarijom i dve terase,u potkrovlju soba 30m2.<br>Stan ima građevinsku i upotrebnu dozovolu, u procesu je uknjižbe.<br>Agencijska provizija koju plaća kupac pri kupovini ove nepokretnosti iznosi 2%  od dogovorene kupoprodajne cene","Trosoban stan na prodaju, Pere Ćetkovića, 130.000€, 97m² - 4zida",2024-01-26,Stan u zgradi ,,,,,terasa ,,useljivo ,,,,,,,,,
111,https://www.4zida.rs/prodaja-stanova/salajka-gradske-lokacije-novi-sad/cetvorosoban-stan/65b2821acd8ad30c74059b45,129 m² ,4 sobe ,,grejanje na gas ,4/4 sprata ,prazno ,219 ,pre 21 sati ,271.320,Salajka,"Salajka, Gradske lokacije, Novi Sad","<h2 _ngcontent-ng-c3151048826 class=""mat-headline-5"">Opis oglasa</h2><div _ngcontent-ng-c3151048826 class=""prose max-h-64 overflow-hidden text-gray-800 ng-star-inserted""><p>Agencijska oznaka 219","Četvorosoban stan na prodaju, Salajka, 271.320€, 129m² - 4zida",2024-01-26,Stan u zgradi ,u izgradnji ,ima lift (1) ,1 garažno mesto ,,terasa ,"kablovska, internet, interfon ",,,,2024,,,,,,
112,https://www.4zida.rs/prodaja-stanova/slatina-gradske-lokacije-vrnjacka-banja/garsonjera/65b37bf69d2ffd724f040c76,33 m² ,0.5 soba ,nije uknjiženo ,grejanje na struju ,2/4 sprata ,namešteno ,,pre 2 sata ,60.000,Slatina,"Slatina, Gradske lokacije, Vrnjačka Banja","<h2 _ngcontent-ng-c3151048826 class=""mat-headline-5"">Opis oglasa</h2><div _ngcontent-ng-c3151048826 class=""prose max-h-64 overflow-hidden text-gray-800 ng-star-inserted""><p>U prodaji je garsonjera u Vrnjačkoj Banji, površine 33m2, na drugom spratu zgrade sa liftom.","Garsonjera na prodaju, Slatina, 60.000€, 33m² - 4zida",2024-01-26,Stan u zgradi ,novo ,ima lift (1) ,,,terasa ,"klima, kuhinjski elementi, frižider, ležaj, plakar ",useljivo ,"kupatilo, kuhinja ",,,,,,,,
113,https://www.4zida.rs/prodaja-stanova/crveni-krst-zvezdara-zvezdara-opstina-beograd/trosoban-stan/65b2288c54d827b1d706614c,108 m² ,3 sobe ,uknjiženo ,grejanje na struju ,2/2 sprata ,namešteno ,,pre 1 dan ,190.000,Pop Stojanova 21,"Crveni Krst Zvezdara, Zvezdara opština, Beograd","<h2 _ngcontent-ng-c3151048826 class=""mat-headline-5"">Opis oglasa</h2><div _ngcontent-ng-c3151048826 class=""prose max-h-64 overflow-hidden text-gray-800 ng-star-inserted""><p>Stan je prostran i veoma osvetljen,idealan za porodicu","Trosoban stan na prodaju, Pop Stojanova 21, 190.000€, 108m² - 4zida",2024-01-26,Stan u zgradi ,renovirano ,,,javni parking u zoni ,"podrum, terasa ","TV, klima, veš mašina, kuhinjski elementi, frižider, zamrzivač, rerna, šporet, ležaj, plakar ",useljivo ,"kupatila (2), toaleti (2), kuhinja, ostava ",Satelitski ,,,ulicu ,83 ,"7, 14 ",21 ,
114,https://www.4zida.rs/prodaja-stanova/kajsijar-gradske-lokacije-jagodina/jednosoban-stan/65b387b163b878c3560ce06e,29 m² ,1 soba ,uknjiženo ,norveški radijatori ,visoko prizemlje/6 spratova ,prazno ,6657 ,pre 2 sata ,38.500,Kajsijar,"Kajsijar, Gradske lokacije, Jagodina","<h2 _ngcontent-ng-c3151048826 class=""mat-headline-5"">Opis oglasa</h2><div _ngcontent-ng-c3151048826 class=""prose max-h-64 overflow-hidden text-gray-800 ng-star-inserted""><p>Samo u Pedja nekretnine.","Jednosoban stan na prodaju, Kajsijar, 38.500€, 29m² - 4zida",2024-01-26,Stan u zgradi ,novo ,ima lift (1) ,,,terasa ,,,kupatilo ,,,,,,,,
