,link,Površina,Broj soba,Uknjiženost,Grejanje,Stanje,Spratnost,Infrastruktura,Nameštenost,Opremljenost,Useljivo,Šifra oglasa,Oglas ažuriran,price,street,address,title,end_date,Tip,Godina izgradnje,Lift,Garaža,Parking,Unutrašnje prostorije,Orijentacija nekretnine,Useljivo od,Pogled na,Autobuske linije,Internet,Tramvajske linije,Trolejbuske linije
0,https://www.4zida.rs/prodaja-stanova/donja-vrezina-pantelej-gradske-lokacije-nis/dvosoban-stan/650d4ef8619f6faa210afa86,47 m² ,2 sobe ,uknjiženo ,centralno grejanje ,renovirano ,1. sprat ,terasa ,prazno ,"kablovska, internet, klima ",useljivo ,10104 ,pre 2 dana ,77.000,Donja Vrežina,"Donja Vrežina, Pantelej, Gradske lokacije, Niš","Dvosoban stan na prodaju, Donja Vrežina, 77.000€, 47m² - 4zida",2023-09-24,,,,,,,,,,,,,
1,https://www.4zida.rs/prodaja-stanova/nova-detelinara-detelinara-gradske-lokacije-novi-sad/cetvorosoban-stan/650d9ff64a425217a60e44a4,96 m² ,4 sobe ,uknjiženo ,centralno grejanje ,uobičajeno stanje ,5/6 spratova ,terasa ,,,,1055286 ,pre 2 dana ,144.200,Nova Detelinara,"Nova Detelinara, Detelinara, Gradske lokacije, Novi Sad","Četvorosoban stan na prodaju, Nova Detelinara, 144.200€, 96m² - 4zida",2023-09-24,Stan u zgradi ,2007,ima lift (1) ,,,,,,,,,,
2,https://www.4zida.rs/prodaja-stanova/centar-gradske-lokacije-zlatibor/dvosoban-stan/647de0ab42ea270ee0020cb5,,,,,,,,,,,,,,,,"Prodaja stanova Centar, Gradske lokacije, Zlatibor - 4zida",2023-09-24,,,,,,,,,,,,,
3,https://www.4zida.rs/prodaja-stanova/prozivka-gradske-lokacije-subotica/trosoban-stan/647de2e842ea270ee0021891,,,,,,,,,,,,,,,,"Prodaja stanova Prozivka, Gradske lokacije, Subotica - 4zida",2023-09-24,,,,,,,,,,,,,
4,https://www.4zida.rs/prodaja-stanova/djurkovac-okolne-lokacije-zlatibor/dvosoban-stan/65087bb9eb45b6c6f60e2556,42 m² ,2 sobe ,uknjiženo ,etažno grejanje ,,,terasa ,namešteno ,"kablovska, interfon, TV, Kanalizacija ",,5844 ,pre 5 dana ,115.000,Breza,"Đurkovac, Okolne lokacije, Zlatibor","Dvosoban stan na prodaju, Breza, 115.000€, 42m² - 4zida",2023-09-24,Stan u zgradi ,,,1 garažno mesto ,1 parking mesto ,kuhinja ,istok ,,,,,,
5,https://www.4zida.rs/prodaja-stanova/blok-64-bezanijski-blokovi-novi-beograd-beograd/garsonjera/64db694d248c921ae500c53d,,,,,,,,,,,,,,,,"Prodaja stanova Blok 64, Bežanijski Blokovi, Novi Beograd, Beograd, Garsonjera - 4zida",2023-09-24,,,,,,,,,,,,,
6,https://www.4zida.rs/prodaja-stanova/bulevar-nemanjica-medijana-gradske-lokacije-nis/dvoiposoban-stan/64fb10958b2d64c753002a0b,65 m² ,2.5 soba ,uknjiženo ,centralno grejanje ,uobičajeno stanje ,2/12 spratova ,"prilaz za invalide, terase (2) ",prazno ,interfon ,,p,pre 16 dana ,115.000,Bulevar Nemanjića,"Bulevar Nemanjića, Medijana, Gradske lokacije, Niš","Dvoiposoban stan na prodaju, Bulevar Nemanjića, 115.000€, 65m² - 4zida",2023-09-24,,,ima lift (1) ,,1 parking mesto ,"kupatilo, toalet ",,,,,,,
7,https://www.4zida.rs/prodaja-stanova/nova-detelinara-detelinara-gradske-lokacije-novi-sad/dvoiposoban-stan/650973c7fc404c97c50dff74,59 m² ,2.5 soba ,uknjiženo ,grejanje na gas ,novo ,3/4 sprata ,terasa ,prazno ,"telefon, kablovska ",,517097 ,pre 5 dana ,151.930,Nova Detelinara,"Nova Detelinara, Detelinara, Gradske lokacije, Novi Sad","Dvoiposoban stan na prodaju, Nova Detelinara, 151.930€, 59m² - 4zida",2023-09-24,Stan u zgradi ,2023,ima lift (1) ,,,,,,,,,,
8,https://www.4zida.rs/prodaja-stanova/blok-58-novi-beograd-beograd/dvosoban-stan/650d9f5a4a425217a60e443f,70 m² ,2 sobe ,nije uknjiženo ,podno grejanje ,novo ,6/10 spratova ,terasa ,,telefon ,,7658 ,pre 2 dana ,262.500,Jurija Gagarina,"Blok 58, Novi Beograd, Beograd","Dvosoban stan na prodaju, Jurija Gagarina, 262.500€, 70m² - 4zida",2023-09-24,Stan u zgradi ,2023,ima lift (1) ,1 garažno mesto ,,,,,,,,,
9,https://www.4zida.rs/prodaja-stanova/blok-58-novi-beograd-beograd/trosoban-stan/650d9f5e4a425217a60e4457,78 m² ,3 sobe ,nije uknjiženo ,podno grejanje ,novo ,9/10 spratova ,terasa ,,telefon ,,7666 ,pre 2 dana ,292.500,Jurija Gagarina,"Blok 58, Novi Beograd, Beograd","Trosoban stan na prodaju, Jurija Gagarina, 292.500€, 78m² - 4zida",2023-09-24,Stan u zgradi ,2023,ima lift (1) ,1 garažno mesto ,,,,,,,,,
10,https://www.4zida.rs/prodaja-stanova/novi-sad-centar-stari-grad-gradske-lokacije-novi-sad/cetvorosoban-stan/650eba79fe0a304e8c03271f,86 m² ,4 sobe ,,centralno grejanje ,,,,,,,72037 ,pre 1 dan ,329.600,ZARKA VASILJEVICA,"Novi Sad - Centar, Stari Grad, Gradske lokacije, Novi Sad","Četvorosoban stan na prodaju, ZARKA VASILJEVICA, 329.600€, 86m² - 4zida",2023-09-24,Stan u zgradi ,,,,,,,,,,,,
11,https://www.4zida.rs/prodaja-stanova/telep-gradske-lokacije-novi-sad/dvoiposoban-stan/65097488ed313cf71006f42a,,,,,,,,,,,,,,,,"Prodaja stanova Telep, Gradske lokacije, Novi Sad - 4zida",2023-09-24,,,,,,,,,,,,,
12,https://www.4zida.rs/prodaja-stanova/gornji-grad-zemun-zemun-opstina-beograd/dvosoban-stan/65030b0b3b9f9a600f02beaf,62 m² ,2 sobe ,uknjiženo ,centralno grejanje ,novo ,prizemlje/3 sprata ,terasa ,namešteno ,"telefon, kablovska, internet, interfon, klima ",useljivo ,1351 ,pre 10 dana ,98.000,Slavonska,"Gornji Grad, Zemun, Zemun opština, Beograd","Dvosoban stan na prodaju, Slavonska, 98.000€, 62m² - 4zida",2023-09-24,,2023,,,,kupatilo ,,,,,,,
13,https://www.4zida.rs/prodaja-stanova/selenca-gradske-lokacije-sombor/trosoban-stan/65032dcc19bc3e8c02065495,75 m² ,3 sobe ,uknjiženo ,centralno grejanje ,,5/5 spratova ,,namešteno ,"interfon, klima ",useljivo ,,pre 9 dana ,59.000,Slaviše Vajnera Čiče,"Selenča, Gradske lokacije, Sombor","Trosoban stan na prodaju, Slaviše Vajnera Čiče, 59.000€, 75m² - 4zida",2023-09-24,Stan u zgradi ,,ima lift (1) ,,1 parking mesto ,kupatilo ,,,,,,,
14,https://www.4zida.rs/prodaja-stanova/zeleznicki-park-banatic-gradske-lokacije-novi-sad/jednoiposoban-stan/650d9c654a47da6c1d010e9b,36 m² ,1.5 soba ,uknjiženo ,centralno grejanje ,uobičajeno stanje ,5/5 spratova ,,namešteno ,"klima, veš mašina, kuhinjski elementi, ležaj, plakar ",useljivo ,,pre 2 dana ,97.850,Železnički Park,"Železnički Park, Banatić, Gradske lokacije, Novi Sad","Jednoiposoban stan na prodaju, Železnički Park, 97.850€, 36m² - 4zida",2023-09-24,Stan u zgradi ,,ima lift (1) ,,,"kupatilo, kuhinja, ostava ",,,,,,,
15,https://www.4zida.rs/prodaja-stanova/blok-58-novi-beograd-beograd/trosoban-stan/650d9f604a425217a60e4460,84 m² ,3 sobe ,nije uknjiženo ,podno grejanje ,novo ,4/10 spratova ,terasa ,,telefon ,,7669 ,pre 2 dana ,315.000,Jurija Gagarina,"Blok 58, Novi Beograd, Beograd","Trosoban stan na prodaju, Jurija Gagarina, 315.000€, 84m² - 4zida",2023-09-24,Stan u zgradi ,2023,ima lift (1) ,1 garažno mesto ,,,,,,,,,
16,https://www.4zida.rs/prodaja-stanova/hram-svetog-save-neimar-vracar-beograd/cetvoroiposoban-stan/64f1e1b81402b6705500a956,198 m² ,4.5 soba ,uknjiženo ,centralno grejanje ,,5/6 spratova ,terasa ,prazno ,Kanalizacija ,,20601 ,pre 1 dan ,700.000,Nebojšina,"Hram Svetog Save, Neimar, Vračar, Beograd","Četvoroiposoban stan na prodaju, Nebojšina, 700.000€, 198m² - 4zida",2023-09-24,Stan u zgradi ,,ima lift (1) ,1 garažno mesto ,,,,,,,,,
17,https://www.4zida.rs/prodaja-stanova/telep-gradske-lokacije-novi-sad/dvosoban-stan/64f8c30a8dd00f83950abf63,51 m² ,2 sobe ,uknjiženo ,centralno grejanje ,,,,prazno ,"kablovska, internet, klima, veš mašina, frižider, Kanalizacija ",,1552 ,pre 17 dana ,113.300,Telep,"Telep, Gradske lokacije, Novi Sad","Dvosoban stan na prodaju, Telep, 113.300€, 51m² - 4zida",2023-09-24,Stan u zgradi ,,ima lift (1) ,,,kuhinja ,,,,,,,
18,https://www.4zida.rs/prodaja-stanova/vozdovacka-crkva-vozdovac-opstina-beograd/cetvoroiposoban-stan/6467bea19fcf37fd370992b0,92 m² ,4.5 soba ,uknjiženo ,centralno grejanje ,uobičajeno stanje ,7/11 spratova ,lođa ,,interfon ,useljivo ,8399 ,pre 3 dana ,207.000,Vojvode Stepe,"Voždovačka crkva, Voždovac opština, Beograd","Četvoroiposoban stan na prodaju, Vojvode Stepe, 207.000€, 92m² - 4zida",2023-09-24,,,ima lift (2) ,,,,,,,,,,
19,https://www.4zida.rs/prodaja-stanova/blok-64-bezanijski-blokovi-novi-beograd-beograd/jednoiposoban-stan/64db695f248c921ae500c599,,,,,,,,,,,,,,,,"Prodaja stanova Blok 64, Bežanijski Blokovi, Novi Beograd, Beograd - 4zida",2023-09-24,,,,,,,,,,,,,
20,https://www.4zida.rs/prodaja-stanova/bistrica-novo-naselje-gradske-lokacije-novi-sad/dvosoban-stan/6500281cba19acced00b7528,46 m² ,2 sobe ,uknjiženo ,centralno grejanje ,,4/4 sprata ,terasa ,namešteno ,,,42440 ,pre 11 dana ,92.700,Vladike Ćirića,"Bistrica, Novo Naselje, Gradske lokacije, Novi Sad","Dvosoban stan na prodaju, Vladike Ćirića, 92.700€, 46m² - 4zida",2023-09-24,Stan u zgradi ,,,,1 parking mesto ,kupatilo ,,,,,,,
21,https://www.4zida.rs/prodaja-stanova/julino-brdo-cukarica-cukarica-opstina-beograd/dvoiposoban-stan/64f5afe3b19b138db80970db,77 m² ,2.5 soba ,uknjiženo ,centralno grejanje ,,5/6 spratova ,"terasa, lođa ",prazno ,telefon ,,18048 ,pre 3 dana ,154.360,Marine Veličković,"Julino Brdo, Čukarica, Čukarica opština, Beograd","Dvoiposoban stan na prodaju, Marine Veličković, 154.360€, 77m² - 4zida",2023-09-24,,,ima lift (1) ,,1 parking mesto ,kupatilo ,,,,,,,
22,https://www.4zida.rs/prodaja-stanova/detelinara-gradske-lokacije-novi-sad/dvosoban-stan/650d5d9c0e83febf3d0d746d,53 m² ,2 sobe ,uknjiženo ,centralno grejanje ,uobičajeno stanje ,8/12 spratova ,terasa ,prazno ,telefon ,useljivo ,6165 ,pre 2 dana ,90.080,Veselina Masleše,"Detelinara, Gradske lokacije, Novi Sad","Dvosoban stan na prodaju, Veselina Masleše, 90.080€, 53m² - 4zida",2023-09-24,,,ima lift (1) ,,,kupatilo ,,,,,,,
23,https://www.4zida.rs/prodaja-stanova/donja-vrezina-pantelej-gradske-lokacije-nis/dvoiposoban-stan/650ac91b8029ce69870839eb,60 m² ,2.5 soba ,nije uknjiženo ,grejanje na struju ,u izgradnji ,visoko prizemlje/3 sprata ,terasa ,prazno ,,,500041006,pre 4 dana ,80.500,Donja Vrežina,"Donja Vrežina, Pantelej, Gradske lokacije, Niš","Dvoiposoban stan na prodaju, Donja Vrežina, 80.500€, 60m² - 4zida",2023-09-24,Stan u zgradi ,,,,1 parking mesto ,kupatilo ,,01.06.2024 ,,,,,
24,https://www.4zida.rs/prodaja-stanova/cair-medijana-gradske-lokacije-nis/troiposoban-stan/650c3f03db2648729900f862,,,,,,,,,,,,,,,,"Prodaja stanova Čair, Medijana, Gradske lokacije, Niš - 4zida",2023-09-24,,,,,,,,,,,,,
25,https://www.4zida.rs/prodaja-stanova/kumodraz-2-kumodraz-vozdovac-opstina-beograd/jednosoban-stan/650dc43f2edd675dd402aa67,30 m² ,1 soba ,uknjiženo ,etažno grejanje ,renovirano ,2/3 sprata ,lođa ,namešteno ,"kablovska, TV, klima, veš mašina, kuhinjski elementi, frižider, zamrzivač, rerna, šporet, ležaj, plakar ",,,pre 1 dan ,59.000,Bagremova 1,"Kumodraž 2, Kumodraž, Voždovac opština, Beograd","Jednosoban stan na prodaju, Bagremova 1, 59.000€, 30m² - 4zida",2023-09-24,Stan u zgradi ,2010,,,,"kupatilo, kuhinja ","zapad, jug ",,dvorište ,"25, 39, 25P ",Kablovska ,,
26,https://www.4zida.rs/prodaja-stanova/sneznik-gradske-lokacije-vrnjacka-banja/garsonjera/650ac9b9805832baaf0430bd,21 m² ,0.5 soba ,u procesu uknjižavanja ,grejanje na struju ,u izgradnji ,,,,,,,pre 4 dana ,41.553,Snežnik,"Snežnik, Gradske lokacije, Vrnjačka Banja","Garsonjera na prodaju, Snežnik, 41.553€, 21m² - 4zida",2023-09-24,Stan u zgradi ,,ima lift (1) ,,,,,,,,,,
27,https://www.4zida.rs/prodaja-stanova/blok-58-novi-beograd-beograd/cetvorosoban-stan/650d9f644a425217a60e4478,113 m² ,4 sobe ,nije uknjiženo ,podno grejanje ,novo ,3/10 spratova ,terasa ,,telefon ,,7677 ,pre 2 dana ,423.750,Jurija Gagarina,"Blok 58, Novi Beograd, Beograd","Četvorosoban stan na prodaju, Jurija Gagarina, 423.750€, 113m² - 4zida",2023-09-24,Stan u zgradi ,2023,ima lift (1) ,1 garažno mesto ,,,,,,,,,
28,https://www.4zida.rs/prodaja-stanova/vikend-naselje-okolne-lokacije-kopaonik/jednoiposoban-stan/647de2d442ea270ee0021776,,,,,,,,,,,,,,,,"Prodaja stanova Vikend naselje, Okolne lokacije, Kopaonik - 4zida",2023-09-24,,,,,,,,,,,,,
29,https://www.4zida.rs/prodaja-stanova/novi-zeleznik-cukarica-cukarica-opstina-beograd/troiposoban-stan/64f755e67a2e82076b0d8ee8,63 m² ,3.5 soba ,uknjiženo ,TA peć ,potrebno renoviranje ,prizemlje/2 sprata ,terasa ,polunamešteno ,,useljivo ,8215 ,pre 18 dana ,65.000,Vlade Aksentijevića,"Novi Železnik, Čukarica, Čukarica opština, Beograd","Troiposoban stan na prodaju, Vlade Aksentijevića, 65.000€, 63m² - 4zida",2023-09-24,,,,,,,,,,,,,
30,https://www.4zida.rs/prodaja-stanova/sumice-vozdovac-opstina-beograd/jednosoban-stan/64f86c31f2d67064930f7cf8,34 m² ,1 soba ,uknjiženo ,centralno grejanje ,,5/10 spratova ,podrum ,,telefon ,useljivo ,2736 ,pre 18 dana ,85.000,LJERMONTOVLJEVA,"Šumice, Voždovac opština, Beograd","Jednosoban stan na prodaju, LJERMONTOVLJEVA, 85.000€, 34m² - 4zida",2023-09-24,Stan u zgradi ,1975,ima lift (1) ,,,,,,,,,,
31,https://www.4zida.rs/prodaja-stanova/blok-64-bezanijski-blokovi-novi-beograd-beograd/jednoiposoban-stan/64db5b324afa93e86a052f51,,,,,,,,,,,,,,,,"Prodaja stanova Blok 64, Bežanijski Blokovi, Novi Beograd, Beograd - 4zida",2023-09-24,,,,,,,,,,,,,
32,https://www.4zida.rs/prodaja-stanova/nova-detelinara-detelinara-gradske-lokacije-novi-sad/jednoiposoban-stan/650dbe1bf48c988f7f0dab7b,39 m² ,1.5 soba ,uknjiženo ,centralno grejanje ,,4/6 spratova ,terasa ,,klima ,useljivo ,101829 ,pre 1 dan ,110.000,Veselina Masleše,"Nova Detelinara, Detelinara, Gradske lokacije, Novi Sad","Jednoiposoban stan na prodaju, Veselina Masleše, 110.000€, 39m² - 4zida",2023-09-24,Stan u zgradi ,,ima lift (1) ,,,,,,,,,,
33,https://www.4zida.rs/prodaja-stanova/cvetanova-cuprija-zvezdara-opstina-beograd/jednoiposoban-stan/650dd7d41115b336250bd7a8,40 m² ,1.5 soba ,,etažno grejanje ,novo ,4/4 sprata ,terasa ,,,useljivo ,3472 ,pre 1 dan ,72.000,Cvetanova ćuprija,"Cvetanova Ćuprija, Zvezdara opština, Beograd","Jednoiposoban stan na prodaju, Cvetanova ćuprija, 72.000€, 40m² - 4zida",2023-09-24,Stan u zgradi ,2023,ima lift (1) ,,,,,,,,,,
34,https://www.4zida.rs/prodaja-stanova/nova-detelinara-detelinara-gradske-lokacije-novi-sad/dvoiposoban-stan/650ec88173a357863407a85c,50 m² ,2.5 soba ,,centralno grejanje ,,,,,,,72700 ,pre 1 dan ,133.990,VESELINA MASLESE,"Nova Detelinara, Detelinara, Gradske lokacije, Novi Sad","Dvoiposoban stan na prodaju, VESELINA MASLESE, 133.990€, 50m² - 4zida",2023-09-24,Stan u zgradi ,,,,,,,,,,,,
35,https://www.4zida.rs/prodaja-stanova/avijaticarsko-naselje-gradske-lokacije-novi-sad/cetvorosoban-stan/647de03842ea270ee00208ba,,,,,,,,,,,,,,,,"Prodaja stanova Avijatičarsko Naselje, Gradske lokacije, Novi Sad - 4zida",2023-09-24,,,,,,,,,,,,,
36,https://www.4zida.rs/prodaja-stanova/blok-58-novi-beograd-beograd/trosoban-stan/650d9f604a425217a60e4463,84 m² ,3 sobe ,nije uknjiženo ,podno grejanje ,novo ,6/10 spratova ,terasa ,,telefon ,,7670 ,pre 2 dana ,315.000,Jurija Gagarina,"Blok 58, Novi Beograd, Beograd","Trosoban stan na prodaju, Jurija Gagarina, 315.000€, 84m² - 4zida",2023-09-24,Stan u zgradi ,2023,ima lift (1) ,1 garažno mesto ,,,,,,,,,
37,https://www.4zida.rs/prodaja-stanova/donji-dorcol-dorcol-stari-grad-opstina-beograd/trosoban-stan/65084e2e3550057c950e96a8,66 m² ,3 sobe ,uknjiženo ,centralno grejanje ,,1/5 spratova ,,prazno ,interfon ,,42724 ,pre 6 dana ,315.000,Carigradska,"Donji Dorćol, Dorćol, Stari Grad opština, Beograd","Trosoban stan na prodaju, Carigradska, 315.000€, 66m² - 4zida",2023-09-24,,,ima lift (1) ,,,kupatilo ,,,,,,,
38,https://www.4zida.rs/prodaja-stanova/gradske-lokacije-vrnjacka-banja/jednosoban-stan/65030c1077e4964eb20e4448,60 m² ,1 soba ,uknjiženo ,,novo ,,terasa ,,klima ,,,pre 1 dan ,76.000,Gradske lokacije,"Gradske lokacije, Vrnjačka Banja","Jednosoban stan na prodaju, Gradske lokacije, 76.000€, 60m² - 4zida",2023-09-24,Stan u zgradi ,,,,,kupatilo ,,,,,,,
39,https://www.4zida.rs/prodaja-stanova/novi-sad-centar-stari-grad-gradske-lokacije-novi-sad/dvoiposoban-stan/6510276ba36dcef23d0c2f88,80 m² ,2.5 soba ,uknjiženo ,centralno grejanje ,,2/2 sprata ,terasa ,prazno ,"telefon, kablovska, klima, veš mašina, kuhinjski elementi ",useljivo ,,pre 2 sata ,204.000,Laze Telečkog 7,"Novi Sad - Centar, Stari Grad, Gradske lokacije, Novi Sad","Dvoiposoban stan na prodaju, Laze Telečkog 7, 204.000€, 80m² - 4zida",2023-09-24,Salonac ,,,,,"kupatilo, kuhinja, ostava ",,,,,,,
40,https://www.4zida.rs/prodaja-stanova/salajka-gradske-lokacije-novi-sad/jednoiposoban-stan/647de2bc42ea270ee002162d,,,,,,,,,,,,,,,,"Prodaja stanova Salajka, Gradske lokacije, Novi Sad - 4zida",2023-09-24,,,,,,,,,,,,,
41,https://www.4zida.rs/prodaja-stanova/cigota-okolne-lokacije-zlatibor/jednosoban-stan/647de1ca42ea270ee0020e21,,,,,,,,,,,,,,,,"Prodaja stanova Čigota, Okolne lokacije, Zlatibor - 4zida",2023-09-24,,,,,,,,,,,,,
42,https://www.4zida.rs/prodaja-stanova/avijaticarsko-naselje-gradske-lokacije-novi-sad/trosoban-stan/647de06a42ea270ee0020a2d,,,,,,,,,,,,,,,,"Prodaja stanova Avijatičarsko Naselje, Gradske lokacije, Novi Sad - 4zida",2023-09-24,,,,,,,,,,,,,
43,https://www.4zida.rs/prodaja-stanova/labudovo-brdo-rakovica-opstina-beograd/troiposoban-stan/650df4ab00485b27f60e7388,89 m² ,3.5 soba ,uknjiženo ,centralno grejanje ,uobičajeno stanje ,2/10 spratova ,"podrum, terasa ",prazno ,telefon ,useljivo ,3216 ,pre 1 dan ,200.000,11. krajiške divizije,"Labudovo Brdo, Rakovica opština, Beograd","Troiposoban stan na prodaju, 11. krajiške divizije, 200.000€, 89m² - 4zida",2023-09-24,,,ima lift (1) ,,1 parking mesto ,kupatila (2) ,,,,,,,
44,https://www.4zida.rs/prodaja-stanova/divcibare-okolne-lokacije-valjevo/jednoiposoban-stan/647de28a42ea270ee00213a2,,,,,,,,,,,,,,,,"Prodaja stanova Divčibare, Okolne lokacije, Valjevo - 4zida",2023-09-24,,,,,,,,,,,,,
45,https://www.4zida.rs/prodaja-stanova/vracar-beograd/cetvorosoban-stan/650cb399c80a48abf3092534,63 m² ,4 sobe ,uknjiženo ,grejanje na struju ,uobičajeno stanje ,5/5 spratova ,terasa ,,,useljivo ,9060 ,pre 2 dana ,250.000,Kneza od Semberije,"Vračar, Beograd","Četvorosoban stan na prodaju, Kneza od Semberije, 250.000€, 63m² - 4zida",2023-09-24,,,,,,,,,,,,,
46,https://www.4zida.rs/prodaja-stanova/vojvode-stepe-vozdovac-opstina-beograd/dvosoban-stan/647de2ea42ea270ee00218a9,,,,,,,,,,,,,,,,"Prodaja stanova Vojvode Stepe, Voždovac opština, Beograd - 4zida",2023-09-24,,,,,,,,,,,,,
47,https://www.4zida.rs/prodaja-stanova/telep-gradske-lokacije-novi-sad/cetvorosoban-stan/650ad4163ee3c74dce00d1d5,,,,,,,,,,,,,,,,"Prodaja stanova Telep, Gradske lokacije, Novi Sad - 4zida",2023-09-24,,,,,,,,,,,,,
48,https://www.4zida.rs/prodaja-stanova/avijaticarsko-naselje-gradske-lokacije-novi-sad/dvosoban-stan/647de07342ea270ee0020a58,,,,,,,,,,,,,,,,"Prodaja stanova Avijatičarsko Naselje, Gradske lokacije, Novi Sad - 4zida",2023-09-24,,,,,,,,,,,,,
49,https://www.4zida.rs/prodaja-stanova/misa-gradske-lokacije-pancevo/jednosoban-stan/64cca284f21c322d6e02bf5d,,,,,,,,,,,,,,,,"Prodaja stanova Misa, Gradske lokacije, Pančevo - 4zida",2023-09-24,,,,,,,,,,,,,
50,https://www.4zida.rs/prodaja-stanova/socijalno-rotkvarija-gradske-lokacije-novi-sad/trosoban-stan/64f60bc525ec9e766e0a87aa,75 m² ,3 sobe ,uknjiženo ,centralno grejanje ,uobičajeno stanje ,2/10 spratova ,terasa ,,,useljivo ,,pre 19 dana ,163.000,Socijalno,"Socijalno, Rotkvarija, Gradske lokacije, Novi Sad","Trosoban stan na prodaju, Socijalno, 163.000€, 75m² - 4zida",2023-09-24,Stan u zgradi ,,,,,,,,,,,,
51,https://www.4zida.rs/prodaja-stanova/hram-svetog-save-neimar-vracar-beograd/dvosoban-stan/650da0c44a425217a60e44e7,186 m² ,2 sobe ,,centralno grejanje ,novo ,4/4 sprata ,,prazno ,"telefon, internet, interfon ",useljivo ,6108 ,pre 2 dana ,696.000,Dubljanska,"Hram Svetog Save, Neimar, Vračar, Beograd","Dvosoban stan na prodaju, Dubljanska, 696.000€, 186m² - 4zida",2023-09-24,,,,,,kupatilo ,,,,,,,
52,https://www.4zida.rs/prodaja-stanova/filmski-grad-cukarica-cukarica-opstina-beograd/cetvorosoban-stan/650ecb3873a357863407a8db,99 m² ,4 sobe ,uknjiženo ,TA peć ,renovirano ,1/1 sprat ,terasa ,prazno ,"telefon, kablovska, internet, klima ",useljivo ,67456 ,pre 1 dan ,140.000,Veljka Petrovića,"Filmski Grad, Čukarica, Čukarica opština, Beograd","Četvorosoban stan na prodaju, Veljka Petrovića, 140.000€, 99m² - 4zida",2023-09-24,,,,,,kupatila (2) ,,,,,,,
53,https://www.4zida.rs/prodaja-stanova/satelit-novo-naselje-gradske-lokacije-novi-sad/garsonjera/650c88f91ad51d6745072be3,25 m² ,0.5 soba ,uknjiženo ,centralno grejanje ,renovirano ,3/3 sprata ,,namešteno ,,useljivo ,517264 ,pre 2 dana ,47.740,Satelit,"Satelit, Novo Naselje, Gradske lokacije, Novi Sad","Garsonjera na prodaju, Satelit, 47.740€, 25m² - 4zida",2023-09-24,Stan u zgradi ,,,,,"kupatilo, kuhinja ",,,,,,,
54,https://www.4zida.rs/prodaja-stanova/bulevar-evrope-gradske-lokacije-novi-sad/dvosoban-stan/64f8456e906b5c31ba04adc9,,,,,,,,,,,,,,,,"Prodaja stanova Bulevar Evrope, Gradske lokacije, Novi Sad - 4zida",2023-09-24,,,,,,,,,,,,,
55,https://www.4zida.rs/prodaja-stanova/adice-gradske-lokacije-novi-sad/troiposoban-stan/65081a787807ba87b10caa4c,69 m² ,3.5 soba ,uknjiženo ,grejanje na gas ,,1/2 sprata ,terase (2) ,,"telefon, kablovska ",,516940 ,pre 6 dana ,110.000,Adice,"Adice, Gradske lokacije, Novi Sad","Troiposoban stan na prodaju, Adice, 110.000€, 69m² - 4zida",2023-09-24,Stan u zgradi ,,,,javni parking van zone ,kupatilo ,,,,,,,
56,https://www.4zida.rs/prodaja-stanova/centar-stari-grad-gradske-lokacije-kragujevac/jednosoban-stan/647de02542ea270ee00207a4,,,,,,,,,,,,,,,,"Prodaja stanova Centar, Stari Grad, Gradske lokacije, Kragujevac - 4zida",2023-09-24,,,,,,,,,,,,,
57,https://www.4zida.rs/prodaja-stanova/radnicko-naselje-gradske-lokacije-leskovac/jednosoban-stan/64f03ba38176dfeca90d1bbd,33 m² ,1 soba ,uknjiženo ,grejanje na struju ,,4/7 spratova ,"podrum, terasa ",polunamešteno ,"kablovska, klima, kuhinjski elementi, plakar ",useljivo ,,pre 23 dana ,29.000,Radničko Naselje,"Radničko Naselje, Gradske lokacije, Leskovac","Jednosoban stan na prodaju, Radničko Naselje, 29.000€, 33m² - 4zida",2023-09-24,Stan u zgradi ,1980,,,javni parking u zoni ,"kupatilo, toalet, kuhinja, ostava ",jugoistok ,,ulicu ,,,,
58,https://www.4zida.rs/prodaja-stanova/telep-gradske-lokacije-novi-sad/jednoiposoban-stan/6509748aed313cf71006f445,,,,,,,,,,,,,,,,"Prodaja stanova Telep, Gradske lokacije, Novi Sad - 4zida",2023-09-24,,,,,,,,,,,,,
59,https://www.4zida.rs/prodaja-stanova/futoski-put-gradske-lokacije-novi-sad/cetvorosoban-stan/64d2049fb9cfd4a5e005c72d,,,,,,,,,,,,,,,,"Prodaja stanova Futoški Put, Gradske lokacije, Novi Sad - 4zida",2023-09-24,,,,,,,,,,,,,
60,https://www.4zida.rs/prodaja-stanova/mala-vaga-centar-gradske-lokacije-kragujevac/trosoban-stan/650d6afe636ed914380e9fda,77 m² ,3 sobe ,uknjiženo ,centralno grejanje ,novo ,,lođa ,prazno ,,useljivo ,,pre 2 dana ,77.000,Mala Vaga,"Mala Vaga, Centar, Gradske lokacije, Kragujevac","Trosoban stan na prodaju, Mala Vaga, 77.000€, 77m² - 4zida",2023-09-24,Stan u zgradi ,,,,,"kupatilo, toalet, kuhinja ",,,,,,,
61,https://www.4zida.rs/prodaja-stanova/nova-detelinara-detelinara-gradske-lokacije-novi-sad/dvosoban-stan/650d7af60af28e27b504ce4c,45 m² ,2 sobe ,uknjiženo ,centralno grejanje ,,4/5 spratova ,terasa ,prazno ,,,516333 ,pre 2 dana ,118.450,cankareva,"Nova Detelinara, Detelinara, Gradske lokacije, Novi Sad","Dvosoban stan na prodaju, cankareva, 118.450€, 45m² - 4zida",2023-09-24,Stan u zgradi ,,ima lift (1) ,,,kupatilo ,,,,,,,
62,https://www.4zida.rs/prodaja-stanova/brzece-okolne-lokacije-kopaonik/dvosoban-stan/65101f346dee0e940608c4f6,37 m² ,2 sobe ,uknjiženo ,etažno grejanje ,novo ,1/4 sprata ,"prilaz za invalide, dvorište, recepcija ",namešteno ,"kablovska, internet, TV, kuhinjski elementi, frižider, rerna, ležaj, plakar ",useljivo ,,pre 3 sata ,81.400,Mramorska,"Brzeće, Okolne lokacije, Kopaonik","Dvosoban stan na prodaju, Mramorska, 81.400€, 37m² - 4zida",2023-09-24,Apartman ,2010,ima lift (1) ,,u dvorištu zgrade ,"kupatilo, kuhinja ",istok ,,dvorište ,,Kablovska ,,
63,https://www.4zida.rs/prodaja-stanova/centar-gradske-lokacije-zlatibor/dvosoban-stan/647de0ac42ea270ee0020cbb,,,,,,,,,,,,,,,,"Prodaja stanova Centar, Gradske lokacije, Zlatibor - 4zida",2023-09-24,,,,,,,,,,,,,
64,https://www.4zida.rs/prodaja-stanova/bajnat-gradske-lokacije-subotica/trosoban-stan/64f027b989490754340ebaf8,61 m² ,3 sobe ,u procesu uknjižavanja ,grejanje na gas ,novo ,3/5 spratova ,terasa ,prazno ,klima ,,nema ,pre 2 dana ,82.350,Bajnat,"Bajnat, Gradske lokacije, Subotica","Trosoban stan na prodaju, Bajnat, 82.350€, 61m² - 4zida",2023-09-24,Stan u zgradi ,2020,ima lift (1) ,,javni parking van zone ,"kupatilo, toalet, kuhinja, ostava ",istok ,01.10.2023 ,ulicu ,ima ,Optički ,nema ,nema 
65,https://www.4zida.rs/prodaja-stanova/blok-64-bezanijski-blokovi-novi-beograd-beograd/troiposoban-stan/64db5b2c4afa93e86a052f23,,,,,,,,,,,,,,,,"Prodaja stanova Blok 64, Bežanijski Blokovi, Novi Beograd, Beograd - 4zida",2023-09-24,,,,,,,,,,,,,
66,https://www.4zida.rs/prodaja-stanova/bulbulder-zvezdara-opstina-beograd/trosoban-stan/64f86b3af2d67064930f7cbd,75 m² ,3 sobe ,uknjiženo ,centralno grejanje ,novo ,prizemlje/4 sprata ,,prazno ,"telefon, kablovska, internet, interfon ",useljivo ,8178 ,pre 18 dana ,139.000,Svetog Nikole,"Bulbulder, Zvezdara opština, Beograd","Trosoban stan na prodaju, Svetog Nikole, 139.000€, 75m² - 4zida",2023-09-24,,2013,,,,kupatilo ,,,,,,,
67,https://www.4zida.rs/prodaja-stanova/veternicka-rampa-veternik-gradske-lokacije-novi-sad/garsonjera/6501d0b0e85485522f015bfa,13 m² ,0.5 soba ,u procesu uknjižavanja ,,u izgradnji ,prizemlje/2 sprata ,,prazno ,,,,pre 10 dana ,32.960,Veternička Rampa,"Veternička Rampa, Veternik, Gradske lokacije, Novi Sad","Garsonjera na prodaju, Veternička Rampa, 32.960€, 13m² - 4zida",2023-09-24,Stan u zgradi ,,,,,,,15.04.2024 ,,,,,
