,link,title,end_date,Površina,Broj soba,Uknjiženost,Grejanje,Stanje,Godina izgradnje,Spratnost,Parking,Infrastruktura,Unutrašnje prostorije,Nameštenost,Opremljenost,Useljivo,Šifra oglasa,Oglas ažuriran,price,street,address,Tip,Lift,Garaža,Orijentacija nekretnine,Pogled na,Internet,Autobuske linije,Useljivo od,Tramvajske linije,Trolejbuske linije
720,https://www.4zida.rs/prodaja-stanova/adice-gradske-lokacije-novi-sad/garsonjera/64e5dbab146172044c065e60,"Garsonjera na prodaju, Adice, 41.750€, 27m² - 4zida",2023-08-29,27 m² ,0.5 soba ,,grejanje na gas ,,2024,visoko prizemlje/2 sprata ,,terasa ,,,,,1047314 ,pre 6 dana ,41.750,Adice,"Adice, Gradske lokacije, Novi Sad",,,,,,,,,,
721,https://www.4zida.rs/prodaja-stanova/tatarsko-brdo-sremska-kamenica-gradske-lokacije-novi-sad/cetvorosoban-stan/64e79d4f1b637ad17708f418,"Četvorosoban stan na prodaju, Tatarsko Brdo, 169.300€, 106m² - 4zida",2023-08-29,106 m² ,4 sobe ,uknjiženo ,,u izgradnji ,2023,1/1 sprat ,,terasa ,,,,,1026963 ,pre 5 dana ,169.300,Tatarsko Brdo,"Tatarsko Brdo, Sremska Kamenica, Gradske lokacije, Novi Sad",Stan u zgradi ,,,,,,,,,
722,https://www.4zida.rs/prodaja-stanova/bulevar-evrope-gradske-lokacije-novi-sad/jednoiposoban-stan/64edefa4b218680575010cd2,"Jednoiposoban stan na prodaju, Bulevar Evrope, 123.600€, 49m² - 4zida",2023-08-29,49 m² ,1.5 soba ,uknjiženo ,,u izgradnji ,2016,1/6 spratova ,,terasa ,,,,,1096473 ,pre 6 sati ,123.600,Bulevar Evrope,"Bulevar Evrope, Gradske lokacije, Novi Sad",Stan u zgradi ,ima lift (1) ,,,,,,,,
723,https://www.4zida.rs/prodaja-stanova/telep-gradske-lokacije-novi-sad/dvosoban-stan/64e7d5271adead01460db9aa,"Dvosoban stan na prodaju, Telep, 95.500€, 39m² - 4zida",2023-08-29,39 m² ,2 sobe ,,etažno grejanje ,u izgradnji ,2022,prizemlje/4 sprata ,,terasa ,,,,,1040044 ,pre 4 dana ,95.500,Telep,"Telep, Gradske lokacije, Novi Sad",Stan u zgradi ,ima lift (1) ,,,,,,,,
724,https://www.4zida.rs/prodaja-stanova/radijalac-gradske-lokacije-subotica/trosoban-stan/647de29742ea270ee002143e,"Prodaja stanova Radijalac, Gradske lokacije, Subotica - 4zida",2023-08-29,,,,,,,,,,,,,,,,,,,,,,,,,,,,
725,https://www.4zida.rs/prodaja-stanova/rujno-okolne-lokacije-zlatibor/jednosoban-stan/64ecdedf1fbce6c22e0a1f91,"Jednosoban stan na prodaju, Bele Vode 01, 56.266€, 40m² - 4zida",2023-08-29,40 m² ,1 soba ,uknjiženo ,grejanje na struju ,novo ,2020,prizemlje/3 sprata ,,dvorište ,"kupatilo, kuhinja, ostava ",namešteno ,"telefon, kablovska, kuhinjski elementi, frižider, zamrzivač, rerna, šporet, ležaj, plakar, ugradni plakar ",,,pre 1 dan ,56.266,Bele Vode 01,"Rujno, Okolne lokacije, Zlatibor",Stan u zgradi ,,1 garažno mesto ,jug ,dvorište ,Optički ,,28.08.2023 ,,
726,https://www.4zida.rs/prodaja-stanova/bajnat-gradske-lokacije-subotica/trosoban-stan/64e75fda92a12bc3890e7f5f,"Trosoban stan na prodaju, Šolohova, 78.750€, 63m² - 4zida",2023-08-29,63 m² ,3 sobe ,u procesu uknjižavanja ,grejanje na gas ,novo ,,2/5 spratova ,,terasa ,kupatilo ,prazno ,,,S,pre 5 dana ,78.750,Šolohova,"Bajnat, Gradske lokacije, Subotica",Stan u zgradi ,ima lift (1) ,,,,,,,,
727,https://www.4zida.rs/prodaja-stanova/delta-bulevar-nemanjica-medijana-gradske-lokacije-nis/cetvorosoban-stan/647de1a942ea270ee0020d69,"Prodaja stanova Delta, Bulevar Nemanjića, Medijana, Gradske lokacije, Niš - 4zida",2023-08-29,,,,,,,,,,,,,,,,,,,,,,,,,,,,
728,https://www.4zida.rs/prodaja-stanova/gradske-lokacije-vrnjacka-banja/dvosoban-stan/64e89ef4c3b6bca8de0fa043,"Dvosoban stan na prodaju, Gradske lokacije, 88.500€, 58m² - 4zida",2023-08-29,58 m² ,2 sobe ,uknjiženo ,,novo ,,,,,kupatilo ,namešteno ,,,,pre 4 dana ,88.500,Gradske lokacije,"Gradske lokacije, Vrnjačka Banja",Stan u zgradi ,,,,,,,,,
729,https://www.4zida.rs/prodaja-stanova/cerak-vinogradi-cukarica-cukarica-opstina-beograd/trosoban-stan/64ece57e71ba363fa107fdea,"Trosoban stan na prodaju, Vinogradski Venac, 172.000€, 84m² - 4zida",2023-08-29,84 m² ,3 sobe ,,centralno grejanje ,,,4/6 spratova ,,lođa ,kupatilo ,prazno ,telefon ,useljivo ,125390 ,pre 1 dan ,172.000,Vinogradski Venac,"Cerak Vinogradi, Čukarica, Čukarica opština, Beograd",,ima lift (1) ,,,,,,,,
730,https://www.4zida.rs/prodaja-stanova/liman-1-liman-gradske-lokacije-novi-sad/dvoiposoban-stan/64e115d0217bab3c03097aa7,"Dvoiposoban stan na prodaju, Liman 1, 135.000€, 61m² - 4zida",2023-08-29,61 m² ,2.5 soba ,uknjiženo ,centralno grejanje ,luksuzno ,,prizemlje/4 sprata ,,dvorište ,"kupatilo, kuhinja, ostava ",namešteno ,"telefon, kablovska, TV, klima, centralna klima, veš mašina, kuhinjski elementi, sudo mašina, frižider, zamrzivač, mikrotalasna rerna, rerna, šporet, ležaj, plakar ",useljivo ,,pre 9 dana ,135.000,Liman 1,"Liman 1, Liman, Gradske lokacije, Novi Sad",Stan u zgradi ,ima lift (3) ,,,,Kablovska ,,,,
731,https://www.4zida.rs/prodaja-stanova/riblja-pijaca-stari-grad-gradske-lokacije-novi-sad/trosoban-stan/64e48a319595b74836023ab9,"Trosoban stan na prodaju, Riblja Pijaca, 198.000€, 90m² - 4zida",2023-08-29,90 m² ,3 sobe ,,centralno grejanje ,,2001,1/6 spratova ,,terasa ,,,,,1047294 ,pre 7 dana ,198.000,Riblja Pijaca,"Riblja Pijaca, Stari Grad, Gradske lokacije, Novi Sad",,ima lift (1) ,,,,,,,,
732,https://www.4zida.rs/prodaja-stanova/raj-gradske-lokacije-vrnjacka-banja/garsonjera/64e6057e5e42de6e2a004dd2,"Garsonjera na prodaju, Raj, 103.000€, 34m² - 4zida",2023-08-29,34 m² ,0.5 soba ,uknjiženo ,,luksuzno ,,,,,,prazno ,,,,pre 6 dana ,103.000,Raj,"Raj, Gradske lokacije, Vrnjačka Banja",Stan u zgradi ,ima lift (1) ,,,,,,,,
733,https://www.4zida.rs/prodaja-stanova/divcibare-okolne-lokacije-valjevo/dvosoban-stan/647de25242ea270ee0021318,"Prodaja stanova Divčibare, Okolne lokacije, Valjevo - 4zida",2023-08-29,,,,,,,,,,,,,,,,,,,,,,,,,,,,
734,https://www.4zida.rs/prodaja-stanova/prozivka-gradske-lokacije-subotica/dvosoban-stan/64e56a997116da10a606914e,"Dvosoban stan na prodaju, Prozivka, 60.000€, 65m² - 4zida",2023-08-29,65 m² ,2 sobe ,uknjiženo ,centralno grejanje ,,,,,"prilaz za invalide, dvorište, terasa, lođa ","kupatilo, toalet, kuhinja ",,"telefon, kablovska, klima, veš mašina, kuhinjski elementi, frižider, zamrzivač, rerna, šporet, plakar ",,,pre 6 dana ,60.000,Prozivka,"Prozivka, Gradske lokacije, Subotica",Stan u zgradi ,ima lift (1) ,,jug ,ulicu ,Optički ,"1a, 16 ",13.10.2023 ,,
735,https://www.4zida.rs/prodaja-stanova/juzni-bulevar-vracar-beograd/dvoiposoban-stan/64ede924473dbf038c07920e,"Dvoiposoban stan na prodaju, Sime Igumanova, 180.000€, 65m² - 4zida",2023-08-29,65 m² ,2.5 soba ,uknjiženo ,etažno grejanje ,uobičajeno stanje ,,visoko prizemlje/4 sprata ,,"terasa, lođe (2) ","kupatilo, kuhinja ",,"telefon, kablovska, klima, kuhinjski elementi ",,3292 ,pre 6 sati ,180.000,Sime Igumanova,"Južni Bulevar, Vračar, Beograd",Stan u zgradi ,,,,,,,,,
736,https://www.4zida.rs/prodaja-stanova/lagator-gradske-lokacije-loznica/trosoban-stan/647de09642ea270ee0020bbb,"Prodaja stanova Lagator, Gradske lokacije, Loznica - 4zida",2023-08-29,,,,,,,,,,,,,,,,,,,,,,,,,,,,
737,https://www.4zida.rs/prodaja-stanova/sajmiste-gradske-lokacije-novi-sad/garsonjera/64e6196d102a72cf5d0053f6,"Garsonjera na prodaju, Bulevar Kralja Petra I, 46.800€, 18m² - 4zida",2023-08-29,18 m² ,0.5 soba ,uknjiženo ,centralno grejanje ,,,6/6 spratova ,,,,,,useljivo ,515858 ,pre 6 dana ,46.800,Bulevar Kralja Petra I,"Sajmište, Gradske lokacije, Novi Sad",Stan u zgradi ,ima lift (1) ,,,,,,,,
738,https://www.4zida.rs/prodaja-stanova/labudovo-brdo-rakovica-opstina-beograd/cetvorosoban-stan/64e4c0d5333f6b25410f0c66,"Četvorosoban stan na prodaju, Ljubomira Ivkovića Šuce, 123.000€, 86m² - 4zida",2023-08-29,86 m² ,4 sobe ,uknjiženo ,centralno grejanje ,uobičajeno stanje ,,3/3 sprata ,,lođa ,kupatilo ,prazno ,"telefon, kablovska, internet, interfon ",,7948 ,pre 7 dana ,123.000,Ljubomira Ivkovića Šuce,"Labudovo Brdo, Rakovica opština, Beograd",,,,,,,,,,
739,https://www.4zida.rs/prodaja-stanova/telep-gradske-lokacije-novi-sad/jednoiposoban-stan/64e3356d35f4f3445c06de68,"Prodaja stanova Telep, Gradske lokacije, Novi Sad - 4zida",2023-08-29,,,,,,,,,,,,,,,,,,,,,,,,,,,,
740,https://www.4zida.rs/prodaja-stanova/jugovicevo-gradske-lokacije-novi-sad/trosoban-stan/64e39495047cd9f77f0e6372,"Prodaja stanova Jugovićevo, Gradske lokacije, Novi Sad - 4zida",2023-08-29,,,,,,,,,,,,,,,,,,,,,,,,,,,,
741,https://www.4zida.rs/prodaja-stanova/centar-gradske-lokacije-pancevo/cetvorosoban-stan/649addde6904f1dc5f0a78fa,"Prodaja stanova Centar, Gradske lokacije, Pančevo - 4zida",2023-08-29,,,,,,,,,,,,,,,,,,,,,,,,,,,,
742,https://www.4zida.rs/prodaja-stanova/cukaricka-padina-cukarica-cukarica-opstina-beograd/dvosoban-stan/64e604bd0cf2cbd0d40d9920,"Dvosoban stan na prodaju, Obalskih  Radnika, 120.000€, 49m² - 4zida",2023-08-29,49 m² ,2 sobe ,uknjiženo ,centralno grejanje ,,,4/7 spratova ,,"prilaz za invalide, lođa ","kupatilo, kuhinja ",prazno ,"kablovska, klima ",,,pre 6 dana ,120.000,Obalskih  Radnika,"Čukarička Padina, Čukarica, Čukarica opština, Beograd",Stan u zgradi ,ima lift (1) ,,,,,,,,
743,https://www.4zida.rs/prodaja-stanova/vikend-naselje-okolne-lokacije-kopaonik/dvoiposoban-stan/647de2d442ea270ee0021773,"Prodaja stanova Vikend naselje, Okolne lokacije, Kopaonik - 4zida",2023-08-29,,,,,,,,,,,,,,,,,,,,,,,,,,,,
744,https://www.4zida.rs/prodaja-stanova/lipov-gaj-adice-gradske-lokacije-novi-sad/garsonjera/64edb5d65716facbb8074ee2,"Garsonjera na prodaju, Lipov Gaj, 35.000€, 21m² - 4zida",2023-08-29,21 m² ,0.5 soba ,uknjiženo ,,novo ,,prizemlje/2 sprata ,,,,prazno ,,,42413 ,pre 10 sati ,35.000,Lipov Gaj,"Lipov Gaj, Adice, Gradske lokacije, Novi Sad",Stan u zgradi ,,,,,,,,,
745,https://www.4zida.rs/prodaja-stanova/telep-gradske-lokacije-novi-sad/cetvorosoban-stan/64e5edfd9dd4ef2ed90a96f9,"Četvorosoban stan na prodaju, Telep, 335.000€, 146m² - 4zida",2023-08-29,146 m² ,4 sobe ,,,,,2/2 sprata ,,,,prazno ,,,185 ,pre 6 dana ,335.000,Telep,"Telep, Gradske lokacije, Novi Sad",Stan u zgradi ,,,,,,,,,
746,https://www.4zida.rs/prodaja-stanova/cara-dusana-adamovicevo-naselje-gradske-lokacije-novi-sad/cetvorosoban-stan/64ed1b33a333dadc2a09cdbd,"Četvorosoban stan na prodaju, Cara Dušana, 268.200€, 124m² - 4zida",2023-08-29,124 m² ,4 sobe ,uknjiženo ,centralno grejanje ,uobičajeno stanje ,2008,5/6 spratova ,,terasa ,,,,,1040054 ,pre 21 sati ,268.200,Cara Dušana,"Cara Dušana, Adamovićevo Naselje, Gradske lokacije, Novi Sad",Stan u zgradi ,ima lift (1) ,,,,,,,,
747,https://www.4zida.rs/prodaja-stanova/bezanijska-kosa-1-bezanijska-kosa-novi-beograd-beograd/cetvorosoban-stan/647de24542ea270ee002128d,"Prodaja stanova Bežanijska kosa 1, Bežanijska kosa, Novi Beograd, Beograd - 4zida",2023-08-29,,,,,,,,,,,,,,,,,,,,,,,,,,,,
748,https://www.4zida.rs/prodaja-stanova/trg-republike-beograd-centar-stari-grad-opstina-beograd/cetvorosoban-stan/64ece35e71ba363fa107fda6,"Četvorosoban stan na prodaju, Bulevar Despota Stefana, 598.000€, 109m² - 4zida",2023-08-29,109 m² ,4 sobe ,uknjiženo ,centralno grejanje ,,,4/6 spratova ,,terasa ,kupatilo ,namešteno ,"telefon, interfon ",,5967 ,pre 1 dan ,598.000,Bulevar Despota Stefana,"Trg Republike, Beograd centar, Stari Grad opština, Beograd",,ima lift (1) ,,,,,,,,
749,https://www.4zida.rs/prodaja-stanova/gradske-lokacije-vrnjacka-banja/dvosoban-stan/64e89e23e50ac97d2f0446a7,"Dvosoban stan na prodaju, Gradske lokacije, 102.000€, 85m² - 4zida",2023-08-29,85 m² ,2 sobe ,uknjiženo ,grejanje na struju ,,,,,terasa ,kupatilo ,prazno ,,,,pre 4 dana ,102.000,Gradske lokacije,"Gradske lokacije, Vrnjačka Banja",Stan u zgradi ,,,,,,,,,
750,https://www.4zida.rs/prodaja-stanova/telep-gradske-lokacije-novi-sad/dvosoban-stan/64eda7bf397683b20e07eccb,"Dvosoban stan na prodaju, Telep, 104.600€, 41m² - 4zida",2023-08-29,41 m² ,2 sobe ,uknjiženo ,grejanje na gas ,,,4/5 spratova ,,,,,,,509035 ,pre 11 sati ,104.600,Telep,"Telep, Gradske lokacije, Novi Sad",Stan u zgradi ,,,,,,,,,
751,https://www.4zida.rs/prodaja-stanova/cvijiceva-palilula-opstina-beograd/dvosoban-stan/64e5c35645443582f20e3382,"Dvosoban stan na prodaju, Cvijićeva, 157.000€, 48m² - 4zida",2023-08-29,48 m² ,2 sobe ,,centralno grejanje ,novo ,,prizemlje ,1 parking mesto ,terasa ,,prazno ,"interfon, klima ",,2368 ,pre 6 dana ,157.000,Cvijićeva,"Cvijićeva, Palilula opština, Beograd",Stan u zgradi ,ima lift (1) ,1 garažno mesto ,,,,,,,
752,https://www.4zida.rs/prodaja-stanova/beograd-na-vodi-savski-venac-beograd/dvosoban-stan/64edff8d43f5195e720dc7fd,"Dvosoban stan na prodaju, Bulevar Vudroa Vilsona, 270.000€, 55m² - 4zida",2023-08-29,55 m² ,2 sobe ,uknjiženo ,centralno grejanje ,,,16/24 sprata ,,terasa ,kupatilo ,prazno ,"telefon, kablovska, internet, interfon, klima ",useljivo ,2322 ,pre 5 sati ,270.000,Bulevar Vudroa Vilsona,"Beograd na vodi, Savski Venac, Beograd",,ima lift (1) ,1 garažno mesto ,,,,,,,
753,https://www.4zida.rs/prodaja-stanova/lipov-gaj-adice-gradske-lokacije-novi-sad/cetvorosoban-stan/64d58bcef4789cde86023536,"Četvorosoban stan na prodaju, Lipov Gaj, 125.250€, 76m² - 4zida",2023-08-29,76 m² ,4 sobe ,uknjiženo ,,u izgradnji ,2023,1/3 sprata ,,terasa ,,,,,1096532 ,pre 18 dana ,125.250,Lipov Gaj,"Lipov Gaj, Adice, Gradske lokacije, Novi Sad",Stan u zgradi ,,,,,,,,,
754,https://www.4zida.rs/prodaja-stanova/secerana-gradske-lokacije-zrenjanin/dvosoban-stan/64e47b0e676048e4780db6e2,"Dvosoban stan na prodaju, Šećerana, 49.000€, 58m² - 4zida",2023-08-29,58 m² ,2 sobe ,,,,,,,,,,,,12210454 ,pre 7 dana ,49.000,Šećerana,"Šećerana, Gradske lokacije, Zrenjanin",,,,,,,,,,
755,https://www.4zida.rs/prodaja-stanova/bulevar-oslobodjenja-gradske-lokacije-novi-sad/dvoiposoban-stan/64e4c24b333f6b25410f0cd1,"Dvoiposoban stan na prodaju, Bulevar Oslobođenja, 136.300€, 49m² - 4zida",2023-08-29,49 m² ,2.5 soba ,,centralno grejanje ,,1970,3/11 spratova ,,terasa ,,,,,1047270 ,pre 7 dana ,136.300,Bulevar Oslobođenja,"Bulevar Oslobođenja, Gradske lokacije, Novi Sad",,ima lift (1) ,,,,,,,,
756,https://www.4zida.rs/prodaja-stanova/adice-gradske-lokacije-novi-sad/jednoiposoban-stan/64e4ece0a716e5363c09e91a,"Prodaja stanova Adice, Gradske lokacije, Novi Sad - 4zida",2023-08-29,,,,,,,,,,,,,,,,,,,,,,,,,,,,
757,https://www.4zida.rs/prodaja-stanova/cara-dusana-adamovicevo-naselje-gradske-lokacije-novi-sad/dvosoban-stan/64ec724fb0f264ba2a0a5f23,"Dvosoban stan na prodaju, Cara Dušana, 128.750€, 50m² - 4zida",2023-08-29,50 m² ,2 sobe ,uknjiženo ,centralno grejanje ,uobičajeno stanje ,2011,3/3 sprata ,,terasa ,,,,,1056187 ,pre 1 dan ,128.750,Cara Dušana,"Cara Dušana, Adamovićevo Naselje, Gradske lokacije, Novi Sad",Stan u zgradi ,,,,,,,,,
758,https://www.4zida.rs/prodaja-stanova/banjica-gradske-lokacije-sokobanja/dvosoban-stan/647de2ba42ea270ee0021608,"Prodaja stanova Banjica, Gradske lokacije, Sokobanja - 4zida",2023-08-29,,,,,,,,,,,,,,,,,,,,,,,,,,,,
759,https://www.4zida.rs/prodaja-stanova/telep-gradske-lokacije-novi-sad/dvosoban-stan/64e7d5271adead01460db9ad,"Dvosoban stan na prodaju, Telep, 90.350€, 37m² - 4zida",2023-08-29,37 m² ,2 sobe ,,etažno grejanje ,u izgradnji ,2022,prizemlje/4 sprata ,,,,,,,1040043 ,pre 4 dana ,90.350,Telep,"Telep, Gradske lokacije, Novi Sad",Stan u zgradi ,ima lift (1) ,,,,,,,,
760,https://www.4zida.rs/prodaja-stanova/pantelej-gradske-lokacije-nis/jednosoban-stan/64e8b7eaba16edae15094d2c,"Jednosoban stan na prodaju, Bulevar Svetog Pantelejmona, 53.000€, 38m² - 4zida",2023-08-29,38 m² ,1 soba ,uknjiženo ,TA peć ,uobičajeno stanje ,,4/7 spratova ,1 parking mesto ,terasa ,kupatilo ,prazno ,,,p,pre 4 dana ,53.000,Bulevar Svetog Pantelejmona,"Pantelej, Gradske lokacije, Niš",,ima lift (1) ,,,,,,,,
761,https://www.4zida.rs/prodaja-stanova/adice-gradske-lokacije-novi-sad/garsonjera/64ed2af154892a284d067abc,"Garsonjera na prodaju, Mirona Đorđevića, 44.000€, 27m² - 4zida",2023-08-29,27 m² ,0.5 soba ,nije uknjiženo ,grejanje na gas ,novo ,,prizemlje/2 sprata ,1 parking mesto ,,,,,useljivo ,101207 ,pre 20 sati ,44.000,Mirona Đorđevića,"Adice, Gradske lokacije, Novi Sad",Stan u zgradi ,,1 garažno mesto ,,,,,,,
762,https://www.4zida.rs/prodaja-stanova/telep-gradske-lokacije-novi-sad/jednoiposoban-stan/647de29d42ea270ee0021495,"Prodaja stanova Telep, Gradske lokacije, Novi Sad - 4zida",2023-08-29,,,,,,,,,,,,,,,,,,,,,,,,,,,,
763,https://www.4zida.rs/prodaja-stanova/centar-gradske-lokacije-aleksandrovac/trosoban-stan/64ccc66d8901c86fd60b1aaf,"Trosoban stan na prodaju, Gradske lokacije, 103.000€, 69m² - 4zida",2023-08-29,69 m² ,3 sobe ,uknjiženo ,centralno grejanje ,održavano ,2010,4/5 spratova ,,"podrum, terasa ","kupatilo, kuhinja ",prazno ,"telefon, kablovska, kuhinjski elementi, sudo mašina, frižider, rerna ",useljivo ,,pre 2 dana ,103.000,Gradske lokacije,"Gradske lokacije, Kraljevo",Stan u zgradi ,ima lift (1) ,,,ulicu ,Optički ,,,,
764,https://www.4zida.rs/prodaja-stanova/banovo-brdo-cukarica-cukarica-opstina-beograd/sestosoban-stan/64edd89d0225e929650f949f,"Šestosoban stan na prodaju, Šumadijski trg, 270.000€, 123m² - 4zida",2023-08-29,123 m² ,6 soba ,uknjiženo ,centralno grejanje ,,,4/5 spratova ,,terasa ,kupatilo ,prazno ,telefon ,,4402 ,pre 8 sati ,270.000,Šumadijski trg,"Banovo Brdo, Čukarica, Čukarica opština, Beograd",,,,,,,,,,
765,https://www.4zida.rs/prodaja-stanova/centar-gradske-lokacije-vrnjacka-banja/garsonjera/64e9f5b810dacc59b80da637,"Garsonjera na prodaju, Centar, 37.500€, 17m² - 4zida",2023-08-29,17 m² ,0.5 soba ,uknjiženo ,grejanje na struju ,,,,1 parking mesto ,terasa ,,namešteno ,,,,pre 3 dana ,37.500,Centar,"Centar, Gradske lokacije, Vrnjačka Banja",Stan u zgradi ,,,,,,,,,
766,https://www.4zida.rs/prodaja-stanova/gradske-lokacije-zlatibor/dvosoban-stan/647de2ef42ea270ee0021914,"Prodaja stanova Gradske lokacije, Zlatibor - 4zida",2023-08-29,,,,,,,,,,,,,,,,,,,,,,,,,,,,
767,https://www.4zida.rs/prodaja-stanova/zemun-centar-zemun-zemun-opstina-beograd/cetvorosoban-stan/64eca9fae2e89301bb04a3ad,"Četvorosoban stan na prodaju, Banatska, 211.900€, 90m² - 4zida",2023-08-29,90 m² ,4 sobe ,,centralno grejanje ,novo ,,visoko prizemlje/6 spratova ,,,kupatilo ,prazno ,telefon ,,2870 ,pre 1 dan ,211.900,Banatska,"Zemun - Centar, Zemun, Zemun opština, Beograd",,,,,,,,,,
768,https://www.4zida.rs/prodaja-stanova/kraljevi-cardaci-okolne-lokacije-kopaonik/garsonjera/64ea4a7167eecf22bc05e02b,"Garsonjera na prodaju, Kraljevi Čardaci, 50.500€, 25m² - 4zida",2023-08-29,25 m² ,0.5 soba ,uknjiženo ,grejanje na struju ,luksuzno ,2020,,,"dvorište, sauna, recepcija ","kupatilo, kuhinja ",namešteno ,"telefon, kablovska, TV, kuhinjski elementi, frižider, ležaj, plakar ",useljivo ,,pre 3 dana ,50.500,Kraljevi Čardaci,"Kraljevi Čardaci, Okolne lokacije, Kopaonik",Apartman ,ima lift (1) ,,,dvorište ,,,,,
769,https://www.4zida.rs/prodaja-stanova/gradske-lokacije-pancevo/trosoban-stan/64d9ed7f34403498cd0f89fe,"Prodaja stanova Gradske lokacije, Pančevo - 4zida",2023-08-29,,,,,,,,,,,,,,,,,,,,,,,,,,,,
770,https://www.4zida.rs/prodaja-stanova/kertvaros-gradske-lokacije-subotica/dvosoban-stan/64edc21cdd508318cf0e7f81,"Prodaja stanova Kertvaroš, Gradske lokacije, Subotica - 4zida",2023-08-29,,,,,,,,,,,,,,,,,,,,,,,,,,,,
771,https://www.4zida.rs/prodaja-stanova/bulevar-patrijarha-pavla-somborski-bulevar-telep-gradske-lokacije-novi-sad/jednosoban-stan/64ee25db663ef773eb0ce692,"Jednosoban stan na prodaju, Bulevar Patrijarha Pavla (Somborski Bulevar), 77.250€, 30m² - 4zida",2023-08-29,30 m² ,1 soba ,uknjiženo ,centralno grejanje ,,,3/5 spratova ,,terasa ,"kupatilo, kuhinja ",namešteno ,"internet, interfon, klima ",,516046 ,pre 2 sata ,77.250,Bulevar Patrijarha Pavla (Somborski Bulevar),"Bulevar Patrijarha Pavla (Somborski Bulevar), Telep, Gradske lokacije, Novi Sad",Stan u zgradi ,ima lift (1) ,,,,,,,,
772,https://www.4zida.rs/prodaja-stanova/gradske-lokacije-alibunar/jednosoban-stan/64e72060659b2b8d0a0e8ade,"Jednosoban stan na prodaju, Gradske lokacije, 32.000€, 38m² - 4zida",2023-08-29,38 m² ,1 soba ,uknjiženo ,grejanje na gas ,renovirano ,,1/1 sprat ,,,kupatilo ,namešteno ,telefon ,useljivo ,,pre 5 dana ,32.000,Gradske lokacije,"Gradske lokacije, Alibunar",Stan u zgradi ,,,,,Kablovska ,,,,
773,https://www.4zida.rs/prodaja-stanova/gradske-lokacije-indjija/garsonjera/64ec9b65b79699674c000371,"Garsonjera na prodaju, Inđija, 47.651€, 29m² - 4zida",2023-08-29,29 m² ,0.5 soba ,uknjiženo ,grejanje na gas ,u izgradnji ,,1/4 sprata ,,terasa ,kupatilo ,prazno ,,,3288 ,pre 1 dan ,47.651,Inđija,"Gradske lokacije, Inđija",Stan u zgradi ,,,,,,,,,
774,https://www.4zida.rs/prodaja-stanova/bezanijska-kosa-1-bezanijska-kosa-novi-beograd-beograd/cetvorosoban-stan/647de24742ea270ee002129e,"Prodaja stanova Bežanijska kosa 1, Bežanijska kosa, Novi Beograd, Beograd - 4zida",2023-08-29,,,,,,,,,,,,,,,,,,,,,,,,,,,,
775,https://www.4zida.rs/prodaja-stanova/4-juli-gradske-lokacije-zrenjanin/trosoban-stan/64e862f58a46dc3aae0774a4,"Trosoban stan na prodaju, 4. Juli, 71.000€, 67m² - 4zida",2023-08-29,67 m² ,3 sobe ,,grejanje na struju ,,,1. sprat ,,,,,,,30234 ,pre 4 dana ,71.000,4. Juli,"4. Juli, Gradske lokacije, Zrenjanin",,,,,,,,,,
776,https://www.4zida.rs/prodaja-stanova/telep-gradske-lokacije-novi-sad/dvoiposoban-stan/64edd3610225e929650f9330,"Dvoiposoban stan na prodaju, 654, 144.600€, 58m² - 4zida",2023-08-29,58 m² ,2.5 soba ,,etažno grejanje ,,,,,,,,,,72372 ,pre 8 sati ,144.600,654,"Telep, Gradske lokacije, Novi Sad",Stan u zgradi ,,,,,,,,,
777,https://www.4zida.rs/prodaja-stanova/nova-detelinara-detelinara-gradske-lokacije-novi-sad/jednosoban-stan/64ecbd3ccbe56af11c0ff4d0,"Jednosoban stan na prodaju, Nova Detelinara, 75.190€, 30m² - 4zida",2023-08-29,30 m² ,1 soba ,uknjiženo ,centralno grejanje ,novo ,,1/5 spratova ,1 parking mesto ,terasa ,kuhinja ,polunamešteno ,"kablovska, internet, interfon ",,2701 ,pre 1 dan ,75.190,Nova Detelinara,"Nova Detelinara, Detelinara, Gradske lokacije, Novi Sad",Stan u zgradi ,ima lift (1) ,,,,,,,,
778,https://www.4zida.rs/prodaja-stanova/vojvode-stepe-vozdovac-opstina-beograd/trosoban-stan/647de1ba42ea270ee0020d95,"Prodaja stanova Vojvode Stepe, Voždovac opština, Beograd - 4zida",2023-08-29,,,,,,,,,,,,,,,,,,,,,,,,,,,,
779,https://www.4zida.rs/prodaja-stanova/centar-gradske-lokacije-aleksinac/jednosoban-stan/647de29a42ea270ee0021467,"Prodaja stanova Centar, Gradske lokacije, Aleksinac - 4zida",2023-08-29,,,,,,,,,,,,,,,,,,,,,,,,,,,,
780,https://www.4zida.rs/prodaja-stanova/centar-gradske-lokacije-zlatibor/dvoiposoban-stan/648314aacd62f21ff80f8e77,"Prodaja stanova Centar, Gradske lokacije, Zlatibor - 4zida",2023-08-29,,,,,,,,,,,,,,,,,,,,,,,,,,,,
781,https://www.4zida.rs/prodaja-stanova/lion-zvezdara-opstina-beograd/sestosoban-stan/64e5c2ce45443582f20e3347,"Šestosoban stan na prodaju, Lion, 598.000€, 142m² - 4zida",2023-08-29,142 m² ,6 soba ,,,,,1/1 sprat ,1 parking mesto ,,"kupatila (2), toalet ",namešteno ,klima ,,91347520 ,pre 6 dana ,598.000,Lion,"Lion, Zvezdara opština, Beograd",,,2 garažna mesta ,,,,,,,
782,https://www.4zida.rs/prodaja-stanova/banovo-brdo-cukarica-cukarica-opstina-beograd/jednosoban-stan/64e8ed93809d0c5263077106,"Jednosoban stan na prodaju, Pere Todorovića, 85.000€, 33m² - 4zida",2023-08-29,33 m² ,1 soba ,,centralno grejanje ,,,2/4 sprata ,,,kupatilo ,prazno ,telefon ,,8824 ,pre 4 dana ,85.000,Pere Todorovića,"Banovo Brdo, Čukarica, Čukarica opština, Beograd",,,,,,,,,,
783,https://www.4zida.rs/prodaja-stanova/nova-detelinara-detelinara-gradske-lokacije-novi-sad/garsonjera/64ec8f15d3f26847430b5e88,"Garsonjera na prodaju, Veselina Maslese, 66.950€, 26m² - 4zida",2023-08-29,26 m² ,0.5 soba ,uknjiženo ,centralno grejanje ,novo ,2010,5/5 spratova ,,"prilaz za invalide, dvorište, terasa ","kupatilo, kuhinja ",namešteno ,"telefon, kablovska ",useljivo ,,pre 10 sati ,66.950,Veselina Maslese,"Nova Detelinara, Detelinara, Gradske lokacije, Novi Sad",Stan u zgradi ,ima lift (1) ,,istok ,dvorište ,,,,,
784,https://www.4zida.rs/prodaja-stanova/crveni-krst-vracar-vracar-beograd/jednosoban-stan/64e51803c5559e85a801db74,"Jednosoban stan na prodaju, Crveni Krst Vračar, 99.200€, 32m² - 4zida",2023-08-29,32 m² ,1 soba ,uknjiženo ,TA peć ,renovirano ,,2/3 sprata ,,,"kupatilo, toalet, ostava ",prazno ,"kuhinjski elementi, rerna, šporet ",useljivo ,,pre 6 dana ,99.200,Crveni Krst Vračar,"Crveni Krst Vračar, Vračar, Beograd",Stan u zgradi ,,,,ulicu ,,da ,,ne ,da 
785,https://www.4zida.rs/prodaja-stanova/cvijiceva-palilula-opstina-beograd/trosoban-stan/64e8b598ba16edae15094ca1,"Trosoban stan na prodaju, Cvijićeva, 251.000€, 77m² - 4zida",2023-08-29,77 m² ,3 sobe ,,centralno grejanje ,,,4/6 spratova ,,lođa ,kupatila (2) ,namešteno ,telefon ,,86097 ,pre 4 dana ,251.000,Cvijićeva,"Cvijićeva, Palilula opština, Beograd",,ima lift (1) ,,,,,,,,
786,https://www.4zida.rs/prodaja-stanova/nova-detelinara-detelinara-gradske-lokacije-novi-sad/dvoiposoban-stan/64e8a374389d6a61a20a2b83,"Dvoiposoban stan na prodaju, Nova Detelinara, 141.110€, 63m² - 4zida",2023-08-29,63 m² ,2.5 soba ,uknjiženo ,centralno grejanje ,,,5/6 spratova ,,terasa ,kupatilo ,,,,515945 ,pre 4 dana ,141.110,Nova Detelinara,"Nova Detelinara, Detelinara, Gradske lokacije, Novi Sad",Stan u zgradi ,ima lift (1) ,,,,,,,,
787,https://www.4zida.rs/prodaja-stanova/novi-grad-zemun-zemun-opstina-beograd/dvoiposoban-stan/64e48c279595b74836023b1b,"Dvoiposoban stan na prodaju, Makedonska, 124.000€, 62m² - 4zida",2023-08-29,62 m² ,2.5 soba ,uknjiženo ,centralno grejanje ,uobičajeno stanje ,,2/4 sprata ,,lođa ,,,,useljivo ,8896 ,pre 7 dana ,124.000,Makedonska,"Novi Grad, Zemun, Zemun opština, Beograd",,,,,,,,,,
