,link,title,end_date,Površina,Broj soba,Uknjiženost,Grejanje,Stanje,Godina izgradnje,Spratnost,Parking,Infrastruktura,Unutrašnje prostorije,Nameštenost,Opremljenost,Useljivo,Šifra oglasa,Oglas ažuriran,price,street,address,Tip,Lift,Garaža,Orijentacija nekretnine,Pogled na,Internet,Autobuske linije,Useljivo od,Tramvajske linije,Trolejbuske linije
426,https://www.4zida.rs/prodaja-stanova/cair-medijana-gradske-lokacije-nis/trosoban-stan/64e8a0c5e18ac7b1280e69b0,"Trosoban stan na prodaju, Čair, 107.400€, 63m² - 4zida",2023-08-29,63 m² ,3 sobe ,uknjiženo ,centralno grejanje ,u izgradnji ,,1/4 sprata ,,terasa ,"kupatilo, toalet ",prazno ,,,500041006,pre 4 dana ,107.400,Čair,"Čair, Medijana, Gradske lokacije, Niš",Stan u zgradi ,ima lift (1) ,,,,,,,,
427,https://www.4zida.rs/prodaja-stanova/bubanj-palilula-gradske-lokacije-nis/dvoiposoban-stan/6480556ca3266d6fb8010372,"Prodaja stanova Bubanj, Palilula, Gradske lokacije, Niš - 4zida",2023-08-29,,,,,,,,,,,,,,,,,,,,,,,,,,,,
428,https://www.4zida.rs/prodaja-stanova/severni-telep-telep-gradske-lokacije-novi-sad/jednoiposoban-stan/63ff7b302d5c9d762d012c15,"Jednoiposoban stan na prodaju, Severni Telep, 68.000€, 35m² - 4zida",2023-08-29,35 m² ,1.5 soba ,uknjiženo ,grejanje na gas ,,,visoko prizemlje/2 sprata ,,,,prazno ,,,505364 ,pre 5 meseci ,68.000,Severni Telep,"Severni Telep, Telep, Gradske lokacije, Novi Sad",Stan u zgradi ,,,,,,,,,
429,https://www.4zida.rs/prodaja-stanova/centar-gradske-lokacije-zlatibor/dvosoban-stan/647de1ea42ea270ee0020f95,"Prodaja stanova Centar, Gradske lokacije, Zlatibor - 4zida",2023-08-29,,,,,,,,,,,,,,,,,,,,,,,,,,,,
430,https://www.4zida.rs/prodaja-stanova/centar-gradske-lokacije-vrnjacka-banja/dvosoban-stan/647a134842b321153d04703b,"Dvosoban stan na prodaju, Heroja sa Košara, 78.390€, 40m² - 4zida",2023-08-29,40 m² ,2 sobe ,,etažno grejanje ,novo ,2023,prizemlje/3 sprata ,,,kupatilo ,prazno ,"telefon, kablovska, internet, interfon, klima ",,1385 ,pre 2 meseca ,78.390,Heroja sa Košara,"Centar, Gradske lokacije, Vrnjačka Banja",,ima lift (1) ,1 garažno mesto ,,,,,,,
431,https://www.4zida.rs/prodaja-stanova/blok-64-bezanijski-blokovi-novi-beograd-beograd/troiposoban-stan/64db6946248c921ae500c513,"Prodaja stanova Blok 64, Bežanijski Blokovi, Novi Beograd, Beograd - 4zida",2023-08-29,,,,,,,,,,,,,,,,,,,,,,,,,,,,
432,https://www.4zida.rs/prodaja-stanova/somborska-pantelej-gradske-lokacije-nis/jednoiposoban-stan/64c7a2dd4f3e5b891f0bef2c,"Prodaja stanova Somborska, Pantelej, Gradske lokacije, Niš - 4zida",2023-08-29,,,,,,,,,,,,,,,,,,,,,,,,,,,,
433,https://www.4zida.rs/prodaja-stanova/lion-zvezdara-opstina-beograd/petosoban-stan/64ec56f5269e155fd1014525,"Prodaja stanova Lion, Zvezdara opština, Beograd - 4zida",2023-08-29,,,,,,,,,,,,,,,,,,,,,,,,,,,,
434,https://www.4zida.rs/prodaja-stanova/retenzija-zemun-zemun-opstina-beograd/dvosoban-stan/64ee33cd3d7da1e92d0bd6f8,"Dvosoban stan na prodaju, Džona Kenedija, 175.000€, 64m² - 4zida",2023-08-29,64 m² ,2 sobe ,uknjiženo ,centralno grejanje ,,,7/8 spratova ,,"podrum, terasa, lođa ",,,,,3444 ,pre 1 sat ,175.000,Džona Kenedija,"Retenzija, Zemun, Zemun opština, Beograd",Stan u zgradi ,ima lift (1) ,,,,,,,,
435,https://www.4zida.rs/prodaja-stanova/novi-grad-zemun-zemun-opstina-beograd/dvoiposoban-stan/64e49c92b5e199b52e09762f,"Dvoiposoban stan na prodaju, Makedonska, 124.000€, 62m² - 4zida",2023-08-29,62 m² ,2.5 soba ,uknjiženo ,centralno grejanje ,uobičajeno stanje ,,2/5 spratova ,,lođa ,kupatilo ,namešteno ,telefon ,useljivo ,1505 ,pre 7 dana ,124.000,Makedonska,"Novi Grad, Zemun, Zemun opština, Beograd",,,,,,,,,,
436,https://www.4zida.rs/prodaja-stanova/detelinara-gradske-lokacije-novi-sad/dvosoban-stan/64e8d2c011cd8175f90866ac,"Dvosoban stan na prodaju, Detelinara, 128.750€, 44m² - 4zida",2023-08-29,44 m² ,2 sobe ,uknjiženo ,,u izgradnji ,,2/5 spratova ,,terasa ,,,,,1025395 ,pre 4 dana ,128.750,Detelinara,"Detelinara, Gradske lokacije, Novi Sad",Stan u zgradi ,ima lift (1) ,,,,,,,,
437,https://www.4zida.rs/prodaja-stanova/tornik-okolne-lokacije-zlatibor/dvosoban-stan/647de03442ea270ee002087f,"Prodaja stanova Tornik, Okolne lokacije, Zlatibor - 4zida",2023-08-29,,,,,,,,,,,,,,,,,,,,,,,,,,,,
438,https://www.4zida.rs/prodaja-stanova/sajmiste-gradske-lokacije-novi-sad/dvosoban-stan/64e75501f74a93260209a5f5,"Prodaja stanova Sajmište, Gradske lokacije, Novi Sad - 4zida",2023-08-29,,,,,,,,,,,,,,,,,,,,,,,,,,,,
439,https://www.4zida.rs/prodaja-stanova/blok-64-bezanijski-blokovi-novi-beograd-beograd/troiposoban-stan/64db6946248c921ae500c50f,"Prodaja stanova Blok 64, Bežanijski Blokovi, Novi Beograd, Beograd - 4zida",2023-08-29,,,,,,,,,,,,,,,,,,,,,,,,,,,,
440,https://www.4zida.rs/prodaja-stanova/centar-gradske-lokacije-krusevac/jednosoban-stan/64e8be827a3080971801ebe7,"Jednosoban stan na prodaju, Centar, 63.000€, 44m² - 4zida",2023-08-29,44 m² ,1 soba ,uknjiženo ,centralno grejanje ,novo ,,2/3 sprata ,,,kupatilo ,prazno ,,useljivo ,,pre 4 dana ,63.000,Centar,"Centar, Gradske lokacije, Kruševac",Stan u zgradi ,ima lift (1) ,,,,,,,,
441,https://www.4zida.rs/prodaja-stanova/9-maj-palilula-gradske-lokacije-nis/cetvorosoban-stan/64df4774f94cc779e7089ce7,"Četvorosoban stan na prodaju, Novo selo, 100.000€, 99m² - 4zida",2023-08-29,99 m² ,4 sobe ,,,,,prizemlje ,,terasa ,kupatilo ,,,,p,pre 11 dana ,100.000,Novo selo,"9. Maj, Palilula, Gradske lokacije, Niš",,,1 garažno mesto ,,,,,,,
442,https://www.4zida.rs/prodaja-stanova/radijalac-gradske-lokacije-subotica/dvosoban-stan/64957ba6ef8930a9a60781ce,"Prodaja stanova Radijalac, Gradske lokacije, Subotica - 4zida",2023-08-29,,,,,,,,,,,,,,,,,,,,,,,,,,,,
443,https://www.4zida.rs/prodaja-stanova/somborska-pantelej-gradske-lokacije-nis/dvosoban-stan/64c0fd4ba4ac4baf740f87a5,"Prodaja stanova Somborska, Pantelej, Gradske lokacije, Niš - 4zida",2023-08-29,,,,,,,,,,,,,,,,,,,,,,,,,,,,
444,https://www.4zida.rs/prodaja-stanova/adice-gradske-lokacije-novi-sad/troiposoban-stan/64e37b56061511e5770bddef,"Troiposoban stan na prodaju, Adice, 115.570€, 68m² - 4zida",2023-08-29,68 m² ,3.5 soba ,uknjiženo ,centralno grejanje ,novo ,,1/2 sprata ,1 parking mesto ,,,prazno ,,,515759 ,pre 8 dana ,115.570,Adice,"Adice, Gradske lokacije, Novi Sad",Stan u zgradi ,,,,,,,,,
445,https://www.4zida.rs/prodaja-stanova/krnjaca-palilula-opstina-beograd/jednosoban-stan/64e89923a6d034f13005f08a,"Jednosoban stan na prodaju, Sutjeska ulica 7, 50.000€, 32m² - 4zida",2023-08-29,32 m² ,1 soba ,uknjiženo ,TA peć ,,2010,3/3 sprata ,1 parking mesto ,terasa ,,prazno ,"klima, Kanalizacija ",,20580 ,pre 4 dana ,50.000,Sutjeska ulica 7,"Krnjača, Palilula opština, Beograd",Stan u zgradi ,,,,,,,,,
446,https://www.4zida.rs/prodaja-stanova/meandri-zemun-zemun-opstina-beograd/jednoiposoban-stan/64e77202dec671e0af04e274,"Jednoiposoban stan na prodaju, Banijska, 89.000€, 40m² - 4zida",2023-08-29,40 m² ,1.5 soba ,uknjiženo ,centralno grejanje ,,1979,4/22 sprata ,,"podrum, terasa ",,,telefon ,useljivo ,85575 ,pre 7 sati ,89.000,Banijska,"Meandri, Zemun, Zemun opština, Beograd",Stan u zgradi ,ima lift (1) ,,,,,,,,
447,https://www.4zida.rs/prodaja-stanova/blok-63-bezanijski-blokovi-novi-beograd-beograd/jednoiposoban-stan/64e8b892ba16edae15094d4f,"Jednoiposoban stan na prodaju, Gandijeva, 125.000€, 47m² - 4zida",2023-08-29,47 m² ,1.5 soba ,uknjiženo ,centralno grejanje ,,,5/6 spratova ,1 parking mesto ,"terasa, lođa ",kupatilo ,prazno ,"telefon, kablovska, interfon ",useljivo ,1641 ,pre 4 dana ,125.000,Gandijeva,"Blok 63, Bežanijski Blokovi, Novi Beograd, Beograd",,ima lift (1) ,1 garažno mesto ,,,,,,,
448,https://www.4zida.rs/prodaja-stanova/adice-gradske-lokacije-novi-sad/jednoiposoban-stan/647de2f642ea270ee002196f,"Prodaja stanova Adice, Gradske lokacije, Novi Sad - 4zida",2023-08-29,,,,,,,,,,,,,,,,,,,,,,,,,,,,
449,https://www.4zida.rs/prodaja-stanova/avijaticarsko-naselje-gradske-lokacije-novi-sad/trosoban-stan/647de03942ea270ee00208be,"Prodaja stanova Avijatičarsko Naselje, Gradske lokacije, Novi Sad - 4zida",2023-08-29,,,,,,,,,,,,,,,,,,,,,,,,,,,,
450,https://www.4zida.rs/prodaja-stanova/garic-gradske-lokacije-prokuplje/dvosoban-stan/64b26e435cf456c30406873c,"Prodaja stanova Garić, Gradske lokacije, Prokuplje - 4zida",2023-08-29,,,,,,,,,,,,,,,,,,,,,,,,,,,,
451,https://www.4zida.rs/prodaja-stanova/ekonomskipravni-fakultet-medijana-gradske-lokacije-nis/jednoiposoban-stan/64e8c66cf7b695addf092cb4,"Jednoiposoban stan na prodaju, Obilićev venac, 89.800€, 44m² - 4zida",2023-08-29,44 m² ,1.5 soba ,uknjiženo ,,u izgradnji ,,1. sprat ,,terasa ,kupatilo ,,interfon ,,p,pre 4 dana ,89.800,Obilićev venac,"Ekonomski/Pravni Fakultet, Medijana, Gradske lokacije, Niš",,ima lift (1) ,1 garažno mesto ,,,,,,,
452,https://www.4zida.rs/prodaja-stanova/centar-1-gradske-lokacije-subotica/dvosoban-stan/647de2db42ea270ee00217d3,"Prodaja stanova Centar 1, Gradske lokacije, Subotica - 4zida",2023-08-29,,,,,,,,,,,,,,,,,,,,,,,,,,,,
453,https://www.4zida.rs/prodaja-stanova/dedinje-savski-venac-beograd/jednoiposoban-stan/64d10779ef65239796023247,"Prodaja stanova Dedinje, Savski Venac, Beograd - 4zida",2023-08-29,,,,,,,,,,,,,,,,,,,,,,,,,,,,
454,https://www.4zida.rs/prodaja-stanova/kertvaros-gradske-lokacije-subotica/dvosoban-stan/64edc217dd508318cf0e7f70,"Prodaja stanova Kertvaroš, Gradske lokacije, Subotica - 4zida",2023-08-29,,,,,,,,,,,,,,,,,,,,,,,,,,,,
455,https://www.4zida.rs/prodaja-stanova/centar-gradske-lokacije-vrnjacka-banja/dvosoban-stan/647de1bf42ea270ee0020dce,"Prodaja stanova Centar, Gradske lokacije, Vrnjačka Banja - 4zida",2023-08-29,,,,,,,,,,,,,,,,,,,,,,,,,,,,
456,https://www.4zida.rs/prodaja-stanova/vozdovac-vozdovac-opstina-beograd/dvosoban-stan/649c12d6f62233e705046c06,"Prodaja stanova Voždovac, Voždovac opština, Beograd - 4zida",2023-08-29,,,,,,,,,,,,,,,,,,,,,,,,,,,,
457,https://www.4zida.rs/prodaja-stanova/adice-gradske-lokacije-novi-sad/garsonjera/64ec733cb0f264ba2a0a5f69,"Garsonjera na prodaju, Adice, 36.050€, 17m² - 4zida",2023-08-29,17 m² ,0.5 soba ,,grejanje na struju ,,2023,visoko prizemlje/2 sprata ,,,,,,,1047332 ,pre 1 dan ,36.050,Adice,"Adice, Gradske lokacije, Novi Sad",,,,,,,,,,
458,https://www.4zida.rs/prodaja-stanova/obilicev-venac-medijana-gradske-lokacije-nis/dvoiposoban-stan/647de24c42ea270ee00212d2,"Prodaja stanova Obilićev Venac, Medijana, Gradske lokacije, Niš - 4zida",2023-08-29,,,,,,,,,,,,,,,,,,,,,,,,,,,,
459,https://www.4zida.rs/prodaja-stanova/divcibare-okolne-lokacije-valjevo/garsonjera/647de03242ea270ee0020863,"Prodaja stanova Divčibare, Okolne lokacije, Valjevo, Garsonjera - 4zida",2023-08-29,,,,,,,,,,,,,,,,,,,,,,,,,,,,
460,https://www.4zida.rs/prodaja-stanova/blok-64-bezanijski-blokovi-novi-beograd-beograd/dvoiposoban-stan/64db6944248c921ae500c505,"Prodaja stanova Blok 64, Bežanijski Blokovi, Novi Beograd, Beograd - 4zida",2023-08-29,,,,,,,,,,,,,,,,,,,,,,,,,,,,
461,https://www.4zida.rs/prodaja-stanova/somborska-pantelej-gradske-lokacije-nis/dvoiposoban-stan/64c0fd4aa4ac4baf740f879f,"Prodaja stanova Somborska, Pantelej, Gradske lokacije, Niš - 4zida",2023-08-29,,,,,,,,,,,,,,,,,,,,,,,,,,,,
462,https://www.4zida.rs/prodaja-stanova/blok-45-novi-beograd-beograd/jednoiposoban-stan/64ee2aabaaff8415f60d5ce0,"Jednoiposoban stan na prodaju, Jurija Gagarina, 117.000€, 50m² - 4zida",2023-08-29,50 m² ,1.5 soba ,uknjiženo ,centralno grejanje ,uobičajeno stanje ,,6/12 spratova ,,terasa ,kupatilo ,prazno ,"telefon, interfon ",,1513 ,pre 2 sata ,117.000,Jurija Gagarina,"Blok 45, Novi Beograd, Beograd",,ima lift (1) ,,,,,,,,
463,https://www.4zida.rs/prodaja-stanova/gornji-grad-zemun-zemun-opstina-beograd/trosoban-stan/64e4a85a04e13de7060544bf,"Trosoban stan na prodaju, Karlovačka, 159.999€, 69m² - 4zida",2023-08-29,69 m² ,3 sobe ,uknjiženo ,centralno grejanje ,,,visoko prizemlje/6 spratova ,,lođa ,kupatilo ,prazno ,telefon ,,18736 ,pre 1 dan ,159.999,Karlovačka,"Gornji Grad, Zemun, Zemun opština, Beograd",,,,,,,,,,
464,https://www.4zida.rs/prodaja-stanova/slatina-gradske-lokacije-vrnjacka-banja/dvosoban-stan/647de28a42ea270ee00213aa,"Prodaja stanova Slatina, Gradske lokacije, Vrnjačka Banja - 4zida",2023-08-29,,,,,,,,,,,,,,,,,,,,,,,,,,,,
465,https://www.4zida.rs/prodaja-stanova/gradske-lokacije-zlatar/garsonjera/64e471d9e4c0ee1a590e01ea,"Garsonjera na prodaju, Krfska 34, 59.000€, 29m² - 4zida",2023-08-29,29 m² ,0.5 soba ,uknjiženo ,etažno grejanje ,novo ,2020,prizemlje/5 spratova ,,"prilaz za invalide, dvorište ","kupatilo, kuhinja ",namešteno ,"telefon, kablovska, TV, veš mašina, kuhinjski elementi, frižider, rerna, ležaj, plakar ",useljivo ,,pre 7 dana ,59.000,Krfska 34,"Gradske lokacije, Zlatar",Stan u zgradi ,ima lift (1) ,,istok ,ulicu ,Optički ,0 ,,0 ,0 
466,https://www.4zida.rs/prodaja-stanova/crveni-krst-vracar-vracar-beograd/trosoban-stan/64e86db5e8611a33a607f866,"Trosoban stan na prodaju, Žička, 297.000€, 103m² - 4zida",2023-08-29,103 m² ,3 sobe ,uknjiženo ,centralno grejanje ,renovirano ,2010,4/5 spratova ,,terasa ,"kupatilo, toalet, kuhinja ",namešteno ,klima ,,,pre 1 dan ,297.000,Žička,"Crveni Krst Vračar, Vračar, Beograd",Stan u zgradi ,ima lift (1) ,1 garažno mesto ,,,,,,,
467,https://www.4zida.rs/prodaja-stanova/filmski-grad-cukarica-cukarica-opstina-beograd/jednosoban-stan/64ec86214f42f852c40b109e,"Jednosoban stan na prodaju, Dimitrija Avramovića, 80.000€, 39m² - 4zida",2023-08-29,39 m² ,1 soba ,,centralno grejanje ,uobičajeno stanje ,,3/4 sprata ,,"podrum, lođa ",kupatilo ,namešteno ,"telefon, kablovska, internet, interfon ",useljivo ,1178 ,pre 1 dan ,80.000,Dimitrija Avramovića,"Filmski Grad, Čukarica, Čukarica opština, Beograd",,ima lift (1) ,,,,,,,,
468,https://www.4zida.rs/prodaja-stanova/novi-sad-centar-stari-grad-gradske-lokacije-novi-sad/cetvorosoban-stan/64ec9dad359a925c9e0f7312,"Četvorosoban stan na prodaju, STEVANA BRANOVACKOG, 239.000€, 99m² - 4zida",2023-08-29,99 m² ,4 sobe ,,centralno grejanje ,,,,,,,,,,72347 ,pre 1 dan ,239.000,STEVANA BRANOVACKOG,"Novi Sad - Centar, Stari Grad, Gradske lokacije, Novi Sad",Stan u zgradi ,,,,,,,,,
469,https://www.4zida.rs/prodaja-stanova/prozivka-gradske-lokacije-subotica/jednosoban-stan/64e5c40a80da827f54026a61,"Jednosoban stan na prodaju, Prozivka, 36.000€, 32m² - 4zida",2023-08-29,32 m² ,1 soba ,uknjiženo ,centralno grejanje ,renovirano ,,,,terasa ,,namešteno ,,useljivo ,3317 ,pre 5 dana ,36.000,Prozivka,"Prozivka, Gradske lokacije, Subotica",Stan u zgradi ,,,,,,,,,
470,https://www.4zida.rs/prodaja-stanova/grbavica-gradske-lokacije-novi-sad/trosoban-stan/647de22342ea270ee002113f,"Prodaja stanova Grbavica, Gradske lokacije, Novi Sad - 4zida",2023-08-29,,,,,,,,,,,,,,,,,,,,,,,,,,,,
471,https://www.4zida.rs/prodaja-stanova/liman-3-liman-gradske-lokacije-novi-sad/trosoban-stan/64e75ee9156c17a0b40732e9,"Prodaja stanova Liman 3, Liman, Gradske lokacije, Novi Sad - 4zida",2023-08-29,,,,,,,,,,,,,,,,,,,,,,,,,,,,
472,https://www.4zida.rs/prodaja-stanova/bulevar-evrope-gradske-lokacije-novi-sad/jednoiposoban-stan/64edefa8b218680575010cdd,"Jednoiposoban stan na prodaju, Bulevar Evrope, 98.880€, 32m² - 4zida",2023-08-29,32 m² ,1.5 soba ,uknjiženo ,,u izgradnji ,2016,1/7 spratova ,,terasa ,,,,,1095093 ,pre 6 sati ,98.880,Bulevar Evrope,"Bulevar Evrope, Gradske lokacije, Novi Sad",Stan u zgradi ,ima lift (1) ,,,,,,,,
473,https://www.4zida.rs/prodaja-stanova/bulevar-oslobodjenja-gradske-lokacije-novi-sad/dvosoban-stan/64ec8a913f0b7de5d20f05cf,"Dvosoban stan na prodaju, Bulevar Oslobođenja, 128.670€, 49m² - 4zida",2023-08-29,49 m² ,2 sobe ,uknjiženo ,centralno grejanje ,novo ,2010,3/5 spratova ,,terasa ,"kupatilo, kuhinja, ostava ",prazno ,"telefon, kablovska, klima ",useljivo ,516038 ,pre 1 dan ,128.670,Bulevar Oslobođenja,"Bulevar Oslobođenja, Gradske lokacije, Novi Sad",Stan u zgradi ,ima lift (1) ,,,dvorište ,,,,,
474,https://www.4zida.rs/prodaja-stanova/jugovicevo-gradske-lokacije-novi-sad/trosoban-stan/64e365b637f14df7270c263d,"Trosoban stan na prodaju, Jugovićevo, 139.050€, 65m² - 4zida",2023-08-29,65 m² ,3 sobe ,uknjiženo ,grejanje na gas ,,,prizemlje/4 sprata ,,terasa ,"kupatilo, kuhinja ",prazno ,,,515782 ,pre 8 dana ,139.050,Jugovićevo,"Jugovićevo, Gradske lokacije, Novi Sad",Stan u zgradi ,,,,,,,,,
475,https://www.4zida.rs/prodaja-stanova/avijaticarsko-naselje-gradske-lokacije-novi-sad/cetvorosoban-stan/647de07d42ea270ee0020a8a,"Prodaja stanova Avijatičarsko Naselje, Gradske lokacije, Novi Sad - 4zida",2023-08-29,,,,,,,,,,,,,,,,,,,,,,,,,,,,
476,https://www.4zida.rs/prodaja-stanova/pantelej-gradske-lokacije-nis/jednoiposoban-stan/63c7c8b630e6d5ac0d03bb97,"Jednoiposoban stan na prodaju, Somborski bulevar, 71.800€, 46m² - 4zida",2023-08-29,46 m² ,1.5 soba ,,etažno grejanje ,u izgradnji ,,3/6 spratova ,,terasa ,kupatilo ,,interfon ,,p,pre 4 meseca ,71.800,Somborski bulevar,"Pantelej, Gradske lokacije, Niš",,ima lift (1) ,1 garažno mesto ,,,,,,,
477,https://www.4zida.rs/prodaja-stanova/telep-gradske-lokacije-novi-sad/trosoban-stan/64eca3597edcfb560c099518,"Trosoban stan na prodaju, Telep, 226.600€, 100m² - 4zida",2023-08-29,100 m² ,3 sobe ,uknjiženo ,centralno grejanje ,u izgradnji ,,2/2 sprata ,,,,,,,,pre 1 dan ,226.600,Telep,"Telep, Gradske lokacije, Novi Sad",Stan u zgradi ,,,,,,,,,
478,https://www.4zida.rs/prodaja-stanova/sajmiste-gradske-lokacije-novi-sad/trosoban-stan/64e926cffbe762d900006c89,"Trosoban stan na prodaju, Sajmište, 168.200€, 58m² - 4zida",2023-08-29,58 m² ,3 sobe ,uknjiženo ,grejanje na gas ,uobičajeno stanje ,2017,2/5 spratova ,,terasa ,,,,,1040024 ,pre 3 dana ,168.200,Sajmište,"Sajmište, Gradske lokacije, Novi Sad",Stan u zgradi ,ima lift (1) ,,,,,,,,
479,https://www.4zida.rs/prodaja-stanova/bezanijska-kosa-1-bezanijska-kosa-novi-beograd-beograd/dvosoban-stan/647de24a42ea270ee00212bc,"Prodaja stanova Bežanijska kosa 1, Bežanijska kosa, Novi Beograd, Beograd - 4zida",2023-08-29,,,,,,,,,,,,,,,,,,,,,,,,,,,,
480,https://www.4zida.rs/prodaja-stanova/zemun-centar-zemun-zemun-opstina-beograd/trosoban-stan/64eca9f9e2e89301bb04a38f,"Trosoban stan na prodaju, Banatska, 178.330€, 71m² - 4zida",2023-08-29,71 m² ,3 sobe ,,centralno grejanje ,novo ,,1/6 spratova ,,,kupatilo ,prazno ,telefon ,,2880 ,pre 1 dan ,178.330,Banatska,"Zemun - Centar, Zemun, Zemun opština, Beograd",,,,,,,,,,
481,https://www.4zida.rs/prodaja-stanova/mirijevo-zvezdara-opstina-beograd/dvoiposoban-stan/64e7491f34d261852f0c864f,"Dvoiposoban stan na prodaju, Jovanke Radaković, 115.000€, 63m² - 4zida",2023-08-29,63 m² ,2.5 soba ,uknjiženo ,grejanje na struju ,uobičajeno stanje ,,1/2 sprata ,,"podrum, terasa ",kupatilo ,prazno ,"telefon, klima ",useljivo ,5945 ,pre 5 dana ,115.000,Jovanke Radaković,"Mirijevo, Zvezdara opština, Beograd",,,,,,,,,,
482,https://www.4zida.rs/prodaja-stanova/centar-gradske-lokacije-zlatibor/jednoiposoban-stan/647de1ea42ea270ee0020f90,"Prodaja stanova Centar, Gradske lokacije, Zlatibor - 4zida",2023-08-29,,,,,,,,,,,,,,,,,,,,,,,,,,,,
483,https://www.4zida.rs/prodaja-stanova/futoski-put-gradske-lokacije-novi-sad/dvosoban-stan/64d2049bb9cfd4a5e005c6ab,"Prodaja stanova Futoški Put, Gradske lokacije, Novi Sad - 4zida",2023-08-29,,,,,,,,,,,,,,,,,,,,,,,,,,,,
484,https://www.4zida.rs/prodaja-stanova/telep-gradske-lokacije-novi-sad/dvosoban-stan/64e7d51b1adead01460db994,"Dvosoban stan na prodaju, Telep, 101.350€, 40m² - 4zida",2023-08-29,40 m² ,2 sobe ,,etažno grejanje ,u izgradnji ,2022,4/4 sprata ,,terasa ,,,,,1040049 ,pre 4 dana ,101.350,Telep,"Telep, Gradske lokacije, Novi Sad",Stan u zgradi ,ima lift (1) ,,,,,,,,
485,https://www.4zida.rs/prodaja-stanova/rusanj-cukarica-opstina-beograd/dvoiposoban-stan/64e9b922f1c5f06b2c06117c,"Dvoiposoban stan na prodaju, Oslobodjenja 1deo 1, 52.000€, 52m² - 4zida",2023-08-29,52 m² ,2.5 soba ,uknjiženo ,TA peć ,renovirano ,1980,3/4 sprata ,,podrum ,kuhinja ,prazno ,"telefon, kablovska, kuhinjski elementi, plakar ",useljivo ,,pre 3 dana ,52.000,Oslobodjenja 1deo 1,"Rušanj, Čukarica opština, Beograd",Stan u zgradi ,,,,ulicu ,Kablovska ,532 531 ,,Nema ,Nema 
486,https://www.4zida.rs/prodaja-stanova/altina-zemun-zemun-opstina-beograd/dvoiposoban-stan/64e3666d3d7550db960f546c,"Dvoiposoban stan na prodaju, Ugrinovački put 10. deo, 42.000€, 48m² - 4zida",2023-08-29,48 m² ,2.5 soba ,,etažno grejanje ,novo ,,nisko prizemlje/3 sprata ,1 parking mesto ,,kupatilo ,prazno ,telefon ,useljivo ,1504 ,pre 8 dana ,42.000,Ugrinovački put 10. deo,"Altina, Zemun, Zemun opština, Beograd",,,,,,,,,,
487,https://www.4zida.rs/prodaja-stanova/bulevar-evrope-gradske-lokacije-novi-sad/jednoiposoban-stan/64e474d9cbcde024270cd8a0,"Jednoiposoban stan na prodaju, Bulevar Evrope, 89.000€, 31m² - 4zida",2023-08-29,31 m² ,1.5 soba ,uknjiženo ,grejanje na gas ,novo ,,visoko prizemlje/4 sprata ,1 parking mesto ,"prilaz za invalide, dvorište ","kupatilo, kuhinja, ostava ",namešteno ,"telefon, kablovska, TV, klima, veš mašina, kuhinjski elementi, frižider, zamrzivač, mikrotalasna rerna, rerna, šporet, ležaj, plakar, ugradni plakar ",useljivo ,,pre 6 dana ,89.000,Bulevar Evrope,"Bulevar Evrope, Gradske lokacije, Novi Sad",Stan u zgradi ,,,severoistok ,"ulicu, dvorište ",Optički ,,,,
488,https://www.4zida.rs/prodaja-stanova/divcibare-okolne-lokacije-valjevo/cetvorosoban-stan/647de03242ea270ee0020864,"Prodaja stanova Divčibare, Okolne lokacije, Valjevo - 4zida",2023-08-29,,,,,,,,,,,,,,,,,,,,,,,,,,,,
489,https://www.4zida.rs/prodaja-stanova/bulevar-evrope-gradske-lokacije-novi-sad/cetvorosoban-stan/64edb6ea249176e9f2001347,"Četvorosoban stan na prodaju, 747, 182.670€, 85m² - 4zida",2023-08-29,85 m² ,4 sobe ,,etažno grejanje ,,,,,,,,,,72239 ,pre 10 sati ,182.670,747,"Bulevar Evrope, Gradske lokacije, Novi Sad",Stan u zgradi ,,,,,,,,,
490,https://www.4zida.rs/prodaja-stanova/adice-gradske-lokacije-novi-sad/garsonjera/64df30d2a4602c80a103deda,"Garsonjera na prodaju, Adice, 44.300€, 27m² - 4zida",2023-08-29,,,,,,,,,,,,,,,,,,,,,,,,,,,,
491,https://www.4zida.rs/prodaja-stanova/veternik-gradske-lokacije-novi-sad/dvosoban-stan/64eb8dbe1b584eec520ae1aa,"Dvosoban stan na prodaju, Kninska, 87.000€, 57m² - 4zida",2023-08-29,57 m² ,2 sobe ,uknjiženo ,grejanje na gas ,održavano ,,4/5 spratova ,,terasa ,kupatilo ,prazno ,,,14/23 ,pre 2 dana ,87.000,Kninska,"Veternik, Gradske lokacije, Novi Sad",Stan u zgradi ,,,,,,,,,
492,https://www.4zida.rs/prodaja-stanova/gradska-bolnica-zvezdara-opstina-beograd/jednosoban-stan/64edf29cb218680575010db0,"Jednosoban stan na prodaju, Velebitska, 54.000€, 20m² - 4zida",2023-08-29,20 m² ,1 soba ,uknjiženo ,etažno grejanje ,,,suteren/6 spratova ,,,kupatilo ,prazno ,telefon ,,4403 ,pre 6 sati ,54.000,Velebitska,"Gradska Bolnica, Zvezdara opština, Beograd",,ima lift (1) ,1 garažno mesto ,,,,,,,
493,https://www.4zida.rs/prodaja-stanova/bubanj-palilula-gradske-lokacije-nis/dvoiposoban-stan/6480475c0dc622074301e028,"Prodaja stanova Bubanj, Palilula, Gradske lokacije, Niš - 4zida",2023-08-29,,,,,,,,,,,,,,,,,,,,,,,,,,,,
494,https://www.4zida.rs/prodaja-stanova/kej-zrtava-racije-stari-grad-gradske-lokacije-novi-sad/garsonjera/64ec8da29b3eba7e490379e5,"Garsonjera na prodaju, Kej Žrtava Racije, 56.650€, 21m² - 4zida",2023-08-29,21 m² ,0.5 soba ,uknjiženo ,centralno grejanje ,,,3/4 sprata ,,,,,,,516030 ,pre 1 dan ,56.650,Kej Žrtava Racije,"Kej Žrtava Racije, Stari Grad, Gradske lokacije, Novi Sad",Stan u zgradi ,,,,,,,,,
495,https://www.4zida.rs/prodaja-stanova/zvezdara-zvezdara-opstina-beograd/jednosoban-stan/64ee19ef82c58d5c990081d7,"Jednosoban stan na prodaju, Velebitska, 54.000€, 20m² - 4zida",2023-08-29,20 m² ,1 soba ,uknjiženo ,etažno grejanje ,,,nisko prizemlje ,,,,,klima ,useljivo ,101439 ,pre 3 sata ,54.000,Velebitska,"Zvezdara, Zvezdara opština, Beograd",Stan u zgradi ,,1 garažno mesto ,,,,,,,
496,https://www.4zida.rs/prodaja-stanova/centar-stari-grad-gradske-lokacije-kragujevac/dvoiposoban-stan/647de1c242ea270ee0020e03,"Prodaja stanova Centar, Stari Grad, Gradske lokacije, Kragujevac - 4zida",2023-08-29,,,,,,,,,,,,,,,,,,,,,,,,,,,,
497,https://www.4zida.rs/prodaja-stanova/palisad-okolne-lokacije-zlatibor/jednoiposoban-stan/647de1ed42ea270ee0020fbf,"Prodaja stanova Palisad, Okolne lokacije, Zlatibor - 4zida",2023-08-29,,,,,,,,,,,,,,,,,,,,,,,,,,,,
498,https://www.4zida.rs/prodaja-stanova/blok-64-bezanijski-blokovi-novi-beograd-beograd/dvoiposoban-stan/64db5b3c4afa93e86a052fa3,"Prodaja stanova Blok 64, Bežanijski Blokovi, Novi Beograd, Beograd - 4zida",2023-08-29,,,,,,,,,,,,,,,,,,,,,,,,,,,,
499,https://www.4zida.rs/prodaja-stanova/socijalno-rotkvarija-gradske-lokacije-novi-sad/trosoban-stan/64e5cb7a0172d67dc70a8229,"Trosoban stan na prodaju, Socijalno, 139.050€, 65m² - 4zida",2023-08-29,65 m² ,3 sobe ,uknjiženo ,centralno grejanje ,uobičajeno stanje ,,1/3 sprata ,,terasa ,"kupatilo, kuhinja ",namešteno ,"kablovska, TV, veš mašina, kuhinjski elementi, frižider, rerna, plakar ",useljivo ,,pre 5 dana ,139.050,Socijalno,"Socijalno, Rotkvarija, Gradske lokacije, Novi Sad",Stan u zgradi ,,,istok ,,,,,,
500,https://www.4zida.rs/prodaja-stanova/obilicev-venac-medijana-gradske-lokacije-nis/troiposoban-stan/647de24d42ea270ee00212de,"Prodaja stanova Obilićev Venac, Medijana, Gradske lokacije, Niš - 4zida",2023-08-29,,,,,,,,,,,,,,,,,,,,,,,,,,,,
501,https://www.4zida.rs/prodaja-stanova/somborska-pantelej-gradske-lokacije-nis/dvoiposoban-stan/64c0fd4ba4ac4baf740f87a1,"Prodaja stanova Somborska, Pantelej, Gradske lokacije, Niš - 4zida",2023-08-29,,,,,,,,,,,,,,,,,,,,,,,,,,,,
502,https://www.4zida.rs/prodaja-stanova/petrovaradin-gradske-lokacije-novi-sad/dvosoban-stan/64a3fc664e68e80b3e011b2a,"Prodaja stanova Petrovaradin, Gradske lokacije, Novi Sad - 4zida",2023-08-29,,,,,,,,,,,,,,,,,,,,,,,,,,,,
503,https://www.4zida.rs/prodaja-stanova/centar-gradske-lokacije-pancevo/trosoban-stan/647de09f42ea270ee0020c0a,"Prodaja stanova Centar, Gradske lokacije, Pančevo - 4zida",2023-08-29,,,,,,,,,,,,,,,,,,,,,,,,,,,,
