,link,Površina,Broj soba,Grejanje,Stanje,Spratnost,Lift,Unutrašnje prostorije,Nameštenost,Opremljenost,Šifra oglasa,Oglas ažuriran,price,street,address,title,end_date,Tip,Uknjiženost,Godina izgradnje,Infrastruktura,Useljivo,Orijentacija nekretnine,Pogled na,Garaža,Internet,Parking,Autobuske linije,Tramvajske linije,Useljivo od,Trolejbuske linije
253,https://www.4zida.rs/prodaja-stanova/pantelej-gradske-lokacije-nis/jednoiposoban-stan/64df8011ab91826292072f99,42 m² ,1.5 soba ,grejanje na struju ,novo ,5/7 spratova ,ima lift (1) ,kupatilo ,,interfon ,p,pre 2 dana ,70.000,Bulevar Svetog Pantelejmona,"Pantelej, Gradske lokacije, Niš","Jednoiposoban stan na prodaju, Bulevar Svetog Pantelejmona, 70.000€, 42m² - 4zida",2023-08-21,,,,terasa ,,,,1 garažno mesto ,,,,,,
254,https://www.4zida.rs/prodaja-stanova/retenzija-zemun-zemun-opstina-beograd/dvosoban-stan/64df5eba578c1ca2d80a868b,64 m² ,2 sobe ,centralno grejanje ,uobičajeno stanje ,7/8 spratova ,ima lift (1) ,kupatilo ,prazno ,"telefon, kablovska, internet, interfon ",8783 ,pre 2 dana ,175.000,Džona Kenedija,"Retenzija, Zemun, Zemun opština, Beograd","Dvosoban stan na prodaju, Džona Kenedija, 175.000€, 64m² - 4zida",2023-08-21,,uknjiženo ,,"podrum, lođa ",,,,,,,,,,
255,https://www.4zida.rs/prodaja-stanova/centar-gradske-lokacije-zrenjanin/garsonjera/64de08085454174843049c58,29 m² ,0.5 soba ,,,1. sprat ,,,,,30098 ,pre 2 dana ,42.000,Centar,"Centar, Gradske lokacije, Zrenjanin","Garsonjera na prodaju, Centar, 42.000€, 29m² - 4zida",2023-08-21,,,,,,,,,,,,,,
256,https://www.4zida.rs/prodaja-stanova/centar-gradske-lokacije-trstenik/dvosoban-stan/64df03fdee3827a9da06090a,55 m² ,2 sobe ,centralno grejanje ,uobičajeno stanje ,7/8 spratova ,ima lift (1) ,ostava ,prazno ,,,pre 3 dana ,42.000,Miodraga Cajetinca Cajke,"Centar, Gradske lokacije, Trstenik","Dvosoban stan na prodaju, Miodraga Cajetinca Cajke, 42.000€, 55m² - 4zida",2023-08-21,Stan u zgradi ,uknjiženo ,,"prilaz za invalide, podrum ",useljivo ,,,,,,,,,
257,https://www.4zida.rs/prodaja-stanova/nova-detelinara-detelinara-gradske-lokacije-novi-sad/dvosoban-stan/64de7ab656088a8a740e5eed,50 m² ,2 sobe ,centralno grejanje ,održavano ,3/5 spratova ,ima lift (1) ,"kupatilo, kuhinja, ostava ",polunamešteno ,"telefon, klima, ugradni plakar ",,pre 1 dan ,107.000,Dr Svetislava Kasapinovica,"Nova Detelinara, Detelinara, Gradske lokacije, Novi Sad","Dvosoban stan na prodaju, Dr Svetislava Kasapinovica, 107.000€, 50m² - 4zida",2023-08-21,Stan u zgradi ,uknjiženo ,2010,"prilaz za invalide, dvorište, podrum, terasa ",useljivo ,severoistok ,ulicu ,,Optički ,1 parking mesto ,,,,
258,https://www.4zida.rs/prodaja-stanova/sarengrad-novo-naselje-gradske-lokacije-novi-sad/jednosoban-stan/64df965f197e4420260d1e69,36 m² ,1 soba ,centralno grejanje ,renovirano ,2/3 sprata ,ima lift (1) ,"kupatilo, kuhinja, ostava ",polunamešteno ,,515708 ,pre 2 dana ,74.270,Šarengrad,"Šarengrad, Novo Naselje, Gradske lokacije, Novi Sad","Jednosoban stan na prodaju, Šarengrad, 74.270€, 36m² - 4zida",2023-08-21,Stan u zgradi ,uknjiženo ,,terasa ,useljivo ,,,,,,,,,
259,https://www.4zida.rs/prodaja-stanova/vikend-naselje-okolne-lokacije-kopaonik/garsonjera/64de30ee245504cb500af8e8,26 m² ,0.5 soba ,norveški radijatori ,luksuzno ,1/5 spratova ,ima lift (1) ,kupatilo ,namešteno ,,,pre 3 dana ,49.000,Kraljevi Čardaci,"Vikend naselje, Okolne lokacije, Kopaonik","Garsonjera na prodaju, Kraljevi Čardaci, 49.000€, 26m² - 4zida",2023-08-21,Apartman ,uknjiženo ,,,useljivo ,,,,,,,,,
260,https://www.4zida.rs/prodaja-stanova/adice-gradske-lokacije-novi-sad/jednoiposoban-stan/64d9f2a586f8c85d3e0fb225,,,,,,,,,,,,,,,"Prodaja stanova Adice, Gradske lokacije, Novi Sad - 4zida",2023-08-21,,,,,,,,,,,,,,
261,https://www.4zida.rs/prodaja-stanova/mokranjcev-palilula-gradske-lokacije-nis/jednosoban-stan/64bfdaca9de0419ad50f56f4,33 m² ,1 soba ,centralno grejanje ,,prizemlje ,,,prazno ,,3675 ,pre 26 dana ,46.000,Mokranjčev,"Mokranjčev, Palilula, Gradske lokacije, Niš","Jednosoban stan na prodaju, Mokranjčev, 46.000€, 33m² - 4zida",2023-08-21,,uknjiženo ,,,,,,,,,,,,
262,https://www.4zida.rs/prodaja-stanova/centar-gradske-lokacije-zrenjanin/trosoban-stan/64deb8b7420e5f17c00b979a,45 m² ,3 sobe ,grejanje na struju ,,nisko prizemlje ,,kupatilo ,,klima ,1795 ,pre 3 dana ,30.000,"Zrenjanin, Širi centar","Centar, Gradske lokacije, Zrenjanin","Trosoban stan na prodaju, Zrenjanin, Širi centar, 30.000€, 45m² - 4zida",2023-08-21,,uknjiženo ,,,,,,,,1 parking mesto ,,,,
263,https://www.4zida.rs/prodaja-stanova/banjica-vozdovac-opstina-beograd/trosoban-stan/64df6244578c1ca2d80a875d,77 m² ,3 sobe ,centralno grejanje ,renovirano ,2/6 spratova ,ima lift (1) ,,,,8889 ,pre 2 dana ,172.000,Bulevar oslobođenja,"Banjica, Voždovac opština, Beograd","Trosoban stan na prodaju, Bulevar oslobođenja, 172.000€, 77m² - 4zida",2023-08-21,,uknjiženo ,,lođe (2) ,useljivo ,,,,,,,,,
264,https://www.4zida.rs/prodaja-stanova/stepa-stepanovic-vozdovac-opstina-beograd/jednoiposoban-stan/64dca0a1aec3b00502015dde,46 m² ,1.5 soba ,grejanje na gas ,novo ,8/8 spratova ,ima lift (1) ,kupatilo ,prazno ,telefon ,3146 ,pre 4 dana ,115.000,Dušana Jovanovića,"Stepa Stepanović, Voždovac opština, Beograd","Jednoiposoban stan na prodaju, Dušana Jovanovića, 115.000€, 46m² - 4zida",2023-08-21,,uknjiženo ,,terasa ,,,,,,,,,,
265,https://www.4zida.rs/prodaja-stanova/cukarica-cukarica-opstina-beograd/jednosoban-stan/64ddf5182f37fbcc350feb09,31 m² ,1 soba ,,,3/5 spratova ,,,polunamešteno ,,7341 ,pre 3 dana ,79.000,Čukarica,"Čukarica, Čukarica opština, Beograd","Jednosoban stan na prodaju, Čukarica, 79.000€, 31m² - 4zida",2023-08-21,Stan u zgradi ,,,,,,,,,,,,,
266,https://www.4zida.rs/prodaja-stanova/gradske-lokacije-vrnjacka-banja/dvosoban-stan/64e08b48e5dcd72ce60990c2,81 m² ,2 sobe ,grejanje na struju ,u izgradnji ,,,,,,,pre 1 dan ,89.000,Gradske lokacije,"Gradske lokacije, Vrnjačka Banja","Dvosoban stan na prodaju, Gradske lokacije, 89.000€, 81m² - 4zida",2023-08-21,Stan u zgradi ,u procesu uknjižavanja ,,,,,,,,,,,,
267,https://www.4zida.rs/prodaja-stanova/centar-gradske-lokacije-vrnjacka-banja/garsonjera/64db2cd232efa77a5d049103,,,,,,,,,,,,,,,"Prodaja stanova Centar, Gradske lokacije, Vrnjačka Banja, Garsonjera - 4zida",2023-08-21,,,,,,,,,,,,,,
268,https://www.4zida.rs/prodaja-stanova/jezero-okolne-lokacije-zlatibor/jednoiposoban-stan/64b90631a721c55044039202,,,,,,,,,,,,,,,"Prodaja stanova Jezero, Okolne lokacije, Zlatibor - 4zida",2023-08-21,,,,,,,,,,,,,,
269,https://www.4zida.rs/prodaja-stanova/sarengrad-novo-naselje-gradske-lokacije-novi-sad/dvosoban-stan/64ad13cf05e7c545c00c54d9,,,,,,,,,,,,,,,"Prodaja stanova Šarengrad, Novo Naselje, Gradske lokacije, Novi Sad - 4zida",2023-08-21,,,,,,,,,,,,,,
270,https://www.4zida.rs/prodaja-stanova/obrenovac-obrenovac-opstina-beograd/jednosoban-stan/647f121ee81e5725180ae85b,,,,,,,,,,,,,,,"Prodaja stanova Obrenovac, Obrenovac opština, Beograd - 4zida",2023-08-21,,,,,,,,,,,,,,
271,https://www.4zida.rs/prodaja-stanova/novo-naselje-gradske-lokacije-novi-sad/garsonjera/64df35071901ec101a0c4a4f,29 m² ,0.5 soba ,,uobičajeno stanje ,5/5 spratova ,ima lift (1) ,,,,1016493 ,pre 2 dana ,71.600,Novo Naselje,"Novo Naselje, Gradske lokacije, Novi Sad","Garsonjera na prodaju, Novo Naselje, 71.600€, 29m² - 4zida",2023-08-21,Stan u zgradi ,uknjiženo ,,,,,,,,,,,,
272,https://www.4zida.rs/prodaja-stanova/bulevar-evrope-gradske-lokacije-novi-sad/dvosoban-stan/63dd420e566370e97e0e796e,49 m² ,2 sobe ,grejanje na gas ,,3/3 sprata ,ima lift (1) ,,,,1045700 ,pre 2 dana ,116.485,Bulevar Evrope,"Bulevar Evrope, Gradske lokacije, Novi Sad","Dvosoban stan na prodaju, Bulevar Evrope, 116.485€, 49m² - 4zida",2023-08-21,,,2023,terasa ,,,,,,,,,,
273,https://www.4zida.rs/prodaja-stanova/telep-gradske-lokacije-novi-sad/trosoban-stan/64dfaa25f2c9a0af0b0ac78b,59 m² ,3 sobe ,podno grejanje ,u izgradnji ,2/3 sprata ,ima lift (1) ,,prazno ,"kablovska, internet, interfon, klima ",2674 ,pre 2 dana ,125.700,Telep,"Telep, Gradske lokacije, Novi Sad","Trosoban stan na prodaju, Telep, 125.700€, 59m² - 4zida",2023-08-21,Stan u zgradi ,,2023,terasa ,,,,1 garažno mesto ,,1 parking mesto ,,,,
274,https://www.4zida.rs/prodaja-stanova/gradske-lokacije-vrnjacka-banja/garsonjera/64da215b1a3bc0483f0adefd,28 m² ,0.5 soba ,,novo ,,,,namešteno ,,,pre 2 dana ,51.500,Gradske lokacije,"Gradske lokacije, Vrnjačka Banja","Garsonjera na prodaju, Gradske lokacije, 51.500€, 28m² - 4zida",2023-08-21,Stan u zgradi ,uknjiženo ,,,,,,,,,,,,
275,https://www.4zida.rs/prodaja-stanova/karaburma-palilula-opstina-beograd/dvosoban-stan/64d3a1ae82749e98790ac113,,,,,,,,,,,,,,,"Prodaja stanova Karaburma, Palilula opština, Beograd - 4zida",2023-08-21,,,,,,,,,,,,,,
276,https://www.4zida.rs/prodaja-stanova/centar-2-gradske-lokacije-subotica/trosoban-stan/63134a8b6ec84b69a90e0858,72 m² ,3 sobe ,grejanje na gas ,novo ,1. sprat ,ima lift (1) ,"kupatilo, toalet ",,"telefon, internet ",1270 ,pre 4 meseca ,93.600,Karađorđev put,"Centar 2, Gradske lokacije, Subotica","Trosoban stan na prodaju, Karađorđev put, 93.600€, 72m² - 4zida",2023-08-21,,,,terasa ,,,,,,,,,,
277,https://www.4zida.rs/prodaja-stanova/cara-dusana-adamovicevo-naselje-gradske-lokacije-novi-sad/dvosoban-stan/64e1084fb7df34c989073952,59 m² ,2 sobe ,centralno grejanje ,uobičajeno stanje ,visoko prizemlje/4 sprata ,ima lift (1) ,"kupatilo, kuhinja, ostava ",,"telefon, kablovska ",515762 ,pre 1 dan ,125.660,Cara Dušana,"Cara Dušana, Adamovićevo Naselje, Gradske lokacije, Novi Sad","Dvosoban stan na prodaju, Cara Dušana, 125.660€, 59m² - 4zida",2023-08-21,Stan u zgradi ,uknjiženo ,,terasa ,,,,,Kablovska ,,,,,
278,https://www.4zida.rs/prodaja-stanova/dragomir-gajic-gradske-lokacije-krusevac/cetvorosoban-stan/648af4d02bbee0bbab0c4569,110 m² ,4 sobe ,centralno grejanje ,novo ,1/4 sprata ,,kupatilo ,prazno ,,,pre 2 meseca ,95.000,Dragomir Gajić,"Dragomir Gajić, Gradske lokacije, Kruševac","Četvorosoban stan na prodaju, Dragomir Gajić, 95.000€, 110m² - 4zida",2023-08-21,Stan u zgradi ,uknjiženo ,,terasa ,,,,,,,,,,
279,https://www.4zida.rs/prodaja-stanova/autokomanda-vozdovac-opstina-beograd/jednosoban-stan/6420aad5ff805895d504b27a,38 m² ,1 soba ,centralno grejanje ,,3/8 spratova ,ima lift (1) ,,,,,pre 33 dana ,104.900,Autokomanda,"Autokomanda, Voždovac opština, Beograd","Jednosoban stan na prodaju, Autokomanda, 104.900€, 38m² - 4zida",2023-08-21,Stan u zgradi ,uknjiženo ,,,useljivo ,,,,,,,,,
280,https://www.4zida.rs/prodaja-stanova/streliste-gradske-lokacije-pancevo/jednoiposoban-stan/64ddcc4135b55f27e2085fb2,57 m² ,1.5 soba ,,,1/1 sprat ,,,prazno ,,,pre 4 dana ,48.500,Strelište,"Strelište, Gradske lokacije, Pančevo","Jednoiposoban stan na prodaju, Strelište, 48.500€, 57m² - 4zida",2023-08-21,Stan u zgradi ,uknjiženo ,,terasa ,,,,,,,,,,
281,https://www.4zida.rs/prodaja-stanova/liman-1-liman-gradske-lokacije-novi-sad/trosoban-stan/647cf05fae64ab52340c7f40,67 m² ,3 sobe ,centralno grejanje ,,8/11 spratova ,ima lift (1) ,,,,1046475 ,pre 2 meseca ,163.770,Liman 1,"Liman 1, Liman, Gradske lokacije, Novi Sad","Trosoban stan na prodaju, Liman 1, 163.770€, 67m² - 4zida",2023-08-21,,,1968,terasa ,,,,,,,,,,
282,https://www.4zida.rs/prodaja-stanova/telep-gradske-lokacije-novi-sad/troiposoban-stan/64de305b760b719a2c0e0019,58 m² ,3.5 soba ,grejanje na gas ,,2/2 sprata ,,,,"telefon, kablovska ",515651 ,pre 3 dana ,136.580,Telep,"Telep, Gradske lokacije, Novi Sad","Troiposoban stan na prodaju, Telep, 136.580€, 58m² - 4zida",2023-08-21,Stan u zgradi ,uknjiženo ,,terasa ,,,,,,,,,,
283,https://www.4zida.rs/prodaja-stanova/lipov-lad-zvezdara-opstina-beograd/jednoiposoban-stan/64de04715454174843049bb4,47 m² ,1.5 soba ,centralno grejanje ,uobičajeno stanje ,3/4 sprata ,ima lift (1) ,kupatilo ,namešteno ,"telefon, interfon ",2158 ,pre 3 dana ,118.000,Stanislava Sremčevića,"Lipov Lad, Zvezdara opština, Beograd","Jednoiposoban stan na prodaju, Stanislava Sremčevića, 118.000€, 47m² - 4zida",2023-08-21,,,2006,,,,,,,,,,,
284,https://www.4zida.rs/prodaja-stanova/detelinara-gradske-lokacije-novi-sad/garsonjera/648ed72ddf185287440603ed,31 m² ,0.5 soba ,centralno grejanje ,novo ,2/6 spratova ,,,prazno ,,512969 ,pre 2 meseca ,69.000,Detelinara,"Detelinara, Gradske lokacije, Novi Sad","Garsonjera na prodaju, Detelinara, 69.000€, 31m² - 4zida",2023-08-21,Stan u zgradi ,uknjiženo ,,,,,,,,,,,,
285,https://www.4zida.rs/prodaja-stanova/gradske-lokacije-vrnjacka-banja/jednoiposoban-stan/64ae5e411ad814059d0d6bd5,,,,,,,,,,,,,,,"Prodaja stanova Gradske lokacije, Vrnjačka Banja - 4zida",2023-08-21,,,,,,,,,,,,,,
286,https://www.4zida.rs/prodaja-stanova/centar-medijana-gradske-lokacije-nis/dvosoban-stan/64624362e2ae888ca30fba12,42 m² ,2 sobe ,grejanje na struju ,renovirano ,3. sprat ,ima lift (1) ,kupatilo ,prazno ,interfon ,p,pre 3 meseca ,89.000,Nade Tomić,"Centar, Medijana, Gradske lokacije, Niš","Dvosoban stan na prodaju, Nade Tomić, 89.000€, 42m² - 4zida",2023-08-21,,uknjiženo ,,,,,,,,1 parking mesto ,,,,
287,https://www.4zida.rs/prodaja-stanova/julino-brdo-cukarica-cukarica-opstina-beograd/jednoiposoban-stan/64d26a768a032f421c019e37,40 m² ,1.5 soba ,centralno grejanje ,,2/4 sprata ,ima lift (1) ,,,"telefon, klima ",100911 ,pre 12 dana ,110.000,Marine Veličković,"Julino Brdo, Čukarica, Čukarica opština, Beograd","Jednoiposoban stan na prodaju, Marine Veličković, 110.000€, 40m² - 4zida",2023-08-21,Stan u zgradi ,uknjiženo ,,lođa ,useljivo ,,,,,1 parking mesto ,,,,
288,https://www.4zida.rs/prodaja-stanova/liman-4-liman-gradske-lokacije-novi-sad/dvosoban-stan/6420998f1eb6daf57e031e87,,,,,,,,,,,,,,,"Prodaja stanova Liman 4, Liman, Gradske lokacije, Novi Sad - 4zida",2023-08-21,,,,,,,,,,,,,,
289,https://www.4zida.rs/prodaja-stanova/vozdovac-vozdovac-opstina-beograd/dvoiposoban-stan/64df554387316329140a7312,69 m² ,2.5 soba ,grejanje na gas ,,3/5 spratova ,ima lift (1) ,,prazno ,"interfon, klima ",2689 ,pre 2 dana ,193.200,Bože Jankovića,"Voždovac, Voždovac opština, Beograd","Dvoiposoban stan na prodaju, Bože Jankovića, 193.200€, 69m² - 4zida",2023-08-21,Stan u zgradi ,uknjiženo ,2019,terasa ,,,,,,,,,,
290,https://www.4zida.rs/prodaja-stanova/blok-22-novi-beograd-beograd/dvoiposoban-stan/63bdaf90a76eae15ae024b0e,65 m² ,2.5 soba ,centralno grejanje ,,2/6 spratova ,ima lift (1) ,,,,3159 ,pre 4 meseca ,190.000,Milentija Popoviæa,"Blok 22, Novi Beograd, Beograd","Dvoiposoban stan na prodaju, Milentija Popoviæa, 190.000€, 65m² - 4zida",2023-08-21,Stan u zgradi ,uknjiženo ,,"podrum, terasa ",useljivo ,,,,,,,,,
291,https://www.4zida.rs/prodaja-stanova/sajmiste-gradske-lokacije-novi-sad/dvosoban-stan/64c7b488e5601883140a531e,40 m² ,2 sobe ,,u izgradnji ,3/4 sprata ,,,,,1096493 ,pre 5 dana ,88.580,Sajmište,"Sajmište, Gradske lokacije, Novi Sad","Dvosoban stan na prodaju, Sajmište, 88.580€, 40m² - 4zida",2023-08-21,Stan u zgradi ,uknjiženo ,1980,terasa ,,,,,,,,,,
292,https://www.4zida.rs/prodaja-stanova/zemun-polje-zemun-zemun-opstina-beograd/trosoban-stan/6453a538f2186b8a880958bd,63 m² ,3 sobe ,etažno grejanje ,renovirano ,3/3 sprata ,,,prazno ,"interfon, klima ",2550 ,pre 1 mesec ,102.000,Franje Krča,"Zemun Polje, Zemun, Zemun opština, Beograd","Trosoban stan na prodaju, Franje Krča, 102.000€, 63m² - 4zida",2023-08-21,Stan u zgradi ,uknjiženo ,1975,terasa ,,,,,,,,,,
293,https://www.4zida.rs/prodaja-stanova/nova-detelinara-detelinara-gradske-lokacije-novi-sad/dvosoban-stan/64df3a864aa6286e56092361,42 m² ,2 sobe ,grejanje na gas ,novo ,1/5 spratova ,ima lift (1) ,"kuhinja, ostava ",namešteno ,"kablovska, internet, interfon, TV, klima, veš mašina, frižider, šporet, ležaj ",2667 ,pre 2 dana ,110.210,Nova Detelinara,"Nova Detelinara, Detelinara, Gradske lokacije, Novi Sad","Dvosoban stan na prodaju, Nova Detelinara, 110.210€, 42m² - 4zida",2023-08-21,Stan u zgradi ,uknjiženo ,2020,terasa ,,,,,,,,,,
294,https://www.4zida.rs/prodaja-stanova/banovo-brdo-cukarica-cukarica-opstina-beograd/jednoiposoban-stan/64e117fbe954b9c8070e60a5,33 m² ,1.5 soba ,centralno grejanje ,uobičajeno stanje ,2/4 sprata ,,kupatilo ,prazno ,"telefon, kablovska, internet, interfon, klima ",1301 ,pre 1 dan ,85.000,Pere Todorovića,"Banovo Brdo, Čukarica, Čukarica opština, Beograd","Jednoiposoban stan na prodaju, Pere Todorovića, 85.000€, 33m² - 4zida",2023-08-21,,uknjiženo ,,,useljivo ,,,,,1 parking mesto ,,,,
295,https://www.4zida.rs/prodaja-stanova/detelinara-gradske-lokacije-novi-sad/dvoiposoban-stan/64d7f8b4e33dfdc00709a23a,58 m² ,2.5 soba ,centralno grejanje ,renovirano ,visoko prizemlje/5 spratova ,,"kupatilo, kuhinja ",prazno ,,,pre 9 sati ,133.500,Kornelija Stankovića,"Detelinara, Gradske lokacije, Novi Sad","Dvoiposoban stan na prodaju, Kornelija Stankovića, 133.500€, 58m² - 4zida",2023-08-21,Stan u zgradi ,uknjiženo ,1970,podrum ,useljivo ,jugoistok ,ulicu ,,,,,,,
296,https://www.4zida.rs/prodaja-stanova/blok-33-geneks-novi-beograd-beograd/trosoban-stan/64da46ea091bd55b1704fdc1,68 m² ,3 sobe ,centralno grejanje ,renovirano ,1/4 sprata ,,ostava ,prazno ,"interfon, klima ",2683 ,pre 5 dana ,194.000,Omladinskih brigada,"Blok 33 - Geneks, Novi Beograd, Beograd","Trosoban stan na prodaju, Omladinskih brigada, 194.000€, 68m² - 4zida",2023-08-21,Stan u zgradi ,uknjiženo ,1968,"podrum, terasa ",,,,,,,,,,
297,https://www.4zida.rs/prodaja-stanova/bubanj-centar-gradske-lokacije-kragujevac/dvoiposoban-stan/64b685046f8a1df38304f228,,,,,,,,,,,,,,,"Prodaja stanova Bubanj, Centar, Gradske lokacije, Kragujevac - 4zida",2023-08-21,,,,,,,,,,,,,,
298,https://www.4zida.rs/prodaja-stanova/slavija-vracar-beograd/garsonjera/64de052c95f905cb2f0fe40c,33 m² ,0.5 soba ,centralno grejanje ,uobičajeno stanje ,2/5 spratova ,ima lift (1) ,"kupatilo, kuhinja ",namešteno ,"telefon, kablovska, klima, veš mašina, kuhinjski elementi, ugradni plakar ",3267 ,pre 2 dana ,149.000,Birčaninova,"Slavija, Vračar, Beograd","Garsonjera na prodaju, Birčaninova, 149.000€, 33m² - 4zida",2023-08-21,Stan u zgradi ,uknjiženo ,,podrum ,,,,,,,,,,
299,https://www.4zida.rs/prodaja-stanova/4-juli-gradske-lokacije-zrenjanin/dvosoban-stan/64e00a2c07e5a4cca60404f6,58 m² ,2 sobe ,centralno grejanje ,,4. sprat ,,kupatilo ,,,1798 ,pre 2 dana ,39.000,"Zrenjanin, 4. jul","4. Juli, Gradske lokacije, Zrenjanin","Dvosoban stan na prodaju, Zrenjanin, 4. jul, 39.000€, 58m² - 4zida",2023-08-21,,uknjiženo ,,,useljivo ,,,,,,,,,
300,https://www.4zida.rs/prodaja-stanova/centar-savski-venac-beograd/trosoban-stan/64d3d697682296aec003b7d8,90 m² ,3 sobe ,etažno grejanje ,,4/4 sprata ,,,,telefon ,90867 ,pre 8 dana ,279.000,Kraljevica Marka,"Centar, Savski Venac, Beograd","Trosoban stan na prodaju, Kraljevica Marka, 279.000€, 90m² - 4zida",2023-08-21,Stan u zgradi ,uknjiženo ,2000,,useljivo ,,,,,,,,,
301,https://www.4zida.rs/prodaja-stanova/gornji-grad-zemun-zemun-opstina-beograd/jednoiposoban-stan/63ced3637e6a79081f02a812,42 m² ,1.5 soba ,etažno grejanje ,novo ,3/5 spratova ,ima lift (1) ,,prazno ,"kablovska, internet, interfon, klima, Kanalizacija ",1271 ,pre 1 mesec ,106.800,Gornji Grad,"Gornji Grad, Zemun, Zemun opština, Beograd","Jednoiposoban stan na prodaju, Gornji Grad, 106.800€, 42m² - 4zida",2023-08-21,Stan u zgradi ,uknjiženo ,2023,terasa ,useljivo ,,,1 garažno mesto ,,1 parking mesto ,,,,
302,https://www.4zida.rs/prodaja-stanova/radijalac-gradske-lokacije-subotica/dvoiposoban-stan/64db17e472cab43b0408551d,55 m² ,2.5 soba ,centralno grejanje ,renovirano ,4/5 spratova ,ima lift (1) ,"kupatilo, kuhinja, ostava ",namešteno ,"telefon, kablovska, internet, klima, veš mašina, kuhinjski elementi, sudo mašina, frižider, rerna, šporet, ležaj ",,pre 2 dana ,70.000,Radijalac,"Radijalac, Gradske lokacije, Subotica","Dvoiposoban stan na prodaju, Radijalac, 70.000€, 55m² - 4zida",2023-08-21,Stan u zgradi ,uknjiženo ,1970,"podrum, terasa ",,jugoistok ,ulicu ,,Optički ,,,,,
303,https://www.4zida.rs/prodaja-stanova/hram-svetog-save-neimar-vracar-beograd/cetvorosoban-stan/64d35d6e9e1a647b61031aa6,180 m² ,4 sobe ,etažno grejanje ,u izgradnji ,1/4 sprata ,ima lift (1) ,,prazno ,"kablovska, internet, interfon, klima ",3 ,pre 11 dana ,990.000,Hram Svetog Save,"Hram Svetog Save, Neimar, Vračar, Beograd","Četvorosoban stan na prodaju, Hram Svetog Save, 990.000€, 180m² - 4zida",2023-08-21,Stan u zgradi ,,2023,terasa ,,,,,,,,,,
304,https://www.4zida.rs/prodaja-stanova/centar-gradske-lokacije-zlatibor/jednosoban-stan/64dc7397a3cc2d6c580a371c,38 m² ,1 soba ,grejanje na struju ,novo ,4/6 spratova ,,kupatilo ,namešteno ,,,pre 5 dana ,105.000,Svetogorska,"Centar, Gradske lokacije, Zlatibor","Jednosoban stan na prodaju, Svetogorska, 105.000€, 38m² - 4zida",2023-08-21,Stan u zgradi ,uknjiženo ,,terasa ,,,,,,,,,,
305,https://www.4zida.rs/prodaja-stanova/palisad-okolne-lokacije-zlatibor/garsonjera/64899e2dd62912f09408ea44,,,,,,,,,,,,,,,"Prodaja stanova Palisad, Okolne lokacije, Zlatibor, Garsonjera - 4zida",2023-08-21,,,,,,,,,,,,,,
306,https://www.4zida.rs/prodaja-stanova/satelit-novo-naselje-gradske-lokacije-novi-sad/jednoiposoban-stan/64cd774583eda766a70cdc2d,33 m² ,1.5 soba ,centralno grejanje ,uobičajeno stanje ,3/4 sprata ,,,,,1039999 ,pre 16 dana ,69.000,Satelit,"Satelit, Novo Naselje, Gradske lokacije, Novi Sad","Jednoiposoban stan na prodaju, Satelit, 69.000€, 33m² - 4zida",2023-08-21,Stan u zgradi ,uknjiženo ,2007,terasa ,,,,,,,,,,
307,https://www.4zida.rs/prodaja-stanova/satelit-novo-naselje-gradske-lokacije-novi-sad/dvosoban-stan/64d5fce6dbd8843c510ce900,48 m² ,2 sobe ,centralno grejanje ,uobičajeno stanje ,visoko prizemlje/4 sprata ,,kupatilo ,prazno ,klima ,,pre 2 dana ,87.550,Satelit,"Satelit, Novo Naselje, Gradske lokacije, Novi Sad","Dvosoban stan na prodaju, Satelit, 87.550€, 48m² - 4zida",2023-08-21,Stan u zgradi ,uknjiženo ,,podrum ,useljivo ,,,,,,,,,
308,https://www.4zida.rs/prodaja-stanova/telep-gradske-lokacije-novi-sad/troiposoban-stan/64de4d356efd61a48e0794cf,58 m² ,3.5 soba ,grejanje na gas ,novo ,2/2 sprata ,,,,,515651 ,pre 3 dana ,136.580,Telep,"Telep, Gradske lokacije, Novi Sad","Troiposoban stan na prodaju, Telep, 136.580€, 58m² - 4zida",2023-08-21,Stan u zgradi ,uknjiženo ,,terasa ,,,,,,,,,,
309,https://www.4zida.rs/prodaja-stanova/lekino-brdo-vozdovac-opstina-beograd/jednosoban-stan/6447c40e3680f861ef0b5428,39 m² ,1 soba ,etažno grejanje ,,prizemlje/4 sprata ,,kupatilo ,prazno ,"telefon, interfon, klima ",5236 ,pre 30 dana ,149.000,Garibaldijeva,"Lekino Brdo, Voždovac opština, Beograd","Jednosoban stan na prodaju, Garibaldijeva, 149.000€, 39m² - 4zida",2023-08-21,,uknjiženo ,2015,terasa ,useljivo ,,,,,,,,,
310,https://www.4zida.rs/prodaja-stanova/medakovic-3-medakovic-vozdovac-opstina-beograd/jednoiposoban-stan/64c7a64fdab6ec23ae0d7610,40 m² ,1.5 soba ,etažno grejanje ,,2/4 sprata ,,,,,548800 ,pre 20 dana ,80.000,Cvetanova Ćuprija,"Medaković 3, Medaković, Voždovac opština, Beograd","Jednoiposoban stan na prodaju, Cvetanova Ćuprija, 80.000€, 40m² - 4zida",2023-08-21,Stan u zgradi ,nije uknjiženo ,,,useljivo ,,,,,,,,,
311,https://www.4zida.rs/prodaja-stanova/obrenovac-okolne-lokacije-pirot/dvosoban-stan/64b7ad447752b8c34007e498,62 m² ,2 sobe ,centralno grejanje ,novo ,3/3 sprata ,ima lift (1) ,,prazno ,"kablovska, internet, interfon, Kanalizacija ",1586 ,pre 32 dana ,96.000,Obrenovac ,"Obrenovac , Okolne lokacije, Pirot","Dvosoban stan na prodaju, Obrenovac , 96.000€, 62m² - 4zida",2023-08-21,Stan u zgradi ,uknjiženo ,2023,"terasa, Bazen za plivanje ",useljivo ,,,1 garažno mesto ,,1 parking mesto ,,,,
312,https://www.4zida.rs/prodaja-stanova/adice-gradske-lokacije-novi-sad/troiposoban-stan/648c663666d0e76230087e4e,62 m² ,3.5 soba ,grejanje na struju ,,prizemlje/2 sprata ,,,,telefon ,98390 ,pre 2 meseca ,147.000,Rafaila Sisatovackog,"Adice, Gradske lokacije, Novi Sad","Troiposoban stan na prodaju, Rafaila Sisatovackog, 147.000€, 62m² - 4zida",2023-08-21,Stan u zgradi ,nije uknjiženo ,,terasa ,useljivo ,,,1 garažno mesto ,,1 parking mesto ,,,,
313,https://www.4zida.rs/prodaja-stanova/petrovaradin-gradske-lokacije-novi-sad/cetvorosoban-stan/64142152ab3a849f280fe73e,,,,,,,,,,,,,,,"Prodaja stanova Petrovaradin, Gradske lokacije, Novi Sad - 4zida",2023-08-21,,,,,,,,,,,,,,
314,https://www.4zida.rs/prodaja-stanova/adice-gradske-lokacije-novi-sad/jednoiposoban-stan/64b80e3ae6f95a152003f75d,29 m² ,1.5 soba ,,u izgradnji ,1/3 sprata ,,,,,1005802 ,pre 32 dana ,63.860,Adice,"Adice, Gradske lokacije, Novi Sad","Jednoiposoban stan na prodaju, Adice, 63.860€, 29m² - 4zida",2023-08-21,Stan u zgradi ,,,terasa ,,,,,,,,,,
315,https://www.4zida.rs/prodaja-stanova/stara-detelinara-detelinara-gradske-lokacije-novi-sad/dvosoban-stan/64592ad5dac343c3f6046c9d,53 m² ,2 sobe ,centralno grejanje ,renovirano ,11/12 spratova ,ima lift (2) ,kupatilo ,prazno ,,506322 ,pre 3 meseca ,95.790,Stara Detelinara,"Stara Detelinara, Detelinara, Gradske lokacije, Novi Sad","Dvosoban stan na prodaju, Stara Detelinara, 95.790€, 53m² - 4zida",2023-08-21,Stan u zgradi ,uknjiženo ,,"terasa, lođa ",,,,,,,,,,
316,https://www.4zida.rs/prodaja-stanova/avijaticarsko-naselje-gradske-lokacije-novi-sad/dvosoban-stan/649dbb7a1636dab7eb0d40fb,60 m² ,2 sobe ,centralno grejanje ,novo ,4/5 spratova ,ima lift (1) ,,prazno ,,512178 ,pre 1 mesec ,122.000,Avijatičarsko Naselje,"Avijatičarsko Naselje, Gradske lokacije, Novi Sad","Dvosoban stan na prodaju, Avijatičarsko Naselje, 122.000€, 60m² - 4zida",2023-08-21,Stan u zgradi ,uknjiženo ,,terase (2) ,useljivo ,,,,,1 parking mesto ,,,,
