,link,Površina,Broj soba,Uknjiženost,Grejanje,Stanje,Spratnost,Infrastruktura,Nameštenost,Opremljenost,Useljivo,Šifra oglasa,Oglas ažuriran,price,street,address,title,end_date,Tip,Godina izgradnje,Lift,Garaža,Parking,Unutrašnje prostorije,Orijentacija nekretnine,Useljivo od,Pogled na,Autobuske linije,Internet,Tramvajske linije,Trolejbuske linije
1080,https://www.4zida.rs/prodaja-stanova/zeleno-brdo-zvezdara-opstina-beograd/dvosoban-stan/650f3d789ecd1eadce039a16,46 m² ,2 sobe ,uknjiženo ,podno grejanje ,novo ,3/4 sprata ,"terasa, lođa ",prazno ,"kablovska, internet, interfon, klima ",useljivo ,320 ,pre 20 sati ,82.800,Zeleno Brdo,"Zeleno Brdo, Zvezdara opština, Beograd","Dvosoban stan na prodaju, Zeleno Brdo, 82.800€, 46m² - 4zida",2023-09-24,Stan u zgradi ,,ima lift (1) ,,1 parking mesto ,,,,,,,,
1081,https://www.4zida.rs/prodaja-stanova/novi-sad-centar-stari-grad-gradske-lokacije-novi-sad/jednoiposoban-stan/64e62fe0fd7041609903e760,36 m² ,1.5 soba ,,grejanje na gas ,,1. sprat ,terasa ,,,,1047316 ,pre 10 dana ,121.540,Novi Sad - Centar,"Novi Sad - Centar, Stari Grad, Gradske lokacije, Novi Sad","Jednoiposoban stan na prodaju, Novi Sad - Centar, 121.540€, 36m² - 4zida",2023-09-24,,2023,ima lift (1) ,,,,,,,,,,
1082,https://www.4zida.rs/prodaja-stanova/novo-naselje-gradske-lokacije-novi-sad/dvoiposoban-stan/650d431da39a5f7dbb0de54a,58 m² ,2.5 soba ,,,,1/4 sprata ,,polunamešteno ,,,2840 ,pre 2 dana ,131.500,Novo Naselje,"Novo Naselje, Gradske lokacije, Novi Sad","Dvoiposoban stan na prodaju, Novo Naselje, 131.500€, 58m² - 4zida",2023-09-24,Stan u zgradi ,,,,,,,,,,,,
1083,https://www.4zida.rs/prodaja-stanova/calije-pantelej-gradske-lokacije-nis/troiposoban-stan/650d936750dc0355dc00a05b,76 m² ,3.5 soba ,,etažno grejanje ,novo ,1/5 spratova ,"podrum, terasa ",prazno ,klima ,,1105 ,pre 2 dana ,100.320,Čalije,"Čalije, Pantelej, Gradske lokacije, Niš","Troiposoban stan na prodaju, Čalije, 100.320€, 76m² - 4zida",2023-09-24,Stan u zgradi ,,ima lift (1) ,,,,,,,,,,
1084,https://www.4zida.rs/prodaja-stanova/novo-naselje-gradske-lokacije-novi-sad/cetvorosoban-stan/647de1d342ea270ee0020ea1,,,,,,,,,,,,,,,,"Prodaja stanova Novo Naselje, Gradske lokacije, Novi Sad - 4zida",2023-09-24,,,,,,,,,,,,,
1085,https://www.4zida.rs/prodaja-stanova/bulevar-oslobodjenja-gradske-lokacije-novi-sad/trosoban-stan/64f754f17a2e82076b0d8e93,94 m² ,3 sobe ,nije uknjiženo ,centralno grejanje ,,7. sprat ,terasa ,,,useljivo ,95319 ,pre 18 dana ,203.300,Bulevar Oslobođenja,"Bulevar Oslobođenja, Gradske lokacije, Novi Sad","Trosoban stan na prodaju, Bulevar Oslobođenja, 203.300€, 94m² - 4zida",2023-09-24,Stan u zgradi ,,ima lift (1) ,,1 parking mesto ,,,,,,,,
1086,https://www.4zida.rs/prodaja-stanova/telep-gradske-lokacije-novi-sad/dvosoban-stan/650b303ef1f26d498b0c35c8,33 m² ,2 sobe ,uknjiženo ,centralno grejanje ,,3/3 sprata ,,namešteno ,,,517250 ,pre 3 dana ,77.250,Telep,"Telep, Gradske lokacije, Novi Sad","Dvosoban stan na prodaju, Telep, 77.250€, 33m² - 4zida",2023-09-24,Stan u zgradi ,,ima lift (1) ,,1 parking mesto ,,,,,,,,
1087,https://www.4zida.rs/prodaja-stanova/sajmiste-gradske-lokacije-novi-sad/dvosoban-stan/647de23c42ea270ee0021239,,,,,,,,,,,,,,,,"Prodaja stanova Sajmište, Gradske lokacije, Novi Sad - 4zida",2023-09-24,,,,,,,,,,,,,
1088,https://www.4zida.rs/prodaja-stanova/bezanijska-kosa-1-bezanijska-kosa-novi-beograd-beograd/dvosoban-stan/647de24642ea270ee0021297,,,,,,,,,,,,,,,,"Prodaja stanova Bežanijska kosa 1, Bežanijska kosa, Novi Beograd, Beograd - 4zida",2023-09-24,,,,,,,,,,,,,
1089,https://www.4zida.rs/prodaja-stanova/grbavica-gradske-lokacije-novi-sad/cetvorosoban-stan/64f59ec593f6a658c5065fa1,116 m² ,4 sobe ,uknjiženo ,,uobičajeno stanje ,5/5 spratova ,terasa ,,,,1059663 ,pre 23 sati ,220.000,Grbavica,"Grbavica, Gradske lokacije, Novi Sad","Četvorosoban stan na prodaju, Grbavica, 220.000€, 116m² - 4zida",2023-09-24,Stan u zgradi ,2005,ima lift (1) ,,,,,,,,,,
1090,https://www.4zida.rs/prodaja-stanova/centar-gradske-lokacije-vrnjacka-banja/dvosoban-stan/647de02342ea270ee0020782,,,,,,,,,,,,,,,,"Prodaja stanova Centar, Gradske lokacije, Vrnjačka Banja - 4zida",2023-09-24,,,,,,,,,,,,,
1091,https://www.4zida.rs/prodaja-stanova/cair-medijana-gradske-lokacije-nis/trosoban-stan/650c3f00db2648729900f83a,,,,,,,,,,,,,,,,"Prodaja stanova Čair, Medijana, Gradske lokacije, Niš - 4zida",2023-09-24,,,,,,,,,,,,,
1092,https://www.4zida.rs/prodaja-stanova/bubanj-palilula-gradske-lokacije-nis/dvoiposoban-stan/64803952d633a551f608c8ff,,,,,,,,,,,,,,,,"Prodaja stanova Bubanj, Palilula, Gradske lokacije, Niš - 4zida",2023-09-24,,,,,,,,,,,,,
1093,https://www.4zida.rs/prodaja-stanova/stari-grad-gradske-lokacije-novi-sad/garsonjera/64f0735f20097f977e0dab66,30 m² ,0.5 soba ,uknjiženo ,centralno grejanje ,renovirano ,3/3 sprata ,terasa ,namešteno ,"TV, klima, veš mašina, kuhinjski elementi, frižider, mikrotalasna rerna, rerna, šporet, ležaj, plakar, ugradni plakar ",useljivo ,,pre 24 dana ,100.500,Sonje Marinković 5,"Stari Grad, Gradske lokacije, Novi Sad","Garsonjera na prodaju, Sonje Marinković 5, 100.500€, 30m² - 4zida",2023-09-24,Stan u zgradi ,1990,,,u dvorištu zgrade ,"kupatilo, kuhinja ",,,dvorište ,,Optički ,,
1094,https://www.4zida.rs/prodaja-stanova/avijaticarsko-naselje-gradske-lokacije-novi-sad/dvosoban-stan/647de04a42ea270ee0020965,,,,,,,,,,,,,,,,"Prodaja stanova Avijatičarsko Naselje, Gradske lokacije, Novi Sad - 4zida",2023-09-24,,,,,,,,,,,,,
1095,https://www.4zida.rs/prodaja-stanova/juzni-telep-telep-gradske-lokacije-novi-sad/trosoban-stan/64f071ec8b07035631044821,66 m² ,3 sobe ,uknjiženo ,centralno grejanje ,održavano ,1/2 sprata ,terase (2) ,prazno ,"telefon, kablovska ",useljivo ,,pre 24 dana ,126.700,Telep,"Južni Telep, Telep, Gradske lokacije, Novi Sad","Trosoban stan na prodaju, Telep, 126.700€, 66m² - 4zida",2023-09-24,Stan u zgradi ,,,,,"kupatila (2), toalet, kuhinja ",,,ulicu ,,Kablovska ,,
1096,https://www.4zida.rs/prodaja-stanova/raj-gradske-lokacije-vrnjacka-banja/jednosoban-stan/650c3cc890406ff3ad04b73b,56 m² ,1 soba ,uknjiženo ,grejanje na struju ,,,terasa ,prazno ,,,,pre 1 dan ,76.500,Raj,"Raj, Gradske lokacije, Vrnjačka Banja","Jednosoban stan na prodaju, Raj, 76.500€, 56m² - 4zida",2023-09-24,Stan u zgradi ,,,,,kupatilo ,,,,,,,
1097,https://www.4zida.rs/prodaja-stanova/bulevar-oslobodjenja-gradske-lokacije-novi-sad/dvoiposoban-stan/650c8787a8576718bc0c7863,69 m² ,2.5 soba ,,centralno grejanje ,,6/11 spratova ,terasa ,,,,1047467 ,pre 2 dana ,174.000,Bulevar Oslobođenja,"Bulevar Oslobođenja, Gradske lokacije, Novi Sad","Dvoiposoban stan na prodaju, Bulevar Oslobođenja, 174.000€, 69m² - 4zida",2023-09-24,,1981,ima lift (1) ,,,,,,,,,,
1098,https://www.4zida.rs/prodaja-stanova/adamovicevo-naselje-gradske-lokacije-novi-sad/dvosoban-stan/650ecbe473a357863407a8fd,47 m² ,2 sobe ,uknjiženo ,grejanje na gas ,,1/5 spratova ,terasa ,namešteno ,"internet, interfon, klima, veš mašina, frižider, šporet, ležaj, Kanalizacija ",useljivo ,317 ,pre 23 sati ,113.300,Adamovićevo Naselje,"Adamovićevo Naselje, Gradske lokacije, Novi Sad","Dvosoban stan na prodaju, Adamovićevo Naselje, 113.300€, 47m² - 4zida",2023-09-24,Stan u zgradi ,,ima lift (1) ,,,kuhinja ,,,,,,,
1099,https://www.4zida.rs/prodaja-stanova/petlovo-brdo-rakovica-opstina-beograd/trosoban-stan/64f9bcff5a6a1785140cd0d3,70 m² ,3 sobe ,uknjiženo ,grejanje na struju ,uobičajeno stanje ,prizemlje/2 sprata ,"podrum, terasa ",prazno ,telefon ,,84644 ,pre 17 dana ,115.000,Gočka,"Petlovo Brdo, Rakovica opština, Beograd","Trosoban stan na prodaju, Gočka, 115.000€, 70m² - 4zida",2023-09-24,,,,,,kupatilo ,,,,,,,
1100,https://www.4zida.rs/prodaja-stanova/brace-jerkovic-vozdovac-opstina-beograd/dvosoban-stan/65095afdc051b120500dbf4e,49 m² ,2 sobe ,uknjiženo ,TA peć ,uobičajeno stanje ,1/4 sprata ,podrum ,prazno ,interfon ,useljivo ,2712 ,pre 5 dana ,115.000,Piva Karamatijevića,"Braće Jerković, Voždovac opština, Beograd","Dvosoban stan na prodaju, Piva Karamatijevića, 115.000€, 49m² - 4zida",2023-09-24,Stan u zgradi ,1970,,,1 parking mesto ,,,,,,,,
1101,https://www.4zida.rs/prodaja-stanova/jagodnjak-gradske-lokacije-paracin/dvoiposoban-stan/64fece411109ab73ad0c5251,64 m² ,2.5 soba ,,TA peć ,,2/4 sprata ,,prazno ,,,7404 ,pre 13 dana ,42.000,Jagodnjak,"Jagodnjak, Gradske lokacije, Paraćin","Dvoiposoban stan na prodaju, Jagodnjak, 42.000€, 64m² - 4zida",2023-09-24,Stan u zgradi ,,,,,,,,,,,,
1102,https://www.4zida.rs/prodaja-stanova/juzni-bulevar-vracar-beograd/dvosoban-stan/64fb66fb2983dd7c690205bb,54 m² ,2 sobe ,uknjiženo ,etažno grejanje ,novo ,2/5 spratova ,lođa ,prazno ,"telefon, kablovska, internet ",useljivo ,67190 ,pre 10 dana ,175.000,Generala  Horvatovića,"Južni Bulevar, Vračar, Beograd","Dvosoban stan na prodaju, Generala  Horvatovića, 175.000€, 54m² - 4zida",2023-09-24,,,ima lift (1) ,1 garažno mesto ,,,,,,,,,
1103,https://www.4zida.rs/prodaja-stanova/socijalno-rotkvarija-gradske-lokacije-novi-sad/trosoban-stan/64f5adc8b19b138db8097068,75 m² ,3 sobe ,,centralno grejanje ,,2/10 spratova ,terasa ,,,,1047379 ,pre 20 dana ,160.000,Socijalno,"Socijalno, Rotkvarija, Gradske lokacije, Novi Sad","Trosoban stan na prodaju, Socijalno, 160.000€, 75m² - 4zida",2023-09-24,,1975,ima lift (1) ,,,,,,,,,,
1104,https://www.4zida.rs/prodaja-stanova/krnjaca-palilula-opstina-beograd/jednoiposoban-stan/6501d49919216639a30b0da3,40 m² ,1.5 soba ,u procesu uknjižavanja ,norveški radijatori ,novo ,4/4 sprata ,terasa ,polunamešteno ,"kablovska, klima, ventilacija ",useljivo ,,pre 11 dana ,67.000,Zrenjaninski put 62a,"Krnjača, Palilula opština, Beograd","Jednoiposoban stan na prodaju, Zrenjaninski put 62a, 67.000€, 40m² - 4zida",2023-09-24,Stan u zgradi ,2020,ima lift (1) ,,"1 parking mesto, u dvorištu zgrade ","kupatilo, kuhinja ",severozapad ,,dvorište ,"43, 95, 96, 101, 104, 105, 106 ",Bežični ,,
1105,https://www.4zida.rs/prodaja-stanova/liman-3-liman-gradske-lokacije-novi-sad/dvosoban-stan/65034c4b915ab0f1870753a0,,,,,,,,,,,,,,,,"Prodaja stanova Liman 3, Liman, Gradske lokacije, Novi Sad - 4zida",2023-09-24,,,,,,,,,,,,,
1106,https://www.4zida.rs/prodaja-stanova/blok-25-arena-novi-beograd-beograd/dvosoban-stan/650d7f27c1242dafd20a51c5,50 m² ,2 sobe ,uknjiženo ,centralno grejanje ,renovirano ,1/7 spratova ,podrum ,prazno ,"telefon, kablovska, klima, frižider ",,,pre 2 dana ,169.000,Antifašističke borbe 32,"Blok 25 - Arena, Novi Beograd, Beograd","Dvosoban stan na prodaju, Antifašističke borbe 32, 169.000€, 50m² - 4zida",2023-09-24,Stan u zgradi ,2000,ima lift (3) ,,,"kupatilo, kuhinja, ostava ",,30.09.2023 ,ulicu ,,ADSL ,,
1107,https://www.4zida.rs/prodaja-stanova/zeljeznicko-naselje-gradske-lokacije-subotica/jednoiposoban-stan/647de25942ea270ee0021371,,,,,,,,,,,,,,,,"Prodaja stanova Željezničko Naselje, Gradske lokacije, Subotica - 4zida",2023-09-24,,,,,,,,,,,,,
1108,https://www.4zida.rs/prodaja-stanova/centar-gradske-lokacije-zlatibor/dvosoban-stan/647de0af42ea270ee0020cd1,,,,,,,,,,,,,,,,"Prodaja stanova Centar, Gradske lokacije, Zlatibor - 4zida",2023-09-24,,,,,,,,,,,,,
1109,https://www.4zida.rs/prodaja-stanova/centar-gradske-lokacije-krusevac/jednoiposoban-stan/64fd70e63d033b25dc0e088e,47 m² ,1.5 soba ,uknjiženo ,centralno grejanje ,novo ,,,prazno ,,useljivo ,,pre 14 dana ,70.000,Centar,"Centar, Gradske lokacije, Kruševac","Jednoiposoban stan na prodaju, Centar, 70.000€, 47m² - 4zida",2023-09-24,Stan u zgradi ,2010,ima lift (1) ,1 garažno mesto ,,kupatilo ,,,,,,,
1110,https://www.4zida.rs/prodaja-stanova/gradske-lokacije-zlatibor/jednoiposoban-stan/65002138539176db80097c67,43 m² ,1.5 soba ,uknjiženo ,grejanje na struju ,uobičajeno stanje ,3. sprat ,"terasa, lođa ",namešteno ,"kablovska, internet, interfon ",,PS36854VJ ,pre 12 dana ,77.500,Gradske lokacije,"Gradske lokacije, Zlatibor","Jednoiposoban stan na prodaju, Gradske lokacije, 77.500€, 43m² - 4zida",2023-09-24,,2001,,,,kupatilo ,,,,,,,
1111,https://www.4zida.rs/prodaja-stanova/grbavica-gradske-lokacije-novi-sad/cetvorosoban-stan/6508312c21bb81c41f078d44,,,,,,,,,,,,,,,,"Prodaja stanova Grbavica, Gradske lokacije, Novi Sad - 4zida",2023-09-24,,,,,,,,,,,,,
1112,https://www.4zida.rs/prodaja-stanova/cvetojevac-okolne-lokacije-kragujevac/cetvorosoban-stan/65084db0212d58ce150b2cb0,100 m² ,4 sobe ,,,,prizemlje ,,,,,p,pre 6 dana ,31.000,Slobodana Jovanovića,"Cvetojevac, Okolne lokacije, Kragujevac","Četvorosoban stan na prodaju, Slobodana Jovanovića, 31.000€, 100m² - 4zida",2023-09-24,,,,1 garažno mesto ,,kupatilo ,,,,,,,
1113,https://www.4zida.rs/prodaja-stanova/grbavica-gradske-lokacije-novi-sad/cetvorosoban-stan/65097489ed313cf71006f43c,,,,,,,,,,,,,,,,"Prodaja stanova Grbavica, Gradske lokacije, Novi Sad - 4zida",2023-09-24,,,,,,,,,,,,,
1114,https://www.4zida.rs/prodaja-stanova/petrovaradin-gradske-lokacije-novi-sad/trosoban-stan/650aa9eb1453cc57b50049e1,,,,,,,,,,,,,,,,"Prodaja stanova Petrovaradin, Gradske lokacije, Novi Sad - 4zida",2023-09-24,,,,,,,,,,,,,
1115,https://www.4zida.rs/prodaja-stanova/dunavac-padinska-skela-palilula-opstina-beograd/jednoiposoban-stan/650cb39dc80a48abf309253a,50 m² ,1.5 soba ,uknjiženo ,grejanje na struju ,uobičajeno stanje ,3/4 sprata ,terasa ,,,useljivo ,9062 ,pre 2 dana ,30.000,Dunavac,"Dunavac, Padinska Skela, Palilula opština, Beograd","Jednoiposoban stan na prodaju, Dunavac, 30.000€, 50m² - 4zida",2023-09-24,,,,,,,,,,,,,
1116,https://www.4zida.rs/prodaja-stanova/blok-64-bezanijski-blokovi-novi-beograd-beograd/jednoiposoban-stan/64db5b384afa93e86a052f87,,,,,,,,,,,,,,,,"Prodaja stanova Blok 64, Bežanijski Blokovi, Novi Beograd, Beograd - 4zida",2023-09-24,,,,,,,,,,,,,
1117,https://www.4zida.rs/prodaja-stanova/centar-gradske-lokacije-zlatibor/dvosoban-stan/647de0b842ea270ee0020d07,,,,,,,,,,,,,,,,"Prodaja stanova Centar, Gradske lokacije, Zlatibor - 4zida",2023-09-24,,,,,,,,,,,,,
1118,https://www.4zida.rs/prodaja-stanova/gradske-lokacije-stara-pazova/dvosoban-stan/64e738362f2cdc5c2a0fa974,56 m² ,2 sobe ,uknjiženo ,grejanje na gas ,u izgradnji ,1/3 sprata ,,prazno ,,,,pre 6 dana ,72.000,Kralja Petra I Oslobodioca 93,"Gradske lokacije, Stara Pazova","Dvosoban stan na prodaju, Kralja Petra I Oslobodioca 93, 72.000€, 56m² - 4zida",2023-09-24,Stan u zgradi ,,,,,,,01.06.2024 ,,,,,
1119,https://www.4zida.rs/prodaja-stanova/telep-gradske-lokacije-novi-sad/dvoiposoban-stan/647de22942ea270ee0021186,,,,,,,,,,,,,,,,"Prodaja stanova Telep, Gradske lokacije, Novi Sad - 4zida",2023-09-24,,,,,,,,,,,,,
1120,https://www.4zida.rs/prodaja-stanova/kraljevi-cardaci-okolne-lokacije-kopaonik/jednoiposoban-stan/64ef1f72ef9e406fc00dc88b,,,,,,,,,,,,,,,,"Jednoiposoban stan na prodaju, Kraljevi Čardaci, 65.000€, 30m² - 4zida",2023-09-24,,,,,,,,,,,,,
1121,https://www.4zida.rs/prodaja-stanova/blok-1-fontana-novi-beograd-beograd/dvoiposoban-stan/6508786deb45b6c6f60e247a,52 m² ,2.5 soba ,uknjiženo ,centralno grejanje ,uobičajeno stanje ,4/8 spratova ,,,,useljivo ,102112 ,pre 3 dana ,135.000,Bulevar Zorana Đinđića,"Blok 4, Novi Beograd, Beograd","Dvoiposoban stan na prodaju, Bulevar Zorana Đinđića, 135.000€, 52m² - 4zida",2023-09-24,Stan u zgradi ,,ima lift (1) ,,1 parking mesto ,,,,,,,,
1122,https://www.4zida.rs/prodaja-stanova/bulbulder-zvezdara-opstina-beograd/trosoban-stan/65045e26b833557ebd09aa18,62 m² ,3 sobe ,nije uknjiženo ,centralno grejanje ,u izgradnji ,1/5 spratova ,terasa ,prazno ,,,,pre 9 dana ,184.288,Bulbulder,"Bulbulder, Zvezdara opština, Beograd","Trosoban stan na prodaju, Bulbulder, 184.288€, 62m² - 4zida",2023-09-24,Stan u zgradi ,,ima lift (2) ,,1 parking mesto ,"kupatilo, toalet ",,,,,,,
1123,https://www.4zida.rs/prodaja-stanova/tatarsko-brdo-sremska-kamenica-gradske-lokacije-novi-sad/cetvorosoban-stan/647de2e542ea270ee0021864,,,,,,,,,,,,,,,,"Prodaja stanova Tatarsko Brdo, Sremska Kamenica, Gradske lokacije, Novi Sad - 4zida",2023-09-24,,,,,,,,,,,,,
1124,https://www.4zida.rs/prodaja-stanova/novi-sad-centar-stari-grad-gradske-lokacije-novi-sad/dvosoban-stan/6501a76303f2df88910ea121,,,,,,,,,,,,,,,,"Prodaja stanova Novi Sad - Centar, Stari Grad, Gradske lokacije, Novi Sad - 4zida",2023-09-24,,,,,,,,,,,,,
1125,https://www.4zida.rs/prodaja-stanova/gornji-grad-zemun-zemun-opstina-beograd/troiposoban-stan/6508b0988d331b46dc014492,85 m² ,3.5 soba ,uknjiženo ,centralno grejanje ,,7/8 spratova ,"podrum, terasa, lođa ",prazno ,interfon ,,42925 ,pre 3 dana ,160.000,Karlovačka,"Gornji Grad, Zemun, Zemun opština, Beograd","Troiposoban stan na prodaju, Karlovačka, 160.000€, 85m² - 4zida",2023-09-24,,,ima lift (1) ,,,kupatilo ,,,,,,,
1126,https://www.4zida.rs/prodaja-stanova/vojvode-vlahovica-vozdovac-opstina-beograd/trosoban-stan/650f20e84c6777e53b0028b2,68 m² ,3 sobe ,uknjiženo ,etažno grejanje ,novo ,1/5 spratova ,terasa ,,,,,pre 22 sati ,135.000,Mate Miloševića,"Vojvode Vlahovića, Voždovac opština, Beograd","Trosoban stan na prodaju, Mate Miloševića, 135.000€, 68m² - 4zida",2023-09-24,Stan u zgradi ,,ima lift (1) ,,,,,,,,,,
1127,https://www.4zida.rs/prodaja-stanova/ledine-novi-beograd-beograd/jednoiposoban-stan/650d67441c92ad724d02c362,43 m² ,1.5 soba ,uknjiženo ,etažno grejanje ,novo ,suteren/4 sprata ,,prazno ,telefon ,,2488 ,pre 2 dana ,62.350,Marka Šagala,"Ledine, Novi Beograd, Beograd","Jednoiposoban stan na prodaju, Marka Šagala, 62.350€, 43m² - 4zida",2023-09-24,,,,,1 parking mesto ,kupatilo ,,,,,,,
1128,https://www.4zida.rs/prodaja-stanova/novo-naselje-gradske-lokacije-novi-sad/dvosoban-stan/650ec88473a357863407a862,57 m² ,2 sobe ,,centralno grejanje ,,,,,,,72703 ,pre 1 dan ,117.900,BUL.JOVANA DUCICA,"Novo Naselje, Gradske lokacije, Novi Sad","Dvosoban stan na prodaju, BUL.JOVANA DUCICA, 117.900€, 57m² - 4zida",2023-09-24,Stan u zgradi ,,,,,,,,,,,,
1129,https://www.4zida.rs/prodaja-stanova/cukovac-zemun-zemun-opstina-beograd/cetvorosoban-stan/650f3ac1791bdc84be03dc20,125 m² ,4 sobe ,uknjiženo ,etažno grejanje ,novo ,prizemlje/3 sprata ,"dvorište, terase (2) ",,,,,pre 20 sati ,250.000,Ugrinovačka,"Ćukovac, Zemun, Zemun opština, Beograd","Četvorosoban stan na prodaju, Ugrinovačka, 250.000€, 125m² - 4zida",2023-09-24,Stan u zgradi ,,,,,,,,,,,,
1130,https://www.4zida.rs/prodaja-stanova/bezanijska-kosa-1-bezanijska-kosa-novi-beograd-beograd/trosoban-stan/647de24942ea270ee00212b6,,,,,,,,,,,,,,,,"Prodaja stanova Bežanijska kosa 1, Bežanijska kosa, Novi Beograd, Beograd - 4zida",2023-09-24,,,,,,,,,,,,,
1131,https://www.4zida.rs/prodaja-stanova/detelinara-gradske-lokacije-novi-sad/dvoiposoban-stan/650eba7bfe0a304e8c032726,62 m² ,2.5 soba ,,centralno grejanje ,,,,,,,71846 ,pre 1 dan ,108.150,NADEZDE PETROVIC,"Detelinara, Gradske lokacije, Novi Sad","Dvoiposoban stan na prodaju, NADEZDE PETROVIC, 108.150€, 62m² - 4zida",2023-09-24,Stan u zgradi ,,,,,,,,,,,,
1132,https://www.4zida.rs/prodaja-stanova/stara-detelinara-detelinara-gradske-lokacije-novi-sad/dvosoban-stan/650ee8ab76125077420911da,48 m² ,2 sobe ,uknjiženo ,centralno grejanje ,,2/5 spratova ,,,,,517350 ,pre 1 dan ,89.610,Stara Detelinara,"Stara Detelinara, Detelinara, Gradske lokacije, Novi Sad","Dvosoban stan na prodaju, Stara Detelinara, 89.610€, 48m² - 4zida",2023-09-24,Stan u zgradi ,,ima lift (1) ,,,,,,,,,,
1133,https://www.4zida.rs/prodaja-stanova/novi-sad-centar-stari-grad-gradske-lokacije-novi-sad/dvosoban-stan/65083f17b224f9813a08d143,55 m² ,2 sobe ,,centralno grejanje ,,2/2 sprata ,terasa ,,,,1047466 ,pre 6 dana ,221.450,Novi Sad - Centar,"Novi Sad - Centar, Stari Grad, Gradske lokacije, Novi Sad","Dvosoban stan na prodaju, Novi Sad - Centar, 221.450€, 55m² - 4zida",2023-09-24,,2000,,,,,,,,,,,
1134,https://www.4zida.rs/prodaja-stanova/cigota-okolne-lokacije-zlatibor/dvosoban-stan/647de1ca42ea270ee0020e22,,,,,,,,,,,,,,,,"Prodaja stanova Čigota, Okolne lokacije, Zlatibor - 4zida",2023-09-24,,,,,,,,,,,,,
1135,https://www.4zida.rs/prodaja-stanova/knezevac-vidikovac-rakovica-opstina-beograd/jednoiposoban-stan/65045cfc5c774c8f2900d282,35 m² ,1.5 soba ,,grejanje na struju ,uobičajeno stanje ,1/4 sprata ,,prazno ,telefon ,,1530 ,pre 8 dana ,56.000,17. oktobra,"Kneževac, Vidikovac, Rakovica opština, Beograd","Jednoiposoban stan na prodaju, 17. oktobra, 56.000€, 35m² - 4zida",2023-09-24,,,,,,kupatilo ,,,,,,,
1136,https://www.4zida.rs/prodaja-stanova/bulevar-oslobodjenja-gradske-lokacije-novi-sad/cetvorosoban-stan/64f13b737338cdb2480167d3,82 m² ,4 sobe ,,,u izgradnji ,3/6 spratova ,terasa ,,,,1096642 ,pre 23 dana ,218.330,Bulevar Oslobođenja,"Bulevar Oslobođenja, Gradske lokacije, Novi Sad","Četvorosoban stan na prodaju, Bulevar Oslobođenja, 218.330€, 82m² - 4zida",2023-09-24,Stan u zgradi ,2024,ima lift (1) ,1 garažno mesto ,,,,,,,,,
1137,https://www.4zida.rs/prodaja-stanova/novo-naselje-gradske-lokacije-novi-sad/dvosoban-stan/647de1d642ea270ee0020ec4,,,,,,,,,,,,,,,,"Prodaja stanova Novo Naselje, Gradske lokacije, Novi Sad - 4zida",2023-09-24,,,,,,,,,,,,,
1138,https://www.4zida.rs/prodaja-stanova/cerak-cukarica-cukarica-opstina-beograd/trosoban-stan/650d676c1c92ad724d02c385,87 m² ,3 sobe ,uknjiženo ,centralno grejanje ,uobičajeno stanje ,1/5 spratova ,"podrum, terasa ",prazno ,"telefon, kablovska, internet, interfon ",,1601 ,pre 2 dana ,167.000,Jablanička,"Cerak, Čukarica, Čukarica opština, Beograd","Trosoban stan na prodaju, Jablanička, 167.000€, 87m² - 4zida",2023-09-24,,,ima lift (1) ,,,,,,,,,,
1139,https://www.4zida.rs/prodaja-stanova/radijalac-gradske-lokacije-subotica/dvosoban-stan/650842d293ef5ffa2e0a2dcc,56 m² ,2 sobe ,,,,,,,,,23,pre 6 sati ,53.000,Radijalac,"Radijalac, Gradske lokacije, Subotica","Dvosoban stan na prodaju, Radijalac, 53.000€, 56m² - 4zida",2023-09-24,,,,,,kupatilo ,,,,,,,
1140,https://www.4zida.rs/prodaja-stanova/liman-2-liman-gradske-lokacije-novi-sad/dvosoban-stan/64f114439c88d9b2e9097c7d,,,,,,,,,,,,,,,,"Prodaja stanova Liman 2, Liman, Gradske lokacije, Novi Sad - 4zida",2023-09-24,,,,,,,,,,,,,
1141,https://www.4zida.rs/prodaja-stanova/kalemegdan-stari-grad-opstina-beograd/dvosoban-stan/65085b941ee0cd470a0fa59b,63 m² ,2 sobe ,uknjiženo ,,renovirano ,1/6 spratova ,terasa ,namešteno ,"telefon, kablovska, interfon, klima ",useljivo ,3975 ,pre 5 dana ,350.000,Gospodar Jovanova,"Kalemegdan, Stari Grad opština, Beograd","Dvosoban stan na prodaju, Gospodar Jovanova, 350.000€, 63m² - 4zida",2023-09-24,,,ima lift (1) ,,,kupatilo ,,,,,,,
1142,https://www.4zida.rs/prodaja-stanova/palilula-gradske-lokacije-nis/dvoiposoban-stan/650d974650dc0355dc00a184,58 m² ,2.5 soba ,,grejanje na struju ,,visoko prizemlje/4 sprata ,,prazno ,"TV, veš mašina, frižider, šporet, ležaj ",,336 ,pre 2 dana ,78.900,Palilula,"Palilula, Gradske lokacije, Niš","Dvoiposoban stan na prodaju, Palilula, 78.900€, 58m² - 4zida",2023-09-24,Stan u zgradi ,,,,,kuhinja ,,,,,,,
1143,https://www.4zida.rs/prodaja-stanova/palilula-palilula-opstina-beograd/cetvorosoban-stan/650d42cea39a5f7dbb0de51a,130 m² ,4 sobe ,,grejanje na struju ,,2/5 spratova ,terasa ,namešteno ,,,91947585 ,pre 2 dana ,400.000,Palilula,"Palilula, Palilula opština, Beograd","Četvorosoban stan na prodaju, Palilula, 400.000€, 130m² - 4zida",2023-09-24,,,,2 garažna mesta ,,"kupatilo, toaleti (2) ",,,,,,,
1144,https://www.4zida.rs/prodaja-stanova/bulevar-oslobodjenja-gradske-lokacije-novi-sad/trosoban-stan/64f9b3a90127676cba084311,68 m² ,3 sobe ,uknjiženo ,centralno grejanje ,uobičajeno stanje ,7/4 sprata ,terasa ,namešteno ,klima ,useljivo ,44192 ,pre 16 dana ,113.300,Bulevar Oslobođenja,"Bulevar Oslobođenja, Gradske lokacije, Novi Sad","Trosoban stan na prodaju, Bulevar Oslobođenja, 113.300€, 68m² - 4zida",2023-09-24,,,ima lift (1) ,,,,,,,,,,
1145,https://www.4zida.rs/prodaja-stanova/petrovaradin-gradske-lokacije-novi-sad/cetvorosoban-stan/65097481ed313cf71006f3d6,,,,,,,,,,,,,,,,"Prodaja stanova Petrovaradin, Gradske lokacije, Novi Sad - 4zida",2023-09-24,,,,,,,,,,,,,
1146,https://www.4zida.rs/prodaja-stanova/spens-stari-grad-gradske-lokacije-novi-sad/cetvorosoban-stan/650eac6ffd9cad790c0cf8f2,92 m² ,4 sobe ,,centralno grejanje ,,,,,,,70266 ,pre 1 dan ,257.500,VOJVODJANSKIH BRIGADA,"Spens, Stari Grad, Gradske lokacije, Novi Sad","Četvorosoban stan na prodaju, VOJVODJANSKIH BRIGADA, 257.500€, 92m² - 4zida",2023-09-24,Stan u zgradi ,,,,,,,,,,,,
1147,https://www.4zida.rs/prodaja-stanova/borca-greda-borca-palilula-opstina-beograd/jednosoban-stan/64fb44c4ddd58c33cd0f9ca4,39 m² ,1 soba ,nije uknjiženo ,centralno grejanje ,potrebno renoviranje ,1/4 sprata ,"dvorište, lođa ",prazno ,kablovska ,,,pre 15 dana ,60.000,Moravske divizije,"Borča Greda, Borča, Palilula opština, Beograd","Jednosoban stan na prodaju, Moravske divizije, 60.000€, 39m² - 4zida",2023-09-24,Stan u zgradi ,,,,,"kupatilo, toalet, kuhinja ",severozapad ,,dvorište ,,,,
1148,https://www.4zida.rs/prodaja-stanova/juzni-bulevar-vracar-beograd/cetvorosoban-stan/64f3389988274345820e39b6,202 m² ,4 sobe ,uknjiženo ,centralno grejanje ,novo ,8/8 spratova ,terasa ,prazno ,"kablovska, internet, interfon, klima ",,1667 ,pre 3 dana ,515.000,Južni Bulevar,"Južni Bulevar, Vračar, Beograd","Četvorosoban stan na prodaju, Južni Bulevar, 515.000€, 202m² - 4zida",2023-09-24,Penthaus ,,ima lift (1) ,1 garažno mesto ,1 parking mesto ,,,,,,,,
1149,https://www.4zida.rs/prodaja-stanova/vracar-beograd/dvosoban-stan/65045ca45c774c8f2900d260,52 m² ,2 sobe ,,centralno grejanje ,novo ,6. sprat ,terasa ,prazno ,"kablovska, internet, interfon, klima ",,1698 ,pre 9 dana ,255.000,Vračar,"Vračar, Beograd","Dvosoban stan na prodaju, Vračar, 255.000€, 52m² - 4zida",2023-09-24,Stan u zgradi ,,ima lift (1) ,,1 parking mesto ,,,,,,,,
