,link,title,end_date,Površina,Broj soba,Uknjiženost,Grejanje,Stanje,Godina izgradnje,Spratnost,Parking,Infrastruktura,Unutrašnje prostorije,Nameštenost,Opremljenost,Useljivo,Šifra oglasa,Oglas ažuriran,price,street,address,Tip,Lift,Garaža,Orijentacija nekretnine,Pogled na,Internet,Autobuske linije,Useljivo od,Tramvajske linije,Trolejbuske linije
214,https://www.4zida.rs/prodaja-stanova/bezanijska-kosa-novi-beograd-beograd/trosoban-stan/64e6175e7f7183b9eb020881,"Trosoban stan na prodaju, Bežanijska kosa, 260.000€, 94m² - 4zida",2023-08-29,94 m² ,3 sobe ,,centralno grejanje ,renovirano ,,3/4 sprata ,,"podrum, terasa ",kuhinja ,namešteno ,"interfon, TV, veš mašina, sudo mašina, frižider, šporet, ležaj ",,1626 ,pre 6 dana ,260.000,Bežanijska kosa,"Bežanijska kosa, Novi Beograd, Beograd",Stan u zgradi ,,,,,,,,,
215,https://www.4zida.rs/prodaja-stanova/toplicin-venac-kosancicev-venac-beograd-centar-stari-grad-opstina-beograd/jednoiposoban-stan/64ecac12e2e89301bb04a4c0,"Jednoiposoban stan na prodaju, Topličin Venac, 179.900€, 44m² - 4zida",2023-08-29,44 m² ,1.5 soba ,uknjiženo ,centralno grejanje ,,,3/6 spratova ,,,kupatilo ,prazno ,"telefon, internet, interfon, klima ",useljivo ,3949 ,pre 1 dan ,179.900,Topličin Venac,"Topličin Venac, Kosančićev Venac, Beograd centar, Stari Grad opština, Beograd",,ima lift (1) ,,,,,,,,
216,https://www.4zida.rs/prodaja-stanova/crveni-krst-zvezdara-opstina-beograd/trosoban-stan/64e46a0ea6600fc0e2070d0e,"Trosoban stan na prodaju, Golubacka 2, 297.000€, 103m² - 4zida",2023-08-29,103 m² ,3 sobe ,uknjiženo ,centralno grejanje ,luksuzno ,2010,4/5 spratova ,,terasa ,"kupatilo, toalet, kuhinja ",namešteno ,"telefon, kablovska, TV, klima, veš mašina, kuhinjski elementi, sudo mašina, frižider, zamrzivač, mikrotalasna rerna, rerna, šporet, ležaj, plakar, ugradni plakar ",useljivo ,,pre 4 dana ,297.000,Golubacka 2,"Crveni Krst, Zvezdara opština, Beograd",Stan u zgradi ,ima lift (1) ,,,dvorište ,,,,,
217,https://www.4zida.rs/prodaja-stanova/vojvode-stepe-vozdovac-opstina-beograd/dvosoban-stan/647de2e942ea270ee00218a6,"Prodaja stanova Vojvode Stepe, Voždovac opština, Beograd - 4zida",2023-08-29,,,,,,,,,,,,,,,,,,,,,,,,,,,,
218,https://www.4zida.rs/prodaja-stanova/zeleznicka-stanica-banatic-gradske-lokacije-novi-sad/dvoiposoban-stan/64eda58fb1456ee6ee0414b3,"Dvoiposoban stan na prodaju, Železnička stanica, 78.280€, 43m² - 4zida",2023-08-29,43 m² ,2.5 soba ,uknjiženo ,centralno grejanje ,uobičajeno stanje ,,5/5 spratova ,,terasa ,,,,useljivo ,515820 ,pre 11 sati ,78.280,Železnička stanica,"Železnička stanica, Banatić, Gradske lokacije, Novi Sad",Stan u zgradi ,,,,,,,,,
219,https://www.4zida.rs/prodaja-stanova/aerodrom-gradske-lokacije-kragujevac/dvosoban-stan/64d61541c9aeffc1850bd738,"Prodaja stanova Aerodrom, Gradske lokacije, Kragujevac - 4zida",2023-08-29,,,,,,,,,,,,,,,,,,,,,,,,,,,,
220,https://www.4zida.rs/prodaja-stanova/novi-sad-centar-stari-grad-gradske-lokacije-novi-sad/dvosoban-stan/64edefaab218680575010ce3,"Dvosoban stan na prodaju, Novi Sad - Centar, 114.000€, 41m² - 4zida",2023-08-29,41 m² ,2 sobe ,uknjiženo ,,u izgradnji ,2018,3/5 spratova ,,terasa ,,,,,1096066 ,pre 6 sati ,114.000,Novi Sad - Centar,"Novi Sad - Centar, Stari Grad, Gradske lokacije, Novi Sad",Stan u zgradi ,ima lift (1) ,1 garažno mesto ,,,,,,,
221,https://www.4zida.rs/prodaja-stanova/cerak-cukarica-cukarica-opstina-beograd/trosoban-stan/64edfedd43f5195e720dc7cf,"Trosoban stan na prodaju, Petefijeva, 168.000€, 88m² - 4zida",2023-08-29,88 m² ,3 sobe ,uknjiženo ,centralno grejanje ,,,4/6 spratova ,,lođa ,kupatilo ,prazno ,telefon ,,125447 ,pre 5 sati ,168.000,Petefijeva,"Cerak, Čukarica, Čukarica opština, Beograd",,,,,,,,,,
222,https://www.4zida.rs/prodaja-stanova/bagljas-gradske-lokacije-zrenjanin/trosoban-stan/64d39c3899ef7358d30631e7,"Prodaja stanova Bagljaš, Gradske lokacije, Zrenjanin - 4zida",2023-08-29,,,,,,,,,,,,,,,,,,,,,,,,,,,,
223,https://www.4zida.rs/prodaja-stanova/sajmiste-gradske-lokacije-novi-sad/troiposoban-stan/64542d6550a79f89810f5457,"Troiposoban stan na prodaju, Sajmište, 292.000€, 105m² - 4zida",2023-08-29,105 m² ,3.5 soba ,,centralno grejanje ,u izgradnji ,2022,2/3 sprata ,,terasa ,,,,,1039731 ,pre 3 meseca ,292.000,Sajmište,"Sajmište, Gradske lokacije, Novi Sad",Stan u zgradi ,ima lift (1) ,,,,,,,,
224,https://www.4zida.rs/prodaja-stanova/klisa-gradske-lokacije-novi-sad/dvosoban-stan/64e765099540b466a008eab1,"Dvosoban stan na prodaju, Klisa, 87.550€, 77m² - 4zida",2023-08-29,77 m² ,2 sobe ,uknjiženo ,,u izgradnji ,,,,terasa ,,,,,1026959 ,pre 5 dana ,87.550,Klisa,"Klisa, Gradske lokacije, Novi Sad",Stan u zgradi ,,,,,,,,,
225,https://www.4zida.rs/prodaja-stanova/sremska-kamenica-gradske-lokacije-novi-sad/trosoban-stan/64e4db5ec263c508d30eac0c,"Trosoban stan na prodaju, Sremska Kamenica, 126.940€, 63m² - 4zida",2023-08-29,63 m² ,3 sobe ,nije uknjiženo ,grejanje na gas ,u izgradnji ,,prizemlje/2 sprata ,,terasa ,kupatilo ,,,,512709 ,pre 7 dana ,126.940,Sremska Kamenica,"Sremska Kamenica, Gradske lokacije, Novi Sad",Stan u zgradi ,ima lift (1) ,,,,,,,,
226,https://www.4zida.rs/prodaja-stanova/zemun-centar-zemun-zemun-opstina-beograd/troiposoban-stan/64eca9fae2e89301bb04a3bc,"Troiposoban stan na prodaju, Banatska, 231.970€, 94m² - 4zida",2023-08-29,94 m² ,3.5 soba ,,centralno grejanje ,novo ,,2/6 spratova ,,,kupatilo ,prazno ,telefon ,,2865 ,pre 1 dan ,231.970,Banatska,"Zemun - Centar, Zemun, Zemun opština, Beograd",,,,,,,,,,
227,https://www.4zida.rs/prodaja-stanova/blok-64-bezanijski-blokovi-novi-beograd-beograd/dvoiposoban-stan/64db6953248c921ae500c55b,"Prodaja stanova Blok 64, Bežanijski Blokovi, Novi Beograd, Beograd - 4zida",2023-08-29,,,,,,,,,,,,,,,,,,,,,,,,,,,,
228,https://www.4zida.rs/prodaja-stanova/misa-gradske-lokacije-pancevo/trosoban-stan/64cca28af21c322d6e02bf9e,"Prodaja stanova Misa, Gradske lokacije, Pančevo - 4zida",2023-08-29,,,,,,,,,,,,,,,,,,,,,,,,,,,,
229,https://www.4zida.rs/prodaja-stanova/novi-sad-centar-stari-grad-gradske-lokacije-novi-sad/garsonjera/64edffcf43f5195e720dc814,"Garsonjera na prodaju, Sonje Marinković, 103.500€, 30m² - 4zida",2023-08-29,30 m² ,0.5 soba ,uknjiženo ,centralno grejanje ,uobičajeno stanje ,,3/3 sprata ,,terasa ,kupatilo ,namešteno ,"telefon, kablovska, internet, interfon, klima ",,1000761 ,pre 5 sati ,103.500,Sonje Marinković,"Novi Sad - Centar, Stari Grad, Gradske lokacije, Novi Sad",,,,,,,,,,
230,https://www.4zida.rs/prodaja-stanova/zelena-avenija-zemun-zemun-opstina-beograd/trosoban-stan/647de09142ea270ee0020b59,"Prodaja stanova Zelena Avenija, Zemun, Zemun opština, Beograd - 4zida",2023-08-29,,,,,,,,,,,,,,,,,,,,,,,,,,,,
231,https://www.4zida.rs/prodaja-stanova/medakovic-2-medakovic-vozdovac-opstina-beograd/jednoiposoban-stan/64ee092dbece50f7ae06bb49,"Jednoiposoban stan na prodaju, Brane Ćosića, 85.000€, 46m² - 4zida",2023-08-29,46 m² ,1.5 soba ,uknjiženo ,,,1978,4/5 spratova ,,lođa ,,,"kablovska, interfon, TV, Kanalizacija ",,5283 ,pre 4 sata ,85.000,Brane Ćosića,"Medaković 2, Medaković, Voždovac opština, Beograd",Stan u zgradi ,ima lift (1) ,,istok ,,,,,,
232,https://www.4zida.rs/prodaja-stanova/centar-gradske-lokacije-vrnjacka-banja/dvosoban-stan/647de2ad42ea270ee002155e,"Prodaja stanova Centar, Gradske lokacije, Vrnjačka Banja - 4zida",2023-08-29,,,,,,,,,,,,,,,,,,,,,,,,,,,,
233,https://www.4zida.rs/prodaja-stanova/liman-gradske-lokacije-novi-sad/cetvorosoban-stan/647de2b342ea270ee00215aa,"Prodaja stanova Liman, Gradske lokacije, Novi Sad - 4zida",2023-08-29,,,,,,,,,,,,,,,,,,,,,,,,,,,,
234,https://www.4zida.rs/prodaja-stanova/bulevar-evrope-gradske-lokacije-novi-sad/jednoiposoban-stan/64edb6ec249176e9f200135a,"Jednoiposoban stan na prodaju, 747, 103.670€, 44m² - 4zida",2023-08-29,44 m² ,1.5 soba ,,etažno grejanje ,,,,,,,,,,72231 ,pre 10 sati ,103.670,747,"Bulevar Evrope, Gradske lokacije, Novi Sad",Stan u zgradi ,,,,,,,,,
235,https://www.4zida.rs/prodaja-stanova/batajnica-zemun-opstina-beograd/trosoban-stan/64e9b290e5941e867d0b0bcb,"Trosoban stan na prodaju, Milice Rakić, 121.500€, 70m² - 4zida",2023-08-29,70 m² ,3 sobe ,uknjiženo ,grejanje na struju ,,1970,visoko prizemlje/1 sprat ,,"podrum, terasa, lođa ",,,telefon ,useljivo ,85968 ,pre 3 dana ,121.500,Milice Rakić,"Batajnica, Zemun opština, Beograd",Stan u zgradi ,,,,,,,,,
236,https://www.4zida.rs/prodaja-stanova/gradske-lokacije-secanj/jednosoban-stan/64e9e7d33d630b302f02ac98,"Jednosoban stan na prodaju, Gradske lokacije, 15.000€, 30m² - 4zida",2023-08-29,30 m² ,1 soba ,uknjiženo ,grejanje na gas ,renovirano ,,1/1 sprat ,,,,,"klima, veš mašina, kuhinjski elementi, frižider, ugradni plakar ",useljivo ,,pre 3 dana ,15.000,Gradske lokacije,"Gradske lokacije, Sečanj",Stan u zgradi ,,,,,,,,,
237,https://www.4zida.rs/prodaja-stanova/bulevar-evrope-gradske-lokacije-novi-sad/trosoban-stan/64edb6ec249176e9f2001360,"Trosoban stan na prodaju, 747, 145.820€, 68m² - 4zida",2023-08-29,68 m² ,3 sobe ,,etažno grejanje ,,,,,,,,,,72238 ,pre 10 sati ,145.820,747,"Bulevar Evrope, Gradske lokacije, Novi Sad",Stan u zgradi ,,,,,,,,,
238,https://www.4zida.rs/prodaja-stanova/neimar-vracar-beograd/dvoiposoban-stan/64e8d1ce11cd8175f9086661,"Dvoiposoban stan na prodaju, Neimar, 210.000€, 56m² - 4zida",2023-08-29,56 m² ,2.5 soba ,uknjiženo ,centralno grejanje ,novo ,,visoko prizemlje ,,,,polunamešteno ,"telefon, kablovska, internet, klima ",useljivo ,42702 ,pre 4 dana ,210.000,Neimar,"Neimar, Vračar, Beograd",,,,,,,,,,
239,https://www.4zida.rs/prodaja-stanova/liman-3-liman-gradske-lokacije-novi-sad/dvosoban-stan/64ed1b39a333dadc2a09cdc0,"Dvosoban stan na prodaju, Liman 3, 88.050€, 39m² - 4zida",2023-08-29,39 m² ,2 sobe ,uknjiženo ,centralno grejanje ,uobičajeno stanje ,1985,visoko prizemlje/6 spratova ,,,,,,,1040053 ,pre 21 sati ,88.050,Liman 3,"Liman 3, Liman, Gradske lokacije, Novi Sad",Stan u zgradi ,ima lift (1) ,,,,,,,,
240,https://www.4zida.rs/prodaja-stanova/novi-sad-centar-stari-grad-gradske-lokacije-novi-sad/jednoiposoban-stan/64edefa9b218680575010ce0,"Jednoiposoban stan na prodaju, Novi Sad - Centar, 63.860€, 21m² - 4zida",2023-08-29,21 m² ,1.5 soba ,uknjiženo ,,u izgradnji ,,prizemlje/4 sprata ,,,,,,,1095088 ,pre 6 sati ,63.860,Novi Sad - Centar,"Novi Sad - Centar, Stari Grad, Gradske lokacije, Novi Sad",Stan u zgradi ,,,,,,,,,
241,https://www.4zida.rs/prodaja-stanova/visnjica-palilula-opstina-beograd/trosoban-stan/64ec7305b0f264ba2a0a5f4f,"Trosoban stan na prodaju, Mirka Milojkovića, 145.000€, 67m² - 4zida",2023-08-29,67 m² ,3 sobe ,,centralno grejanje ,novo ,2023,1/5 spratova ,,terasa ,kupatilo ,prazno ,"telefon, interfon, klima ",,5957 ,pre 1 dan ,145.000,Mirka Milojkovića,"Višnjica, Palilula opština, Beograd",,ima lift (1) ,1 garažno mesto ,,,,,,,
242,https://www.4zida.rs/prodaja-stanova/blok-9a-novi-beograd-beograd/jednosoban-stan/64eddfa6fd39e371d404f16c,"Jednosoban stan na prodaju, Gramšijeva, 132.000€, 48m² - 4zida",2023-08-29,48 m² ,1 soba ,uknjiženo ,centralno grejanje ,uobičajeno stanje ,1980,13/19 spratova ,,"podrum, terasa ",kupatilo ,prazno ,"telefon, kablovska, internet, interfon, klima ",,1276 ,pre 7 sati ,132.000,Gramšijeva,"Blok 9a, Novi Beograd, Beograd",,ima lift (1) ,,,,,,,,
243,https://www.4zida.rs/prodaja-stanova/savina-novo-naselje-gradske-lokacije-novi-sad/jednoiposoban-stan/64e71a65724f6b2753062fed,"Jednoiposoban stan na prodaju, xxx, 92.000€, 47m² - 4zida",2023-08-29,47 m² ,1.5 soba ,uknjiženo ,centralno grejanje ,,,2/4 sprata ,,terasa ,,,,,,pre 4 dana ,92.000,xxx,"Savina, Novo Naselje, Gradske lokacije, Novi Sad",Stan u zgradi ,,,,,,,,,
244,https://www.4zida.rs/prodaja-stanova/visnjicka-banja-palilula-opstina-beograd/trosoban-stan/64e93696273614f3a1074bc8,"Trosoban stan na prodaju, Višnjička Banja, 145.000€, 67m² - 4zida",2023-08-29,67 m² ,3 sobe ,nije uknjiženo ,centralno grejanje ,,,2/6 spratova ,,terasa ,,,,useljivo ,101400 ,pre 3 dana ,145.000,Višnjička Banja,"Višnjička Banja, Palilula opština, Beograd",Stan u zgradi ,ima lift (1) ,,,,,,,,
245,https://www.4zida.rs/prodaja-stanova/centar-stari-grad-gradske-lokacije-kragujevac/troiposoban-stan/647de09542ea270ee0020ba5,"Prodaja stanova Centar, Stari Grad, Gradske lokacije, Kragujevac - 4zida",2023-08-29,,,,,,,,,,,,,,,,,,,,,,,,,,,,
246,https://www.4zida.rs/prodaja-stanova/neimar-vracar-beograd/dvoiposoban-stan/64ed1a83a333dadc2a09cd9c,"Dvoiposoban stan na prodaju, Anastasa Jovanovića, 254.500€, 67m² - 4zida",2023-08-29,67 m² ,2.5 soba ,uknjiženo ,centralno grejanje ,,,1/5 spratova ,,,kupatila (2) ,,"internet, klima ",,166873 ,pre 21 sati ,254.500,Anastasa Jovanovića,"Neimar, Vračar, Beograd",,ima lift (1) ,1 garažno mesto ,,,,,,,
247,https://www.4zida.rs/prodaja-stanova/staro-groblje-palilula-gradske-lokacije-nis/jednosoban-stan/63c1de85a63a418474064228,"Jednosoban stan na prodaju, Čarnojevića 6, 43.000€, 44m² - 4zida",2023-08-29,44 m² ,1 soba ,uknjiženo ,grejanje na struju ,renovirano ,1990,6/6 spratova ,,podrum ,"kupatilo, kuhinja, ostava ",namešteno ,"TV, klima, veš mašina, kuhinjski elementi, sudo mašina, frižider, zamrzivač, rerna ",useljivo ,,pre 13 sati ,43.000,Čarnojevića 6,"Staro Groblje, Palilula, Gradske lokacije, Niš",Stan u zgradi ,,,severoistok ,ulicu ,,"34, 7 ",,,
248,https://www.4zida.rs/prodaja-stanova/vikend-naselje-okolne-lokacije-kopaonik/jednoiposoban-stan/647de2d442ea270ee002177a,"Prodaja stanova Vikend naselje, Okolne lokacije, Kopaonik - 4zida",2023-08-29,,,,,,,,,,,,,,,,,,,,,,,,,,,,
249,https://www.4zida.rs/prodaja-stanova/erdoglija-gradske-lokacije-kragujevac/dvosoban-stan/647de2aa42ea270ee002153c,"Prodaja stanova Erdoglija, Gradske lokacije, Kragujevac - 4zida",2023-08-29,,,,,,,,,,,,,,,,,,,,,,,,,,,,
250,https://www.4zida.rs/prodaja-stanova/centar-gradske-lokacije-zlatibor/dvosoban-stan/647de0c142ea270ee0020d37,"Prodaja stanova Centar, Gradske lokacije, Zlatibor - 4zida",2023-08-29,,,,,,,,,,,,,,,,,,,,,,,,,,,,
251,https://www.4zida.rs/prodaja-stanova/zemun-centar-zemun-zemun-opstina-beograd/dvoiposoban-stan/64eca9f9e2e89301bb04a39b,"Dvoiposoban stan na prodaju, Banatska, 173.700€, 72m² - 4zida",2023-08-29,72 m² ,2.5 soba ,,centralno grejanje ,novo ,,visoko prizemlje/6 spratova ,,,kupatilo ,prazno ,telefon ,,2876 ,pre 1 dan ,173.700,Banatska,"Zemun - Centar, Zemun, Zemun opština, Beograd",,,,,,,,,,
252,https://www.4zida.rs/prodaja-stanova/kertvaros-gradske-lokacije-subotica/dvosoban-stan/64edc21ddd508318cf0e7f85,"Prodaja stanova Kertvaroš, Gradske lokacije, Subotica - 4zida",2023-08-29,,,,,,,,,,,,,,,,,,,,,,,,,,,,
253,https://www.4zida.rs/prodaja-stanova/zemun-centar-zemun-zemun-opstina-beograd/troiposoban-stan/64eca9fbe2e89301bb04a3e6,"Troiposoban stan na prodaju, Banatska, 214.300€, 91m² - 4zida",2023-08-29,91 m² ,3.5 soba ,,centralno grejanje ,novo ,,visoko prizemlje/6 spratova ,,,kupatilo ,prazno ,telefon ,,2851 ,pre 1 dan ,214.300,Banatska,"Zemun - Centar, Zemun, Zemun opština, Beograd",,,,,,,,,,
254,https://www.4zida.rs/prodaja-stanova/kumodraz-2-kumodraz-vozdovac-opstina-beograd/trosoban-stan/64e89a9cba28a2fbce0c2b3e,"Trosoban stan na prodaju, Bulevar Peka Dapčevića 80, 205.000€, 75m² - 4zida",2023-08-29,75 m² ,3 sobe ,uknjiženo ,centralno grejanje ,,1990,1/5 spratova ,,"podrum, terasa ",kupatilo ,prazno ,,,,pre 4 dana ,205.000,Bulevar Peka Dapčevića 80,"Kumodraž 2, Kumodraž, Voždovac opština, Beograd",Stan u zgradi ,,,,ulicu ,,25 25p ,,,
255,https://www.4zida.rs/prodaja-stanova/tornik-okolne-lokacije-zlatibor/dvosoban-stan/647de03442ea270ee0020877,"Prodaja stanova Tornik, Okolne lokacije, Zlatibor - 4zida",2023-08-29,,,,,,,,,,,,,,,,,,,,,,,,,,,,
256,https://www.4zida.rs/prodaja-stanova/park-svetog-save-bulevar-nemanjica-medijana-gradske-lokacije-nis/cetvorosoban-stan/64e615667f7183b9eb0207d2,"Četvorosoban stan na prodaju, Branka Krsmanovića, 144.500€, 95m² - 4zida",2023-08-29,95 m² ,4 sobe ,uknjiženo ,centralno grejanje ,uobičajeno stanje ,,3/5 spratova ,1 parking mesto ,"prilaz za invalide, terase (2) ","kupatilo, toalet ",prazno ,interfon ,,p,pre 6 dana ,144.500,Branka Krsmanovića,"Park Svetog Save, Bulevar Nemanjića, Medijana, Gradske lokacije, Niš",,ima lift (1) ,,,,,,,,
257,https://www.4zida.rs/prodaja-stanova/somborska-rampa-podbara-gradske-lokacije-novi-sad/troiposoban-stan/64e367c5c6ebe3889500ddf2,"Troiposoban stan na prodaju, Somborska rampa, 121.730€, 74m² - 4zida",2023-08-29,74 m² ,3.5 soba ,nije uknjiženo ,grejanje na gas ,u izgradnji ,2020,visoko prizemlje/2 sprata ,,terase (2) ,"kupatilo, toalet, kuhinja ",prazno ,,,514527 ,pre 8 dana ,121.730,Somborska rampa,"Somborska rampa, Podbara, Gradske lokacije, Novi Sad",Stan u zgradi ,,,,,,,,,
258,https://www.4zida.rs/prodaja-stanova/siva-stena-vozdovac-opstina-beograd/osmosoban-stan/64ede530fd39e371d404f2cd,"Osmosoban stan na prodaju, Siva Stena, 350.000€, 270m² - 4zida",2023-08-29,270 m² ,8 soba ,u procesu uknjižavanja ,etažno grejanje ,uobičajeno stanje ,1990,2/2 sprata ,1 parking mesto ,terasa ,kuhinja ,polunamešteno ,"kablovska, internet, interfon, TV, klima, veš mašina, frižider, šporet, ležaj ",,249 ,pre 7 sati ,350.000,Siva Stena,"Siva Stena, Voždovac opština, Beograd",Stan u zgradi ,,,,,,,,,
259,https://www.4zida.rs/prodaja-stanova/kalvarija-zemun-zemun-opstina-beograd/jednoiposoban-stan/64ecd97720e38ba7ac07cc55,"Jednoiposoban stan na prodaju, Milana Uzelca, 65.000€, 37m² - 4zida",2023-08-29,37 m² ,1.5 soba ,uknjiženo ,grejanje na struju ,,,prizemlje/4 sprata ,,,kupatilo ,prazno ,telefon ,,1563 ,pre 1 dan ,65.000,Milana Uzelca,"Kalvarija, Zemun, Zemun opština, Beograd",,,,,,,,,,
260,https://www.4zida.rs/prodaja-stanova/podina-gradske-lokacije-sokobanja/jednoiposoban-stan/64c392318622b0199b014a5d,"Prodaja stanova Podina, Gradske lokacije, Sokobanja - 4zida",2023-08-29,,,,,,,,,,,,,,,,,,,,,,,,,,,,
261,https://www.4zida.rs/prodaja-stanova/petrovaradin-gradske-lokacije-novi-sad/petosoban-stan/64a3fc664e68e80b3e011b2c,"Prodaja stanova Petrovaradin, Gradske lokacije, Novi Sad - 4zida",2023-08-29,,,,,,,,,,,,,,,,,,,,,,,,,,,,
262,https://www.4zida.rs/prodaja-stanova/mose-pijade-gradske-lokacije-kraljevo/dvosoban-stan/64e4a066e4042822a60ab979,"Dvosoban stan na prodaju, Dimitrija Tucovica, 82.000€, 80m² - 4zida",2023-08-29,80 m² ,2 sobe ,uknjiženo ,TA peć ,,1960,8/9 spratova ,,"podrum, terasa ","kupatila (2), toaleti (2), kuhinja ",polunamešteno ,"klima, plakar ",,,pre 7 dana ,82.000,Dimitrija Tucovica,"Moše Pijade, Gradske lokacije, Kraljevo",Stan u zgradi ,ima lift (2) ,,"istok, jug ","ulicu, dvorište ",,,,,
263,https://www.4zida.rs/prodaja-stanova/dom-zdravlja-medijana-gradske-lokacije-nis/troiposoban-stan/647ef60f07a69ee45a094fb2,"Prodaja stanova Dom Zdravlja, Medijana, Gradske lokacije, Niš - 4zida",2023-08-29,,,,,,,,,,,,,,,,,,,,,,,,,,,,
264,https://www.4zida.rs/prodaja-stanova/centar-gradske-lokacije-vrnjacka-banja/jednosoban-stan/647de1c042ea270ee0020dd3,"Prodaja stanova Centar, Gradske lokacije, Vrnjačka Banja - 4zida",2023-08-29,,,,,,,,,,,,,,,,,,,,,,,,,,,,
265,https://www.4zida.rs/prodaja-stanova/cair-medijana-gradske-lokacije-nis/dvoiposoban-stan/64e873ccaeb53926a7004e5f,"Dvoiposoban stan na prodaju, Ljube Nenadovića, 107.865€, 63m² - 4zida",2023-08-29,63 m² ,2.5 soba ,uknjiženo ,grejanje na struju ,novo ,,prizemlje/4 sprata ,,"prilaz za invalide, terasa ",kupatilo ,,"kablovska, internet, interfon, klima ",,p,pre 4 dana ,107.865,Ljube Nenadovića,"Čair, Medijana, Gradske lokacije, Niš",,ima lift (1) ,1 garažno mesto ,,,,,,,
266,https://www.4zida.rs/prodaja-stanova/zeleznicka-stanica-banatic-gradske-lokacije-novi-sad/cetvorosoban-stan/64e3e09dc00ac90d6f0b908c,"Četvorosoban stan na prodaju, Železnička stanica, 154.500€, 72m² - 4zida",2023-08-29,72 m² ,4 sobe ,,centralno grejanje ,uobičajeno stanje ,2001,5/5 spratova ,,terasa ,,,,,1040031 ,pre 5 dana ,154.500,Železnička stanica,"Železnička stanica, Banatić, Gradske lokacije, Novi Sad",Stan u zgradi ,,,,,,,,,
267,https://www.4zida.rs/prodaja-stanova/gradske-lokacije-zlatibor/trosoban-stan/647de2f142ea270ee0021920,"Prodaja stanova Gradske lokacije, Zlatibor - 4zida",2023-08-29,,,,,,,,,,,,,,,,,,,,,,,,,,,,
268,https://www.4zida.rs/prodaja-stanova/sajmiste-gradske-lokacije-novi-sad/garsonjera/64e5de93146172044c065f26,"Garsonjera na prodaju, Sajmište, 37.080€, 15m² - 4zida",2023-08-29,15 m² ,0.5 soba ,uknjiženo ,grejanje na gas ,uobičajeno stanje ,2009,5/5 spratova ,,,,,,,1006416 ,pre 6 dana ,37.080,Sajmište,"Sajmište, Gradske lokacije, Novi Sad",Stan u zgradi ,ima lift (1) ,,,,,,,,
269,https://www.4zida.rs/prodaja-stanova/bulevar-oslobodjenja-gradske-lokacije-novi-sad/dvosoban-stan/64ecadd8e744c522750da222,"Dvosoban stan na prodaju, Bulevar Oslobođenja, 128.670€, 49m² - 4zida",2023-08-29,49 m² ,2 sobe ,uknjiženo ,centralno grejanje ,renovirano ,,3/5 spratova ,,terasa ,kupatilo ,prazno ,,,516038 ,pre 1 dan ,128.670,Bulevar Oslobođenja,"Bulevar Oslobođenja, Gradske lokacije, Novi Sad",Stan u zgradi ,ima lift (1) ,,,,,,,,
270,https://www.4zida.rs/prodaja-stanova/rakovica-rakovica-opstina-beograd/garsonjera/64eccc8a4248c411e50bca12,"Garsonjera na prodaju, Kneževac, 47.500€, 27m² - 4zida",2023-08-29,27 m² ,0.5 soba ,uknjiženo ,TA peć ,,2000,2/3 sprata ,2 parking mesta ,terasa ,kupatilo ,prazno ,,,3293 ,pre 1 dan ,47.500,Kneževac,"Rakovica, Rakovica opština, Beograd",Stan u zgradi ,,,,,,,,,
271,https://www.4zida.rs/prodaja-stanova/pantelejska-crkva-pantelej-gradske-lokacije-nis/dvoiposoban-stan/64bfb9dd1c57e0a6760aa08c,"Prodaja stanova Pantelejska Crkva, Pantelej, Gradske lokacije, Niš - 4zida",2023-08-29,,,,,,,,,,,,,,,,,,,,,,,,,,,,
272,https://www.4zida.rs/prodaja-stanova/stara-carsija-gradske-lokacije-kraljevo/trosoban-stan/64ede4c414a367e72503dae8,"Trosoban stan na prodaju, heroja maricica, 70.000€, 73m² - 4zida",2023-08-29,73 m² ,3 sobe ,uknjiženo ,centralno grejanje ,renovirano ,,5/5 spratova ,,,,,,useljivo ,,pre 7 sati ,70.000,heroja maricica,"Stara Čaršija, Gradske lokacije, Kraljevo",Stan u zgradi ,,,,,,,,,
273,https://www.4zida.rs/prodaja-stanova/kaludjerica-grocka-opstina-beograd/dvoiposoban-stan/64e39e74244711338a0fd5df,"Dvoiposoban stan na prodaju, Lončarevo, 85.250€, 55m² - 4zida",2023-08-29,55 m² ,2.5 soba ,uknjiženo ,etažno grejanje ,,,1/3 sprata ,,lođa ,kupatilo ,prazno ,telefon ,,4354 ,pre 6 dana ,85.250,Lončarevo,"Kaluđerica, Grocka opština, Beograd",,,,,,,,,,
274,https://www.4zida.rs/prodaja-stanova/beograd-centar-stari-grad-opstina-beograd/petosoban-stan/64e8f315809d0c5263077202,"Petosoban stan na prodaju, Beograd centar, 329.000€, 166m² - 4zida",2023-08-29,166 m² ,5 soba ,uknjiženo ,centralno grejanje ,renovirano ,,5/5 spratova ,,terasa ,kuhinja ,polunamešteno ,"kablovska, internet, interfon, klima ",useljivo ,266 ,pre 3 dana ,329.000,Beograd centar,"Beograd centar, Stari Grad opština, Beograd",Stan u zgradi ,ima lift (1) ,,,,,,,,
275,https://www.4zida.rs/prodaja-stanova/novi-sad-centar-stari-grad-gradske-lokacije-novi-sad/dvosoban-stan/64e89acba6d034f13005f10a,"Dvosoban stan na prodaju, Novi Sad - Centar, 132.000€, 40m² - 4zida",2023-08-29,40 m² ,2 sobe ,,centralno grejanje ,,2023,visoko prizemlje/4 sprata ,,terasa ,,,,,1044298 ,pre 4 dana ,132.000,Novi Sad - Centar,"Novi Sad - Centar, Stari Grad, Gradske lokacije, Novi Sad",,ima lift (1) ,,,,,,,,
276,https://www.4zida.rs/prodaja-stanova/podina-gradske-lokacije-sokobanja/jednoiposoban-stan/64c392318622b0199b014a61,"Prodaja stanova Podina, Gradske lokacije, Sokobanja - 4zida",2023-08-29,,,,,,,,,,,,,,,,,,,,,,,,,,,,
277,https://www.4zida.rs/prodaja-stanova/podbara-gradske-lokacije-novi-sad/dvoiposoban-stan/647de23442ea270ee00211de,"Prodaja stanova Podbara, Gradske lokacije, Novi Sad - 4zida",2023-08-29,,,,,,,,,,,,,,,,,,,,,,,,,,,,
278,https://www.4zida.rs/prodaja-stanova/zemun-centar-zemun-zemun-opstina-beograd/trosoban-stan/64eca9fbe2e89301bb04a3da,"Trosoban stan na prodaju, Banatska, 191.580€, 76m² - 4zida",2023-08-29,76 m² ,3 sobe ,,centralno grejanje ,novo ,,1/6 spratova ,,,kupatilo ,prazno ,telefon ,,2855 ,pre 1 dan ,191.580,Banatska,"Zemun - Centar, Zemun, Zemun opština, Beograd",,,,,,,,,,
279,https://www.4zida.rs/prodaja-stanova/brace-jerkovic-vozdovac-opstina-beograd/dvoiposoban-stan/64ec72c1b0f264ba2a0a5f39,"Dvoiposoban stan na prodaju, Jovana Bijelića, 114.500€, 56m² - 4zida",2023-08-29,56 m² ,2.5 soba ,uknjiženo ,etažno grejanje ,uobičajeno stanje ,,1/4 sprata ,,"podrum, lođa ",kupatilo ,prazno ,telefon ,,3167 ,pre 1 dan ,114.500,Jovana Bijelića,"Braće Jerković, Voždovac opština, Beograd",,,,,,,,,,
280,https://www.4zida.rs/prodaja-stanova/telep-gradske-lokacije-novi-sad/dvoiposoban-stan/64e47b38676048e4780db6ed,"Dvoiposoban stan na prodaju, Telep, 133.900€, 58m² - 4zida",2023-08-29,58 m² ,2.5 soba ,,etažno grejanje ,uobičajeno stanje ,2022,3/4 sprata ,,terasa ,,,,,1056126 ,pre 7 dana ,133.900,Telep,"Telep, Gradske lokacije, Novi Sad",Stan u zgradi ,ima lift (1) ,,,,,,,,
281,https://www.4zida.rs/prodaja-stanova/somborska-pantelej-gradske-lokacije-nis/jednoiposoban-stan/64c7a2dc4f3e5b891f0bef2a,"Prodaja stanova Somborska, Pantelej, Gradske lokacije, Niš - 4zida",2023-08-29,,,,,,,,,,,,,,,,,,,,,,,,,,,,
282,https://www.4zida.rs/prodaja-stanova/blok-64-bezanijski-blokovi-novi-beograd-beograd/troiposoban-stan/64db6948248c921ae500c51c,"Prodaja stanova Blok 64, Bežanijski Blokovi, Novi Beograd, Beograd - 4zida",2023-08-29,,,,,,,,,,,,,,,,,,,,,,,,,,,,
