,link,Površina,Broj soba,Uknjiženost,Grejanje,Stanje,Spratnost,Infrastruktura,Nameštenost,Opremljenost,Useljivo,Šifra oglasa,Oglas ažuriran,price,street,address,title,end_date,Tip,Godina izgradnje,Lift,Garaža,Parking,Unutrašnje prostorije,Orijentacija nekretnine,Useljivo od,Pogled na,Autobuske linije,Internet,Tramvajske linije,Trolejbuske linije
682,https://www.4zida.rs/prodaja-stanova/misa-gradske-lokacije-pancevo/jednoiposoban-stan/64cca285f21c322d6e02bf63,,,,,,,,,,,,,,,,"Prodaja stanova Misa, Gradske lokacije, Pančevo - 4zida",2023-09-24,,,,,,,,,,,,,
683,https://www.4zida.rs/prodaja-stanova/cara-dusana-adamovicevo-naselje-gradske-lokacije-novi-sad/dvoiposoban-stan/6504792475518a8b4501c882,53 m² ,2.5 soba ,uknjiženo ,grejanje na struju ,renovirano ,3/4 sprata ,,prazno ,,,469942 ,pre 8 dana ,109.180,Cara Dušana,"Cara Dušana, Adamovićevo Naselje, Gradske lokacije, Novi Sad","Dvoiposoban stan na prodaju, Cara Dušana, 109.180€, 53m² - 4zida",2023-09-24,Stan u zgradi ,,,,,,,,,,,,
684,https://www.4zida.rs/prodaja-stanova/somborska-pantelej-gradske-lokacije-nis/dvoiposoban-stan/650ebbc6fe0a304e8c032756,57 m² ,2.5 soba ,uknjiženo ,etažno grejanje ,novo ,,terasa ,prazno ,,,3869 ,pre 1 dan ,90.880,Somborska,"Somborska, Pantelej, Gradske lokacije, Niš","Dvoiposoban stan na prodaju, Somborska, 90.880€, 57m² - 4zida",2023-09-24,,,,,,,,,,,,,
685,https://www.4zida.rs/prodaja-stanova/bulevar-nemanjica-medijana-gradske-lokacije-nis/dvosoban-stan/650ebbc6fe0a304e8c032753,51 m² ,2 sobe ,uknjiženo ,etažno grejanje ,novo ,3. sprat ,terasa ,prazno ,,,3870 ,pre 1 dan ,97.400,Bulevar Nemanjića,"Bulevar Nemanjića, Medijana, Gradske lokacije, Niš","Dvosoban stan na prodaju, Bulevar Nemanjića, 97.400€, 51m² - 4zida",2023-09-24,,,ima lift (1) ,,,,,,,,,,
686,https://www.4zida.rs/prodaja-stanova/klisa-gradske-lokacije-novi-sad/cetvorosoban-stan/650806def44aff9f650d8bc4,,,,,,,,,,,,,,,,"Prodaja stanova Klisa, Gradske lokacije, Novi Sad - 4zida",2023-09-24,,,,,,,,,,,,,
687,https://www.4zida.rs/prodaja-stanova/liman-3-liman-gradske-lokacije-novi-sad/jednosoban-stan/64f322f68c1e24dc15009639,,,,,,,,,,,,,,,,"Prodaja stanova Liman 3, Liman, Gradske lokacije, Novi Sad - 4zida",2023-09-24,,,,,,,,,,,,,
688,https://www.4zida.rs/prodaja-stanova/alvadzinica-gradske-lokacije-cacak/jednoiposoban-stan/6507586baa4a083a1a05f14c,61 m² ,1.5 soba ,uknjiženo ,centralno grejanje ,novo ,prizemlje/5 spratova ,,namešteno ,"kablovska, kuhinjski elementi, plakar ",useljivo ,,pre 6 dana ,80.000,Balkanska 19,"Alvadžinica, Gradske lokacije, Čačak","Jednoiposoban stan na prodaju, Balkanska 19, 80.000€, 61m² - 4zida",2023-09-24,Stan u zgradi ,2010,,,u dvorištu zgrade ,"kupatilo, toalet, kuhinja, ostava ",,,ulicu ,,,,
689,https://www.4zida.rs/prodaja-stanova/blok-64-bezanijski-blokovi-novi-beograd-beograd/jednoiposoban-stan/64db6959248c921ae500c57e,,,,,,,,,,,,,,,,"Prodaja stanova Blok 64, Bežanijski Blokovi, Novi Beograd, Beograd - 4zida",2023-09-24,,,,,,,,,,,,,
690,https://www.4zida.rs/prodaja-stanova/lesnina-gradske-lokacije-zrenjanin/dvosoban-stan/64fb103d8b2d64c7530029f5,58 m² ,2 sobe ,uknjiženo ,centralno grejanje ,uobičajeno stanje ,3/4 sprata ,"podrum, terasa ",prazno ,"telefon, interfon ",useljivo ,1211 ,pre 2 dana ,47.000,Lesnina,"Lesnina, Gradske lokacije, Zrenjanin","Dvosoban stan na prodaju, Lesnina, 47.000€, 58m² - 4zida",2023-09-24,,,,,1 parking mesto ,kupatilo ,,,,,,,
691,https://www.4zida.rs/prodaja-stanova/satelit-novo-naselje-gradske-lokacije-novi-sad/dvosoban-stan/64ef4e8b97be4febdd012e5d,48 m² ,2 sobe ,,centralno grejanje ,,1/3 sprata ,,,,,1047354 ,pre 25 dana ,94.700,Satelit,"Satelit, Novo Naselje, Gradske lokacije, Novi Sad","Dvosoban stan na prodaju, Satelit, 94.700€, 48m² - 4zida",2023-09-24,,1965,,,,,,,,,,,
692,https://www.4zida.rs/prodaja-stanova/sajmiste-gradske-lokacije-novi-sad/trosoban-stan/647de23c42ea270ee002123f,,,,,,,,,,,,,,,,"Prodaja stanova Sajmište, Gradske lokacije, Novi Sad - 4zida",2023-09-24,,,,,,,,,,,,,
693,https://www.4zida.rs/prodaja-stanova/slavija-vracar-beograd/cetvorosoban-stan/650d96840b7f6289c1078e2a,201 m² ,4 sobe ,u procesu uknjižavanja ,centralno grejanje ,u izgradnji ,7/7 spratova ,terase (2) ,prazno ,,,,pre 2 dana ,924.000,bulevar oslobodjenja,"Slavija, Vračar, Beograd","Četvorosoban stan na prodaju, bulevar oslobodjenja, 924.000€, 201m² - 4zida",2023-09-24,Stan u zgradi ,,,2 garažna mesta ,,kupatila (3,,,,,,,
694,https://www.4zida.rs/prodaja-stanova/novi-sad-centar-stari-grad-gradske-lokacije-novi-sad/jednoiposoban-stan/650d88649a048a1de80fe7d1,41 m² ,1.5 soba ,uknjiženo ,centralno grejanje ,novo ,4/5 spratova ,,namešteno ,,useljivo ,44220 ,pre 2 dana ,122.570,Novi Sad - Centar,"Novi Sad - Centar, Stari Grad, Gradske lokacije, Novi Sad","Jednoiposoban stan na prodaju, Novi Sad - Centar, 122.570€, 41m² - 4zida",2023-09-24,,,,,,,,,,,,,
695,https://www.4zida.rs/prodaja-stanova/somborska-pantelej-gradske-lokacije-nis/dvoiposoban-stan/64c7a2dc4f3e5b891f0bef24,,,,,,,,,,,,,,,,"Prodaja stanova Somborska, Pantelej, Gradske lokacije, Niš - 4zida",2023-09-24,,,,,,,,,,,,,
696,https://www.4zida.rs/prodaja-stanova/delta-city-blok-67-belville-novi-beograd-beograd/dvosoban-stan/650d7724fede657ccd07b2c1,68 m² ,2 sobe ,uknjiženo ,centralno grejanje ,novo ,9/10 spratova ,terasa ,prazno ,,useljivo ,2461 ,pre 2 dana ,238.000,Jurija Gagarina,"Delta City, Blok 67 - Belville, Novi Beograd, Beograd","Dvosoban stan na prodaju, Jurija Gagarina, 238.000€, 68m² - 4zida",2023-09-24,Stan u zgradi ,,ima lift (2) ,1 garažno mesto ,,,,,,,,,
697,https://www.4zida.rs/prodaja-stanova/slatina-gradske-lokacije-vrnjacka-banja/dvosoban-stan/647de28b42ea270ee00213b4,,,,,,,,,,,,,,,,"Prodaja stanova Slatina, Gradske lokacije, Vrnjačka Banja - 4zida",2023-09-24,,,,,,,,,,,,,
698,https://www.4zida.rs/prodaja-stanova/sremcica-cukarica-opstina-beograd/jednoiposoban-stan/64f5dcb4627a4728630c152b,43 m² ,1.5 soba ,uknjiženo ,centralno grejanje ,,4/4 sprata ,,prazno ,telefon ,,1569 ,pre 20 dana ,59.000,Sare Bernar,"Sremčica, Čukarica opština, Beograd","Jednoiposoban stan na prodaju, Sare Bernar, 59.000€, 43m² - 4zida",2023-09-24,,,,,,kupatilo ,,,,,,,
699,https://www.4zida.rs/prodaja-stanova/cacak-centar-gradske-lokacije-cacak/trosoban-stan/64fb21d460ae76a40c0b61af,61 m² ,3 sobe ,uknjiženo ,centralno grejanje ,novo ,4/4 sprata ,terasa ,prazno ,,useljivo ,,pre 16 dana ,63.000,Svetozara Markovića,"Čačak - Centar, Gradske lokacije, Čačak","Trosoban stan na prodaju, Svetozara Markovića, 63.000€, 61m² - 4zida",2023-09-24,Stan u zgradi ,2015,,,,kupatilo ,,,,,,,
700,https://www.4zida.rs/prodaja-stanova/avijaticarsko-naselje-gradske-lokacije-novi-sad/dvosoban-stan/647de06842ea270ee0020a20,,,,,,,,,,,,,,,,"Prodaja stanova Avijatičarsko Naselje, Gradske lokacije, Novi Sad - 4zida",2023-09-24,,,,,,,,,,,,,
701,https://www.4zida.rs/prodaja-stanova/gradske-lokacije-sokobanja/dvosoban-stan/64f0ae7d4c9cb47b2f0e0c1d,45 m² ,2 sobe ,,grejanje na struju ,u izgradnji ,2/3 sprata ,terasa ,,"interfon, klima ",,p,pre 24 dana ,74.550,Sokobanja,"Gradske lokacije, Sokobanja","Dvosoban stan na prodaju, Sokobanja, 74.550€, 45m² - 4zida",2023-09-24,,,,,1 parking mesto ,kupatilo ,,,,,,,
702,https://www.4zida.rs/prodaja-stanova/karaburma-palilula-opstina-beograd/dvosoban-stan/650d6b7a1c92ad724d02c477,50 m² ,2 sobe ,uknjiženo ,TA peć ,uobičajeno stanje ,3/4 sprata ,"podrum, terasa ",prazno ,"kablovska, internet, interfon ",,16740 ,pre 2 dana ,82.000,Stevana Dukića,"Karaburma, Palilula opština, Beograd","Dvosoban stan na prodaju, Stevana Dukića, 82.000€, 50m² - 4zida",2023-09-24,Stan u zgradi ,,,,,ostava ,,,,,,,
703,https://www.4zida.rs/prodaja-stanova/blok-64-bezanijski-blokovi-novi-beograd-beograd/troiposoban-stan/64db5b2d4afa93e86a052f25,,,,,,,,,,,,,,,,"Prodaja stanova Blok 64, Bežanijski Blokovi, Novi Beograd, Beograd - 4zida",2023-09-24,,,,,,,,,,,,,
704,https://www.4zida.rs/prodaja-stanova/blok-58-novi-beograd-beograd/trosoban-stan/650d9f604a425217a60e4466,84 m² ,3 sobe ,nije uknjiženo ,podno grejanje ,novo ,7/10 spratova ,terasa ,,telefon ,,7671 ,pre 2 dana ,315.000,Jurija Gagarina,"Blok 58, Novi Beograd, Beograd","Trosoban stan na prodaju, Jurija Gagarina, 315.000€, 84m² - 4zida",2023-09-24,Stan u zgradi ,2023,ima lift (1) ,1 garažno mesto ,,,,,,,,,
705,https://www.4zida.rs/prodaja-stanova/nova-detelinara-detelinara-gradske-lokacije-novi-sad/trosoban-stan/650afb1e8d43253795030030,66 m² ,3 sobe ,uknjiženo ,centralno grejanje ,novo ,1/3 sprata ,terasa ,,,,517196 ,pre 4 dana ,122.000,Nova Detelinara,"Nova Detelinara, Detelinara, Gradske lokacije, Novi Sad","Trosoban stan na prodaju, Nova Detelinara, 122.000€, 66m² - 4zida",2023-09-24,Stan u zgradi ,,,,,,,,,,,,
706,https://www.4zida.rs/prodaja-stanova/juzni-bulevar-vracar-beograd/dvosoban-stan/650d5c940e83febf3d0d7420,52 m² ,2 sobe ,uknjiženo ,,novo ,6/8 spratova ,terasa ,namešteno ,"kablovska, internet, interfon, TV, klima, Kanalizacija ",useljivo ,8003 ,pre 2 dana ,153.900,Južni Bulevar,"Južni Bulevar, Vračar, Beograd","Dvosoban stan na prodaju, Južni Bulevar, 153.900€, 52m² - 4zida",2023-09-24,,2010,ima lift (1) ,,,kuhinja ,,,,,,,
707,https://www.4zida.rs/prodaja-stanova/labudovo-brdo-rakovica-opstina-beograd/dvoiposoban-stan/64ee7c6ee7c59ac01c0a81f0,69 m² ,2.5 soba ,uknjiženo ,etažno grejanje ,novo ,9/9 spratova ,lođa ,,"telefon, klima ",useljivo ,101437 ,pre 25 dana ,122.000,11. krajiške divizije,"Labudovo Brdo, Rakovica opština, Beograd","Dvoiposoban stan na prodaju, 11. krajiške divizije, 122.000€, 69m² - 4zida",2023-09-24,Stan u zgradi ,2010,ima lift (1) ,,1 parking mesto ,,,,,,,,
708,https://www.4zida.rs/prodaja-stanova/bistrica-novo-naselje-gradske-lokacije-novi-sad/trosoban-stan/64f06e4490c43447ac0c99cf,64 m² ,3 sobe ,uknjiženo ,centralno grejanje ,renovirano ,4/5 spratova ,terasa ,namešteno ,klima ,,42418 ,pre 11 dana ,133.900,Bistrica,"Bistrica, Novo Naselje, Gradske lokacije, Novi Sad","Trosoban stan na prodaju, Bistrica, 133.900€, 64m² - 4zida",2023-09-24,Stan u zgradi ,,ima lift (1) ,,,kupatilo ,,,,"2, 7, 8 i 9 ",,,
709,https://www.4zida.rs/prodaja-stanova/erdoglija-gradske-lokacije-kragujevac/cetvoroiposoban-stan/65045a995c774c8f2900d1eb,174 m² ,4.5 soba ,,podno grejanje ,novo ,4. sprat ,,prazno ,,,1182 ,pre 9 dana ,200.000,Erdoglija,"Erdoglija, Gradske lokacije, Kragujevac","Četvoroiposoban stan na prodaju, Erdoglija, 200.000€, 174m² - 4zida",2023-09-24,Stan u zgradi ,,ima lift (1) ,1 garažno mesto ,,,,,,,,,
710,https://www.4zida.rs/prodaja-stanova/zvezdara-zvezdara-opstina-beograd/petosoban-stan/6502325220cb5582990cde53,120 m² ,5 soba ,uknjiženo ,etažno grejanje ,,4/4 sprata ,,,"internet, klima ",,167579 ,pre 10 dana ,191.900,SEVERNI BULEVAR,"Zvezdara, Zvezdara opština, Beograd","Petosoban stan na prodaju, SEVERNI BULEVAR, 191.900€, 120m² - 4zida",2023-09-24,,1967,,,,kupatilo ,,,,,,,
711,https://www.4zida.rs/prodaja-stanova/vozdovac-vozdovac-opstina-beograd/jednosoban-stan/64fc9a4b7397933f950bcdee,35 m² ,1 soba ,uknjiženo ,grejanje na gas ,novo ,suteren/4 sprata ,lođa ,,klima ,useljivo ,74116 ,pre 14 dana ,55.000,Nikole Đurkovića,"Voždovac, Voždovac opština, Beograd","Jednosoban stan na prodaju, Nikole Đurkovića, 55.000€, 35m² - 4zida",2023-09-24,Stan u zgradi ,,,,,,,,,,,,
712,https://www.4zida.rs/prodaja-stanova/nova-detelinara-detelinara-gradske-lokacije-novi-sad/dvosoban-stan/650ad47f014b12746c0a2a70,45 m² ,2 sobe ,uknjiženo ,centralno grejanje ,,2/4 sprata ,terasa ,prazno ,"telefon, kablovska ",,508365 ,pre 4 dana ,95.490,Nova Detelinara,"Nova Detelinara, Detelinara, Gradske lokacije, Novi Sad","Dvosoban stan na prodaju, Nova Detelinara, 95.490€, 45m² - 4zida",2023-09-24,Stan u zgradi ,,ima lift (1) ,,,,,,,,,,
713,https://www.4zida.rs/prodaja-stanova/gradske-lokacije-vrnjacka-banja/jednosoban-stan/65059d89806e00ffe907cde3,43 m² ,1 soba ,uknjiženo ,grejanje na struju ,novo ,,,,,,,pre 8 dana ,76.110,Gradske lokacije,"Gradske lokacije, Vrnjačka Banja","Jednosoban stan na prodaju, Gradske lokacije, 76.110€, 43m² - 4zida",2023-09-24,Stan u zgradi ,,,,,,,,,,,,
714,https://www.4zida.rs/prodaja-stanova/cair-medijana-gradske-lokacije-nis/dvoiposoban-stan/650ab70bc53fe1ba4d0b5a75,65 m² ,2.5 soba ,u procesu uknjižavanja ,etažno grejanje ,novo ,3/4 sprata ,"terasa, lođa ",prazno ,,useljivo ,,pre 4 dana ,86.600,Čair,"Čair, Medijana, Gradske lokacije, Niš","Dvoiposoban stan na prodaju, Čair, 86.600€, 65m² - 4zida",2023-09-24,Stan u zgradi ,,ima lift (1) ,,1 parking mesto ,"kupatilo, toalet, kuhinja ",,,,,,,
715,https://www.4zida.rs/prodaja-stanova/stepa-stepanovic-vozdovac-opstina-beograd/jednosoban-stan/650d3def88bcf3b500042714,36 m² ,1 soba ,uknjiženo ,centralno grejanje ,uobičajeno stanje ,visoko prizemlje/4 sprata ,terasa ,,"kablovska, interfon, klima ",,977532 ,pre 2 dana ,95.000,Druge srpske armije,"Stepa Stepanović, Voždovac opština, Beograd","Jednosoban stan na prodaju, Druge srpske armije, 95.000€, 36m² - 4zida",2023-09-24,Stan u zgradi ,2014,,,,"kupatilo, kuhinja ",,,,,Kablovska ,,
716,https://www.4zida.rs/prodaja-stanova/podbara-gradske-lokacije-novi-sad/cetvorosoban-stan/64f5acd11cfc91474e0ddff2,92 m² ,4 sobe ,uknjiženo ,,uobičajeno stanje ,2/2 sprata ,terasa ,,,,1059670 ,pre 20 dana ,154.400,Podbara,"Podbara, Gradske lokacije, Novi Sad","Četvorosoban stan na prodaju, Podbara, 154.400€, 92m² - 4zida",2023-09-24,Stan u zgradi ,1950,,,,,,,,,,,
717,https://www.4zida.rs/prodaja-stanova/banovo-brdo-cukarica-cukarica-opstina-beograd/trosoban-stan/650d5ee00e83febf3d0d74f3,92 m² ,3 sobe ,,,,2/7 spratova ,,prazno ,"kablovska, internet, interfon, klima ",,48 ,pre 2 dana ,255.400,Banovo Brdo,"Banovo Brdo, Čukarica, Čukarica opština, Beograd","Trosoban stan na prodaju, Banovo Brdo, 255.400€, 92m² - 4zida",2023-09-24,Stan u zgradi ,2024,ima lift (1) ,,,,,,,,,,
718,https://www.4zida.rs/prodaja-stanova/stari-majur-majur-petrovaradin-gradske-lokacije-novi-sad/jednoiposoban-stan/64fedb705b9efc9d87046257,41 m² ,1.5 soba ,uknjiženo ,grejanje na gas ,u izgradnji ,3/5 spratova ,terasa ,,,,513626 ,pre 13 dana ,84.400,Stari Majur,"Stari Majur, Majur, Petrovaradin, Gradske lokacije, Novi Sad","Jednoiposoban stan na prodaju, Stari Majur, 84.400€, 41m² - 4zida",2023-09-24,Stan u zgradi ,,ima lift (1) ,,,,,,,,,,
719,https://www.4zida.rs/prodaja-stanova/padina-zvezdara-opstina-beograd/trosoban-stan/6507000baa122630fb0102ff,57 m² ,3 sobe ,uknjiženo ,etažno grejanje ,novo ,1/2 sprata ,terasa ,prazno ,,useljivo ,,pre 3 dana ,108.000,Radoslava Bokšića,"Padina, Zvezdara opština, Beograd","Trosoban stan na prodaju, Radoslava Bokšića, 108.000€, 57m² - 4zida",2023-09-24,Stan u zgradi ,,,,"1 parking mesto, u dvorištu zgrade ","kupatilo, kuhinja ",,,,,,,
720,https://www.4zida.rs/prodaja-stanova/cair-medijana-gradske-lokacije-nis/cetvorosoban-stan/650c3f01db2648729900f84c,,,,,,,,,,,,,,,,"Prodaja stanova Čair, Medijana, Gradske lokacije, Niš - 4zida",2023-09-24,,,,,,,,,,,,,
721,https://www.4zida.rs/prodaja-stanova/dorcol-stari-grad-opstina-beograd/jednoiposoban-stan/650d5e2d0e83febf3d0d7487,40 m² ,1.5 soba ,uknjiženo ,centralno grejanje ,,2/8 spratova ,"podrum, terasa ",namešteno ,"kablovska, internet, interfon, klima ",useljivo ,1728 ,pre 2 dana ,175.000,Dorćol,"Dorćol, Stari Grad opština, Beograd","Jednoiposoban stan na prodaju, Dorćol, 175.000€, 40m² - 4zida",2023-09-24,Stan u zgradi ,,ima lift (1) ,,,,,,,,,,
722,https://www.4zida.rs/prodaja-stanova/medakovic-vozdovac-opstina-beograd/trosoban-stan/650181e87fbbefdca401c812,100 m² ,3 sobe ,uknjiženo ,grejanje na gas ,novo ,1/2 sprata ,terasa ,prazno ,"telefon, kablovska, internet, interfon, klima ",useljivo ,1186 ,pre 11 dana ,220.800,Svetozara Radojčića,"Medaković, Voždovac opština, Beograd","Trosoban stan na prodaju, Svetozara Radojčića, 220.800€, 100m² - 4zida",2023-09-24,,,,,1 parking mesto ,kupatilo ,,,,,,,
723,https://www.4zida.rs/prodaja-stanova/severni-telep-telep-gradske-lokacije-novi-sad/dvosoban-stan/650dd1f5c6db22cb270e1cab,40 m² ,2 sobe ,uknjiženo ,grejanje na gas ,novo ,1/3 sprata ,terasa ,,,useljivo ,503762 ,pre 1 dan ,90.980,Severni Telep,"Severni Telep, Telep, Gradske lokacije, Novi Sad","Dvosoban stan na prodaju, Severni Telep, 90.980€, 40m² - 4zida",2023-09-24,Stan u zgradi ,,ima lift (1) ,,,,,,,,,,
724,https://www.4zida.rs/prodaja-stanova/zarkovo-cukarica-cukarica-opstina-beograd/dvosoban-stan/650dbc7af48c988f7f0dab0a,60 m² ,2 sobe ,uknjiženo ,,,nisko prizemlje/4 sprata ,terasa ,,,,91146 ,pre 1 dan ,99.000,Ratka Mitrovica,"Žarkovo, Čukarica, Čukarica opština, Beograd","Dvosoban stan na prodaju, Ratka Mitrovica, 99.000€, 60m² - 4zida",2023-09-24,Stan u zgradi ,,,,,,,,,,,,
725,https://www.4zida.rs/prodaja-stanova/avijaticarsko-naselje-gradske-lokacije-novi-sad/trosoban-stan/647de04342ea270ee002092c,,,,,,,,,,,,,,,,"Prodaja stanova Avijatičarsko Naselje, Gradske lokacije, Novi Sad - 4zida",2023-09-24,,,,,,,,,,,,,
726,https://www.4zida.rs/prodaja-stanova/brace-jerkovic-vozdovac-opstina-beograd/jednoiposoban-stan/6508919e416155cb2207b08b,49 m² ,1.5 soba ,uknjiženo ,grejanje na struju ,uobičajeno stanje ,1/4 sprata ,podrum ,polunamešteno ,"telefon, kablovska, internet, interfon ",,8874 ,pre 5 dana ,115.000,Piva Karamatijevića,"Braće Jerković, Voždovac opština, Beograd","Jednoiposoban stan na prodaju, Piva Karamatijevića, 115.000€, 49m² - 4zida",2023-09-24,,1967,,,,kupatilo ,,,,,,,
727,https://www.4zida.rs/prodaja-stanova/centar-gradske-lokacije-zrenjanin/petoiposoban-stan/650db21e8ba4c0e10a0d0504,76 m² ,5.5 soba ,uknjiženo ,grejanje na struju ,renovirano ,prizemlje/1 sprat ,,namešteno ,"kablovska, TV, klima, veš mašina, kuhinjski elementi, frižider, ležaj, plakar ",useljivo ,PU1048 ,pre 1 dan ,119.000,Gimnazijska,"Centar, Gradske lokacije, Zrenjanin","Petoiposoban stan na prodaju, Gimnazijska, 119.000€, 76m² - 4zida",2023-09-24,Apartman ,,,,,kupatila (3,,,,,Optički ,,
728,https://www.4zida.rs/prodaja-stanova/zeleznicka-stanica-palilula-gradske-lokacije-nis/jednoiposoban-stan/64fb13ca8b2d64c753002aa1,40 m² ,1.5 soba ,uknjiženo ,TA peć ,renovirano ,prizemlje ,,namešteno ,,,p,pre 6 dana ,55.000,Vojvode Gojka,"Železnička Stanica, Palilula, Gradske lokacije, Niš","Jednoiposoban stan na prodaju, Vojvode Gojka, 55.000€, 40m² - 4zida",2023-09-24,,,,,,kupatilo ,,,,,,,
729,https://www.4zida.rs/prodaja-stanova/socijalno-rotkvarija-gradske-lokacije-novi-sad/trosoban-stan/65085b781ee0cd470a0fa581,83 m² ,3 sobe ,,centralno grejanje ,,,,,,,68427 ,pre 6 dana ,206.000,KRALJEVICA MARKA,"Socijalno, Rotkvarija, Gradske lokacije, Novi Sad","Trosoban stan na prodaju, KRALJEVICA MARKA, 206.000€, 83m² - 4zida",2023-09-24,Stan u zgradi ,,,,,,,,,,,,
730,https://www.4zida.rs/prodaja-stanova/ledine-novi-beograd-beograd/jednoiposoban-stan/650d67441c92ad724d02c35f,33 m² ,1.5 soba ,uknjiženo ,etažno grejanje ,novo ,suteren/4 sprata ,,prazno ,telefon ,,2489 ,pre 2 dana ,47.850,Marka Šagala,"Ledine, Novi Beograd, Beograd","Jednoiposoban stan na prodaju, Marka Šagala, 47.850€, 33m² - 4zida",2023-09-24,,,,,1 parking mesto ,kupatilo ,,,,,,,
731,https://www.4zida.rs/prodaja-stanova/centar-gradske-lokacije-vrnjacka-banja/dvosoban-stan/647de02342ea270ee0020787,,,,,,,,,,,,,,,,"Prodaja stanova Centar, Gradske lokacije, Vrnjačka Banja - 4zida",2023-09-24,,,,,,,,,,,,,
732,https://www.4zida.rs/prodaja-stanova/vidikovac-rakovica-opstina-beograd/dvosoban-stan/64ef2876cd5b27672d09bf46,53 m² ,2 sobe ,uknjiženo ,centralno grejanje ,,7/7 spratova ,terasa ,prazno ,"telefon, interfon ",,1565 ,pre 20 dana ,120.000,Pilota Mihaila Petrovića,"Vidikovac, Rakovica opština, Beograd","Dvosoban stan na prodaju, Pilota Mihaila Petrovića, 120.000€, 53m² - 4zida",2023-09-24,,,ima lift (1) ,,,kupatilo ,,,,,,,
733,https://www.4zida.rs/prodaja-stanova/fon-vozdovac-vozdovac-vozdovac-opstina-beograd/dvoiposoban-stan/64ef3517ac495b0b0b035fe5,69 m² ,2.5 soba ,uknjiženo ,centralno grejanje ,,2. sprat ,"podrum, terasa ",prazno ,,,16546 ,pre 25 dana ,245.000,Bilećka,"FON - Voždovac, Voždovac, Voždovac opština, Beograd","Dvoiposoban stan na prodaju, Bilećka, 245.000€, 69m² - 4zida",2023-09-24,Stan u zgradi ,,,,1 parking mesto ,ostava ,,,,,,,
734,https://www.4zida.rs/prodaja-stanova/lesnina-gradske-lokacije-zrenjanin/dvosoban-stan/650ad76163090cbb0c0c111e,49 m² ,2 sobe ,uknjiženo ,grejanje na struju ,novo ,visoko prizemlje/4 sprata ,terasa ,namešteno ,"telefon, kablovska, internet, interfon ",,1903 ,pre 4 dana ,80.000,Lesnina,"Lesnina, Gradske lokacije, Zrenjanin","Dvosoban stan na prodaju, Lesnina, 80.000€, 49m² - 4zida",2023-09-24,,2021,ima lift (1) ,,1 parking mesto ,kupatilo ,,,,,,,
735,https://www.4zida.rs/prodaja-stanova/donji-dorcol-dorcol-stari-grad-opstina-beograd/dvoiposoban-stan/650481361b34c6180f069bde,57 m² ,2.5 soba ,uknjiženo ,centralno grejanje ,uobičajeno stanje ,7/7 spratova ,lođa ,prazno ,telefon ,,86410 ,pre 8 dana ,220.000,Kapetan Mišina,"Donji Dorćol, Dorćol, Stari Grad opština, Beograd","Dvoiposoban stan na prodaju, Kapetan Mišina, 220.000€, 57m² - 4zida",2023-09-24,,,ima lift (1) ,,,kupatilo ,,,,,,,
736,https://www.4zida.rs/prodaja-stanova/petrovaradin-gradske-lokacije-novi-sad/trosoban-stan/650f674bd5fdd70a1303cd4e,69 m² ,3 sobe ,,grejanje na gas ,uobičajeno stanje ,1/3 sprata ,terasa ,,,,1001632 ,pre 16 sati ,159.500,Petrovaradin,"Petrovaradin, Gradske lokacije, Novi Sad","Trosoban stan na prodaju, Petrovaradin, 159.500€, 69m² - 4zida",2023-09-24,Stan u zgradi ,2022,ima lift (1) ,,,,,,,,,,
737,https://www.4zida.rs/prodaja-stanova/blok-64-bezanijski-blokovi-novi-beograd-beograd/garsonjera/64db4d224a8599ed43038e24,,,,,,,,,,,,,,,,"Prodaja stanova Blok 64, Bežanijski Blokovi, Novi Beograd, Beograd, Garsonjera - 4zida",2023-09-24,,,,,,,,,,,,,
738,https://www.4zida.rs/prodaja-stanova/novi-sad-centar-stari-grad-gradske-lokacije-novi-sad/dvosoban-stan/650dbc96f48c988f7f0dab19,49 m² ,2 sobe ,uknjiženo ,,uobičajeno stanje ,2/7 spratova ,terasa ,,,,1027086 ,pre 1 dan ,130.000,Novi Sad - Centar,"Novi Sad - Centar, Stari Grad, Gradske lokacije, Novi Sad","Dvosoban stan na prodaju, Novi Sad - Centar, 130.000€, 49m² - 4zida",2023-09-24,Stan u zgradi ,1980,ima lift (1) ,,,,,,,,,,
739,https://www.4zida.rs/prodaja-stanova/adice-gradske-lokacije-novi-sad/garsonjera/650dbe1af48c988f7f0dab78,27 m² ,0.5 soba ,uknjiženo ,etažno grejanje ,novo ,prizemlje/2 sprata ,,,,useljivo ,101785 ,pre 1 dan ,50.000,Mirona Đorđevića,"Adice, Gradske lokacije, Novi Sad","Garsonjera na prodaju, Mirona Đorđevića, 50.000€, 27m² - 4zida",2023-09-24,Stan u zgradi ,,,1 garažno mesto ,1 parking mesto ,,,,,,,,
740,https://www.4zida.rs/prodaja-stanova/bulevar-oslobodjenja-gradske-lokacije-novi-sad/jednosoban-stan/6503469aa52d508ab40d4109,34 m² ,1 soba ,uknjiženo ,centralno grejanje ,uobičajeno stanje ,4/6 spratova ,terasa ,namešteno ,"klima, veš mašina, kuhinjski elementi, frižider, zamrzivač, ležaj, plakar ",,,pre 4 dana ,90.000,Ćirpanova,"Bulevar Oslobođenja, Gradske lokacije, Novi Sad","Jednosoban stan na prodaju, Ćirpanova, 90.000€, 34m² - 4zida",2023-09-24,Stan u zgradi ,2010,ima lift (1) ,,,"kupatilo, kuhinja ",sever ,,dvorište ,,Kablovska ,,
741,https://www.4zida.rs/prodaja-stanova/telep-gradske-lokacije-novi-sad/dvoiposoban-stan/650d59ad0e83febf3d0d73d4,58 m² ,2.5 soba ,,,u izgradnji ,3/3 sprata ,terasa ,,,,1058430 ,pre 2 dana ,161.700,Telep,"Telep, Gradske lokacije, Novi Sad","Dvoiposoban stan na prodaju, Telep, 161.700€, 58m² - 4zida",2023-09-24,Stan u zgradi ,2023,ima lift (1) ,,,,,,,,,,
742,https://www.4zida.rs/prodaja-stanova/lesnina-gradske-lokacije-zrenjanin/trosoban-stan/650c901b05271653e70b2c9e,66 m² ,3 sobe ,u procesu uknjižavanja ,centralno grejanje ,u izgradnji ,1/5 spratova ,"prilaz za invalide, terasa ",prazno ,"kablovska, klima ",,N889 ,pre 2 dana ,87.120,Lesnina,"Lesnina, Gradske lokacije, Zrenjanin","Trosoban stan na prodaju, Lesnina, 87.120€, 66m² - 4zida",2023-09-24,Stan u zgradi ,,ima lift (1) ,,"1 parking mesto, u dvorištu zgrade ","kupatilo, kuhinja ",,01.09.2024 ,ulicu ,,Kablovska ,,
743,https://www.4zida.rs/prodaja-stanova/blok-64-bezanijski-blokovi-novi-beograd-beograd/jednoiposoban-stan/64db5b3a4afa93e86a052f94,,,,,,,,,,,,,,,,"Prodaja stanova Blok 64, Bežanijski Blokovi, Novi Beograd, Beograd - 4zida",2023-09-24,,,,,,,,,,,,,
744,https://www.4zida.rs/prodaja-stanova/palic-okolne-lokacije-subotica/garsonjera/650f090b7ba90ffbbf0b7878,23 m² ,0.5 soba ,u procesu uknjižavanja ,grejanje na gas ,u izgradnji ,suteren/3 sprata ,lođe (3,prazno ,,,,pre 23 sati ,50.500,Kanjiški put Bb,"Palić, Okolne lokacije, Subotica","Garsonjera na prodaju, Kanjiški put Bb, 50.500€, 23m² - 4zida",2023-09-24,Stan u zgradi ,,ima lift (3) ,1 garažno mesto ,u dvorištu zgrade ,"kupatilo, toalet ",,,,,,,
745,https://www.4zida.rs/prodaja-stanova/bulevar-patrijarha-pavla-somborski-bulevar-telep-gradske-lokacije-novi-sad/dvosoban-stan/65097494ed313cf71006f4d8,,,,,,,,,,,,,,,,"Prodaja stanova Bulevar Patrijarha Pavla (Somborski Bulevar), Telep, Gradske lokacije, Novi Sad - 4zida",2023-09-24,,,,,,,,,,,,,
746,https://www.4zida.rs/prodaja-stanova/sajmiste-gradske-lokacije-novi-sad/jednoiposoban-stan/647de23a42ea270ee0021227,,,,,,,,,,,,,,,,"Prodaja stanova Sajmište, Gradske lokacije, Novi Sad - 4zida",2023-09-24,,,,,,,,,,,,,
747,https://www.4zida.rs/prodaja-stanova/cvijiceva-palilula-opstina-beograd/dvoiposoban-stan/650464c0cea006f7a70ef120,72 m² ,2.5 soba ,uknjiženo ,centralno grejanje ,,5/7 spratova ,"podrum, terasa ",prazno ,"interfon, Kanalizacija ",,20644 ,pre 1 dan ,270.000,Ilije Garašanina,"Cvijićeva, Palilula opština, Beograd","Dvoiposoban stan na prodaju, Ilije Garašanina, 270.000€, 72m² - 4zida",2023-09-24,Stan u zgradi ,1959,ima lift (1) ,,1 parking mesto ,,,,,,,,
