,link,title,end_date,Površina,Broj soba,Grejanje,Stanje,Spratnost,Unutrašnje prostorije,Nameštenost,Opremljenost,Šifra oglasa,Oglas ažuriran,price,street,address,Uknjiženost,Godina izgradnje,Lift,Parking,Infrastruktura,Tip,Garaža,Useljivo,Orijentacija nekretnine,Autobuske linije,Internet,Useljivo od,Pogled na,Tramvajske linije,Trolejbuske linije,Dozvoljeni kućni ljubimci
413,https://www.4zida.rs/prodaja-stanova/adice-gradske-lokacije-novi-sad/garsonjera/64ee0a16bece50f7ae06bb96,"Garsonjera na prodaju, Adice, 35.000€, 17m² - 4zida",2023-08-29,17 m² ,0.5 soba ,,u izgradnji ,prizemlje/3 sprata ,,,,1059614 ,pre 5 sati ,35.000,Adice,"Adice, Gradske lokacije, Novi Sad",uknjiženo ,,,,,Stan u zgradi ,,,,,,,,,,
414,https://www.4zida.rs/prodaja-stanova/satelit-novo-naselje-gradske-lokacije-novi-sad/dvosoban-stan/64e8a935106ec264f9000e78,"Prodaja stanova Satelit, Novo Naselje, Gradske lokacije, Novi Sad - 4zida",2023-08-29,,,,,,,,,,,,,,,,,,,,,,,,,,,,,
415,https://www.4zida.rs/prodaja-stanova/cerak-vinogradi-cukarica-cukarica-opstina-beograd/troiposoban-stan/64e4a6f404e13de706054483,"Troiposoban stan na prodaju, Jasenova, 205.000€, 93m² - 4zida",2023-08-29,93 m² ,3.5 soba ,centralno grejanje ,uobičajeno stanje ,2/3 sprata ,kupatilo ,prazno ,"internet, interfon ",39953 ,pre 7 dana ,205.000,Jasenova,"Cerak Vinogradi, Čukarica, Čukarica opština, Beograd",uknjiženo ,,,,lođa ,,,,,,,,,,,
416,https://www.4zida.rs/prodaja-stanova/obrenovac-obrenovac-opstina-beograd/dvosoban-stan/647de25842ea270ee002136c,"Prodaja stanova Obrenovac, Obrenovac opština, Beograd - 4zida",2023-08-29,,,,,,,,,,,,,,,,,,,,,,,,,,,,,
417,https://www.4zida.rs/prodaja-stanova/veternicka-rampa-veternik-gradske-lokacije-novi-sad/trosoban-stan/64e31625cfb51c5b930c6d17,"Prodaja stanova Veternička Rampa, Veternik, Gradske lokacije, Novi Sad - 4zida",2023-08-29,,,,,,,,,,,,,,,,,,,,,,,,,,,,,
418,https://www.4zida.rs/prodaja-stanova/bagljas-gradske-lokacije-zrenjanin/trosoban-stan/64e88bb682d53bd1920440f2,"Trosoban stan na prodaju, Bagljaš, 64.000€, 67m² - 4zida",2023-08-29,67 m² ,3 sobe ,,,,kupatilo ,,,12310209 ,pre 4 dana ,64.000,Bagljaš,"Bagljaš, Gradske lokacije, Zrenjanin",,,,,,,,,,,,,,,,
419,https://www.4zida.rs/prodaja-stanova/mirijevo-zvezdara-opstina-beograd/jednoiposoban-stan/64e8c906f7b695addf092d9a,"Jednoiposoban stan na prodaju, Vitezova Karađorđeve Zvezde, 103.200€, 51m² - 4zida",2023-08-29,51 m² ,1.5 soba ,,novo ,1/3 sprata ,kupatilo ,prazno ,klima ,1035 ,pre 5 sati ,103.200,Vitezova Karađorđeve Zvezde,"Mirijevo, Zvezdara opština, Beograd",uknjiženo ,2023,,1 parking mesto ,terasa ,,,,,,,,,,,
420,https://www.4zida.rs/prodaja-stanova/nova-detelinara-detelinara-gradske-lokacije-novi-sad/dvosoban-stan/64ec9c67359a925c9e0f72f9,"Dvosoban stan na prodaju, Nova Detelinara, 124.000€, 66m² - 4zida",2023-08-29,66 m² ,2 sobe ,centralno grejanje ,uobičajeno stanje ,7/8 spratova ,,,,1052617 ,pre 1 dan ,124.000,Nova Detelinara,"Nova Detelinara, Detelinara, Gradske lokacije, Novi Sad",uknjiženo ,1900,ima lift (1) ,,terasa ,Stan u zgradi ,,,,,,,,,,
421,https://www.4zida.rs/prodaja-stanova/pantelej-gradske-lokacije-nis/dvosoban-stan/64e373550556bd24210ae373,"Dvosoban stan na prodaju, Pantelej, 65.000€, 53m² - 4zida",2023-08-29,53 m² ,2 sobe ,centralno grejanje ,uobičajeno stanje ,5/10 spratova ,,prazno ,"telefon, kablovska, internet ",10010 ,pre 7 dana ,65.000,Pantelej,"Pantelej, Gradske lokacije, Niš",uknjiženo ,,ima lift (1) ,,lođa ,,,useljivo ,,,,,,,,
422,https://www.4zida.rs/prodaja-stanova/somborska-pantelej-gradske-lokacije-nis/troiposoban-stan/64c0fd4ba4ac4baf740f87aa,"Prodaja stanova Somborska, Pantelej, Gradske lokacije, Niš - 4zida",2023-08-29,,,,,,,,,,,,,,,,,,,,,,,,,,,,,
423,https://www.4zida.rs/prodaja-stanova/bezanijska-kosa-3-bezanijska-kosa-novi-beograd-beograd/trosoban-stan/648accf0d0f9bcb9b20f3a24,"Trosoban stan na prodaju, Srđana Aleksića, 148.000€, 62m² - 4zida",2023-08-29,62 m² ,3 sobe ,,,1/5 spratova ,kupatilo ,namešteno ,"internet, klima ",88829701 ,pre 1 mesec ,148.000,Srđana Aleksića,"Bežanijska kosa 3, Bežanijska kosa, Novi Beograd, Beograd",,,,,terasa ,,,,,,,,,,,
424,https://www.4zida.rs/prodaja-stanova/gornji-grad-gradske-lokacije-pancevo/trosoban-stan/647de2cd42ea270ee002171a,"Prodaja stanova Gornji Grad, Gradske lokacije, Pančevo - 4zida",2023-08-29,,,,,,,,,,,,,,,,,,,,,,,,,,,,,
425,https://www.4zida.rs/prodaja-stanova/marger-medijana-gradske-lokacije-nis/jednoiposoban-stan/64edb77a249176e9f200139c,"Jednoiposoban stan na prodaju, Dečanska, 102.000€, 51m² - 4zida",2023-08-29,51 m² ,1.5 soba ,etažno grejanje ,renovirano ,1/5 spratova ,kupatilo ,namešteno ,,p,pre 11 sati ,102.000,Dečanska,"Marger, Medijana, Gradske lokacije, Niš",uknjiženo ,,,1 parking mesto ,,,,,,,,,,,,
426,https://www.4zida.rs/prodaja-stanova/rakovica-rakovica-opstina-beograd/jednoiposoban-stan/64e60895b19ce0b0b00809aa,"Jednoiposoban stan na prodaju, Mome Stanojlovića, 66.000€, 37m² - 4zida",2023-08-29,37 m² ,1.5 soba ,TA peć ,,,kuhinja ,,,179 ,pre 6 dana ,66.000,Mome Stanojlovića,"Rakovica, Rakovica opština, Beograd",uknjiženo ,,,,terasa ,Stan u zgradi ,,,jugoistok ,,,,,,,
427,https://www.4zida.rs/prodaja-stanova/centar-gradske-lokacije-zlatibor/dvosoban-stan/647de0bb42ea270ee0020d1a,"Prodaja stanova Centar, Gradske lokacije, Zlatibor - 4zida",2023-08-29,,,,,,,,,,,,,,,,,,,,,,,,,,,,,
428,https://www.4zida.rs/prodaja-stanova/visnjica-palilula-opstina-beograd/trosoban-stan/64ee50eb58be6ff5580c706b,"Trosoban stan na prodaju, Slanački Put, 170.000€, 67m² - 4zida",2023-08-29,67 m² ,3 sobe ,centralno grejanje ,novo ,4/5 spratova ,kupatilo ,prazno ,"telefon, interfon, klima ",8027 ,pre 42 minuta ,170.000,Slanački Put,"Višnjica, Palilula opština, Beograd",uknjiženo ,2023,ima lift (1) ,,terasa ,,1 garažno mesto ,useljivo ,,,,,,,,
429,https://www.4zida.rs/prodaja-stanova/adice-gradske-lokacije-novi-sad/garsonjera/64ee19f782c58d5c990081e6,"Garsonjera na prodaju, Šumska, 35.000€, 17m² - 4zida",2023-08-29,17 m² ,0.5 soba ,podno grejanje ,,prizemlje ,,,,101455 ,pre 4 sata ,35.000,Šumska,"Adice, Gradske lokacije, Novi Sad",uknjiženo ,,,,,Stan u zgradi ,,useljivo ,,,,,,,,
430,https://www.4zida.rs/prodaja-stanova/centar-gradske-lokacije-zrenjanin/dvosoban-stan/64e862f88a46dc3aae0774b6,"Dvosoban stan na prodaju, Centar, 45.000€, 57m² - 4zida",2023-08-29,57 m² ,2 sobe ,grejanje na gas ,,visoko prizemlje ,,,,30316 ,pre 4 dana ,45.000,Centar,"Centar, Gradske lokacije, Zrenjanin",,,,,,,,,,,,,,,,
431,https://www.4zida.rs/prodaja-stanova/centar-gradske-lokacije-kragujevac/trosoban-stan/64e8a9e4106ec264f9000ebf,"Trosoban stan na prodaju, Centar, 86.000€, 77m² - 4zida",2023-08-29,77 m² ,3 sobe ,,renovirano ,13/13 spratova ,kupatilo ,polunamešteno ,"interfon, klima ",2899 ,pre 4 dana ,86.000,Centar,"Centar, Gradske lokacije, Kragujevac",uknjiženo ,,,,,,,,,,,,,,,
432,https://www.4zida.rs/prodaja-stanova/medakovic-2-medakovic-vozdovac-opstina-beograd/dvosoban-stan/64df31429bb7139a390f46fd,"Prodaja stanova Medaković 2, Medaković, Voždovac opština, Beograd - 4zida",2023-08-29,,,,,,,,,,,,,,,,,,,,,,,,,,,,,
433,https://www.4zida.rs/prodaja-stanova/cerak-cukarica-cukarica-opstina-beograd/troiposoban-stan/64e615837b3621833f0e338b,"Troiposoban stan na prodaju, Petefijeva, 158.900€, 88m² - 4zida",2023-08-29,88 m² ,3.5 soba ,centralno grejanje ,uobičajeno stanje ,1/6 spratova ,"kupatilo, toalet ",prazno ,,,pre 6 dana ,158.900,Petefijeva,"Cerak, Čukarica, Čukarica opština, Beograd",uknjiženo ,,ima lift (1) ,,"terasa, lođa ",Stan u zgradi ,,,,,,,,,,
434,https://www.4zida.rs/prodaja-stanova/sajmiste-gradske-lokacije-novi-sad/jednosoban-stan/647de23942ea270ee0021214,"Prodaja stanova Sajmište, Gradske lokacije, Novi Sad - 4zida",2023-08-29,,,,,,,,,,,,,,,,,,,,,,,,,,,,,
435,https://www.4zida.rs/prodaja-stanova/sajmiste-gradske-lokacije-novi-sad/jednoiposoban-stan/64e8d75911cd8175f90867e3,"Jednoiposoban stan na prodaju, Sajmište, 117.000€, 38m² - 4zida",2023-08-29,38 m² ,1.5 soba ,,,1/3 sprata ,,prazno ,,189 ,pre 4 dana ,117.000,Sajmište,"Sajmište, Gradske lokacije, Novi Sad",,,,,,Stan u zgradi ,,,,,,,,,,
436,https://www.4zida.rs/prodaja-stanova/blok-64-bezanijski-blokovi-novi-beograd-beograd/dvoiposoban-stan/64db5b3f4afa93e86a052fb8,"Prodaja stanova Blok 64, Bežanijski Blokovi, Novi Beograd, Beograd - 4zida",2023-08-29,,,,,,,,,,,,,,,,,,,,,,,,,,,,,
437,https://www.4zida.rs/prodaja-stanova/lagator-gradske-lokacije-loznica/trosoban-stan/647de09642ea270ee0020bba,"Prodaja stanova Lagator, Gradske lokacije, Loznica - 4zida",2023-08-29,,,,,,,,,,,,,,,,,,,,,,,,,,,,,
438,https://www.4zida.rs/prodaja-stanova/beograd-na-vodi-savski-venac-beograd/dvosoban-stan/64e4d230eda91ed1d3030a28,"Dvosoban stan na prodaju, Hercegovačka, 272.000€, 56m² - 4zida",2023-08-29,56 m² ,2 sobe ,centralno grejanje ,novo ,11/24 sprata ,,,,8901 ,pre 7 dana ,272.000,Hercegovačka,"Beograd na vodi, Savski Venac, Beograd",nije uknjiženo ,,ima lift (6) ,,terasa ,,,useljivo ,,,,,,,,
439,https://www.4zida.rs/prodaja-stanova/radijalac-gradske-lokacije-subotica/dvosoban-stan/64ee030e1db7f5b1e600d6a4,"Dvosoban stan na prodaju, Arsenija čarnojevića Bb, 105.000€, 74m² - 4zida",2023-08-29,74 m² ,2 sobe ,grejanje na gas ,novo ,5/5 spratova ,"kupatilo, toalet, kuhinja ",prazno ,,,pre 6 sati ,105.000,Arsenija čarnojevića Bb,"Radijalac, Gradske lokacije, Subotica",uknjiženo ,2020,ima lift (3) ,,"terasa, lođe (3",Stan u zgradi ,,,,,,01.09.2023 ,,,,
440,https://www.4zida.rs/prodaja-stanova/centar-gradske-lokacije-zlatibor/jednoiposoban-stan/647de1f042ea270ee0020fed,"Prodaja stanova Centar, Gradske lokacije, Zlatibor - 4zida",2023-08-29,,,,,,,,,,,,,,,,,,,,,,,,,,,,,
441,https://www.4zida.rs/prodaja-stanova/nova-detelinara-detelinara-gradske-lokacije-novi-sad/cetvorosoban-stan/64e4b1c114c14b3da0083ad0,"Četvorosoban stan na prodaju, Nova Detelinara, 154.500€, 80m² - 4zida",2023-08-29,80 m² ,4 sobe ,centralno grejanje ,,6/6 spratova ,kupatila (2) ,,,470766 ,pre 7 dana ,154.500,Nova Detelinara,"Nova Detelinara, Detelinara, Gradske lokacije, Novi Sad",uknjiženo ,,ima lift (1) ,,terasa ,Stan u zgradi ,,,,,,,,,,
442,https://www.4zida.rs/prodaja-stanova/centar-gradske-lokacije-kopaonik/jednosoban-stan/647de03142ea270ee0020858,"Prodaja stanova Centar, Gradske lokacije, Kopaonik - 4zida",2023-08-29,,,,,,,,,,,,,,,,,,,,,,,,,,,,,
443,https://www.4zida.rs/prodaja-stanova/tosin-bunar-novi-beograd-beograd/trosoban-stan/64ec8ddc5cb0777f53016b6c,"Trosoban stan na prodaju, Tošin bunar, 353.900€, 104m² - 4zida",2023-08-29,104 m² ,3 sobe ,centralno grejanje ,novo ,prizemlje/9 spratova ,kupatilo ,prazno ,telefon ,2842 ,pre 1 dan ,353.900,Tošin bunar,"Tošin Bunar, Novi Beograd, Beograd",,,,,,,,,,,,,,,,
444,https://www.4zida.rs/prodaja-stanova/telep-gradske-lokacije-novi-sad/cetvorosoban-stan/647de2df42ea270ee00217fc,"Prodaja stanova Telep, Gradske lokacije, Novi Sad - 4zida",2023-08-29,,,,,,,,,,,,,,,,,,,,,,,,,,,,,
445,https://www.4zida.rs/prodaja-stanova/centar-gradske-lokacije-jagodina/jednosoban-stan/64ee4a025a4986864d087d8c,"Jednosoban stan na prodaju, Centar, 30.000€, 36m² - 4zida",2023-08-29,36 m² ,1 soba ,grejanje na struju ,renovirano ,5/5 spratova ,"kupatilo, kuhinja ",namešteno ,,,pre 1 sat ,30.000,Centar,"Centar, Gradske lokacije, Jagodina",uknjiženo ,,,,"podrum, terasa ",Stan u zgradi ,,useljivo ,,,,,,,,
446,https://www.4zida.rs/prodaja-stanova/kumodraz-vozdovac-opstina-beograd/dvosoban-stan/64e87d18385a7e321a06d4ff,"Dvosoban stan na prodaju, Decembarska, 99.900€, 46m² - 4zida",2023-08-29,46 m² ,2 sobe ,etažno grejanje ,novo ,prizemlje/2 sprata ,kupatilo ,prazno ,telefon ,8820 ,pre 4 dana ,99.900,Decembarska,"Kumodraž, Voždovac opština, Beograd",uknjiženo ,,,,,,,,,,,,,,,
447,https://www.4zida.rs/prodaja-stanova/kertvaros-gradske-lokacije-subotica/dvoiposoban-stan/64edc217dd508318cf0e7f6d,"Prodaja stanova Kertvaroš, Gradske lokacije, Subotica - 4zida",2023-08-29,,,,,,,,,,,,,,,,,,,,,,,,,,,,,
448,https://www.4zida.rs/prodaja-stanova/prozivka-gradske-lokacije-subotica/dvosoban-stan/64995437186955272f08075d,"Prodaja stanova Prozivka, Gradske lokacije, Subotica - 4zida",2023-08-29,,,,,,,,,,,,,,,,,,,,,,,,,,,,,
449,https://www.4zida.rs/prodaja-stanova/bubanj-palilula-gradske-lokacije-nis/dvoiposoban-stan/64edcc472e30f983c9031935,"Dvoiposoban stan na prodaju, Bubanj, 82.500€, 64m² - 4zida",2023-08-29,64 m² ,2.5 soba ,TA peć ,uobičajeno stanje ,2/6 spratova ,"kupatilo, toalet, kuhinja, ostava ",polunamešteno ,"veš mašina, kuhinjski elementi, frižider, rerna, ležaj, plakar ",,pre 9 sati ,82.500,Bubanj,"Bubanj, Palilula, Gradske lokacije, Niš",uknjiženo ,,,,"podrum, terasa, lođa ",Stan u zgradi ,,useljivo ,,,,,,,,
450,https://www.4zida.rs/prodaja-stanova/divcibare-okolne-lokacije-valjevo/dvosoban-stan/64eae8bef1920571070d43db,"Dvosoban stan na prodaju, Divčibare, 75.000€, 45m² - 4zida",2023-08-29,45 m² ,2 sobe ,podno grejanje ,renovirano ,1/1 sprat ,"kupatilo, toalet ",namešteno ,,,pre 1 dan ,75.000,Divčibare,"Divčibare, Okolne lokacije, Valjevo",uknjiženo ,,,,,Apartman ,,,,,,,,,,
451,https://www.4zida.rs/prodaja-stanova/somborska-pantelej-gradske-lokacije-nis/dvosoban-stan/647de1e242ea270ee0020f3c,"Prodaja stanova Somborska, Pantelej, Gradske lokacije, Niš - 4zida",2023-08-29,,,,,,,,,,,,,,,,,,,,,,,,,,,,,
452,https://www.4zida.rs/prodaja-stanova/brace-jerkovic-vozdovac-opstina-beograd/jednoiposoban-stan/64eca164359a925c9e0f740c,"Jednoiposoban stan na prodaju, Braće Jerković, 105.000€, 53m² - 4zida",2023-08-29,53 m² ,1.5 soba ,centralno grejanje ,,8/11 spratova ,,prazno ,interfon ,439 ,pre 1 dan ,105.000,Braće Jerković,"Braće Jerković, Voždovac opština, Beograd",uknjiženo ,1985,ima lift (1) ,1 parking mesto ,"podrum, terasa ",Stan u zgradi ,,,,,,,,,,
453,https://www.4zida.rs/prodaja-stanova/banovo-brdo-cukarica-cukarica-opstina-beograd/jednosoban-stan/64e366583d7550db960f545c,"Jednosoban stan na prodaju, Pere Todorovića, 85.000€, 33m² - 4zida",2023-08-29,33 m² ,1 soba ,centralno grejanje ,,2/4 sprata ,kupatilo ,prazno ,telefon ,4352 ,pre 6 dana ,85.000,Pere Todorovića,"Banovo Brdo, Čukarica, Čukarica opština, Beograd",uknjiženo ,,,,,,,,,,,,,,,
454,https://www.4zida.rs/prodaja-stanova/kertvaros-gradske-lokacije-subotica/dvosoban-stan/64edc21cdd508318cf0e7f82,"Prodaja stanova Kertvaroš, Gradske lokacije, Subotica - 4zida",2023-08-29,,,,,,,,,,,,,,,,,,,,,,,,,,,,,
455,https://www.4zida.rs/prodaja-stanova/mirijevo-zvezdara-opstina-beograd/dvosoban-stan/64dbf6f259c2ae74d4037b5c,"Dvosoban stan na prodaju, Lazara Trifunovića, 105.000€, 48m² - 4zida",2023-08-29,48 m² ,2 sobe ,etažno grejanje ,novo ,visoko prizemlje/5 spratova ,kupatilo ,,"internet, klima ",166456 ,pre 13 dana ,105.000,Lazara Trifunovića,"Mirijevo, Zvezdara opština, Beograd",uknjiženo ,2019,ima lift (1) ,,,,,,,,,,,,,
456,https://www.4zida.rs/prodaja-stanova/satelit-novo-naselje-gradske-lokacije-novi-sad/dvoiposoban-stan/64edefa7b218680575010cda,"Dvoiposoban stan na prodaju, Satelit, 91.240€, 48m² - 4zida",2023-08-29,48 m² ,2.5 soba ,,u izgradnji ,1/4 sprata ,,,,1095521 ,pre 7 sati ,91.240,Satelit,"Satelit, Novo Naselje, Gradske lokacije, Novi Sad",uknjiženo ,,,,,Stan u zgradi ,,,,,,,,,,
457,https://www.4zida.rs/prodaja-stanova/centar-gradske-lokacije-kraljevo/trosoban-stan/64edb0cad24389fdd00aadb2,"Trosoban stan na prodaju, Kej, 118.500€, 78m² - 4zida",2023-08-29,78 m² ,3 sobe ,centralno grejanje ,,,kupatilo ,namešteno ,,,pre 9 sati ,118.500,Kej,"Centar, Gradske lokacije, Kraljevo",uknjiženo ,,ima lift (1) ,,lođa ,Stan u zgradi ,,useljivo ,,,,,,,,
458,https://www.4zida.rs/prodaja-stanova/profesorska-kolonija-palilula-opstina-beograd/trosoban-stan/64edd1960225e929650f92d7,"Trosoban stan na prodaju, Cvijićeva, 300.000€, 80m² - 4zida",2023-08-29,80 m² ,3 sobe ,TA peć ,uobičajeno stanje ,1/3 sprata ,,prazno ,"kablovska, internet, interfon, klima ",4983 ,pre 9 sati ,300.000,Cvijićeva,"Profesorska Kolonija, Palilula opština, Beograd",uknjiženo ,1947,,,"podrum, lođa ",Salonac ,,,,,,,,,,
459,https://www.4zida.rs/prodaja-stanova/centar-stari-grad-gradske-lokacije-kragujevac/dvosoban-stan/64ec7419b0f264ba2a0a5f96,"Dvosoban stan na prodaju, Nikole Pašića, 60.000€, 51m² - 4zida",2023-08-29,51 m² ,2 sobe ,centralno grejanje ,,14/15 spratova ,kupatilo ,,,p,pre 1 dan ,60.000,Nikole Pašića,"Centar, Stari Grad, Gradske lokacije, Kragujevac",uknjiženo ,,,,,,1 garažno mesto ,,,,,,,,,
460,https://www.4zida.rs/prodaja-stanova/liman-gradske-lokacije-novi-sad/dvosoban-stan/647de2b242ea270ee00215a8,"Prodaja stanova Liman, Gradske lokacije, Novi Sad - 4zida",2023-08-29,,,,,,,,,,,,,,,,,,,,,,,,,,,,,
461,https://www.4zida.rs/prodaja-stanova/konjarnik-vozdovacki-deo-vozdovac-opstina-beograd/dvosoban-stan/64ee348e3d7da1e92d0bd723,"Dvosoban stan na prodaju, Glasinačka, 90.000€, 58m² - 4zida",2023-08-29,58 m² ,2 sobe ,centralno grejanje ,uobičajeno stanje ,10/11 spratova ,kupatilo ,prazno ,telefon ,3169 ,pre 2 sata ,90.000,Glasinačka,"Konjarnik (Voždovački deo), Voždovac opština, Beograd",uknjiženo ,,ima lift (1) ,1 parking mesto ,"podrum, terasa ",,,,,,,,,,,
462,https://www.4zida.rs/prodaja-stanova/pejton-gradske-lokacije-krusevac/jednoiposoban-stan/64edd96a06b591c1ce004ce4,"Jednoiposoban stan na prodaju, Pejton, 45.000€, 51m² - 4zida",2023-08-29,51 m² ,1.5 soba ,,novo ,4/4 sprata ,"kupatilo, toalet, kuhinja ",namešteno ,"kablovska, klima, veš mašina, kuhinjski elementi, frižider, rerna, ležaj, ugradni plakar ",,pre 9 sati ,45.000,Pejton,"Pejton, Gradske lokacije, Kruševac",uknjiženo ,2010,,,"tavan, terasa ",Stan u zgradi ,,useljivo ,,Gradski prevoz ,Optički ,,dvorište ,,,
463,https://www.4zida.rs/prodaja-stanova/zeleno-brdo-zvezdara-opstina-beograd/dvosoban-stan/64e707107137399d7007b6f7,"Dvosoban stan na prodaju, Lošinjska donja, 117.000€, 43m² - 4zida",2023-08-29,43 m² ,2 sobe ,,,2/4 sprata ,kupatilo ,,klima ,91369653 ,pre 5 dana ,117.000,Lošinjska donja,"Zeleno Brdo, Zvezdara opština, Beograd",,2018,,,terasa ,,2 garažna mesta ,,,,,,,,,
464,https://www.4zida.rs/prodaja-stanova/vojvode-vlahovica-vozdovac-opstina-beograd/jednosoban-stan/64edd8b50225e929650f94ac,"Jednosoban stan na prodaju, Predraga Simića, 70.000€, 34m² - 4zida",2023-08-29,34 m² ,1 soba ,,novo ,nisko prizemlje/4 sprata ,kupatilo ,prazno ,"telefon, interfon ",2177 ,pre 9 sati ,70.000,Predraga Simića,"Vojvode Vlahovića, Voždovac opština, Beograd",uknjiženo ,,,1 parking mesto ,podrum ,,,useljivo ,,,,,,,,
465,https://www.4zida.rs/prodaja-stanova/kertvaros-gradske-lokacije-subotica/trosoban-stan/64edc219dd508318cf0e7f78,"Prodaja stanova Kertvaroš, Gradske lokacije, Subotica - 4zida",2023-08-29,,,,,,,,,,,,,,,,,,,,,,,,,,,,,
466,https://www.4zida.rs/prodaja-stanova/dedinje-savski-venac-beograd/dvoiposoban-stan/64d10778ef65239796023241,"Prodaja stanova Dedinje, Savski Venac, Beograd - 4zida",2023-08-29,,,,,,,,,,,,,,,,,,,,,,,,,,,,,
467,https://www.4zida.rs/prodaja-stanova/bagljas-gradske-lokacije-zrenjanin/jednosoban-stan/64e7f34e6e529c0e41045e65,"Jednosoban stan na prodaju, Zrenjanin, Bagljaš, 40.500€, 39m² - 4zida",2023-08-29,39 m² ,1 soba ,centralno grejanje ,,1. sprat ,kupatilo ,,,1803 ,pre 4 dana ,40.500,"Zrenjanin, Bagljaš","Bagljaš, Gradske lokacije, Zrenjanin",uknjiženo ,,,,,,,,,,,,,,,
468,https://www.4zida.rs/prodaja-stanova/blok-63-bezanijski-blokovi-novi-beograd-beograd/dvosoban-stan/64ecc742ce5b458dd8034d80,"Dvosoban stan na prodaju, Gandijeva, 139.000€, 51m² - 4zida",2023-08-29,51 m² ,2 sobe ,centralno grejanje ,uobičajeno stanje ,3/3 sprata ,kupatilo ,prazno ,"telefon, interfon, klima ",5964 ,pre 1 dan ,139.000,Gandijeva,"Blok 63, Bežanijski Blokovi, Novi Beograd, Beograd",uknjiženo ,1986,,,podrum ,,,,,,,,,,,
469,https://www.4zida.rs/prodaja-stanova/veternik-gradske-lokacije-novi-sad/trosoban-stan/64a3ee33cb28659fb404207f,"Prodaja stanova Veternik, Gradske lokacije, Novi Sad - 4zida",2023-08-29,,,,,,,,,,,,,,,,,,,,,,,,,,,,,
470,https://www.4zida.rs/prodaja-stanova/cubura-vracar-beograd/sestosoban-stan/64e5dffd146172044c065f92,"Šestosoban stan na prodaju, Čubura, 619.500€, 177m² - 4zida",2023-08-29,177 m² ,6 soba ,,novo ,8/8 spratova ,"kuhinja, ostava ",namešteno ,"kablovska, internet, interfon, TV, klima, veš mašina, sudo mašina, frižider, šporet, ležaj, Kanalizacija ",261 ,pre 6 dana ,619.500,Čubura,"Čubura, Vračar, Beograd",,2018,ima lift (1) ,1 parking mesto ,terasa ,Penthaus ,1 garažno mesto ,,,,,,,,,
471,https://www.4zida.rs/prodaja-stanova/aerodrom-gradske-lokacije-kragujevac/cetvorosoban-stan/64ec65b5f1a75dd5980e077f,"Četvorosoban stan na prodaju, Bosanska, 130.700€, 86m² - 4zida",2023-08-29,86 m² ,4 sobe ,etažno grejanje ,u izgradnji ,4/4 sprata ,kupatilo ,polunamešteno ,interfon ,p,pre 1 dan ,130.700,Bosanska,"Aerodrom, Gradske lokacije, Kragujevac",,,ima lift (1) ,,"prilaz za invalide, terase (2) ",,1 garažno mesto ,,,,,,,,,
472,https://www.4zida.rs/prodaja-stanova/kalenic-vracar-beograd/petosoban-stan/64e45c008823bb53df0f2636,"Petosoban stan na prodaju, Maksima Gorkog 3, 495.000€, 174m² - 4zida",2023-08-29,174 m² ,5 soba ,,luksuzno ,2/5 spratova ,"kupatila (2), toaleti (2), kuhinja, ostava ",polunamešteno ,"telefon, kablovska, klima, centralna klima, ventilacija, veš mašina, kuhinjski elementi, sudo mašina, frižider, zamrzivač, šporet, plakar ",,pre 1 dan ,495.000,Maksima Gorkog 3,"Kalenić, Vračar, Beograd",uknjiženo ,2010,ima lift (1) ,,"dvorište, terasa ",Stan u zgradi ,,useljivo ,"istok, zapad ",,,,"ulicu, dvorište ",,,
473,https://www.4zida.rs/prodaja-stanova/gradske-lokacije-indjija/garsonjera/64e5c27d6e704b6b2a0ed4af,"Garsonjera na prodaju, Blok 63, 28.000€, 24m² - 4zida",2023-08-29,24 m² ,0.5 soba ,grejanje na gas ,uobičajeno stanje ,1/4 sprata ,"kupatilo, kuhinja ",,"telefon, kablovska ",,pre 6 dana ,28.000,Blok 63,"Gradske lokacije, Inđija",uknjiženo ,1970,,,podrum ,Stan u zgradi ,,useljivo ,,,Kablovska ,,,,,
474,https://www.4zida.rs/prodaja-stanova/blok-64-bezanijski-blokovi-novi-beograd-beograd/dvoiposoban-stan/64db6965248c921ae500c5b5,"Prodaja stanova Blok 64, Bežanijski Blokovi, Novi Beograd, Beograd - 4zida",2023-08-29,,,,,,,,,,,,,,,,,,,,,,,,,,,,,
475,https://www.4zida.rs/prodaja-stanova/adice-gradske-lokacije-novi-sad/jednoiposoban-stan/64ec86f7b4d2d9a0e90f5184,"Jednoiposoban stan na prodaju, Adice, 63.660€, 30m² - 4zida",2023-08-29,30 m² ,1.5 soba ,grejanje na gas ,novo ,2/2 sprata ,,prazno ,,515312 ,pre 1 dan ,63.660,Adice,"Adice, Gradske lokacije, Novi Sad",uknjiženo ,,,,,Stan u zgradi ,,,,,,,,,,
476,https://www.4zida.rs/prodaja-stanova/bagljas-gradske-lokacije-zrenjanin/jednoiposoban-stan/64e6a1af91cc7d72c405a9f9,"Jednoiposoban stan na prodaju, Zrenjanin, Bagljaš, 39.000€, 43m² - 4zida",2023-08-29,43 m² ,1.5 soba ,centralno grejanje ,,5. sprat ,kupatilo ,,klima ,1800 ,pre 5 dana ,39.000,"Zrenjanin, Bagljaš","Bagljaš, Gradske lokacije, Zrenjanin",uknjiženo ,,,,,,,,,,,,,,,
477,https://www.4zida.rs/prodaja-stanova/stepa-stepanovic-vozdovac-opstina-beograd/dvoiposoban-stan/64e49d06b5e199b52e09766e,"Dvoiposoban stan na prodaju, Generala Ljubomira Milića, 195.000€, 66m² - 4zida",2023-08-29,66 m² ,2.5 soba ,centralno grejanje ,,3/7 spratova ,kupatilo ,prazno ,"telefon, interfon, klima ",1559 ,pre 7 dana ,195.000,Generala Ljubomira Milića,"Stepa Stepanović, Voždovac opština, Beograd",uknjiženo ,,ima lift (1) ,,"podrum, terasa ",,,,,,,,,,,
478,https://www.4zida.rs/prodaja-stanova/zemun-centar-zemun-zemun-opstina-beograd/dvoiposoban-stan/64eca9f9e2e89301bb04a39e,"Dvoiposoban stan na prodaju, Banatska, 192.540€, 81m² - 4zida",2023-08-29,81 m² ,2.5 soba ,centralno grejanje ,novo ,visoko prizemlje/6 spratova ,kupatilo ,prazno ,telefon ,2875 ,pre 1 dan ,192.540,Banatska,"Zemun - Centar, Zemun, Zemun opština, Beograd",,,,,,,,,,,,,,,,
479,https://www.4zida.rs/prodaja-stanova/grbavica-gradske-lokacije-novi-sad/garsonjera/64e48e665c7a7325670f75f7,"Garsonjera na prodaju, Grbavica, 77.250€, 27m² - 4zida",2023-08-29,27 m² ,0.5 soba ,centralno grejanje ,,,,prazno ,,183 ,pre 6 dana ,77.250,Grbavica,"Grbavica, Gradske lokacije, Novi Sad",,,ima lift (1) ,,,Stan u zgradi ,,,,,,,,,,
480,https://www.4zida.rs/prodaja-stanova/centar-gradske-lokacije-zlatibor/garsonjera/63da2a4f95ab117e2d0bc816,"Garsonjera na prodaju, Zelenkada 5, 40.000€, 20m² - 4zida",2023-08-29,20 m² ,0.5 soba ,,održavano ,2/4 sprata ,kupatilo ,,,,pre 11 sati ,40.000,Zelenkada 5,"Centar, Gradske lokacije, Zlatibor",uknjiženo ,,,,,Stan u zgradi ,,,,,,15.06.2023 ,,,,
481,https://www.4zida.rs/prodaja-stanova/4-juli-gradske-lokacije-zrenjanin/jednosoban-stan/64e38ae2ef689f47650590b1,"Jednosoban stan na prodaju, 4. Juli, 47.500€, 44m² - 4zida",2023-08-29,44 m² ,1 soba ,centralno grejanje ,uobičajeno stanje ,2/5 spratova ,"kupatilo, kuhinja, ostava ",namešteno ,"kablovska, kuhinjski elementi, ležaj ",PU1034 ,pre 8 sati ,47.500,4. Juli,"4. Juli, Gradske lokacije, Zrenjanin",uknjiženo ,,,,"terasa, lođa ",Stan u zgradi ,,,jugoistok ,,Optički ,,,,,
482,https://www.4zida.rs/prodaja-stanova/mladenovac-centar-mladenovac-opstina-beograd/cetvorosoban-stan/647de2eb42ea270ee00218d5,"Prodaja stanova Mladenovac centar, Mladenovac opština, Beograd - 4zida",2023-08-29,,,,,,,,,,,,,,,,,,,,,,,,,,,,,
483,https://www.4zida.rs/prodaja-stanova/sava-kovacevic-zemun-zemun-opstina-beograd/dvoiposoban-stan/64e4d262cab1272a2a0d7ffd,"Dvoiposoban stan na prodaju, Crnogorska 18, 137.500€, 54m² - 4zida",2023-08-29,54 m² ,2.5 soba ,,u izgradnji ,visoko prizemlje/3 sprata ,"kupatilo, toalet, kuhinja ",prazno ,"telefon, kablovska, ventilacija ",,pre 16 sati ,137.500,Crnogorska 18,"Sava Kovačević, Zemun, Zemun opština, Beograd",u procesu uknjižavanja ,2020,ima lift (1) ,1 parking mesto ,"dvorište, alarm, terasa ",Stan u zgradi ,1 garažno mesto ,,jugoistok ,"15, 15N, 18, 78 ",Kablovska ,01.05.2024 ,ulicu ,Nema ,Nema ,
