,link,Površina,Broj soba,Uknjiženost,Grejanje,Stanje,Spratnost,Infrastruktura,Nameštenost,Opremljenost,Useljivo,Šifra oglasa,Oglas ažuriran,price,street,address,title,end_date,Tip,Godina izgradnje,Lift,Garaža,Parking,Unutrašnje prostorije,Orijentacija nekretnine,Useljivo od,Pogled na,Autobuske linije,Internet,Tramvajske linije,Trolejbuske linije
335,https://www.4zida.rs/prodaja-stanova/durlan-pantelej-gradske-lokacije-nis/troiposoban-stan/650da5304a425217a60e45fd,134 m² ,3.5 soba ,uknjiženo ,grejanje na struju ,novo ,2/2 sprata ,terasa ,polunamešteno ,Kanalizacija ,useljivo ,334 ,pre 2 dana ,164.000,Durlan,"Durlan, Pantelej, Gradske lokacije, Niš","Troiposoban stan na prodaju, Durlan, 164.000€, 134m² - 4zida",2023-09-24,Stan u zgradi ,,,,1 parking mesto ,,,,,,,,
336,https://www.4zida.rs/prodaja-stanova/aqua-park-gradske-lokacije-jagodina/dvoiposoban-stan/650ff0ea37f69d67440430c5,48 m² ,2.5 soba ,uknjiženo ,norveški radijatori ,novo ,3/6 spratova ,"prilaz za invalide, alarm, terasa, recepcija ",,"telefon, klima ",useljivo ,,pre 6 sati ,72.000,Aqua Park,"Aqua Park, Gradske lokacije, Jagodina","Dvoiposoban stan na prodaju, Aqua Park, 72.000€, 48m² - 4zida",2023-09-24,Stan u zgradi ,,ima lift (2) ,,,"kupatilo, toalet ",,,dvorište ,,,,
337,https://www.4zida.rs/prodaja-stanova/fon-vozdovac-vozdovac-vozdovac-opstina-beograd/dvoiposoban-stan/650eff33bedc5d67330f1686,57 m² ,2.5 soba ,uknjiženo ,centralno grejanje ,renovirano ,7/12 spratova ,"podrum, terasa ",prazno ,"kablovska, internet, interfon, klima ",,5015 ,pre 1 dan ,155.000,Kostolačka,"FON - Voždovac, Voždovac, Voždovac opština, Beograd","Dvoiposoban stan na prodaju, Kostolačka, 155.000€, 57m² - 4zida",2023-09-24,Stan u zgradi ,1985,ima lift (1) ,,,ostava ,,,,,,,
338,https://www.4zida.rs/prodaja-stanova/petrovaradin-gradske-lokacije-novi-sad/dvoiposoban-stan/650982a2ec2cfae79e008120,,,,,,,,,,,,,,,,"Prodaja stanova Petrovaradin, Gradske lokacije, Novi Sad - 4zida",2023-09-24,,,,,,,,,,,,,
339,https://www.4zida.rs/prodaja-stanova/blok-64-bezanijski-blokovi-novi-beograd-beograd/jednoiposoban-stan/64db5b384afa93e86a052f86,,,,,,,,,,,,,,,,"Prodaja stanova Blok 64, Bežanijski Blokovi, Novi Beograd, Beograd - 4zida",2023-09-24,,,,,,,,,,,,,
340,https://www.4zida.rs/prodaja-stanova/cair-medijana-gradske-lokacije-nis/trosoban-stan/650c3f00db2648729900f83b,,,,,,,,,,,,,,,,"Prodaja stanova Čair, Medijana, Gradske lokacije, Niš - 4zida",2023-09-24,,,,,,,,,,,,,
341,https://www.4zida.rs/prodaja-stanova/zeleznicka-stanica-banatic-gradske-lokacije-novi-sad/dvosoban-stan/650d83d69a048a1de80fe6bf,42 m² ,2 sobe ,uknjiženo ,centralno grejanje ,uobičajeno stanje ,4/7 spratova ,terasa ,,,,1055114 ,pre 2 dana ,90.700,Železnička stanica,"Železnička stanica, Banatić, Gradske lokacije, Novi Sad","Dvosoban stan na prodaju, Železnička stanica, 90.700€, 42m² - 4zida",2023-09-24,Stan u zgradi ,1968,ima lift (1) ,,,,,,,,,,
342,https://www.4zida.rs/prodaja-stanova/klisa-gradske-lokacije-novi-sad/cetvorosoban-stan/650da16c4a425217a60e44fb,79 m² ,4 sobe ,,etažno grejanje ,,,,,,,72666 ,pre 2 dana ,131.850,KLISANSKI PUT,"Klisa, Gradske lokacije, Novi Sad","Četvorosoban stan na prodaju, KLISANSKI PUT, 131.850€, 79m² - 4zida",2023-09-24,Stan u zgradi ,,,,,,,,,,,,
343,https://www.4zida.rs/prodaja-stanova/misa-gradske-lokacije-pancevo/jednosoban-stan/64cca286f21c322d6e02bf73,,,,,,,,,,,,,,,,"Prodaja stanova Misa, Gradske lokacije, Pančevo - 4zida",2023-09-24,,,,,,,,,,,,,
344,https://www.4zida.rs/prodaja-stanova/avijaticarsko-naselje-gradske-lokacije-novi-sad/dvosoban-stan/647de03a42ea270ee00208c9,,,,,,,,,,,,,,,,"Prodaja stanova Avijatičarsko Naselje, Gradske lokacije, Novi Sad - 4zida",2023-09-24,,,,,,,,,,,,,
345,https://www.4zida.rs/prodaja-stanova/cara-dusana-adamovicevo-naselje-gradske-lokacije-novi-sad/trosoban-stan/650dd7a037e5f83e140c7ffc,110 m² ,3 sobe ,uknjiženo ,centralno grejanje ,novo ,1/1 sprat ,terase (2) ,,,,517348 ,pre 1 dan ,257.500,Cara Dušana,"Cara Dušana, Adamovićevo Naselje, Gradske lokacije, Novi Sad","Trosoban stan na prodaju, Cara Dušana, 257.500€, 110m² - 4zida",2023-09-24,Stan u zgradi ,,,,,,,,,,,,
346,https://www.4zida.rs/prodaja-stanova/studentski-grad-blok-34-novi-beograd-beograd/dvosoban-stan/650f3d779ecd1eadce039a13,51 m² ,2 sobe ,uknjiženo ,centralno grejanje ,uobičajeno stanje ,17/20 spratova ,terasa ,prazno ,"kablovska, internet, interfon, klima ",useljivo ,322 ,pre 19 sati ,129.000,Studentski Grad,"Studentski Grad, Blok 34, Novi Beograd, Beograd","Dvosoban stan na prodaju, Studentski Grad, 129.000€, 51m² - 4zida",2023-09-24,Stan u zgradi ,,ima lift (1) ,,1 parking mesto ,,,,,,,,
347,https://www.4zida.rs/prodaja-stanova/gradske-lokacije-ruma/troiposoban-stan/650db3d7225d1682f702f0ab,67 m² ,3.5 soba ,uknjiženo ,grejanje na gas ,,prizemlje/1 sprat ,"dvorište, podrum, terasa ",prazno ,"telefon, kablovska ",useljivo ,,pre 1 dan ,66.000,Partizanska 43,"Gradske lokacije, Ruma","Troiposoban stan na prodaju, Partizanska 43, 66.000€, 67m² - 4zida",2023-09-24,Stan u zgradi ,,,1 garažno mesto ,u dvorištu zgrade ,"kupatilo, toalet, kuhinja, ostava ","istok, zapad ",,"ulicu, dvorište ",,,,
348,https://www.4zida.rs/prodaja-stanova/banjica-vozdovac-opstina-beograd/trosoban-stan/64ef2624cd5b27672d09be87,77 m² ,3 sobe ,uknjiženo ,centralno grejanje ,renovirano ,7/10 spratova ,terasa ,,interfon ,useljivo ,8934 ,pre 3 dana ,170.000,Bulevar oslobođenja,"Banjica, Voždovac opština, Beograd","Trosoban stan na prodaju, Bulevar oslobođenja, 170.000€, 77m² - 4zida",2023-09-24,,,ima lift (2) ,,,,,,,,,,
349,https://www.4zida.rs/prodaja-stanova/apelovac-palilula-gradske-lokacije-nis/dvoiposoban-stan/647de2c542ea270ee00216ac,,,,,,,,,,,,,,,,"Prodaja stanova Apelovac, Palilula, Gradske lokacije, Niš - 4zida",2023-09-24,,,,,,,,,,,,,
350,https://www.4zida.rs/prodaja-stanova/blok-64-bezanijski-blokovi-novi-beograd-beograd/jednoiposoban-stan/64db5b3b4afa93e86a052f9c,,,,,,,,,,,,,,,,"Prodaja stanova Blok 64, Bežanijski Blokovi, Novi Beograd, Beograd - 4zida",2023-09-24,,,,,,,,,,,,,
351,https://www.4zida.rs/prodaja-stanova/kotez-2-gradske-lokacije-pancevo/dvosoban-stan/650fe57c03d1535d830177db,64 m² ,2 sobe ,,,,,lođa ,namešteno ,,,92068517 ,pre 7 sati ,69.500,Stevana Šupljikca,"Kotež 2, Gradske lokacije, Pančevo","Dvosoban stan na prodaju, Stevana Šupljikca, 69.500€, 64m² - 4zida",2023-09-24,,,,1 garažno mesto ,,"kupatilo, toalet ",,,,,,,
352,https://www.4zida.rs/prodaja-stanova/novo-naselje-gradske-lokacije-novi-sad/trosoban-stan/650da1684a425217a60e44f5,79 m² ,3 sobe ,,centralno grejanje ,,,,,,,72512 ,pre 2 dana ,164.800,BUL.SLOBODANA JOVANOVICA,"Novo Naselje, Gradske lokacije, Novi Sad","Trosoban stan na prodaju, BUL.SLOBODANA JOVANOVICA, 164.800€, 79m² - 4zida",2023-09-24,Stan u zgradi ,,,,,,,,,,,,
353,https://www.4zida.rs/prodaja-stanova/veliki-park-vasariste-gradske-lokacije-kragujevac/trosoban-stan/650b4507592f8921510a59d4,105 m² ,3 sobe ,uknjiženo ,grejanje na struju ,novo ,1/6 spratova ,"terasa, lođa ",prazno ,interfon ,,2918 ,pre 3 dana ,126.000,Veliki Park,"Veliki Park, Vašarište, Gradske lokacije, Kragujevac","Trosoban stan na prodaju, Veliki Park, 126.000€, 105m² - 4zida",2023-09-24,,2018,ima lift (1) ,,,"kupatilo, toalet ",,,,,,,
354,https://www.4zida.rs/prodaja-stanova/novi-banovci-okolne-lokacije-stara-pazova/cetvorosoban-stan/64ff6b1e45091e1de2037229,95 m² ,4 sobe ,u procesu uknjižavanja ,etažno grejanje ,novo ,2/3 sprata ,terasa ,prazno ,"kablovska, internet, interfon, klima ",,349 ,pre 12 dana ,128.150,Novi Banovci,"Novi Banovci, Okolne lokacije, Stara Pazova","Četvorosoban stan na prodaju, Novi Banovci, 128.150€, 95m² - 4zida",2023-09-24,Stan u zgradi ,2023,ima lift (1) ,1 garažno mesto ,1 parking mesto ,kuhinja ,,,,,,,
355,https://www.4zida.rs/prodaja-stanova/blok-64-bezanijski-blokovi-novi-beograd-beograd/troiposoban-stan/64db5b2d4afa93e86a052f26,,,,,,,,,,,,,,,,"Prodaja stanova Blok 64, Bežanijski Blokovi, Novi Beograd, Beograd - 4zida",2023-09-24,,,,,,,,,,,,,
356,https://www.4zida.rs/prodaja-stanova/crveni-krst-vracar-vracar-beograd/trosoban-stan/650c61499c05a241e10e89b1,83 m² ,3 sobe ,uknjiženo ,etažno grejanje ,novo ,5/5 spratova ,terasa ,namešteno ,"kablovska, internet ",useljivo ,67378 ,pre 2 dana ,381.800,Šumatovačka,"Crveni Krst Vračar, Vračar, Beograd","Trosoban stan na prodaju, Šumatovačka, 381.800€, 83m² - 4zida",2023-09-24,,,,1 garažno mesto ,,,,,,,,,
357,https://www.4zida.rs/prodaja-stanova/liman-gradske-lokacije-novi-sad/dvosoban-stan/647de23742ea270ee0021203,,,,,,,,,,,,,,,,"Prodaja stanova Liman, Gradske lokacije, Novi Sad - 4zida",2023-09-24,,,,,,,,,,,,,
358,https://www.4zida.rs/prodaja-stanova/nova-detelinara-detelinara-gradske-lokacije-novi-sad/petosoban-stan/650d9ff14a425217a60e44a1,98 m² ,5 soba ,uknjiženo ,centralno grejanje ,uobičajeno stanje ,3/3 sprata ,terasa ,,,,1047255 ,pre 2 dana ,149.900,Nova Detelinara,"Nova Detelinara, Detelinara, Gradske lokacije, Novi Sad","Petosoban stan na prodaju, Nova Detelinara, 149.900€, 98m² - 4zida",2023-09-24,Stan u zgradi ,2011,,,,,,,,,,,
359,https://www.4zida.rs/prodaja-stanova/pantelej-gradske-lokacije-nis/trosoban-stan/64f603d2953c97b7a203a0dc,74 m² ,3 sobe ,,etažno grejanje ,u izgradnji ,2/3 sprata ,terasa ,prazno ,interfon ,useljivo ,100 ,pre 19 dana ,78.500,Pantelej,"Pantelej, Gradske lokacije, Niš","Trosoban stan na prodaju, Pantelej, 78.500€, 74m² - 4zida",2023-09-24,Stan u zgradi ,2022,,,1 parking mesto ,,,,,,,,
360,https://www.4zida.rs/prodaja-stanova/bulevar-patrijarha-pavla-somborski-bulevar-telep-gradske-lokacije-novi-sad/dvoiposoban-stan/65097494ed313cf71006f4e2,,,,,,,,,,,,,,,,"Prodaja stanova Bulevar Patrijarha Pavla (Somborski Bulevar), Telep, Gradske lokacije, Novi Sad - 4zida",2023-09-24,,,,,,,,,,,,,
361,https://www.4zida.rs/prodaja-stanova/gradske-lokacije-vrnjacka-banja/jednosoban-stan/64fc75843a626c89880fe81b,41 m² ,1 soba ,uknjiženo ,,novo ,,,prazno ,,,,pre 1 dan ,81.000,Nemanjina 15v,"Gradske lokacije, Vrnjačka Banja","Jednosoban stan na prodaju, Nemanjina 15v, 81.000€, 41m² - 4zida",2023-09-24,Stan u zgradi ,,,,,,,,,,,,
362,https://www.4zida.rs/prodaja-stanova/dorcol-stari-grad-opstina-beograd/jednosoban-stan/65046b2a663880db28031447,32 m² ,1 soba ,uknjiženo ,centralno grejanje ,novo ,4/5 spratova ,,namešteno ,,useljivo ,42561 ,pre 8 dana ,158.000,Dorćol,"Dorćol, Stari Grad opština, Beograd","Jednosoban stan na prodaju, Dorćol, 158.000€, 32m² - 4zida",2023-09-24,,,ima lift (1) ,,,,,,,,,,
363,https://www.4zida.rs/prodaja-stanova/duvaniste-medijana-gradske-lokacije-nis/cetvorosoban-stan/650d6a731c92ad724d02c430,80 m² ,4 sobe ,uknjiženo ,etažno grejanje ,novo ,3. sprat ,terasa ,prazno ,,,3861 ,pre 2 dana ,132.050,Duvanište,"Duvanište, Medijana, Gradske lokacije, Niš","Četvorosoban stan na prodaju, Duvanište, 132.050€, 80m² - 4zida",2023-09-24,,,ima lift (1) ,,,,,,,,,,
364,https://www.4zida.rs/prodaja-stanova/novo-naselje-gradske-lokacije-novi-sad/trosoban-stan/650ec88273a357863407a85f,55 m² ,3 sobe ,,etažno grejanje ,,,,,,,71646 ,pre 1 dan ,159.650,BUL.VOJVODE STEPE,"Novo Naselje, Gradske lokacije, Novi Sad","Trosoban stan na prodaju, BUL.VOJVODE STEPE, 159.650€, 55m² - 4zida",2023-09-24,Stan u zgradi ,,,,,,,,,,,,
365,https://www.4zida.rs/prodaja-stanova/delta-bulevar-nemanjica-medijana-gradske-lokacije-nis/jednoiposoban-stan/64eef6ebe704fe8b160b14e5,28 m² ,1.5 soba ,uknjiženo ,centralno grejanje ,,3/4 sprata ,terasa ,prazno ,"kablovska, klima, kuhinjski elementi, sudo mašina, frižider, rerna, ležaj, plakar ",useljivo ,,pre 25 dana ,48.000,7.juli,"Delta, Bulevar Nemanjića, Medijana, Gradske lokacije, Niš","Jednoiposoban stan na prodaju, 7.juli, 48.000€, 28m² - 4zida",2023-09-24,Stan u zgradi ,2010,,,,"kupatilo, toalet, kuhinja, ostava ",,,dvorište ,Da ,Optički ,,
366,https://www.4zida.rs/prodaja-stanova/juzni-bulevar-vracar-beograd/dvosoban-stan/64f9da5511fb6c94030f62c0,,,,,,,,,,,,,,,,"Prodaja stanova Južni Bulevar, Vračar, Beograd - 4zida",2023-09-24,,,,,,,,,,,,,
367,https://www.4zida.rs/prodaja-stanova/grbavica-gradske-lokacije-novi-sad/cetvorosoban-stan/65097489ed313cf71006f439,,,,,,,,,,,,,,,,"Prodaja stanova Grbavica, Gradske lokacije, Novi Sad - 4zida",2023-09-24,,,,,,,,,,,,,
368,https://www.4zida.rs/prodaja-stanova/aerodrom-gradske-lokacije-kragujevac/trosoban-stan/650308ee3b9f9a600f02bdee,74 m² ,3 sobe ,nije uknjiženo ,,uobičajeno stanje ,2/5 spratova ,terasa ,,"interfon, klima ",,1416,pre 10 dana ,74.000,Aerodrom,"Aerodrom, Gradske lokacije, Kragujevac","Trosoban stan na prodaju, Aerodrom, 74.000€, 74m² - 4zida",2023-09-24,,,,,1 parking mesto ,"kupatilo, toalet ",,,,,,,
369,https://www.4zida.rs/prodaja-stanova/crveni-krst-vracar-vracar-beograd/trosoban-stan/6502c3ca83d04992050ca72a,75 m² ,3 sobe ,,centralno grejanje ,novo ,5/7 spratova ,terasa ,prazno ,klima ,useljivo ,67285 ,pre 10 dana ,247.170,Velimira Todorovića,"Crveni Krst Vračar, Vračar, Beograd","Trosoban stan na prodaju, Velimira Todorovića, 247.170€, 75m² - 4zida",2023-09-24,,,,1 garažno mesto ,,kupatilo ,,,,,,,
370,https://www.4zida.rs/prodaja-stanova/centar-gradske-lokacije-sabac/jednoiposoban-stan/64ef2cb76b24fb22460e874d,52 m² ,1.5 soba ,u procesu uknjižavanja ,centralno grejanje ,novo ,potkrovlje/2 sprata ,,prazno ,,,,pre 25 dana ,72.800,Centar,"Centar, Gradske lokacije, Šabac","Jednoiposoban stan na prodaju, Centar, 72.800€, 52m² - 4zida",2023-09-24,Stan u zgradi ,,,,,,,,,,,,
371,https://www.4zida.rs/prodaja-stanova/somborska-pantelej-gradske-lokacije-nis/dvosoban-stan/647de2b442ea270ee00215c2,,,,,,,,,,,,,,,,"Prodaja stanova Somborska, Pantelej, Gradske lokacije, Niš - 4zida",2023-09-24,,,,,,,,,,,,,
372,https://www.4zida.rs/prodaja-stanova/nova-detelinara-detelinara-gradske-lokacije-novi-sad/dvoiposoban-stan/650cbf296f39e73f6e0ee0bb,60 m² ,2.5 soba ,,etažno grejanje ,u izgradnji ,3/3 sprata ,terasa ,,,,1040110 ,pre 2 dana ,172.500,Nova Detelinara,"Nova Detelinara, Detelinara, Gradske lokacije, Novi Sad","Dvoiposoban stan na prodaju, Nova Detelinara, 172.500€, 60m² - 4zida",2023-09-24,Stan u zgradi ,2023,ima lift (1) ,,,,,,,,,,
373,https://www.4zida.rs/prodaja-stanova/altina-zemun-zemun-opstina-beograd/dvosoban-stan/65009fa80c53fe612d0c9abf,43 m² ,2 sobe ,,etažno grejanje ,novo ,1/4 sprata ,terasa ,prazno ,telefon ,useljivo ,4488 ,pre 11 dana ,77.300,Ugrinovački put 41. deo,"Altina, Zemun, Zemun opština, Beograd","Dvosoban stan na prodaju, Ugrinovački put 41. deo, 77.300€, 43m² - 4zida",2023-09-24,,2023,,,1 parking mesto ,kupatilo ,,,,,,,
374,https://www.4zida.rs/prodaja-stanova/dedinje-savski-venac-beograd/dvosoban-stan/650da17c4a425217a60e4509,51 m² ,2 sobe ,uknjiženo ,centralno grejanje ,,2/2 sprata ,terasa ,,"telefon, kablovska, internet, interfon, klima ",useljivo ,3983 ,pre 2 dana ,198.000,Miće Orlovića,"Dedinje, Savski Venac, Beograd","Dvosoban stan na prodaju, Miće Orlovića, 198.000€, 51m² - 4zida",2023-09-24,,,,,1 parking mesto ,kupatila (2) ,,,,,,,
375,https://www.4zida.rs/prodaja-stanova/petrovaradin-gradske-lokacije-novi-sad/dvoiposoban-stan/64e7656d9540b466a008eacd,57 m² ,2.5 soba ,,grejanje na gas ,,1/5 spratova ,terasa ,,,,1047274 ,pre 31 dana ,161.710,Petrovaradin,"Petrovaradin, Gradske lokacije, Novi Sad","Dvoiposoban stan na prodaju, Petrovaradin, 161.710€, 57m² - 4zida",2023-09-24,,2018,ima lift (1) ,,,,,,,,,,
376,https://www.4zida.rs/prodaja-stanova/blok-64-bezanijski-blokovi-novi-beograd-beograd/jednoiposoban-stan/64db5b344afa93e86a052f6b,,,,,,,,,,,,,,,,"Prodaja stanova Blok 64, Bežanijski Blokovi, Novi Beograd, Beograd - 4zida",2023-09-24,,,,,,,,,,,,,
377,https://www.4zida.rs/prodaja-stanova/dubocica-gradske-lokacije-leskovac/dvosoban-stan/6502b3b29af9234f8000460f,59 m² ,2 sobe ,uknjiženo ,centralno grejanje ,uobičajeno stanje ,,lođa ,namešteno ,,,,pre 10 dana ,60.000,Dubočica,"Dubočica, Gradske lokacije, Leskovac","Dvosoban stan na prodaju, Dubočica, 60.000€, 59m² - 4zida",2023-09-24,Stan u zgradi ,,ima lift (1) ,,,"kupatilo, toalet ",,,,,,,
378,https://www.4zida.rs/prodaja-stanova/grbavica-gradske-lokacije-novi-sad/jednoiposoban-stan/6500e19faf9f2e8e86005119,34 m² ,1.5 soba ,uknjiženo ,centralno grejanje ,uobičajeno stanje ,2/5 spratova ,terasa ,,,,1040064 ,pre 11 dana ,97.850,Grbavica,"Grbavica, Gradske lokacije, Novi Sad","Jednoiposoban stan na prodaju, Grbavica, 97.850€, 34m² - 4zida",2023-09-24,Stan u zgradi ,2003,ima lift (1) ,,,,,,,,,,
379,https://www.4zida.rs/prodaja-stanova/kanarevo-brdo-rakovica-opstina-beograd/dvosoban-stan/64eef878d0012d06860a2636,50 m² ,2 sobe ,uknjiženo ,etažno grejanje ,,2/4 sprata ,terasa ,,telefon ,,7625 ,pre 25 dana ,115.000,Kanarevo brdo,"Kanarevo Brdo, Rakovica opština, Beograd","Dvosoban stan na prodaju, Kanarevo brdo, 115.000€, 50m² - 4zida",2023-09-24,Stan u zgradi ,,,,,,,,,,,,
380,https://www.4zida.rs/prodaja-stanova/veternik-gradske-lokacije-novi-sad/trosoban-stan/650c32869288ebf30e075649,62 m² ,3 sobe ,uknjiženo ,,u izgradnji ,prizemlje ,terasa ,,,,1059747 ,pre 3 dana ,102.200,Veternik,"Veternik, Gradske lokacije, Novi Sad","Trosoban stan na prodaju, Veternik, 102.200€, 62m² - 4zida",2023-09-24,Stan u zgradi ,,,,,,,,,,,,
381,https://www.4zida.rs/prodaja-stanova/cvetanova-cuprija-zvezdara-opstina-beograd/jednoiposoban-stan/650dd7d41115b336250bd79f,38 m² ,1.5 soba ,,etažno grejanje ,novo ,nisko prizemlje/4 sprata ,terasa ,,,useljivo ,3470 ,pre 1 dan ,58.000,Cvetanova ćuprija,"Cvetanova Ćuprija, Zvezdara opština, Beograd","Jednoiposoban stan na prodaju, Cvetanova ćuprija, 58.000€, 38m² - 4zida",2023-09-24,Stan u zgradi ,2023,ima lift (1) ,,,,,,,,,,
382,https://www.4zida.rs/prodaja-stanova/novi-grad-gradske-lokacije-subotica/garsonjera/6502114cbf76c4fc2509375d,27 m² ,0.5 soba ,uknjiženo ,grejanje na gas ,,2/2 sprata ,podrum ,prazno ,"TV, klima, veš mašina, kuhinjski elementi, frižider, rerna, ležaj, plakar ",useljivo ,,pre 10 dana ,36.000,Majšanski put 134,"Novi Grad, Gradske lokacije, Subotica","Garsonjera na prodaju, Majšanski put 134, 36.000€, 27m² - 4zida",2023-09-24,Stan u zgradi ,,,,u dvorištu zgrade ,"kupatilo, kuhinja ",,,,,,,
383,https://www.4zida.rs/prodaja-stanova/avijaticarsko-naselje-gradske-lokacije-novi-sad/dvosoban-stan/647de03d42ea270ee00208ed,,,,,,,,,,,,,,,,"Prodaja stanova Avijatičarsko Naselje, Gradske lokacije, Novi Sad - 4zida",2023-09-24,,,,,,,,,,,,,
384,https://www.4zida.rs/prodaja-stanova/cele-kula-bulevar-dr-zorana-djindjica-medijana-gradske-lokacije-nis/dvoiposoban-stan/64f0db50dc4e59ad1b0f55f0,67 m² ,2.5 soba ,uknjiženo ,etažno grejanje ,uobičajeno stanje ,1. sprat ,terasa ,,interfon ,,p,pre 13 dana ,95.000,Bulevar dr Zorana,"Ćele Kula, Bulevar Dr Zorana Đinđića, Medijana, Gradske lokacije, Niš","Dvoiposoban stan na prodaju, Bulevar dr Zorana, 95.000€, 67m² - 4zida",2023-09-24,,,ima lift (1) ,,1 parking mesto ,"kupatilo, toalet ",,,,,,,
385,https://www.4zida.rs/prodaja-stanova/salajka-gradske-lokacije-novi-sad/dvoiposoban-stan/650eac6efd9cad790c0cf8ef,52 m² ,2.5 soba ,,etažno grejanje ,,,,,,,68796 ,pre 1 dan ,111.250,DOSITEJEVA,"Salajka, Gradske lokacije, Novi Sad","Dvoiposoban stan na prodaju, DOSITEJEVA, 111.250€, 52m² - 4zida",2023-09-24,Stan u zgradi ,,,,,,,,,,,,
386,https://www.4zida.rs/prodaja-stanova/gradske-lokacije-vrbas/dvosoban-stan/650b5d2f8374786a510f49df,53 m² ,2 sobe ,uknjiženo ,grejanje na gas ,renovirano ,3/6 spratova ,terasa ,prazno ,"klima, kuhinjski elementi, ugradni plakar ",,,pre 3 dana ,55.000,Gradske lokacije,"Gradske lokacije, Vrbas","Dvosoban stan na prodaju, Gradske lokacije, 55.000€, 53m² - 4zida",2023-09-24,Stan u zgradi ,1970,,,javni parking u zoni ,"kupatilo, kuhinja, ostava ",,01.11.2023 ,,,Kablovska ,,
387,https://www.4zida.rs/prodaja-stanova/senjak-savski-venac-beograd/dvosoban-stan/650c4da3ab57f3523d0fac5f,50 m² ,2 sobe ,uknjiženo ,grejanje na struju ,uobičajeno stanje ,visoko prizemlje/3 sprata ,podrum ,namešteno ,"telefon, interfon, klima ",useljivo ,1419 ,pre 3 dana ,135.000,Koste Glavinića,"Senjak, Savski Venac, Beograd","Dvosoban stan na prodaju, Koste Glavinića, 135.000€, 50m² - 4zida",2023-09-24,,,,,,kupatilo ,,,,,,,
388,https://www.4zida.rs/prodaja-stanova/cair-medijana-gradske-lokacije-nis/trosoban-stan/650c3f02db2648729900f854,,,,,,,,,,,,,,,,"Prodaja stanova Čair, Medijana, Gradske lokacije, Niš - 4zida",2023-09-24,,,,,,,,,,,,,
389,https://www.4zida.rs/prodaja-stanova/bele-vode-cukarica-cukarica-opstina-beograd/jednosoban-stan/6501c5a91346b6e74503998d,32 m² ,1 soba ,u procesu uknjižavanja ,TA peć ,potrebno renoviranje ,1/2 sprata ,,,,,7984 ,pre 10 dana ,55.900,Bele vode,"Bele Vode, Čukarica, Čukarica opština, Beograd","Jednosoban stan na prodaju, Bele vode, 55.900€, 32m² - 4zida",2023-09-24,Stan u zgradi ,,,,,,,,,,,,
390,https://www.4zida.rs/prodaja-stanova/mirijevo-zvezdara-opstina-beograd/dvosoban-stan/650ef2b58c1215238d062519,63 m² ,2 sobe ,uknjiženo ,centralno grejanje ,,visoko prizemlje/4 sprata ,"podrum, terasa ",,"telefon, kablovska, internet, interfon, klima ",useljivo ,3986 ,pre 1 dan ,115.000,Franca Jankea,"Mirijevo, Zvezdara opština, Beograd","Dvosoban stan na prodaju, Franca Jankea, 115.000€, 63m² - 4zida",2023-09-24,,,,,,kupatilo ,,,,,,,
391,https://www.4zida.rs/prodaja-stanova/teslino-naselje-kertvaros-gradske-lokacije-subotica/trosoban-stan/64ef100c286e8da62807b4aa,131 m² ,3 sobe ,uknjiženo ,etažno grejanje ,,,terasa ,prazno ,,,,pre 12 dana ,62.000,Teslino Naselje,"Teslino Naselje, Kertvaroš, Gradske lokacije, Subotica","Trosoban stan na prodaju, Teslino Naselje, 62.000€, 131m² - 4zida",2023-09-24,Stan u zgradi ,,,,,"kupatila (2), toaleti (2), kuhinja ",,,,,,,
392,https://www.4zida.rs/prodaja-stanova/beograd-centar-stari-grad-opstina-beograd/trosoban-stan/6503133e968d4fd34f0e2bf2,107 m² ,3 sobe ,uknjiženo ,centralno grejanje ,uobičajeno stanje ,1/7 spratova ,terasa ,prazno ,"telefon, kablovska, internet, interfon, klima ",useljivo ,1219 ,pre 9 dana ,270.000,Gospodar Jovanova,"Beograd centar, Stari Grad opština, Beograd","Trosoban stan na prodaju, Gospodar Jovanova, 270.000€, 107m² - 4zida",2023-09-24,,,ima lift (1) ,,,kupatilo ,,,,,,,
393,https://www.4zida.rs/prodaja-stanova/mirijevo-zvezdara-opstina-beograd/dvoiposoban-stan/64f86f9ef2d67064930f7de8,52 m² ,2.5 soba ,uknjiženo ,etažno grejanje ,novo ,2/2 sprata ,terasa ,prazno ,"kablovska, internet, interfon, klima ",,16602 ,pre 18 dana ,114.000,Šejkina,"Mirijevo, Zvezdara opština, Beograd","Dvoiposoban stan na prodaju, Šejkina, 114.000€, 52m² - 4zida",2023-09-24,Stan u zgradi ,,,,,,,,,,,,
394,https://www.4zida.rs/prodaja-stanova/blok-22-novi-beograd-beograd/trosoban-stan/650c33259288ebf30e07567e,,,,,,,,,,,,,,,,"Prodaja stanova Blok 22, Novi Beograd, Beograd - 4zida",2023-09-24,,,,,,,,,,,,,
395,https://www.4zida.rs/prodaja-stanova/bagljas-gradske-lokacije-zrenjanin/dvoiposoban-stan/64ffae21d5cd0e9ab30b9081,61 m² ,2.5 soba ,uknjiženo ,centralno grejanje ,,4. sprat ,,,,useljivo ,1819 ,pre 12 dana ,56.000,"Zrenjanin, Bagljaš","Bagljaš, Gradske lokacije, Zrenjanin","Dvoiposoban stan na prodaju, Zrenjanin, Bagljaš, 56.000€, 61m² - 4zida",2023-09-24,,,,,,kupatilo ,,,,,,,
396,https://www.4zida.rs/prodaja-stanova/sarengrad-novo-naselje-gradske-lokacije-novi-sad/dvoiposoban-stan/64fdc0dd0284b721460d10fc,58 m² ,2.5 soba ,uknjiženo ,centralno grejanje ,,1/4 sprata ,"prilaz za invalide, podrum, terase (2) ",polunamešteno ,"kablovska, interfon, klima, kuhinjski elementi, sudo mašina ",,,pre 14 dana ,127.600,Stanoja Stanojevića,"Šarengrad, Novo Naselje, Gradske lokacije, Novi Sad","Dvoiposoban stan na prodaju, Stanoja Stanojevića, 127.600€, 58m² - 4zida",2023-09-24,Stan u zgradi ,2010,ima lift (1) ,,u dvorištu zgrade ,"kupatilo, kuhinja ",,,dvorište ,"7a, 7b, 2, 9, 8 ",Kablovska ,,
397,https://www.4zida.rs/prodaja-stanova/meandri-zemun-zemun-opstina-beograd/jednoiposoban-stan/64fc80d24c068d748d0e31c1,,,,,,,,,,,,,,,,"Prodaja stanova Meandri, Zemun, Zemun opština, Beograd - 4zida",2023-09-24,,,,,,,,,,,,,
398,https://www.4zida.rs/prodaja-stanova/centar-gradske-lokacije-bor/trosoban-stan/64fcaadb6d58d9ba1805e217,74 m² ,3 sobe ,uknjiženo ,centralno grejanje ,uobičajeno stanje ,4/4 sprata ,"podrum, terasa ",namešteno ,"kuhinjski elementi, frižider, ležaj, plakar ",useljivo ,,pre 6 sati ,85.000,Centar,"Centar, Gradske lokacije, Bor","Trosoban stan na prodaju, Centar, 85.000€, 74m² - 4zida",2023-09-24,Stan u zgradi ,,,,,"kupatilo, kuhinja ",,,ulicu ,,,,
399,https://www.4zida.rs/prodaja-stanova/cara-dusana-adamovicevo-naselje-gradske-lokacije-novi-sad/jednoiposoban-stan/65018bdd99ab985803034eab,37 m² ,1.5 soba ,uknjiženo ,grejanje na gas ,uobičajeno stanje ,4/7 spratova ,terasa ,,,useljivo ,516777 ,pre 11 dana ,133.500,Cara Dušana,"Cara Dušana, Adamovićevo Naselje, Gradske lokacije, Novi Sad","Jednoiposoban stan na prodaju, Cara Dušana, 133.500€, 37m² - 4zida",2023-09-24,Stan u zgradi ,,ima lift (1) ,,,,,,,,,,
400,https://www.4zida.rs/prodaja-stanova/salajka-gradske-lokacije-novi-sad/jednoiposoban-stan/650d5dc2b0a2c2d6b00f6245,39 m² ,1.5 soba ,uknjiženo ,grejanje na gas ,u izgradnji ,prizemlje/4 sprata ,,prazno ,,,,pre 2 dana ,88.780,Salajka,"Salajka, Gradske lokacije, Novi Sad","Jednoiposoban stan na prodaju, Salajka, 88.780€, 39m² - 4zida",2023-09-24,Stan u zgradi ,,,,,,,,,,,,
401,https://www.4zida.rs/prodaja-stanova/detelinara-gradske-lokacije-novi-sad/dvosoban-stan/6509a5f1f3780e55d00e773c,47 m² ,2 sobe ,uknjiženo ,centralno grejanje ,potrebno renoviranje ,visoko prizemlje/4 sprata ,,prazno ,,,42458 ,pre 3 dana ,71.000,Detelinara,"Detelinara, Gradske lokacije, Novi Sad","Dvosoban stan na prodaju, Detelinara, 71.000€, 47m² - 4zida",2023-09-24,Stan u zgradi ,,,,1 parking mesto ,,,,,,,,
