,link,Površina,Broj soba,Uknjiženost,Grejanje,Spratnost,Nameštenost,Šifra oglasa,Oglas ažuriran,price,street,address,description,title,end_date,Tip,Stanje,Lift,Garaža,Parking,Infrastruktura,Opremljenost,Useljivo,Unutrašnje prostorije,Internet,Godina izgradnje,Orijentacija nekretnine,Pogled na,Autobuske linije,Tramvajske linije,Trolejbuske linije,Useljivo od
0,https://www.4zida.rs/prodaja-stanova/beverli-hils-pantelej-gradske-lokacije-nis/jednosoban-stan/65b244c7a3a667922f0bd38d,34 m² ,1 soba ,uknjiženo ,grejanje na struju ,3. sprat ,prazno ,4346 ,pre 21 sati ,47.500,Beverli Hils,"Beverli Hils, Pantelej, Gradske lokacije, Niš","<h2 _ngcontent-ng-c3151048826 class=""mat-headline-5"">Opis oglasa</h2><div _ngcontent-ng-c3151048826 class=""prose max-h-64 overflow-hidden text-gray-800 ng-star-inserted""><p>Prodaje se lep jednosoban stan u naselju Beverli Hils. Stan je površine 34m2 i nalazi se na III spratu (potkrovlje, iznad je ploča i krov) novije stambene zgrade bez lifta. Sastoji se od ulaznog hodnika, jedne sobe, odvojene kuhinje i kupatila. Grejanje u stanu je na struju. Podovi su obloženi parketom, a stolarija je PVC profila. Stan je u dobrom stanju i ne zahteva velika dodatna ulaganja. Ispred zgrade je privatni parking. Nalazi se na dobroj lokaciji, u blizini su: OŠ ´Mika Antić´, Lidl, DIS, Durlanska pijaca, Nišavski kej, pa je ova nekretnina idealno mesto za miran i kvalitetan život. Hvala Vam što ste pogledali oglas. Za više informacija o ovoj ili drugim nekretninama i zakazivanje razgledanja kontaktirajte agenta na broj telefona iz oglasa (poziv, sms, viber) ili putem e-maila. Kompletnu ponudu dostupnih nekretnina možete pronaći na našem sajtu. Agencija Proagent nekretnine je upisana u Registru posrednika pod brojem: 940.","Jednosoban stan na prodaju, Beverli Hils, 47.500€, 34m² - 4zida",2024-01-26,,,,,,,,,,,,,,,,,
1,https://www.4zida.rs/prodaja-stanova/autokomanda-vozdovac-opstina-beograd/trosoban-stan/65b2550f4c511bbe9b024586,87 m² ,3 sobe ,uknjiženo ,centralno grejanje ,3/6 spratova ,prazno ,1659 ,pre 1 dan ,226.200,Vojvode Stepe,"Autokomanda, Voždovac opština, Beograd","<h2 _ngcontent-ng-c3151048826 class=""mat-headline-5"">Opis oglasa</h2><div _ngcontent-ng-c3151048826 class=""prose max-h-64 overflow-hidden text-gray-800 ng-star-inserted""><p>Prodajemo odličan trosoban, dvostrano orijentisan stan na III spratu održavane novogradnje sa liftom na ekskluzivnoj lokaciji, na Autokomandi. ","Trosoban stan na prodaju, Vojvode Stepe, 226.200€, 87m² - 4zida",2024-01-26,Stan u zgradi ,novo ,ima lift (1) ,1 garažno mesto ,1 parking mesto ,terasa ,"kablovska, internet, interfon, klima, Kanalizacija ",useljivo ,,,,,,,,,
2,https://www.4zida.rs/prodaja-stanova/miljakovac-rakovica-opstina-beograd/trosoban-stan/65b256054c511bbe9b0245de,88 m² ,3 sobe ,uknjiženo ,centralno grejanje ,5/5 spratova ,prazno ,1819 ,pre 1 dan ,115.000,Stevana Opačića,"Miljakovac, Rakovica opština, Beograd","<h2 _ngcontent-ng-c3151048826 class=""mat-headline-5"">Opis oglasa</h2><div _ngcontent-ng-c3151048826 class=""prose max-h-64 overflow-hidden text-gray-800 ng-star-inserted""><p>Dupleks u odličnom stanju i mirnom delu Miljakovca, sa vrlo prijatnim i interesantnim enterijerom. Odmah useljiv i ne zahteva dodatna ulaganja.<br>U blizini se nalaze škola,vrtić,objekti za snabdevanje, pošta, autobuska stanica. Stan ima 82m² grejne površine + lođa 6m².","Trosoban stan na prodaju, Stevana Opačića, 115.000€, 88m² - 4zida",2024-01-26,,uobičajeno stanje ,ima lift (1) ,,,lođa ,interfon ,useljivo ,kupatila (2) ,,,,,,,,
3,https://www.4zida.rs/prodaja-stanova/rotkvarija-gradske-lokacije-novi-sad/dvosoban-stan/65b3a4c893564bf78b051ead,51 m² ,2 sobe ,uknjiženo ,centralno grejanje ,1/4 sprata ,namešteno ,26012401 ,pre 7 minuta ,131.325,Vuka Karadžića,"Rotkvarija, Gradske lokacije, Novi Sad","<h2 _ngcontent-ng-c3151048826 class=""mat-headline-5"">Opis oglasa</h2><div _ngcontent-ng-c3151048826 class=""prose max-h-64 overflow-hidden text-gray-800 ng-star-inserted""><p>U ponudi agencije je odličan dvosoban stan na samo 600 metara od Gradske kuće i pešačke zone,odmah useljiv,  kompletno opremljen nameštajem,bez ulaganja.","Dvosoban stan na prodaju, Vuka Karadžića, 131.325€, 51m² - 4zida",2024-01-26,Stan u zgradi ,održavano ,ima lift (1) ,,"javni parking u zoni, javni parking van zone ","prilaz za invalide, terasa ","telefon, kablovska, TV, klima, ventilacija, veš mašina, kuhinjski elementi, frižider, zamrzivač, rerna, šporet, ležaj, plakar ",useljivo ,"kupatilo, kuhinja, ostava ",Optički ,,,,,,,
4,https://www.4zida.rs/prodaja-stanova/salajka-gradske-lokacije-novi-sad/dvoiposoban-stan/65b298ad430e7564a209d1b4,53 m² ,2.5 soba ,nije uknjiženo ,grejanje na gas ,visoko prizemlje/5 spratova ,,90046 ,pre 19 sati ,138.000,Radoja Domanovića,"Salajka, Gradske lokacije, Novi Sad","<h2 _ngcontent-ng-c3151048826 class=""mat-headline-5"">Opis oglasa</h2><div _ngcontent-ng-c3151048826 class=""prose max-h-64 overflow-hidden text-gray-800 ng-star-inserted""><p>Agencijski ID: 90046, VPR/V, lift, terasa, nov luks, novogradnja. Dvoiposoban stan u blizini centra,odlicnog rasporeda,u sve prostorije se ulazi iz hodnika.Useljiv za mesec dana.Racuni po potrosnji.Miran kraj sa dosta zelenila.Mogucnost kupovine parking mesta. Više informacija na: http://www.beocitynekretnine.rs Agencijska provizija 3%. Telefoni: 021/399-0210 • 060/399-0210. Kontakt van radnog vremena: kancelarija@beocitynekretnine.rs","Dvoiposoban stan na prodaju, Radoja Domanovića, 138.000€, 53m² - 4zida",2024-01-26,Stan u zgradi ,novo ,ima lift (1) ,,,terasa ,,useljivo ,,,,,,,,,
5,https://www.4zida.rs/prodaja-stanova/staro-groblje-palilula-gradske-lokacije-nis/trosoban-stan/65b260ba9a6556b81e088d8e,90 m² ,3 sobe ,uknjiženo ,etažno grejanje ,1/3 sprata ,,p,pre 23 sati ,127.000,Njegoševa,"Staro Groblje, Palilula, Gradske lokacije, Niš","<h2 _ngcontent-ng-c3151048826 class=""mat-headline-5"">Opis oglasa</h2><div _ngcontent-ng-c3151048826 class=""prose max-h-64 overflow-hidden text-gray-800 ng-star-inserted""><p>Na prodaju stan u novoj zgradi na Paliluli.<br>Stan ima 90m2 (82m2 korisne, uknjižene površine). Nalazi se na prvom spratu manje trospratne zgrade bez lifta. Po strukturi je trosoban.<br>Sastoji se od ulaznog hodnika, dnevne sobe sa delom za kuhinju, dve spavaće sobe, kupatila i dve terase.<br>Objekat je kvllitetne gradnje, demit fasada sa 10cm izolacijom, spoljna PVC stolarija, prvoklasni bukov parket, kvalitena keramika i sanitarija, etažno grejanje. Useljivo oktobra 2022. godine.<br>Cena stana je 127.000,00€. Uknjiženo, čisto vlasništvo, mogućnost kupovine putem kredita. Za više informacija slobodno pozovite.","Trosoban stan na prodaju, Njegoševa, 127.000€, 90m² - 4zida",2024-01-26,,novo ,,1 garažno mesto ,,terase (2) ,,,kupatilo ,,,,,,,,
6,https://www.4zida.rs/prodaja-stanova/crveni-krst-zvezdara-zvezdara-opstina-beograd/trosoban-stan/65b3a754a15a6f8b3e0ff660,108 m² ,3 sobe ,uknjiženo ,grejanje na struju ,2/2 sprata ,prazno ,2376 ,pre 8 minuta ,190.000,Pop Stojanova,"Crveni Krst Zvezdara, Zvezdara opština, Beograd","<h2 _ngcontent-ng-c3151048826 class=""mat-headline-5"">Opis oglasa</h2><div _ngcontent-ng-c3151048826 class=""prose max-h-64 overflow-hidden text-gray-800 ng-star-inserted""><p>Optimist nekretnine Vam nude prelep dupleks, uknjižen, trosoban, svetao, topao, u jednom od najlepših delova grada, na Crvenom krstu, u Pop Stojanovoj ulici.","Trosoban stan na prodaju, Pop Stojanova, 190.000€, 108m² - 4zida",2024-01-26,,,,,,terasa ,"telefon, kablovska, internet, interfon, klima ",useljivo ,kupatila (2) ,,,,,,,,
7,https://www.4zida.rs/prodaja-stanova/calije-pantelej-gradske-lokacije-nis/dvoiposoban-stan/65b27eaa42af730a4e00a324,57 m² ,2.5 soba ,uknjiženo ,etažno grejanje ,2. sprat ,prazno ,4332 ,pre 21 sati ,91.200,Čalije,"Čalije, Pantelej, Gradske lokacije, Niš","<h2 _ngcontent-ng-c3151048826 class=""mat-headline-5"">Opis oglasa</h2><div _ngcontent-ng-c3151048826 class=""prose max-h-64 overflow-hidden text-gray-800 ng-star-inserted""><p>Prodaje se nov odmah useljiv stan u naselju Čalije.Površina stana je 57me i nalazi  se na II spratu stambene zgrade sa liftom. Sastoji se od ulaznog hodnika, dnevnog boravka sa trpezarijom, kuhinje, dve spavaće sobe, kupatila  i terase. Podovi su obloženi parketom, stolarija je PVC profila. Postavljena je kompletna instalacija za etažno grejanje. Stan je neuseljavan i postoji mogucnost povraćaja PDV. Mogućnost kupovine privatnog parking mesta. Hvala Vam što ste pogledali oglas. Za više informacija o ovoj ili drugim nekretninama i zakazivanje razgledanja kontaktirajte agenta na broj telefona iz oglasa (poziv, sms, viber) ili putem e-maila. Kompletnu ponudu dostupnih nekretnina možete pronaći na našem sajtu. Agencija Proagent nekretnine je upisana u Registru posrednika pod brojem: 940.","Dvoiposoban stan na prodaju, Čalije, 91.200€, 57m² - 4zida",2024-01-26,,,ima lift (1) ,,,terasa ,,,,,,,,,,,
8,https://www.4zida.rs/prodaja-stanova/centar-gradske-lokacije-kragujevac/cetvorosoban-stan/65b24ece4c511bbe9b024483,96 m² ,4 sobe ,uknjiženo ,podno grejanje ,5/5 spratova ,,7821 ,pre 1 dan ,158.400,Karadjoedjeva,"Centar, Gradske lokacije, Kragujevac","<h2 _ngcontent-ng-c3151048826 class=""mat-headline-5"">Opis oglasa</h2><div _ngcontent-ng-c3151048826 class=""prose max-h-64 overflow-hidden text-gray-800 ng-star-inserted""><p>Odlican cetverosoban stan u lux varijanti u zgradi koja se nalazi u samom centru Kragujevca. Zgrada i stan gradjeni najkvalitetnijim materijalima, i sa opremom najrenomiranijih proizvodjaca.. Stan dvostrano orjentisan,  pun svetlosti i sunca.. Grejanje podno na gas. Fasadna stolarija  PVC+ALU sa roletnama i komarnicima. Granitna keramika italijanska. Zgrada poseduje lift koji je povezan sa garazom.<br>Cena sa uracunatim PDV-om. Mogucnost kupovine garaznog mesta po ceni od 7200 eura. hodnik, dnevna soba sa kuhinjom i trpezarijom, tri spavace sobe, dva kupatila, terasa potpuna Broj u reg:105 Posrednicka provizija 2% 5/5 Karadjoedjeva","Četvorosoban stan na prodaju, Karadjoedjeva, 158.400€, 96m² - 4zida",2024-01-26,Stan u zgradi ,novo ,ima lift (1) ,,,terasa ,telefon ,useljivo ,,,,,,,,,
9,https://www.4zida.rs/prodaja-stanova/salajka-gradske-lokacije-novi-sad/cetvorosoban-stan/65b272b442af730a4e00a067,88 m² ,4 sobe ,,grejanje na gas ,4/4 sprata ,prazno ,208 ,pre 1 sat ,184.254,Salajka,"Salajka, Gradske lokacije, Novi Sad","<h2 _ngcontent-ng-c3151048826 class=""mat-headline-5"">Opis oglasa</h2><div _ngcontent-ng-c3151048826 class=""prose max-h-64 overflow-hidden text-gray-800 ng-star-inserted""><p>Agencijska oznaka 208","Četvorosoban stan na prodaju, Salajka, 184.254€, 88m² - 4zida",2024-01-26,Stan u zgradi ,u izgradnji ,ima lift (1) ,1 garažno mesto ,,terasa ,"kablovska, internet, interfon ",,,,2024,,,,,,
10,https://www.4zida.rs/prodaja-stanova/lekino-brdo-vozdovac-opstina-beograd/cetvorosoban-stan/65b24634a3a667922f0bd3d9,180 m² ,4 sobe ,uknjiženo ,centralno grejanje ,3/3 sprata ,prazno ,2824 ,pre 1 dan ,335.000,Tetovska,"Lekino Brdo, Voždovac opština, Beograd","<h2 _ngcontent-ng-c3151048826 class=""mat-headline-5"">Opis oglasa</h2><div _ngcontent-ng-c3151048826 class=""prose max-h-64 overflow-hidden text-gray-800 ng-star-inserted""><p>Voždovac, Lekino brdo - Tetovska","Četvorosoban stan na prodaju, Tetovska, 335.000€, 180m² - 4zida",2024-01-26,Dupleks ,novo ,,,,terasa ,,,,,2020,,,,,,
11,https://www.4zida.rs/prodaja-stanova/novi-sad-centar-stari-grad-gradske-lokacije-novi-sad/cetvorosoban-stan/65b234b35634395e37099281,126 m² ,4 sobe ,uknjiženo ,centralno grejanje ,4/4 sprata ,prazno ,2273 ,pre 1 dan ,389.000,Novi Sad - Centar,"Novi Sad - Centar, Stari Grad, Gradske lokacije, Novi Sad","<h2 _ngcontent-ng-c3151048826 class=""mat-headline-5"">Opis oglasa</h2><div _ngcontent-ng-c3151048826 class=""prose max-h-64 overflow-hidden text-gray-800 ng-star-inserted""><p>Prodaje se NOV 4 stan u NOVOM SADU, CENTAR površine 126m2. Stan se nalazi u extra kvalitetnom objektu nadomak IZVRŠNOG VEĆA i DUNAVSKOG PARKA. Cena stana sa PDV-om.  Mogućnost kupovine i garažnog mesta uz stan. Vredi pogledati.","Četvorosoban stan na prodaju, Novi Sad - Centar, 389.000€, 126m² - 4zida",2024-01-26,Stan u zgradi ,novo ,ima lift (1) ,1 garažno mesto ,,terasa ,"kablovska, internet, interfon ",useljivo ,,,,,,,,,
12,https://www.4zida.rs/prodaja-stanova/bulevar-oslobodjenja-gradske-lokacije-novi-sad/garsonjera/65b377f60d1ac28c800cb678,27 m² ,0.5 soba ,uknjiženo ,centralno grejanje ,2/5 spratova ,prazno ,523212 ,pre 3 sata ,79.000,CCC,"Bulevar Oslobođenja, Gradske lokacije, Novi Sad","<h2 _ngcontent-ng-c3151048826 class=""mat-headline-5"">Opis oglasa</h2><div _ngcontent-ng-c3151048826 class=""prose max-h-64 overflow-hidden text-gray-800 ng-star-inserted""><p>Predstavljamo vam garsonjeru na jednoj od najtraženijih logacija u Novom Sadu. Nalaizi se na 10 minuta hoda od centra i katedrale ,u neposrednoj blizini Trga Mladenaca. Garsonjera je kompletno renovirana prošče godine i prodaje sa stvarima i tehnikom kao na slikama. Izuzetno pogodna za izdavanje ali i za život. Za više informacija pozovite naš tim agenata.","Garsonjera na prodaju, CCC, 79.000€, 27m² - 4zida",2024-01-26,Stan u zgradi ,renovirano ,,,,,,,,,,,,,,,
13,https://www.4zida.rs/prodaja-stanova/vojvode-vlahovica-vozdovac-vozdovac-opstina-beograd/trosoban-stan/63e6707902a8260f6d0d416a,60 m² ,3 sobe ,uknjiženo ,grejanje na gas ,2/3 sprata ,prazno ,1630 ,pre 23 sati ,131.000,Vojvode Vlahovića Voždovac,"Vojvode Vlahovića Voždovac, Voždovac opština, Beograd","<h2 _ngcontent-ng-c3151048826 class=""mat-headline-5"">Opis oglasa</h2><div _ngcontent-ng-c3151048826 class=""prose max-h-64 overflow-hidden text-gray-800 ng-star-inserted""><p>Svaki kupac na poklon dobija osiguranje nepokretnosti i stvari domaćinstva u trajanju od 1 godine!!!","Trosoban stan na prodaju, Vojvode Vlahovića Voždovac, 131.000€, 60m² - 4zida",2024-01-26,,,ima lift (1) ,,1 parking mesto ,terasa ,"telefon, interfon ",,kupatilo ,,,,,,,,
14,https://www.4zida.rs/prodaja-stanova/liman-3-liman-gradske-lokacije-novi-sad/dvosoban-stan/65b236cf11023501900e8419,47 m² ,2 sobe ,uknjiženo ,centralno grejanje ,8/12 spratova ,namešteno ,,pre 1 dan ,126.690,Danila Kiša 2,"Liman 3, Liman, Gradske lokacije, Novi Sad","<h2 _ngcontent-ng-c3151048826 class=""mat-headline-5"">Opis oglasa</h2><div _ngcontent-ng-c3151048826 class=""prose max-h-64 overflow-hidden text-gray-800 ng-star-inserted""><p>Predstavljamo vam odličan limanski dvosoban stan u blizini limanskog parka i studentskog doma. Sama lokacija stana je odlična jer se u blizini nalazi sve neophodno za život. Stan je odlično održavan i ne zahteva prevelika ulaganja. Prodaje se komplet namešten sem frižidera. Stan je uknjižen i moguće je kupiti putem stambenog kredita. Za sve dodatne informacije možete pozvati agente prodaje!","Dvosoban stan na prodaju, Danila Kiša 2, 126.690€, 47m² - 4zida",2024-01-26,Stan u zgradi ,renovirano ,,,javni parking van zone ,terasa ,"telefon, kablovska, klima ",useljivo ,"kupatilo, kuhinja, ostava ",,,,,,,,
15,https://www.4zida.rs/prodaja-stanova/tosin-bunar-novi-beograd-beograd/trosoban-stan/65b272b942af730a4e00a06b,84 m² ,3 sobe ,uknjiženo ,centralno grejanje ,3/9 spratova ,prazno ,42569 ,pre 22 sati ,302.256,Tošin Bunar,"Tošin Bunar, Novi Beograd, Beograd","<h2 _ngcontent-ng-c3151048826 class=""mat-headline-5"">Opis oglasa</h2><div _ngcontent-ng-c3151048826 class=""prose max-h-64 overflow-hidden text-gray-800 ng-star-inserted""><p>Trosoban, Lux, stan na trećem spratu stambeno poslovnog kompleksa SAVADA 3 .<br>Odlično pozicioniran, sa mogućnošću formiranja treće spavaće sobe kao to se može videti iz tlocrta stana.<br>Stankoji poseduje dva mokra čvora, koji sem aspiratorske ventilacije u kuhinji ima i prirodnu ventilaciju.<br>Ima dve funkcionalne terase, prostranu dnevnu sobu  kuhinju i trpezariju koncepcije open space.<br>Kupovinom ovog stana kupac ne plaća proviziju.Uz sta je moguće kupiti i garažna mesta po ceni od<br>1750eura/m2.<br>Spoljašnja stolarija: kvalitetni inostrani PVC profili sa vrhunskim okovom zahvaljujući kojima objekat ima  B energetski razred. Spoljašnja obloga profila je od aluminijuma, ugradjene aluminijumske roletne.<br>Unutrašnja stolarija: MDF unutrašnja vrata farbana poliuretanskom belom bojom sa prvoklasnim okovima i kvakama inostranih brendova<br>Sigurnosna vrata u stanu: Ulazna vrata su visokokvalitetna, sigurnosna. Vrata ispunjavaju sve relevantne zahteve vezane za akustiku i bezbednost. Završna obrada krila je od drvenog furnira, obostrano obložena.<br>Parket: Vrhunski troslojni , gotov hrastov parket, završno obrađen I lakiran,  sa parket lajsnom, visine 8cm<br>Keramika: inostrane granitne, keramičke pločice renomiranih brendova, na terasama protivklizna granitna keramika<br>Sanitarije: Ugradni sistem vodokotlića uz prateću sanitarnu galanteriju inostranih brendova, konzolne wc šolje, umivaonici, tuš podne rešetke I jednoručne baterije vrhunskog kvaliteta.<br>Termo i zvučna izolacija svakog stana, u medjuspratnim konstrukcijama i u zidovima ka susednim stanovima i ka zajedničkom hodniku, sve zadovoljava energetski razred B kategorije<br>Hidroizolacija vrhunskog proverenog kvaliteta renomiranog proizvođača, u svim prostorijama gde je potrebna, kao što su kupatila, toaleti, terase, krovovi<br>Grejanje: Daljinski sistem grejanja sa merenjem utroška energije putem kalorimetara, aluminijumski radijatori, u kupatilima sušači peškira<br>Klimatizacija: Inverterske split i multi sistem jedinice inostranih brendova potvrđenog kvaliteta.<br>Locirana strateški, povezana vrhunski, SAVADA 3 leži kraj jedne od najstarijih ulica s ove strane reke, danas jedne od najvažnijih saobraćajnica. Lako uočljiva, pogledima privlačna, prava lepota stambenog prostora ušuškana je iza kulisa gradske vreve. Mirne unutrašnjosti i savremene spoljašnosti, svojim vrhovima namiguje nekim od najpoznatijih gradskih centara za biznis, edukaciju, zabavu, rekreaciju, kupovinu.<br>Pešačkom udaljenošću bliska školama i centrima sa velikim izborom sportskih i rekreativnih aktivnosti. U komšiluku niže supermarkete, tržne centre, poslovne komplekse, restorane. Zaljubljenicima u vožnju bicikla nudi dobru povezanost stazama i bogat izbor destinacija.<br>Nekoliko minuta dalje, vodi do reke Save i opuštajućeg zelenog raja. A na drugu stranu, malo dalje, do prirodnog prostranstva Zemunskog keja.<br>Na koju god stranu da se uputiš, SAVADA 3 je start do pregršt izbora. Za istraživanje, za avanturu, za razvijanje tela i uma. Za kvalitetan život.","Trosoban stan na prodaju, Tošin Bunar, 302.256€, 84m² - 4zida",2024-01-26,,novo ,ima lift (1) ,,,"terasa, lođa ","kablovska, internet, klima ",useljivo ,,,,,,,,,
16,https://www.4zida.rs/prodaja-stanova/kotez-palilula-opstina-beograd/jednoiposoban-stan/65b3a088a791815a2204587b,43 m² ,1.5 soba ,uknjiženo ,grejanje na struju ,1/3 sprata ,,87917 ,pre 38 minuta ,69.900,Kajuhova,"Kotež, Palilula opština, Beograd","<h2 _ngcontent-ng-c3151048826 class=""mat-headline-5"">Opis oglasa</h2><div _ngcontent-ng-c3151048826 class=""prose max-h-64 overflow-hidden text-gray-800 ng-star-inserted""><p>Stvarna površina-43m2 , ugovorna površina-39.00m2,<br>Kotež, odmah useljiv, odličan raspored, bez većih ulaganja, potrebno higijensko krečenje, promenjene vodovodne i elektro instalacije.<br>Istočno orjentisan, mali režijski troškovi, vredi pogledati.<br>Agencijska provizija koju plaća kupac pri kupovini ove nepokretnosti iznosi 2%  od dogovorene kupoprodajne cene","Jednoiposoban stan na prodaju, Kajuhova, 69.900€, 43m² - 4zida",2024-01-26,Stan u zgradi ,,,,,"podrum, terasa ",telefon ,useljivo ,,,1960,,,,,,
17,https://www.4zida.rs/prodaja-stanova/erdoglija-gradske-lokacije-kragujevac/dvosoban-stan/65b24ecc4c511bbe9b024462,47 m² ,2 sobe ,nije uknjiženo ,podno grejanje ,4/4 sprata ,,7793 ,pre 1 dan ,67.110,Obiliceva,"Erdoglija, Gradske lokacije, Kragujevac","<h2 _ngcontent-ng-c3151048826 class=""mat-headline-5"">Opis oglasa</h2><div _ngcontent-ng-c3151048826 class=""prose max-h-64 overflow-hidden text-gray-800 ng-star-inserted""><p>Odlican dvosoban stan, jugozapadno orjentisan u novoj zgradi koja je useljiv u decembru 2023 godine. Odlicna gradnja gradjena sa najkvalitetnijim materijalima i opremom renomiranih proizvodjaca, Odlicna lokacija sa svom potrebnom infrastrukturom. Isti stan u ponudi i na cetvrtom spratu.  Cena sa uracunatim PDV-om hodnik, kuhinja, dnevna soba sa trpezarijom, spavaca soba, kupatilo, terasa potpuna Broj u reg:105 Posrednicka provizija 2% 4/4 Obiliceva","Dvosoban stan na prodaju, Obiliceva, 67.110€, 47m² - 4zida",2024-01-26,Stan u zgradi ,novo ,ima lift (1) ,,,terasa ,telefon ,useljivo ,,,2023,,,,,,
18,https://www.4zida.rs/prodaja-stanova/gradske-lokacije-indjija/trosoban-stan/65b26604e4d2e9c5e104bbec,60 m² ,3 sobe ,uknjiženo ,grejanje na gas ,2/5 spratova ,prazno ,643 ,pre 22 sati ,73.057,Gradske lokacije,"Gradske lokacije, Inđija","<h2 _ngcontent-ng-c3151048826 class=""mat-headline-5"">Opis oglasa</h2><div _ngcontent-ng-c3151048826 class=""prose max-h-64 overflow-hidden text-gray-800 ng-star-inserted""><p>Na atraktivnoj lokaciji u glavnoj ulici Indjije, gradi se novogradnja koja predstavlja spoj vrhunskog kvaliteta gradnje, inovativnog dizajna i posvećenosti investitora. Smeštena u srcu Indjije, ova zgrada omogućava udoban i komforan život u blizini svih neophodnih sadržaja, objedinjujući funkcionalnost i estetiku u jednu harmoničnu celinu. Energetska efikasnost stanova, o kojoj investitor vodi posebno računa, garantuje Vam komfor i štednju energije, stvarajući idealnu kombinaciju za savremen životni stil.","Trosoban stan na prodaju, Gradske lokacije, 73.057€, 60m² - 4zida",2024-01-26,Stan u zgradi ,novo ,ima lift (1) ,1 garažno mesto ,1 parking mesto ,terasa ,"kablovska, internet, interfon, klima, Kanalizacija ",,,,,,,,,,
19,https://www.4zida.rs/prodaja-stanova/gradske-lokacije-ruma/trosoban-stan/65b0ca9bcd505c51010f083e,83 m² ,3 sobe ,uknjiženo ,centralno grejanje ,4/5 spratova ,prazno ,,pre 1 dan ,88.000,15. Maj 140,"Gradske lokacije, Ruma","<h2 _ngcontent-ng-c3151048826 class=""mat-headline-5"">Opis oglasa</h2><div _ngcontent-ng-c3151048826 class=""prose max-h-64 overflow-hidden text-gray-800 ng-star-inserted""><p>Na prodaju komforan stan od 83 m2 u samom centru Rume na 4. spratu. Stan je orijentisan sever-jug sa prelepim rasporedom prostorija (predsoblje, hodnik, kupatilo, ostava, dve spavace sobe, ogromna dnevna soba, kuhinja sa trpezarijom i terasa). Stan je kompletno renoviran(zidovi i plafoni guljeni, gletovani, okreceni, nova PVC stolarija, novi podovi, nova keramika, nova struja, voda, kanalizacija). Stan ima centralno grejanje, svoj podrum, kablovsku, internet, ispred zgrade je javni parking......Cena nije fixna, vredi pogledati zbog komfora koji ovaj prelep renoviran stan pruza!","Trosoban stan na prodaju, 15. Maj 140, 88.000€, 83m² - 4zida",2024-01-26,Stan u zgradi ,renovirano ,,,"1 parking mesto, u dvorištu zgrade, javni parking u zoni ","dvorište, podrum, terasa ","kablovska, internet, klima, kuhinjski elementi ",,"kupatilo, toalet, kuhinja, ostava ",Kablovska ,1980,"sever, jug ","ulicu, dvorište ",,,,
20,https://www.4zida.rs/prodaja-stanova/ledena-stena-gradske-lokacije-vranje/dvoiposoban-stan/65b2f27499735b467a0a8bc7,62 m² ,2.5 soba ,uknjiženo ,TA peć ,2/6 spratova ,prazno ,189 ,pre 13 sati ,50.777,Ledena Stena,"Ledena Stena, Gradske lokacije, Vranje","<h2 _ngcontent-ng-c3151048826 class=""mat-headline-5"">Opis oglasa</h2><div _ngcontent-ng-c3151048826 class=""prose max-h-64 overflow-hidden text-gray-800 ng-star-inserted""><p>Otvorite vrata Vašeg novog doma - elegantnog stana u širem centru Vranja, naselje Ledena stena, gde se udobnost susreće s praktičnošću. Ovaj prelepi stan od 62 m2 + terasa od 9 m2 predstavlja idealan spoj udobnosti i praktičnosti, a evo zašto je ovo savršena prilika za Vas!","Dvoiposoban stan na prodaju, Ledena Stena, 50.777€, 62m² - 4zida",2024-01-26,Stan u zgradi ,,ima lift (1) ,,1 parking mesto ,"podrum, terasa, lođa ",Kanalizacija ,,ostava ,,,,,,,,
21,https://www.4zida.rs/prodaja-stanova/uciteljsko-naselje-zvezdara-opstina-beograd/trosoban-stan/65b3a087a791815a22045872,70 m² ,3 sobe ,uknjiženo ,centralno grejanje ,5/5 spratova ,,87881 ,pre 38 minuta ,210.000,Onisima Popovića,"Učiteljsko Naselje, Zvezdara opština, Beograd","<h2 _ngcontent-ng-c3151048826 class=""mat-headline-5"">Opis oglasa</h2><div _ngcontent-ng-c3151048826 class=""prose max-h-64 overflow-hidden text-gray-800 ng-star-inserted""><p>Stvarna površina-70m2 , ugovorna površina-68.00m2,<br>Odličan stan kod Cvetkove pijace u lux novogradnji. Sendvič zid, pikovana fasada, grejanje po potrošnji na kalorimetre. Dvostrano orijentisan sa lepim pogledom. Mogućnost kupovine garažnog mesta.<br>Agencijska provizija koju plaća kupac pri kupovini ove nepokretnosti iznosi 2%  od dogovorene kupoprodajne cene","Trosoban stan na prodaju, Onisima Popovića, 210.000€, 70m² - 4zida",2024-01-26,Stan u zgradi ,novo ,ima lift (1) ,1 garažno mesto ,,terasa ,,useljivo ,,,2023,,,,,,
