,link,Tip,Površina,Uknjiženost,Šifra oglasa,Oglas ažuriran,price,street,address,description,title,end_date
0,https://www.4zida.rs/prodaja-placeva/prva-kutina-okolne-lokacije-nis/gradjevinsko-zemljiste/65e863302d1580ff4d05acab,građevinsko zemljište ,24.27 a ,uknjiženo ,p,pre 1 dan ,39.000,Radikinski put,"Prva Kutina, Okolne lokacije, Niš","<h2 _ngcontent-ng-c3151048826 class=""mat-headline-5"">Opis oglasa</h2><div _ngcontent-ng-c3151048826 class=""prose max-h-64 overflow-hidden text-gray-800 ng-star-inserted""><p>Na  prodaju  plac  za  gradnju - gradsko  građevinsko  zemljište   u  Prvoj  Kutini, pored  asvaltnog  puta,  na  atraktivnom, mirnom   mestu  za  gradnju  porodične  kuće  ili  vikendice  sa  prostranom  okućnicom  za  voćnjak, vinograd  ili  baštu.  Plac  izlazi  na  dve  ulice,  ulazni  front  je  širine  25 m  a  priključci  ne  elektro  i  vodovodnu  mrežu  su  odmah  pored  placa. Za  više  informacija  pozovite  agenciju.","Građevinsko zemljište na prodaju, Radikinski put, 39.000€, 24a - 4zida",2024-03-07
1,https://www.4zida.rs/prodaja-placeva/kelebija-okolne-lokacije-subotica/gradjevinsko-zemljiste/65ae89a4bea8348f040cefd3,građevinsko zemljište ,6.01 a ,uknjiženo ,1728 ,pre 1 mesec ,9.000,Kelebija,"Kelebija, Okolne lokacije, Subotica","<h2 _ngcontent-ng-c3151048826 class=""mat-headline-5"">Opis oglasa</h2><div _ngcontent-ng-c3151048826 class=""prose max-h-64 overflow-hidden text-gray-800 ng-star-inserted""><p>Prodaje se plac gradevinskog zemlista blizu glavnog puta na Kelebije povrsine od 601m2 sa pomocnim objektom, trofaznom strujom i bunarom.","Građevinsko zemljište na prodaju, Kelebija, 9.000€, 6a - 4zida",2024-03-07
2,https://www.4zida.rs/prodaja-placeva/konjska-reka-tara/gradjevinsko-zemljiste/65e869494bfde720cd09d3b9,građevinsko zemljište ,804 a ,uknjiženo ,,pre 1 dan ,49.500,KONJSKA REKA BB,"Konjska Reka, Tara","<h2 _ngcontent-ng-c3151048826 class=""mat-headline-5"">Opis oglasa</h2><div _ngcontent-ng-c3151048826 class=""prose max-h-64 overflow-hidden text-gray-800 ng-star-inserted""><p>Prodaje se plac 804m2 (8,04ar) u mestu SEKULIĆ NA TARI, KO KONJSKA REKA , BR. PARCELE JE 906/36. Za plac su dobijeni lokaciski uslovi, građevisnka dozvola je u procesu dobijanja (mesec ili dva ) takođe je urađeno i idejno rešenje od strane Arhitektonskog studija za izgradnju stambenog objekta u skladu sa zakonom oplaniranju , izgradnji, propisima, standardima iz oblasti gradnje na tom području.","Građevinsko zemljište na prodaju, KONJSKA REKA BB, 49.500€, 804a - 4zida",2024-03-07
3,https://www.4zida.rs/prodaja-placeva/dobanovci-surcin-opstina-beograd/gradjevinsko-zemljiste/65e9dad82bfe1de0de0f0b75,građevinsko zemljište ,4.2 a ,uknjiženo ,43378 ,pre 1 sat ,1.260.000,Krčevina,"Dobanovci, Surčin opština, Beograd","<h2 _ngcontent-ng-c3151048826 class=""mat-headline-5"">Opis oglasa</h2><div _ngcontent-ng-c3151048826 class=""prose max-h-64 overflow-hidden text-gray-800 ng-star-inserted""><p>(agencijska provizija 2%) Agencijska provizija 2%","Građevinsko zemljište na prodaju, Krčevina, 1.260.000€, 4a - 4zida",2024-03-07
4,https://www.4zida.rs/prodaja-placeva/gornja-kamenica-sremska-kamenica-gradske-lokacije-novi-sad/gradjevinsko-zemljiste/65e9ef5afac3ac4bc2031d64,građevinsko zemljište ,5.6 a ,uknjiženo ,5824 ,pre 30 minuta ,232.000,Gornja Kamenica,"Gornja Kamenica, Sremska Kamenica, Gradske lokacije, Novi Sad","<h2 _ngcontent-ng-c3151048826 class=""mat-headline-5"">Opis oglasa</h2><div _ngcontent-ng-c3151048826 class=""prose max-h-64 overflow-hidden text-gray-800 ng-star-inserted""><p>Prodaje se plac 560 m2 na odličnom mestu u Sremskoj Kamenici. Plac širine 16 metara ima izlaz na dve asfaltirane ulice, lep pogled ka Novom Sadu, dozvoljena je gradnja stambenih objekata, ograđen, na blagoj kosini. ","Građevinsko zemljište na prodaju, Gornja Kamenica, 232.000€, 5a - 4zida",2024-03-07
5,https://www.4zida.rs/prodaja-placeva/srpski-sor-zorka-gradske-lokacije-subotica/gradjevinsko-zemljiste/65e8d92a5d3f08114f0a7bea,građevinsko zemljište ,9 a ,nije uknjiženo ,,pre 1 sat ,13.900,11. nova,"Srpski Šor, Zorka, Gradske lokacije, Subotica","<h2 _ngcontent-ng-c3151048826 class=""mat-headline-5"">Opis oglasa</h2><div _ngcontent-ng-c3151048826 class=""prose max-h-64 overflow-hidden text-gray-800 ng-star-inserted""><p>Prodaje se plac u vikend naselju u Subotici. Preko puta placa je Kelebijska šuma. Vikendice su samo sa jedne strane ulice.","Građevinsko zemljište na prodaju, 11. nova, 13.900€, 9a - 4zida",2024-03-07
6,https://www.4zida.rs/prodaja-placeva/mokra-gora-tara/gradjevinsko-zemljiste/65e9810cb0c1b4d7850cc10d,građevinsko zemljište ,12.85 a ,uknjiženo ,,pre 4 sata ,1,Mokra Gora,"Mokra Gora, Tara","<h2 _ngcontent-ng-c3151048826 class=""mat-headline-5"">Opis oglasa</h2><div _ngcontent-ng-c3151048826 class=""prose max-h-64 overflow-hidden text-gray-800 ng-star-inserted""><p>Prodajem plac na izuzetnoj lokaciji u Mokroj gori, najlepsem selu na svetu. Plac se nalazi u samoj blizini zeleznicke stanice i Drvengrada. Duz celog placa je asfaltni put, potrebana infrastruktura takodje. Za dodatne informacije pozvati na tel.broj :","Građevinsko zemljište na prodaju, Mokra Gora, 1€, 12a - 4zida",2024-03-07
7,https://www.4zida.rs/prodaja-placeva/velika-lomnica-okolne-lokacije-krusevac/gradjevinsko-zemljiste/65e8fbe51a808706b50fe266,građevinsko zemljište ,15 a ,uknjiženo ,,pre 17 sati ,11.000,Trg Fontana 20/3,"Velika Lomnica, Okolne lokacije, Kruševac","<h2 _ngcontent-ng-c3151048826 class=""mat-headline-5"">Opis oglasa</h2><div _ngcontent-ng-c3151048826 class=""prose max-h-64 overflow-hidden text-gray-800 ng-star-inserted""><p>Na prodaju plac u Lomnici u okolini Krusevca, plac je idealan za izgradnju kuce, odlicna investicija.","Građevinsko zemljište na prodaju, Trg Fontana 20/3, 11.000€, 15a - 4zida",2024-03-07
8,https://www.4zida.rs/prodaja-placeva/muzlja-gradske-lokacije-zrenjanin/gradjevinsko-zemljiste/65e983374d63590a0504565d,građevinsko zemljište ,4.2 a ,uknjiženo ,,pre 7 sati ,18.000,Korvin Oto,"Mužlja, Gradske lokacije, Zrenjanin","<h2 _ngcontent-ng-c3151048826 class=""mat-headline-5"">Opis oglasa</h2><div _ngcontent-ng-c3151048826 class=""prose max-h-64 overflow-hidden text-gray-800 ng-star-inserted""><p>Na prodaju plac veličine 4,2 ara. Broj parcele 9782/9.","Građevinsko zemljište na prodaju, Korvin Oto, 18.000€, 4a - 4zida",2024-03-07
9,https://www.4zida.rs/prodaja-placeva/siljakovac-barajevo-opstina-beograd/gradjevinsko-zemljiste/65e846d16f62eda4340a6474,građevinsko zemljište ,48.68 a ,uknjiženo ,5231 ,pre 1 dan ,19.600,Trstenička,"Šiljakovac, Barajevo opština, Beograd","<h2 _ngcontent-ng-c3151048826 class=""mat-headline-5"">Opis oglasa</h2><div _ngcontent-ng-c3151048826 class=""prose max-h-64 overflow-hidden text-gray-800 ng-star-inserted""><p>Izuzetna ponuda!Prodaje se plac u Šiljakovcu površine 48,68 ari, u građevinskom području. Sastoji se od dve spojene parcele, uknjižene na jednog vlasnika, bez tereta. Struja i gradska voda uz plac, koji je uz asfaltnu ulicu, širine do iste 85 metara (prilog skica parcele). Na placu je voćnjak šljive oko 180 komada, najboljih sorti u sedmoj godini, koje rađaju i donose prihod, kao i tri stabla kruške i tri stabla jabuke. Plac je pod blagim padom, iznad puta, južno orjentisan, osunčan i održavan. Lokacija odlična, na pola sata vožnje od Banovog brda. Cena po aru 400 evra.","Građevinsko zemljište na prodaju, Trstenička, 19.600€, 48a - 4zida",2024-03-07
10,https://www.4zida.rs/prodaja-placeva/kelebija-okolne-lokacije-subotica/gradjevinsko-zemljiste/65e18929980b0622a601b9f5,građevinsko zemljište ,31 a ,uknjiženo ,,pre 17 sati ,5.000,Eleka Benedeka bb,"Kelebija, Okolne lokacije, Subotica","<h2 _ngcontent-ng-c3151048826 class=""mat-headline-5"">Opis oglasa</h2><!----><button _ngcontent-ng-c3151048826 mat-button color=""primary"" class=""w-full mdc-button mat-mdc-button mat-primary _mat-animation-noopable mat-mdc-button-base ng-star-inserted"" mat-ripple-loader-uninitialized mat-ripple-loader-class-name=""mat-mdc-button-ripple"" ngh=""6""><span class=""mat-mdc-button-persistent-ripple mdc-button__ripple""></span><mat-icon _ngcontent-ng-c3151048826 role=""img"" class=""mat-icon notranslate material-icons mat-ligature-font mat-icon-no-color"" aria-hidden=""true"" data-mat-icon-type=""font"" ngh=""0"">expand_more</mat-icon><span class=""mdc-button__label""> Prikaži </span><span class=""mat-mdc-focus-indicator""></span><span class=""mat-mdc-button-touch-target""></span></button><!----><!----><div _ngcontent-ng-c3151048826 data-cy=""detailsDescButtons"" class=""mt-6 grid grid-cols-2 gap-2 desk:grid-cols-4""><!----><!----><button _ngcontent-ng-c3151048826 mat-stroked-button color=""primary"" class=""flex-grow mdc-button mdc-button--outlined mat-mdc-outlined-button mat-primary _mat-animation-noopable mat-mdc-button-base ng-star-inserted"" mat-ripple-loader-uninitialized mat-ripple-loader-class-name=""mat-mdc-button-ripple"" ngh=""6""><span class=""mat-mdc-button-persistent-ripple mdc-button__ripple""></span><mat-icon _ngcontent-ng-c3151048826 role=""img"" class=""mat-icon notranslate material-icons mat-ligature-font mat-icon-no-color"" aria-hidden=""true"" data-mat-icon-type=""font"" ngh=""0"">share</mat-icon><span class=""mdc-button__label""> Podeli </span><span class=""mat-mdc-focus-indicator""></span><span class=""mat-mdc-button-touch-target""></span></button><!----><!----><!----><button _ngcontent-ng-c3151048826 mat-stroked-button color=""primary"" class=""flex-grow mdc-button mdc-button--outlined mat-mdc-outlined-button mat-primary _mat-animation-noopable mat-mdc-button-base ng-star-inserted"" mat-ripple-loader-uninitialized mat-ripple-loader-class-name=""mat-mdc-button-ripple"" ngh=""6""><span class=""mat-mdc-button-persistent-ripple mdc-button__ripple""></span><mat-icon _ngcontent-ng-c3151048826 role=""img"" class=""mat-icon notranslate material-icons mat-ligature-font mat-icon-no-color"" aria-hidden=""true"" data-mat-icon-type=""font"" ngh=""0"">warning</mat-icon><span class=""mdc-button__label""> Prijavi </span><span class=""mat-mdc-focus-indicator""></span><span class=""mat-mdc-button-touch-target""></span></button><!----></div></div><!----><app-gpt-banner _ngcontent-ng-c3151048826 labelposition=""top"" class=""inset-0 my-12 flex justify-center ng-star-inserted"" _nghost-ng-c2356194491 ngh=""13""><div _ngcontent-ng-c2356194491 id=""ed-container"" class=""overflow-clip bg-white"" data-cy=""banner""><!----><div _ngcontent-ng-c2356194491 class=""label-top""><div _ngcontent-ng-c2356194491 class=""relative"" id=""4Z_Mobile_320x100_AdDetails_Branding"" style=""width: 320px; height: 100px;""></div><small _ngcontent-ng-c2356194491 class=""leading-none ng-star-inserted""><span _ngcontent-ng-c2356194491>▾</span>Reklama<span _ngcontent-ng-c2356194491>▾</span></small><!----></div></div></app-gpt-banner><!----><div _ngcontent-ng-c3151048826 class=""mx-auto max-w-container""><!----></div><!----><!----><!----><!----><hr _ngcontent-ng-c3151048826><app-author-info _ngcontent-ng-c3151048826 variant=""description"" data-cy=""authorInfo"" _nghost-ng-c3575723570 ngh=""15""><!----><app-vertical-info _ngcontent-ng-c3575723570 _nghost-ng-c3763752656 class=""ng-star-inserted"" ngh=""14""><div _ngcontent-ng-c3763752656 class=""flex flex-col items-center gap-2 ng-star-inserted""><div _ngcontent-ng-c3763752656 class=""mt-2 flex flex-col items-center""><!----><span _ngcontent-ng-c3763752656 class=""font-medium text-orange-500"">Krisztian Taskovity</span><picture _ngcontent-ng-c3763752656><source _ngcontent-ng-c3763752656 type=""image/webp"" srcset=""https://cdn.4zida.rs/assets/images/no-images/no-user-avatar-96x96.png""><source _ngcontent-ng-c3763752656 type=""image/jpeg"" srcset=""https://cdn.4zida.rs/assets/images/no-images/no-user-avatar-96x96.png""><img _ngcontent-ng-c3763752656 width=""76"" height=""76"" class=""author-avatar mt-4 shadow-lg"" alt=""Krisztian Taskovity avatar"" loading=""lazy"" fetchpriority=""auto"" ng-img=""true"" src=""https://cdn.4zida.rs/assets/images/no-images/no-user-avatar-96x96.png""></picture><div _ngcontent-ng-c3763752656 class=""mt-2 flex items-center gap-1""><mat-icon _ngcontent-ng-c3763752656 role=""img"" color=""primary"" class=""mat-icon notranslate verified-icon mat-primary material-icons mat-ligature-font"" aria-hidden=""true"" data-mat-icon-type=""font"" ngh=""0"">verified</mat-icon><small _ngcontent-ng-c3763752656 class=""font-medium""> na 4zida</small></div></div><div _ngcontent-ng-c3763752656 class=""mt-2 w-full flex-grow""><div _ngcontent-ng-c3763752656><div _ngcontent-ng-c3763752656 class=""grid-cols-auto-fit grid justify-center gap-2""><button _ngcontent-ng-c3763752656 mat-flat-button color=""primary"" mat-ripple-loader-uninitialized mat-ripple-loader-class-name=""mat-mdc-button-ripple"" class=""mdc-button mdc-button--unelevated mat-mdc-unelevated-button mat-primary _mat-animation-noopable mat-mdc-button-base ng-star-inserted"" ngh=""6""><span class=""mat-mdc-button-persistent-ripple mdc-button__ripple""></span><mat-icon _ngcontent-ng-c3763752656 role=""img"" class=""mat-icon notranslate mr-2 material-icons mat-ligature-font mat-icon-no-color"" aria-hidden=""true"" data-mat-icon-type=""font"" ngh=""0"">phone</mat-icon><span class=""mdc-button__label""><span _ngcontent-ng-c3763752656>pozovi oglašivača</span></span><span class=""mat-mdc-focus-indicator""></span><span class=""mat-mdc-button-touch-target""></span></button><!----><!----><button _ngcontent-ng-c3763752656 mat-stroked-button color=""primary"" mat-ripple-loader-uninitialized mat-ripple-loader-class-name=""mat-mdc-button-ripple"" class=""mdc-button mdc-button--outlined mat-mdc-outlined-button mat-primary _mat-animation-noopable mat-mdc-button-base"" ngh=""6""><span class=""mat-mdc-button-persistent-ripple mdc-button__ripple""></span><mat-icon _ngcontent-ng-c3763752656 role=""img"" class=""mat-icon notranslate mr-2 material-icons mat-ligature-font mat-icon-no-color"" aria-hidden=""true"" data-mat-icon-type=""font"" ngh=""0"">mail</mat-icon><span class=""mdc-button__label""><span _ngcontent-ng-c3763752656>pošalji mejl</span></span><span class=""mat-mdc-focus-indicator""></span><span class=""mat-mdc-button-touch-target""></span></button></div></div></div></div><!----></app-vertical-info><!----><!----><!----><!----><!----><!----><!----></app-author-info><hr _ngcontent-ng-c3151048826><!----><section _ngcontent-ng-c3151048826 data-cy=""cashLoanDiv"" class=""py-4""><h2 _ngcontent-ng-c3151048826 class=""mat-headline-5"">Keš krediti</h2><mat-accordion _ngcontent-ng-c3151048826 class=""mat-accordion""><mat-expansion-panel _ngcontent-ng-c3151048826 class=""mat-expansion-panel ng-tns-c1859850774-2 mat-expanded _mat-animation-noopable mat-expansion-panel-spacing ng-star-inserted"" ngh=""22""><mat-expansion-panel-header _ngcontent-ng-c3151048826 role=""button"" class=""mat-expansion-panel-header mat-focus-indicator ng-tns-c2690051721-3 ng-tns-c1859850774-2 mat-expanded mat-expansion-toggle-indicator-after _mat-animation-noopable ng-star-inserted"" id=""mat-expansion-panel-header-4172"" tabindex=""0"" aria-controls=""cdk-accordion-child-4172"" aria-expanded=""true"" aria-disabled=""false"" ngh=""23""><span class=""mat-content ng-tns-c2690051721-3""><mat-panel-title _ngcontent-ng-c3151048826 class=""mat-expansion-panel-header-title font-bold uppercase text-green-500 ng-tns-c2690051721-3""> Pogledaj i ponudu keš kredita </mat-panel-title></span><span class=""mat-expansion-indicator ng-tns-c2690051721-3 ng-trigger ng-trigger-indicatorRotate ng-star-inserted"" style=""transform: rotate(180deg);""></span><!----></mat-expansion-panel-header><div role=""region"" class=""mat-expansion-panel-content ng-tns-c1859850774-2 ng-trigger ng-trigger-bodyExpansion"" id=""cdk-accordion-child-4172"" aria-labelledby=""mat-expansion-panel-header-4172"" style=""height: *;""><div class=""mat-expansion-panel-body ng-tns-c1859850774-2""><!----><app-cash-credit-calculator _ngcontent-ng-c3151048826 _nghost-ng-c1647687278 class=""ng-star-inserted"" style ngh=""20""><form _ngcontent-ng-c1647687278 novalidate class=""ng-untouched ng-pristine ng-valid""><app-number-field _ngcontent-ng-c1647687278 label=""Iznos kredita"" placeholder=""Unesi iznos kredita"" data-cy=""cashCreditPrice"" _nghost-ng-c3646848609 ngh=""17""><mat-form-field _ngcontent-ng-c3646848609 data-cy=""numberFormField"" class=""mat-mdc-form-field w-full ng-tns-c1205077789-4 mat-mdc-form-field-type-mat-input mat-mdc-form-field-has-icon-suffix mat-form-field-no-animations mat-form-field-appearance-outline mat-primary ng-untouched ng-pristine ng-valid ng-star-inserted"" ngh=""16""><!----><div class=""mat-mdc-text-field-wrapper mdc-text-field ng-tns-c1205077789-4 mdc-text-field--outlined""><!----><div class=""mat-mdc-form-field-flex ng-tns-c1205077789-4""><div matformfieldnotchedoutline class=""mdc-notched-outline ng-tns-c1205077789-4 mdc-notched-outline--notched mdc-notched-outline--upgraded ng-star-inserted"" ngh=""0""><div class=""mdc-notched-outline__leading""></div><div class=""mdc-notched-outline__notch""><label matformfieldfloatinglabel class=""mdc-floating-label mat-mdc-floating-label ng-tns-c1205077789-4 mdc-floating-label--float-above ng-star-inserted"" id=""mat-mdc-form-field-label-30272"" for=""mat-input-7321""><mat-label _ngcontent-ng-c3646848609 class=""ng-tns-c1205077789-4 ng-star-inserted"">Iznos kredita</mat-label><!----><span aria-hidden=""true"" class=""mat-mdc-form-field-required-marker mdc-floating-label--required ng-tns-c1205077789-4 ng-star-inserted""></span><!----></label><!----><!----><!----></div><div class=""mdc-notched-outline__trailing""></div></div><!----><!----><!----><div class=""mat-mdc-form-field-infix ng-tns-c1205077789-4""><!----><input _ngcontent-ng-c3646848609 matinput type=""number"" autocomplete=""off"" class=""mat-mdc-input-element ng-tns-c1205077789-4 mat-input-server mat-mdc-form-field-input-control mdc-text-field__input ng-untouched ng-pristine ng-valid"" value=""50000"" placeholder=""Unesi iznos kredita"" id=""mat-input-7321"" required aria-invalid=""false"" aria-required=""true"" min=""0"" max=""3000000""></div><!----><div class=""mat-mdc-form-field-icon-suffix ng-tns-c1205077789-4 ng-star-inserted""><span _ngcontent-ng-c3646848609 matsuffix class=""px-2 ng-tns-c1205077789-4"">RSD</span></div><!----></div><!----></div><div class=""mat-mdc-form-field-subscript-wrapper mat-mdc-form-field-bottom-align ng-tns-c1205077789-4""><!----><div class=""mat-mdc-form-field-hint-wrapper ng-tns-c1205077789-4 ng-trigger ng-trigger-transitionMessages ng-star-inserted"" style=""opacity: 1; transform: translateY(0%);""><!----><div class=""mat-mdc-form-field-hint-spacer ng-tns-c1205077789-4""></div></div><!----></div></mat-form-field></app-number-field><div _ngcontent-ng-c1647687278 class=""flex justify-between""><p _ngcontent-ng-c1647687278 class=""uppercase"">Period otplate</p><p _ngcontent-ng-c1647687278 class=""uppercase"">13 meseci</p></div><mat-slider _ngcontent-ng-c1647687278 step=""1"" data-cy=""cashCreditSlider"" class=""mat-mdc-slider mdc-slider mat-primary mdc-slider--discrete _mat-animation-noopable"" ngh=""19""><input _ngcontent-ng-c1647687278 type=""range"" matsliderthumb formcontrolname=""period"" class=""mdc-slider__input ng-untouched ng-pristine ng-valid"" style=""padding: 0px; width: calc(100% + 48px); left: -24px;"" step=""1"" min=""6"" max=""71"" value=""13"" aria-valuetext=""13""><div class=""mdc-slider__track""><div class=""mdc-slider__track--inactive""></div><div class=""mdc-slider__track--active""><div class=""mdc-slider__track--active_fill"" style=""left: 0px; right: auto; transform-origin: left; transform: scaleX(0);""></div></div><!----></div><!----><mat-slider-visual-thumb class=""mdc-slider__thumb mat-mdc-slider-visual-thumb mdc-slider__thumb--short-value"" style=""transform: translateX(NaNpx);"" ngh=""18""><div class=""mdc-slider__value-indicator-container ng-star-inserted""><div class=""mdc-slider__value-indicator""><span class=""mdc-slider__value-indicator-text"">13</span></div></div><!----><div class=""mdc-slider__thumb-knob""></div><div matripple class=""mat-ripple mat-mdc-focus-indicator""></div></mat-slider-visual-thumb></mat-slider></form></app-cash-credit-calculator><app-cash-offers _ngcontent-ng-c3151048826 prefixid=""ad_details_"" _nghost-ng-c2972256473 class=""ng-star-inserted"" style ngh=""21""><div _ngcontent-ng-c2972256473 waintersectionobserver waintersectionthreshold=""0.5"" class=""space-y-4""><div _ngcontent-ng-c2972256473 class=""card-container ng-star-inserted""><!----><span _ngcontent-ng-c2972256473 class=""ng-star-inserted""><div _ngcontent-ng-c2972256473 class=""rounded border-l-[5px] border-green-500 bg-gray-50 p-4 shadow hover:shadow-md""><div _ngcontent-ng-c2972256473 class=""flex w-full flex-wrap items-center justify-center gap-4 [@media(min-width:390px)]:justify-between""><a _ngcontent-ng-c2972256473 target=""_blank"" title=""nlb"" id=""ad_details_kes_krediti-nlb"" href=""https://www.nlbkb.rs/stanovnistvo/krediti/kes-krediti?utm_source=4zida.rs&utm_medium=kalkulator&utm_campaign=&utm_term""><div _ngcontent-ng-c2972256473 class=""bank-image""><picture _ngcontent-ng-c2972256473 class=""ng-star-inserted""><source _ngcontent-ng-c2972256473 type=""image/webp"" srcset=""https://cdn.4zida.rs/assets/images/logos/banka-nlb-logo.webp""><source _ngcontent-ng-c2972256473 type=""image/png"" srcset=""https://cdn.4zida.rs/assets/images/logos/banka-nlb-logo.webp""><img _ngcontent-ng-c2972256473 width=""170"" height=""65"" alt=""NLB Komercijalna Banka Logo"" loading=""lazy"" fetchpriority=""auto"" ng-img=""true"" src=""https://cdn.4zida.rs/assets/images/logos/banka-nlb-logo.webp""></picture><!----></div></a><div _ngcontent-ng-c2972256473 class=""flex flex-col items-end gap-2""><div _ngcontent-ng-c2972256473 class=""text-md text-right font-bold text-green-500 desk:text-2xl""> od 4.120 RSD </div><a _ngcontent-ng-c2972256473 target=""_blank"" class=""link-primary desk:text-md text-right text-xs"" href=""https://www.nlbkb.rs/stanovnistvo/krediti/kes-krediti?utm_source=4zida.rs&utm_medium=kalkulator&utm_campaign=&utm_term""> Reprezentativni primer </a></div></div></div></span><!----><!----></div><!----><!----><!----><div _ngcontent-ng-c2972256473 class=""card-container ng-star-inserted""><!----><span _ngcontent-ng-c2972256473 class=""ng-star-inserted""><div _ngcontent-ng-c2972256473 class=""rounded border-l-[5px] border-green-500 bg-gray-50 p-4 shadow hover:shadow-md""><div _ngcontent-ng-c2972256473 class=""flex w-full flex-wrap items-center justify-center gap-4 [@media(min-width:390px)]:justify-between""><a _ngcontent-ng-c2972256473 target=""_blank"" title=""otp"" id=""ad_details_kes_krediti_otp"" href=""https://www.otpbanka.rs/kes-kredit/?utm_source=partner_website&utm_medium=kalkulator&utm_campaign=partner_website&utm_content=4_zida&utm_term=&utm_id=12351&crmc=49e1b6f2-75d7-ff7f-63be-63f73ab698eb&crm_campaign=CCC_ONLINE_KES_KREDITI_RTDE_SLS""><div _ngcontent-ng-c2972256473 class=""bank-image""><picture _ngcontent-ng-c2972256473 class=""ng-star-inserted""><source _ngcontent-ng-c2972256473 type=""image/webp"" srcset=""https://cdn.4zida.rs/assets/images/logos/banka-otp-logo.webp""><source _ngcontent-ng-c2972256473 type=""image/png"" srcset=""https://cdn.4zida.rs/assets/images/logos/banka-otp-logo.png""><img _ngcontent-ng-c2972256473 width=""170"" height=""65"" alt=""OTP Banka Logo"" loading=""lazy"" fetchpriority=""auto"" ng-img=""true"" src=""https://cdn.4zida.rs/assets/images/logos/banka-otp-logo.png""></picture><!----></div></a><div _ngcontent-ng-c2972256473 class=""flex flex-col items-end gap-2""><div _ngcontent-ng-c2972256473 class=""text-md text-right font-bold text-green-500 desk:text-2xl""> od 4.144 RSD </div><a _ngcontent-ng-c2972256473 target=""_blank"" class=""link-primary desk:text-md text-right text-xs"" href=""https://www.otpbanka.rs/kes-kredit/?utm_source=partner_website&utm_medium=kalkulator&utm_campaign=partner_website&utm_content=4_zida&utm_term=&utm_id=12351&crmc=49e1b6f2-75d7-ff7f-63be-63f73ab698eb&crm_campaign=CCC_ONLINE_KES_KREDITI_RTDE_SLS""> Reprezentativni primer </a></div></div></div></span><!----><!----></div><!----><!----><!----><!----><!----><!----><!----><!----><!----><!----><!----><!----><!----><!----><!----><!----><!----><!----><!----><!----></div></app-cash-offers><div _ngcontent-ng-c3151048826 class=""text-center ng-star-inserted"" style><a _ngcontent-ng-c3151048826 mat-button color=""accent"" class=""mt-4 mdc-button mat-mdc-button mat-accent _mat-animation-noopable mat-mdc-button-base"" mat-ripple-loader-uninitialized mat-ripple-loader-class-name=""mat-mdc-button-ripple"" href=""/kreditna-sposobnost"" aria-disabled=""false"" ngh=""11""><span class=""mat-mdc-button-persistent-ripple mdc-button__ripple""></span><span class=""mdc-button__label""> Proveri da li si kreditno sposoban OVDE </span><span class=""mat-mdc-focus-indicator""></span><span class=""mat-mdc-button-touch-target""></span></a></div><!----></div></div></mat-expansion-panel><!----></mat-accordion></section><div _ngcontent-ng-c3151048826 data-cy=""priceStatsDiv""><!----><!----></div><!----><!----></main><!----></div><div _ngcontent-ng-c3151048826 class=""mx-auto max-w-container""><p _ngcontent-ng-c3151048826 class=""!mt-8 text-sm text-gray-600"">Građevinsko zemljište za prodaju, Kelebija, 31 a, uknjiženo.","Građevinsko zemljište na prodaju, Eleka Benedeka bb, 5.000€, 31a - 4zida",2024-03-07
