,link,Tip,PovrÅ¡ina,UknjiÅ¾enost,Å ifra oglasa,Oglas aÅ¾uriran,price,street,address,description,title,end_date
100,https://www.4zida.rs/prodaja-placeva/gradske-lokacije-bela-palanka/gradjevinsko-zemljiste/6524380daeb42402b609b41d,graÄ‘evinsko zemljiÅ¡te ,450 a ,uknjiÅ¾eno ,p,pre 4 meseca ,400.000,Crvena Reka,"Gradske lokacije, Bela Palanka","<h2 _ngcontent-ng-c3151048826 class=""mat-headline-5"">Opis oglasa</h2><div _ngcontent-ng-c3151048826 class=""prose max-h-64 overflow-hidden text-gray-800 ng-star-inserted""><p>Na prodaju plantaÅ¾a borovnica locirana u blizini  asfaltiranog puta, na velikom razvijenom i organizovanom poljoprivrednom zemljiÅ¡tu  povrÅ¡ine 4,5 h ( 30 km od NiÅ¡a), obezbeÄ‘eno video nadzorom. PlantaÅ¾a poseduje 16 000 biljaka, osiguranih kod osiguravajuÄ‡e kuÄ‡e, starosti 3 godine. Prihod u ovoj godini je bio 29 tona borovnica ili 1,8 kilograma po biljci, oÄekivani prinos u narednoj, 4. godini bi bio 2-3kg, a u 5-oj godini oÄekivani rod po stablu bi bio 4-6kg. Plantaza je  ograÄ‘ena i poseduje odgovarajuÄ‡e zaÅ¡titne mere od pristupa domaÄ‡ih i divljih Å¾ivotinja  kao i stubove za postavljanje zaÅ¡titne protivgradne mreÅ¾e. Za navodnjavanje se koristi voda iz 4 jezera, (u susedstvu ove plantaÅ¾e nalaze se joÅ¡ 3) od toga jedno, koje je ispred kuÄ‡e, pripada imanju, a ostala 3 susednim plantaÅ¾ama, tako da su zalihe vode dovoljne za navodnjavanje i u najsuÅ¡nijem periodu godine.  Sistem za navodnjavanje je fertigator ,kap po kap, sa automatskim hranjenjem stabala kako bi se obezbedila optimalna ishrana biljaka, poboljÅ¡ao njihov rast i prinos. Sistem navodnjavanja i prihrane prati i kontroliÅ¡e raÄunar 24h svakodnevno iz tehniÄke sobe u kojoj su rezervoari sa substratima za prihranu. Na plantaÅ¾i je montaÅ¾na kuÄ‡a-brvnara, za ugodan boravak, Å¾ivot i rad na imanju, povrÅ¡ine 78 m2, sa velikim dnevnim  boravkom, trpezarijom i kuhinjom, dve spavaÄ‡e sobe, kupatilom i verandom. U sklopu kuÄ‡e nalazi se tehniÄka soba. Struja, voda, internet. Na imanju se nalazi i pomoÄ‡ni objekat za drÅ¾anje maÅ¡ina i alata. Predmet prodaje uz plantaÅ¾u je i traktor za obradu iste. BuduÄ‡i vlasnik, kupovinom ove plantaÅ¾e stiÄe pravo vlasniÅ¡tva na hladnjaÄi, koja opskrbljuje sve plantaÅ¾e, u udelu od 4/7.  Sve uknjiÅ¾eno,  Äisto vlasniÅ¡tvo, privatna svojina 1 kroz 1. Ovo je samo deo naÅ¡e ponude, ovu kao i druge nekretnine moÅ¾ete pogledati na naÅ¡em sajtu.","GraÄ‘evinsko zemljiÅ¡te na prodaju, Crvena Reka, 400.000â‚¬, 450a - 4zida",2024-03-02
101,https://www.4zida.rs/prodaja-placeva/krnjaca-palilula-opstina-beograd/gradjevinsko-zemljiste/6431789313e1405ad003d60e,graÄ‘evinsko zemljiÅ¡te ,86 a ,uknjiÅ¾eno ,17898 ,pre 1 mesec ,473.000,KrnjaÄa,"KrnjaÄa, Palilula opÅ¡tina, Beograd","<h2 _ngcontent-ng-c3151048826 class=""mat-headline-5"">Opis oglasa</h2><div _ngcontent-ng-c3151048826 class=""prose max-h-64 overflow-hidden text-gray-800 ng-star-inserted""><p>Prodaje se 86 ari zemljiÅ¡ta u KrnjaÄi, na 100-ak metara od fabrike Drenik.<br>Dimenzije placa cca 23mÃ—370m, direktan pristup sa asfaltirane saobraÄ‡ajnice.<br>Plac je uknjiÅ¾en i pripada industrijskoj zoni.<br>Blizina auto puta Beograd-PanÄevo i iskljuÄenja ka deonici BorÄa-Zemun.<br>Prisutna sva potrebna urbana infrastruktura.","GraÄ‘evinsko zemljiÅ¡te na prodaju, KrnjaÄa, 473.000â‚¬, 86a - 4zida",2024-03-02
102,https://www.4zida.rs/prodaja-placeva/malca-okolne-lokacije-nis/gradjevinsko-zemljiste/64536a7338bb5eae5408cb8b,graÄ‘evinsko zemljiÅ¡te ,166 a ,uknjiÅ¾eno ,p,pre 9 meseci ,340.000,MalÄa,"MalÄa, Okolne lokacije, NiÅ¡","<h2 _ngcontent-ng-c3151048826 class=""mat-headline-5"">Opis oglasa</h2><div _ngcontent-ng-c3151048826 class=""prose max-h-64 overflow-hidden text-gray-800 ng-star-inserted""><p>Na prodaju plac u neposrednoj blizini Malcanske petlje.								","GraÄ‘evinsko zemljiÅ¡te na prodaju, MalÄa, 340.000â‚¬, 166a - 4zida",2024-03-02
103,https://www.4zida.rs/prodaja-placeva/trosarina-medijana-gradske-lokacije-nis/gradjevinsko-zemljiste/63662a2ddda34592700a96b0,,,,,,,,,,"Prodaja placeva TroÅ¡arina, Medijana, Gradske lokacije, NiÅ¡, GraÄ‘evinsko zemljiÅ¡te - 4zida",2024-03-02
104,https://www.4zida.rs/prodaja-placeva/sibnica-sopot-opstina-beograd/gradjevinsko-zemljiste/63d04b0f241f362ef404137a,,,,,,,,,,"GraÄ‘evinsko zemljiÅ¡te na prodaju, Pukovnika Å½ike RadovanoviÄ‡a, 18.500â‚¬, 31a - 4zida",2024-03-02
105,https://www.4zida.rs/prodaja-placeva/makis-cukarica-cukarica-opstina-beograd/gradjevinsko-zemljiste/659689fb72167e68fa039885,graÄ‘evinsko zemljiÅ¡te ,128 a ,,1763 ,pre 1 mesec ,520.000,MakiÅ¡,"MakiÅ¡, ÄŒukarica, ÄŒukarica opÅ¡tina, Beograd","<h2 _ngcontent-ng-c3151048826 class=""mat-headline-5"">Opis oglasa</h2><div _ngcontent-ng-c3151048826 class=""prose max-h-64 overflow-hidden text-gray-800 ng-star-inserted""><p>Gradsko graÄ‘evinsko zemljiÅ¡te 128 ari ( 1,28 ha). MoguÄ‡nost kupovine do 5ha. Pogodno za komercijalnu gradnju.","GraÄ‘evinsko zemljiÅ¡te na prodaju, MakiÅ¡, 520.000â‚¬, 128a - 4zida",2024-03-02
106,https://www.4zida.rs/prodaja-placeva/petrovac-gradske-lokacije-kragujevac/gradjevinsko-zemljiste/630f5eb22203c39fc90fb507,graÄ‘evinsko zemljiÅ¡te ,13.53 a ,,p,pre 10 meseci ,125.000,Internacionalnih brigada,"Petrovac, Gradske lokacije, Kragujevac","<h2 _ngcontent-ng-c3151048826 class=""mat-headline-5"">Opis oglasa</h2><div _ngcontent-ng-c3151048826 class=""prose max-h-64 overflow-hidden text-gray-800 ng-star-inserted""><p>Na prodaju plac povrÅ¡ine 13,5 ari u Petrovcu. Na placu se nalazi kuÄ‡a starije gradnje, kao i pomoÄ‡ni objekti. Ceo plac je ograÄ‘en. Objekti upisani i legalizovani. Svi prikljuÄci  su sprovedeni. Vlasnik 1/1.<br>Za sve informacije i razgledanje stojimo vam na raspolaganju, radnim danima od 09-19h i subotom od 09-17h. Ovu i druge nekretnine sa veÄ‡im brojem fotografija moÅ¾ete pogledati na naÅ¡em sajtu: bulevarnekretnine.rs, kontakt: info@bulevarnekretnine.rs, usluga besplatna. ÄŒekamo Vas. Telefon 034/330808 i 060/0544253. Bulevar Nekretnine 034, Kragujevac, broj u registru posrednika: 1278.","GraÄ‘evinsko zemljiÅ¡te na prodaju, Internacionalnih brigada, 125.000â‚¬, 13a - 4zida",2024-03-02
107,https://www.4zida.rs/prodaja-placeva/jovanovac-okolne-lokacije-kragujevac/gradjevinsko-zemljiste/6320664e3ec8cc588b0a4930,graÄ‘evinsko zemljiÅ¡te ,41.19 a ,,p,pre 10 meseci ,170.000,Reka,"Jovanovac, Okolne lokacije, Kragujevac","<h2 _ngcontent-ng-c3151048826 class=""mat-headline-5"">Opis oglasa</h2><div _ngcontent-ng-c3151048826 class=""prose max-h-64 overflow-hidden text-gray-800 ng-star-inserted""><p>Plac je pogodan za gradnju poslovnog   objekata. Ispred ovog placa se nalazi industrijska hala i ovaj deo je predviÄ‘en za proÅ¡irenje industrijske zone.Nalazi se u blizini reke UgljeÅ¡nice pored Äijeg korita je predviÄ‘eno spajanje ovog dela sa auto putem.<br>Plac se vodi kao poljoprivredno zemljiÅ¡te i potpuno je ravan.<br> Ovo je topla preporuka Bulevar grupe. Za sve informacije i razgledanje stojimo vam na raspolaganju, radnim danom od 09 do 19h i subotom od 09 do 17h.  ÄŒekamo Vas.","GraÄ‘evinsko zemljiÅ¡te na prodaju, Reka, 170.000â‚¬, 41a - 4zida",2024-03-02
108,https://www.4zida.rs/prodaja-placeva/miseluk-petrovaradin-gradske-lokacije-novi-sad/gradjevinsko-zemljiste/653fa175cfff04e1730fdaa1,,,,,,,,,,"GraÄ‘evinsko zemljiÅ¡te na prodaju, MiÅ¡eluk BB, 150.000â‚¬, 5a - 4zida",2024-03-02
109,https://www.4zida.rs/prodaja-placeva/fruska-gora/gradjevinsko-zemljiste/65c11eb68e71c5570308c9f4,graÄ‘evinsko zemljiÅ¡te ,26 a ,uknjiÅ¾eno ,3153 ,pre 15 dana ,22.000,KruÅ¡edol,FruÅ¡ka Gora,,"GraÄ‘evinsko zemljiÅ¡te na prodaju, KruÅ¡edol, 22.000â‚¬, 26a - 4zida",2024-03-02
110,https://www.4zida.rs/prodaja-placeva/palilula-gradske-lokacije-nis/gradjevinsko-zemljiste/6397375bd4250c7b47023f7d,graÄ‘evinsko zemljiÅ¡te ,15.51 a ,uknjiÅ¾eno ,p,pre 10 meseci ,16.000,BabiÄkog odreda,"Palilula, Gradske lokacije, NiÅ¡","<h2 _ngcontent-ng-c3151048826 class=""mat-headline-5"">Opis oglasa</h2><div _ngcontent-ng-c3151048826 class=""prose max-h-64 overflow-hidden text-gray-800 ng-star-inserted""><p>Na prodaju plac na Paliluli, 1551 m2. Plac je graÄ‘evinsko zemljiÅ¡te i nalazi se u viÅ¡em delu Palilule odakle se pruÅ¾a lep pogled na grad. Po lokacijskim uslovima, dozvoljena je gradnja poslovnih objekata, trgovina, ugostiteljstvo, infrastrukturni objekti do pet metara visine i do 300 m2 povrÅ¡ine u osnovi. UknjiÅ¾en je, svojina, vlasniÅ¡tvo 1 kroz 1. Ovo je samo deo naÅ¡e ponude, za viÅ¡e informacija, stojimo vam na raspolaganju.","GraÄ‘evinsko zemljiÅ¡te na prodaju, BabiÄkog odreda, 16.000â‚¬, 15a - 4zida",2024-03-02
111,https://www.4zida.rs/prodaja-placeva/radusa-okolne-lokacije-ub/gradjevinsko-zemljiste/655fe7993b53d8760302748e,graÄ‘evinsko zemljiÅ¡te ,35.73 a ,uknjiÅ¾eno ,ID,pre 27 dana ,12.000,RaduÅ¡a,"RaduÅ¡a, Okolne lokacije, Ub","<h2 _ngcontent-ng-c3151048826 class=""mat-headline-5"">Opis oglasa</h2><div _ngcontent-ng-c3151048826 class=""prose max-h-64 overflow-hidden text-gray-800 ng-star-inserted""><p>Na putu za Å abac prodaje se plac povrÅ¡ine 35.73 ari, na najviÅ¡oj taÄki u selu RaduÅ¡a . Na oko 80 metara postoje podzemne vode. Dobra lokacija (pored samog puta) pogodna je perionicu, garaÅ¾u, parking kamiona, skladiÅ¡te, restoran. U letnjoj sezoni tim putem prodje 6000 vozila dnevno, Å¡to daje veliki broj moguÄ‡nosti kako iskoritstit ovaj plac. Plac je udaljen oko 35 km od Å apca, 25 km od Valjeva, 6 km do Koceljeve, i 25 km od auto puta MiloÅ¡ Veliki. Cena: 12000 EUR Agencijska provizija je 1000 EUR od dogovorene kupoprodajne cene i plaÄ‡a se prilikom potpisivanja Predugovora (Ugovora) Za sve infomacije i zakazivanje termina za gledanje, kontaktirajte naÅ¡eg agenta: Jelisaveta Prodanov, licencirani agent za nekretnine Redni broj u registru posrednika 1719 mob.br. +381 64 133 60 08","GraÄ‘evinsko zemljiÅ¡te na prodaju, RaduÅ¡a, 12.000â‚¬, 35a - 4zida",2024-03-02
112,https://www.4zida.rs/prodaja-placeva/niska-banja-gradske-lokacije-nis/gradjevinsko-zemljiste/64b31d5f865fc9a4c207d5f4,graÄ‘evinsko zemljiÅ¡te ,1515 a ,uknjiÅ¾eno ,9833 ,pre 7 meseci ,53.000,NiÅ¡ka Banja,"NiÅ¡ka Banja, Gradske lokacije, NiÅ¡","<h2 _ngcontent-ng-c3151048826 class=""mat-headline-5"">Opis oglasa</h2><div _ngcontent-ng-c3151048826 class=""prose max-h-64 overflow-hidden text-gray-800 ng-star-inserted""><p>ZemljiÅ¡te, NiÅ¡ka Banja, 15 ari<br>U ponudi fenomenalan plac povrÅ¡ine 15 ari na putu za JelaÅ¡nicu u NiÅ¡koj Banji. U pitanju je gradsko - graÄ‘evinsko zemljiÅ¡te, front je oko 18m, a dubina oko 84m. Nalazi se do glavnog puta i predviÄ‘en je za izgradnju sportskih terena. U blizini su prikljuÄci za struju, vodu i kanalizaciju.","GraÄ‘evinsko zemljiÅ¡te na prodaju, NiÅ¡ka Banja, 53.000â‚¬, 1515a - 4zida",2024-03-02
113,https://www.4zida.rs/prodaja-placeva/popovic-sopot-opstina-beograd/gradjevinsko-zemljiste/6418b2f64afee0c9ef043b73,graÄ‘evinsko zemljiÅ¡te ,52 a ,uknjiÅ¾eno ,1520 ,pre 10 meseci ,57.000,PopoviÄ‡,"PopoviÄ‡, Sopot opÅ¡tina, Beograd","<h2 _ngcontent-ng-c3151048826 class=""mat-headline-5"">Opis oglasa</h2><div _ngcontent-ng-c3151048826 class=""prose max-h-64 overflow-hidden text-gray-800 ng-star-inserted""><p>Plac se nalazi oko 150m od glavnog puta.<br>U blizini su i struja i voda.<br>UknjiÅ¾eno! Agencijska provizija 2%","GraÄ‘evinsko zemljiÅ¡te na prodaju, PopoviÄ‡, 57.000â‚¬, 52a - 4zida",2024-03-02
114,https://www.4zida.rs/prodaja-placeva/bolec-grocka-opstina-beograd/gradjevinsko-zemljiste/648c0a0d50dabb5525084589,,,,,,,,,,"Prodaja placeva BoleÄ, Grocka opÅ¡tina, Beograd, GraÄ‘evinsko zemljiÅ¡te - 4zida",2024-03-02
115,https://www.4zida.rs/prodaja-placeva/rudine-okolne-lokacije-zlatibor/gradjevinsko-zemljiste/6419fcf8ea8ce698500da06d,graÄ‘evinsko zemljiÅ¡te ,59.8 a ,uknjiÅ¾eno ,,pre 18 sati ,300.000,Rudine,"Rudine, Okolne lokacije, Zlatibor","<h2 _ngcontent-ng-c3151048826 class=""mat-headline-5"">Opis oglasa</h2><div _ngcontent-ng-c3151048826 class=""prose max-h-64 overflow-hidden text-gray-800 ng-star-inserted""><p>Plac se nalazi u Tic polju, na putu za Rudine, 4.6km od centra Zlatibora. Nalazi se ispod Springs teniskih terena.","GraÄ‘evinsko zemljiÅ¡te na prodaju, Rudine, 300.000â‚¬, 59a - 4zida",2024-03-02
116,https://www.4zida.rs/prodaja-placeva/rakovac-okolne-lokacije-beocin/gradjevinsko-zemljiste/62c59974ba44d43cfa05df38,graÄ‘evinsko zemljiÅ¡te ,54.18 a ,uknjiÅ¾eno ,1870 ,pre 10 meseci ,31.000,Rakovac,"Rakovac, Okolne lokacije, BeoÄin","<h2 _ngcontent-ng-c3151048826 class=""mat-headline-5"">Opis oglasa</h2><div _ngcontent-ng-c3151048826 class=""prose max-h-64 overflow-hidden text-gray-800 ng-star-inserted""><p>Na prodaju parcele 2656(4534m2) i 2657(8844m2).Ukupno 5418m2. PLac sa pogledom na bgrad,jedn deo pod Å¡umom,jedan  pod voÄ‡em, a izmedju je livada.Vredi pogledati","GraÄ‘evinsko zemljiÅ¡te na prodaju, Rakovac, 31.000â‚¬, 54a - 4zida",2024-03-02
117,https://www.4zida.rs/prodaja-placeva/donje-medjurovo-okolne-lokacije-nis/gradjevinsko-zemljiste/606d9e0a19bbff1a1a6253c3,graÄ‘evinsko zemljiÅ¡te ,51 a ,,1382 ,pre 10 meseci ,160.000,Donje MeÄ‘urovo,"Donje MeÄ‘urovo, Okolne lokacije, NiÅ¡","<h2 _ngcontent-ng-c3151048826 class=""mat-headline-5"">Opis oglasa</h2><div _ngcontent-ng-c3151048826 class=""prose max-h-64 overflow-hidden text-gray-800 ng-star-inserted""><p>Plac Donje Medjurovo 51 ar. Gradsko gradjevinsko zemljiste, ima sve prikljucke struja, voda, kanalizacija. Ucrtan put. Industrijsa zona trenutno je zemljani put. Za vise informacija kontaktirajte Agenciju LIBO NEKRETNINE NIS, na telefone 065/222-3922,065/3303 703, 065/8833-446, 060/7513-377, Reg. Posredika broj 495.","GraÄ‘evinsko zemljiÅ¡te na prodaju, Donje MeÄ‘urovo, 160.000â‚¬, 51a - 4zida",2024-03-02
118,https://www.4zida.rs/prodaja-placeva/vinogradi-gradske-lokacije-kragujevac/gradjevinsko-zemljiste/650020a8539176db80097bb9,,,,,,,,,,"Prodaja placeva Vinogradi, Gradske lokacije, Kragujevac, GraÄ‘evinsko zemljiÅ¡te - 4zida",2024-03-02
119,https://www.4zida.rs/prodaja-placeva/paragovo-sremska-kamenica-gradske-lokacije-novi-sad/gradjevinsko-zemljiste/64b5264b1c54ffa21500ba89,graÄ‘evinsko zemljiÅ¡te ,8.2 a ,uknjiÅ¾eno ,7000056 ,pre 7 meseci ,168.500,Paragovo,"Paragovo, Sremska Kamenica, Gradske lokacije, Novi Sad","<h2 _ngcontent-ng-c3151048826 class=""mat-headline-5"">Opis oglasa</h2><div _ngcontent-ng-c3151048826 class=""prose max-h-64 overflow-hidden text-gray-800 ng-star-inserted""><p>Sremska Kamenica, Paragovo. Plac u graÄ‘evinskom podruÄju. Struja, voda, gas. Asfalt na 5m od placa. Front 39m. UknjiÅ¾en. (Vinson nekretnine, Novi Sad, Reg. br. posrednika: 1085)","GraÄ‘evinsko zemljiÅ¡te na prodaju, Paragovo, 168.500â‚¬, 8a - 4zida",2024-03-02
120,https://www.4zida.rs/prodaja-placeva/ugrinovci-zemun-opstina-beograd/gradjevinsko-zemljiste/63231a30a744ccc511065c9d,graÄ‘evinsko zemljiÅ¡te ,81.04 a ,uknjiÅ¾eno ,1205 ,pre 10 meseci ,154.000,Krivajska,"Ugrinovci, Zemun opÅ¡tina, Beograd","<h2 _ngcontent-ng-c3151048826 class=""mat-headline-5"">Opis oglasa</h2><div _ngcontent-ng-c3151048826 class=""prose max-h-64 overflow-hidden text-gray-800 ng-star-inserted""><p>Prodaje se zemljiste ukupne povrsine 81.04ara u neposrednoj blizini naselja Busije u Ugrinovcima, a u ulici Krivajska<br>Uknjizeno 1/1 na vlasnika<br>PosredniÄka naknada je regulisana u skladu sa OpÅ¡tim uslovima poslovanja EURO-WINNER NEKRETNINE D.O.O.","GraÄ‘evinsko zemljiÅ¡te na prodaju, Krivajska, 154.000â‚¬, 81a - 4zida",2024-03-02
121,https://www.4zida.rs/prodaja-placeva/zirovnica-okolne-lokacije-batocina/gradjevinsko-zemljiste/63692f17e89ad9e22b0e239b,graÄ‘evinsko zemljiÅ¡te ,15.8 a ,,p,pre 10 meseci ,18.000,Å½irovnica,"Å½irovnica, Okolne lokacije, BatoÄina","<h2 _ngcontent-ng-c3151048826 class=""mat-headline-5"">Opis oglasa</h2><div _ngcontent-ng-c3151048826 class=""prose max-h-64 overflow-hidden text-gray-800 ng-star-inserted""><p>Na prodaju plac pored auto puta u Å½irovnici,  povrÅ¡ine 15,80 ari. Nalazi se na oko 500 m udaljenosti od kruÅ¾nog toka. Plac je ograÄ‘en, ima direktan ulaz sa lokalnog puta, poseduje bunarsku vodu,  kanalizacionu mreÅ¾u, dostupan  prikljuÄak za struju. Plac je registrovan kao graÄ‘evinsko zemljiÅ¡te i na njemu se nalazi stambeni objekat povrÅ¡ine 100 m2  tri sobe, dva kupatila  i garaÅ¾a. Pogodan  za razne namene i  poslovne aktivnosti.  Za sve informacije i razgledanje stojimo vam na raspolaganju, radnim danima od 09-19h i subotom od 09-17h. Ovu i druge nekretnine sa veÄ‡im brojem fotografija moÅ¾ete pogledati na naÅ¡em sajtu: bulevarnekretnine.rs, kontakt: info@bulevarnekretnine.rs, usluga besplatna. ÄŒekamo Vas. Telefon 034/330808 i 060/0544253. Bulevar Nekretnine 034, Kragujevac, broj u registru posrednika: 1278.","GraÄ‘evinsko zemljiÅ¡te na prodaju, Å½irovnica, 18.000â‚¬, 15a - 4zida",2024-03-02
122,https://www.4zida.rs/prodaja-placeva/zeleno-brdo-zvezdara-opstina-beograd/gradjevinsko-zemljiste/62f18c015c6fa340440270ad,graÄ‘evinsko zemljiÅ¡te ,5 a ,uknjiÅ¾eno ,61470 ,pre 10 meseci ,110.000,Ä†uprijska,"Zeleno Brdo, Zvezdara opÅ¡tina, Beograd","<h2 _ngcontent-ng-c3151048826 class=""mat-headline-5"">Opis oglasa</h2><div _ngcontent-ng-c3151048826 class=""prose max-h-64 overflow-hidden text-gray-800 ng-star-inserted""><p>OdliÄan graÄ‘evinski plac na Zvezdari, Zeleno brdo povrÅ¡ine 5 ari sa idealnim uslovima za gradnju.<br>Plac je pravilnog oblika, ravne povrÅ¡ine, ograÄ‘en, bez objekata i sa svim potrebnim uslovima za gradnju. ID oglasa: 61470. Agencijska provizija 2% od kupoprodajne cene.","GraÄ‘evinsko zemljiÅ¡te na prodaju, Ä†uprijska, 110.000â‚¬, 5a - 4zida",2024-03-02
123,https://www.4zida.rs/prodaja-placeva/borca-i-borca-palilula-opstina-beograd/gradjevinsko-zemljiste/65378e2c5e57075bf30b808f,,,,,,,,,,"Prodaja placeva BorÄa I, BorÄa, Palilula opÅ¡tina, Beograd, GraÄ‘evinsko zemljiÅ¡te - 4zida",2024-03-02
124,https://www.4zida.rs/prodaja-placeva/rogaca-sopot-opstina-beograd/gradjevinsko-zemljiste/64be6007d738599e84067f74,graÄ‘evinsko zemljiÅ¡te ,20.29 a ,uknjiÅ¾eno ,6923 ,pre 7 meseci ,34.500,Kosmajski trg,"RogaÄa, Sopot opÅ¡tina, Beograd","<h2 _ngcontent-ng-c3151048826 class=""mat-headline-5"">Opis oglasa</h2><div _ngcontent-ng-c3151048826 class=""prose max-h-64 overflow-hidden text-gray-800 ng-star-inserted""><p>Plac se nalazi na uzviÅ¡enju sa prelepim pogledom na Kosmaj u tihom ambijentalnom okruÅ¾enju. U gradjevinskoj je zoni i ima moguÄ‡nost prikljuÄka na infrastrukturu. Idealan je za jednu ili dve vikend kuÄ‡e. Ima sopstveni prilaz.","GraÄ‘evinsko zemljiÅ¡te na prodaju, Kosmajski trg, 34.500â‚¬, 20a - 4zida",2024-03-02
125,https://www.4zida.rs/prodaja-placeva/fruska-gora/gradjevinsko-zemljiste/65c643f1f3d3d8650f058730,graÄ‘evinsko zemljiÅ¡te ,24 a ,uknjiÅ¾eno ,19480 ,pre 1 dan ,199.000,FruÅ¡ka Gora,FruÅ¡ka Gora,"<h2 _ngcontent-ng-c3151048826 class=""mat-headline-5"">Opis oglasa</h2><div _ngcontent-ng-c3151048826 class=""prose max-h-64 overflow-hidden text-gray-800 ng-star-inserted""><p>Samo za investitore.<br>Plac 24.25a na FruÅ¡koj gori sa gotovom idejom i projektom. Sutra se moze poÄeti sa gradnjom.<br>BaÅ¡ tako kako ste proÄitali, plac koji pruÅ¾a moguÄ‡nosti da velike ideje sprovedete u delo na FruÅ¡koj gori.<br>Da Vam odmah na poÄetku skrenemo paÅ¾nju da nema mnogo ovakvih lokacija na FruÅ¡koj gori, pre svega po poziciji, dostupnosti i moguÄ‡nostima koje pruÅ¾a.<br>Plac se nalazi na Banstolu,na pelepom FruÅ¡kogorskom vidikovcu,  na raskrsnici puteva koji vode prema Nacionalnom parku FruÅ¡ka gora sa jedne i putu koji vodi prema manastiru KruÅ¡edol sa druge strane.<br>Lokacija koja je oko 20km udaljena od Novog Sada i oko 80km od Beograda, veoma dostupna i fenomenalno povezana putevima.<br>Do Nacionalnog parka FruÅ¡ka gora imate oko 1km, do Sremskih Karlovaca oko 7km, do Iriga oko 8km.","GraÄ‘evinsko zemljiÅ¡te na prodaju, FruÅ¡ka Gora, 199.000â‚¬, 24a - 4zida",2024-03-02
126,https://www.4zida.rs/prodaja-placeva/ripanj-vozdovac-opstina-beograd/gradjevinsko-zemljiste/62defadb61d417be1e082341,,,,,,,,,,"Prodaja placeva Ripanj, VoÅ¾dovac opÅ¡tina, Beograd, GraÄ‘evinsko zemljiÅ¡te - 4zida",2024-03-02
127,https://www.4zida.rs/prodaja-placeva/grosnica-okolne-lokacije-kragujevac/gradjevinsko-zemljiste/63d28d52343292ac1e0813d0,graÄ‘evinsko zemljiÅ¡te ,40 a ,nije uknjiÅ¾eno ,PZ15102202219203346SL ,pre 10 meseci ,52.000,GroÅ¡nica,"GroÅ¡nica, Okolne lokacije, Kragujevac","<h2 _ngcontent-ng-c3151048826 class=""mat-headline-5"">Opis oglasa</h2><div _ngcontent-ng-c3151048826 class=""prose max-h-64 overflow-hidden text-gray-800 ng-star-inserted""><p>Prodaje se plac u Kragujevcu naselje GroÅ¡nica. Svi prikljuÄci prolaze pored placa.Â ","GraÄ‘evinsko zemljiÅ¡te na prodaju, GroÅ¡nica, 52.000â‚¬, 40a - 4zida",2024-03-02
128,https://www.4zida.rs/prodaja-placeva/umka-cukarica-opstina-beograd/gradjevinsko-zemljiste/637cd47f6801f7c3be09adf0,,,,,,,,,,"GraÄ‘evinsko zemljiÅ¡te na prodaju, Kalemi Bb, 42.000â‚¬, 55a - 4zida",2024-03-02
129,https://www.4zida.rs/prodaja-placeva/futog-okolne-lokacije-novi-sad/gradjevinsko-zemljiste/655f52d208cc01fd7502539e,,,,,,,,,,"Prodaja placeva Futog, Okolne lokacije, Novi Sad, GraÄ‘evinsko zemljiÅ¡te - 4zida",2024-03-02
130,https://www.4zida.rs/prodaja-placeva/kotez-1-gradske-lokacije-pancevo/gradjevinsko-zemljiste/651287cf551f212cdd0f2149,,,,,,,,,,"Prodaja placeva KoteÅ¾ 1, Gradske lokacije, PanÄevo, GraÄ‘evinsko zemljiÅ¡te - 4zida",2024-03-02
131,https://www.4zida.rs/prodaja-placeva/gradske-lokacije-sremski-karlovci/gradjevinsko-zemljiste/6552785b6f6a03e18703343f,,,,,,,,,,"Prodaja placeva Gradske lokacije, Sremski Karlovci, GraÄ‘evinsko zemljiÅ¡te - 4zida",2024-03-02
132,https://www.4zida.rs/prodaja-placeva/gornja-vrezina-okolne-lokacije-nis/gradjevinsko-zemljiste/62ff5609c6aa6066b80c56d1,graÄ‘evinsko zemljiÅ¡te ,21.45 a ,uknjiÅ¾eno ,p,pre 10 meseci ,107.000,Gornja vreÅ¾ina,"Gornja VreÅ¾ina, Okolne lokacije, NiÅ¡","<h2 _ngcontent-ng-c3151048826 class=""mat-headline-5"">Opis oglasa</h2><div _ngcontent-ng-c3151048826 class=""prose max-h-64 overflow-hidden text-gray-800 ng-star-inserted""><p>Na prodaju plac na putu za Gornju VreÅ¾inu.<br>Ukupna povrÅ¡ina placa je 2145m2, ulazni front placa je oko 50m, dubina placa oko 50m.<br>Nalazi se do samog asfaltnog  puta, sve komunalije dostupne do placa.<br>Po urbanistiÄkim uslovima nalazi se u poslovnoj zoni, indeks zauzetosti parcele do 70 posto, spratnost objekta p plus 3, indeks, koeficijent, izgraÄ‘enosti 2,1, visina objekta 18m. Idealni uslovni za poslovne, magacinske, proizvodne ili sajamske objekte.<br>Topla preporuka naÅ¡a agencije!<br>UknjiÅ¾en, vlasniÅ¡tvo  1 kroz 1. Za viÅ¡e informacija slobodno pozovite.","GraÄ‘evinsko zemljiÅ¡te na prodaju, Gornja vreÅ¾ina, 107.000â‚¬, 21a - 4zida",2024-03-02
133,https://www.4zida.rs/prodaja-placeva/borca-palilula-opstina-beograd/gradjevinsko-zemljiste/651456153eefcff7d90cce42,graÄ‘evinsko zemljiÅ¡te ,25.05 a ,uknjiÅ¾eno ,1927 ,pre 5 meseci ,47.000,BorÄa,"BorÄa, Palilula opÅ¡tina, Beograd","<h2 _ngcontent-ng-c3151048826 class=""mat-headline-5"">Opis oglasa</h2><div _ngcontent-ng-c3151048826 class=""prose max-h-64 overflow-hidden text-gray-800 ng-star-inserted""><p>U ponudi plac u naselju BorÄa ukupne povrÅ¡ine 25,05 ari. UknjiÅ¾eno 1/1. Prema informaciji o lokaciji osnovna namena je viÅ¡eporodiÄno stanovanje uz koje su kompatibilni sadrÅ¾aji iz trgovine,administracije i usluÅ¾nih delatnosti koje ne ugroÅ¾avaju Å¾ivotnu sredinu i ne stvaraju buku.","GraÄ‘evinsko zemljiÅ¡te na prodaju, BorÄa, 47.000â‚¬, 25a - 4zida",2024-03-02
134,https://www.4zida.rs/prodaja-placeva/lazarevac-lazarevac-opstina-beograd/gradjevinsko-zemljiste/64be42fc40709d231405a218,,,,,,,,,,"GraÄ‘evinsko zemljiÅ¡te na prodaju, TopliÄki venac, 83.500â‚¬, 64a - 4zida",2024-03-02
135,https://www.4zida.rs/prodaja-placeva/klupci-okolne-lokacije-loznica/gradjevinsko-zemljiste/653bc0287f4e5830190a8ca6,graÄ‘evinsko zemljiÅ¡te ,20 a ,uknjiÅ¾eno ,,pre 4 meseca ,17.000,Klupci,"Klupci, Okolne lokacije, Loznica","<h2 _ngcontent-ng-c3151048826 class=""mat-headline-5"">Opis oglasa</h2><div _ngcontent-ng-c3151048826 class=""prose max-h-64 overflow-hidden text-gray-800 ng-star-inserted""><p>Na putu izmeÄ‘u Loznice i TrÅ¡iÄ‡a u mestu Klupci se nalazi prekrasan plac sa Å¡umom. Na kome je dozvoljena gradnja. Lokacija placa je Idealna za odmor.","GraÄ‘evinsko zemljiÅ¡te na prodaju, Klupci, 17.000â‚¬, 20a - 4zida",2024-03-02
136,https://www.4zida.rs/prodaja-placeva/belo-blato-okolne-lokacije-zrenjanin/gradjevinsko-zemljiste/64903776cb0f2011390c0f87,graÄ‘evinsko zemljiÅ¡te ,14 a ,,12810053 ,pre 8 meseci ,6.000,Belo Blato,"Belo Blato, Okolne lokacije, Zrenjanin","<h2 _ngcontent-ng-c3151048826 class=""mat-headline-5"">Opis oglasa</h2><div _ngcontent-ng-c3151048826 class=""prose max-h-64 overflow-hidden text-gray-800 ng-star-inserted""><p>Prazan plac na prodaju u naseljenom mestu Belo blato. Ukupna povrÅ¡ina placa 14 ari i uz kupovinu<br>se dobja projekat za gradnju novog objekta do 100m2","GraÄ‘evinsko zemljiÅ¡te na prodaju, Belo Blato, 6.000â‚¬, 14a - 4zida",2024-03-02
