,link,Tip,Površina,Uknjiženost,Šifra oglasa,Oglas ažuriran,price,street,address,description,title,end_date
217,https://www.4zida.rs/prodaja-placeva/gradske-lokacije-gornji-milanovac/gradjevinsko-zemljiste/644d459447c388d1170129f4,,,,,,,,,,"Prodaja placeva Gradske lokacije, Gornji Milanovac, Građevinsko zemljište - 4zida",2024-03-07
218,https://www.4zida.rs/prodaja-placeva/vinogradi-gradske-lokacije-kragujevac/gradjevinsko-zemljiste/62129ad5b04bf96b215fcc35,građevinsko zemljište ,97 a ,uknjiženo ,,pre 9 dana ,145.500,Vinogradi,"Vinogradi, Gradske lokacije, Kragujevac","<h2 _ngcontent-ng-c3151048826 class=""mat-headline-5"">Opis oglasa</h2><div _ngcontent-ng-c3151048826 class=""prose max-h-64 overflow-hidden text-gray-800 ng-star-inserted""><p>Prodajem plac na izuzetnoj lokaciji i odlicnog polozaja, pogodan za sve vrste gradnji.","Građevinsko zemljište na prodaju, Vinogradi, 145.500€, 97a - 4zida",2024-03-07
219,https://www.4zida.rs/prodaja-placeva/visnjica-palilula-opstina-beograd/gradjevinsko-zemljiste/64c02f12b970d329cc0d3a2b,građevinsko zemljište ,28 a ,uknjiženo ,18598 ,pre 1 mesec ,150.000,Branislava Stankovića,"Višnjica, Palilula opština, Beograd","<h2 _ngcontent-ng-c3151048826 class=""mat-headline-5"">Opis oglasa</h2><div _ngcontent-ng-c3151048826 class=""prose max-h-64 overflow-hidden text-gray-800 ng-star-inserted""><p>Prodaje se plac u Višnjici, 28 ari. Plac je ravan sa prelepim pogledom na Dunav.","Građevinsko zemljište na prodaju, Branislava Stankovića, 150.000€, 28a - 4zida",2024-03-07
220,https://www.4zida.rs/prodaja-placeva/borca-palilula-opstina-beograd/gradjevinsko-zemljiste/642bf9bf557558faa60f0214,građevinsko zemljište ,7.5 a ,,1826 ,pre 10 meseci ,36.000,Borča,"Borča, Palilula opština, Beograd","<h2 _ngcontent-ng-c3151048826 class=""mat-headline-5"">Opis oglasa</h2><div _ngcontent-ng-c3151048826 class=""prose max-h-64 overflow-hidden text-gray-800 ng-star-inserted""><p>Plac površine 7,5 Ari Idealni deo placa.Potes Ovčanski put (od Ovčanskog puta 400m,iza Vanasa) ravan plac,Asfaltna ulica Voda na placu.Plac širine 30 m x24","Građevinsko zemljište na prodaju, Borča, 36.000€, 7a - 4zida",2024-03-07
221,https://www.4zida.rs/prodaja-placeva/krnjesevci-okolne-lokacije-stara-pazova/gradjevinsko-zemljiste/64913f599d037177f50c6053,,,,,,,,,,"Građevinsko zemljište na prodaju, Nema, 1.867.500€, 747a - 4zida",2024-03-07
222,https://www.4zida.rs/prodaja-placeva/beli-potok-vozdovac-opstina-beograd/gradjevinsko-zemljiste/6527c8d9ecd43433dc0f17fa,građevinsko zemljište ,12 a ,uknjiženo ,126251 ,pre 4 meseca ,144.000,Bulevar patrijarha Germana,"Beli Potok, Voždovac opština, Beograd","<h2 _ngcontent-ng-c3151048826 class=""mat-headline-5"">Opis oglasa</h2><div _ngcontent-ng-c3151048826 class=""prose max-h-64 overflow-hidden text-gray-800 ng-star-inserted""><p>Uz asvaltiran put na dobroj lokaciji u Belom potoku u ponudi je plac sa frontom od 40m skoro pa ravan. Plac ima zasade voća. Po informaciji po lokaciji: kao porodnično stanovanje spratnosti P+1+PS sa najviše 4 stana sa kompatibilnim komercijalnim sadržajem iz delatnosti trgovine, administracije i uslužne delatnosti. Dozvoljena je izgradnja pomoćnih objekata. Plac je uknjižen i ograđen. Za preporuku. agencijska provizija 2%","Građevinsko zemljište na prodaju, Bulevar patrijarha Germana, 144.000€, 12a - 4zida",2024-03-07
223,https://www.4zida.rs/prodaja-placeva/aradac-okolne-lokacije-zrenjanin/gradjevinsko-zemljiste/64241e0db01b93c40f0fa3b5,građevinsko zemljište ,7.19 a ,,27838 ,pre 6 meseci ,18.000,Aradac,"Aradac, Okolne lokacije, Zrenjanin","<h2 _ngcontent-ng-c3151048826 class=""mat-headline-5"">Opis oglasa</h2><div _ngcontent-ng-c3151048826 class=""prose max-h-64 overflow-hidden text-gray-800 ng-star-inserted""><p>Placevi sa izlazom na reku Tisu kod Žabaljskog mosta","Građevinsko zemljište na prodaju, Aradac, 18.000€, 7a - 4zida",2024-03-07
224,https://www.4zida.rs/prodaja-placeva/borca-i-borca-palilula-opstina-beograd/gradjevinsko-zemljiste/65378e2c5e57075bf30b808f,,,,,,,,,,"Prodaja placeva Borča I, Borča, Palilula opština, Beograd, Građevinsko zemljište - 4zida",2024-03-07
225,https://www.4zida.rs/prodaja-placeva/rumenka-okolne-lokacije-novi-sad/gradjevinsko-zemljiste/655f97a6a47c2553760f6a6d,,,,,,,,,,"Prodaja placeva Rumenka, Okolne lokacije, Novi Sad, Građevinsko zemljište - 4zida",2024-03-07
226,https://www.4zida.rs/prodaja-placeva/cortanovci-okolne-lokacije-indjija/gradjevinsko-zemljiste/6479ed72d9dbb71eb50a86d3,građevinsko zemljište ,40 a ,uknjiženo ,511877 ,pre 7 meseci ,97.850,Čortanovci,"Čortanovci, Okolne lokacije, Inđija","<h2 _ngcontent-ng-c3151048826 class=""mat-headline-5"">Opis oglasa</h2><div _ngcontent-ng-c3151048826 class=""prose max-h-64 overflow-hidden text-gray-800 ng-star-inserted""><p>Otvorite vrata svog skrivenog raja s ovim izvanrednim placem koji se nalazi u Čortanovcima. Nalazi se u prelepom vikend području, pružajući vam savršeno utočište i beg od svakodnevnog gradskog života. Ova nekretnina predstavlja ne samo izvanrednu investiciju, već i priliku da uživate u obilju zelenila i čistom vazduhu. Prodajemo atraktivan plac površine 4136m2 (46m x 90m). Svojom pozicijom izdvaja se od ostale ponude, u pitanju je južna padina, sa gornjom i donjom zaravni širine oko 10m. Nalazi se oko 300m od Vile Stanković i od velike Lipove šume, sa istovremenim pogledom na TV Tornjeve na Avali i Iriškom Vencu. Do njega se dolazi novim asfaltnim putem pa dobrim tucanikom oko 60m. Na istoj udaljenosti se nalazi i priključak za vodu i struju. Na ovom placu će vam se pružiti mogućnost da izgradite svoj san o mirnom i opuštajućem mestu. Prelepi pejzaži, prostrane površine i bogatstvo prirode će vas očarati i pružiti vam osećaj potpune harmonije. Možete stvoriti svoj vikend dom, vrt ili bilo koji drugi projekat koji vam dolazi na pamet. Vikend zone su sve popularnije među onima koji traže beg od gradske vreve i žele da se povežu s prirodom. Ovo je prilika da kupite nekretninu s velikim potencijalom rasta vrednosti. Uživajte u punoći zelenila i čistom vazduhu koji će vas okruživati na ovom placu. Ne propustite ovu jedinstvenu priliku da stvorite svoj raj u prirodi. Pozovite nas danas da biste saznali više o ovoj izvanrednoj nekretnini i zakazali razgledanje. Vaša oaza mira vas čeka!","Građevinsko zemljište na prodaju, Čortanovci, 97.850€, 40a - 4zida",2024-03-07
227,https://www.4zida.rs/prodaja-placeva/pantelej-gradske-lokacije-nis/gradjevinsko-zemljiste/5d2372e3e466e63db8453543,,,,,,,,,,"Građevinsko zemljište na prodaju, Pantelej, 1€, 18a - 4zida",2024-03-07
228,https://www.4zida.rs/prodaja-placeva/batajnica-zemun-opstina-beograd/gradjevinsko-zemljiste/654b43a7d9b112ce93098fd3,građevinsko zemljište ,216.21 a ,,2285,pre 3 meseca ,2.162.100,Zabran,"Batajnica, Zemun opština, Beograd","<h2 _ngcontent-ng-c3151048826 class=""mat-headline-5"">Opis oglasa</h2><div _ngcontent-ng-c3151048826 class=""prose max-h-64 overflow-hidden text-gray-800 ng-star-inserted""><p>Na prodaju je atraktivna građevinska parcela u Batajnici, koja se ističe svojom odličnom pozicijom i raznovrsnim mogućnostima korišćenja. Ova parcela nalazi se u zoni privredno komercijalnih delatnosti, ali takođe nudi i potencijal za individualno stanovanje prema Planu detaljne regulacije.Osnovne informacije o parceli:Površina parcele: 21621m2Namena parcele: Privredno komercijalne delatnosti i individualno stanovanje (zona C1)Odnos kompatibilnih namena: Minimalno 80% za privredno komercijalne delatnosti, maksimalno 20% za individualno stanovanjeDozvoljena izgradnja više objekata na parceli.Specifikacije za izgradnju:Širina fronta parcele: 303 metaraMinimalna širina fronta za slobodnostojeći objekat: 15 metaraMaksimalni indeks izgrađenosti (""I""): 1.2Maksimalna visina venca objekta: 12.0 metara u odnosu na kotu pristupne saobraćajnicePlanirana spratnost do P+2+Pk/PsMaksimalna visina pomoćnih objekata: 4 metara (do kote venca) i maksimalno 6.0 metara (do kote slemena)Dodatne prednosti parcela uključuju planiranu izgradnju nove obilaznice, koja će značajno smanjiti put do petlje za Nove Banovce i Novi Beograd. Ovo će dodatno poboljšati pristup parceli i povećati njenu vrednost.Parcela je savršena prilika za investitore koji traže atraktivnu lokaciju za komercijalne delatnosti ili za pojedince koji žele da izgrade svoj dom u mirnom okruženju sa svim potrebnim sadržajima u blizini.Za dodatne informacije, cenu i detalje o parceli, molimo vas da nas kontaktirate. Ne propustite ovu jedinstvenu priliku za investiranje u Batajnici.Regenerate","Građevinsko zemljište na prodaju, Zabran, 2.162.100€, 216a - 4zida",2024-03-07
229,https://www.4zida.rs/prodaja-placeva/miljakovac-iii-miljakovac-rakovica-opstina-beograd/gradjevinsko-zemljiste/6490577b20cc72c7780628af,građevinsko zemljište ,6 a ,uknjiženo ,124320 ,pre 8 meseci ,90.000,Miljakovačke staze,"Miljakovac III, Miljakovac, Rakovica opština, Beograd","<h2 _ngcontent-ng-c3151048826 class=""mat-headline-5"">Opis oglasa</h2><div _ngcontent-ng-c3151048826 class=""prose max-h-64 overflow-hidden text-gray-800 ng-star-inserted""><p>Struja i voda do placa, asfalt, ogradjen, prazan, pod nagibom, dozvoljena gradnja, posedujemo informaciju o lokaciji. Uknjižen agencijska provizija 2%","Građevinsko zemljište na prodaju, Miljakovačke staze, 90.000€, 6a - 4zida",2024-03-07
230,https://www.4zida.rs/prodaja-placeva/markovac-mladenovac-opstina-beograd/gradjevinsko-zemljiste/65d2152c63a93b043c0397fc,,,,,,,,,,"Prodaja placeva Markovac, Mladenovac opština, Beograd, Građevinsko zemljište - 4zida",2024-03-07
231,https://www.4zida.rs/prodaja-placeva/cerevic-okolne-lokacije-beocin/gradjevinsko-zemljiste/65cba5ed89d80675540037f2,građevinsko zemljište ,38.59 a ,uknjiženo ,1490 ,pre 13 dana ,47.000,Čerević,"Čerević, Okolne lokacije, Beočin","<h2 _ngcontent-ng-c3151048826 class=""mat-headline-5"">Opis oglasa</h2><div _ngcontent-ng-c3151048826 class=""prose max-h-64 overflow-hidden text-gray-800 ng-star-inserted""><p>Prodajem odličan građevinski plac 3859m2 u Čereviću . Plac se nalazi na putu za Andrevlje . Asfaltni put 150m od placa , od asflatnog puta do placa zemljani put . Bandera za struju se nalazi uz plac , moguć priključak struje . Do placa protiče potok i visoke su podzemne vode te se kopanjem bunara obezbeđuje voda. . Gradske vode nema kao ni kanalizacije . Povrsina placa je ravna što je kvalitet. Gradjevinsko zemljište u vikend zoni, dozvoljena gradnja . Uknjizen 1/1 bez tereta. Cena povoljna spram kvaliteta koji se nudi.","Građevinsko zemljište na prodaju, Čerević, 47.000€, 38a - 4zida",2024-03-07
232,https://www.4zida.rs/prodaja-placeva/paragovo-sremska-kamenica-gradske-lokacije-novi-sad/gradjevinsko-zemljiste/6536639db404d4ce7d06dbfb,,,,,,,,,,"Građevinsko zemljište na prodaju, Paragovo, 249.000€, 49a - 4zida",2024-03-07
233,https://www.4zida.rs/prodaja-placeva/rogaca-sopot-opstina-beograd/gradjevinsko-zemljiste/63f8e5ece8360ddbae0d648f,građevinsko zemljište ,92 a ,uknjiženo ,1159 ,pre 10 meseci ,46.000,Rogača,"Rogača, Sopot opština, Beograd","<h2 _ngcontent-ng-c3151048826 class=""mat-headline-5"">Opis oglasa</h2><div _ngcontent-ng-c3151048826 class=""prose max-h-64 overflow-hidden text-gray-800 ng-star-inserted""><p>Šifra: P441<br>Predivan i celodnevno osunčan plac s pogledom na Bukulju i Rudnik, površine 92 ara građevinskog zemljišta u podnožju Kosmaja, selo Rogača. Placu ima struju, vodu i plin. Na njemu se nalazi i pomoćni objekat površine 60 m2 (radionica). 27 ari je pod šumom. Na udaljenosti 100 metara vazdušnom linijom je put za Aranđelovac. Na placu je i akumulaciono jezero 5x3x2 metra , za sakupljanje vode iz drenaže i kišnice. Kroz plac prolazi i potok, koji je u zoni šume; 12 ari je s građevinskom dozvolom za izgradnju kuće od 250 m2. Sastoji se od 3 parcele. Vlasnik je 1/1.<br>Ukoliko želite više informacija, pozovite broj:<br>  063/70-30-538 - Nataša<br>  062/80-10-641 - Tanja","Građevinsko zemljište na prodaju, Rogača, 46.000€, 92a - 4zida",2024-03-07
234,https://www.4zida.rs/prodaja-placeva/simanovci-okolne-lokacije-pecinci/gradjevinsko-zemljiste/5f0c2a010c7cde589d2c2dd5,građevinsko zemljište ,500 a ,uknjiženo ,,pre 1 mesec ,1.100.000,Šimanovci,"Šimanovci, Okolne lokacije, Pećinci","<h2 _ngcontent-ng-c3151048826 class=""mat-headline-5"">Opis oglasa</h2><div _ngcontent-ng-c3151048826 class=""prose max-h-64 overflow-hidden text-gray-800 ng-star-inserted""><p>ŠIMANOVCI !","Građevinsko zemljište na prodaju, Šimanovci, 1.100.000€, 500a - 4zida",2024-03-07
235,https://www.4zida.rs/prodaja-placeva/gradske-lokacije-svilajnac/gradjevinsko-zemljiste/649fd4692a72dca7640a8a98,,,,,,,,,,"Građevinsko zemljište na prodaju, prilepska, 73.000€, 15a - 4zida",2024-03-07
236,https://www.4zida.rs/prodaja-placeva/banstol-okolne-lokacije-sremski-karlovci/gradjevinsko-zemljiste/64edaadcf569bbf74c0cff64,,,,,,,,,,"Prodaja placeva Banstol, Okolne lokacije, Sremski Karlovci, Građevinsko zemljište - 4zida",2024-03-07
237,https://www.4zida.rs/prodaja-placeva/palic-okolne-lokacije-subotica/gradjevinsko-zemljiste/62853b67219ea6803b004485,,,,,,,,,,"Građevinsko zemljište na prodaju, Palić, 30.000€, 5a - 4zida",2024-03-07
238,https://www.4zida.rs/prodaja-placeva/nikola-tesla-niska-banja-gradske-lokacije-nis/gradjevinsko-zemljiste/651eab18cdbbb1b32a021757,građevinsko zemljište ,2427 a ,uknjiženo ,9977 ,pre 5 meseci ,37.800,Nikola Tesla,"Nikola Tesla, Niška Banja, Gradske lokacije, Niš","<h2 _ngcontent-ng-c3151048826 class=""mat-headline-5"">Opis oglasa</h2><div _ngcontent-ng-c3151048826 class=""prose max-h-64 overflow-hidden text-gray-800 ng-star-inserted""><p>Zemljište, Naselje Nikola Tesla, 24 ara<br>U ponudi fenomenalan plac površine 24 ara na putu za Nisku Banju. U pitanju je gradsko - građevinsko zemljište. Nalazi se do glavnog puta i predviđen je za izgradnju porodicne kuce. Pravougaonog je oblika. U blizini su priključci za struju, vodu i kanalizaciju.","Građevinsko zemljište na prodaju, Nikola Tesla, 37.800€, 2427a - 4zida",2024-03-07
239,https://www.4zida.rs/prodaja-placeva/zaovine-tara/gradjevinsko-zemljiste/646224835220e807a400a289,građevinsko zemljište ,10.13 a ,uknjiženo ,1896 ,pre 13 sati ,15.000,Zaovine,"Zaovine, Tara","<h2 _ngcontent-ng-c3151048826 class=""mat-headline-5"">Opis oglasa</h2><div _ngcontent-ng-c3151048826 class=""prose max-h-64 overflow-hidden text-gray-800 ng-star-inserted""><p>Hitna prodaja dve parcele od po 565m2 .Dva placa ukupno površine 1130m2.Zajedno se prodaju ukupna cena za dva placa 15000 eura.Parcele su jedna pored druge, pored puta.Svaka parcela uknjižena 1/1. Lokacija Tara-Zaovine potez Rajaci.Za sve dodatne informacije 1pozovite Cena povoljna Placevi se mogu prodavati i pojedinačno","Građevinsko zemljište na prodaju, Zaovine, 15.000€, 10a - 4zida",2024-03-07
240,https://www.4zida.rs/prodaja-placeva/gradske-lokacije-merosina/gradjevinsko-zemljiste/638b5a96ba5d6c2c37002690,građevinsko zemljište ,30.87 a ,uknjiženo ,p,pre 8 meseci ,21.000,Mramorsko brdo,"Gradske lokacije, Merošina","<h2 _ngcontent-ng-c3151048826 class=""mat-headline-5"">Opis oglasa</h2><div _ngcontent-ng-c3151048826 class=""prose max-h-64 overflow-hidden text-gray-800 ng-star-inserted""><p>Na prodaju odličan plac na Batušinačkom putu.  							<br>Plac je poljoprivredno zemljište, ukupne površine 30.87ari, prednji front je 16m širine, dubina je oko 157m, dok je u zadnjem delu plac 24m širine. Od lokalnog asfaltnog puta je udaljen oko 100m. Prilaz je nasipan. Na placu postoji priključak za struju. Vode trenutno nema, ali postoji mogućnost iskopa bunara, jer su u blizini placa komšijske kuće koje se snadbevaju bunarskom vodom. 							<br>Plac je uknjižen, čisto vlasništvo. Moguća je prenamena iz poljoprivrednog zemljišta  u gradjevinsko, radi izgradnje stambenog objekta.							Ovo je samo deo naše ponude, ovu nekretninu kao i ostale sa većim brojem fotografija možete pogledati na našem sajtu.","Građevinsko zemljište na prodaju, Mramorsko brdo, 21.000€, 30a - 4zida",2024-03-07
241,https://www.4zida.rs/prodaja-placeva/gradske-lokacije-indjija/gradjevinsko-zemljiste/6411ff610e166def4d09fd96,građevinsko zemljište ,400 a ,uknjiženo ,1512 ,pre 10 meseci ,510.000,Gradske lokacije,"Gradske lokacije, Inđija","<h2 _ngcontent-ng-c3151048826 class=""mat-headline-5"">Opis oglasa</h2><div _ngcontent-ng-c3151048826 class=""prose max-h-64 overflow-hidden text-gray-800 ng-star-inserted""><p>Izuzetno atraktivna lokacija , koja se nalazi na ulazu iz pravca auto-puta, u reonu Carine, Outtleta , Martini gradnje i dr.<br>Ima struja, voda, gas, sve neophodno za sve vrste biznisa.<br>Postoji informacija o lokaciji.<br>Za preporuku!<br>Uknjiženo! Agencijska provizija 2%","Građevinsko zemljište na prodaju, Gradske lokacije, 510.000€, 400a - 4zida",2024-03-07
242,https://www.4zida.rs/prodaja-placeva/belotinac-okolne-lokacije-doljevac/gradjevinsko-zemljiste/6581b5af7cfaff1804022526,,,,,,,,,,"Prodaja placeva Belotinac, Okolne lokacije, Doljevac, Građevinsko zemljište - 4zida",2024-03-07
243,https://www.4zida.rs/prodaja-placeva/simanovci-okolne-lokacije-pecinci/gradjevinsko-zemljiste/61f53aa7e7b0f5396c6b0384,,,,,,,,,,"Građevinsko zemljište na prodaju, Šimanovci, 198.500€, 49a - 4zida",2024-03-07
244,https://www.4zida.rs/prodaja-placeva/radiofar-surcin-opstina-beograd/gradjevinsko-zemljiste/643cf0f2ac628b0c9d0c09cf,,,,,,,,,,"Prodaja placeva Radiofar, Surčin opština, Beograd, Građevinsko zemljište - 4zida",2024-03-07
245,https://www.4zida.rs/prodaja-placeva/rumenka-okolne-lokacije-novi-sad/gradjevinsko-zemljiste/5f5246929a309113e05e8e1a,građevinsko zemljište ,10 a ,uknjiženo ,40467 ,pre 3 godine ,77.250,Rumenka,"Rumenka, Okolne lokacije, Novi Sad","<h2 _ngcontent-ng-c3151048826 class=""mat-headline-5"">Opis oglasa</h2><div _ngcontent-ng-c3151048826 class=""prose max-h-64 overflow-hidden text-gray-800 ng-star-inserted""><p>40467, 063 526 063 Milovan, Površina 10461m2, Velika njiva 1. klase, zemljište u graðevinskom području, urbanistièkim planom predviðeno za parkovski pojas.","Građevinsko zemljište na prodaju, Rumenka, 77.250€, 10a - 4zida",2024-03-07
246,https://www.4zida.rs/prodaja-placeva/gaj-barajevo-barajevo-opstina-beograd/gradjevinsko-zemljiste/650ae06a63090cbb0c0c1220,građevinsko zemljište ,36 a ,,2411 ,pre 5 meseci ,9.000,Gaj,"Gaj, Barajevo, Barajevo opština, Beograd","<h2 _ngcontent-ng-c3151048826 class=""mat-headline-5"">Opis oglasa</h2><div _ngcontent-ng-c3151048826 class=""prose max-h-64 overflow-hidden text-gray-800 ng-star-inserted""><p>Barajevo Mekote na asfaltnom putu Lipovica - Sopot plac 36 ari poljoprivredno.<br>Agencijska provizija 2%<br>Za više informacija kontakt telefon 063/804-1184 Rade","Građevinsko zemljište na prodaju, Gaj, 9.000€, 36a - 4zida",2024-03-07
247,https://www.4zida.rs/prodaja-placeva/karlovcic-okolne-lokacije-pecinci/gradjevinsko-zemljiste/65e06452e80b28bd9200b4da,građevinsko zemljište ,115 a ,uknjiženo ,1581 ,pre 7 dana ,80.500,potes Šodol,"Karlovčić, Okolne lokacije, Pećinci","<h2 _ngcontent-ng-c3151048826 class=""mat-headline-5"">Opis oglasa</h2><div _ngcontent-ng-c3151048826 class=""prose max-h-64 overflow-hidden text-gray-800 ng-star-inserted""><p>Na prodaju građevinsko zemljište u Karlovčiću, površine 115a. Prednji front oko 50m, dužina parcele oko 230m. U blizini parcele se nalaze sve potrebne instalacije ( struja,voda). Vlasništvo 1/1.","Građevinsko zemljište na prodaju, potes Šodol, 80.500€, 115a - 4zida",2024-03-07
248,https://www.4zida.rs/prodaja-placeva/lezimir-okolne-lokacije-sremska-mitrovica/gradjevinsko-zemljiste/6470c0788c8c189849033731,,,,,,,,,,"Prodaja placeva Ležimir, Okolne lokacije, Sremska Mitrovica, Građevinsko zemljište - 4zida",2024-03-07
249,https://www.4zida.rs/prodaja-placeva/trmbas-okolne-lokacije-kragujevac/gradjevinsko-zemljiste/63e2d05bef58848de90dcec5,,,,,,,,,,"Prodaja placeva Trmbas, Okolne lokacije, Kragujevac, Građevinsko zemljište - 4zida",2024-03-07
250,https://www.4zida.rs/prodaja-placeva/sremska-kamenica-gradske-lokacije-novi-sad/gradjevinsko-zemljiste/6495aba29584d5ef0e0a85f6,,,,,,,,,,"Prodaja placeva Sremska Kamenica, Gradske lokacije, Novi Sad, Građevinsko zemljište - 4zida",2024-03-07
251,https://www.4zida.rs/prodaja-placeva/klisa-gradske-lokacije-novi-sad/gradjevinsko-zemljiste/65d329f033e53ed5b5061fcf,,,,,,,,,,"Prodaja placeva Klisa, Gradske lokacije, Novi Sad, Građevinsko zemljište - 4zida",2024-03-07
252,https://www.4zida.rs/prodaja-placeva/pasi-poljana-palilula-gradske-lokacije-nis/gradjevinsko-zemljiste/64e8b7b1ba16edae15094d1f,građevinsko zemljište ,11.37 a ,,p,pre 6 meseci ,35.000,Vojvode Putnika,"Pasi Poljana, Palilula, Gradske lokacije, Niš","<h2 _ngcontent-ng-c3151048826 class=""mat-headline-5"">Opis oglasa</h2><div _ngcontent-ng-c3151048826 class=""prose max-h-64 overflow-hidden text-gray-800 ng-star-inserted""><p>Na prodaju plac u Pasi Poljani  u blizini novog groblja na glavnom putu za Doljevac , površine 1137 m2, gradsko građevinsko zemljište.  Plac  je,svojina 1 kroz 1. Za više informacija javite se","Građevinsko zemljište na prodaju, Vojvode Putnika, 35.000€, 11a - 4zida",2024-03-07
253,https://www.4zida.rs/prodaja-placeva/gradske-lokacije-beocin/gradjevinsko-zemljiste/655f448700fa00ffb604dcc6,građevinsko zemljište ,27.34 a ,,1077 ,pre 3 meseca ,51.500,Gradske lokacije,"Gradske lokacije, Beočin","<h2 _ngcontent-ng-c3151048826 class=""mat-headline-5"">Opis oglasa</h2><div _ngcontent-ng-c3151048826 class=""prose max-h-64 overflow-hidden text-gray-800 ng-star-inserted""><p>U ponudi odličan plac na lepoj i mirnoj lokaciji u neposrednoj blizini Dunava. Nalazi se u građevinoskom području pored regionalnog puta Novi Sad-Ilok. Gradjevinsko zemljište na kojem se mogu zidati objekti različitih namena.  Ukupna površina pčaca je 2.750 m2, Front 110 m. Prilaz placu je sa glavnog asvaltnog puta.","Građevinsko zemljište na prodaju, Gradske lokacije, 51.500€, 27a - 4zida",2024-03-07
254,https://www.4zida.rs/prodaja-placeva/vrtiste-okolne-lokacije-nis/gradjevinsko-zemljiste/64e89b6ea6d034f13005f172,građevinsko zemljište ,65.79 a ,uknjiženo ,p,pre 6 meseci ,82.000,Beogradska,"Vrtište, Okolne lokacije, Niš","<h2 _ngcontent-ng-c3151048826 class=""mat-headline-5"">Opis oglasa</h2><div _ngcontent-ng-c3151048826 class=""prose max-h-64 overflow-hidden text-gray-800 ng-star-inserted""><p>Na prodaju plac površine 6579m2 U neposrednoj blizini Hotela Nais .Parcela se nalazi u granici zahvata Plana generalne regulacije gradske opštine Crveni Krst , u zoni predvidjenoj za poslovno proizvodno trgovinskih kompleksa Čisto vlasništvo , uknjižen kao poljoprivredno zemljište.","Građevinsko zemljište na prodaju, Beogradska, 82.000€, 65a - 4zida",2024-03-07
255,https://www.4zida.rs/prodaja-placeva/divcibare-okolne-lokacije-valjevo/gradjevinsko-zemljiste/650482904052b607ee00d12e,građevinsko zemljište ,2 a ,uknjiženo ,,pre 9 dana ,4.000,Rastovac 3,"Divčibare, Okolne lokacije, Valjevo","<h2 _ngcontent-ng-c3151048826 class=""mat-headline-5"">Opis oglasa</h2><div _ngcontent-ng-c3151048826 class=""prose max-h-64 overflow-hidden text-gray-800 ng-star-inserted""><p>Divcibare, naselje Rastovac tri,opstina Pozega,udaljeno 3km od centra Divcibara.Na prodaju vise parcela od po 2 ara u gradjevinskom reonu.Prilaz od asfaltnog puta je makadam u duzini od 1200 metara a poslednjih 600 metara put je uzbrdo,nizbrdo i moguce je za sada prici iskljucivo terenskim vozilom ili putnickim autom 4×4.Najbliza vikendica parcelama udaljena je 250 metara i ima prikljucak elektricne energije.Preko puta placa nema trznog centra,spa centra,maksija i diskoteke.SAMO ZA LJUBITELJE PRIRODE,MIRA I TISINE.Cena za parcelu od dva ara 4000e.Informacije na broj telefona:0654079696","Građevinsko zemljište na prodaju, Rastovac 3, 4.000€, 2a - 4zida",2024-03-07
256,https://www.4zida.rs/prodaja-placeva/dedinje-savski-venac-beograd/gradjevinsko-zemljiste/5f6f78f1ca1c837fb428eb7f,,,,,,,,,,"Građevinsko zemljište na prodaju, Dedinje, 600.000€, 6a - 4zida",2024-03-07
257,https://www.4zida.rs/prodaja-placeva/centar-gradske-lokacije-knjazevac/gradjevinsko-zemljiste/643944b4a6a2c40d21053863,,,,,,,,,,"Građevinsko zemljište na prodaju, Centar, 16.000€, 23a - 4zida",2024-03-07
258,https://www.4zida.rs/prodaja-placeva/vranic-barajevo-opstina-beograd/gradjevinsko-zemljiste/655b8af296f3daf16800dcc0,građevinsko zemljište ,10 a ,uknjiženo ,1708 ,pre 3 meseca ,10.000,Hajduk Veljkova,"Vranić, Barajevo opština, Beograd","<h2 _ngcontent-ng-c3151048826 class=""mat-headline-5"">Opis oglasa</h2><div _ngcontent-ng-c3151048826 class=""prose max-h-64 overflow-hidden text-gray-800 ng-star-inserted""><p>Uknjižen plac površine 10a, nadomak placa prolaze vodovod i gas, kao i priključak za struju. Naselje Vranić, udaljeno od Beograda 20 minuta vožnje, ima osnovnu školu, gradski prevoz 860D u blizini placa.","Građevinsko zemljište na prodaju, Hajduk Veljkova, 10.000€, 10a - 4zida",2024-03-07
259,https://www.4zida.rs/prodaja-placeva/zaklopaca-grocka-opstina-beograd/gradjevinsko-zemljiste/653e89ca4c257055690f93c6,,,,,,,,,,"Građevinsko zemljište na prodaju, Zavojice 4, 11.000€, 14a - 4zida",2024-03-07
