,link,Tip,Površina,Šifra oglasa,Oglas ažuriran,price,street,address,description,title,end_date,Uknjiženost
331,https://www.4zida.rs/prodaja-placeva/lukovica-okolne-lokacije-svilajnac/gradjevinsko-zemljiste/65674e72865877c20f03b279,građevinsko zemljište ,53.72 a ,,pre 28 dana ,47.000,Dragana Joksimovića,"Lukovica, Okolne lokacije, Svilajnac","<h2 _ngcontent-ng-c3151048826 class=""mat-headline-5"">Opis oglasa</h2><div _ngcontent-ng-c3151048826 class=""prose max-h-64 overflow-hidden text-gray-800 ng-star-inserted""><p>Parcela površine 53,72 ara,pravilnog oblika u ulici Dragana Joksimovića Belog KO Lukovica. Na odličnoj lokaciji,pored glavnog puta,asfalt,dostupna sva gradska infrastruktura.","Građevinsko zemljište na prodaju, Dragana Joksimovića, 47.000€, 53a - 4zida",2024-01-12,uknjiženo 
332,https://www.4zida.rs/prodaja-placeva/cerat-okolne-lokacije-sremski-karlovci/gradjevinsko-zemljiste/655dc8d6d0d8a71e4d060a39,,,,,,,,,"Prodaja placeva Čerat, Okolne lokacije, Sremski Karlovci, Građevinsko zemljište - 4zida",2024-01-12,
333,https://www.4zida.rs/prodaja-placeva/dobanovci-surcin-opstina-beograd/gradjevinsko-zemljiste/5ff470b659de9e36396dd773,građevinsko zemljište ,65 a ,52413 ,pre 8 meseci ,180.000,Železnička,"Dobanovci, Surčin opština, Beograd","<h2 _ngcontent-ng-c3151048826 class=""mat-headline-5"">Opis oglasa</h2><div _ngcontent-ng-c3151048826 class=""prose max-h-64 overflow-hidden text-gray-800 ng-star-inserted""><p>Plac se nalazi na izlazu iz Surčina ka Dobanovcima.Do samog asfalta je i obilaznice. ID oglasa: 52413. Agencijska provizija 2% od kupoprodajne cene.","Građevinsko zemljište na prodaju, Železnička, 180.000€, 65a - 4zida",2024-01-12,uknjiženo 
334,https://www.4zida.rs/prodaja-placeva/vrdnik-okolne-lokacije-irig/gradjevinsko-zemljiste/632d0506d2ae5ec93c03bd8e,građevinsko zemljište ,400 a ,,pre 1 mesec ,400.000,Pavla Vujsića,"Vrdnik, Okolne lokacije, Irig","<h2 _ngcontent-ng-c3151048826 class=""mat-headline-5"">Opis oglasa</h2><div _ngcontent-ng-c3151048826 class=""prose max-h-64 overflow-hidden text-gray-800 ng-star-inserted""><p>Plac poseduje fenomenalan pogled i odličan potencijal, udaljen je od asfalta 1 kilometar.","Građevinsko zemljište na prodaju, Pavla Vujsića, 400.000€, 400a - 4zida",2024-01-12,uknjiženo 
335,https://www.4zida.rs/prodaja-placeva/zaovine-tara/gradjevinsko-zemljiste/62c8884400e6d8a1640f2d5a,građevinsko zemljište ,89 a ,,pre 17 dana ,35.000,Zaovine,"Zaovine, Tara","<h2 _ngcontent-ng-c3151048826 class=""mat-headline-5"">Opis oglasa</h2><div _ngcontent-ng-c3151048826 class=""prose max-h-64 overflow-hidden text-gray-800 ng-star-inserted""><p>Na prodaju plac u zaovinama povrsine 89 ari.Struja blizu,voda blizu,ima put a u procesu je i izgradnja asfalta.<br>ZEMLJISTE NIJE GRADJEVINSKO NEGO POLJUPRIVREDNO!!!","Građevinsko zemljište na prodaju, Zaovine, 35.000€, 89a - 4zida",2024-01-12,uknjiženo 
336,https://www.4zida.rs/prodaja-placeva/male-pcelice-gradske-lokacije-kragujevac/gradjevinsko-zemljiste/65153889d018ad45910210b6,građevinsko zemljište ,3.6 a ,201512089H66VJ ,pre 3 meseca ,8.000,Male Pčelice,"Male Pčelice, Gradske lokacije, Kragujevac","<h2 _ngcontent-ng-c3151048826 class=""mat-headline-5"">Opis oglasa</h2><div _ngcontent-ng-c3151048826 class=""prose max-h-64 overflow-hidden text-gray-800 ng-star-inserted""><p>Pored asfalta. Prolaze sve komunalije.","Građevinsko zemljište na prodaju, Male Pčelice, 8.000€, 3a - 4zida",2024-01-12,nije uknjiženo 
337,https://www.4zida.rs/prodaja-placeva/rusanj-cukarica-opstina-beograd/gradjevinsko-zemljiste/64578cc1d2d785a4d50f98ae,,,,,,,,,"Građevinsko zemljište na prodaju, 13. septembra, 180.000€, 30a - 4zida",2024-01-12,
338,https://www.4zida.rs/prodaja-placeva/crni-vrh-okolne-lokacije-knjazevac/gradjevinsko-zemljiste/6522e5364230ee95610dcbec,građevinsko zemljište ,43 a ,,pre 2 dana ,20,Celo Crni Vrh bb,"Crni Vrh, Okolne lokacije, Knjaževac","<h2 _ngcontent-ng-c3151048826 class=""mat-headline-5"">Opis oglasa</h2><div _ngcontent-ng-c3151048826 class=""prose max-h-64 overflow-hidden text-gray-800 ng-star-inserted""><p>Prodajem plac,na Staroj planini,u selu Crni vrh, povrsine 42.5ari,na izuzetnoj lokaciji,plac izlazi na reku,struja, voda,gradjevinsko zemljiste,kroz plac prolazi asfaltni put,blizina skijalista,za sve informacije tel Aleksandar","Građevinsko zemljište na prodaju, Celo Crni Vrh bb, 20€, 43a - 4zida",2024-01-12,uknjiženo 
339,https://www.4zida.rs/prodaja-placeva/pantelej-gradske-lokacije-nis/gradjevinsko-zemljiste/632888dd49fa50bb7d0a7b32,građevinsko zemljište ,4535 a ,9537 ,pre 11 meseci ,715.000,Pantelej,"Pantelej, Gradske lokacije, Niš","<h2 _ngcontent-ng-c3151048826 class=""mat-headline-5"">Opis oglasa</h2><div _ngcontent-ng-c3151048826 class=""prose max-h-64 overflow-hidden text-gray-800 ng-star-inserted""><p>Opis lokacije: Plac se nalazi u blizini crkve Svetog Pantelejmona, u neposrednoj blizini je izgradnja kopleks stanova za pripadnike vojske. U urbanističkom planu grada Niša predviđena je infrastruktura, trenutno u fazi izgradnje, koja spaja Somborski bulevar sa bulevarom Heroja sa Košara, preko bulevara Nikole Tesle.<br>Opis zemljišta: Ukupna površina placa iznosi 4535m2, sastoji se od nekoliko parcela na ime jednog vlasnika. U pitanju je gradsko-građevinsko zemljište i dozvoljena je gradnja. Plac izlazi na dve ulice, frontalni deo iznosi oko 88m sa jedne strane a sa druge je 27m. Inace plac je pravougaonog oblika, ravan bez nagiba. Idealna lokacija za izgradnju stambenog kompleksa. Vredi pogledati.<br>Odvojite malo slobodnog vremena i zakažite razgledanje ove nepokretnosti sa agencijom AVENIJA NEKRETNINE putem telefona: 018/272-212, 061/25-100-25. Svojim klijentima garantujemo potpunu pravnu sigurnost pri kupovini i zakupu nepokretnosti. Kompletnu ponudu nekretnina možete videti na našem portalu: http://www.avenijanekretninenis.rs<br>Ukoliko je ova nekretnina na nekom drugom mestu oglašena sa nižom cenom, koju je prethodno odobrio vlasnik nekretnine, niža cena takođe važi i u našoj ponudi.","Građevinsko zemljište na prodaju, Pantelej, 715.000€, 4535a - 4zida",2024-01-12,uknjiženo 
340,https://www.4zida.rs/prodaja-placeva/denino-brdo-aerodrom-gradske-lokacije-kragujevac/gradjevinsko-zemljiste/63049b032cfbeb4e7902d6a6,građevinsko zemljište ,5.55 a ,2649 ,pre 15 dana ,37.200,Denino Brdo,"Denino Brdo, Aerodrom, Gradske lokacije, Kragujevac","<h2 _ngcontent-ng-c3151048826 class=""mat-headline-5"">Opis oglasa</h2><div _ngcontent-ng-c3151048826 class=""prose max-h-64 overflow-hidden text-gray-800 ng-star-inserted""><p>Kroz ulicu prošao gas, gradska kanalizacija. 5,55 ari. Postoji mogućnost kupovine placa pored, iste površine.","Građevinsko zemljište na prodaju, Denino Brdo, 37.200€, 5a - 4zida",2024-01-12,uknjiženo 
341,https://www.4zida.rs/prodaja-placeva/banja-vrujci-gradske-lokacije-mionica/gradjevinsko-zemljiste/64637da03f70c4632f0de65b,građevinsko zemljište ,7 a ,421512 ,pre 5 meseci ,20.000,Banja Vrujci,"Banja Vrujci, Gradske lokacije, Mionica","<h2 _ngcontent-ng-c3151048826 class=""mat-headline-5"">Opis oglasa</h2><div _ngcontent-ng-c3151048826 class=""prose max-h-64 overflow-hidden text-gray-800 ng-star-inserted""><p>Nedaleko od novog centra za odmor ""Savčić"" i restorana ""Plavi Cvet"", prodajemo građevinski plac od 680m2. Plac je idealnog oblika i na njemu je moguće graditi objekat Pr+1+Pk.<br>Struja, voda i kanalizacija su uz samu ulicu. Cena nekretnine je €20000. Telefon: 063 344844<br>Registarski broj 741, provizija 2%.","Građevinsko zemljište na prodaju, Banja Vrujci, 20.000€, 7a - 4zida",2024-01-12,uknjiženo 
342,https://www.4zida.rs/prodaja-placeva/gabrovac-okolne-lokacije-nis/gradjevinsko-zemljiste/5fa25f5b78937f10333a4ac3,građevinsko zemljište ,19.03 a ,p,pre 8 meseci ,62.000,Gabrovački put,"Gabrovac, Okolne lokacije, Niš","<h2 _ngcontent-ng-c3151048826 class=""mat-headline-5"">Opis oglasa</h2><div _ngcontent-ng-c3151048826 class=""prose max-h-64 overflow-hidden text-gray-800 ng-star-inserted""><p>Na prodaju plac 1903 m2  na Gabrovackom putu u blizini restorana Bolji Zivot, ograđen žičanom ogradom sa kapijom, plac ima izvedenu struju, vodu i telefon.  Uredno održavan na ravnom terenu oko placa se nalaze vikendice u kojima ljudi žive. Plac se vodi kao gradsko gradjevinsko zemljiste na kome je dozvoljena gradnja.","Građevinsko zemljište na prodaju, Gabrovački put, 62.000€, 19a - 4zida",2024-01-12,
343,https://www.4zida.rs/prodaja-placeva/vranic-barajevo-opstina-beograd/gradjevinsko-zemljiste/6538206aa12f1151170120a2,građevinsko zemljište ,37 a ,,pre 24 dana ,45.000,Ilije Jelica 4,"Vranić, Barajevo opština, Beograd","<h2 _ngcontent-ng-c3151048826 class=""mat-headline-5"">Opis oglasa</h2><div _ngcontent-ng-c3151048826 class=""prose max-h-64 overflow-hidden text-gray-800 ng-star-inserted""><p>Prodaje se plac od 37 ari, sve se vodi kao gradjevinsko zemljiste, na sta se svake godine uredno placa porez. Na placu postoje 2 kuce koje su stare ali mogu da se adaptiraju za zivot. Plac poseduje struju, vodu, telefonsku liniju, vocnjak, vinograd i pasnjak.","Građevinsko zemljište na prodaju, Ilije Jelica 4, 45.000€, 37a - 4zida",2024-01-12,uknjiženo 
