,link,Tip,Površina,Šifra oglasa,Oglas ažuriran,price,street,address,description,title,end_date,Uknjiženost
71,https://www.4zida.rs/prodaja-placeva/zaovine-tara/gradjevinsko-zemljiste/651d5fe0a754807ec00d6283,građevinsko zemljište ,108 a ,,pre 8 dana ,216.000,Zaovine bb,"Zaovine, Tara","<h2 _ngcontent-ng-c3151048826 class=""mat-headline-5"">Opis oglasa</h2><div _ngcontent-ng-c3151048826 class=""prose max-h-64 overflow-hidden text-gray-800 ng-star-inserted""><p>Prelep plac na Tari, na 200m od Zaovinskog jezera. Plac ima 108 ari, redovno je održavan, struja prolazi kroz njega a voda na 200m od placa. Moguća korekcija cene za kupce koji žele da kupe ceo plac.","Građevinsko zemljište na prodaju, Zaovine bb, 216.000€, 108a - 4zida",2024-01-12,uknjiženo 
72,https://www.4zida.rs/prodaja-placeva/sumarice-gradske-lokacije-kragujevac/gradjevinsko-zemljiste/6359742709f7d8ea0f064854,građevinsko zemljište ,11 a ,,pre 1 godinu ,90.000,Na Šumaričkom jezeru,"Šumarice, Gradske lokacije, Kragujevac","<h2 _ngcontent-ng-c3151048826 class=""mat-headline-5"">Opis oglasa</h2><div _ngcontent-ng-c3151048826 class=""prose max-h-64 overflow-hidden text-gray-800 ng-star-inserted""><p>Plac na jezeru u Sumaricama<br>Pravilan pravougaonik<br>11,5 ari<br>Prvi red do borića i jezera<br>Od prikljucaka ima struja,voda mogucnost prikljucka gradske kanalizacije,gas,telefon.","Građevinsko zemljište na prodaju, Na Šumaričkom jezeru, 90.000€, 11a - 4zida",2024-01-12,uknjiženo 
73,https://www.4zida.rs/prodaja-placeva/veternicka-rampa-veternik-gradske-lokacije-novi-sad/gradjevinsko-zemljiste/62750d93566429619839b663,građevinsko zemljište ,12.53 a ,7000035 ,pre 8 meseci ,123.600,Veternička Rampa,"Veternička Rampa, Veternik, Gradske lokacije, Novi Sad","<h2 _ngcontent-ng-c3151048826 class=""mat-headline-5"">Opis oglasa</h2><div _ngcontent-ng-c3151048826 class=""prose max-h-64 overflow-hidden text-gray-800 ng-star-inserted""><p>Novi Sad - Veternik - VETERNIČKA RAMPA. Predstavljamo plac u građevinsokom području. Predvođena izgradnja stambeno poslovnog objekta. Prizemlje, sprat i potkrovlje. Zauzetost parcele 40%. Na kraju placa je trafo (mogućnost uvođenja jače struje). Plac trapezastog oblika, ulični front oko 40m, zadnji deo placa 25m. U neposrednoj blizini kanala. Uknjižen. (Vinson nekretnine, Novi Sad, Reg. br. posrednika: 1085)","Građevinsko zemljište na prodaju, Veternička Rampa, 123.600€, 12a - 4zida",2024-01-12,uknjiženo 
74,https://www.4zida.rs/prodaja-placeva/djurdjevo-brdo-gradske-lokacije-jagodina/gradjevinsko-zemljiste/644d2986ba5267636405b9f8,građevinsko zemljište ,39.72 a ,5185 ,pre 8 meseci ,28.000,Đurđevo Brdo,"Đurđevo Brdo, Gradske lokacije, Jagodina","<h2 _ngcontent-ng-c3151048826 class=""mat-headline-5"">Opis oglasa</h2><div _ngcontent-ng-c3151048826 class=""prose max-h-64 overflow-hidden text-gray-800 ng-star-inserted""><p>Prodaju se dve parcele,lep položaj parcele.","Građevinsko zemljište na prodaju, Đurđevo Brdo, 28.000€, 39a - 4zida",2024-01-12,
75,https://www.4zida.rs/prodaja-placeva/gradske-lokacije-doljevac/gradjevinsko-zemljiste/60f8b6afccec3565d1133128,građevinsko zemljište ,123.89 a ,p,pre 8 meseci ,70.000,Doljevac,"Gradske lokacije, Doljevac","<h2 _ngcontent-ng-c3151048826 class=""mat-headline-5"">Opis oglasa</h2><div _ngcontent-ng-c3151048826 class=""prose max-h-64 overflow-hidden text-gray-800 ng-star-inserted""><p>Na prodaju plac pored autoputa E75.<br>Ukupna površina placa 1ha 23a 89m2, ulazni front ima oko 140m.<br>Pogodan za benzinsku pumpu, proizvodno-skladišna postrojenja, predstavništva različitih delatnosti i sl.<br>U neposrednoj blizini nalaze se benzinska pumpa, fabrika LEONI, reka Južna Morava.<br>Cena je 70.000,00€. Uknjiženo, vlasništo 1/1. Za više informacija slobodno pozovite.","Građevinsko zemljište na prodaju, Doljevac, 70.000€, 123a - 4zida",2024-01-12,uknjiženo 
76,https://www.4zida.rs/prodaja-placeva/zuce-vozdovac-opstina-beograd/gradjevinsko-zemljiste/6213dda87a20a7309011f238,građevinsko zemljište ,91.44 a ,2281 ,pre 8 meseci ,350.000,Zuce,"Zuce, Voždovac opština, Beograd","<h2 _ngcontent-ng-c3151048826 class=""mat-headline-5"">Opis oglasa</h2><div _ngcontent-ng-c3151048826 class=""prose max-h-64 overflow-hidden text-gray-800 ng-star-inserted""><p>Na prodaju plac u selu Zuce, opština Voždovac, površine 91,44 ari, pored asfalta i puta od centra Zuca ka autoputu i ""Ikei"". Sva infrastruktura uz plac, struja, voda, gas i ulična rasveta. Udaljenost od ""Ikee"" 800 metara. Plac ravan, ravougaonog oblika, pogodan za sve namene, gradnju hala, stovarišta, garaža. Sa placa se pruža divan pogled na autoput, ""Ikeu"" i okolinu. Fantastična lokacija.","Građevinsko zemljište na prodaju, Zuce, 350.000€, 91a - 4zida",2024-01-12,uknjiženo 
77,https://www.4zida.rs/prodaja-placeva/gornji-komren-crveni-krst-gradske-lokacije-nis/gradjevinsko-zemljiste/611e1d116cd39970b84da04b,građevinsko zemljište ,395 a ,8721 ,pre 11 meseci ,6.000,Gornji Komren,"Gornji Komren, Crveni Krst, Gradske lokacije, Niš","<h2 _ngcontent-ng-c3151048826 class=""mat-headline-5"">Opis oglasa</h2><div _ngcontent-ng-c3151048826 class=""prose max-h-64 overflow-hidden text-gray-800 ng-star-inserted""><p>NIŠ - CRVENI KRST - GORNJI KOMREN - GRADSKO-GRAĐEVINSKO ZEMLJIŠTE 3,95 ARA","Građevinsko zemljište na prodaju, Gornji Komren, 6.000€, 395a - 4zida",2024-01-12,uknjiženo 
78,https://www.4zida.rs/prodaja-placeva/gradske-lokacije-velika-plana/gradjevinsko-zemljiste/64e217495a447c19b3013670,građevinsko zemljište ,24 a ,,pre 2 meseca ,27.500,Gradske lokacije,"Gradske lokacije, Velika Plana","<h2 _ngcontent-ng-c3151048826 class=""mat-headline-5"">Opis oglasa</h2><div _ngcontent-ng-c3151048826 class=""prose max-h-64 overflow-hidden text-gray-800 ng-star-inserted""><p>Na prodaju gradsko građevinsko zemljište površine 24 ara.","Građevinsko zemljište na prodaju, Gradske lokacije, 27.500€, 24a - 4zida",2024-01-12,uknjiženo 
79,https://www.4zida.rs/prodaja-placeva/donja-klisa-klisa-gradske-lokacije-novi-sad/gradjevinsko-zemljiste/64bce2b16081fa048506affd,građevinsko zemljište ,5.4 a ,,pre 16 dana ,75.000,Bože Kuzmanovica,"Donja Klisa, Klisa, Gradske lokacije, Novi Sad","<h2 _ngcontent-ng-c3151048826 class=""mat-headline-5"">Opis oglasa</h2><div _ngcontent-ng-c3151048826 class=""prose max-h-64 overflow-hidden text-gray-800 ng-star-inserted""><p>Prodajem plac u Novom Sadu u ulici Bože Kuzmanovića od 540 kv. Plac je gradjevinsko zemljište 1/1. Dozvoljena gradnja je P/1/PK. Mogucnost gradnje porudične kuce ili urbanih vila. Pored placa prolaze svi priključci, struja, voda , kanalizacija, gas i asfalt. Odlična lokacija.","Građevinsko zemljište na prodaju, Bože Kuzmanovica, 75.000€, 5a - 4zida",2024-01-12,uknjiženo 
80,https://www.4zida.rs/prodaja-placeva/makis-cukarica-cukarica-opstina-beograd/gradjevinsko-zemljiste/6585c4c74ff0f5979808bb06,građevinsko zemljište ,80 a ,4145 ,pre 21 dana ,295.000,Makiš,"Makiš, Čukarica, Čukarica opština, Beograd","<h2 _ngcontent-ng-c3151048826 class=""mat-headline-5"">Opis oglasa</h2><div _ngcontent-ng-c3151048826 class=""prose max-h-64 overflow-hidden text-gray-800 ng-star-inserted""><p>U ponudi imamo izuzetan plac u Makisu , blizu Starog obrenovackog puta sa  prilazom za teretna vozila , kamione i šlepere.  Postoji ucrtan put do placa !<br>Plac je ravan  , nasut , pravilnog oblika .<br>Odličan  za hale i magacinski prostor .<br>Za svaku preporuku  1012 Oznaka na mapi pokazuje deo grada, ne i tačan položaj zgrade.","Građevinsko zemljište na prodaju, Makiš, 295.000€, 80a - 4zida",2024-01-12,uknjiženo 
81,https://www.4zida.rs/prodaja-placeva/gradske-lokacije-pecinci/gradjevinsko-zemljiste/654b454ad9b112ce93099510,građevinsko zemljište ,170.54 a ,2285,pre 2 meseca ,460.000,Šimanovci,"Gradske lokacije, Pećinci","<h2 _ngcontent-ng-c3151048826 class=""mat-headline-5"">Opis oglasa</h2><div _ngcontent-ng-c3151048826 class=""prose max-h-64 overflow-hidden text-gray-800 ng-star-inserted""><p>Prodaje se atraktivno gradsko građevinsko zemljište, površine 1,7 hektara u industrijskoj zoni naselja Šimanovci. U neposrednoj blizini ove parcele su uspešne kompanije kao što je Milšped, DHL, Tesla paneli. Ovo zemljište pruža izvrsnu priliku investitorima koji žele iskoristiti njegov potencijal u razvoju.Specifikacija zemljišta:Površina: 17.054 m2  (oko 1.7 hektara)Lokacija:  Šimanovci, industrijska zona, uz autoput A3 (Beograd-Zagreb). u blizini DHL, Milšped, Tesla panelsInfrastruktura: Asfaltni put do parcele, voda, struja, gas, telekomunikacijske mrežeOvo zemljište ima stratešku lokaciju koja privlači mnoge poslovne subjekte i investitore i nudi ogroman potencijal za realizaciju različitih projekata poput poslovnih objekata, fabrika, skaldišta...Posebna pogodnost: ova parcela je deo jedinstvene ponude na ovoj lokaciji, ukupne površine oko 7 hektara.Ne propustite ovu jedinstvenu priliku za investiranje!.","Građevinsko zemljište na prodaju, Šimanovci, 460.000€, 170a - 4zida",2024-01-12,uknjiženo 
82,https://www.4zida.rs/prodaja-placeva/tresnja-sopot-opstina-beograd/gradjevinsko-zemljiste/650eb9d8fe0a304e8c032702,,,,,,,,,"Prodaja placeva Trešnja, Sopot opština, Beograd, Građevinsko zemljište - 4zida",2024-01-12,
83,https://www.4zida.rs/prodaja-placeva/crveni-krst-gradske-lokacije-nis/gradjevinsko-zemljiste/64984aa3cac87f625a021c31,,,,,,,,,"Građevinsko zemljište na prodaju, Crveni Krst, 145.000€, 26a - 4zida",2024-01-12,
84,https://www.4zida.rs/prodaja-placeva/gradske-lokacije-merosina/gradjevinsko-zemljiste/63cfbf37f5c44828ff08a0fa,građevinsko zemljište ,75 a ,p,pre 8 meseci ,41.200,Mramorsko Brdo,"Gradske lokacije, Merošina","<h2 _ngcontent-ng-c3151048826 class=""mat-headline-5"">Opis oglasa</h2><div _ngcontent-ng-c3151048826 class=""prose max-h-64 overflow-hidden text-gray-800 ng-star-inserted""><p>Na prodaju plac na Mramorskom Brdu u blizini Bifteka.							","Građevinsko zemljište na prodaju, Mramorsko Brdo, 41.200€, 75a - 4zida",2024-01-12,
85,https://www.4zida.rs/prodaja-placeva/radanovac-gradske-lokacije-subotica/gradjevinsko-zemljiste/645b31e376e0c08f8801ece6,građevinsko zemljište ,609 a ,,pre 11 sati ,1.600.000,Ulica Mira,"Radanovac, Gradske lokacije, Subotica","<h2 _ngcontent-ng-c3151048826 class=""mat-headline-5"">Opis oglasa</h2><div _ngcontent-ng-c3151048826 class=""prose max-h-64 overflow-hidden text-gray-800 ng-star-inserted""><p>Prodaje se građevinsko zemljište površine 60.950 m2 uz Palićki put. Vlasništvo 1/1. Cena 1,6 miliona eura. Prednji izadnji front su širine 171m. Dubina parcele je 357m. Parcela je regulisana Planom detaljne regulacije za deo bloka 17.3 južno od državnog puta I reda M-22.1. Moguće je graditi objekte sa sledećom namenom: poslovni objekat, poslovno-proizvodni, poslovno-skladišni i proizvodno-skladišni objekat. Maksimalni dozvoljeni indeks zauzetosti je 40%. Najveća dozvoljena spratnost je P+2+Pk. Kontakt telefon za sve informacije 065/9777088.","Građevinsko zemljište na prodaju, Ulica Mira, 1.600.000€, 609a - 4zida",2024-01-12,uknjiženo 
86,https://www.4zida.rs/prodaja-placeva/ralja-sopot-opstina-beograd/gradjevinsko-zemljiste/65219f05848e7789620be503,građevinsko zemljište ,100 a ,,pre 2 meseca ,300.000,Zmaj Jovina,"Ralja, Sopot opština, Beograd","<h2 _ngcontent-ng-c3151048826 class=""mat-headline-5"">Opis oglasa</h2><div _ngcontent-ng-c3151048826 class=""prose max-h-64 overflow-hidden text-gray-800 ng-star-inserted""><p>Na prodaju plac veličine 1ha u Ralji u neposrednoj blizini Avalskog puta na 32km udaljenosti od Beograda. ","Građevinsko zemljište na prodaju, Zmaj Jovina, 300.000€, 100a - 4zida",2024-01-12,uknjiženo 
87,https://www.4zida.rs/prodaja-placeva/siljakovac-barajevo-opstina-beograd/gradjevinsko-zemljiste/652f788c9d7730924d080e15,,,,,,,,,"Prodaja placeva Šiljakovac, Barajevo opština, Beograd, Građevinsko zemljište - 4zida",2024-01-12,
88,https://www.4zida.rs/prodaja-placeva/veternik-gradske-lokacije-novi-sad/gradjevinsko-zemljiste/64b677fa516a8e96ed0027ec,,,,,,,,,"Prodaja placeva Veternik, Gradske lokacije, Novi Sad, Građevinsko zemljište - 4zida",2024-01-12,
89,https://www.4zida.rs/prodaja-placeva/glogovac-okolne-lokacije-jagodina/gradjevinsko-zemljiste/6256ec7218f6fd5619667a75,građevinsko zemljište ,16.48 a ,5881 ,pre 8 meseci ,10.000,Glogovac,"Glogovac, Okolne lokacije, Jagodina","<h2 _ngcontent-ng-c3151048826 class=""mat-headline-5"">Opis oglasa</h2><div _ngcontent-ng-c3151048826 class=""prose max-h-64 overflow-hidden text-gray-800 ng-star-inserted""><p>Plac uz put, odličan prilaz za automobile.","Građevinsko zemljište na prodaju, Glogovac, 10.000€, 16a - 4zida",2024-01-12,uknjiženo 
90,https://www.4zida.rs/prodaja-placeva/parcani-sopot-opstina-beograd/gradjevinsko-zemljiste/63a9e78d9d342831ed07f4d9,građevinsko zemljište ,167.96 a ,3471 ,pre 8 meseci ,67.200,Velje Milenkovića,"Parcani, Sopot opština, Beograd","<h2 _ngcontent-ng-c3151048826 class=""mat-headline-5"">Opis oglasa</h2><div _ngcontent-ng-c3151048826 class=""prose max-h-64 overflow-hidden text-gray-800 ng-star-inserted""><p>Na prodaju zemljište, u građevinskom području, u Parcanima, opština Sopot, površine 1 ha i 70ari. Zemljište je uz tvrdo nasuti put, električna energija i gradska voda na 100 metara, u komadu na jednoj katastarskoj parceli. Širina do puta je oko 75 metara, Dužina oko 200 metara. Pogodno za gradnju više stambenih jedinica ili izgradnju etno sela. Pogled panoramski, ničim zaklonjen, u blizini par vikendica. Nadmorska visina oko 250 metara, zemljište skoro pa ravno. Osmisli,kupi, zaradi, uživaj.","Građevinsko zemljište na prodaju, Velje Milenkovića, 67.200€, 167a - 4zida",2024-01-12,
91,https://www.4zida.rs/prodaja-placeva/jovanovac-okolne-lokacije-kragujevac/gradjevinsko-zemljiste/5e80a83c27317166e4528507,građevinsko zemljište ,94.51 a ,4293 ,pre 8 meseci ,1,Jovanovac,"Jovanovac, Okolne lokacije, Kragujevac","<h2 _ngcontent-ng-c3151048826 class=""mat-headline-5"">Opis oglasa</h2><div _ngcontent-ng-c3151048826 class=""prose max-h-64 overflow-hidden text-gray-800 ng-star-inserted""><p>Plac u Jovanovcu u Industrijskoj zoni od 94,51a na odličnoj lokaciji. Ima dva simetrična ulaza iz dve ulice širine od po 100m. Posut je zemljom i izravnjan. Plac ima vodu, kanalizaciju i gas. Cena po dogovoru.","Građevinsko zemljište na prodaju, Jovanovac, 1€, 94a - 4zida",2024-01-12,nije uknjiženo 
92,https://www.4zida.rs/prodaja-placeva/zaklopaca-grocka-opstina-beograd/gradjevinsko-zemljiste/64f5afdcb19b138db80970d7,,,,,,,,,"Prodaja placeva Zaklopača, Grocka opština, Beograd, Građevinsko zemljište - 4zida",2024-01-12,
93,https://www.4zida.rs/prodaja-placeva/visnjak-gradske-lokacije-kragujevac/gradjevinsko-zemljiste/5c8a7a0a9a3091193f0a88d5,građevinsko zemljište ,13 a ,,pre 1 dan ,26.000,Mladena Stefanovića Bb,"Višnjak, Gradske lokacije, Kragujevac","<h2 _ngcontent-ng-c3151048826 class=""mat-headline-5"">Opis oglasa</h2><div _ngcontent-ng-c3151048826 class=""prose max-h-64 overflow-hidden text-gray-800 ng-star-inserted""><p>Trenutno je vocnjak. Ogradjen.","Građevinsko zemljište na prodaju, Mladena Stefanovića Bb, 26.000€, 13a - 4zida",2024-01-12,uknjiženo 
94,https://www.4zida.rs/prodaja-placeva/donji-matejevac-okolne-lokacije-nis/gradjevinsko-zemljiste/63ff53532bb17163bd0879b7,građevinsko zemljište ,31.05 a ,p,pre 8 meseci ,12.000,Donji Matejevac,"Donji Matejevac, Okolne lokacije, Niš","<h2 _ngcontent-ng-c3151048826 class=""mat-headline-5"">Opis oglasa</h2><div _ngcontent-ng-c3151048826 class=""prose max-h-64 overflow-hidden text-gray-800 ng-star-inserted""><p>Na prodaju odličan plac u Donjem Matejevcu. Plac je poljoprivredno zemljište, ukupne površine 3105m2. Prednji front je 15,21m širine, dužina placa je 184,20m. Nalazi se pored puta. Uknjižen, čisto vlasništvo.Ovo je samo deo naše ponude, ovu kao  i ostale ponude sa većim brojem fotografija možete pogledati na našem sajtu.","Građevinsko zemljište na prodaju, Donji Matejevac, 12.000€, 31a - 4zida",2024-01-12,uknjiženo 
95,https://www.4zida.rs/prodaja-placeva/rusanj-cukarica-opstina-beograd/gradjevinsko-zemljiste/62e8de14a959a106b3003f0c,građevinsko zemljište ,40 a ,16113 ,pre 8 meseci ,190.000,Rušanj,"Rušanj, Čukarica opština, Beograd","<h2 _ngcontent-ng-c3151048826 class=""mat-headline-5"">Opis oglasa</h2><div _ngcontent-ng-c3151048826 class=""prose max-h-64 overflow-hidden text-gray-800 ng-star-inserted""><p>Izuzetna prilika<br>Prodaje se 40 ari zemljišta nadomak Beograda tik uz Ibarsku magistralu na 100-ak metara od Cryogas pumpe.<br>Dimenzije placa cca 35m x 130m.","Građevinsko zemljište na prodaju, Rušanj, 190.000€, 40a - 4zida",2024-01-12,uknjiženo 
96,https://www.4zida.rs/prodaja-placeva/camurlija-okolne-lokacije-nis/gradjevinsko-zemljiste/633c40c6b1aec5120d0c1f84,građevinsko zemljište ,35.11 a ,p,pre 7 meseci ,63.500,Toponički put,"Čamurlija, Okolne lokacije, Niš","<h2 _ngcontent-ng-c3151048826 class=""mat-headline-5"">Opis oglasa</h2><div _ngcontent-ng-c3151048826 class=""prose max-h-64 overflow-hidden text-gray-800 ng-star-inserted""><p>Na prodaju plac u Camurliji, preko puta mlekare Milk House, nekih 500 metara od glavnog puta.								","Građevinsko zemljište na prodaju, Toponički put, 63.500€, 35a - 4zida",2024-01-12,
97,https://www.4zida.rs/prodaja-placeva/zuce-vozdovac-opstina-beograd/gradjevinsko-zemljiste/648601bbd48722330a00b989,,,,,,,,,"Prodaja placeva Zuce, Voždovac opština, Beograd, Građevinsko zemljište - 4zida",2024-01-12,
98,https://www.4zida.rs/prodaja-placeva/gradske-lokacije-kraljevo/gradjevinsko-zemljiste/5b5726cdb70c59250b488722,građevinsko zemljište ,9.5 a ,,pre 5 sati ,15.000,11. Autodromska 15,"Gradske lokacije, Kraljevo","<h2 _ngcontent-ng-c3151048826 class=""mat-headline-5"">Opis oglasa</h2><div _ngcontent-ng-c3151048826 class=""prose max-h-64 overflow-hidden text-gray-800 ng-star-inserted""><p>Prodajem plac u Kovanluku, vlasnik, 3km od centra Kraljeva, građevinsko zemljište parcela 402/32","Građevinsko zemljište na prodaju, 11. Autodromska 15, 15.000€, 9a - 4zida",2024-01-12,uknjiženo 
99,https://www.4zida.rs/prodaja-placeva/ozrenkso-naselje-gradske-lokacije-prokuplje/gradjevinsko-zemljiste/631779adecf2251fcb044fdb,građevinsko zemljište ,14.3 a ,,pre 3 meseca ,19.500,Banijska,"Ozrenkso Naselje, Gradske lokacije, Prokuplje","<h2 _ngcontent-ng-c3151048826 class=""mat-headline-5"">Opis oglasa</h2><div _ngcontent-ng-c3151048826 class=""prose max-h-64 overflow-hidden text-gray-800 ng-star-inserted""><p>Prodajem 14,3 ara gradskog gradjevinskog zemljista u Prokuplju. Plac se nalazi u Banijskoj ulici 2km od centra.","Građevinsko zemljište na prodaju, Banijska, 19.500€, 14a - 4zida",2024-01-12,uknjiženo 
100,https://www.4zida.rs/prodaja-placeva/palilula-gradske-lokacije-nis/gradjevinsko-zemljiste/652d37a7af11b8c78a075fa6,građevinsko zemljište ,6.06 a ,p,pre 2 meseca ,33.000,Kovanlučka,"Palilula, Gradske lokacije, Niš","<h2 _ngcontent-ng-c3151048826 class=""mat-headline-5"">Opis oglasa</h2><div _ngcontent-ng-c3151048826 class=""prose max-h-64 overflow-hidden text-gray-800 ng-star-inserted""><p>Na  prodaju  plac - gradsko  građevinsko  zemljište, na  Paliluli, blizu  restorana Amerikanac.  Plac  je  pravougaonog  oblika, sa  izlaskom  na  ulicu,  na  odličnoj  lokaciji  za  individualnu  stambenu  gradnju. Uknjižen  kao  privatna  svojina.  Odlična  ponuda. Za  više  informacija  pozovite  agenciju.","Građevinsko zemljište na prodaju, Kovanlučka, 33.000€, 6a - 4zida",2024-01-12,uknjiženo 
101,https://www.4zida.rs/prodaja-placeva/dobanovci-surcin-opstina-beograd/gradjevinsko-zemljiste/64799b1251b3978d8c051342,,,,,,,,,"Prodaja placeva Dobanovci, Surčin opština, Beograd, Građevinsko zemljište - 4zida",2024-01-12,
102,https://www.4zida.rs/prodaja-placeva/sirca-okolne-lokacije-kraljevo/gradjevinsko-zemljiste/64d4aa6726066e9eea0607bd,građevinsko zemljište ,71.47 a ,,pre 30 dana ,49.990,Ribarska,"Sirča, Okolne lokacije, Kraljevo","<h2 _ngcontent-ng-c3151048826 class=""mat-headline-5"">Opis oglasa</h2><div _ngcontent-ng-c3151048826 class=""prose max-h-64 overflow-hidden text-gray-800 ng-star-inserted""><p>Na prodaju građevinsko zemiljište na atraktivnoj lokaciji pored autoputa u izgradnji Pojate - Preljina (Moravski koridor) u neposrednoj blizini petlje Kamidžora kod Kraljeva. Naime radi se o parcelama označenim na fotografijama u prilogu 1989/1 i 1989/3 odnosno nakon izvršene eksproprijacije dela pomenutih parcela, postaju cele parcele 1989/5 površine <strong>32.49</strong> ari i 1989/7 površine <strong>38.98</strong> ari, <strong>ukupno 71.47 ari</strong>, sve u KO Sirča, opština Kraljevo. Vlasnik 1/1","Građevinsko zemljište na prodaju, Ribarska, 49.990€, 71a - 4zida",2024-01-12,uknjiženo 
103,https://www.4zida.rs/prodaja-placeva/zaklopaca-grocka-opstina-beograd/gradjevinsko-zemljiste/651a99aedd7549cd1b01784f,građevinsko zemljište ,7.5 a ,18911 ,pre 3 meseca ,28.000,Beogradska,"Zaklopača, Grocka opština, Beograd","<h2 _ngcontent-ng-c3151048826 class=""mat-headline-5"">Opis oglasa</h2><div _ngcontent-ng-c3151048826 class=""prose max-h-64 overflow-hidden text-gray-800 ng-star-inserted""><p>Zemljište u građevinskom području 7.5ari u Zaklopači na kome se nalazi vikendica koja je spratnosti P+PK, prizemlje čini soba 16.16m2 i potkrovlje soba 2.59m2 sa upotrebnom dozvolom, kao i pomoćni objekat.<br>Vlasniku pripada i deo druge parcele od 2.5ara koji je uknjižen u katastar u svojini 1/2, koristi se za put.<br>Do samog placa se dolazi sa Smederevskog puta direktno, ima svoju rampu.<br>Na placu je gradski vodovod, struja na 10 metara.<br>Divan pogled ka Kosmaju i Avali.<br>Uknjiženo.<br>Za ozbiljne kupce mogućnost korigovanja cene!","Građevinsko zemljište na prodaju, Beogradska, 28.000€, 7a - 4zida",2024-01-12,uknjiženo 
104,https://www.4zida.rs/prodaja-placeva/barajevo-barajevo-opstina-beograd/gradjevinsko-zemljiste/62e2b880cc3eb157470f41f4,građevinsko zemljište ,204 a ,15778 ,pre 1 mesec ,190.000,Barajevo,"Barajevo, Barajevo opština, Beograd","<h2 _ngcontent-ng-c3151048826 class=""mat-headline-5"">Opis oglasa</h2><div _ngcontent-ng-c3151048826 class=""prose max-h-64 overflow-hidden text-gray-800 ng-star-inserted""><p>Retko u ponudi!<br>Izuzetan plac u Barajevu, na top lokaciji, sa fantastičnim pogledom.<br>Sva infrastruktura.","Građevinsko zemljište na prodaju, Barajevo, 190.000€, 204a - 4zida",2024-01-12,
105,https://www.4zida.rs/prodaja-placeva/stari-banovci-okolne-lokacije-stara-pazova/gradjevinsko-zemljiste/61b8e6699ef06b2125200e43,građevinsko zemljište ,23 a ,2056 ,pre 14 dana ,46.000,Đoke Jovanovića,"Stari Banovci, Okolne lokacije, Stara Pazova","<h2 _ngcontent-ng-c3151048826 class=""mat-headline-5"">Opis oglasa</h2><div _ngcontent-ng-c3151048826 class=""prose max-h-64 overflow-hidden text-gray-800 ng-star-inserted""><p>Odličan plac od 23 ari u Starim Banovcima. Uknjižen 1/1, ravan i pravilnog oblika, dimenzija 144m2x16m2, do asfaltnog puta sa širinom fronta 16m2. Mogućnost gradnje i priključenja struje, vode i gasa. ","Građevinsko zemljište na prodaju, Đoke Jovanovića, 46.000€, 23a - 4zida",2024-01-12,uknjiženo 
106,https://www.4zida.rs/prodaja-placeva/miljakovac-rakovica-opstina-beograd/gradjevinsko-zemljiste/649cb51f812aa7b8e009b340,,,,,,,,,"Građevinsko zemljište na prodaju, Nikole Bižumića, 73.000€, 5a - 4zida",2024-01-12,
107,https://www.4zida.rs/prodaja-placeva/misa-gradske-lokacije-pancevo/gradjevinsko-zemljiste/6388b0a4e3fda3183a004d9c,građevinsko zemljište ,20.13 a ,,pre 8 meseci ,105.000,Bavaništanski put,"Misa, Gradske lokacije, Pančevo","<h2 _ngcontent-ng-c3151048826 class=""mat-headline-5"">Opis oglasa</h2><div _ngcontent-ng-c3151048826 class=""prose max-h-64 overflow-hidden text-gray-800 ng-star-inserted""><p>Na prodaju plac na Bavaništanskom putu, do puta, gradsko građevinsko zemljište, površine 2013m2, ograđen visokim zidom, zid je urađen sa temeljom metar ispod zemlje i metar iznad, armiran u duplim zonama sa 12ticom armaturom, razlog je kako bi se teren nasipao i bio u ravni sa putem, nivo terena je podignut negde i 1 metar, zid je rađen od betonskih blokova sa serklažem i zid je jako visok, ograđen u potpunosti sa kapijom, na placu je bunar dubine 27m, plac ima izlaz na dve ulice, idealno za firme, hale, front je oko 19m, svojina privatna 1/1, sva dokumentacija u potpunosti.","Građevinsko zemljište na prodaju, Bavaništanski put, 105.000€, 20a - 4zida",2024-01-12,uknjiženo 
108,https://www.4zida.rs/prodaja-placeva/elemir-okolne-lokacije-zrenjanin/gradjevinsko-zemljiste/6261357bc0689b71f330e444,građevinsko zemljište ,7.91 a ,23893 ,pre 4 meseca ,9.700,Elemir,"Elemir, Okolne lokacije, Zrenjanin","<h2 _ngcontent-ng-c3151048826 class=""mat-headline-5"">Opis oglasa</h2><div _ngcontent-ng-c3151048826 class=""prose max-h-64 overflow-hidden text-gray-800 ng-star-inserted""><p>Elemir - plac površine 7,91 ar. Plac se nalazi na uglu dve ulice, specifičnog oblika i prikazanih približnih dimenzija, uknjižena kuća površine 90m2 je porušena, poseduje trofazni priključak struje, plin, vodu, jedan vlasnik.<br>Agencijska provizija za kupca je 1,5%, odnosno minimalno 300 evra.","Građevinsko zemljište na prodaju, Elemir, 9.700€, 7a - 4zida",2024-01-12,
