,link,Tip,Površina,Uknjiženost,Šifra oglasa,Oglas ažuriran,price,street,address,title,end_date,description
348,https://www.4zida.rs/prodaja-placeva/gradske-lokacije-irig/gradjevinsko-zemljiste/63a423fd59f2a61b410cfc7e,građevinsko zemljište ,27.14 a ,,156 ,pre 3 dana ,70.000,Gradske lokacije,"Gradske lokacije, Irig","Građevinsko zemljište na prodaju, Gradske lokacije, 70.000€, 27a - 4zida",2024-01-07,"<h2 _ngcontent-ng-c3151048826 class=""mat-headline-5"">Opis oglasa</h2><div _ngcontent-ng-c3151048826 class=""prose max-h-64 overflow-hidden text-gray-800 ng-star-inserted""><p>Prodaje se parcela od 2714m2, ostalo građevinsko zemljište, zona kuća za odmor. Parcela je jedna od 4 parcele koje ukupno čine parcelu od 17.374m2, a koja ima prilaz - put sa dve strane. Frontovi parcele su 160 m do glavnog i 250 do sporednog puta. Mogućnost gradnje vikend kuća ili objekata za smeštaj (apartmani) spratnostu Sut+P+Pk, bruto površine 150m2, minimalna parcela 1500m2 . Na paracelama većim od 5.000m2 moguća gradnja građevinskih kompleksa. Idiličan lepo sređen okoliš. Za više infrormacija 065 933 0044"
349,https://www.4zida.rs/prodaja-placeva/niska-banja-gradske-lokacije-nis/gradjevinsko-zemljiste/64e8c817f7b695addf092d32,građevinsko zemljište ,29.63 a ,uknjiženo ,p,pre 4 meseca ,61.000,Niška Banja,"Niška Banja, Gradske lokacije, Niš","Građevinsko zemljište na prodaju, Niška Banja, 61.000€, 29a - 4zida",2024-01-07,"<h2 _ngcontent-ng-c3151048826 class=""mat-headline-5"">Opis oglasa</h2><div _ngcontent-ng-c3151048826 class=""prose max-h-64 overflow-hidden text-gray-800 ng-star-inserted""><p>Na prodaju plac u Niškoj banji, u blizini teniskih terena. Nalazi se u naseljenom delu. Plac je gradsko građevinsko zemljište, osnovne namene za izgradnju objekta za stanovanje umerenih gustina u gradskom području. Dopunsku namenu predstavljaju objekti za ugostiteljstvo, trgovinu, zanatske usluge, komercijane usluge, kao i objekti u nameni sporta i rekreacije. Površina placa je 2963m2, uknjižen, čisto vlasništvo, privatna svojina 1 kroz 1. Ovo je samo deo naše ponude, ovu kao i druge nekretnine možete pogledati na našem sajtu."
350,https://www.4zida.rs/prodaja-placeva/kumodraz-vozdovac-opstina-beograd/gradjevinsko-zemljiste/63317b1aa870c7f29e078627,,,,,,,,,"Prodaja placeva Kumodraž, Voždovac opština, Beograd, Građevinsko zemljište - 4zida",2024-01-07,
351,https://www.4zida.rs/prodaja-placeva/aleksandrovo-gradske-lokacije-subotica/gradjevinsko-zemljiste/641b4f4a07d9188a8c015e36,građevinsko zemljište ,159 a ,uknjiženo ,nema ,pre 1 mesec ,238.500,Starine Novaka bb,"Aleksandrovo, Gradske lokacije, Subotica","Građevinsko zemljište na prodaju, Starine Novaka bb, 238.500€, 159a - 4zida",2024-01-07,"<h2 _ngcontent-ng-c3151048826 class=""mat-headline-5"">Opis oglasa</h2><div _ngcontent-ng-c3151048826 class=""prose max-h-64 overflow-hidden text-gray-800 ng-star-inserted""><p>Građevinsko neizgrađeno zemljište u PRIVREDNOJ ZONI , površine 15.921 m2, u blizini sva infrastruktura. Dimenzije placa su 100m širina, 159 m dužina placa, pravougaonog oblika, između ulice Starine Novaka i Beogradskog puta."
352,https://www.4zida.rs/prodaja-placeva/zemun-polje-zemun-zemun-opstina-beograd/gradjevinsko-zemljiste/64221877e4b99519880ca060,,,,,,,,,"Građevinsko zemljište na prodaju, Jankovića voće, 510.000€, 51a - 4zida",2024-01-07,
353,https://www.4zida.rs/prodaja-placeva/marsic-okolne-lokacije-kragujevac/gradjevinsko-zemljiste/631347d46ec84b69a90dedbd,građevinsko zemljište ,55 a ,,p,pre 8 meseci ,102.000,Kormanski put,"Maršić, Okolne lokacije, Kragujevac","Građevinsko zemljište na prodaju, Kormanski put, 102.000€, 55a - 4zida",2024-01-07,"<h2 _ngcontent-ng-c3151048826 class=""mat-headline-5"">Opis oglasa</h2><div _ngcontent-ng-c3151048826 class=""prose max-h-64 overflow-hidden text-gray-800 ng-star-inserted""><p>Na prodaju plac u Maršiću  od 55 ari. Zemljište je gradsko gradjevinsko.<br>Plac se nalazi pored asfaltnog puta i 40m se ide do placa neasfaltiranim putem. Struja i voda neposredno pored placa.<br> Ovo je topla preporuka Bulevar grupe. Za sve informacije i razgledanje stojimo vam na raspolaganju, radnim danom od 09 do 19h i subotom od 09 do 17h. Čekamo Vas."
354,https://www.4zida.rs/prodaja-placeva/malosiste-okolne-lokacije-doljevac/gradjevinsko-zemljiste/652d53d5b75c7f57f70c60af,građevinsko zemljište ,14.14 a ,,p,pre 2 meseca ,10.000,Malošište,"Malošište, Okolne lokacije, Doljevac","Građevinsko zemljište na prodaju, Malošište, 10.000€, 14a - 4zida",2024-01-07,"<h2 _ngcontent-ng-c3151048826 class=""mat-headline-5"">Opis oglasa</h2><div _ngcontent-ng-c3151048826 class=""prose max-h-64 overflow-hidden text-gray-800 ng-star-inserted""><p>Na prodaju plac u selu Malošište, oko 10 km od Niša, 1414m2 poljoprivredno zemljište sa mogućnošću prenamene zemljišta u gradsko gradjevinsko. Cena je 10.000,00 eur."
355,https://www.4zida.rs/prodaja-placeva/kusici-okolne-lokacije-ivanjica/gradjevinsko-zemljiste/5cd56e162731711e1b4faed2,građevinsko zemljište ,500 a ,,,pre 15 dana ,100.000,Kušići ,"Kušići , Okolne lokacije, Ivanjica","Građevinsko zemljište na prodaju, Kušići , 100.000€, 500a - 4zida",2024-01-07,"<h2 _ngcontent-ng-c3151048826 class=""mat-headline-5"">Opis oglasa</h2><div _ngcontent-ng-c3151048826 class=""prose max-h-64 overflow-hidden text-gray-800 ng-star-inserted""><p>Prodajem vlasničke udele u parcelama na Kušićima. Parcele se nalaze u blizini hotela. Na samoj ski stazi je udeo 11a.Moguć svaki dogovor. Kupovina je investicija."
356,https://www.4zida.rs/prodaja-placeva/centar-gradske-lokacije-kraljevo/gradjevinsko-zemljiste/63ad87295152a912fb0efe34,građevinsko zemljište ,10 a ,uknjiženo ,,pre 2 meseca ,18.000,Centar,"Centar, Gradske lokacije, Kraljevo","Građevinsko zemljište na prodaju, Centar, 18.000€, 10a - 4zida",2024-01-07,"<h2 _ngcontent-ng-c3151048826 class=""mat-headline-5"">Opis oglasa</h2><div _ngcontent-ng-c3151048826 class=""prose max-h-64 overflow-hidden text-gray-800 ng-star-inserted""><p>Prodaje se građevinsko zemljište u blizini Mol pumpe, ulica Rudopoljska, ukupne površine 10,06 a.<br>Plac je udaljen 1,5 km od centra grada.<br>Pogodan za različite namene."
357,https://www.4zida.rs/prodaja-placeva/velika-ivanca-mladenovac-opstina-beograd/gradjevinsko-zemljiste/640d1c01105bc5e1fc0e4a51,građevinsko zemljište ,69.51 a ,uknjiženo ,1166 ,pre 8 meseci ,41.706,Velika Ivanča,"Velika Ivanča, Mladenovac opština, Beograd","Građevinsko zemljište na prodaju, Velika Ivanča, 41.706€, 69a - 4zida",2024-01-07,"<h2 _ngcontent-ng-c3151048826 class=""mat-headline-5"">Opis oglasa</h2><div _ngcontent-ng-c3151048826 class=""prose max-h-64 overflow-hidden text-gray-800 ng-star-inserted""><p>Šifra: P477<br>Plac površine 69,51 ari idealan za izgradnju vikendice. Udaljen je 8 km od centra Kosmaja i nalazi se u divnom prirodnom okruženju. Ima struju, bunar i asfaltni prilaz. Beograd je udaljen sat vremena vožnje.<br>Ukoliko želite više informacija, pozovite broj:<br>  063/70-30-538 - Nataša<br>  062/80-10-641 - Tanja"
358,https://www.4zida.rs/prodaja-placeva/donje-medjurovo-okolne-lokacije-nis/gradjevinsko-zemljiste/637cf6becce36761d5053936,građevinsko zemljište ,14.86 a ,uknjiženo ,p,pre 6 meseci ,38.300,Donje Medjurovo,"Donje Međurovo, Okolne lokacije, Niš","Građevinsko zemljište na prodaju, Donje Medjurovo, 38.300€, 14a - 4zida",2024-01-07,"<h2 _ngcontent-ng-c3151048826 class=""mat-headline-5"">Opis oglasa</h2><div _ngcontent-ng-c3151048826 class=""prose max-h-64 overflow-hidden text-gray-800 ng-star-inserted""><p>Na prodaju plac u industrijskoj zoni Donje Međurovo. Ukupna površina placa je 1486m2, gradsko građevinsko zemljište. Nalazi se pored glavnog puta Niš Leskovac, u blizini fabrike Yura. Ulazni front oko 15m, dužina oko 100m. Pogodan je za gradnju poslovno proizvodnih, skladišnih, trgovinskih objekata i sl. Uknjižen, privatna svojina. Za više informacija slobodno pozovite."
359,https://www.4zida.rs/prodaja-placeva/mirijevo-zvezdara-opstina-beograd/gradjevinsko-zemljiste/5ed4e6639a30916fca75136b,,,,,,,,,"Prodaja placeva Mirijevo, Zvezdara opština, Beograd, Građevinsko zemljište - 4zida",2024-01-07,
360,https://www.4zida.rs/prodaja-placeva/umka-cukarica-opstina-beograd/gradjevinsko-zemljiste/64295aa6948842ee260b9b4e,građevinsko zemljište ,30 a ,uknjiženo ,,pre 3 meseca ,45.000,Umka,"Umka, Čukarica opština, Beograd","Građevinsko zemljište na prodaju, Umka, 45.000€, 30a - 4zida",2024-01-07,"<h2 _ngcontent-ng-c3151048826 class=""mat-headline-5"">Opis oglasa</h2><div _ngcontent-ng-c3151048826 class=""prose max-h-64 overflow-hidden text-gray-800 ng-star-inserted""><p>Plac površine 30ari Umka,opština Čukarica,prilaz placu sa ulice,900 metara od centra i škole na Umci.Cena nije fixna!"
361,https://www.4zida.rs/prodaja-placeva/kumodraz-vozdovac-opstina-beograd/gradjevinsko-zemljiste/651eb43fab3916c8d80c940d,,,,,,,,,"Prodaja placeva Kumodraž, Voždovac opština, Beograd, Građevinsko zemljište - 4zida",2024-01-07,
362,https://www.4zida.rs/prodaja-placeva/donje-vlase-okolne-lokacije-nis/gradjevinsko-zemljiste/650c3af42a8bf32048053ae6,građevinsko zemljište ,31 a ,uknjiženo ,,pre 2 meseca ,22.000,Rajka Mitica 15,"Donje Vlase, Okolne lokacije, Niš","Građevinsko zemljište na prodaju, Rajka Mitica 15, 22.000€, 31a - 4zida",2024-01-07,"<h2 _ngcontent-ng-c3151048826 class=""mat-headline-5"">Opis oglasa</h2><div _ngcontent-ng-c3151048826 class=""prose max-h-64 overflow-hidden text-gray-800 ng-star-inserted""><p>Na prodaju plac 31 ar na putu Za selo Donje Vlase 3,5 km od Nisa.Plac je gradsko gradjevinsko zemljiste dozvoljena gradnja ,jer sam vadio informaciju o parceli .Blizu placa struja I voda ,od glavnog puta je oko stotinu metara .Za zainteresovane moze I 15 ari ,jer je moguca parcelizacija parcele na vise placeva za sve informacije zvati na broj 0652562770"
363,https://www.4zida.rs/prodaja-placeva/kumodraz-vozdovac-opstina-beograd/gradjevinsko-zemljiste/61a915b85073635f3d13a2ea,građevinsko zemljište ,10 a ,uknjiženo ,1238 ,pre 3 meseca ,140.000,Vojvode Stepe,"Kumodraž, Voždovac opština, Beograd","Građevinsko zemljište na prodaju, Vojvode Stepe, 140.000€, 10a - 4zida",2024-01-07,"<h2 _ngcontent-ng-c3151048826 class=""mat-headline-5"">Opis oglasa</h2><div _ngcontent-ng-c3151048826 class=""prose max-h-64 overflow-hidden text-gray-800 ng-star-inserted""><p>Uknjižen plac na odličnoj lokaciji, pored glavnog puta sa svim infrastrukturnim elementima, gradsko građevinsko pravougaonog oblika, dozvoljena porodična gradnja."
364,https://www.4zida.rs/prodaja-placeva/cibukovac-gradske-lokacije-kraljevo/gradjevinsko-zemljiste/63b6adee4bdac1b20f0febfb,građevinsko zemljište ,5.5 a ,uknjiženo ,,pre 2 meseca ,16.500,2. Čibukovačka,"Čibukovac, Gradske lokacije, Kraljevo","Građevinsko zemljište na prodaju, 2. Čibukovačka, 16.500€, 5a - 4zida",2024-01-07,"<h2 _ngcontent-ng-c3151048826 class=""mat-headline-5"">Opis oglasa</h2><div _ngcontent-ng-c3151048826 class=""prose max-h-64 overflow-hidden text-gray-800 ng-star-inserted""><p>Plac na extra lokaciji, vlasnik 1/1. Nalazi se u Čibukovcu u mirnom delu i veoma blizu grada, plac je ravan, pogodan za sve vrste gradnje,u blizini se nalazi bazen Talas. Srećna kupovina."
365,https://www.4zida.rs/prodaja-placeva/rakovac-okolne-lokacije-beocin/gradjevinsko-zemljiste/64f8623026f78cb1de094075,građevinsko zemljište ,15.77 a ,uknjiženo ,44187 ,pre 4 meseca ,129.950,Rakovac,"Rakovac, Okolne lokacije, Beočin","Građevinsko zemljište na prodaju, Rakovac, 129.950€, 15a - 4zida",2024-01-07,"<h2 _ngcontent-ng-c3151048826 class=""mat-headline-5"">Opis oglasa</h2><div _ngcontent-ng-c3151048826 class=""prose max-h-64 overflow-hidden text-gray-800 ng-star-inserted""><p>Na prodaju odličan,ravan plac na Salaksijama sa prelepim pogledom na grad. Površina placa 1577m2 ,uknjižen 1/1 bez tereta!  ID oglasa: 44187."
366,https://www.4zida.rs/prodaja-placeva/okolne-lokacije-irig/gradjevinsko-zemljiste/638f52a95b03b610140c0453,,,,,,,,,"Prodaja placeva Okolne lokacije, Irig, Građevinsko zemljište - 4zida",2024-01-07,
367,https://www.4zida.rs/prodaja-placeva/vrdnik-okolne-lokacije-irig/gradjevinsko-zemljiste/64da389cb77ba0d1d5057c06,građevinsko zemljište ,5 a ,uknjiženo ,18690 ,pre 3 dana ,35.000,Vrdnik,"Vrdnik, Okolne lokacije, Irig","Građevinsko zemljište na prodaju, Vrdnik, 35.000€, 5a - 4zida",2024-01-07,"<h2 _ngcontent-ng-c3151048826 class=""mat-headline-5"">Opis oglasa</h2><div _ngcontent-ng-c3151048826 class=""prose max-h-64 overflow-hidden text-gray-800 ng-star-inserted""><p>Odličan plac za gradnju kuće na top lokaciji."
368,https://www.4zida.rs/prodaja-placeva/novo-selo-gradske-lokacije-subotica/gradjevinsko-zemljiste/646380e70513fea6c0031850,,,,,,,,,"Prodaja placeva Novo Selo, Gradske lokacije, Subotica, Građevinsko zemljište - 4zida",2024-01-07,
369,https://www.4zida.rs/prodaja-placeva/erdevik-okolne-lokacije-sid/gradjevinsko-zemljiste/64a4a137cd5c9bf57a0e2b78,,,,,,,,,"Prodaja placeva Erdevik, Okolne lokacije, Šid, Građevinsko zemljište - 4zida",2024-01-07,
370,https://www.4zida.rs/prodaja-placeva/surcin-surcin-opstina-beograd/gradjevinsko-zemljiste/60feafa38205696a5d3ea82d,građevinsko zemljište ,6.38 a ,uknjiženo ,,pre 1 dan ,80.000,Seljačke bune,"Surčin, Surčin opština, Beograd","Građevinsko zemljište na prodaju, Seljačke bune, 80.000€, 6a - 4zida",2024-01-07,"<h2 _ngcontent-ng-c3151048826 class=""mat-headline-5"">Opis oglasa</h2><div _ngcontent-ng-c3151048826 class=""prose max-h-64 overflow-hidden text-gray-800 ng-star-inserted""><p>Građevinsko zemljište na prodaju, br. parcele 2136/2. Centar, preko puta crkve, površina 633m2."
371,https://www.4zida.rs/prodaja-placeva/vlaska-mladenovac-opstina-beograd/gradjevinsko-zemljiste/6420802753fde74e5c01ddf9,građevinsko zemljište ,15 a ,uknjiženo ,1175 ,pre 8 meseci ,18.000,Vlaška,"Vlaška, Mladenovac opština, Beograd","Građevinsko zemljište na prodaju, Vlaška, 18.000€, 15a - 4zida",2024-01-07,"<h2 _ngcontent-ng-c3151048826 class=""mat-headline-5"">Opis oglasa</h2><div _ngcontent-ng-c3151048826 class=""prose max-h-64 overflow-hidden text-gray-800 ng-star-inserted""><p>Šifra: P483<br>Odlično ograđeno građevinsko zemljište površine 15 ari smešteno blizu glavnog puta u Vlaškom polju. Idealna lokacija za izgradnju objekta bilo koje namene, s obzirom na poziciju placa, kojoj se lako pristupa. Ima struju, a voda se nalazi odmah pored. Kosmaj je udaljen 15-ak km; centar Mladenovca 5 km, a Beograd se nalazi na 40 minuta vožnje, jer je izlazak na auto-put nedaleko.<br>Ukoliko želite više informacija, pozovite broj:<br>  063/70-30-538 - Nataša<br>  062/80-10-641 - Tanja"
372,https://www.4zida.rs/prodaja-placeva/surcin-surcin-opstina-beograd/gradjevinsko-zemljiste/63db65f32216d4719b03a468,,,,,,,,,"Prodaja placeva Surčin, Surčin opština, Beograd, Građevinsko zemljište - 4zida",2024-01-07,
373,https://www.4zida.rs/prodaja-placeva/muzlja-gradske-lokacije-zrenjanin/gradjevinsko-zemljiste/6412fa6d2ad53d681a0c9438,građevinsko zemljište ,4.88 a ,,27611 ,pre 4 meseca ,14.000,Mužlja,"Mužlja, Gradske lokacije, Zrenjanin","Građevinsko zemljište na prodaju, Mužlja, 14.000€, 4a - 4zida",2024-01-07,"<h2 _ngcontent-ng-c3151048826 class=""mat-headline-5"">Opis oglasa</h2><div _ngcontent-ng-c3151048826 class=""prose max-h-64 overflow-hidden text-gray-800 ng-star-inserted""><p>Mužlja - plac u mirnoj ulici površine 4,88 ara. Na placu se nalazio upisani stambeni objekat uknjižene površine 70m2, koji je srušen, plac je očišćen i spreman za gradnju. Dimenzije placa su 10,5m x 45m, monofazna struja, voda, uknjižen.<br>Agencijska provizija za kupca je 1,5%, odnosno minimalno 300 evra."
374,https://www.4zida.rs/prodaja-placeva/ugrinovci-zemun-opstina-beograd/gradjevinsko-zemljiste/64ff2232bbcaf02d1d09431b,građevinsko zemljište ,24.12 a ,uknjiženo ,18812 ,pre 3 meseca ,36.000,Nova 19.,"Ugrinovci, Zemun opština, Beograd","Građevinsko zemljište na prodaju, Nova 19., 36.000€, 24a - 4zida",2024-01-07,"<h2 _ngcontent-ng-c3151048826 class=""mat-headline-5"">Opis oglasa</h2><div _ngcontent-ng-c3151048826 class=""prose max-h-64 overflow-hidden text-gray-800 ng-star-inserted""><p>Odličan plac u Ugrinovcima.<br>Poseduje struju i vodu sa frontom od 80m.Dozvoljena gradnja P+1+Pk."
375,https://www.4zida.rs/prodaja-placeva/centar-gradske-lokacije-smederevo/gradjevinsko-zemljiste/64aeef98f8b0e7f3d50d70da,građevinsko zemljište ,66.8 a ,uknjiženo ,18510 ,pre 5 meseci ,59.000,Centar,"Centar, Gradske lokacije, Smederevo","Građevinsko zemljište na prodaju, Centar, 59.000€, 66a - 4zida",2024-01-07,"<h2 _ngcontent-ng-c3151048826 class=""mat-headline-5"">Opis oglasa</h2><div _ngcontent-ng-c3151048826 class=""prose max-h-64 overflow-hidden text-gray-800 ng-star-inserted""><p>Mihajlovac, plac od 66,8 ari na glavnom putu, pored benzinske pumpe.<br>Pod voćem, zemljište u građevinskom području.<br>Širok front do glavnog puta."
376,https://www.4zida.rs/prodaja-placeva/gradske-lokacije-indjija/gradjevinsko-zemljiste/620ec304f2832f15f87d42c3,građevinsko zemljište ,30 a ,uknjiženo ,GZ,pre 1 godinu ,150.000,Gradske lokacije,"Gradske lokacije, Inđija","Građevinsko zemljište na prodaju, Gradske lokacije, 150.000€, 30a - 4zida",2024-01-07,"<h2 _ngcontent-ng-c3151048826 class=""mat-headline-5"">Opis oglasa</h2><div _ngcontent-ng-c3151048826 class=""prose max-h-64 overflow-hidden text-gray-800 ng-star-inserted""><p>Građevinsko zemljište površine 30 ari, širina 30 m, udaljeno od centra grada 1,5 km. Plac je snabdeven vodom i strujom (trofazna i monofazna). Ograđen. Pogodno za izgradnju privrednih i stambenih objekata. GZ-315"
377,https://www.4zida.rs/prodaja-placeva/aqua-park-gradske-lokacije-jagodina/gradjevinsko-zemljiste/651b6b495e176d0f10024e1c,građevinsko zemljište ,4 a ,uknjiženo ,,pre 2 meseca ,15.000,Tavric Obori 539/28,"Aqua Park, Gradske lokacije, Jagodina","Građevinsko zemljište na prodaju, Tavric Obori 539/28, 15.000€, 4a - 4zida",2024-01-07,"<h2 _ngcontent-ng-c3151048826 class=""mat-headline-5"">Opis oglasa</h2><div _ngcontent-ng-c3151048826 class=""prose max-h-64 overflow-hidden text-gray-800 ng-star-inserted""><p>Prodajem plac 402m2 tavric obori"
378,https://www.4zida.rs/prodaja-placeva/novi-slankamen-okolne-lokacije-indjija/gradjevinsko-zemljiste/64fc5bb54079e6ebf302549e,građevinsko zemljište ,80 a ,uknjiženo ,,pre 3 meseca ,102.000,Slankamen,"Novi Slankamen, Okolne lokacije, Inđija","Građevinsko zemljište na prodaju, Slankamen, 102.000€, 80a - 4zida",2024-01-07,"<h2 _ngcontent-ng-c3151048826 class=""mat-headline-5"">Opis oglasa</h2><div _ngcontent-ng-c3151048826 class=""prose max-h-64 overflow-hidden text-gray-800 ng-star-inserted""><h3><strong>80 ari gradjevinskog zemljišta</strong> gde sa svakog kvadratnog metra placa imate pogled na Dunav.</h3><p>Plac koji predstavljamo se nalazi u Novom Slankamenu. Na putu koji iz pravca Slankamenačkih vinograda, pored poznate vinarije Stojanović prolazi do Starog Slankamena."
379,https://www.4zida.rs/prodaja-placeva/elemir-okolne-lokacije-zrenjanin/gradjevinsko-zemljiste/62f379c6654d79f8f2005e0f,građevinsko zemljište ,6.07 a ,,25268 ,pre 4 meseca ,13.500,Elemir,"Elemir, Okolne lokacije, Zrenjanin","Građevinsko zemljište na prodaju, Elemir, 13.500€, 6a - 4zida",2024-01-07,"<h2 _ngcontent-ng-c3151048826 class=""mat-headline-5"">Opis oglasa</h2><div _ngcontent-ng-c3151048826 class=""prose max-h-64 overflow-hidden text-gray-800 ng-star-inserted""><p>Elemir - kuća za rušenje uknjižene površine 126m2 na placu od 6,07 ara. Dimenzije placa su 16x38m, monofazna struja, priključak plina do kuće, voda, septička jama, kolski ulaz, asfaltni put, jedan vlasnik.<br>Agencijska provizija za kupca je 1,5%, odnosno minimalno 300 evra."
380,https://www.4zida.rs/prodaja-placeva/gradske-lokacije-indjija/gradjevinsko-zemljiste/620ec26ed24d2c38a1210d08,građevinsko zemljište ,30 a ,uknjiženo ,GZ,pre 1 godinu ,150.000,Gradske lokacije,"Gradske lokacije, Inđija","Građevinsko zemljište na prodaju, Gradske lokacije, 150.000€, 30a - 4zida",2024-01-07,"<h2 _ngcontent-ng-c3151048826 class=""mat-headline-5"">Opis oglasa</h2><div _ngcontent-ng-c3151048826 class=""prose max-h-64 overflow-hidden text-gray-800 ng-star-inserted""><p>Plac površine 30 ari, udaljen od centra grada cca 1 km. U dvosmernoj ulici. Sa objektima za rušenje ili rekonstrukciju. Infrastruktura: voda, struja (trofazna i monofazna), gas. Pogodno za gradnju privrednih objekata ili  objekata za višeporodično stanovanje. GZ-314"
381,https://www.4zida.rs/prodaja-placeva/krnjaca-palilula-opstina-beograd/gradjevinsko-zemljiste/651e9d19e972b357b400c00e,građevinsko zemljište ,50 a ,uknjiženo ,16842 ,pre 3 meseca ,610.000,Pančevački put,"Krnjača, Palilula opština, Beograd","Građevinsko zemljište na prodaju, Pančevački put, 610.000€, 50a - 4zida",2024-01-07,"<h2 _ngcontent-ng-c3151048826 class=""mat-headline-5"">Opis oglasa</h2><div _ngcontent-ng-c3151048826 class=""prose max-h-64 overflow-hidden text-gray-800 ng-star-inserted""><p>Prodaje se građevinsko zemljište u industrijskoj zoni za komercijalnu gradnju kod Džip komerca. Na placu voda, struja, gas. Predato za građevinsku dozvolu. Retko u ponudi. Za svaku preporuku. Vlasnik 1/1<br>Ag provizija 2%"
382,https://www.4zida.rs/prodaja-placeva/novi-grad-gradske-lokacije-subotica/gradjevinsko-zemljiste/6507184bcd8b85dbc100a376,građevinsko zemljište ,29.75 a ,uknjiženo ,,pre 20 dana ,140.000,Pčelarska bb i Kireška ulica,"Novi Grad, Gradske lokacije, Subotica","Građevinsko zemljište na prodaju, Pčelarska bb i Kireška ulica, 140.000€, 29a - 4zida",2024-01-07,"<h2 _ngcontent-ng-c3151048826 class=""mat-headline-5"">Opis oglasa</h2><div _ngcontent-ng-c3151048826 class=""prose max-h-64 overflow-hidden text-gray-800 ng-star-inserted""><p>Vlasnik"
383,https://www.4zida.rs/prodaja-placeva/sicevo-okolne-lokacije-nis/gradjevinsko-zemljiste/648c9bb140f70bc155029c0f,građevinsko zemljište ,20.71 a ,,p,pre 6 meseci ,17.000,Sićevo,"Sićevo, Okolne lokacije, Niš","Građevinsko zemljište na prodaju, Sićevo, 17.000€, 20a - 4zida",2024-01-07,"<h2 _ngcontent-ng-c3151048826 class=""mat-headline-5"">Opis oglasa</h2><div _ngcontent-ng-c3151048826 class=""prose max-h-64 overflow-hidden text-gray-800 ng-star-inserted""><p>Na  ponudi  je  parcela  na  odličnoj  lokaciji  i  blizu  magistralnog  puta  u  Sićevu, površine  2.071 m2, koja  prenamenom, može  biti  veoma  atraktivan  prostor  za  izgradnju  stambenog  ili  vikend  objekta. Za  više  informacija  o  ovoj  i  drugim  ponudama, pozovite."
384,https://www.4zida.rs/prodaja-placeva/vinogradi-gradske-lokacije-kragujevac/gradjevinsko-zemljiste/650020f8539176db80097c04,građevinsko zemljište ,3 a ,nije uknjiženo ,PZ1907231236AV ,pre 3 meseca ,15.000,Vinogradi,"Vinogradi, Gradske lokacije, Kragujevac","Građevinsko zemljište na prodaju, Vinogradi, 15.000€, 3a - 4zida",2024-01-07,"<h2 _ngcontent-ng-c3151048826 class=""mat-headline-5"">Opis oglasa</h2><div _ngcontent-ng-c3151048826 class=""prose max-h-64 overflow-hidden text-gray-800 ng-star-inserted""><p>Prodaje se više građevinskih parcela u Kragujevcu - naselje Vinigradi."
385,https://www.4zida.rs/prodaja-placeva/nemenikuce-sopot-opstina-beograd/gradjevinsko-zemljiste/64df5db60e0224e82d04bee0,građevinsko zemljište ,14.68 a ,uknjiženo ,KO0040 ,pre 16 dana ,44.000,Nemenikuće,"Nemenikuće, Sopot opština, Beograd","Građevinsko zemljište na prodaju, Nemenikuće, 44.000€, 14a - 4zida",2024-01-07,"<h2 _ngcontent-ng-c3151048826 class=""mat-headline-5"">Opis oglasa</h2><div _ngcontent-ng-c3151048826 class=""prose max-h-64 overflow-hidden text-gray-800 ng-star-inserted""><p>Prodaje se plac na Tresijama,Povrsina placa iznosi 14.68 ari.Gradjevinsko zemljiste.Plac se nalazi u prelepom naselju sa pogledom na Kosmaj.Nalazi se pored asfaltiranog puta. Pored placa prolazi struja,voda, gas i optika."
386,https://www.4zida.rs/prodaja-placeva/miseluk-petrovaradin-gradske-lokacije-novi-sad/gradjevinsko-zemljiste/62f62491e6150af8ba00c5d9,građevinsko zemljište ,10.75 a ,uknjiženo ,,pre 27 dana ,232,Mišeluk,"Mišeluk, Petrovaradin, Gradske lokacije, Novi Sad","Građevinsko zemljište na prodaju, Mišeluk, 232€, 10a - 4zida",2024-01-07,"<h2 _ngcontent-ng-c3151048826 class=""mat-headline-5"">Opis oglasa</h2><div _ngcontent-ng-c3151048826 class=""prose max-h-64 overflow-hidden text-gray-800 ng-star-inserted""><p>Plac se nalazi na jednoj od najpoželjnijih lokacija u Novom Sadu, na samo 500m od petlje Mišeluk."
387,https://www.4zida.rs/prodaja-placeva/lalinac-okolne-lokacije-nis/gradjevinsko-zemljiste/637cda7ba447fc5d61016a8c,građevinsko zemljište ,43.01 a ,,p,pre 6 meseci ,4.300,Novo selo,"Lalinac, Okolne lokacije, Niš","Građevinsko zemljište na prodaju, Novo selo, 4.300€, 43a - 4zida",2024-01-07,"<h2 _ngcontent-ng-c3151048826 class=""mat-headline-5"">Opis oglasa</h2><div _ngcontent-ng-c3151048826 class=""prose max-h-64 overflow-hidden text-gray-800 ng-star-inserted""><p>Na prodaju poljoprivredno zemljište tj. njiva u blizini sela Lalinac. Uknjižen kao poljoprivredno zemljište, pravilnog pravouganog oblika, sa zemljanim pomoćnim putevima sa obe strane njive. Uknjižen, privatna svojina, čisto vlasništvo 1 kroz 1. Za više informacija slobodno pozovite."
