,link,Tip,Površina,Uknjiženost,Šifra oglasa,Oglas ažuriran,price,street,address,title,end_date,description
228,https://www.4zida.rs/prodaja-placeva/bacevac-barajevo-opstina-beograd/gradjevinsko-zemljiste/62724e445a4b862b7c7cb518,građevinsko zemljište ,15 a ,uknjiženo ,1387 ,pre 8 meseci ,25.000,Sime Markovića,"Baćevac, Barajevo opština, Beograd","Građevinsko zemljište na prodaju, Sime Markovića, 25.000€, 15a - 4zida",2024-01-07,"<h2 _ngcontent-ng-c3151048826 class=""mat-headline-5"">Opis oglasa</h2><div _ngcontent-ng-c3151048826 class=""prose max-h-64 overflow-hidden text-gray-800 ng-star-inserted""><p>Plac se nalazi na putu Baćevac - Barajevo, na 5km od Barajeva.<br>Svojom širinom izlazi na glavni put.<br>Ravan je , sa vrlo blaagim nagibom.<br>U fazi je pretvaranja u građevinsko zemljište.<br>Ima vodu, struju na samom placu.<br>Uknjižen!<br>Za preporuku!<br>Agencijska provizija 500 evra! Agencijska provizija 2%"
229,https://www.4zida.rs/prodaja-placeva/curug-okolne-lokacije-zabalj/gradjevinsko-zemljiste/6432d063257c31df3704d5c5,građevinsko zemljište ,7 a ,uknjiženo ,,pre 2 meseca ,1,Svetozara Markovica,"Čurug, Okolne lokacije, Žabalj","Građevinsko zemljište na prodaju, Svetozara Markovica, 1€, 7a - 4zida",2024-01-07,"<h2 _ngcontent-ng-c3151048826 class=""mat-headline-5"">Opis oglasa</h2><div _ngcontent-ng-c3151048826 class=""prose max-h-64 overflow-hidden text-gray-800 ng-star-inserted""><p>Prodajem plac u Curugu u ulici Svetozara Markovica, blizu centra i blizu Tise (blizu plaze). Plac je velicine oko 7 ari."
230,https://www.4zida.rs/prodaja-placeva/veternicka-rampa-veternik-gradske-lokacije-novi-sad/gradjevinsko-zemljiste/64771621300f5522a60c6589,građevinsko zemljište ,5 a ,uknjiženo ,,pre 23 dana ,110.000,Veternička Rampa,"Veternička Rampa, Veternik, Gradske lokacije, Novi Sad","Građevinsko zemljište na prodaju, Veternička Rampa, 110.000€, 5a - 4zida",2024-01-07,"<h2 _ngcontent-ng-c3151048826 class=""mat-headline-5"">Opis oglasa</h2><div _ngcontent-ng-c3151048826 class=""prose max-h-64 overflow-hidden text-gray-800 ng-star-inserted""><p>Prodajem plac na Veterničkoj rampi, atraktivna lokacija, 500 kvadrata, moguća zamena za nekretninu u vidu stana"
231,https://www.4zida.rs/prodaja-placeva/puckaros-petrovaradin-gradske-lokacije-novi-sad/gradjevinsko-zemljiste/6234c5fb0761d11df52c0243,građevinsko zemljište ,15 a ,uknjiženo ,,pre 2 meseca ,52.000,Puckaros,"Puckaroš, Petrovaradin, Gradske lokacije, Novi Sad","Građevinsko zemljište na prodaju, Puckaros, 52.000€, 15a - 4zida",2024-01-07,"<h2 _ngcontent-ng-c3151048826 class=""mat-headline-5"">Opis oglasa</h2><div _ngcontent-ng-c3151048826 class=""prose max-h-64 overflow-hidden text-gray-800 ng-star-inserted""><p>Veliki ravan plac,dozvoljena gradnja,voćnjak.pozovite 063/808-69-62,Maksima Nekretnine"
232,https://www.4zida.rs/prodaja-placeva/dobanovci-surcin-opstina-beograd/gradjevinsko-zemljiste/63b47382c7b43aae6b099156,građevinsko zemljište ,148 a ,uknjiženo ,3501 ,pre 3 meseca ,740.000,Dobanovci,"Dobanovci, Surčin opština, Beograd","Građevinsko zemljište na prodaju, Dobanovci, 740.000€, 148a - 4zida",2024-01-07,"<h2 _ngcontent-ng-c3151048826 class=""mat-headline-5"">Opis oglasa</h2><div _ngcontent-ng-c3151048826 class=""prose max-h-64 overflow-hidden text-gray-800 ng-star-inserted""><p>Na prodaju parcela od 148 ari koja je uknjižena kao građevinsko zemljište. Parcela se nalazi u neposrednoj blizini budućeg stambeno-poslovnog kompleksa ""Singidunum city"" gde je planirano ukupno 3.000 stamebnih jedinica sa svim pripadajućim sadržajem. "
233,https://www.4zida.rs/prodaja-placeva/branko-bjegovic-crveni-krst-gradske-lokacije-nis/gradjevinsko-zemljiste/6513f697b769c1cfc20340e1,građevinsko zemljište ,4.56 a ,uknjiženo ,,pre 3 meseca ,45.000,Matije Bana,"Branko Bjegović, Crveni Krst, Gradske lokacije, Niš","Građevinsko zemljište na prodaju, Matije Bana, 45.000€, 4a - 4zida",2024-01-07,"<h2 _ngcontent-ng-c3151048826 class=""mat-headline-5"">Opis oglasa</h2><div _ngcontent-ng-c3151048826 class=""prose max-h-64 overflow-hidden text-gray-800 ng-star-inserted""><p>Prodaja placa u naselju Branko Bjegovic 4.5a 45000e uknjizen sa svim papirima privatna svojina 1/1 od strane vlasnika direktno bez posrednika. Plac je na uglu dve ulice sa idealnom lokacijom za gradnju stambenih i stambeno poslovnih objekata. Mogucnost vadjenja gradjevinske dozvole, prikljucka struje, vode, kanalizacije. Ulice su sve asfaltirane sa obe strane placa. Udaljen 10m od osnovne skole Ivo Andric (preko puta skole)."
234,https://www.4zida.rs/prodaja-placeva/aleksandrovo-gradske-lokacije-subotica/gradjevinsko-zemljiste/638221a0e7d5114d7d011166,građevinsko zemljište ,5.8 a ,uknjiženo ,,pre 8 dana ,14.000,Juraja Arnolda,"Aleksandrovo, Gradske lokacije, Subotica","Građevinsko zemljište na prodaju, Juraja Arnolda, 14.000€, 5a - 4zida",2024-01-07,"<h2 _ngcontent-ng-c3151048826 class=""mat-headline-5"">Opis oglasa</h2><div _ngcontent-ng-c3151048826 class=""prose max-h-64 overflow-hidden text-gray-800 ng-star-inserted""><p>Prodajem plac od 580 m2 u Aleksandrovu u ulici Juraja Arnolda izuzetno pogodan za gradnju stambenog objekta. U ulici ima gas, struja, voda, kanalizacija, telefon."
235,https://www.4zida.rs/prodaja-placeva/makova-sedmica-gradske-lokacije-subotica/gradjevinsko-zemljiste/6568c436e2702098750ad5e1,građevinsko zemljište ,14.29 a ,uknjiženo ,456 ,pre 1 mesec ,12.000,Đerđa Lukača,"Makova Sedmica, Gradske lokacije, Subotica","Građevinsko zemljište na prodaju, Đerđa Lukača, 12.000€, 14a - 4zida",2024-01-07,"<h2 _ngcontent-ng-c3151048826 class=""mat-headline-5"">Opis oglasa</h2><div _ngcontent-ng-c3151048826 class=""prose max-h-64 overflow-hidden text-gray-800 ng-star-inserted""><p>Plac za gradnju kuće ili vikendice na lepom i mirnom mestu, u asvaltiranoj ulici na Makovoj Sedmici, 1429 m2, ograđen, priključci na ulici. Plac je pravilnog oblika i ulični front mu je 22 metra."
236,https://www.4zida.rs/prodaja-placeva/donja-vrezina-pantelej-gradske-lokacije-nis/gradjevinsko-zemljiste/65844b1127fcf8d2000d1469,građevinsko zemljište ,2.3 a ,,4254 ,pre 17 dana ,32.000,Donja Vrežina,"Donja Vrežina, Pantelej, Gradske lokacije, Niš","Građevinsko zemljište na prodaju, Donja Vrežina, 32.000€, 2a - 4zida",2024-01-07,"<h2 _ngcontent-ng-c3151048826 class=""mat-headline-5"">Opis oglasa</h2><div _ngcontent-ng-c3151048826 class=""prose max-h-64 overflow-hidden text-gray-800 ng-star-inserted""><p>Prodaje se plac u Vrežini površine 2,3ara. Plac je gradsko građevinsko zemljište i pogodan je za izgradnju zgrade, pa može biti zanimljiva ponuda za investitore. Na placu je moguća gradnja zgrade spratnosti P+2+Pk sa po jednim stanom na spratu. Hvala Vam što ste pogledali oglas. Za više informacija o ovoj ili drugim nekretninama i zakazivanje razgledanja kontaktirajte agenta na broj telefona iz oglasa (poziv, sms, viber) ili putem e-maila. Kompletnu ponudu dostupnih nekretnina možete pronaći na našem sajtu. Agencija Proagent nekretnine je upisana u Registru posrednika pod brojem: 940."
237,https://www.4zida.rs/prodaja-placeva/petka-lazarevac-opstina-beograd/gradjevinsko-zemljiste/645e8e19572b498d6b0f575d,građevinsko zemljište ,12.4 a ,uknjiženo ,,pre 2 meseca ,7.440,SOKOLSKA 23,"Petka, Lazarevac opština, Beograd","Građevinsko zemljište na prodaju, SOKOLSKA 23, 7.440€, 12a - 4zida",2024-01-07,"<h2 _ngcontent-ng-c3151048826 class=""mat-headline-5"">Opis oglasa</h2><div _ngcontent-ng-c3151048826 class=""prose max-h-64 overflow-hidden text-gray-800 ng-star-inserted""><p>Продајем  12,4 ари у непосредној близини Дома у Петки . Плац је квадратног облика и на мирној локацији , на крају Соколске улице , 2км од Лидла у Лазаревцу . У близини је аутобуско стајалиште , више продавница , стадион , школа , црква. .. ..<br>Цена је 600 еура  по ару .<br>На пола плаца   има 35 стабала шљиве .<br>Вода спроведена  у  плац  , струја до плаца .<br>Власник 1/1 .<br>Може сваки договор , цена није фиксна .<br>Звати после 15 h"
238,https://www.4zida.rs/prodaja-placeva/marsic-okolne-lokacije-kragujevac/gradjevinsko-zemljiste/6331b413d18f70b9f1042123,građevinsko zemljište ,9.94 a ,,p,pre 8 meseci ,14.500,Dr Dragiše Mišovića,"Maršić, Okolne lokacije, Kragujevac","Građevinsko zemljište na prodaju, Dr Dragiše Mišovića, 14.500€, 9a - 4zida",2024-01-07,"<h2 _ngcontent-ng-c3151048826 class=""mat-headline-5"">Opis oglasa</h2><div _ngcontent-ng-c3151048826 class=""prose max-h-64 overflow-hidden text-gray-800 ng-star-inserted""><p>Na prodaju plac od 9,94 ari u Maršiću . Nalazi se u neposrednoj blizini  škole i crkve u Maršiću u tihom i mirnom okruženju. Plac je ogradjen, pravougaonog oblika, ima direktan ulaz sa asfaltiranog puta. Mogućnost  priključka  na gradski  vodovod,  dostupan je priključak za struju. Za sve informacije i razgledanje stojimo vam na raspolaganju, radnim danima od 09-19h i subotom od 09-17h. Ovu i druge nekretnine sa većim brojem fotografija možete pogledati na našem sajtu: bulevarnekretnine.rs, kontakt: info@bulevarnekretnine.rs, usluga besplatna. Čekamo Vas. Telefon 034/330808 i 060/0544253. Bulevar Nekretnine 034, Kragujevac, broj u registru posrednika: 1278."
239,https://www.4zida.rs/prodaja-placeva/simanovci-okolne-lokacije-pecinci/gradjevinsko-zemljiste/634ff73a051a86b9c10287b7,građevinsko zemljište ,31.12 a ,uknjiženo ,529 ,pre 8 meseci ,88.000,Dečka,"Šimanovci, Okolne lokacije, Pećinci","Građevinsko zemljište na prodaju, Dečka, 88.000€, 31a - 4zida",2024-01-07,"<h2 _ngcontent-ng-c3151048826 class=""mat-headline-5"">Opis oglasa</h2><div _ngcontent-ng-c3151048826 class=""prose max-h-64 overflow-hidden text-gray-800 ng-star-inserted""><p>OZBILJAN PRODAVAC, MOGUĆ DOGOVOR OKO CENE! Uknjižen plac površine 31,12ari u blizini autoputa, u građevinskom području Opštine Pećinci, katastarska opština Šimanovci. Nalazi se pored samog asfaltnog puta; pored  placa su priključci za vodu, struju, kanalizaciju, a na oko sto metara je prošao i gasovod. Namena parcele: radna zona. Preko puta placa se nalazi nekoliko poslovno-industrijskih objekata sa velikim parkinzima. Širina placa je oko 16m, dužina skoro 200m. Postoji mogućnost kupovine skoro identičnog placa koji se graniči sa ovim te je moguće spajanje u jednu parcelu čiji bi front ka putu bio širine oko 40m. Odlična pozicija i okruženje, mogućost raznih namena. ZA PREPORUKU! Posrednička provizije iznosi 2% od dogovorene cene."
240,https://www.4zida.rs/prodaja-placeva/ripanj-vozdovac-opstina-beograd/gradjevinsko-zemljiste/64fef9889f3c363ac50d6cfd,,,,,,,,,"Prodaja placeva Ripanj, Voždovac opština, Beograd, Građevinsko zemljište - 4zida",2024-01-07,
241,https://www.4zida.rs/prodaja-placeva/mramorsko-brdo-okolne-lokacije-merosina/gradjevinsko-zemljiste/650ef3ce8c1215238d062538,građevinsko zemljište ,87.71 a ,,p,pre 29 dana ,90.000,Mramorsko brdo,"Mramorsko Brdo, Okolne lokacije, Merošina","Građevinsko zemljište na prodaju, Mramorsko brdo, 90.000€, 87a - 4zida",2024-01-07,"<h2 _ngcontent-ng-c3151048826 class=""mat-headline-5"">Opis oglasa</h2><div _ngcontent-ng-c3151048826 class=""prose max-h-64 overflow-hidden text-gray-800 ng-star-inserted""><p>Na prodaju plac na Mramorskom brdu, u blizini fabrike ,,Austroterm”. Plac se nalazi na 130 metara od glavnog puta Niš - Prokuplje. Plac je površine 8771 m2. Svojina privatna, uknjižen kao  zemljište u građevinskom području. Pogodan za razne delatnosti (poslovni prostor, magacinski prostor, skladišni prostor i sl…). Ovo je samo deo naše ponude, za više informacija slobodno pozovite."
242,https://www.4zida.rs/prodaja-placeva/nenadovac-barajevo-barajevo-opstina-beograd/gradjevinsko-zemljiste/5cb8410527317176a13c9cc2,građevinsko zemljište ,64 a ,uknjiženo ,,pre 25 dana ,64.000,Nenadovac,"Nenadovac, Barajevo, Barajevo opština, Beograd","Građevinsko zemljište na prodaju, Nenadovac, 64.000€, 64a - 4zida",2024-01-07,"<h2 _ngcontent-ng-c3151048826 class=""mat-headline-5"">Opis oglasa</h2><div _ngcontent-ng-c3151048826 class=""prose max-h-64 overflow-hidden text-gray-800 ng-star-inserted""><p>Plac 64+40a, mogucnost gradnje na 64 ara. Plac je uz glavni put asfalt ,struja,voda ,telefon i gradski minibus koji prolazi pored placa. Udaljenost od Beograda je 15ak km i dobra je veza sa gradom jer su u blizini jos dve linije gradskog prevoza.Vlasnik 1/1. Cena po dogovoru,u zavisnosti od povrsine koja se kupuje."
243,https://www.4zida.rs/prodaja-placeva/gradske-lokacije-ljig/gradjevinsko-zemljiste/655cdb0c9618fa4c390d28c3,građevinsko zemljište ,10.17 a ,uknjiženo ,1263 ,pre 1 mesec ,14.000,Vojvode Mišića,"Gradske lokacije, Ljig","Građevinsko zemljište na prodaju, Vojvode Mišića, 14.000€, 10a - 4zida",2024-01-07,"<h2 _ngcontent-ng-c3151048826 class=""mat-headline-5"">Opis oglasa</h2><div _ngcontent-ng-c3151048826 class=""prose max-h-64 overflow-hidden text-gray-800 ng-star-inserted""><p>Gradsko građevinsko zemljište. Plac se nalazi na najlepšem mestu u Ljigu blizu centra sa lepim pogledom i 7,5 km od Baje Vrujci. Plac se nalazi na asfaltnom putu i dostupni su svi priključci (struja, voda, kanalizacija, telefon...).<br>Agent Slađana Ikonić"
244,https://www.4zida.rs/prodaja-placeva/centar-gradske-lokacije-topola/gradjevinsko-zemljiste/636468c2eb89d6aee507021d,građevinsko zemljište ,53.29 a ,uknjiženo ,1277 ,pre 8 meseci ,21.316,Centar,"Centar, Gradske lokacije, Topola","Građevinsko zemljište na prodaju, Centar, 21.316€, 53a - 4zida",2024-01-07,"<h2 _ngcontent-ng-c3151048826 class=""mat-headline-5"">Opis oglasa</h2><div _ngcontent-ng-c3151048826 class=""prose max-h-64 overflow-hidden text-gray-800 ng-star-inserted""><p>Šifra: P523<br>Odlično zemljište površine 53,29 ara je nalazi na udaljenosti oko 2 km od centra Topole, do asfaltnog puta. Struja je blizu placa, a ima i tehničku vodu.<br>Ukoliko želite više informacija, pozovite broj:<br>  063/70-30-538 - Nataša<br>  062/80-10-641 - Tanja"
245,https://www.4zida.rs/prodaja-placeva/lalinac-okolne-lokacije-nis/gradjevinsko-zemljiste/64d635450a50583e1a08c0a7,građevinsko zemljište ,14.95 a ,,p,pre 29 dana ,6.000,Novo selo,"Lalinac, Okolne lokacije, Niš","Građevinsko zemljište na prodaju, Novo selo, 6.000€, 14a - 4zida",2024-01-07,"<h2 _ngcontent-ng-c3151048826 class=""mat-headline-5"">Opis oglasa</h2><div _ngcontent-ng-c3151048826 class=""prose max-h-64 overflow-hidden text-gray-800 ng-star-inserted""><p>Na prodaju poljoprivredno zemljište tj. njiva u blizini sela Lalinac. Površine 1495m2. Pravilnog pravouganog oblika, sa zemljanim pomoćnim putevima sa obe strane njive. Uknjižen, privatna svojina, čisto vlasništvo 1 kroz 1. Za više informacija slobodno pozovite."
246,https://www.4zida.rs/prodaja-placeva/gradske-lokacije-beocin/gradjevinsko-zemljiste/64e49c57b5e199b52e09761b,građevinsko zemljište ,15.54 a ,uknjiženo ,43084 ,pre 4 meseca ,80.000,Gradske lokacije,"Gradske lokacije, Beočin","Građevinsko zemljište na prodaju, Gradske lokacije, 80.000€, 15a - 4zida",2024-01-07,"<h2 _ngcontent-ng-c3151048826 class=""mat-headline-5"">Opis oglasa</h2><div _ngcontent-ng-c3151048826 class=""prose max-h-64 overflow-hidden text-gray-800 ng-star-inserted""><p>Na prodaju plac na traženoj lokaciji u Rakovcu površine 1554m2. Idealno za porodično stanovanje.Sva infrastruktura se nalazi na placu. Nalazi se veoma blizu beočinskog puta a opet je miran i ušuškan.  ID oglasa: 43084."
247,https://www.4zida.rs/prodaja-placeva/pivarski-park-pivara-gradske-lokacije-kragujevac/gradjevinsko-zemljiste/642498184d3aee0f98014a46,građevinsko zemljište ,13.52 a ,uknjiženo ,HZPKG,pre 1 mesec ,169.000,Pivarski Park,"Pivarski Park, Pivara, Gradske lokacije, Kragujevac","Građevinsko zemljište na prodaju, Pivarski Park, 169.000€, 13a - 4zida",2024-01-07,"<h2 _ngcontent-ng-c3151048826 class=""mat-headline-5"">Opis oglasa</h2><div _ngcontent-ng-c3151048826 class=""prose max-h-64 overflow-hidden text-gray-800 ng-star-inserted""><p>Plac površine 13.50 ari, pogodan za investitore. Atraktivna lokacija, u blizini planirane lokacije za izgradnju velikog poslovno stambenog kompleksa.<br>Plac ima sve priključke, asfaltirani prilaz i odličnu infrastrukturu.<br>Na placu se nalazi i više objekata od kojih je jedan kuća površine 130 m2, koja je potpuno opremljena za stanovanje, renovirana sa novom fasadom.<br>U nastavku kuće se nalaze pomoćni objekti, ostave i garaža.<br>Na placu se nalazi i ugostiteljski objekat koji je trenutno u radu, sa veoma velikom frekvencijom gostiju."
248,https://www.4zida.rs/prodaja-placeva/ledine-novi-beograd-beograd/gradjevinsko-zemljiste/658c0636d85025d6570101c4,građevinsko zemljište ,40 a ,uknjiženo ,29444 ,pre 11 dana ,360.000,Ledine,"Ledine, Novi Beograd, Beograd","Građevinsko zemljište na prodaju, Ledine, 360.000€, 40a - 4zida",2024-01-07,"<h2 _ngcontent-ng-c3151048826 class=""mat-headline-5"">Opis oglasa</h2><div _ngcontent-ng-c3151048826 class=""prose max-h-64 overflow-hidden text-gray-800 ng-star-inserted""><p>Na prodaju zemljište , njiva 2.klase, ukupne površine 40ari.Može se dogovoriti kupovina 5,10,20 ari . Urađen priključak za vodu. Cena je 360.000eur(9000eur/ar-fiksna cena). Uknjiženo. Agencijska provizija 2%//Agent:065/2555603//"
249,https://www.4zida.rs/prodaja-placeva/orlovat-okolne-lokacije-zrenjanin/gradjevinsko-zemljiste/63c69265f2c8a331a80cb1be,građevinsko zemljište ,39 a ,,26995 ,pre 4 meseca ,20.000,Orlovat,"Orlovat, Okolne lokacije, Zrenjanin","Građevinsko zemljište na prodaju, Orlovat, 20.000€, 39a - 4zida",2024-01-07,"<h2 _ngcontent-ng-c3151048826 class=""mat-headline-5"">Opis oglasa</h2><div _ngcontent-ng-c3151048826 class=""prose max-h-64 overflow-hidden text-gray-800 ng-star-inserted""><p>Orlovat - plac površine 39 ara. Na placu su dva urušena stambena objekta, svaki uknjižene površine po 94m2. Dimenzije placa 39x100m, nema struje, ima vodu, jedan vlasnik. Plac se nalazi u glavnoj ulici u mestu.<br>Agencijska provizija za kupca je 1,5%, odnosno minimalno 300 evra."
250,https://www.4zida.rs/prodaja-placeva/vrcin-grocka-opstina-beograd/gradjevinsko-zemljiste/636d0e4037dac0792404606a,građevinsko zemljište ,27 a ,uknjiženo ,,pre 4 meseca ,36.000,Vrčin,"Vrčin, Grocka opština, Beograd","Građevinsko zemljište na prodaju, Vrčin, 36.000€, 27a - 4zida",2024-01-07,"<h2 _ngcontent-ng-c3151048826 class=""mat-headline-5"">Opis oglasa</h2><div _ngcontent-ng-c3151048826 class=""prose max-h-64 overflow-hidden text-gray-800 ng-star-inserted""><p>Plac u Vrčinu, 600 metara od naplatne rampe, 60 x 45 metara, građevinsko zemljište, postoje lokacijski uslovi, površina 2663 m2, pod kosinom sa pogledom na Avalu, postoji pristupni put."
251,https://www.4zida.rs/prodaja-placeva/vinik-pantelej-gradske-lokacije-nis/gradjevinsko-zemljiste/6373ad8717f46bd99c00bdde,građevinsko zemljište ,4.52 a ,uknjiženo ,1766 ,pre 8 meseci ,45.000,Vinik,"Vinik, Pantelej, Gradske lokacije, Niš","Građevinsko zemljište na prodaju, Vinik, 45.000€, 4a - 4zida",2024-01-07,"<h2 _ngcontent-ng-c3151048826 class=""mat-headline-5"">Opis oglasa</h2><div _ngcontent-ng-c3151048826 class=""prose max-h-64 overflow-hidden text-gray-800 ng-star-inserted""><p>na prodaju plac u podviniku p-452m2, pogodan za izgradnju stanbenog objekta,ima mogućnost priključenja struje,vode i kanalizacije, asvalt na 50m, za više informacije obratite se agenciji Libo na telefone 0652223922,0658833446,0659513377,0607513377.agencija upisana u listu posrednika pod brojem 495."
252,https://www.4zida.rs/prodaja-placeva/knic-okolne-lokacije-knic/gradjevinsko-zemljiste/6124ecc870b98d39b6517203,građevinsko zemljište ,27.8 a ,nije uknjiženo ,PZ151020191799SV ,pre 9 meseci ,14.000,Knić,"Knić, Okolne lokacije, Knić","Građevinsko zemljište na prodaju, Knić, 14.000€, 27a - 4zida",2024-01-07,"<h2 _ngcontent-ng-c3151048826 class=""mat-headline-5"">Opis oglasa</h2><div _ngcontent-ng-c3151048826 class=""prose max-h-64 overflow-hidden text-gray-800 ng-star-inserted""><p>Prodaje se plac na Gružanskom jezeru u varošici Knić.<br>U plac se ulazi sa tamponiranog kategorisanog puta.<br>200 metara je udaljen od vode čija je obala veoma pristupačna i pogodna za sportski ribolov."
253,https://www.4zida.rs/prodaja-placeva/srednji-kraj-barajevo-barajevo-opstina-beograd/gradjevinsko-zemljiste/642aded685a9136fd1049644,građevinsko zemljište ,106.07 a ,uknjiženo ,5065 ,pre 3 meseca ,106.000,Srednji Kraj,"Srednji Kraj, Barajevo, Barajevo opština, Beograd","Građevinsko zemljište na prodaju, Srednji Kraj, 106.000€, 106a - 4zida",2024-01-07,"<h2 _ngcontent-ng-c3151048826 class=""mat-headline-5"">Opis oglasa</h2><div _ngcontent-ng-c3151048826 class=""prose max-h-64 overflow-hidden text-gray-800 ng-star-inserted""><p>Uknjižen, 106.07ari"
254,https://www.4zida.rs/prodaja-placeva/dobanovci-surcin-opstina-beograd/gradjevinsko-zemljiste/632da51f42cd0e4dba0608b5,građevinsko zemljište ,9 a ,uknjiženo ,3010 ,pre 3 meseca ,63.000,Vojvođanska,"Dobanovci, Surčin opština, Beograd","Građevinsko zemljište na prodaju, Vojvođanska, 63.000€, 9a - 4zida",2024-01-07,"<h2 _ngcontent-ng-c3151048826 class=""mat-headline-5"">Opis oglasa</h2><div _ngcontent-ng-c3151048826 class=""prose max-h-64 overflow-hidden text-gray-800 ng-star-inserted""><p>Odličan plac od 9 ari u Dobanovcima. Nalazi se u neposrednoj blizini centra Dobanovca. Uknjižen 1/1, ravan i pravilnog oblika. Mogućnost gradnje i priključenja struje, vode i gasa."
255,https://www.4zida.rs/prodaja-placeva/babe-sopot-opstina-beograd/gradjevinsko-zemljiste/6574a02823a33ffca6031215,građevinsko zemljište ,180.38 a ,uknjiženo ,6748 ,pre 29 dana ,130.000,Babe,"Babe, Sopot opština, Beograd","Građevinsko zemljište na prodaju, Babe, 130.000€, 180a - 4zida",2024-01-07,"<h2 _ngcontent-ng-c3151048826 class=""mat-headline-5"">Opis oglasa</h2><div _ngcontent-ng-c3151048826 class=""prose max-h-64 overflow-hidden text-gray-800 ng-star-inserted""><p>Zemljište u građevinskom području. Asfalt do placa, struja, voda, gas. Informacija o lokaciji na upit. Uknjiženo na vlasnika 1/1."
256,https://www.4zida.rs/prodaja-placeva/sirine-petrovaradin-gradske-lokacije-novi-sad/gradjevinsko-zemljiste/64d24a51f171d0755b0c8834,građevinsko zemljište ,500 a ,uknjiženo ,515282 ,pre 4 meseca ,50.470,karlovački drum,"Širine, Petrovaradin, Gradske lokacije, Novi Sad","Građevinsko zemljište na prodaju, karlovački drum, 50.470€, 500a - 4zida",2024-01-07,"<h2 _ngcontent-ng-c3151048826 class=""mat-headline-5"">Opis oglasa</h2><div _ngcontent-ng-c3151048826 class=""prose max-h-64 overflow-hidden text-gray-800 ng-star-inserted""><p>Odličan uknjižen plac.kontakt.060/423-30-33"
257,https://www.4zida.rs/prodaja-placeva/novo-mirijevo-mirijevo-zvezdara-opstina-beograd/gradjevinsko-zemljiste/635d605bd2d6b043ea05a21a,,,,,,,,,"Građevinsko zemljište na prodaju, Terzija, 26.000€, 4a - 4zida",2024-01-07,
258,https://www.4zida.rs/prodaja-placeva/fruska-gora/gradjevinsko-zemljiste/6508b0ba8d331b46dc0144fe,građevinsko zemljište ,112.6 a ,uknjiženo ,42839 ,pre 3 meseca ,709.000,Fruška Gora,Fruška Gora,"Građevinsko zemljište na prodaju, Fruška Gora, 709.000€, 112a - 4zida",2024-01-07,"<h2 _ngcontent-ng-c3151048826 class=""mat-headline-5"">Opis oglasa</h2><div _ngcontent-ng-c3151048826 class=""prose max-h-64 overflow-hidden text-gray-800 ng-star-inserted""><p>Glamping - prodaje se razrađen biznis u blizini Sremskih Karlovaca na obroncima Fruške Gore sa prelepim pogledom na Dunav. Kompleks se sastoji od četiri Glamping šatora Adria Safari opremljenih sa klima uređajima i kupatilom, bazena i baštenske kućice. Na placu postoje priključci striuje, vode, a septička jama je sa bioprečišćavačem. Postoji i projekat i građevinska dozvola za kuću površine 150m2. U okviru Glamping kompleksa nalazi se i vinograd sa autohotnim sortama vinove loze. Ukupna površina zemljišta je 11260m2. Za sve dodatne informacije stojimo vam na rasplaganju."
259,https://www.4zida.rs/prodaja-placeva/vinca-grocka-opstina-beograd/gradjevinsko-zemljiste/658a72b9cba85f23520cc562,građevinsko zemljište ,100 a ,u procesu uknjižavanja ,,pre 11 dana ,300.000,Istiucki put BB,"Vinča, Grocka opština, Beograd","Građevinsko zemljište na prodaju, Istiucki put BB, 300.000€, 100a - 4zida",2024-01-07,"<h2 _ngcontent-ng-c3151048826 class=""mat-headline-5"">Opis oglasa</h2><div _ngcontent-ng-c3151048826 class=""prose max-h-64 overflow-hidden text-gray-800 ng-star-inserted""><p>Plac ravan pogodan za svaku vrstu delatnosti nalazi se na raskrsnici puteva izmedju puta za deponiju i puta za insitut tel"
260,https://www.4zida.rs/prodaja-placeva/gabrovac-okolne-lokacije-nis/gradjevinsko-zemljiste/629b635a791a6a78a4154f33,građevinsko zemljište ,19.94 a ,uknjiženo ,p,pre 8 meseci ,16.000,Generala Dragoljuba Stankovića,"Gabrovac, Okolne lokacije, Niš","Građevinsko zemljište na prodaju, Generala Dragoljuba Stankovića, 16.000€, 19a - 4zida",2024-01-07,"<h2 _ngcontent-ng-c3151048826 class=""mat-headline-5"">Opis oglasa</h2><div _ngcontent-ng-c3151048826 class=""prose max-h-64 overflow-hidden text-gray-800 ng-star-inserted""><p>Prodaje se plac površine 1994m2 u naselju Gabrovačka Reka. Plac se nalazi u prirodnom okruženju sa pogledom prema Suvoj Planini i Tremu. Postoji mogućnost priključka za struju i vodu u neposrednoj blizini. Trenutno je na placu zasad voća, parcela je pravougaonog oblika ulaznog fronta do 10m2."
