,link,Tip,Površina,Uknjiženost,Šifra oglasa,Oglas ažuriran,price,street,address,description,title,end_date
388,https://www.4zida.rs/prodaja-placeva/prosek-okolne-lokacije-nis/gradjevinsko-zemljiste/628df08d9756d921987fb8c6,građevinsko zemljište ,14.15 a ,,p,pre 10 meseci ,14.150,Prosek,"Prosek, Okolne lokacije, Niš","<h2 _ngcontent-ng-c3151048826 class=""mat-headline-5"">Opis oglasa</h2><div _ngcontent-ng-c3151048826 class=""prose max-h-64 overflow-hidden text-gray-800 ng-star-inserted""><p>Na prodaju plac tj. njiva u Proseku, na putu za Malču. Površine 1415m2. Asfalt do placa, vodi se kao poljoprivredno zemljište. Uknjižen,čisto vlasništvo , privatna svojina 1 kroz 1. Ovo je samo deo naše ponude, ovu kao i druge nekretnine možete pogledati na našem sajtu.","Građevinsko zemljište na prodaju, Prosek, 14.150€, 14a - 4zida",2024-03-07
389,https://www.4zida.rs/prodaja-placeva/kisac-okolne-lokacije-novi-sad/gradjevinsko-zemljiste/653f8831f3b6a311d50e4e38,,,,,,,,,,"Građevinsko zemljište na prodaju, Janka Čmelika, 22.000€, 4a - 4zida",2024-03-07
390,https://www.4zida.rs/prodaja-placeva/mokra-gora-tara/gradjevinsko-zemljiste/6464e4b485a83f329c09ce65,građevinsko zemljište ,69.3 a ,uknjiženo ,65687 ,pre 9 meseci ,105.000,Miloševac,"Mokra Gora, Tara","<h2 _ngcontent-ng-c3151048826 class=""mat-headline-5"">Opis oglasa</h2><div _ngcontent-ng-c3151048826 class=""prose max-h-64 overflow-hidden text-gray-800 ng-star-inserted""><p>Izuzetna lokacija na Tari, jedna od najlepših a nalazi se na 1380 m n. v. U ponudi su dva prelepa placa ukupne površine 69,93. Na samom placu nalazi se izvor vode a na udaljenosti od oko 110 m se nalazi poznati izvor Bogdanovac. Jedan od placeva je dobrim delom pod divljom borovnicom. Prilazni put do lokacije je iz dva pravca povezana sa glavnom saobraćajnicom na relaciji Mokra Gora, skijalište Čarobni breg, Sekulić, Zaovine, Mitrovac. Lokacija ima svoju autonomiju, mir i istinskim ljubiteljima prirode pruža potpuni doživljaj. ID oglasa: 65687. Agencijska provizija 2% od kupoprodajne cene.","Građevinsko zemljište na prodaju, Miloševac, 105.000€, 69a - 4zida",2024-03-07
391,https://www.4zida.rs/prodaja-placeva/gradske-lokacije-doljevac/gradjevinsko-zemljiste/60f8a84f8602875a85190898,građevinsko zemljište ,123.89 a ,uknjiženo ,p,pre 10 meseci ,70.000,Doljevac,"Gradske lokacije, Doljevac","<h2 _ngcontent-ng-c3151048826 class=""mat-headline-5"">Opis oglasa</h2><div _ngcontent-ng-c3151048826 class=""prose max-h-64 overflow-hidden text-gray-800 ng-star-inserted""><p>Na prodaju plac pored autoputa E75.<br>Ukupna površina placa 1ha 23a 89m2, ulazni front ima oko 140m.<br>Pogodan za benzinsku pumpu, proizvodno-skladišna postrojenja, predstavništva različitih delatnosti i sl.<br>U neposrednoj blizini nalaze se benzinska pumpa, fabrika LEONI, reka Južna Morava.<br>Cena je 70.000,00€. Uknjiženo, vlasništo 1/1. Za više informacija slobodno pozovite.","Građevinsko zemljište na prodaju, Doljevac, 70.000€, 123a - 4zida",2024-03-07
392,https://www.4zida.rs/prodaja-placeva/centa-okolne-lokacije-zrenjanin/gradjevinsko-zemljiste/5ef75b712731714a642ce1c1,građevinsko zemljište ,96 a ,,15686 ,pre 6 meseci ,45.000,Čenta,"Čenta, Okolne lokacije, Zrenjanin","<h2 _ngcontent-ng-c3151048826 class=""mat-headline-5"">Opis oglasa</h2><div _ngcontent-ng-c3151048826 class=""prose max-h-64 overflow-hidden text-gray-800 ng-star-inserted""><p>Čenta - plac površine 96ara uz glavni put na ulazu u Čentu iz pravca Zrenjanina. Dimenzije placa 32x300m, građevinsko zemljište, nema priključke, nema plaćene komunalije.","Građevinsko zemljište na prodaju, Čenta, 45.000€, 96a - 4zida",2024-03-07
393,https://www.4zida.rs/prodaja-placeva/vinik-pantelej-gradske-lokacije-nis/gradjevinsko-zemljiste/65e19e4c455a7ec89d0277cf,građevinsko zemljište ,15 a ,,2718 ,pre 6 dana ,67.000,Vinik,"Vinik, Pantelej, Gradske lokacije, Niš","<h2 _ngcontent-ng-c3151048826 class=""mat-headline-5"">Opis oglasa</h2><div _ngcontent-ng-c3151048826 class=""prose max-h-64 overflow-hidden text-gray-800 ng-star-inserted""><p>Prodaje se plac na Viniku, površine 15,5 ari. Do placa je dovedena struja, voda. Hvala Vam što ste pogledali oglas. Za više informacija o ovoj ili drugim nekretninama i zakazivanje razgledanja kontaktirajte agenta na broj telefona iz oglasa (poziv, sms, viber) ili putem e-maila. Kompletnu ponudu dostupnih nekretnina možete pronaći na našem sajtu.","Građevinsko zemljište na prodaju, Vinik, 67.000€, 15a - 4zida",2024-03-07
394,https://www.4zida.rs/prodaja-placeva/vrtiste-okolne-lokacije-nis/gradjevinsko-zemljiste/6026975368931125493968ff,građevinsko zemljište ,2387 a ,uknjiženo ,8337 ,pre 1 godinu ,10.600,Vrtište,"Vrtište, Okolne lokacije, Niš","<h2 _ngcontent-ng-c3151048826 class=""mat-headline-5"">Opis oglasa</h2><div _ngcontent-ng-c3151048826 class=""prose max-h-64 overflow-hidden text-gray-800 ng-star-inserted""><p>NIŠ - VRTIŠTE - HOTEL NAIS - ZEMLJIŠTE - 2387 m2 - U prilici smo da vam ponudimo poljoprivredno zemljište, na lokaciji Vrtište, Hotel Nais. Nalazi se u blizini autoputa.<br>Zemljište je upisano kao svojina privatna, obim udela 1/1, njiva 2.klase.<br>Svi priključci su u neposrednoj blizini.<br>Odvojite malo slobodnog vremena i zakažite razgledanje ove nepokretnosti sa agencijom AVENIJA NEKRETNINE putem telefona: 067/7000-111. Svojim klijentima garantujemo potpunu pravnu sigurnost pri kupovini i zakupu nepokretnosti. Kompletnu ponudu nekretnina možete videti na našem portalu: http://www.avenijanekretninenis.rs<br>Registarski broj posrednika: 669<br>ODRICANJE OD ODGOVORNOSTI:<br>Politika poslovanja Avenija nekretnine jeste da u opisu oglasa o nepokretnostima ne prikazuje tačnu lokaciju, već približnu lokaciju nepokretnosti. Zakazivanjem terena sa našim agentima bićete upoznati sa tačnom lokacijom nepokretnosti, pri čemu Avenija nekretnine ne snosi odgovornost ukoliko je Vaš lični utisak da lokacija navedena u oglasu ne odgovara lokaciji na terenu.Avenija nekretnine nastoji da bude što preciznija u opisu nepokretnosti, prikazu slika i samih cena. Međutim, ne može garantovati da su sve informacije kompletne i bez propusta, kako u pogledu tehničkih grešaka, opisa karakteristika, tako i cena, niti garantuje da su sve nepokretnosti dostupne za kupoprodaju/zakup.  Avenija nekretnine zadržava pravo da promeni sadržaj ovog oglasa i cene navedene na oglasu u bilo koje vreme i bez prethodnog upozorenja. Takođe, može se desiti da sadržaj bude zastareo, međutim, Avenija nekretnine se ne obavezuje da redovno ažurira informacije sadržane na ovom sajtu.Avenija nekretnine ne snosi odgovornost za promene cena koje mogu da nastanu u svakom momentu od objavljivanja oglasa, niti garantuje tačnost istih. Veoma čest slučaj u praksi jeste da vlasnici ne obaveštavaju ažurno posrednika o promeni cene, pa Avenija nekretnine ne snosi odgovornost za promene istih.ID oglasa: 8337.","Građevinsko zemljište na prodaju, Vrtište, 10.600€, 2387a - 4zida",2024-03-07
395,https://www.4zida.rs/prodaja-placeva/popovica-sremska-kamenica-gradske-lokacije-novi-sad/gradjevinsko-zemljiste/65cf8a28b3658dddb70d55f9,građevinsko zemljište ,0.5 a ,uknjiženo ,477 ,pre 20 dana ,125.000,Popovica,"Popovica, Sremska Kamenica, Gradske lokacije, Novi Sad","<h2 _ngcontent-ng-c3151048826 class=""mat-headline-5"">Opis oglasa</h2><div _ngcontent-ng-c3151048826 class=""prose max-h-64 overflow-hidden text-gray-800 ng-star-inserted""><p>LEP VELIKI PLAC KOD NACIONALNOG PARKA FRUSKA GORA<br>PORED PLACA PROLAZE STRUJA VODA I GAS<br>PLAC IMA CETINARE KOJI GA KRASE<br>PLAC U PRIRODI GDE JE MIR I TISINA<br>PLAC JE OGRADJEN<br>RETKO U PONUDI<br>KONTAKT MILKICA 063/519-023  ILI  060/519-0023","Građevinsko zemljište na prodaju, Popovica, 125.000€, 0a - 4zida",2024-03-07
396,https://www.4zida.rs/prodaja-placeva/grocka-grocka-opstina-beograd/gradjevinsko-zemljiste/658c0623d85025d65701015e,građevinsko zemljište ,0.24 a ,uknjiženo ,38753 ,pre 2 meseca ,30.000,Grocka,"Grocka, Grocka opština, Beograd","<h2 _ngcontent-ng-c3151048826 class=""mat-headline-5"">Opis oglasa</h2><div _ngcontent-ng-c3151048826 class=""prose max-h-64 overflow-hidden text-gray-800 ng-star-inserted""><p>Na prodaju deo placa pod voćem, pogodan za gradnju. Asfaltirani put do placa. 3km od centra Grocke i 500m od Smederevskog puta. U okolini ima i struje i vode, okolo su ušorene kuće. Agencijska provizija 2%. //Agent:064/5335446//","Građevinsko zemljište na prodaju, Grocka, 30.000€, 0a - 4zida",2024-03-07
397,https://www.4zida.rs/prodaja-placeva/novo-selo-okolne-lokacije-vrnjacka-banja/gradjevinsko-zemljiste/65d3612a94e4a74d7f0827b2,građevinsko zemljište ,30 a ,uknjiženo ,,pre 17 dana ,36.000,bbb,"Novo Selo, Okolne lokacije, Vrnjačka Banja","<h2 _ngcontent-ng-c3151048826 class=""mat-headline-5"">Opis oglasa</h2><div _ngcontent-ng-c3151048826 class=""prose max-h-64 overflow-hidden text-gray-800 ng-star-inserted""><p>Plac na prodaju 2,5 km od centra Banje. 30 ari, pored asfalta, na placu je uvedena voda.","Građevinsko zemljište na prodaju, bbb, 36.000€, 30a - 4zida",2024-03-07
398,https://www.4zida.rs/prodaja-placeva/gradske-lokacije-cajetina/gradjevinsko-zemljiste/64f0d7d179825090f2051af7,građevinsko zemljište ,23.7 a ,uknjiženo ,,pre 6 meseci ,118.500,Očka Gora,"Gradske lokacije, Čajetina","<h2 _ngcontent-ng-c3151048826 class=""mat-headline-5"">Opis oglasa</h2><div _ngcontent-ng-c3151048826 class=""prose max-h-64 overflow-hidden text-gray-800 ng-star-inserted""><p>Prodaje se gradsko građevinsko zemljište u Čajetini, potez Očka Gora, površine 2370 m2, front je oko 15 metara, blizina magistrale, udaljeno od centra Zlatibora 10-15 minuta pešice, struja i voda u blizini placa, na placu protiče potok, cena 5.000 evra po aru, za više informacija slobodno nas pozovite.","Građevinsko zemljište na prodaju, Očka Gora, 118.500€, 23a - 4zida",2024-03-07
399,https://www.4zida.rs/prodaja-placeva/pancevacki-put-krnjaca-palilula-opstina-beograd/gradjevinsko-zemljiste/64cce48c9a541a12de092cf7,,,,,,,,,,"Građevinsko zemljište na prodaju, Pančevački put, 100.000€, 25a - 4zida",2024-03-07
400,https://www.4zida.rs/prodaja-placeva/pancevacki-put-krnjaca-palilula-opstina-beograd/gradjevinsko-zemljiste/64b5c4498ec2d817fc02e22b,,,,,,,,,,"Građevinsko zemljište na prodaju, Jezerska ulica, 6.prolaz 1, 40.000€, 9a - 4zida",2024-03-07
401,https://www.4zida.rs/prodaja-placeva/palilula-gradske-lokacije-nis/gradjevinsko-zemljiste/65b11fb6bd61a70db00f9b04,građevinsko zemljište ,17.18 a ,uknjiženo ,p,pre 1 mesec ,17.500,Belopalanačka,"Palilula, Gradske lokacije, Niš","<h2 _ngcontent-ng-c3151048826 class=""mat-headline-5"">Opis oglasa</h2><div _ngcontent-ng-c3151048826 class=""prose max-h-64 overflow-hidden text-gray-800 ng-star-inserted""><p>Na prodaju plac na Paliluli, između Kovanlučke i Belopalanačke ulice.<br>Velo lepa lokacija sa panoramskim pogledom na grad.<br>VRLO POVOLJNO!<br>Plac ima 1718m2, svi komunalni priključci su dostupni u blizini parcele.<br>Trenutno se do placa dolazi službenim prolazom.<br>Cena placa je 17.500,00€. Uknjižen, čisto vlasništvo.<br>Za više informacija slobodno pozovite. Ovo je samo deo naše ponude, ovaj kao i druge nekretnine sa većim brojem fotografija možete pogledati na našem sajtu.","Građevinsko zemljište na prodaju, Belopalanačka, 17.500€, 17a - 4zida",2024-03-07
402,https://www.4zida.rs/prodaja-placeva/mladenovac-centar-mladenovac-opstina-beograd/gradjevinsko-zemljiste/6460822b29dd6639850164b4,,,,,,,,,,"Građevinsko zemljište na prodaju, Kraljice Marije, 720.000€, 60a - 4zida",2024-03-07
403,https://www.4zida.rs/prodaja-placeva/kosmaj-sopot-opstina-beograd/gradjevinsko-zemljiste/65548842d8598498c70a9018,,,,,,,,,,"Građevinsko zemljište na prodaju, Kosmaj, 580.000€, 400a - 4zida",2024-03-07
404,https://www.4zida.rs/prodaja-placeva/gradske-lokacije-indjija/gradjevinsko-zemljiste/6418c4fde49a4cbbd50dfccf,,,,,,,,,,"Građevinsko zemljište na prodaju, Kamenova bb, 160.000€, 93a - 4zida",2024-03-07
