,link,Tip,Površina,Uknjiženost,Šifra oglasa,Oglas ažuriran,price,street,address,description,title,end_date
90,https://www.4zida.rs/prodaja-placeva/djuriselo-okolne-lokacije-kragujevac/gradjevinsko-zemljiste/643fb1bba55011fd080c1310,građevinsko zemljište ,9.93 a ,,p,pre 10 meseci ,10.500,Boračka,"Đuriselo, Okolne lokacije, Kragujevac","<h2 _ngcontent-ng-c3151048826 class=""mat-headline-5"">Opis oglasa</h2><div _ngcontent-ng-c3151048826 class=""prose max-h-64 overflow-hidden text-gray-800 ng-star-inserted""><p>Na prodaju plac u Đuriselu  površine 9,93. Plac je građevinska parcela, pogodan za izgradnju porodične kuće, vikendice, brvnare...Nalazi se u neposrednoj blizini glavnog puta u Đuriselu na izuzetno lepoj lokaciji odakle se pruža prelep pogled na grad i okolinu. Postoji mogućnost priključka na gradski vodovod i elektromrežu, u neposrednoj blizini se nalazi gasovod. Za sve informacije i razgledanje stojimo vam na raspolaganju, radnim danima od 09-19h i subotom od 09-17h. Ovu i druge nekretnine sa većim brojem fotografija možete pogledati na našem sajtu: bulevarnekretnine.rs, kontakt: info@bulevarnekretnine.rs, usluga besplatna. Čekamo Vas. Telefon 034/330808 i 060/0544253. Bulevar Nekretnine 034, Kragujevac, broj u registru posrednika: 1278.","Građevinsko zemljište na prodaju, Boračka, 10.500€, 9a - 4zida",2024-03-07
91,https://www.4zida.rs/prodaja-placeva/branko-bjegovic-crveni-krst-gradske-lokacije-nis/gradjevinsko-zemljiste/624c5848ac2bb67aa95de930,građevinsko zemljište ,449 a ,uknjiženo ,9230 ,pre 1 godinu ,36.500,Branko Bjegović,"Branko Bjegović, Crveni Krst, Gradske lokacije, Niš","<h2 _ngcontent-ng-c3151048826 class=""mat-headline-5"">Opis oglasa</h2><div _ngcontent-ng-c3151048826 class=""prose max-h-64 overflow-hidden text-gray-800 ng-star-inserted""><p>Zemljište, Niš, Podvinik, 4,5 Ara<br>U prilici smo da vam ponudimo gradsko građevinsko zemljište na jednoj od atraktivnijih lokacija u gradu u naselju podvinik. U neposrednoj blizini škole i vrtića, do glavnog puta, površine 4,5 ara. Na placu se nalazi temelj sa ukopanim podrumom površine 120m2. Priključci za struju, vodu i kanalizaciju odmah uz plac (plaćeni). Idealna investicija za izgradnju porodične kuće.<br>Ukoliko je ova nekretnina na nekom drugom mestu oglašena sa nižom cenom, koju je prethodno odobrio vlasnik nekretnine, niža cena takođe važi i u našoj ponudi.","Građevinsko zemljište na prodaju, Branko Bjegović, 36.500€, 449a - 4zida",2024-03-07
92,https://www.4zida.rs/prodaja-placeva/ropocevo-sopot-opstina-beograd/gradjevinsko-zemljiste/6544e88dfe91aaa11d094d12,građevinsko zemljište ,41 a ,uknjiženo ,1371 ,pre 4 meseca ,71.750,Prvog maja,"Ropočevo, Sopot opština, Beograd","<h2 _ngcontent-ng-c3151048826 class=""mat-headline-5"">Opis oglasa</h2><div _ngcontent-ng-c3151048826 class=""prose max-h-64 overflow-hidden text-gray-800 ng-star-inserted""><p>Uknjižen, ograđen plac, građevinsko zemljište ( njiva 3. klase) na odličnoj lokaciji u Sopotu, površine 41 ari. Plac je od samog centra Sopota udaljen na oko 1500m. Plac se nalazi na nadmorskoj visini od 250m, izlazi na tri ulice ( nov asfaltiran put), sa placa se pruža prelep pogled ka Kosmaju. Struja, voda, kanalizacija i optika. Na placu je dozvoljena gradnja. Preporuka! ","Građevinsko zemljište na prodaju, Prvog maja, 71.750€, 41a - 4zida",2024-03-07
93,https://www.4zida.rs/prodaja-placeva/niska-banja-gradske-lokacije-nis/gradjevinsko-zemljiste/65e068d312dd27155c002b0d,građevinsko zemljište ,7 a ,,2345 ,pre 7 dana ,19.000,Niška Banja,"Niška Banja, Gradske lokacije, Niš","<h2 _ngcontent-ng-c3151048826 class=""mat-headline-5"">Opis oglasa</h2><div _ngcontent-ng-c3151048826 class=""prose max-h-64 overflow-hidden text-gray-800 ng-star-inserted""><p>Prodaje se plac sa prelepim pogledom na Nišku Banju i grad. Plac je površine 7,5 ari i nalazi se pored asfaltnog puta. Poseduje priključke za vodu i struju. Hvala Vam što ste pogledali oglas. Za više informacija o ovoj ili drugim nekretninama i zakazivanje razgledanja kontaktirajte agenta na telefon 066/489-100 (poziv, sms, viber) ili putem e-maila. Kompletnu ponudu dostupnih nekretnina možete pronaći na našem sajtu.","Građevinsko zemljište na prodaju, Niška Banja, 19.000€, 7a - 4zida",2024-03-07
94,https://www.4zida.rs/prodaja-placeva/centar-gradske-lokacije-jagodina/gradjevinsko-zemljiste/5b7efa96b70c59033501e633,građevinsko zemljište ,31 a ,,,pre 3 godine ,31.000,Centar,"Centar, Gradske lokacije, Jagodina","<h2 _ngcontent-ng-c3151048826 class=""mat-headline-5"">Opis oglasa</h2><div _ngcontent-ng-c3151048826 class=""prose max-h-64 overflow-hidden text-gray-800 ng-star-inserted""><p>Plac se nalazi na nekih 600m od gradske pijace ","Građevinsko zemljište na prodaju, Centar, 31.000€, 31a - 4zida",2024-03-07
95,https://www.4zida.rs/prodaja-placeva/sajlovo-gradske-lokacije-novi-sad/gradjevinsko-zemljiste/6576cb63348d9e3b0d02a2da,,,,,,,,,,"Prodaja placeva Sajlovo, Gradske lokacije, Novi Sad, Građevinsko zemljište - 4zida",2024-03-07
96,https://www.4zida.rs/prodaja-placeva/nemenikuce-sopot-opstina-beograd/gradjevinsko-zemljiste/651d3d990b3d51d4bc0f801b,građevinsko zemljište ,10 a ,uknjiženo ,10923 ,pre 5 meseci ,25.000,Nemenikuće,"Nemenikuće, Sopot opština, Beograd","<h2 _ngcontent-ng-c3151048826 class=""mat-headline-5"">Opis oglasa</h2><div _ngcontent-ng-c3151048826 class=""prose max-h-64 overflow-hidden text-gray-800 ng-star-inserted""><p>Plac se nalazi na uzvišenju sa panoramskim pogledom na Kosmaj, na sunčanoj je strani. U gradjevinskoj je zoni. Celokupna infrastruktura je prošla pored placa odnosno  struja, voda i gas. Ulica je asfaltirana. Postoji mogućnost proširenja placa za još 10 illi 20 ari. ","Građevinsko zemljište na prodaju, Nemenikuće, 25.000€, 10a - 4zida",2024-03-07
97,https://www.4zida.rs/prodaja-placeva/donja-vrezina-pantelej-gradske-lokacije-nis/gradjevinsko-zemljiste/64e8c65df7b695addf092cab,građevinsko zemljište ,26.25 a ,uknjiženo ,p,pre 6 dana ,23.500,Donja Vrežina,"Donja Vrežina, Pantelej, Gradske lokacije, Niš","<h2 _ngcontent-ng-c3151048826 class=""mat-headline-5"">Opis oglasa</h2><div _ngcontent-ng-c3151048826 class=""prose max-h-64 overflow-hidden text-gray-800 ng-star-inserted""><p>Na prodaju plac u Nišu, u Donjoj Vrežini. Plac je gradsko građevinsko zemljište. Površina placa je 2625m2, uknjižen, privatna svojina 1 kroz 1. Ovo je samo deo naše ponude, ovu kao i druge nekretnine možete pogledati na našem sajtu.","Građevinsko zemljište na prodaju, Donja Vrežina, 23.500€, 26a - 4zida",2024-03-07
98,https://www.4zida.rs/prodaja-placeva/tursko-brdo-okolne-lokacije-irig/gradjevinsko-zemljiste/64abf3bd68913cac9d063f5c,građevinsko zemljište ,77 a ,uknjiženo ,17923 ,pre 6 meseci ,160.000,Mike Antića bb,"Tursko Brdo, Okolne lokacije, Irig","<h2 _ngcontent-ng-c3151048826 class=""mat-headline-5"">Opis oglasa</h2><div _ngcontent-ng-c3151048826 class=""prose max-h-64 overflow-hidden text-gray-800 ng-star-inserted""><p>Prodaje se veliki plac 7744m2, u vikend zoni Iriga gde je dozvoljena gradnja, na odličnom mestu. Pored placa je asfaltni put, ima gradsku vodu, a ceo plac je pod voćem. Blaga nizbrdica, prelep pogled. Dozvoljena gradnja vikendica do 150 m2 osnove. Video prezentacija u linku https://www.youtube.com/watch?v=L0en9LeK9UE<br>Agencijska provizija je uračunata u cenu.<br>Agencijska šifra 17923<br>Kontakt Tanja Mitrović 0646431554","Građevinsko zemljište na prodaju, Mike Antića bb, 160.000€, 77a - 4zida",2024-03-07
99,https://www.4zida.rs/prodaja-placeva/belotinac-okolne-lokacije-doljevac/gradjevinsko-zemljiste/6581b48a7cfaff1804022507,,,,,,,,,,"Prodaja placeva Belotinac, Okolne lokacije, Doljevac, Građevinsko zemljište - 4zida",2024-03-07
100,https://www.4zida.rs/prodaja-placeva/jajinci-vozdovac-opstina-beograd/gradjevinsko-zemljiste/65ba2628f67349ca45005c21,,,,,,,,,,"Građevinsko zemljište na prodaju, Zorice Bozovic 13, 70.000€, 5a - 4zida",2024-03-07
101,https://www.4zida.rs/prodaja-placeva/lazarica-gradske-lokacije-krusevac/gradjevinsko-zemljiste/5fa141cfab329f27f000078d,,,,,,,,,,"Građevinsko zemljište na prodaju, Cara Lazara, 130.000€, 55a - 4zida",2024-03-07
102,https://www.4zida.rs/prodaja-placeva/ribnica-gradske-lokacije-kraljevo/gradjevinsko-zemljiste/64f0cf522080cef0e20fca4c,,,,,,,,,,"Građevinsko zemljište na prodaju, ive andrica, 16.000€, 20a - 4zida",2024-03-07
103,https://www.4zida.rs/prodaja-placeva/gradske-lokacije-merosina/gradjevinsko-zemljiste/6329a0f41f531452cd008983,građevinsko zemljište ,164.0185 a ,,p,pre 10 meseci ,21.000,Merošina,"Gradske lokacije, Merošina","<h2 _ngcontent-ng-c3151048826 class=""mat-headline-5"">Opis oglasa</h2><div _ngcontent-ng-c3151048826 class=""prose max-h-64 overflow-hidden text-gray-800 ng-star-inserted""><p>Na prodaju poljoprivredno zemljište u Merošini površine 1h i 64 ari, pod zasadima višnje i šljive . Za više ponuda nekretnina posetite nas sajt uknjiženo čisto vlasništvo, postoji mogućnost kupovine i tri zasebne parcele.","Građevinsko zemljište na prodaju, Merošina, 21.000€, 164a - 4zida",2024-03-07
104,https://www.4zida.rs/prodaja-placeva/donji-matejevac-okolne-lokacije-nis/gradjevinsko-zemljiste/654d2fe5b4e71ad2d605601d,građevinsko zemljište ,23.07 a ,uknjiženo ,p,pre 3 meseca ,55.000,Donji Matejevac,"Donji Matejevac, Okolne lokacije, Niš","<h2 _ngcontent-ng-c3151048826 class=""mat-headline-5"">Opis oglasa</h2><div _ngcontent-ng-c3151048826 class=""prose max-h-64 overflow-hidden text-gray-800 ng-star-inserted""><p>Na prodaju odličan  plac za gradnju,  na nekoliko  km od Niša, u izuzetnom prirodnom okruženju, blizu vikend naselja Donji Matejevac, na putu za Kamenicu.   Uknjižene površine 2307m2.   Urađen je DUP za ovaj deo periferije grada Niša, te ima sve preduslove za izgradnju jednog ili više objekata. Nalazi se u neposrednoj blizini asvaltnog lokalnog puta, a prilaz do kuće je nasipan tucanikom (oko 50m od asvalta). Ispred su voda i struja, priključak za telefon.  Ima lep pogled na crkvu Sv. Petka. Trenutno je poljoprivredno zemljište, ali je u procesu   prenamene  u gradsko građevinsko zemljište . Na odličnom je mestu za za porodičnu kuću ili vikendicu.  Uknjižen kao privatna svojina. Postoji mogućnost parcelacije zemljišta u više manjih parcela, kao i njihova zasebna  kupovina   u dogovoru sa vlasnikom.<br> Ovo je samo deo naše ponude, za više informacija javite se i posetite nas sajt.","Građevinsko zemljište na prodaju, Donji Matejevac, 55.000€, 23a - 4zida",2024-03-07
105,https://www.4zida.rs/prodaja-placeva/mudrakovac-gradske-lokacije-krusevac/gradjevinsko-zemljiste/654536c0631c2d06da0bba7a,građevinsko zemljište ,402 a ,uknjiženo ,,pre 4 meseca ,25.000,Mudrakovac,"Mudrakovac, Gradske lokacije, Kruševac","<h2 _ngcontent-ng-c3151048826 class=""mat-headline-5"">Opis oglasa</h2><div _ngcontent-ng-c3151048826 class=""prose max-h-64 overflow-hidden text-gray-800 ng-star-inserted""><p>Agencija za nekretnine Maksimović prodaje prazan plac od 4,02 ara u Mudrakovcu, Kruševac, nedaleko od škole Jovan Jovanović Zmaj.","Građevinsko zemljište na prodaju, Mudrakovac, 25.000€, 402a - 4zida",2024-03-07
106,https://www.4zida.rs/prodaja-placeva/srebrno-jezero-okolne-lokacije-veliko-gradiste/gradjevinsko-zemljiste/64d8d5721b07adb6180a38fd,,,,,,,,,,"Prodaja placeva Srebrno Jezero, Okolne lokacije, Veliko Gradište, Građevinsko zemljište - 4zida",2024-03-07
107,https://www.4zida.rs/prodaja-placeva/stari-banovci-okolne-lokacije-stara-pazova/gradjevinsko-zemljiste/6489fa6441233060b404b21f,,,,,,,,,,"Prodaja placeva Stari Banovci, Okolne lokacije, Stara Pazova, Građevinsko zemljište - 4zida",2024-03-07
108,https://www.4zida.rs/prodaja-placeva/donje-medjurovo-okolne-lokacije-nis/gradjevinsko-zemljiste/63ee214b8c201b832c075d7d,građevinsko zemljište ,18.43 a ,uknjiženo ,p,pre 10 meseci ,47.500,Donje Medjurovo,"Donje Međurovo, Okolne lokacije, Niš","<h2 _ngcontent-ng-c3151048826 class=""mat-headline-5"">Opis oglasa</h2><div _ngcontent-ng-c3151048826 class=""prose max-h-64 overflow-hidden text-gray-800 ng-star-inserted""><p>Na prodaju plac u industrijskoj zoni Donje Međurovo. Ukupna površina placa je 1843m2, gradsko građevinsko zemljište. Nalazi se pored glavnog puta Niš Leskovac, u blizini fabrike Yura i restorana Cuba 13. Širina parcele je oko 20m, a ulazni front ide uz katastarski put u dužini oko 96m. Pogodan je za gradnju poslovno proizvodnih, skladišnih, trgovinskih objekata i sl. Uknjižen, čisto vlasništvo, privatna svojina 1 kroz 1. Za više informacija slobodno pozovite.","Građevinsko zemljište na prodaju, Donje Medjurovo, 47.500€, 18a - 4zida",2024-03-07
109,https://www.4zida.rs/prodaja-placeva/bolec-grocka-opstina-beograd/gradjevinsko-zemljiste/649df51231ea842018050128,,,,,,,,,,"Prodaja placeva Boleč, Grocka opština, Beograd, Građevinsko zemljište - 4zida",2024-03-07
110,https://www.4zida.rs/prodaja-placeva/nemenikuce-sopot-opstina-beograd/gradjevinsko-zemljiste/63d79c6aa3b22a6b32010885,građevinsko zemljište ,103 a ,uknjiženo ,3582 ,pre 1 mesec ,61.800,Nemenikuće,"Nemenikuće, Sopot opština, Beograd","<h2 _ngcontent-ng-c3151048826 class=""mat-headline-5"">Opis oglasa</h2><div _ngcontent-ng-c3151048826 class=""prose max-h-64 overflow-hidden text-gray-800 ng-star-inserted""><p>Na prodaju zemljište u građevinskom području, u Nemenikuću, opština Sopot, površine 1 ha i 3 ara. Sastoji se od više spojenih parcela, koje čine celinu i sve su uknjižene na jednog vlasnika, bez tereta.Širina do puta preko 50m, na placu priključak gradskog vodovoda, kao i stubovi električne energije. Na zemljištu postoji uknjižen objekat, u osnovi 30 m2 koji je moguće adaptirati za stanovanje ili ga rušiti i sagraditi jedan ili više stambenih objekata. Odlična lokacija sa fenomenalnim pogledom na Kosmaj.<br>Cena po aru 600eura.","Građevinsko zemljište na prodaju, Nemenikuće, 61.800€, 103a - 4zida",2024-03-07
111,https://www.4zida.rs/prodaja-placeva/petrovaradin-gradske-lokacije-novi-sad/gradjevinsko-zemljiste/645b9ac4a9141d3bb905d12e,,,,,,,,,,"Prodaja placeva Petrovaradin, Gradske lokacije, Novi Sad, Građevinsko zemljište - 4zida",2024-03-07
112,https://www.4zida.rs/prodaja-placeva/cukarica-cukarica-opstina-beograd/gradjevinsko-zemljiste/5d53ee1de466e62f975a56df,,,,,,,,,,"Građevinsko zemljište na prodaju, Bore Stankovića, 6.500€, 100a - 4zida",2024-03-07
113,https://www.4zida.rs/prodaja-placeva/cenej-okolne-lokacije-novi-sad/gradjevinsko-zemljiste/656f2cb2807557fafd073749,građevinsko zemljište ,15 a ,uknjiženo ,520901 ,pre 3 meseca ,236.900,Milankovo,"Čenej, Okolne lokacije, Novi Sad","<h2 _ngcontent-ng-c3151048826 class=""mat-headline-5"">Opis oglasa</h2><div _ngcontent-ng-c3151048826 class=""prose max-h-64 overflow-hidden text-gray-800 ng-star-inserted""><p>Odličan plac, po odličnoj ceni i odličnoj poziciji. Izlazi na asfaltni put, na nekih 7-8 km do autoputa Beograd-Subotica i isto toliko udaljen do Temerinske petlje. Plac je u blizini Temerina, Siriga, Kisača, Zmajeva. Na placu su uradjena geodinamička isptivanja, plaćena trafo stanica i dobijena gradjevinska dozvola za 1.000 m2 proizvodnog pogona. Naša preporuka! Za više informacija pozovite naše agente prodaje.","Građevinsko zemljište na prodaju, Milankovo, 236.900€, 15a - 4zida",2024-03-07
114,https://www.4zida.rs/prodaja-placeva/sumarice-gradske-lokacije-kragujevac/gradjevinsko-zemljiste/64783ba0793cdcab630ca91d,,,,,,,,,,"Građevinsko zemljište na prodaju, Gornjomilanovacka Sumarice, 17.040€, 7a - 4zida",2024-03-07
115,https://www.4zida.rs/prodaja-placeva/simanovci-okolne-lokacije-pecinci/gradjevinsko-zemljiste/61f53aa8e7b0f5396c6b0390,,,,,,,,,,"Građevinsko zemljište na prodaju, Šimanovci, 255.000€, 63a - 4zida",2024-03-07
116,https://www.4zida.rs/prodaja-placeva/ada-gradske-lokacije-uzice/gradjevinsko-zemljiste/652655ce333d1241f7059163,građevinsko zemljište ,4.5 a ,uknjiženo ,ID 07/2023 ,pre 4 meseca ,12.000,Vrela bb,"Ada, Gradske lokacije, Užice","<h2 _ngcontent-ng-c3151048826 class=""mat-headline-5"">Opis oglasa</h2><div _ngcontent-ng-c3151048826 class=""prose max-h-64 overflow-hidden text-gray-800 ng-star-inserted""><p>Na prodaju plac u Vrelima površine 450m2. Plac se nalazi u gradskoj građevinskoj zoni. Skroz ravan, pravilnog pravougaonog oblika. Jednom stranom izlazi na potok.  Do placa se dolazi asfaltinim putem. Idealno za kuću ili vikendicu. Vredi pogledati. Dobra kupovina.","Građevinsko zemljište na prodaju, Vrela bb, 12.000€, 4a - 4zida",2024-03-07
117,https://www.4zida.rs/prodaja-placeva/zeleznik-cukarica-cukarica-opstina-beograd/gradjevinsko-zemljiste/650b2bec7e4884227505a2f8,građevinsko zemljište ,11.2 a ,,1599 ,pre 5 meseci ,54.880,Vinogradi,"Železnik, Čukarica, Čukarica opština, Beograd","<h2 _ngcontent-ng-c3151048826 class=""mat-headline-5"">Opis oglasa</h2><div _ngcontent-ng-c3151048826 class=""prose max-h-64 overflow-hidden text-gray-800 ng-star-inserted""><p>Gradsko građevinsko zemljište.","Građevinsko zemljište na prodaju, Vinogradi, 54.880€, 11a - 4zida",2024-03-07
118,https://www.4zida.rs/prodaja-placeva/gornja-klisa-klisa-gradske-lokacije-novi-sad/gradjevinsko-zemljiste/64c7c779636639041c0be50d,građevinsko zemljište ,9 a ,uknjiženo ,514856 ,pre 4 meseca ,118.450,Sentandrejski put,"Gornja Klisa, Klisa, Gradske lokacije, Novi Sad","<h2 _ngcontent-ng-c3151048826 class=""mat-headline-5"">Opis oglasa</h2><div _ngcontent-ng-c3151048826 class=""prose max-h-64 overflow-hidden text-gray-800 ng-star-inserted""><p>Retko u ponudi. Jedinstven građevinski plac na Sentandrejskom putu. Nakon što bude urađena ulica na gornjoj strani placa, plac će izlaziti na dve ulice. Sva infrastruktura se nalazi u neposrednoj blizini placa. Za više informacija slobodno nas kontaktirajte. Kontakt:0648033305","Građevinsko zemljište na prodaju, Sentandrejski put, 118.450€, 9a - 4zida",2024-03-07
119,https://www.4zida.rs/prodaja-placeva/borca-palilula-opstina-beograd/gradjevinsko-zemljiste/62da87e32e56100ce209416f,građevinsko zemljište ,45 a ,uknjiženo ,42768 ,pre 10 meseci ,660.000,Popova bara nova,"Borča, Palilula opština, Beograd","<h2 _ngcontent-ng-c3151048826 class=""mat-headline-5"">Opis oglasa</h2><div _ngcontent-ng-c3151048826 class=""prose max-h-64 overflow-hidden text-gray-800 ng-star-inserted""><p>45a, zemljište u građevinskom području.<br>Plac se prostire između Zrenjaninskog puta i Popove bare nove (moguć prilaz sa obe strane), u blizini skretanja za Ovču, a nedaleko od stajališta Borča Raskršće (96,101,105,106). Veoma prometni deo Borče u čijoj blizini se nalaze supermarketi i ostale trgovinske radnje, restorani, pekare, stovarišta.<br>Ima uslove za priključivanje struje nakon dobijanja građevinske dozvole.<br>Osnovna namena povrsine: komercijalni sadrzaji.<br>Orijentaciona planirana spratnost je p+2+pk/ps, sa maksimalnom visinom venca objekta 13m (maksimalna visina slemena objekta 16,5m).<br>Maksimalni indeks zauzetosti na parceli je 40%.<br>Zemljište je pogodno za različite namene.<br>Kupac plaća agencijsku proviziju 2% na dogovorenu cenu. Agencijska provizija 2%.  ID oglasa: 42768.","Građevinsko zemljište na prodaju, Popova bara nova, 660.000€, 45a - 4zida",2024-03-07
120,https://www.4zida.rs/prodaja-placeva/gornje-livade-gradske-lokacije-novi-sad/gradjevinsko-zemljiste/6501be52926045bb910f9d1d,građevinsko zemljište ,6.04 a ,uknjiženo ,516673 ,pre 5 meseci ,62.250,Gornje Livade,"Gornje Livade, Gradske lokacije, Novi Sad","<h2 _ngcontent-ng-c3151048826 class=""mat-headline-5"">Opis oglasa</h2><div _ngcontent-ng-c3151048826 class=""prose max-h-64 overflow-hidden text-gray-800 ng-star-inserted""><p>KLISA - GORNJE LIVADE - Prodaje se plac u građevinskoj zoni , uknjižen kao njiva 3 klase. Plac je u izgrađenoj ulici, sa asfaltnim pute. Nalazi se na ćošku dve ulice. Front je 20 metara. Odličan za porodičnu kuću. Za više informacija pozovite naše agente prodaje.","Građevinsko zemljište na prodaju, Gornje Livade, 62.250€, 6a - 4zida",2024-03-07
121,https://www.4zida.rs/prodaja-placeva/alibegovac-petrovaradin-gradske-lokacije-novi-sad/gradjevinsko-zemljiste/658c002ce133c49e09061b23,građevinsko zemljište ,24 a ,uknjiženo ,9779 ,pre 2 meseca ,62.000,Alibegovac,"Alibegovac, Petrovaradin, Gradske lokacije, Novi Sad","<h2 _ngcontent-ng-c3151048826 class=""mat-headline-5"">Opis oglasa</h2><div _ngcontent-ng-c3151048826 class=""prose max-h-64 overflow-hidden text-gray-800 ng-star-inserted""><p>Agencija za nekretnine Winner upisana u Registar posrednika br.612 oglašava prodaju; Građevinski plac od 2412m2 u građevinskom području, dozvoljena gradnja SU+PR+I+PK 480m2 neto, pogled prema Alibegovcu, mogućnost otvaranja još jednog pristupnog puta, front do ulice 34m, uknjižen.","Građevinsko zemljište na prodaju, Alibegovac, 62.000€, 24a - 4zida",2024-03-07
122,https://www.4zida.rs/prodaja-placeva/mali-bajmok-gradske-lokacije-subotica/gradjevinsko-zemljiste/6540c27cc2dae5d15c0a8ba1,,,,,,,,,,"Građevinsko zemljište na prodaju, Franje Kluza, 189.000€, 68a - 4zida",2024-03-07
123,https://www.4zida.rs/prodaja-placeva/belic-okolne-lokacije-valjevo/gradjevinsko-zemljiste/64b4f3ecb3efb31aa0052c06,,,,,,,,,,"Prodaja placeva Belić, Okolne lokacije, Valjevo, Građevinsko zemljište - 4zida",2024-03-07
124,https://www.4zida.rs/prodaja-placeva/donje-medjurovo-okolne-lokacije-nis/gradjevinsko-zemljiste/64e89b6ea6d034f13005f175,građevinsko zemljište ,38 a ,,p,pre 6 meseci ,39.500,Novo selo,"Donje Međurovo, Okolne lokacije, Niš","<h2 _ngcontent-ng-c3151048826 class=""mat-headline-5"">Opis oglasa</h2><div _ngcontent-ng-c3151048826 class=""prose max-h-64 overflow-hidden text-gray-800 ng-star-inserted""><p>Na prodaju plac u Novom Selu, 38 ari. Nalazi se u građevinskom području, u blizini puta i komunalne infrastrukture. Uknjižen je i vlasništvo 1 kroz 1. Ovo je samo deo naše ponude, za više informacija, stojimo vam na raspolaganju.","Građevinsko zemljište na prodaju, Novo selo, 39.500€, 38a - 4zida",2024-03-07
125,https://www.4zida.rs/prodaja-placeva/industrijska-zona-sever-gradske-lokacije-novi-sad/gradjevinsko-zemljiste/6231cc6492fb56230e6eed26,građevinsko zemljište ,58.4 a ,uknjiženo ,,pre 2 dana ,280.000,profesora dr. Dragoslava Milisavljevica bb,"Industrijska Zona - Sever, Gradske lokacije, Novi Sad","<h2 _ngcontent-ng-c3151048826 class=""mat-headline-5"">Opis oglasa</h2><div _ngcontent-ng-c3151048826 class=""prose max-h-64 overflow-hidden text-gray-800 ng-star-inserted""><p>Prodajem plac 5840 m2. ..<br>Novi Sad, gornje Sajlovo. ..<br>Plac blizu kanala DTD, izlazi na dve ulice. Gradsko gradjevinsko zemljiste, pogodan za privredno-industrijsku delatnost a moze i za stambeni objekat. Sirina placa 25 metara.","Građevinsko zemljište na prodaju, profesora dr. Dragoslava Milisavljevica bb, 280.000€, 58a - 4zida",2024-03-07
126,https://www.4zida.rs/prodaja-placeva/ritopek-grocka-opstina-beograd/gradjevinsko-zemljiste/655206c5dee3b9f8bb0ea323,,,,,,,,,,"Prodaja placeva Ritopek, Grocka opština, Beograd, Građevinsko zemljište - 4zida",2024-03-07
127,https://www.4zida.rs/prodaja-placeva/guncati-barajevo-opstina-beograd/gradjevinsko-zemljiste/640b4b1dc0720dc17906c26e,građevinsko zemljište ,11900 a ,uknjiženo ,122489 ,pre 3 meseca ,459.000,Guncati,"Guncati, Barajevo opština, Beograd","<h2 _ngcontent-ng-c3151048826 class=""mat-headline-5"">Opis oglasa</h2><div _ngcontent-ng-c3151048826 class=""prose max-h-64 overflow-hidden text-gray-800 ng-star-inserted""><p>Plac u Barajevu na lepoj lokaciji. Vlasnik 1/1, povoljno. agencijska provizija 2%","Građevinsko zemljište na prodaju, Guncati, 459.000€, 11900a - 4zida",2024-03-07
128,https://www.4zida.rs/prodaja-placeva/vrcin-grocka-opstina-beograd/gradjevinsko-zemljiste/65ae4566d6d821cee00eb4c4,građevinsko zemljište ,15 a ,uknjiženo ,42850 ,pre 1 mesec ,45.000,Vrčin,"Vrčin, Grocka opština, Beograd","<h2 _ngcontent-ng-c3151048826 class=""mat-headline-5"">Opis oglasa</h2><div _ngcontent-ng-c3151048826 class=""prose max-h-64 overflow-hidden text-gray-800 ng-star-inserted""><p>Građevinska parcela kvadratnog oblika na vrh brda. Blago nagnuta ka južnoj strani daje joj velike mogućnosti za planiranje kuće, okućnice za jedan udoban dioživljaj. Blizu autobuska  stanica, prisutna sva infrastruktura. Agencijska provizija 3%.  ID oglasa: 42850.","Građevinsko zemljište na prodaju, Vrčin, 45.000€, 15a - 4zida",2024-03-07
129,https://www.4zida.rs/prodaja-placeva/kosmaj-sopot-opstina-beograd/gradjevinsko-zemljiste/642b0155f1541bb5a1050433,,,,,,,,,,"Građevinsko zemljište na prodaju, Tihomira Colica Badze bb, 24.900€, 25a - 4zida",2024-03-07
130,https://www.4zida.rs/prodaja-placeva/donja-vrezina-pantelej-gradske-lokacije-nis/gradjevinsko-zemljiste/640b4abec0720dc17906c24e,,,,,,,,,,"Prodaja placeva Donja Vrežina, Pantelej, Gradske lokacije, Niš, Građevinsko zemljište - 4zida",2024-03-07
131,https://www.4zida.rs/prodaja-placeva/medjuluzje-mladenovac-opstina-beograd/gradjevinsko-zemljiste/656463b481238a65180a7dfd,,,,,,,,,,"Građevinsko zemljište na prodaju, Paje Jovanovića, 105.000€, 70a - 4zida",2024-03-07
