,link,Tip,PovrÅ¡ina,UknjiÅ¾enost,Å ifra oglasa,Oglas aÅ¾uriran,price,street,address,description,title,end_date
0,https://www.4zida.rs/prodaja-placeva/zeleno-polje-gradske-lokacije-zrenjanin/gradjevinsko-zemljiste/65ce215ae0901ae5dd01ab51,graÄ‘evinsko zemljiÅ¡te ,2.57 a ,uknjiÅ¾eno ,1633 ,pre 15 dana ,30.000,Zeleno Polje,"Zeleno Polje, Gradske lokacije, Zrenjanin","<h2 _ngcontent-ng-c3151048826 class=""mat-headline-5"">Opis oglasa</h2><div _ngcontent-ng-c3151048826 class=""prose max-h-64 overflow-hidden text-gray-800 ng-star-inserted""><p>Na prodaju plac, njiva 1. klase, u graÄ‘evinskom podruÄju povrÅ¡ine 25.7 ari. Do parcele se dolazi asfaltnim putem, vlasnik poseduje informacije o lokaciji. U zoni moguÄ‡a izgradnja objekata ( staklenici, plastenici, objekti za gajenje peÄurki, objekti za Äuvanje i lagerovanje poljoprivrednih proizvoda, itd). Å irina parcele do asfaltnog puta je 62,5 m. UknjiÅ¾eno 1/1","GraÄ‘evinsko zemljiÅ¡te na prodaju, Zeleno Polje, 30.000â‚¬, 2a - 4zida",2024-03-02
1,https://www.4zida.rs/prodaja-placeva/simanovci-okolne-lokacije-pecinci/gradjevinsko-zemljiste/65e066425232bbd66305930c,graÄ‘evinsko zemljiÅ¡te ,155 a ,uknjiÅ¾eno ,1355 ,pre 1 dan ,341.000,potes Legdar,"Å imanovci, Okolne lokacije, PeÄ‡inci","<h2 _ngcontent-ng-c3151048826 class=""mat-headline-5"">Opis oglasa</h2><div _ngcontent-ng-c3151048826 class=""prose max-h-64 overflow-hidden text-gray-800 ng-star-inserted""><p>Na prodaju graÄ‘evinska parcela u Å imanovcima, u radnoj zoni u ataru. Parcela je povrÅ¡ine 1h 55a 51m2 i nalazi se na autoputu Zagreb-Beograd, oko 4km od naplatne rampe u Å imanovcima. VlasniÅ¡tvo uredno, POTREBNO PLATITI PROMENU NAMENE ZEMLJIÅ TA.","GraÄ‘evinsko zemljiÅ¡te na prodaju, potes Legdar, 341.000â‚¬, 155a - 4zida",2024-03-02
2,https://www.4zida.rs/prodaja-placeva/simanovci-okolne-lokacije-pecinci/gradjevinsko-zemljiste/65e175edc69bc00e330c48a5,graÄ‘evinsko zemljiÅ¡te ,312 a ,uknjiÅ¾eno ,1216 ,pre 1 dan ,936.000,potes Porajac,"Å imanovci, Okolne lokacije, PeÄ‡inci","<h2 _ngcontent-ng-c3151048826 class=""mat-headline-5"">Opis oglasa</h2><div _ngcontent-ng-c3151048826 class=""prose max-h-64 overflow-hidden text-gray-800 ng-star-inserted""><p>Na prodaju graÄ‘evinska parcela u radnoj zoni, u Å imanovcima. Parcela se nalazi severno od auto-puta Beograd - Zagreb a ima prilaz i sa KrnjeÅ¡evaÄke strane. Do parcele postoji asfalt a sa zapadne strane dobar nasut put ( od KrnjeÅ¡evaca). PovrÅ¡ina je 3h 12a 04m2. Dozvoljena gradnja skladiÅ¡ta, pogona, graÄ‘are, benziske stanice, marketa...Â Vlasnik 1/1. Potrebno platiti promenu namene zemljiÅ¡ta.","GraÄ‘evinsko zemljiÅ¡te na prodaju, potes Porajac, 936.000â‚¬, 312a - 4zida",2024-03-02
3,https://www.4zida.rs/prodaja-placeva/camurlija-okolne-lokacije-nis/gradjevinsko-zemljiste/65e04c9c772f851fe60f7a49,graÄ‘evinsko zemljiÅ¡te ,54 a ,uknjiÅ¾eno ,1811 ,pre 1 dan ,54.000,ÄŒamurlija,"ÄŒamurlija, Okolne lokacije, NiÅ¡","<h2 _ngcontent-ng-c3151048826 class=""mat-headline-5"">Opis oglasa</h2><div _ngcontent-ng-c3151048826 class=""prose max-h-64 overflow-hidden text-gray-800 ng-star-inserted""><p>Prodaje se parcela u VrtiÅ¡tu, ukupne povrÅ¡ine 54 ara. Nalazi se na magistralnom putu za Aleksinac u blizini hotela Nais. Parcela se nalazi na 130m od asfaltnog puta u blizini se nalaze prikljuÄci za vodu i struju. Parcela je pravilnog oblika, dimenzije placa su 132 m x 44 m. Hvala Vam Å¡to ste pogledali oglas. Za viÅ¡e informacija o ovoj ili drugim nekretninama i zakazivanje razgledanja kontaktirajte agenta na telefon (poziv, sms, viber) ili putem e-maila. Kompletnu ponudu dostupnih nekretnina moÅ¾ete pronaÄ‡i na naÅ¡em sajtu.","GraÄ‘evinsko zemljiÅ¡te na prodaju, ÄŒamurlija, 54.000â‚¬, 54a - 4zida",2024-03-02
4,https://www.4zida.rs/prodaja-placeva/petrovcic-surcin-opstina-beograd/gradjevinsko-zemljiste/65e185deff38f223ff0ff07b,graÄ‘evinsko zemljiÅ¡te ,1145 a ,uknjiÅ¾eno ,1031 ,pre 23 sati ,1.145.000,potes Petrovac,"PetrovÄiÄ‡, SurÄin opÅ¡tina, Beograd","<h2 _ngcontent-ng-c3151048826 class=""mat-headline-5"">Opis oglasa</h2><div _ngcontent-ng-c3151048826 class=""prose max-h-64 overflow-hidden text-gray-800 ng-star-inserted""><p>Na prodaju dve graÄ‘evinske parcele u PetrovÄiÄ‡u. Parcele su jedna preko puta druge, a deli ih glavni put. Nalaze se u neposrednoj blizini raskrsnice Preka kaldrma. VeliÄina parcela je: 6h 79a iÂ 4h 66a. PoÅ¡to se parcele nalaze u privrednoj zoni, moguÄ‡a je gradnja velikih objekata (hale, magacin, skladiÅ¡ta i sl.) Parcele bez tereta, uknjiÅ¾ene, vlasnik 1/1.","GraÄ‘evinsko zemljiÅ¡te na prodaju, potes Petrovac, 1.145.000â‚¬, 1145a - 4zida",2024-03-02
5,https://www.4zida.rs/prodaja-placeva/manic-barajevo-opstina-beograd/gradjevinsko-zemljiste/65df7d206d0e4910f90f6f05,graÄ‘evinsko zemljiÅ¡te ,32 a ,uknjiÅ¾eno ,,pre 7 sati ,15.000,Svetolika MilovanoviÄ‡a,"ManiÄ‡, Barajevo opÅ¡tina, Beograd","<h2 _ngcontent-ng-c3151048826 class=""mat-headline-5"">Opis oglasa</h2><div _ngcontent-ng-c3151048826 class=""prose max-h-64 overflow-hidden text-gray-800 ng-star-inserted""><p>Vlasnik prodaje plac u ManiÄ‡u, opÅ¡tina Barajevo, ulica Svetolika MilovanoviÄ‡a. Plac ima 32 ara, nalazi se pored asfaltnog puta, izlazi na 2 puta. 50% gradjevinsko podruÄje a 50% zona poljoprivrednog zemljiÅ¡ta. Struja pored placa. Plac se prodaje u celosti. UknjiÅ¾en 1/1 na vlasnika. OdliÄna lokacija. Cena: 15.000 evra Za ozbiljne kupce moguÄ‡ dogovor oko cene. Vlasnik Nemanja 065 9091500","GraÄ‘evinsko zemljiÅ¡te na prodaju, Svetolika MilovanoviÄ‡a, 15.000â‚¬, 32a - 4zida",2024-03-02
6,https://www.4zida.rs/prodaja-placeva/ledena-stena-palilula-gradske-lokacije-nis/gradjevinsko-zemljiste/65e19e47455a7ec89d0277bd,graÄ‘evinsko zemljiÅ¡te ,170 a ,uknjiÅ¾eno ,2804 ,pre 21 sati ,1.636.000,Ledena Stena,"Ledena Stena, Palilula, Gradske lokacije, NiÅ¡","<h2 _ngcontent-ng-c3151048826 class=""mat-headline-5"">Opis oglasa</h2><div _ngcontent-ng-c3151048826 class=""prose max-h-64 overflow-hidden text-gray-800 ng-star-inserted""><p>Prodaje se plac u blizini Metroa, povrÅ¡ine 1,7ha. Plac je pogodan za izgradnju poslovnog prostora. Hvala Vam Å¡to ste pogledali oglas. Za viÅ¡e informacija o ovoj ili drugim nekretninama i zakazivanje razgledanja kontaktirajte agenta na broj telefona iz oglasa (poziv, sms, viber) ili putem e-maila. Kompletnu ponudu dostupnih nekretnina moÅ¾ete pronaÄ‡i na naÅ¡em sajtu. Agencija Proagent nekretnine je upisana u Registru posrednika pod brojem: 940.","GraÄ‘evinsko zemljiÅ¡te na prodaju, Ledena Stena, 1.636.000â‚¬, 170a - 4zida",2024-03-02
7,https://www.4zida.rs/prodaja-placeva/vasariste-gradske-lokacije-kragujevac/gradjevinsko-zemljiste/65df711d08d95abff3024a2d,graÄ‘evinsko zemljiÅ¡te ,40 a ,uknjiÅ¾eno ,,pre 2 dana ,750.000,Kod Å arene pijace,"VaÅ¡ariÅ¡te, Gradske lokacije, Kragujevac","<h2 _ngcontent-ng-c3151048826 class=""mat-headline-5"">Opis oglasa</h2><div _ngcontent-ng-c3151048826 class=""prose max-h-64 overflow-hidden text-gray-800 ng-star-inserted""><p>KRAGUJEVAC: na prodaju graÄ‘evinski plac na vrhunskoj lokaciji, ugao Beogradske i ulice Slobode, kod Å¡arene pijace, u blizini hotela Å½eneva Lux, Palate pravde i Klinike za pulmologiju. PovrÅ¡ine 39,69 ari. Gradsko graÄ‘evinsko zemljiÅ¡te, struja, voda, kanalizacija, telekomunikacije, gas, prilaz sa asfaltnog puta. MoguÄ‡a gradnja stambeno-poslovnog prostora, nadzemne povrÅ¡ine 12.000 m2. Â Kupovina bez provizije. Za sve informacije kontaktirati 0652000795","GraÄ‘evinsko zemljiÅ¡te na prodaju, Kod Å arene pijace, 750.000â‚¬, 40a - 4zida",2024-03-02
8,https://www.4zida.rs/prodaja-placeva/ledinci-okolne-lokacije-novi-sad/gradjevinsko-zemljiste/65e1e5fba93977fcbf080a0f,graÄ‘evinsko zemljiÅ¡te ,10.89 a ,uknjiÅ¾eno ,7000065 ,pre 16 sati ,112.200,Ledinci,"Ledinci, Okolne lokacije, Novi Sad","<h2 _ngcontent-ng-c3151048826 class=""mat-headline-5"">Opis oglasa</h2><div _ngcontent-ng-c3151048826 class=""prose max-h-64 overflow-hidden text-gray-800 ng-star-inserted""><p>Ledinci, potes Å evinjak. Dva placa ukupna povrÅ¡ine 1089m2 na lepoj lokaciji sa pogledom na grad. Prvi plac ukupne povrÅ¡ine 100 m2 uknjiÅ¾en kao poljoprivredno zemljiÅ¡te, njiva 6.klase. Druga parcela ukupe povrÅ¡ine 989m2 uknjiÅ¾ena je delom kao njiva 6 klase i kao vinograd 3 klase. Voda i struja u blizini placa. Prilaz tucanik. UknjiÅ¾eno.      (Vinson nekretnine, Novi Sad, Reg. br. posrednika: 1085)","GraÄ‘evinsko zemljiÅ¡te na prodaju, Ledinci, 112.200â‚¬, 10a - 4zida",2024-03-02
9,https://www.4zida.rs/prodaja-placeva/americ-mladenovac-opstina-beograd/gradjevinsko-zemljiste/65ddf28738cf54edb40ba911,graÄ‘evinsko zemljiÅ¡te ,7 a ,uknjiÅ¾eno ,5196 ,pre 3 dana ,14.000,AmeriÄ‡,"AmeriÄ‡, Mladenovac opÅ¡tina, Beograd","<h2 _ngcontent-ng-c3151048826 class=""mat-headline-5"">Opis oglasa</h2><div _ngcontent-ng-c3151048826 class=""prose max-h-64 overflow-hidden text-gray-800 ng-star-inserted""><p>Na prodaju plac od 7 ari u AmeriÄ‡u opÅ¡tina Mladenovac, u vikend naselju, na oko 700 m od okretnice autobusa. Prilazni put odliÄan, struja u placu, odrÅ¾avan,ravan sa zimzelenim i listopadnim drveÄ‡em. Priroda prelepa, nadmorska visina, oko 400 m, blizina vrha Kosmaja. Svaka preporuka. ","GraÄ‘evinsko zemljiÅ¡te na prodaju, AmeriÄ‡, 14.000â‚¬, 7a - 4zida",2024-03-02
10,https://www.4zida.rs/prodaja-placeva/karlovcic-okolne-lokacije-pecinci/gradjevinsko-zemljiste/65e063d3bdcd380a390711ea,graÄ‘evinsko zemljiÅ¡te ,196 a ,uknjiÅ¾eno ,1592 ,pre 1 dan ,137.200,potes Å odol,"KarlovÄiÄ‡, Okolne lokacije, PeÄ‡inci","<h2 _ngcontent-ng-c3151048826 class=""mat-headline-5"">Opis oglasa</h2><div _ngcontent-ng-c3151048826 class=""prose max-h-64 overflow-hidden text-gray-800 ng-star-inserted""><p>Na prodaju graÄ‘evinsko zemljiÅ¡te u KarlovÄiÄ‡i, na potesu Å odol. Parcela je povrÅ¡ine 19578m2 , sa prednjim frontom oko 50m. Cena po aru je 700 eura.","GraÄ‘evinsko zemljiÅ¡te na prodaju, potes Å odol, 137.200â‚¬, 196a - 4zida",2024-03-02
11,https://www.4zida.rs/prodaja-placeva/gradske-lokacije-gadzin-han/gradjevinsko-zemljiste/65e04c99772f851fe60f7a3d,graÄ‘evinsko zemljiÅ¡te ,4.5 a ,uknjiÅ¾eno ,1866 ,pre 1 dan ,8.000,Gradske lokacije,"Gradske lokacije, GadÅ¾in Han","<h2 _ngcontent-ng-c3151048826 class=""mat-headline-5"">Opis oglasa</h2><div _ngcontent-ng-c3151048826 class=""prose max-h-64 overflow-hidden text-gray-800 ng-star-inserted""><p>Prodaje se plac u GadÅ¾in Hanu, povrÅ¡ine 4.5 ara. Nalazi se na veoma lepoj lokaciji, nedaleko od centra, na  600 m. Na placu se nalazi zapoÄet objekat povrÅ¡ine 130 m2 za koji postoji graÄ‘evinska dozvola. Ima vodu, kanalizacija prolazi pored placa i struja takoÄ‘e. Nalazi se na veoma lepoj lokaciji i pogodan je za izgradnju kuÄ‡e ili poslovnog objekta. Hvala Vam Å¡to ste pogledali oglas. Za viÅ¡e informacija o ovoj ili drugim nekretninama i zakazivanje razgledanja kontaktirajte agenta na broj telefona iz oglasa (poziv, sms, viber) ili putem e-maila. Kompletnu ponudu dostupnih nekretnina moÅ¾ete pronaÄ‡i na naÅ¡em sajtu.","GraÄ‘evinsko zemljiÅ¡te na prodaju, Gradske lokacije, 8.000â‚¬, 4a - 4zida",2024-03-02
12,https://www.4zida.rs/prodaja-placeva/siljakovac-barajevo-opstina-beograd/gradjevinsko-zemljiste/65dee6ec4f69ef6e180f6249,graÄ‘evinsko zemljiÅ¡te ,12.5 a ,uknjiÅ¾eno ,,pre 7 sati ,8.000,Sime MarkoviÄ‡a,"Å iljakovac, Barajevo opÅ¡tina, Beograd","<h2 _ngcontent-ng-c3151048826 class=""mat-headline-5"">Opis oglasa</h2><div _ngcontent-ng-c3151048826 class=""prose max-h-64 overflow-hidden text-gray-800 ng-star-inserted""><p>Prodaja placa u Barajevu. Vlasnik. MoguÄ‡ dogovor.","GraÄ‘evinsko zemljiÅ¡te na prodaju, Sime MarkoviÄ‡a, 8.000â‚¬, 12a - 4zida",2024-03-02
13,https://www.4zida.rs/prodaja-placeva/simanovci-okolne-lokacije-pecinci/gradjevinsko-zemljiste/65e06e84502e87f3170080bf,graÄ‘evinsko zemljiÅ¡te ,76 a ,uknjiÅ¾eno ,1265 ,pre 1 dan ,190.000,potes kratinje,"Å imanovci, Okolne lokacije, PeÄ‡inci","<h2 _ngcontent-ng-c3151048826 class=""mat-headline-5"">Opis oglasa</h2><div _ngcontent-ng-c3151048826 class=""prose max-h-64 overflow-hidden text-gray-800 ng-star-inserted""><p>Na prodaju parcela u zoni industrije i proizvodnje u Å imanovcima. Parcela je povrÅ¡ine 76a 22m2. Å irina parcele je oko 54m a duÅ¾ina oko 140m. Asfaltni put je na nesto viÅ¡e od 500m od parcele gde su i najbliÅ¾e instalacije. Na parceli se mogu graditi industrijski objekti, poslovno-proizvodni objekti, magacini, skladiÅ¡ta, benzijske pumpe, objekti za trgovinu... U blizini su firme ,,STRAUSS ADRIATIC,,Â I ,,DR OETKER,, Vlasnik 1/1.","GraÄ‘evinsko zemljiÅ¡te na prodaju, potes kratinje, 190.000â‚¬, 76a - 4zida",2024-03-02
14,https://www.4zida.rs/prodaja-placeva/gradske-lokacije-zajecar/gradjevinsko-zemljiste/65dfb6f105b686bbd908157d,graÄ‘evinsko zemljiÅ¡te ,10 a ,uknjiÅ¾eno ,,pre 1 dan ,1,Gradske lokacije,"Gradske lokacije, ZajeÄar","<h2 _ngcontent-ng-c3151048826 class=""mat-headline-5"">Opis oglasa</h2><div _ngcontent-ng-c3151048826 class=""prose max-h-64 overflow-hidden text-gray-800 ng-star-inserted""><h2>DVA PLACA PO 5 ARI = 10 ARI u komadu, ZAJEÄŒAR, 850m OD LIDLA</h2><p><strong><em>NA PRODAJU ZA RAZNORAZNE DELATNOSTI DVA PLACA PO 5 ARI (2 X 5 = 10), JEDAN PORED DRUGOG, U KOMADU.</em></strong>Â ","GraÄ‘evinsko zemljiÅ¡te na prodaju, Gradske lokacije, 1â‚¬, 10a - 4zida",2024-03-02
15,https://www.4zida.rs/prodaja-placeva/paragovo-sremska-kamenica-gradske-lokacije-novi-sad/gradjevinsko-zemljiste/65df8488b2b17596110066e1,graÄ‘evinsko zemljiÅ¡te ,2255 a ,uknjiÅ¾eno ,524407 ,pre 2 dana ,185.820,Paragovo,"Paragovo, Sremska Kamenica, Gradske lokacije, Novi Sad","<h2 _ngcontent-ng-c3151048826 class=""mat-headline-5"">Opis oglasa</h2><div _ngcontent-ng-c3151048826 class=""prose max-h-64 overflow-hidden text-gray-800 ng-star-inserted""><p>Ekskluzivno, samo kod nas u ponudi! Na prodaju je predivan plac na Paragovu, prostire se na povrÅ¡ini od 2255m2. Plac je na odliÄnoj poziciji,u graÄ‘evinskom podruÄju. Gotovo ravan i oÄiÅ¡Ä‡en, dovedeni prikljuÄci za struju i vodu, te je izuzetno povoljan za gradnju. Sa placa se pruÅ¾a prelep pogled. Za viÅ¡e informacija i zakazivanje termina gledanja pozovite nas!","GraÄ‘evinsko zemljiÅ¡te na prodaju, Paragovo, 185.820â‚¬, 2255a - 4zida",2024-03-02
16,https://www.4zida.rs/prodaja-placeva/barajevo-barajevo-opstina-beograd/gradjevinsko-zemljiste/65de337465c60b72690186ed,graÄ‘evinsko zemljiÅ¡te ,335 a ,uknjiÅ¾eno ,53469 ,pre 3 dana ,350.000,Barajevo,"Barajevo, Barajevo opÅ¡tina, Beograd","<h2 _ngcontent-ng-c3151048826 class=""mat-headline-5"">Opis oglasa</h2><div _ngcontent-ng-c3151048826 class=""prose max-h-64 overflow-hidden text-gray-800 ng-star-inserted""><p>Na prodaji plac od 335ari koji se sastoji od tri parcele. 150ari je pod Å¡ljivama (stare 12 godina). 200ari Å¡ume vrlo malo seÄene. DuÅ¾inom cele parcele prolazi potok 100m od asfaltnog puta. Put prolazi celom duÅ¾inom voÄ‡njaka. Voda i struja na 100m od placa. Placevi na 4km od Ibarske magistrale, u Lipovici, 25km od Beograda. UknjiÅ¾eni su, bez tereta i zabeleÅ¾bi. Agencijska provizija 2%.//Agent:060-169-1159//","GraÄ‘evinsko zemljiÅ¡te na prodaju, Barajevo, 350.000â‚¬, 335a - 4zida",2024-03-02
17,https://www.4zida.rs/prodaja-placeva/novi-banovci-okolne-lokacije-stara-pazova/gradjevinsko-zemljiste/65e20e5eaec74b0ed200c90c,graÄ‘evinsko zemljiÅ¡te ,14 a ,uknjiÅ¾eno ,,pre 13 sati ,135.000,Novi Banovci,"Novi Banovci, Okolne lokacije, Stara Pazova","<h2 _ngcontent-ng-c3151048826 class=""mat-headline-5"">Opis oglasa</h2><div _ngcontent-ng-c3151048826 class=""prose max-h-64 overflow-hidden text-gray-800 ng-star-inserted""><p>GraÄ‘evinski plac 14 ari , sa graÄ‘evinskom dozvolom za gradnju objekta. Prodaja jedne od najboljih graÄ‘evinskih parcela u Novim Banovcima. Sama parcela je malo ispod 14 ari sa prelepim pogledom na Dunav. Dobro locirana, u urbanom i mirnom delu, okruÅ¾ena porodiÄnim kuÄ‡ama sa odliÄnim prilazom.Parcela spremna za radove, nema objekata na njoj. Pogodna je za individualno stanovanje kao i za gradnju manjeg hotela, doma za stara lica. Dozvoljena je gradnja objekta tipa SU+prizemlje+sprat+potkrovlje. Kupac odmah moÅ¾e da poÄne gradnju.Ukoliko kupcu odgovara projekat dobija potpuno besplatno izdatu graÄ‘evinsku dozvolu, ceo projekat i projekat bazena. UknjiÅ¾en. Direktno od vlasnika bez provizije.Pozvati na 063270720","GraÄ‘evinsko zemljiÅ¡te na prodaju, Novi Banovci, 135.000â‚¬, 14a - 4zida",2024-03-02
18,https://www.4zida.rs/prodaja-placeva/dec-okolne-lokacije-pecinci/gradjevinsko-zemljiste/65e191f74eff0363a60b7454,graÄ‘evinsko zemljiÅ¡te ,153 a ,uknjiÅ¾eno ,440 ,pre 22 sati ,244.800,Å iroka bara,"DeÄ, Okolne lokacije, PeÄ‡inci","<h2 _ngcontent-ng-c3151048826 class=""mat-headline-5"">Opis oglasa</h2><div _ngcontent-ng-c3151048826 class=""prose max-h-64 overflow-hidden text-gray-800 ng-star-inserted""><p>Na prodaju graÄ‘evinska parcela u industrijskoj zoni u DeÄu, u zoni poslovanja. U zoni poslovanja moguÄ‡e je graditi objekte privrede veÄ‡ih kapaciteta. Ova parcele nalazi se u zoni dalekovoda.Ima direktanÂ izlaz na ulicu BraÄ‡e SaviÄ‡. Parcela je ukupne povrÅ¡ine 1ha 52a. Nalazi se u neposrednoj blizini Å imanovaca, na glavnom putu koji povezuje DeÄ i Å imanovce.Â Â Â ","GraÄ‘evinsko zemljiÅ¡te na prodaju, Å iroka bara, 244.800â‚¬, 153a - 4zida",2024-03-02
19,https://www.4zida.rs/prodaja-placeva/centar-gradske-lokacije-sremski-karlovci/gradjevinsko-zemljiste/65e1be644b153d14a505a06d,graÄ‘evinsko zemljiÅ¡te ,11 a ,uknjiÅ¾eno ,523789 ,pre 19 sati ,82.400,Pinkijeva,"Centar, Gradske lokacije, Sremski Karlovci","<h2 _ngcontent-ng-c3151048826 class=""mat-headline-5"">Opis oglasa</h2><div _ngcontent-ng-c3151048826 class=""prose max-h-64 overflow-hidden text-gray-800 ng-star-inserted""><p>TOP LOKACIJA! GraÄ‘evinski plac u centru Karlovaca. Extra pozicija, blizina gimnazije, crkve, benzinske pumpe, Å¾.stanice. Plac se sastoje od dva dela, jedan deo uzdignut i otvoren pogled na grad. Na placu uknjiÅ¾ena kuÄ‡a 89m2 kao i oko 50m2 pomoÄ‡nih objekata. Do placa struja, gas, kanalizacija, voda. UknjiÅ¾en na vlasnika 1/1. Plac sa mnogo moguÄ‡nosti. NAÅ A PREPORUKA.","GraÄ‘evinsko zemljiÅ¡te na prodaju, Pinkijeva, 82.400â‚¬, 11a - 4zida",2024-03-02
20,https://www.4zida.rs/prodaja-placeva/novi-slankamen-okolne-lokacije-indjija/gradjevinsko-zemljiste/65e0671679b66c5c1906c76b,graÄ‘evinsko zemljiÅ¡te ,14 a ,uknjiÅ¾eno ,1309 ,pre 1 dan ,14.500,potes Janda,"Novi Slankamen, Okolne lokacije, InÄ‘ija","<h2 _ngcontent-ng-c3151048826 class=""mat-headline-5"">Opis oglasa</h2><div _ngcontent-ng-c3151048826 class=""prose max-h-64 overflow-hidden text-gray-800 ng-star-inserted""><p>Na prodaju plac uÂ Novom Slankamenu ( SlankamenaÄki vinogradi) u vikend zoni. Plac je povrÅ¡ine 14a 52m2 i udaljen je od Dunava oko 300m.Â Put do placa je dobar, nasut. Struja i voda u blizini placa. Å irina placa je oko 16m a duÅ¾ina oko 90m. Dozvoljena gradnja, vlasniÅ¡tvo uredno.","GraÄ‘evinsko zemljiÅ¡te na prodaju, potes Janda, 14.500â‚¬, 14a - 4zida",2024-03-02
21,https://www.4zida.rs/prodaja-placeva/progar-surcin-opstina-beograd/gradjevinsko-zemljiste/65e040a1d2185e010c01fe04,graÄ‘evinsko zemljiÅ¡te ,79.46 a ,,5204 ,pre 1 dan ,120.000,Progar,"Progar, SurÄin opÅ¡tina, Beograd","<h2 _ngcontent-ng-c3151048826 class=""mat-headline-5"">Opis oglasa</h2><div _ngcontent-ng-c3151048826 class=""prose max-h-64 overflow-hidden text-gray-800 ng-star-inserted""><p>Prodaje se plac u Progaru, u blizini BojÄinske Å¡ume, koju poseÄ‡uje veliki broj turista, koja ima rekreativne staze za peÅ¡aÄenje i jahanje.<br>TakoÄ‘e ima letnju pozornicu gde se odrÅ¾avaju muziÄki i kulturni dogaÄ‘aji (BojÄinsko kulturno leto).<br>Plac je ograÄ‘en betonskim blokovima. Postoji i arteski bunar.<br>Plac izlazi na dve ulice.<br>Pored placa su prikljuÄci za struju i vodu.<br>Nalazi se u zoni graÄ‘evinskog podruÄja-porodiÄno stanovanje.<br>Maksimalna spratnost objekta je P+1+PK.<br>Za parcele manje od 6a maksimalni indeks izgraÄ‘enosti je 0,6a, stepen zauzetosti 40%, dok je za parcele veÄ‡e od 6a maksimalni indeks izgraÄ‘enosti 0,3a i maksimalni stepen zauzetosti 30%.","GraÄ‘evinsko zemljiÅ¡te na prodaju, Progar, 120.000â‚¬, 79a - 4zida",2024-03-02
22,https://www.4zida.rs/prodaja-placeva/sibac-okolne-lokacije-pecinci/gradjevinsko-zemljiste/65e176e28b21bf03ad09c17d,graÄ‘evinsko zemljiÅ¡te ,40 a ,uknjiÅ¾eno ,1198 ,pre 1 dan ,35.000,Svetozara MiletiÄ‡a,"SibaÄ, Okolne lokacije, PeÄ‡inci","<h2 _ngcontent-ng-c3151048826 class=""mat-headline-5"">Opis oglasa</h2><div _ngcontent-ng-c3151048826 class=""prose max-h-64 overflow-hidden text-gray-800 ng-star-inserted""><p>Na prodaju parcela od 40a70m2 koja se nalazi u SibaÄu u ulici Svetozara MiletiÄ‡a. Na parceli se nalaze 3 garaÅ¾e graÄ‘ene 2010-ih i sluÅ¾ile su za Äuvanje poljoprivrednih maÅ¡ina. GaraÅ¾e su pravljene od graÄ‘evinskog bloka, pokrivene su salonit ploÄama a u prvoj ( koja sluzi i kao letnja kuhinja) ima na plafonu lamperiju i izolovana je kamenom vunom. Dimenzije svake posebno su 7x7, a u najniÅ¾em delu su visoke 2,60m. Na parceli je i kotobanja koja u donjem delu ima manje prostorije pogodne za ostavljanje hrane za stoku. Postoji i drvena Å¡upa za ostavljanje ogreva. U drugom delu parcele je voÄ‡njak star 20 godina sa jabukama,kruÅ¡kama,treÅ¡njama i Å¡ljivama. Na placu postoji struja,voda,prikljuÄak na kanalizaciju a u ulici Svetozara MiletiÄ‡a postoji i gasna mreÅ¾a. SibaÄ je malo sremsko mesto,nadomak Beograda. Ima svoju Osnovnu Å¡kolu i vrtiÄ‡, a od PeÄ‡inaca (OpÅ¡tina) je udaljen samo 2km.","GraÄ‘evinsko zemljiÅ¡te na prodaju, Svetozara MiletiÄ‡a, 35.000â‚¬, 40a - 4zida",2024-03-02
23,https://www.4zida.rs/prodaja-placeva/vinik-pantelej-gradske-lokacije-nis/gradjevinsko-zemljiste/65e04c8e772f851fe60f7a07,graÄ‘evinsko zemljiÅ¡te ,16 a ,uknjiÅ¾eno ,2204 ,pre 1 dan ,65.000,Vinik,"Vinik, Pantelej, Gradske lokacije, NiÅ¡","<h2 _ngcontent-ng-c3151048826 class=""mat-headline-5"">Opis oglasa</h2><div _ngcontent-ng-c3151048826 class=""prose max-h-64 overflow-hidden text-gray-800 ng-star-inserted""><p>Prodaje se plac na Viniku, povrÅ¡ine 15,45 ari. Poseduje prikljuÄak za vodu i struju. Plac ima asfaltni prilaz. Hvala Vam Å¡to ste pogledali oglas. Za viÅ¡e informacija o ovoj ili drugim nekretninama i zakazivanje razgledanja kontaktirajte agenta na broj telefona iz oglasa (poziv, sms, viber) ili putem e-maila. Kompletnu ponudu dostupnih nekretnina moÅ¾ete pronaÄ‡i na naÅ¡em sajtu.","GraÄ‘evinsko zemljiÅ¡te na prodaju, Vinik, 65.000â‚¬, 16a - 4zida",2024-03-02
