,link,Tip,Površina,Uknjiženost,Oglas ažuriran,price,street,address,description,title,end_date,Šifra oglasa
324,https://www.4zida.rs/prodaja-placeva/progar-surcin-opstina-beograd/gradjevinsko-zemljiste/64bb07bb62b288a35a0cb3ff,građevinsko zemljište ,97 a ,,pre 6 meseci ,800.000,Progar,"Progar, Surčin opština, Beograd","<h2 _ngcontent-ng-c3151048826 class=""mat-headline-5"">Opis oglasa</h2><div _ngcontent-ng-c3151048826 class=""prose max-h-64 overflow-hidden text-gray-800 ng-star-inserted""><p>Mogućnost kompleksa  za odmor i rekreaciju na opštini Surčin, 30km od centra Beograda a pripada rejonu Obedske bare kraj Bojčinske šume prodaje se poljoprivredno zemljište u građevinskom području površine 97 ari, parcela se graniči sa Bojčinskom šumom koja je pod zaštitom države kao Spomenik prirode i vrlo je popularno mesto kao izletište.<br>Parcela je pod zasadom 500 stabala lešnika koji su u punom rodu, obezbeđen je sistem za navodnjavanje kap po kap preko solarnih panela. Neposredna blizina glavnog puta i poznatog restorana Bojčinska koleba.<br>Knjižno vlasništvo 1/1.<br>Agencijska provizija za kupce je 2%","Građevinsko zemljište na prodaju, Progar, 800.000€, 97a - 4zida",2024-01-24,110 
325,https://www.4zida.rs/prodaja-placeva/krnjaca-palilula-opstina-beograd/gradjevinsko-zemljiste/63e4a0922a0c9e67380c1308,,,,,,,,,"Prodaja placeva Krnjača, Palilula opština, Beograd, Građevinsko zemljište - 4zida",2024-01-24,
326,https://www.4zida.rs/prodaja-placeva/futog-okolne-lokacije-novi-sad/gradjevinsko-zemljiste/6580760242d624f3ba0c9026,,,,,,,,,"Prodaja placeva Futog, Okolne lokacije, Novi Sad, Građevinsko zemljište - 4zida",2024-01-24,
327,https://www.4zida.rs/prodaja-placeva/ducina-sopot-opstina-beograd/gradjevinsko-zemljiste/63b59b247dcfcc8b4e09025c,građevinsko zemljište ,55 a ,uknjiženo ,pre 3 meseca ,35.000,Ljubomira Živanovića-Brke 12,"Dučina, Sopot opština, Beograd","<h2 _ngcontent-ng-c3151048826 class=""mat-headline-5"">Opis oglasa</h2><div _ngcontent-ng-c3151048826 class=""prose max-h-64 overflow-hidden text-gray-800 ng-star-inserted""><p>Plac od 55a u centru Dučine u blizini osnovne škole, fudbalskih terena, prodavnice i doma zdravlja. plac je ravan i nije potrebno dodatno ravnjanje. Plac je uknjižen na vlasnika 1/1. Struja i gradska voda su dovedene do same parcele. Parcela ima pristup javnom putu. Broj parcele 1300 Dučina Sopot.","Građevinsko zemljište na prodaju, Ljubomira Živanovića-Brke 12, 35.000€, 55a - 4zida",2024-01-24,
328,https://www.4zida.rs/prodaja-placeva/centar-gradske-lokacije-vrnjacka-banja/gradjevinsko-zemljiste/61fb781d9f8c12472a625665,građevinsko zemljište ,1413 a ,uknjiženo ,pre 28 dana ,130.000,Centar,"Centar, Gradske lokacije, Vrnjačka Banja","<h2 _ngcontent-ng-c3151048826 class=""mat-headline-5"">Opis oglasa</h2><div _ngcontent-ng-c3151048826 class=""prose max-h-64 overflow-hidden text-gray-800 ng-star-inserted""><p>Z. Lokacija za izgradnju 3 urbane vile male zgrade na 800m od centra , spratnosti Su+P+1 Vrnjačke Banje:","Građevinsko zemljište na prodaju, Centar, 130.000€, 1413a - 4zida",2024-01-24,
329,https://www.4zida.rs/prodaja-placeva/berbatovo-okolne-lokacije-nis/gradjevinsko-zemljiste/65a2758137916c849c03a777,građevinsko zemljište ,30.48 a ,,pre 11 dana ,32.000,Berbatovo,"Berbatovo, Okolne lokacije, Niš","<h2 _ngcontent-ng-c3151048826 class=""mat-headline-5"">Opis oglasa</h2><div _ngcontent-ng-c3151048826 class=""prose max-h-64 overflow-hidden text-gray-800 ng-star-inserted""><p>Na prodaju Plac, na putu za Berbatovo, površine 3048 m2. Plac se nalazi na 9 km od centra Niša, na putu Gabrocac- Berbatovo. 150 m od glavnog puta. Dimenzije placa su 45 x 68 m. U blizini placa su prikljuci za struju i vodu.","Građevinsko zemljište na prodaju, Berbatovo, 32.000€, 30a - 4zida",2024-01-24,p
330,https://www.4zida.rs/prodaja-placeva/karaula-gradske-lokacije-pancevo/gradjevinsko-zemljiste/6266da1784112b7e46715c23,građevinsko zemljište ,52 a ,uknjiženo ,pre 3 dana ,156.000,Ribarska BB,"Karaula, Gradske lokacije, Pančevo","<h2 _ngcontent-ng-c3151048826 class=""mat-headline-5"">Opis oglasa</h2><div _ngcontent-ng-c3151048826 class=""prose max-h-64 overflow-hidden text-gray-800 ng-star-inserted""><p>Na parceli od 52 ara nalaze se 4 placa, sa pristupnim putem širine od 5m.","Građevinsko zemljište na prodaju, Ribarska BB, 156.000€, 52a - 4zida",2024-01-24,
331,https://www.4zida.rs/prodaja-placeva/miljakovac-rakovica-opstina-beograd/gradjevinsko-zemljiste/63f50029096e68e562075925,,,,,,,,,"Građevinsko zemljište na prodaju, Miljakovačka, 170.000€, 10a - 4zida",2024-01-24,
332,https://www.4zida.rs/prodaja-placeva/lalinac-okolne-lokacije-nis/gradjevinsko-zemljiste/64d637010a50583e1a08c115,građevinsko zemljište ,11 a ,,pre 5 meseci ,11.000,Novo selo,"Lalinac, Okolne lokacije, Niš","<h2 _ngcontent-ng-c3151048826 class=""mat-headline-5"">Opis oglasa</h2><div _ngcontent-ng-c3151048826 class=""prose max-h-64 overflow-hidden text-gray-800 ng-star-inserted""><p>Na prodaju plac u selu Lalinac, površine 1100m2. Uknjižen kao zemljište u građevinskom podrucju, pravilnog pravouganog oblika. Nalazi se u samom selu, okružen drugim objektima. U placu struja, voda. Prodaje se trecina parcele od 3248m2. Za više informacija slobodno pozovite.","Građevinsko zemljište na prodaju, Novo selo, 11.000€, 11a - 4zida",2024-01-24,p
333,https://www.4zida.rs/prodaja-placeva/gabrovac-okolne-lokacije-nis/gradjevinsko-zemljiste/63fdf6a452459ef01303296a,,,,,,,,,"Prodaja placeva Gabrovac, Okolne lokacije, Niš, Građevinsko zemljište - 4zida",2024-01-24,
334,https://www.4zida.rs/prodaja-placeva/babe-sopot-opstina-beograd/gradjevinsko-zemljiste/6207995ed56616784a7bf858,građevinsko zemljište ,96 a ,uknjiženo ,pre 1 dan ,67.200,Zminjak,"Babe, Sopot opština, Beograd","<h2 _ngcontent-ng-c3151048826 class=""mat-headline-5"">Opis oglasa</h2><div _ngcontent-ng-c3151048826 class=""prose max-h-64 overflow-hidden text-gray-800 ng-star-inserted""><p>Na prodaju zemljište u građevinskom području, površine 96 ari, u Babama, opština Sopot. Izuzetna lokacija, visoravan, na nadmorskoj visini od prko 300m sa pogledom na Avalu. Plac je pravilnog oblika, osunčan čitavog dana, na 150m od asfalta i kompletne infrastrukture. Zemljište je u građevinskom području, dozvoljena gradnja. Blizina novoasfaltiranog puta koji spaja Sopot i Ibarsku magistralu. Cena po aru 700 eur, nije fiksno.","Građevinsko zemljište na prodaju, Zminjak, 67.200€, 96a - 4zida",2024-01-24,2238 
335,https://www.4zida.rs/prodaja-placeva/medosevac-okolne-lokacije-nis/gradjevinsko-zemljiste/637b513f11a90182cf01a810,građevinsko zemljište ,7.22 a ,,pre 9 meseci ,16.000,Medoševac,"Medoševac, Okolne lokacije, Niš","<h2 _ngcontent-ng-c3151048826 class=""mat-headline-5"">Opis oglasa</h2><div _ngcontent-ng-c3151048826 class=""prose max-h-64 overflow-hidden text-gray-800 ng-star-inserted""><p>Na prodaju plac u Medoševcu, 722 m2. Plac se nalazi na glavnom putu, sa izlazom na njega. Građevinsko je zemljište i postoji mogućnost priključka na infrastrukturne mreže. Uknjižen je i vlasništvo 1 kroz 1. Ovo je samo deo naše ponude, za više informacija, stojimo vam na raspolaganju.","Građevinsko zemljište na prodaju, Medoševac, 16.000€, 7a - 4zida",2024-01-24,p
336,https://www.4zida.rs/prodaja-placeva/gradske-lokacije-indjija/gradjevinsko-zemljiste/651dcbb452e3e2b9290662cf,građevinsko zemljište ,10 a ,uknjiženo ,pre 3 meseca ,18.000,Pčelarska,"Gradske lokacije, Inđija","<h2 _ngcontent-ng-c3151048826 class=""mat-headline-5"">Opis oglasa</h2><div _ngcontent-ng-c3151048826 class=""prose max-h-64 overflow-hidden text-gray-800 ng-star-inserted""><p>Prodaje se plac u krčevinama, za ozbiljne kupce moguća korekcija cene","Građevinsko zemljište na prodaju, Pčelarska, 18.000€, 10a - 4zida",2024-01-24,
337,https://www.4zida.rs/prodaja-placeva/beli-potok-vozdovac-opstina-beograd/gradjevinsko-zemljiste/62d7b8e681ced7190a0a892a,građevinsko zemljište ,25 a ,,pre 2 meseca ,299.000,Beli Potok,"Beli Potok, Voždovac opština, Beograd","<h2 _ngcontent-ng-c3151048826 class=""mat-headline-5"">Opis oglasa</h2><div _ngcontent-ng-c3151048826 class=""prose max-h-64 overflow-hidden text-gray-800 ng-star-inserted""><p>Na  jednoj od najboljih  pozicija na Avali , gradjevinski plac u površinama za porodično stanovanje/ komercijalni sadržaji   spratnosti P+1+PK/PS<br>Sa porodičnim stanovanjem  su kompatibilni komercijalni sadržaji iz oblasti trgovine, uslužnih delatnosti...<br>-na pojedinačnim gradjevinskim  parcelama kompatibilna namena moze biti dominantna<br>-dozvoljena gradnja vise objekata<br>Moguća kupovina do 1ha.<br>Dimenzije cele parcele  su  69m frontx240m bočne strane .<br>Informacija o lokaciji dostupna .","Građevinsko zemljište na prodaju, Beli Potok, 299.000€, 25a - 4zida",2024-01-24,3387 
338,https://www.4zida.rs/prodaja-placeva/aerodrom-gradske-lokacije-kragujevac/gradjevinsko-zemljiste/63dcf657233ff08b2e074bbd,građevinsko zemljište ,10.54 a ,uknjiženo ,pre 2 meseca ,123.000,Aerodrom,"Aerodrom, Gradske lokacije, Kragujevac","<h2 _ngcontent-ng-c3151048826 class=""mat-headline-5"">Opis oglasa</h2><div _ngcontent-ng-c3151048826 class=""prose max-h-64 overflow-hidden text-gray-800 ng-star-inserted""><p>Plac poseduje i gradjevine oko 200m2 delimicno opremljene. Katastarska parcela 6683. Kragujevac","Građevinsko zemljište na prodaju, Aerodrom, 123.000€, 10a - 4zida",2024-01-24,
339,https://www.4zida.rs/prodaja-placeva/centar-gradske-lokacije-arandjelovac/gradjevinsko-zemljiste/62fa0843f47c063d03076735,građevinsko zemljište ,7.99 a ,delimično uknjiženo ,pre 3 meseca ,38.900,DESANKE MAKSIMOVIĆ,"Centar, Gradske lokacije, Aranđelovac","<h2 _ngcontent-ng-c3151048826 class=""mat-headline-5"">Opis oglasa</h2><div _ngcontent-ng-c3151048826 class=""prose max-h-64 overflow-hidden text-gray-800 ng-star-inserted""><p>ARANĐELOVAC (Bukovička banja) - centralna lokacija, plac 7,99 ara ( 5,57 uknjiženo + 2,42 u postupku knjiženja)","Građevinsko zemljište na prodaju, DESANKE MAKSIMOVIĆ, 38.900€, 7a - 4zida",2024-01-24,
340,https://www.4zida.rs/prodaja-placeva/9-maj-palilula-gradske-lokacije-nis/gradjevinsko-zemljiste/6140d21d5a92bf56e27867a8,građevinsko zemljište ,4.06 a ,uknjiženo ,pre 9 meseci ,7.100,Novo selo,"9. Maj, Palilula, Gradske lokacije, Niš","<h2 _ngcontent-ng-c3151048826 class=""mat-headline-5"">Opis oglasa</h2><div _ngcontent-ng-c3151048826 class=""prose max-h-64 overflow-hidden text-gray-800 ng-star-inserted""><p>Na prodaju plac u Novom selu površine 406 m2, ograđen. Ima mogućnost priključka na vodu i struju, a za kanalizaciju na ulici ispred placa. Plac je poljoprivredno zemljište, privatna svojina 1 kroz 1 u proceduri uknjiženja. Ukoliko imate dodatnih pitanja budite slobodni da nas kontaktirate.","Građevinsko zemljište na prodaju, Novo selo, 7.100€, 4a - 4zida",2024-01-24,p
341,https://www.4zida.rs/prodaja-placeva/palic-okolne-lokacije-subotica/gradjevinsko-zemljiste/6579c188b2d6688850095e9b,građevinsko zemljište ,65.08 a ,,pre 1 mesec ,200.000,Lopudska 1,"Palić, Okolne lokacije, Subotica","<h2 _ngcontent-ng-c3151048826 class=""mat-headline-5"">Opis oglasa</h2><div _ngcontent-ng-c3151048826 class=""prose max-h-64 overflow-hidden text-gray-800 ng-star-inserted""><p>Prodaje se plac na Paliću sastavljen od 3 dela koji se nalazi u Lopudskoj ulici, udaljen 2,2 km od Subotice.<br>Na prvom delu placa od 776m2 nalaze se objekti: kuća od 106m2 i  pomoćni objekti. Objekat kuća je funkcionalnog rasporeda i sastoji se od ulaza, tri sobe, kupatila i hodnika.<br>Drugi deo je veličine 2039m2 a treći deo površine 3693m2.<br>Placevi se prodaju zajedno,nalaze se na dobroj lokaciji u mirnom delu, u blizini centra Palića. Pogodna za etno turizam, restoran , hale, magacine i sl. U njegovoj okolini, nalaze se vrtić Kalimero, železnička stanica, zoološki vrt, market, pošta, banja Palić... .<br>Postoje priključci za vodu,kanalizaciju i struju.<br>Pristup do placa i objekta je asfaltiran i ima mogućnost parkinga ispred kompleksa i u dvorištu. ","Građevinsko zemljište na prodaju, Lopudska 1, 200.000€, 65a - 4zida",2024-01-24,186 
342,https://www.4zida.rs/prodaja-placeva/surcin-surcin-opstina-beograd/gradjevinsko-zemljiste/5f8f178943a707109b738c93,građevinsko zemljište ,230 a ,uknjiženo ,pre 9 meseci ,460.000,Milene Lakočević,"Surčin, Surčin opština, Beograd","<h2 _ngcontent-ng-c3151048826 class=""mat-headline-5"">Opis oglasa</h2><div _ngcontent-ng-c3151048826 class=""prose max-h-64 overflow-hidden text-gray-800 ng-star-inserted""><p>Velika parcela 2 ha, 30 a, 22 m2 za poslovno-komercijalne svrhe u području građevinskog zemljišta na obodu naselja Surčin. Nedaleko od aerodroma, uz put prema industrijskoj zoni u Dobanovcima i ka autoputu (Zagreb, Novi Sad, Beogradska obilaznica, Obrenovac, Čačak). Oko 800 metara od centra Surčina, asfaltni prilaz sa dve strane. ID oglasa: 50808. Agencijska provizija 2% od kupoprodajne cene.","Građevinsko zemljište na prodaju, Milene Lakočević, 460.000€, 230a - 4zida",2024-01-24,50808 
343,https://www.4zida.rs/prodaja-placeva/kumodraz-vozdovac-opstina-beograd/gradjevinsko-zemljiste/61a915b85073635f3d13a2ea,građevinsko zemljište ,10 a ,uknjiženo ,pre 4 meseca ,140.000,Vojvode Stepe,"Kumodraž, Voždovac opština, Beograd","<h2 _ngcontent-ng-c3151048826 class=""mat-headline-5"">Opis oglasa</h2><div _ngcontent-ng-c3151048826 class=""prose max-h-64 overflow-hidden text-gray-800 ng-star-inserted""><p>Uknjižen plac na odličnoj lokaciji, pored glavnog puta sa svim infrastrukturnim elementima, gradsko građevinsko pravougaonog oblika, dozvoljena porodična gradnja.","Građevinsko zemljište na prodaju, Vojvode Stepe, 140.000€, 10a - 4zida",2024-01-24,1238 
344,https://www.4zida.rs/prodaja-placeva/centar-gradske-lokacije-zrenjanin/gradjevinsko-zemljiste/64de0fa7c3d680a0650f3abc,građevinsko zemljište ,38 a ,uknjiženo ,pre 3 meseca ,82.000,Sarajevska Contikarska bb,"Centar, Gradske lokacije, Zrenjanin","<h2 _ngcontent-ng-c3151048826 class=""mat-headline-5"">Opis oglasa</h2><div _ngcontent-ng-c3151048826 class=""prose max-h-64 overflow-hidden text-gray-800 ng-star-inserted""><p>Prodajem gradjevinski plac u Zrenjanina neposredna blizina fudbalskog stadiona i sporckih hala odlicna lokacija ","Građevinsko zemljište na prodaju, Sarajevska Contikarska bb, 82.000€, 38a - 4zida",2024-01-24,
345,https://www.4zida.rs/prodaja-placeva/donje-vlase-okolne-lokacije-nis/gradjevinsko-zemljiste/6411d4312c6f6e55130ee0ee,građevinsko zemljište ,18.57 a ,,pre 7 meseci ,8.000,Donje Vlase,"Donje Vlase, Okolne lokacije, Niš","<h2 _ngcontent-ng-c3151048826 class=""mat-headline-5"">Opis oglasa</h2><div _ngcontent-ng-c3151048826 class=""prose max-h-64 overflow-hidden text-gray-800 ng-star-inserted""><p>Na prodaju plac u Donjem Vlasu površine 1857m2. Plac je poljoprivredno zemljište, pravilnog pravougaonog oblika i nalazi se u neposrednoj blizini hotela Svetlost. Vlasništvo 1 kroz 1. Za više informacija stojimo Vam na raspolaganju.","Građevinsko zemljište na prodaju, Donje Vlase, 8.000€, 18a - 4zida",2024-01-24,p
346,https://www.4zida.rs/prodaja-placeva/topola-gradske-lokacije-pancevo/gradjevinsko-zemljiste/651fb78a27a9a59e4e0d8356,,,,,,,,,"Prodaja placeva Topola, Gradske lokacije, Pančevo, Građevinsko zemljište - 4zida",2024-01-24,
347,https://www.4zida.rs/prodaja-placeva/zuce-vozdovac-opstina-beograd/gradjevinsko-zemljiste/64ad2dc9233c790ccf043675,građevinsko zemljište ,28.58 a ,uknjiženo ,pre 6 meseci ,86.000,Zuce,"Zuce, Voždovac opština, Beograd","<h2 _ngcontent-ng-c3151048826 class=""mat-headline-5"">Opis oglasa</h2><div _ngcontent-ng-c3151048826 class=""prose max-h-64 overflow-hidden text-gray-800 ng-star-inserted""><p>Lep plac na uzvišici u naselju Zuce, sa frontom od oko 100m u blizini gradska voda, struja. Idealno za život u prirodi. U zoni je građevinskog zemljišta. Asfaltni put do puta kojim se ide do placa, širina pristupačnog puta je 6m i upisan je u katastaru. Od asfaltnog puta do parcele ima oko 60m puta, koji je potrebno asfaltirati. agencijska provizija 2%","Građevinsko zemljište na prodaju, Zuce, 86.000€, 28a - 4zida",2024-01-24,124682 
348,https://www.4zida.rs/prodaja-placeva/donje-vranje-gradske-lokacije-vranje/gradjevinsko-zemljiste/651734d4e9c367e70706a3e9,građevinsko zemljište ,5 a ,uknjiženo ,pre 3 meseca ,30.000,Kragujevacka 7,"Donje Vranje, Gradske lokacije, Vranje","<h2 _ngcontent-ng-c3151048826 class=""mat-headline-5"">Opis oglasa</h2><div _ngcontent-ng-c3151048826 class=""prose max-h-64 overflow-hidden text-gray-800 ng-star-inserted""><p>Na placu se nalazi kuca stare gradnje. Cena nije fiksna","Građevinsko zemljište na prodaju, Kragujevacka 7, 30.000€, 5a - 4zida",2024-01-24,
349,https://www.4zida.rs/prodaja-placeva/gornji-matejevac-okolne-lokacije-nis/gradjevinsko-zemljiste/657c10ab9527ef436b0f553b,,,,,,,,,"Prodaja placeva Gornji Matejevac, Okolne lokacije, Niš, Građevinsko zemljište - 4zida",2024-01-24,
350,https://www.4zida.rs/prodaja-placeva/banstol-vikend-naselje-okolne-lokacije-indjija/gradjevinsko-zemljiste/65422560ea8f9da6be0c911c,,,,,,,,,"Prodaja placeva Banstol - Vikend Naselje, Okolne lokacije, Inđija, Građevinsko zemljište - 4zida",2024-01-24,
351,https://www.4zida.rs/prodaja-placeva/donja-vrezina-pantelej-gradske-lokacije-nis/gradjevinsko-zemljiste/64d24eff806d57a64d0cfd1e,građevinsko zemljište ,25 a ,uknjiženo ,pre 4 dana ,250.000,Donja Vrežina,"Donja Vrežina, Pantelej, Gradske lokacije, Niš","<h2 _ngcontent-ng-c3151048826 class=""mat-headline-5"">Opis oglasa</h2><div _ngcontent-ng-c3151048826 class=""prose max-h-64 overflow-hidden text-gray-800 ng-star-inserted""><p>U prilici smo da vam ponudimo plac P=25ari, pravougaonog oblika,do asvalta u naseljenom delu naselja Donja Vrežina. Plac je pogodan za izgradnju a može i parcelizacija. Za više informacije potvati:065/222 3922,065/883 3446,060/751 3377.Libo agencija upisana u registar posrednika pod brojem 495.","Građevinsko zemljište na prodaju, Donja Vrežina, 250.000€, 25a - 4zida",2024-01-24,1924 
352,https://www.4zida.rs/prodaja-placeva/mihajlovo-okolne-lokacije-zrenjanin/gradjevinsko-zemljiste/63b6ba8e823dace252025a25,građevinsko zemljište ,13.5 a ,uknjiženo ,pre 9 meseci ,10.500,Mihajlovo,"Mihajlovo, Okolne lokacije, Zrenjanin","<h2 _ngcontent-ng-c3151048826 class=""mat-headline-5"">Opis oglasa</h2><div _ngcontent-ng-c3151048826 class=""prose max-h-64 overflow-hidden text-gray-800 ng-star-inserted""><p>Prazan plac, pravougaonog oblika. Ukupna površina 1.348m2. Ulična širina 27m. Postoji upisana kuća od 153m2. Priključak struje.","Građevinsko zemljište na prodaju, Mihajlovo, 10.500€, 13a - 4zida",2024-01-24,PU943 
353,https://www.4zida.rs/prodaja-placeva/stepojevac-lazarevac-opstina-beograd/gradjevinsko-zemljiste/62cc06b2433e77b2d60ef21b,građevinsko zemljište ,10 a ,uknjiženo ,pre 32 dana ,6.000,MILANOVICEVA 36,"Stepojevac, Lazarevac opština, Beograd","<h2 _ngcontent-ng-c3151048826 class=""mat-headline-5"">Opis oglasa</h2><div _ngcontent-ng-c3151048826 class=""prose max-h-64 overflow-hidden text-gray-800 ng-star-inserted""><p>Plac u Stepojevcu 10ar . Uknjizen . Ogradjen  . Manji deo placa sumica bez siblja  ostali deo placa ociscen i ravan. Na placu kuca povrsine oko 50m2 samo ozidana a temelji od 1982 , unutra zarasla u rastinje  . Zemljiste nije tretirano otrovima u predhodnih 40 godina sigurno . Asfalt , gas , voda struja sve pored placa. Potpuno miran kraj pogodan za sve namene. Na tacno 3.5 km od semafora u Stepojevcu . Vlasnik","Građevinsko zemljište na prodaju, MILANOVICEVA 36, 6.000€, 10a - 4zida",2024-01-24,
354,https://www.4zida.rs/prodaja-placeva/slanci-palilula-opstina-beograd/gradjevinsko-zemljiste/63a240efd24fe07cfc015c34,građevinsko zemljište ,13 a ,uknjiženo ,pre 28 dana ,50.000,1.maj,"Slanci, Palilula opština, Beograd","<h2 _ngcontent-ng-c3151048826 class=""mat-headline-5"">Opis oglasa</h2><div _ngcontent-ng-c3151048826 class=""prose max-h-64 overflow-hidden text-gray-800 ng-star-inserted""><p>U Slancima na 9km od Beograda prodaje se gradsko-građevinski plac sa informacijom o lokaciji, uknjižen, sačinjen od 4 parcele, PR+P1+Pk, može se napraviti dvojna kuća sa 4 stana, maksimalni index zauzetosti na parceli je 40%, struja, voda i asfaltni put dovedeni do placa. Agencijska provizija 2% Reg.br.566<br>Agencija BeostatuS tel: 064/112-3938","Građevinsko zemljište na prodaju, 1.maj, 50.000€, 13a - 4zida",2024-01-24,
355,https://www.4zida.rs/prodaja-placeva/ostruznica-cukarica-cukarica-opstina-beograd/gradjevinsko-zemljiste/656d9c14c279c6667a07ddd6,građevinsko zemljište ,17 a ,uknjiženo ,pre 1 mesec ,85.000,Miodraga Popovića,"Ostružnica, Čukarica, Čukarica opština, Beograd","<h2 _ngcontent-ng-c3151048826 class=""mat-headline-5"">Opis oglasa</h2><div _ngcontent-ng-c3151048826 class=""prose max-h-64 overflow-hidden text-gray-800 ng-star-inserted""><p>Na prodaju gradsko građevinsko zemljište u Ostružnici, u ulici Miodraga Popovića, stari naziv ulice je 7. jula. Plac se prostire na dve spojene parcele. Na idealnom mestu, okružen kućama.<br>Plac je uknjižen. ID oglasa: 62975. Agencijska provizija 2% od kupoprodajne cene.","Građevinsko zemljište na prodaju, Miodraga Popovića, 85.000€, 17a - 4zida",2024-01-24,62975 
356,https://www.4zida.rs/prodaja-placeva/ostruznica-cukarica-cukarica-opstina-beograd/gradjevinsko-zemljiste/65ad1b5b71b394bc6f00e4fb,građevinsko zemljište ,10 a ,uknjiženo ,pre 1 dan ,45.000,Arsenija Miloševića,"Ostružnica, Čukarica, Čukarica opština, Beograd","<h2 _ngcontent-ng-c3151048826 class=""mat-headline-5"">Opis oglasa</h2><div _ngcontent-ng-c3151048826 class=""prose max-h-64 overflow-hidden text-gray-800 ng-star-inserted""><p>Na prodaju je plac površine 10 ari, savršeno smešteno na blagom proplanku pored asfaltnog puta. ","Građevinsko zemljište na prodaju, Arsenija Miloševića, 45.000€, 10a - 4zida",2024-01-24,
357,https://www.4zida.rs/prodaja-placeva/mudrakovac-gradske-lokacije-krusevac/gradjevinsko-zemljiste/654536c0631c2d06da0bba7a,građevinsko zemljište ,402 a ,uknjiženo ,pre 2 meseca ,25.000,Mudrakovac,"Mudrakovac, Gradske lokacije, Kruševac","<h2 _ngcontent-ng-c3151048826 class=""mat-headline-5"">Opis oglasa</h2><div _ngcontent-ng-c3151048826 class=""prose max-h-64 overflow-hidden text-gray-800 ng-star-inserted""><p>Agencija za nekretnine Maksimović prodaje prazan plac od 4,02 ara u Mudrakovcu, Kruševac, nedaleko od škole Jovan Jovanović Zmaj.","Građevinsko zemljište na prodaju, Mudrakovac, 25.000€, 402a - 4zida",2024-01-24,
358,https://www.4zida.rs/prodaja-placeva/nemenikuce-sopot-opstina-beograd/gradjevinsko-zemljiste/644d473dccf7df6b4406f338,građevinsko zemljište ,85 a ,uknjiženo ,pre 7 meseci ,85.200,Nemenikuće,"Nemenikuće, Sopot opština, Beograd","<h2 _ngcontent-ng-c3151048826 class=""mat-headline-5"">Opis oglasa</h2><div _ngcontent-ng-c3151048826 class=""prose max-h-64 overflow-hidden text-gray-800 ng-star-inserted""><p>Na prodaju je građevinsko zemljište smešteno u slikovitom podnožju Kosmaja. Ovo zemljište ima mnogo potencijala i pruža vam mogućnost izgradnje vašeg idealnog doma.","Građevinsko zemljište na prodaju, Nemenikuće, 85.200€, 85a - 4zida",2024-01-24,
359,https://www.4zida.rs/prodaja-placeva/misa-vinogradi-gradske-lokacije-pancevo/gradjevinsko-zemljiste/645cd2e1a44357942809ec15,građevinsko zemljište ,183.38 a ,uknjiženo ,pre 16 dana ,280.000,Novoseljanski put,"Misa Vinogradi, Gradske lokacije, Pančevo","<h2 _ngcontent-ng-c3151048826 class=""mat-headline-5"">Opis oglasa</h2><div _ngcontent-ng-c3151048826 class=""prose max-h-64 overflow-hidden text-gray-800 ng-star-inserted""><p>Na prodaju zemljište površine 183,38 ari na Novoseljanskom putu, na 6.5km od strogog centra grada, 2.5km od Kutko pumpe. Zemljište se nalazi do glavnog puta, a sastoji se od 3 katastarske parcele (52a29m2 - građevinsko zemljište, 62a04m2 - građevinsko zemljište i 69a05m2 - poljoprivredno zemljište), širina fronta je oko 50 metara. Struja je trofazna, bunarska voda, nema kanalizacije. Pogodno je za firme kojima je potreban veliki plac, pumpe, stovarišta, hale, magacine, itd.","Građevinsko zemljište na prodaju, Novoseljanski put, 280.000€, 183a - 4zida",2024-01-24,
360,https://www.4zida.rs/prodaja-placeva/putinci-okolne-lokacije-ruma/gradjevinsko-zemljiste/60883e8f6d0a4d0940604596,građevinsko zemljište ,42 a ,uknjiženo ,pre 1 mesec ,14.000,RUma,"Putinci, Okolne lokacije, Ruma","<h2 _ngcontent-ng-c3151048826 class=""mat-headline-5"">Opis oglasa</h2><div _ngcontent-ng-c3151048826 class=""prose max-h-64 overflow-hidden text-gray-800 ng-star-inserted""><p>Na prodaju zemljište u građevinskom području. Zemljište ima 42,1 ar i nalazi se u Putincima. Dimenzije placa su 200x22 metara. Zemljište se nalazi na kraju ulice i sva infrastruktura(struja, voda i gas) je dovedena do njega. Takođe, udaljeno je 500 metara zemljanim putem od železničke stanice.","Građevinsko zemljište na prodaju, RUma, 14.000€, 42a - 4zida",2024-01-24,
361,https://www.4zida.rs/prodaja-placeva/donje-sajlovo-sajlovo-gradske-lokacije-novi-sad/gradjevinsko-zemljiste/64a2b395c0e1cc7fde0ace1c,građevinsko zemljište ,9 a ,uknjiženo ,pre 2 meseca ,115.875,Gornje Sajlovo,"Donje Sajlovo, Sajlovo, Gradske lokacije, Novi Sad","<h2 _ngcontent-ng-c3151048826 class=""mat-headline-5"">Opis oglasa</h2><div _ngcontent-ng-c3151048826 class=""prose max-h-64 overflow-hidden text-gray-800 ng-star-inserted""><p>U ponudi imamo:","Građevinsko zemljište na prodaju, Gornje Sajlovo, 115.875€, 9a - 4zida",2024-01-24,
