,link,Tip,Površina,Šifra oglasa,Oglas ažuriran,price,street,address,description,title,end_date,Uknjiženost
0,https://www.4zida.rs/prodaja-placeva/sumarice-gradske-lokacije-kragujevac/gradjevinsko-zemljiste/65a11fd930778f4c8c04cd50,građevinsko zemljište ,10 a ,p,pre 7 sati ,20.000,Lovačka,"Šumarice, Gradske lokacije, Kragujevac","<h2 _ngcontent-ng-c3151048826 class=""mat-headline-5"">Opis oglasa</h2><div _ngcontent-ng-c3151048826 class=""prose max-h-64 overflow-hidden text-gray-800 ng-star-inserted""><p>Na prodaju plac u Kragujevcu, pogodan za izgradnju porodične kuće i vikendice. Plac koji se prodaje je deo parcele, na kojoj se vrši parcelacija i površina parcele koja se prodaje je 1000 m2, a uz kupovinu ove parcele dobija se i 1/5 parcele koja je predviđena da bude ulica. Vodi se kao građevinsko zemljište i moguće je dobijanje dozvole za izgradnju. Vlasnik 1/1. Plac je uknjižen. Za sve informacije i razgledanje stojimo vam na raspolaganju, radnim danima od 09-19h i subotom od 09-17h. Ovu i druge nekretnine sa većim brojem fotografija možete pogledati na našem sajtu: bulevarnekretnine.rs, kontakt: info@bulevarnekretnine.rs, usluga besplatna. Čekamo Vas. Telefon 034/330808 i 060/0544253. Bulevar Nekretnine 034, Kragujevac, broj u registru posrednika: 1278.","Građevinsko zemljište na prodaju, Lovačka, 20.000€, 10a - 4zida",2024-01-12,
1,https://www.4zida.rs/prodaja-placeva/trosarina-vozdovac-opstina-beograd/gradjevinsko-zemljiste/65a15b30ee8097a4480588a8,građevinsko zemljište ,10 a ,68760 ,pre 3 sata ,600.000,Beranska,"Trošarina, Voždovac opština, Beograd","<h2 _ngcontent-ng-c3151048826 class=""mat-headline-5"">Opis oglasa</h2><div _ngcontent-ng-c3151048826 class=""prose max-h-64 overflow-hidden text-gray-800 ng-star-inserted""><p>Na izuzetnoj lokaciji, u blizini Pežoovog sevisa na Voždovcu, ravna parcela za zidanje zgrade. Dostupnost vode i struje na placu, javna kanalizacija. Vlasnik 1/1. ID oglasa: 68760. Agencijska provizija 2% od kupoprodajne cene.","Građevinsko zemljište na prodaju, Beranska, 600.000€, 10a - 4zida",2024-01-12,uknjiženo 
2,https://www.4zida.rs/prodaja-placeva/pinosava-vozdovac-opstina-beograd/gradjevinsko-zemljiste/65a17374b8d5f075fb02d6a0,građevinsko zemljište ,7.2 a ,4957 ,pre 1 sat ,55.000,Pinosava,"Pinosava, Voždovac opština, Beograd","<h2 _ngcontent-ng-c3151048826 class=""mat-headline-5"">Opis oglasa</h2><div _ngcontent-ng-c3151048826 class=""prose max-h-64 overflow-hidden text-gray-800 ng-star-inserted""><p>Plac na odličnoj lokaciji , 7.2 ara  pravilnog oblika, u  zoni koja je predvidjena  za  porodičnu gradnju P+1+Pk .<br>Uradjena preparcelacija, ogradjen, jedan vlasnik…<br>U neposrednoj blizini  je  škola , gradski prevoz.<br>Struja , voda , kanalizacija pored placa.","Građevinsko zemljište na prodaju, Pinosava, 55.000€, 7a - 4zida",2024-01-12,uknjiženo 
3,https://www.4zida.rs/prodaja-placeva/ugrinovci-zemun-opstina-beograd/gradjevinsko-zemljiste/65a06b4e00094e5f5f06a7fa,građevinsko zemljište ,156 a ,1699 ,pre 20 sati ,550.000,Partizanska,"Ugrinovci, Zemun opština, Beograd","<h2 _ngcontent-ng-c3151048826 class=""mat-headline-5"">Opis oglasa</h2><div _ngcontent-ng-c3151048826 class=""prose max-h-64 overflow-hidden text-gray-800 ng-star-inserted""><p>Na prodaju veliki plac površine 156ari sa frontom na glavnu ulicu.<br>Na 15min od Beograda i 3km od autoputa. U blizini aerodroma.<br>Plac se sastoji iz 3 parcele:","Građevinsko zemljište na prodaju, Partizanska, 550.000€, 156a - 4zida",2024-01-12,uknjiženo 
4,https://www.4zida.rs/prodaja-placeva/donja-trnava-okolne-lokacije-nis/gradjevinsko-zemljiste/659ec487f4e36fe0b60db6b9,građevinsko zemljište ,31 a ,2665 ,pre 2 dana ,12.000,Donja Trnava,"Donja Trnava, Okolne lokacije, Niš","<h2 _ngcontent-ng-c3151048826 class=""mat-headline-5"">Opis oglasa</h2><div _ngcontent-ng-c3151048826 class=""prose max-h-64 overflow-hidden text-gray-800 ng-star-inserted""><p>Prodaje se plac sa kućom u grubim radovima u selu Gornja Trnava. Plac je površine 31ar, kuća površine 140m2. Hvala Vam što ste pogledali oglas. Za više informacija o ovoj ili drugim nekretninama i zakazivanje razgledanja kontaktirajte agenta na telefon 066/498-100 (poziv, sms, viber) ili putem e-maila. Kompletnu ponudu dostupnih nekretnina možete pronaći na našem sajtu.","Građevinsko zemljište na prodaju, Donja Trnava, 12.000€, 31a - 4zida",2024-01-12,
5,https://www.4zida.rs/prodaja-placeva/sijace-polje-gradske-lokacije-kraljevo/gradjevinsko-zemljiste/659ef2d2be2969cd190132c7,građevinsko zemljište ,8.2 a ,,pre 3 sata ,30.000,Zarka zrenjanina 0646499041,"Sijaće Polje, Gradske lokacije, Kraljevo","<h2 _ngcontent-ng-c3151048826 class=""mat-headline-5"">Opis oglasa</h2><!----><button _ngcontent-ng-c3151048826 mat-button color=""primary"" class=""w-full mdc-button mat-mdc-button mat-primary _mat-animation-noopable mat-mdc-button-base ng-star-inserted"" mat-ripple-loader-uninitialized mat-ripple-loader-class-name=""mat-mdc-button-ripple"" ngh=""6""><span class=""mat-mdc-button-persistent-ripple mdc-button__ripple""></span><mat-icon _ngcontent-ng-c3151048826 role=""img"" class=""mat-icon notranslate material-icons mat-ligature-font mat-icon-no-color"" aria-hidden=""true"" data-mat-icon-type=""font"" ngh=""0"">expand_more</mat-icon><span class=""mdc-button__label""> Prikaži </span><span class=""mat-mdc-focus-indicator""></span><span class=""mat-mdc-button-touch-target""></span></button><!----><!----><div _ngcontent-ng-c3151048826 data-cy=""detailsDescButtons"" class=""mt-6 grid grid-cols-2 gap-2 desk:grid-cols-4""><!----><!----><button _ngcontent-ng-c3151048826 mat-stroked-button color=""primary"" class=""flex-grow mdc-button mdc-button--outlined mat-mdc-outlined-button mat-primary _mat-animation-noopable mat-mdc-button-base ng-star-inserted"" mat-ripple-loader-uninitialized mat-ripple-loader-class-name=""mat-mdc-button-ripple"" ngh=""6""><span class=""mat-mdc-button-persistent-ripple mdc-button__ripple""></span><mat-icon _ngcontent-ng-c3151048826 role=""img"" class=""mat-icon notranslate material-icons mat-ligature-font mat-icon-no-color"" aria-hidden=""true"" data-mat-icon-type=""font"" ngh=""0"">share</mat-icon><span class=""mdc-button__label""> Podeli </span><span class=""mat-mdc-focus-indicator""></span><span class=""mat-mdc-button-touch-target""></span></button><!----><!----><!----><button _ngcontent-ng-c3151048826 mat-stroked-button color=""primary"" class=""flex-grow mdc-button mdc-button--outlined mat-mdc-outlined-button mat-primary _mat-animation-noopable mat-mdc-button-base ng-star-inserted"" mat-ripple-loader-uninitialized mat-ripple-loader-class-name=""mat-mdc-button-ripple"" ngh=""6""><span class=""mat-mdc-button-persistent-ripple mdc-button__ripple""></span><mat-icon _ngcontent-ng-c3151048826 role=""img"" class=""mat-icon notranslate material-icons mat-ligature-font mat-icon-no-color"" aria-hidden=""true"" data-mat-icon-type=""font"" ngh=""0"">warning</mat-icon><span class=""mdc-button__label""> Prijavi </span><span class=""mat-mdc-focus-indicator""></span><span class=""mat-mdc-button-touch-target""></span></button><!----></div></div><!----><app-gpt-banner _ngcontent-ng-c3151048826 labelposition=""top"" class=""inset-0 my-12 flex justify-center ng-star-inserted"" _nghost-ng-c2356194491 ngh=""13""><div _ngcontent-ng-c2356194491 id=""ed-container"" class=""overflow-clip bg-white"" data-cy=""banner""><!----><div _ngcontent-ng-c2356194491 class=""label-top""><div _ngcontent-ng-c2356194491 class=""relative"" id=""4Z_Mobile_320x100_AdDetails_Branding"" style=""width: 320px; height: 100px;""></div><small _ngcontent-ng-c2356194491 class=""leading-none ng-star-inserted""><span _ngcontent-ng-c2356194491>▾</span>Reklama<span _ngcontent-ng-c2356194491>▾</span></small><!----></div></div></app-gpt-banner><!----><div _ngcontent-ng-c3151048826 class=""mx-auto max-w-container""><!----></div><!----><!----><!----><!----><hr _ngcontent-ng-c3151048826><app-author-info _ngcontent-ng-c3151048826 variant=""description"" data-cy=""authorInfo"" _nghost-ng-c3575723570 ngh=""15""><!----><app-vertical-info _ngcontent-ng-c3575723570 _nghost-ng-c3763752656 class=""ng-star-inserted"" ngh=""14""><div _ngcontent-ng-c3763752656 class=""flex flex-col items-center gap-2 ng-star-inserted""><div _ngcontent-ng-c3763752656 class=""mt-2 flex flex-col items-center""><!----><span _ngcontent-ng-c3763752656 class=""font-medium text-orange-500"">BRANKO PAVLOVIC</span><picture _ngcontent-ng-c3763752656><source _ngcontent-ng-c3763752656 type=""image/webp"" srcset=""https://resizer2.4zida.rs/unsigned/rs:fill:76:76/plain/local:///users/959533/96/5dbf5ea18f.jpg@webp""><source _ngcontent-ng-c3763752656 type=""image/jpeg"" srcset=""https://resizer2.4zida.rs/unsigned/rs:fill:76:76/plain/local:///users/959533/96/5dbf5ea18f.jpg@jpeg""><img _ngcontent-ng-c3763752656 width=""76"" height=""76"" class=""author-avatar mt-4 shadow-lg"" alt=""BRANKO PAVLOVIC avatar"" loading=""lazy"" fetchpriority=""auto"" ng-img=""true"" src=""https://resizer2.4zida.rs/unsigned/rs:fill:76:76/plain/local:///users/959533/96/5dbf5ea18f.jpg@jpeg""></picture><div _ngcontent-ng-c3763752656 class=""mt-2 flex items-center gap-1""><mat-icon _ngcontent-ng-c3763752656 role=""img"" color=""primary"" class=""mat-icon notranslate verified-icon mat-primary material-icons mat-ligature-font"" aria-hidden=""true"" data-mat-icon-type=""font"" ngh=""0"">verified</mat-icon><small _ngcontent-ng-c3763752656 class=""font-medium""> na 4zida</small></div></div><div _ngcontent-ng-c3763752656 class=""mt-2 w-full flex-grow""><div _ngcontent-ng-c3763752656><div _ngcontent-ng-c3763752656 class=""grid-cols-auto-fit grid justify-center gap-2""><button _ngcontent-ng-c3763752656 mat-flat-button color=""primary"" mat-ripple-loader-uninitialized mat-ripple-loader-class-name=""mat-mdc-button-ripple"" class=""mdc-button mdc-button--unelevated mat-mdc-unelevated-button mat-primary _mat-animation-noopable mat-mdc-button-base ng-star-inserted"" ngh=""6""><span class=""mat-mdc-button-persistent-ripple mdc-button__ripple""></span><mat-icon _ngcontent-ng-c3763752656 role=""img"" class=""mat-icon notranslate mr-2 material-icons mat-ligature-font mat-icon-no-color"" aria-hidden=""true"" data-mat-icon-type=""font"" ngh=""0"">phone</mat-icon><span class=""mdc-button__label""><span _ngcontent-ng-c3763752656>pozovi oglašivača</span></span><span class=""mat-mdc-focus-indicator""></span><span class=""mat-mdc-button-touch-target""></span></button><!----><!----><button _ngcontent-ng-c3763752656 mat-stroked-button color=""primary"" mat-ripple-loader-uninitialized mat-ripple-loader-class-name=""mat-mdc-button-ripple"" class=""mdc-button mdc-button--outlined mat-mdc-outlined-button mat-primary _mat-animation-noopable mat-mdc-button-base"" ngh=""6""><span class=""mat-mdc-button-persistent-ripple mdc-button__ripple""></span><mat-icon _ngcontent-ng-c3763752656 role=""img"" class=""mat-icon notranslate mr-2 material-icons mat-ligature-font mat-icon-no-color"" aria-hidden=""true"" data-mat-icon-type=""font"" ngh=""0"">mail</mat-icon><span class=""mdc-button__label""><span _ngcontent-ng-c3763752656>pošalji mejl</span></span><span class=""mat-mdc-focus-indicator""></span><span class=""mat-mdc-button-touch-target""></span></button></div></div></div></div><!----></app-vertical-info><!----><!----><!----><!----><!----><!----><!----></app-author-info><hr _ngcontent-ng-c3151048826><!----><section _ngcontent-ng-c3151048826 data-cy=""cashLoanDiv"" class=""py-4""><h2 _ngcontent-ng-c3151048826 class=""mat-headline-5"">Keš krediti</h2><mat-accordion _ngcontent-ng-c3151048826 class=""mat-accordion""><mat-expansion-panel _ngcontent-ng-c3151048826 class=""mat-expansion-panel ng-tns-c1859850774-2 mat-expanded _mat-animation-noopable mat-expansion-panel-spacing ng-star-inserted"" ngh=""22""><mat-expansion-panel-header _ngcontent-ng-c3151048826 role=""button"" class=""mat-expansion-panel-header mat-focus-indicator ng-tns-c2690051721-3 ng-tns-c1859850774-2 mat-expanded mat-expansion-toggle-indicator-after _mat-animation-noopable ng-star-inserted"" id=""mat-expansion-panel-header-14669"" tabindex=""0"" aria-controls=""cdk-accordion-child-14669"" aria-expanded=""true"" aria-disabled=""false"" ngh=""23""><span class=""mat-content ng-tns-c2690051721-3""><mat-panel-title _ngcontent-ng-c3151048826 class=""mat-expansion-panel-header-title font-bold uppercase text-green-500 ng-tns-c2690051721-3""> Pogledaj i ponudu keš kredita </mat-panel-title></span><span class=""mat-expansion-indicator ng-tns-c2690051721-3 ng-trigger ng-trigger-indicatorRotate ng-star-inserted"" style=""transform: rotate(180deg);""></span><!----></mat-expansion-panel-header><div role=""region"" class=""mat-expansion-panel-content ng-tns-c1859850774-2 ng-trigger ng-trigger-bodyExpansion"" id=""cdk-accordion-child-14669"" aria-labelledby=""mat-expansion-panel-header-14669"" style=""height: *;""><div class=""mat-expansion-panel-body ng-tns-c1859850774-2""><!----><app-cash-credit-calculator _ngcontent-ng-c3151048826 _nghost-ng-c1647687278 class=""ng-star-inserted"" style ngh=""20""><form _ngcontent-ng-c1647687278 novalidate class=""ng-untouched ng-pristine ng-valid""><app-number-field _ngcontent-ng-c1647687278 label=""Iznos kredita"" placeholder=""Unesi iznos kredita"" data-cy=""cashCreditPrice"" _nghost-ng-c3646848609 ngh=""17""><mat-form-field _ngcontent-ng-c3646848609 data-cy=""numberFormField"" class=""mat-mdc-form-field w-full ng-tns-c1205077789-4 mat-mdc-form-field-type-mat-input mat-mdc-form-field-has-icon-suffix mat-form-field-no-animations mat-form-field-appearance-outline mat-primary ng-untouched ng-pristine ng-valid ng-star-inserted"" ngh=""16""><!----><div class=""mat-mdc-text-field-wrapper mdc-text-field ng-tns-c1205077789-4 mdc-text-field--outlined""><!----><div class=""mat-mdc-form-field-flex ng-tns-c1205077789-4""><div matformfieldnotchedoutline class=""mdc-notched-outline ng-tns-c1205077789-4 mdc-notched-outline--notched mdc-notched-outline--upgraded ng-star-inserted"" ngh=""0""><div class=""mdc-notched-outline__leading""></div><div class=""mdc-notched-outline__notch""><label matformfieldfloatinglabel class=""mdc-floating-label mat-mdc-floating-label ng-tns-c1205077789-4 mdc-floating-label--float-above ng-star-inserted"" id=""mat-mdc-form-field-label-141244"" for=""mat-input-32866""><mat-label _ngcontent-ng-c3646848609 class=""ng-tns-c1205077789-4 ng-star-inserted"">Iznos kredita</mat-label><!----><span aria-hidden=""true"" class=""mat-mdc-form-field-required-marker mdc-floating-label--required ng-tns-c1205077789-4 ng-star-inserted""></span><!----></label><!----><!----><!----></div><div class=""mdc-notched-outline__trailing""></div></div><!----><!----><!----><div class=""mat-mdc-form-field-infix ng-tns-c1205077789-4""><!----><input _ngcontent-ng-c3646848609 matinput type=""number"" autocomplete=""off"" class=""mat-mdc-input-element ng-tns-c1205077789-4 mat-input-server mat-mdc-form-field-input-control mdc-text-field__input ng-untouched ng-pristine ng-valid"" value=""50000"" placeholder=""Unesi iznos kredita"" id=""mat-input-32866"" required aria-invalid=""false"" aria-required=""true"" min=""0"" max=""3000000""></div><!----><div class=""mat-mdc-form-field-icon-suffix ng-tns-c1205077789-4 ng-star-inserted""><span _ngcontent-ng-c3646848609 matsuffix class=""px-2 ng-tns-c1205077789-4"">RSD</span></div><!----></div><!----></div><div class=""mat-mdc-form-field-subscript-wrapper mat-mdc-form-field-bottom-align ng-tns-c1205077789-4""><!----><div class=""mat-mdc-form-field-hint-wrapper ng-tns-c1205077789-4 ng-trigger ng-trigger-transitionMessages ng-star-inserted"" style=""opacity: 1; transform: translateY(0%);""><!----><div class=""mat-mdc-form-field-hint-spacer ng-tns-c1205077789-4""></div></div><!----></div></mat-form-field></app-number-field><div _ngcontent-ng-c1647687278 class=""flex justify-between""><p _ngcontent-ng-c1647687278 class=""uppercase"">Period otplate</p><p _ngcontent-ng-c1647687278 class=""uppercase"">13 meseci</p></div><mat-slider _ngcontent-ng-c1647687278 step=""1"" data-cy=""cashCreditSlider"" class=""mat-mdc-slider mdc-slider mat-primary mdc-slider--discrete _mat-animation-noopable"" ngh=""19""><input _ngcontent-ng-c1647687278 type=""range"" matsliderthumb formcontrolname=""period"" class=""mdc-slider__input ng-untouched ng-pristine ng-valid"" style=""padding: 0px; width: calc(100% + 48px); left: -24px;"" step=""1"" min=""6"" max=""71"" value=""13"" aria-valuetext=""13""><div class=""mdc-slider__track""><div class=""mdc-slider__track--inactive""></div><div class=""mdc-slider__track--active""><div class=""mdc-slider__track--active_fill"" style=""left: 0px; right: auto; transform-origin: left; transform: scaleX(0);""></div></div><!----></div><!----><mat-slider-visual-thumb class=""mdc-slider__thumb mat-mdc-slider-visual-thumb mdc-slider__thumb--short-value"" style=""transform: translateX(NaNpx);"" ngh=""18""><div class=""mdc-slider__value-indicator-container ng-star-inserted""><div class=""mdc-slider__value-indicator""><span class=""mdc-slider__value-indicator-text"">13</span></div></div><!----><div class=""mdc-slider__thumb-knob""></div><div matripple class=""mat-ripple mat-mdc-focus-indicator""></div></mat-slider-visual-thumb></mat-slider></form></app-cash-credit-calculator><app-cash-offers _ngcontent-ng-c3151048826 prefixid=""ad_details_"" _nghost-ng-c3095759878 class=""ng-star-inserted"" style ngh=""21""><div _ngcontent-ng-c3095759878 waintersectionobserver waintersectionthreshold=""0.5"" class=""space-y-4""><div _ngcontent-ng-c3095759878 class=""card-container ng-star-inserted""><!----><a _ngcontent-ng-c3095759878 target=""_blank"" title=""nlb"" id=""ad_details_kes_krediti-nlb"" href=""https://www.nlbkb.rs/stanovnistvo/krediti/kes-krediti?utm_source=4zida.rs&utm_medium=kalkulator&utm_campaign=&utm_term"" class=""ng-star-inserted""><div _ngcontent-ng-c3095759878 class=""rounded border-l-[5px] border-green-500 bg-gray-50 p-4 shadow hover:shadow-md""><div _ngcontent-ng-c3095759878 class=""flex w-full flex-wrap items-center justify-center gap-4 [@media(min-width:390px)]:justify-between""><div _ngcontent-ng-c3095759878 class=""bank-image""><picture _ngcontent-ng-c3095759878 class=""ng-star-inserted""><source _ngcontent-ng-c3095759878 type=""image/webp"" srcset=""https://cdn.4zida.rs/assets/images/logos/banka-nlb-logo.webp""><source _ngcontent-ng-c3095759878 type=""image/png"" srcset=""https://cdn.4zida.rs/assets/images/logos/banka-nlb-logo.webp""><img _ngcontent-ng-c3095759878 width=""170"" height=""65"" alt=""NLB Komercijalna Banka Logo"" loading=""lazy"" fetchpriority=""auto"" ng-img=""true"" src=""https://cdn.4zida.rs/assets/images/logos/banka-nlb-logo.webp""></picture><!----></div><div _ngcontent-ng-c3095759878 class=""flex flex-col items-end gap-2""><div _ngcontent-ng-c3095759878 class=""text-md text-right font-bold text-green-500 desk:text-2xl""> od 4.120 RSD </div><a _ngcontent-ng-c3095759878 target=""_blank"" class=""link-primary desk:text-md text-right text-xs"" href=""https://www.nlbkb.rs/stanovnistvo/krediti/kes-krediti?utm_source=4zida.rs&utm_medium=kalkulator&utm_campaign=&utm_term""> Reprezentativni primer </a></div></div></div></a><!----><!----></div><!----><!----><!----><div _ngcontent-ng-c3095759878 class=""card-container ng-star-inserted""><!----><a _ngcontent-ng-c3095759878 target=""_blank"" title=""otp"" id=""ad_details_kes_krediti_otp"" href=""https://www.otpbanka.rs/kes-kredit/?utm_source=partner_website&utm_medium=kalkulator&utm_campaign=partner_website&utm_content=4_zida&utm_term=&utm_id=12351&crmc=49e1b6f2-75d7-ff7f-63be-63f73ab698eb&crm_campaign=CCC_ONLINE_KES_KREDITI_RTDE_SLS"" class=""ng-star-inserted""><div _ngcontent-ng-c3095759878 class=""rounded border-l-[5px] border-green-500 bg-gray-50 p-4 shadow hover:shadow-md""><div _ngcontent-ng-c3095759878 class=""flex w-full flex-wrap items-center justify-center gap-4 [@media(min-width:390px)]:justify-between""><div _ngcontent-ng-c3095759878 class=""bank-image""><picture _ngcontent-ng-c3095759878 class=""ng-star-inserted""><source _ngcontent-ng-c3095759878 type=""image/webp"" srcset=""https://cdn.4zida.rs/assets/images/logos/banka-otp-logo.webp""><source _ngcontent-ng-c3095759878 type=""image/png"" srcset=""https://cdn.4zida.rs/assets/images/logos/banka-otp-logo.png""><img _ngcontent-ng-c3095759878 width=""170"" height=""65"" alt=""OTP Banka Logo"" loading=""lazy"" fetchpriority=""auto"" ng-img=""true"" src=""https://cdn.4zida.rs/assets/images/logos/banka-otp-logo.png""></picture><!----></div><div _ngcontent-ng-c3095759878 class=""flex flex-col items-end gap-2""><div _ngcontent-ng-c3095759878 class=""text-md text-right font-bold text-green-500 desk:text-2xl""> od 4.144 RSD </div><a _ngcontent-ng-c3095759878 target=""_blank"" class=""link-primary desk:text-md text-right text-xs"" href=""https://www.otpbanka.rs/kes-kredit/?utm_source=partner_website&utm_medium=kalkulator&utm_campaign=partner_website&utm_content=4_zida&utm_term=&utm_id=12351&crmc=49e1b6f2-75d7-ff7f-63be-63f73ab698eb&crm_campaign=CCC_ONLINE_KES_KREDITI_RTDE_SLS""> Reprezentativni primer </a></div></div></div></a><!----><!----></div><!----><!----><!----><!----><!----><!----><!----><!----><!----><!----><!----><!----><!----><!----><!----><!----><!----><!----><!----><!----></div></app-cash-offers><div _ngcontent-ng-c3151048826 class=""text-center ng-star-inserted"" style><a _ngcontent-ng-c3151048826 mat-button color=""accent"" class=""mt-4 mdc-button mat-mdc-button mat-accent _mat-animation-noopable mat-mdc-button-base"" mat-ripple-loader-uninitialized mat-ripple-loader-class-name=""mat-mdc-button-ripple"" href=""/kreditna-sposobnost"" aria-disabled=""false"" ngh=""11""><span class=""mat-mdc-button-persistent-ripple mdc-button__ripple""></span><span class=""mdc-button__label""> Proveri da li si kreditno sposoban OVDE </span><span class=""mat-mdc-focus-indicator""></span><span class=""mat-mdc-button-touch-target""></span></a></div><!----></div></div></mat-expansion-panel><!----></mat-accordion></section><div _ngcontent-ng-c3151048826 data-cy=""priceStatsDiv""><!----><!----></div><!----><!----></main><!----></div><div _ngcontent-ng-c3151048826 class=""mx-auto max-w-container""><p _ngcontent-ng-c3151048826 class=""!mt-8 text-sm text-gray-600"">Građevinsko zemljište za prodaju, Sijaće Polje, 8.2 a, uknjiženo.","Građevinsko zemljište na prodaju, Zarka zrenjanina 0646499041, 30.000€, 8a - 4zida",2024-01-12,uknjiženo 
6,https://www.4zida.rs/prodaja-placeva/olimp-zvezdara-opstina-beograd/gradjevinsko-zemljiste/65a168a023873cdfdd050006,građevinsko zemljište ,5.25 a ,960 ,pre 2 sata ,320.000,Olimp,"Olimp, Zvezdara opština, Beograd","<h2 _ngcontent-ng-c3151048826 class=""mat-headline-5"">Opis oglasa</h2><div _ngcontent-ng-c3151048826 class=""prose max-h-64 overflow-hidden text-gray-800 ng-star-inserted""><p>Građevinsko zemljište sa dva objekta uknjižene površine 82m2.","Građevinsko zemljište na prodaju, Olimp, 320.000€, 5a - 4zida",2024-01-12,uknjiženo 
7,https://www.4zida.rs/prodaja-placeva/beli-potok-vozdovac-opstina-beograd/gradjevinsko-zemljiste/65a1557bee8097a448058799,građevinsko zemljište ,30 a ,9120 ,pre 4 sata ,120.000,Zmaja od Avale,"Beli Potok, Voždovac opština, Beograd","<h2 _ngcontent-ng-c3151048826 class=""mat-headline-5"">Opis oglasa</h2><div _ngcontent-ng-c3151048826 class=""prose max-h-64 overflow-hidden text-gray-800 ng-star-inserted""><p>U opštini Voždovac, u naselju Beli potok, nalazi se ovaj plac od 30, ari. Lokacija je odlična, u blizini Kumbare, idealna je za sve one koji žele mir i tišinu, daleko od gradske vreve. Ima struju, vodu i plin, a put do placa je asfaltiran, što dodatno olakšava prilaz do njega. U blizini se nalaze svi neophodni sadržaji za život. Uknjižen kao gradsko građevinsko zemljište, privatna svojina.<br>Agencijska provizija 2%<br>069/2191-847 i 011/2283-734","Građevinsko zemljište na prodaju, Zmaja od Avale, 120.000€, 30a - 4zida",2024-01-12,uknjiženo 
8,https://www.4zida.rs/prodaja-placeva/tometino-polje-okolne-lokacije-pozega/gradjevinsko-zemljiste/65a1689de82ac79161000e8b,građevinsko zemljište ,65 a ,1646 ,pre 39 minuta ,6.500,Tometino Polje,"Tometino Polje, Okolne lokacije, Požega","<h2 _ngcontent-ng-c3151048826 class=""mat-headline-5"">Opis oglasa</h2><div _ngcontent-ng-c3151048826 class=""prose max-h-64 overflow-hidden text-gray-800 ng-star-inserted""><p>Parcela se vodi kao pašnjak, ali je pošumljena sedamdesetih godina.<br>Do parcele popstoji ucrtan put i može se izaći terenskim vozilom ili kvadom.<br>Struja i gradski vovovod su udaljeni oko 800m.<br>Nadmorska visina je 850m.<br>Postoji mogućnost registracije  poljoprivrednog gazdinstva za potrebe pčelarstva radi lakšeg dobijanja priključka za struju.<br>Parcela je idealna za ljude koji žele potpuni mir i tišinu. Agencijska provizija 2%","Građevinsko zemljište na prodaju, Tometino Polje, 6.500€, 65a - 4zida",2024-01-12,
9,https://www.4zida.rs/prodaja-placeva/makis-cukarica-cukarica-opstina-beograd/gradjevinsko-zemljiste/65a018ef5c6ad8669f075dce,građevinsko zemljište ,50 a ,1382 ,pre 1 dan ,255.000,Obrenovački drum,"Makiš, Čukarica, Čukarica opština, Beograd","<h2 _ngcontent-ng-c3151048826 class=""mat-headline-5"">Opis oglasa</h2><div _ngcontent-ng-c3151048826 class=""prose max-h-64 overflow-hidden text-gray-800 ng-star-inserted""><p>Na prodaju uknjizen plac od 50 ari,ulaz sa glavnog puta.Prodaje se u celini.Nalazi se u blizini restorana Mike Alasa sa suprotne puta druma. Posrednička naknada 2%","Građevinsko zemljište na prodaju, Obrenovački drum, 255.000€, 50a - 4zida",2024-01-12,uknjiženo 
10,https://www.4zida.rs/prodaja-placeva/misa-gradske-lokacije-pancevo/gradjevinsko-zemljiste/5c77c6b12731713c8a23f452,,,,,,,,,"Prodaja placeva Misa, Gradske lokacije, Pančevo, Građevinsko zemljište - 4zida",2024-01-12,
