,link,Tip,PovrÅ¡ina,UknjiÅ¾enost,Å ifra oglasa,Oglas aÅ¾uriran,price,street,address,description,title,end_date
340,https://www.4zida.rs/prodaja-placeva/ledena-stena-palilula-gradske-lokacije-nis/gradjevinsko-zemljiste/638623701e6feac3d40ad77c,graÄ‘evinsko zemljiÅ¡te ,73.17 a ,,p,pre 10 meseci ,1.240.000,Dimitrija TucoviÄ‡a,"Ledena Stena, Palilula, Gradske lokacije, NiÅ¡","<h2 _ngcontent-ng-c3151048826 class=""mat-headline-5"">Opis oglasa</h2><div _ngcontent-ng-c3151048826 class=""prose max-h-64 overflow-hidden text-gray-800 ng-star-inserted""><p>Na prodaju izuzetan plac u blizini Minovog naselja, na Ledenoj steni, povrÅ¡ine 7317m2. Pogodan za izgradnju manjeg naselja sa modernim stambeno poslovnim objektima za stanovanje. Plac je gradsko graÄ‘evinsko zemljiÅ¡te, kvadratnog oblika, sa namenom dominantnom, stanovanje ili poslovanje. Izuzetno dobar poloÅ¾aj. Privatna svojina 1 kroz 1, uknjiÅ¾en. Ovo je samo deo naÅ¡e ponude, za viÅ¡e informacija pozovite ili posetite nas sajt.","GraÄ‘evinsko zemljiÅ¡te na prodaju, Dimitrija TucoviÄ‡a, 1.240.000â‚¬, 73a - 4zida",2024-03-02
341,https://www.4zida.rs/prodaja-placeva/globoder-okolne-lokacije-krusevac/gradjevinsko-zemljiste/64f3a0ba6292304e670d12cc,,,,,,,,,,"GraÄ‘evinsko zemljiÅ¡te na prodaju, Globoder, 16.000â‚¬, 80a - 4zida",2024-03-02
342,https://www.4zida.rs/prodaja-placeva/vrdnik-okolne-lokacije-irig/gradjevinsko-zemljiste/63ef40c74d1fb0a9090e701c,,,,,,,,,,"GraÄ‘evinsko zemljiÅ¡te na prodaju, Save JovanoviÄ‡a Äese, 60.000â‚¬, 15a - 4zida",2024-03-02
343,https://www.4zida.rs/prodaja-placeva/malosiste-okolne-lokacije-doljevac/gradjevinsko-zemljiste/652d5735b75c7f57f70c614f,,,,,,,,,,"Prodaja placeva MaloÅ¡iÅ¡te, Okolne lokacije, Doljevac, GraÄ‘evinsko zemljiÅ¡te - 4zida",2024-03-02
344,https://www.4zida.rs/prodaja-placeva/palic-okolne-lokacije-subotica/gradjevinsko-zemljiste/653ad98f17a1e91d7c0961f5,,,,,,,,,,"Prodaja placeva PaliÄ‡, Okolne lokacije, Subotica, GraÄ‘evinsko zemljiÅ¡te - 4zida",2024-03-02
345,https://www.4zida.rs/prodaja-placeva/omoljica-okolne-lokacije-pancevo/gradjevinsko-zemljiste/63e226e381fd2ef01c0b5135,,,,,,,,,,"Prodaja placeva Omoljica, Okolne lokacije, PanÄevo, GraÄ‘evinsko zemljiÅ¡te - 4zida",2024-03-02
346,https://www.4zida.rs/prodaja-placeva/miljakovac-rakovica-opstina-beograd/gradjevinsko-zemljiste/649cb51f812aa7b8e009b340,,,,,,,,,,"GraÄ‘evinsko zemljiÅ¡te na prodaju, Nikole BiÅ¾umiÄ‡a, 73.000â‚¬, 5a - 4zida",2024-03-02
347,https://www.4zida.rs/prodaja-placeva/muzlja-gradske-lokacije-zrenjanin/gradjevinsko-zemljiste/65467a703e9e28af880fa48e,,,,,,,,,,"Prodaja placeva MuÅ¾lja, Gradske lokacije, Zrenjanin, GraÄ‘evinsko zemljiÅ¡te - 4zida",2024-03-02
348,https://www.4zida.rs/prodaja-placeva/makis-cukarica-cukarica-opstina-beograd/gradjevinsko-zemljiste/5fcfa317c0023f1d7318ee33,,,,,,,,,,"Prodaja placeva MakiÅ¡, ÄŒukarica, ÄŒukarica opÅ¡tina, Beograd, GraÄ‘evinsko zemljiÅ¡te - 4zida",2024-03-02
349,https://www.4zida.rs/prodaja-placeva/vrtiste-okolne-lokacije-nis/gradjevinsko-zemljiste/6511b51e0a3261b5d505720e,graÄ‘evinsko zemljiÅ¡te ,8.12 a ,uknjiÅ¾eno ,p,pre 5 meseci ,9.000,VrtiÅ¡te,"VrtiÅ¡te, Okolne lokacije, NiÅ¡","<h2 _ngcontent-ng-c3151048826 class=""mat-headline-5"">Opis oglasa</h2><div _ngcontent-ng-c3151048826 class=""prose max-h-64 overflow-hidden text-gray-800 ng-star-inserted""><p>Na prodaju plac u VrtiÅ¡tu, iznad hotela Nais,u blizini ToponiÄkog puta kod Milk Hausa. Ukupna povrÅ¡ina placa je 812m2. Vodi se kao poljoprivredno zemljiÅ¡te. UknjiÅ¾en kao privatna svojina 1 kroz 1. Za viÅ¡e informacija slobodno pozovite. Ovo je samo deo naÅ¡e ponude, ovu kao i druge nekretnine moÅ¾ete pogledati na naÅ¡em sajtu.","GraÄ‘evinsko zemljiÅ¡te na prodaju, VrtiÅ¡te, 9.000â‚¬, 8a - 4zida",2024-03-02
350,https://www.4zida.rs/prodaja-placeva/gradske-lokacije-doljevac/gradjevinsko-zemljiste/64e8d3c011cd8175f90866d1,graÄ‘evinsko zemljiÅ¡te ,14.33 a ,,p,pre 8 dana ,20.000,Donje Vlase,"Donje Vlase, Okolne lokacije, NiÅ¡","<h2 _ngcontent-ng-c3151048826 class=""mat-headline-5"">Opis oglasa</h2><div _ngcontent-ng-c3151048826 class=""prose max-h-64 overflow-hidden text-gray-800 ng-star-inserted""><p>Na prodaju plac ukupne povrsine 1433m2 sa nedovrÅ¡enom vikend kuÄ‡om kojoj je potrebna adaptacija, povrÅ¡ine 84m2 u vikend naselju Donje Vlase. Plac je pravougaonog oblika, vodi se kao graÄ‘evinsko zemljiÅ¡te izvan graÄ‘evinskog podruÄja.<br>Plac i vikend kuÄ‡a su uknjiÅ¾eni, vlasniÅ¡tvo privatna svojina 1 kroz 1.<br>Za viÅ¡e informacija slobodno pozovite","GraÄ‘evinsko zemljiÅ¡te na prodaju, Donje Vlase, 20.000â‚¬, 14a - 4zida",2024-03-02
351,https://www.4zida.rs/prodaja-placeva/cigota-okolne-lokacije-zlatibor/gradjevinsko-zemljiste/65bbab041a063e9dba0363e0,graÄ‘evinsko zemljiÅ¡te ,5.5 a ,uknjiÅ¾eno ,,pre 3 dana ,27.500,Smiljanski Zakosi,"ÄŒigota, Okolne lokacije, Zlatibor","<h2 _ngcontent-ng-c3151048826 class=""mat-headline-5"">Opis oglasa</h2><div _ngcontent-ng-c3151048826 class=""prose max-h-64 overflow-hidden text-gray-800 ng-star-inserted""><p>Plac se nalazi u Smiljanskim Zakosima, 10 km od centra Zlatibora. Do placa ima asfaltiran put, do samog prilaza placa ima prokopan zemljani put. Plac je pod brojem 6329/24.","GraÄ‘evinsko zemljiÅ¡te na prodaju, Smiljanski Zakosi, 27.500â‚¬, 5a - 4zida",2024-03-02
352,https://www.4zida.rs/prodaja-placeva/ribarska-banja-okolne-lokacije-krusevac/gradjevinsko-zemljiste/64c22ad51b0eeb3855038f98,graÄ‘evinsko zemljiÅ¡te ,46 a ,uknjiÅ¾eno ,p,pre 7 meseci ,36.000,Ribare,"Ribarska Banja, Okolne lokacije, KruÅ¡evac","<h2 _ngcontent-ng-c3151048826 class=""mat-headline-5"">Opis oglasa</h2><div _ngcontent-ng-c3151048826 class=""prose max-h-64 overflow-hidden text-gray-800 ng-star-inserted""><p>Na prodaju odliÄan plac u Ribaru, Ribarskoj Banji. Plac je povrÅ¡ine 46ar. PruÅ¾a odliÄne moguÄ‡nosti za izgradnju Etno sela, modernih Etno kuÄ‡a (moby house), razliÄitih brvnara, kao i razvoj samog etno turizma. Nalazi se nedaleko od ulaza u Ribarsku banju. Udaljenost od najposeÄ‡enijih hotela i apartmana za izdavanje Ribarske banje je samo 2,5km. Plac frontalno izlazi na asfaltni put, boÄnim delom na poljski put. OgraÄ‘en je, poseduje veÄ‡ uvedenu trofaznu struju, prikljuÄen je na gradski vodovod ali ima i  bunar. Na placu se nalaze dva pomoÄ‡na objekata i dva letnjikovca, dok se na delu placa nalaze i razliÄite vrste voÄ‡a i drveÄ‡a. Ima prelep pogled na Mali Jastrebac. Postoji moguÄ‡nost kompenzacije u vidu drugaÄije nadoknade (stan, auto...). UknjiÅ¾en, Äisto vlasniÅ¡tvo. Ovo je samo deo naÅ¡e ponude, ovu kao  i ostale ponude sa veÄ‡im brojem fotografija moÅ¾ete pogledati na naÅ¡em sajtu.","GraÄ‘evinsko zemljiÅ¡te na prodaju, Ribare, 36.000â‚¬, 46a - 4zida",2024-03-02
353,https://www.4zida.rs/prodaja-placeva/gradske-lokacije-pancevo/gradjevinsko-zemljiste/646a8e00399fe3eba70fb745,,,,,,,,,,"GraÄ‘evinsko zemljiÅ¡te na prodaju, Gradske lokacije, 29.000â‚¬, 30a - 4zida",2024-03-02
354,https://www.4zida.rs/prodaja-placeva/borca-palilula-opstina-beograd/gradjevinsko-zemljiste/65a6bb336fd5e61ee50e475b,graÄ‘evinsko zemljiÅ¡te ,191.58 a ,uknjiÅ¾eno ,1969 ,pre 1 mesec ,574.740,Mirgorodska,"BorÄa, Palilula opÅ¡tina, Beograd","<h2 _ngcontent-ng-c3151048826 class=""mat-headline-5"">Opis oglasa</h2><div _ngcontent-ng-c3151048826 class=""prose max-h-64 overflow-hidden text-gray-800 ng-star-inserted""><p>U ponudi gradsko-graÄ‘evinsko zemljiÅ¡te u naselju BorÄa potes OvÄanski put  ukupne povrÅ¡ine 191,58 ari, 1/1.Cena je 3.000 evra po aru. MoguÄ‡nost kupovine od 50 ari pa naviÅ¡e. Po informacijama o lokaciji zemljiÅ¡te je u zoni  porodiÄnog stanovanja gde su kompatibilni i komercijalni sadrÅ¾aji iz oblasti trgovine, administracije i usluÅ¾nih delatnosti koje ne ugroÅ¾avaju Å¾ivotnu sredinu i ne stvaraju buku.Asfalt,voda, struja.Å irina do puta je pribliÅ¾no 380 m.","GraÄ‘evinsko zemljiÅ¡te na prodaju, Mirgorodska, 574.740â‚¬, 191a - 4zida",2024-03-02
355,https://www.4zida.rs/prodaja-placeva/guncati-barajevo-opstina-beograd/gradjevinsko-zemljiste/65042ce0bdcfe6a7580148d7,poljoprivredno zemljiÅ¡te ,15.27 a ,,1201 ,pre 2 meseca ,27.000,UstaniÄka,"Guncati, Barajevo opÅ¡tina, Beograd","<h2 _ngcontent-ng-c3151048826 class=""mat-headline-5"">Opis oglasa</h2><div _ngcontent-ng-c3151048826 class=""prose max-h-64 overflow-hidden text-gray-800 ng-star-inserted""><p>Plac udaljen 2 km od Ibarske magistrale, u zoni porodiÄne gradnje. Nalazi se u ulici UstaniÄka 44, a od glavnog puta ga deli joÅ¡ jedan plac preko koga je put Å¡irine 3m koji vodi do ovog placa. Gradska voda i struja su na ulici, taÄnije na udaljenosti od 30m. Plac je Å¡irine 38m, a duÅ¾ine 40m i pod veoma blagim nagibom. Kontakt tel. agenta: 063/575 359 Dragoljub BurdziÄ‡ Agencijska provizija 2%","Poljoprivredno zemljiÅ¡te na prodaju, UstaniÄka, 27.000â‚¬, 15a - 4zida",2024-03-02
356,https://www.4zida.rs/prodaja-placeva/gradske-lokacije-aleksinac/gradjevinsko-zemljiste/63887099483a9d62a60236b4,graÄ‘evinsko zemljiÅ¡te ,30.3 a ,,p,pre 10 meseci ,10.000,Desimira JoviÄ‡a ÄŒiÄe,"Gradske lokacije, Aleksinac","<h2 _ngcontent-ng-c3151048826 class=""mat-headline-5"">Opis oglasa</h2><div _ngcontent-ng-c3151048826 class=""prose max-h-64 overflow-hidden text-gray-800 ng-star-inserted""><p>Na prodaju plac u Aleksincu odlican za izgradnju kuce iznad parka Brdjanka. Oko placa su kuce.								","GraÄ‘evinsko zemljiÅ¡te na prodaju, Desimira JoviÄ‡a ÄŒiÄe, 10.000â‚¬, 30a - 4zida",2024-03-02
357,https://www.4zida.rs/prodaja-placeva/aradac-okolne-lokacije-zrenjanin/gradjevinsko-zemljiste/60d490fed30f672f7e04798f,graÄ‘evinsko zemljiÅ¡te ,121.91 a ,uknjiÅ¾eno ,42622 ,pre 10 meseci ,48.764,Aradac,"Aradac, Okolne lokacije, Zrenjanin","<h2 _ngcontent-ng-c3151048826 class=""mat-headline-5"">Opis oglasa</h2><div _ngcontent-ng-c3151048826 class=""prose max-h-64 overflow-hidden text-gray-800 ng-star-inserted""><p>Na prodaju poljoprivredno zemljiÅ¡te na periferiji Aradca. ZemljiÅ¡te je povrÅ¡ine 12191m2 i proseÄne dimenzije su: front 37m, dubina 382m2. ZemljiÅ¡te ima izlaz na magistralni put Zrenjanin-Novi Sad sa jedne, i na kolski put sa druge strane. UknjiÅ¾eno, bez tereta i zabeleÅ¾bi.<br>Agencijska provizija 1,5% od kupoprodajne cene. Agencijska provizija 1,5%.  ID oglasa: 42622.","GraÄ‘evinsko zemljiÅ¡te na prodaju, Aradac, 48.764â‚¬, 121a - 4zida",2024-03-02
358,https://www.4zida.rs/prodaja-placeva/gradske-lokacije-lajkovac/gradjevinsko-zemljiste/6536914f434b71725404b3d6,graÄ‘evinsko zemljiÅ¡te ,736 a ,uknjiÅ¾eno ,1050 ,pre 2 meseca ,350.000,Gradske lokacije,"Gradske lokacije, Lajkovac","<h2 _ngcontent-ng-c3151048826 class=""mat-headline-5"">Opis oglasa</h2><div _ngcontent-ng-c3151048826 class=""prose max-h-64 overflow-hidden text-gray-800 ng-star-inserted""><p>Na 80 km od Beograda u selu JabuÄje kod Lajkovca prodajemo poljoprivredno zemljiÅ¡te sa halom. Selo JabuÄje udaljeno je 8km od autoputa MiloÅ¡ Veliki i povezano sa Ibarskom magistralom. Upravo ovakva lokacija uticala je da se u samom selu otvori proizvodni pogon nemaÄke fabrike IGB Automotiv. Selo je idealno za Å¾ivot: ima dom zdravlja, osnovnu Å¡kolu, poÅ¡tu, fudbalski klub, prodavnice. Postoji celodnevna, redovna autobuska linija za Lajkovac i Lazarevac.<br>Do parcele se dolazi asfaltnim putem koji ima uliÄnu rasvetu, na samoj parceli je gradska voda ( postoji moguÄ‡nost izgradnje i arteskog bunara) i kanalizacija. Ono Å¡to ovu parcelu Äini jedinstvenom je trafo stanica koja je u privatnom vlasniÅ¡tvu jaÄine 100kw i trofazna struja. Parcela je u vlasniÅ¡tvu fiziÄkog lica povrÅ¡ine 7,36 ha sa uknjiÅ¾enim objektima. Plac je ograÄ‘en celom povrÅ¡inom, obezbeÄ‘en video nadzorom.<br>Pogodna je za nastavak uzgoja stoke u postojeÄ‡im objektima ili izgradnju fabriÄkog ili magacinskog prostora.","GraÄ‘evinsko zemljiÅ¡te na prodaju, Gradske lokacije, 350.000â‚¬, 736a - 4zida",2024-03-02
359,https://www.4zida.rs/prodaja-placeva/centar-gradske-lokacije-kraljevo/gradjevinsko-zemljiste/64f0d0c12d5b0f99a00d6b9c,,,,,,,,,,"GraÄ‘evinsko zemljiÅ¡te na prodaju, dositejeva, 54.000â‚¬, 12a - 4zida",2024-03-02
360,https://www.4zida.rs/prodaja-placeva/kac-okolne-lokacije-novi-sad/gradjevinsko-zemljiste/65800b819e2e4a857a0f73a0,,,,,,,,,,"Prodaja placeva KaÄ‡, Okolne lokacije, Novi Sad, GraÄ‘evinsko zemljiÅ¡te - 4zida",2024-03-02
361,https://www.4zida.rs/prodaja-placeva/bubanj-palilula-gradske-lokacije-nis/gradjevinsko-zemljiste/635f920dfb90d961af046c04,graÄ‘evinsko zemljiÅ¡te ,17.28 a ,,p,pre 10 meseci ,18.000,KovanluÄka,"Bubanj, Palilula, Gradske lokacije, NiÅ¡","<h2 _ngcontent-ng-c3151048826 class=""mat-headline-5"">Opis oglasa</h2><div _ngcontent-ng-c3151048826 class=""prose max-h-64 overflow-hidden text-gray-800 ng-star-inserted""><p>Na prodaju plac u blizini Novog groblja, povrÅ¡ine 1728 m2. Plac je gradsko graÄ‘evinsko zemljiÅ¡te. UknjiÅ¾en, Äisto vlasniÅ¡tvo , privatna svojina 1 kroz 1. Ovo je samo deo naÅ¡e ponude, ovu kao i druge nekretnine moÅ¾ete pogledati na naÅ¡em sajtu. Za viÅ¡e informacija slobodno pozovite.","GraÄ‘evinsko zemljiÅ¡te na prodaju, KovanluÄka, 18.000â‚¬, 17a - 4zida",2024-03-02
362,https://www.4zida.rs/prodaja-placeva/beli-potok-vozdovac-opstina-beograd/gradjevinsko-zemljiste/63fcf61e430b43a3fc00d817,graÄ‘evinsko zemljiÅ¡te ,200 a ,,1932 ,pre 5 meseci ,520.000,Vase ÄŒarapiÄ‡a,"Beli Potok, VoÅ¾dovac opÅ¡tina, Beograd","<h2 _ngcontent-ng-c3151048826 class=""mat-headline-5"">Opis oglasa</h2><div _ngcontent-ng-c3151048826 class=""prose max-h-64 overflow-hidden text-gray-800 ng-star-inserted""><p>Nekretnine Optimist vam nude 2 ha graÄ‘evinskog zemljiÅ¡ta - 800m od centra Belog potoka ka Ikei.<br>400m je bez asfalta, put je u izgradnji.<br>Pristup placu iz dva pravca.<br>Tri parcele spojene -  pristup zemljiÅ¡tu sa puta.<br>Cena je 2600 eura/ar, i nije fiksna.","GraÄ‘evinsko zemljiÅ¡te na prodaju, Vase ÄŒarapiÄ‡a, 520.000â‚¬, 200a - 4zida",2024-03-02
363,https://www.4zida.rs/prodaja-placeva/cortanovci-okolne-lokacije-indjija/gradjevinsko-zemljiste/6489ea5e9a876319000f2ba4,graÄ‘evinsko zemljiÅ¡te ,11 a ,,18348 ,pre 1 mesec ,19.900,ÄŒortanovci,"ÄŒortanovci, Okolne lokacije, InÄ‘ija","<h2 _ngcontent-ng-c3151048826 class=""mat-headline-5"">Opis oglasa</h2><div _ngcontent-ng-c3151048826 class=""prose max-h-64 overflow-hidden text-gray-800 ng-star-inserted""><p>Plac za gradnju, na izuzetnoj lokaciji!","GraÄ‘evinsko zemljiÅ¡te na prodaju, ÄŒortanovci, 19.900â‚¬, 11a - 4zida",2024-03-02
364,https://www.4zida.rs/prodaja-placeva/popovac-okolne-lokacije-nis/gradjevinsko-zemljiste/64c399691d4949a44f02063d,graÄ‘evinsko zemljiÅ¡te ,57.97 a ,,p,pre 7 meseci ,60.000,Popovac,"Popovac, Okolne lokacije, NiÅ¡","<h2 _ngcontent-ng-c3151048826 class=""mat-headline-5"">Opis oglasa</h2><div _ngcontent-ng-c3151048826 class=""prose max-h-64 overflow-hidden text-gray-800 ng-star-inserted""><p>Na prodaju plac u Popovcu, 58 ari, 60.000e. Plac je graÄ‘evinsko zemljiÅ¡te i nalazi se na asfaltiranoj ulici sa moguÄ‡noÅ¡Ä‡u prikljuÄka na struju, vodu i kanalizaciju. Trenutno je na placu zasad pÅ¡enice, voÄ‡njak, vinograd i zasad oraha. Nalazi se na samo par kilometara od centra NiÅ¡a pa je pogodan za izgradnju stambenog objekta. UknjiÅ¾en je, urednog vlasniÅ¡tva. Ovo je samo deo naÅ¡e ponude, za viÅ¡e informacija, stojimo vam na raspolaganju.","GraÄ‘evinsko zemljiÅ¡te na prodaju, Popovac, 60.000â‚¬, 57a - 4zida",2024-03-02
365,https://www.4zida.rs/prodaja-placeva/banja-vrdnik-okolne-lokacije-irig/gradjevinsko-zemljiste/637de3b6f6e86371d9016716,,,,,,,,,,"GraÄ‘evinsko zemljiÅ¡te na prodaju, Banja Vrdnik, 145.000â‚¬, 12a - 4zida",2024-03-02
366,https://www.4zida.rs/prodaja-placeva/rogaca-sopot-opstina-beograd/gradjevinsko-zemljiste/63ca426d8ee59dba7602dfc0,,,,,,,,,,"Prodaja placeva RogaÄa, Sopot opÅ¡tina, Beograd, GraÄ‘evinsko zemljiÅ¡te - 4zida",2024-03-02
367,https://www.4zida.rs/prodaja-placeva/zeljeznicko-naselje-gradske-lokacije-subotica/gradjevinsko-zemljiste/64d61bc1c063f7907500dd89,graÄ‘evinsko zemljiÅ¡te ,4.4 a ,uknjiÅ¾eno ,1379 ,pre 1 mesec ,16.000,Å½eljezniÄko Naselje,"Å½eljezniÄko Naselje, Gradske lokacije, Subotica","<h2 _ngcontent-ng-c3151048826 class=""mat-headline-5"">Opis oglasa</h2><div _ngcontent-ng-c3151048826 class=""prose max-h-64 overflow-hidden text-gray-800 ng-star-inserted""><p>Subotica, Å½elezniÄko naselje, prodaje se graÄ‘evinsko zemljiÅ¡te, blizu majÅ¡anskog mosta.","GraÄ‘evinsko zemljiÅ¡te na prodaju, Å½eljezniÄko Naselje, 16.000â‚¬, 4a - 4zida",2024-03-02
368,https://www.4zida.rs/prodaja-placeva/pinosava-vozdovac-opstina-beograd/gradjevinsko-zemljiste/64a5555139eda3e487054328,graÄ‘evinsko zemljiÅ¡te ,33 a ,uknjiÅ¾eno ,1486 ,pre 7 meseci ,72.600,Pinosava,"Pinosava, VoÅ¾dovac opÅ¡tina, Beograd","<h2 _ngcontent-ng-c3151048826 class=""mat-headline-5"">Opis oglasa</h2><div _ngcontent-ng-c3151048826 class=""prose max-h-64 overflow-hidden text-gray-800 ng-star-inserted""><p>Na prodaju plac u blizini crkve u Pinosavi. Oko 50 metara od asfalta. Gradsko graÄ‘evinsko zemljiÅ¡te. PrikljuÄci za struju i vodu u blizini placa.","GraÄ‘evinsko zemljiÅ¡te na prodaju, Pinosava, 72.600â‚¬, 33a - 4zida",2024-03-02
369,https://www.4zida.rs/prodaja-placeva/petrovac-gradske-lokacije-kragujevac/gradjevinsko-zemljiste/64952b13faaad622a40240ea,,,,,,,,,,"GraÄ‘evinsko zemljiÅ¡te na prodaju, Solinska 37, 50.000â‚¬, 8a - 4zida",2024-03-02
370,https://www.4zida.rs/prodaja-placeva/sumarice-gradske-lokacije-kragujevac/gradjevinsko-zemljiste/646f9988016b6f47860e5c58,,,,,,,,,,"Prodaja placeva Å umarice, Gradske lokacije, Kragujevac, GraÄ‘evinsko zemljiÅ¡te - 4zida",2024-03-02
371,https://www.4zida.rs/prodaja-placeva/bozdarevac-barajevo-opstina-beograd/gradjevinsko-zemljiste/635175c81102cb17f90cef2f,graÄ‘evinsko zemljiÅ¡te ,63 a ,uknjiÅ¾eno ,3145 ,pre 10 meseci ,38.000,Tatarinska,"BoÅ¾darevac, Barajevo opÅ¡tina, Beograd","<h2 _ngcontent-ng-c3151048826 class=""mat-headline-5"">Opis oglasa</h2><div _ngcontent-ng-c3151048826 class=""prose max-h-64 overflow-hidden text-gray-800 ng-star-inserted""><p>OdliÄan, ravan plac, na dobroj poziciji, pogodan za razne namene, od porodiÄne gradnje, do poljoprivrednih delatnosti (u graÄ‘evinskoj zoni). Struja, voda i gas na pet metara od placa. Za svaku preporuku!","GraÄ‘evinsko zemljiÅ¡te na prodaju, Tatarinska, 38.000â‚¬, 63a - 4zida",2024-03-02
372,https://www.4zida.rs/prodaja-placeva/donji-racnik-okolne-lokacije-jagodina/gradjevinsko-zemljiste/6399ebabbe14d5082d0a639a,graÄ‘evinsko zemljiÅ¡te ,0.82 a ,,6332 ,pre 10 meseci ,25.000,Donji RaÄnik,"Donji RaÄnik, Okolne lokacije, Jagodina","<h2 _ngcontent-ng-c3151048826 class=""mat-headline-5"">Opis oglasa</h2><div _ngcontent-ng-c3151048826 class=""prose max-h-64 overflow-hidden text-gray-800 ng-star-inserted""><p>GraÄ‘evinsko zemljiÅ¡te pogodno za izgradnju i razlicite delatnosti. Nalazi se uz glavni put. Zasebna je parcela od 15,09ari i tu je suma.<br>Ponudite Vasu cenu!","GraÄ‘evinsko zemljiÅ¡te na prodaju, Donji RaÄnik, 25.000â‚¬, 0a - 4zida",2024-03-02
373,https://www.4zida.rs/prodaja-placeva/strmosten-okolne-lokacije-despotovac/gradjevinsko-zemljiste/64f18ab73134b78b600e7587,,,,,,,,,,"GraÄ‘evinsko zemljiÅ¡te na prodaju, Lisine, 25.000â‚¬, 200a - 4zida",2024-03-02
374,https://www.4zida.rs/prodaja-placeva/makis-cukarica-cukarica-opstina-beograd/gradjevinsko-zemljiste/60140c136854f343147c6ba1,,,,,,,,,,"GraÄ‘evinsko zemljiÅ¡te na prodaju, MakiÅ¡, 16.000â‚¬, 4a - 4zida",2024-03-02
375,https://www.4zida.rs/prodaja-placeva/parcani-sopot-opstina-beograd/gradjevinsko-zemljiste/626a708e6b163a631142e9e3,,,,,,,,,,"GraÄ‘evinsko zemljiÅ¡te na prodaju, Milosava JovanoviÄ‡a Zeke 96, 13.900â‚¬, 10a - 4zida",2024-03-02
376,https://www.4zida.rs/prodaja-placeva/glumcevo-brdo-barajevo-barajevo-opstina-beograd/gradjevinsko-zemljiste/63e6349a661384cc4f05881d,,,,,,,,,,"GraÄ‘evinsko zemljiÅ¡te na prodaju, GlumÄevo brdo 125a, 49.900â‚¬, 22a - 4zida",2024-03-02
377,https://www.4zida.rs/prodaja-placeva/prva-kutina-okolne-lokacije-nis/gradjevinsko-zemljiste/62dd670cd0ae03263006a1bc,,,,,,,,,,"GraÄ‘evinsko zemljiÅ¡te na prodaju, Banjski put bb, 9.000â‚¬, 5a - 4zida",2024-03-02
378,https://www.4zida.rs/prodaja-placeva/kovaci-gradske-lokacije-kraljevo/gradjevinsko-zemljiste/63dce64f1cc699a7da0135a2,,,,,,,,,,"Prodaja placeva KovaÄi, Gradske lokacije, Kraljevo, GraÄ‘evinsko zemljiÅ¡te - 4zida",2024-03-02
379,https://www.4zida.rs/prodaja-placeva/gornji-asambair-gradske-lokacije-vranje/gradjevinsko-zemljiste/620856e41c7e083ade4b454a,,,,,,,,,,"GraÄ‘evinsko zemljiÅ¡te na prodaju, Gornji Asambair, 15.000â‚¬, 750a - 4zida",2024-03-02
380,https://www.4zida.rs/prodaja-placeva/barajevo-barajevo-opstina-beograd/gradjevinsko-zemljiste/62540f819eecbe236a6c9b05,,,,,,,,,,"GraÄ‘evinsko zemljiÅ¡te na prodaju, Barajevo, 95.000â‚¬, 19a - 4zida",2024-03-02
381,https://www.4zida.rs/prodaja-placeva/lisovic-barajevo-opstina-beograd/gradjevinsko-zemljiste/632b6673d965b97d880eaa0d,,,,,,,,,,"GraÄ‘evinsko zemljiÅ¡te na prodaju, LisoviÄ‡, 20.000â‚¬, 22a - 4zida",2024-03-02
382,https://www.4zida.rs/prodaja-placeva/beska-okolne-lokacije-indjija/gradjevinsko-zemljiste/63bad9713565a15dfc03ff10,,,,,,,,,,"GraÄ‘evinsko zemljiÅ¡te na prodaju, Kockina, 25.000â‚¬, 22a - 4zida",2024-03-02
383,https://www.4zida.rs/prodaja-placeva/koracica-mladenovac-opstina-beograd/gradjevinsko-zemljiste/65b58f770512f8a2e9003eac,graÄ‘evinsko zemljiÅ¡te ,10.57 a ,uknjiÅ¾eno ,1396 ,pre 34 dana ,10.000,Petkajska,"KoraÄ‡ica, Mladenovac opÅ¡tina, Beograd","<h2 _ngcontent-ng-c3151048826 class=""mat-headline-5"">Opis oglasa</h2><div _ngcontent-ng-c3151048826 class=""prose max-h-64 overflow-hidden text-gray-800 ng-star-inserted""><p>JugoistoÄne padine Kosmaja, plac pravougaonog oblika u graÄ‘evinskom podruÄju,  pored asfaltnog puta, prikljuÄak za struju i vodu pored placa. Plac je uknjiÅ¾en sa vlasnistvom 1/1.<br>Postoji moguÄ‡nost kupovine joÅ¡ dve uknjiÅ¾ene  parcele koje se oslanjaju na ovaj plac  povrÅ¡ine  27 ari na kojima je takoÄ‘e dozvoljena gradnja.<br>Plac je osunÄan I pogodan za razne zasade.","GraÄ‘evinsko zemljiÅ¡te na prodaju, Petkajska, 10.000â‚¬, 10a - 4zida",2024-03-02
384,https://www.4zida.rs/prodaja-placeva/glavica-sremska-kamenica-gradske-lokacije-novi-sad/gradjevinsko-zemljiste/6565b903577fb674d9030f84,,,,,,,,,,"Prodaja placeva Glavica, Sremska Kamenica, Gradske lokacije, Novi Sad, GraÄ‘evinsko zemljiÅ¡te - 4zida",2024-03-02
385,https://www.4zida.rs/prodaja-placeva/pescara-gradske-lokacije-subotica/gradjevinsko-zemljiste/651c5c620607a9a76c06dda8,graÄ‘evinsko zemljiÅ¡te ,37 a ,uknjiÅ¾eno ,1419 ,pre 2 dana ,12.000,PeÅ¡Äara,"PeÅ¡Äara, Gradske lokacije, Subotica","<h2 _ngcontent-ng-c3151048826 class=""mat-headline-5"">Opis oglasa</h2><div _ngcontent-ng-c3151048826 class=""prose max-h-64 overflow-hidden text-gray-800 ng-star-inserted""><p>Lep veliki graÄ‘evinski plac izmeÄ‘u Kelebije i Subotice 3675 kvm ukupne povrÅ¡ine. UliÄni front 32 m , duÅ¾ina placa113 m .Ispred placa ima asfalt . Mirna ulica , miran kraj .","GraÄ‘evinsko zemljiÅ¡te na prodaju, PeÅ¡Äara, 12.000â‚¬, 37a - 4zida",2024-03-02
386,https://www.4zida.rs/prodaja-placeva/resnik-okolne-lokacije-kragujevac/gradjevinsko-zemljiste/64f3278fc3b3481eef02986d,,,,,,,,,,"Prodaja placeva Resnik, Okolne lokacije, Kragujevac, GraÄ‘evinsko zemljiÅ¡te - 4zida",2024-03-02
387,https://www.4zida.rs/prodaja-placeva/gradske-lokacije-zlatibor/gradjevinsko-zemljiste/6149d211ac26311c390e67e3,,,,,,,,,,"GraÄ‘evinsko zemljiÅ¡te na prodaju, Gradske lokacije, 8.000â‚¬, 4a - 4zida",2024-03-02
388,https://www.4zida.rs/prodaja-placeva/carina-gradske-lokacije-sokobanja/gradjevinsko-zemljiste/6584abab2f2acf8462045af9,graÄ‘evinsko zemljiÅ¡te ,3 a ,uknjiÅ¾eno ,,pre 3 dana ,14.000,Lovacka Bb,"Carina, Gradske lokacije, Sokobanja","<h2 _ngcontent-ng-c3151048826 class=""mat-headline-5"">Opis oglasa</h2><div _ngcontent-ng-c3151048826 class=""prose max-h-64 overflow-hidden text-gray-800 ng-star-inserted""><p>Na prodaju plac sa temeljom 8x5,5 u Sokobanji sa 3 ari na carini nedaleko od sokoterma 900 metara ( prve 4 slike )","GraÄ‘evinsko zemljiÅ¡te na prodaju, Lovacka Bb, 14.000â‚¬, 3a - 4zida",2024-03-02
389,https://www.4zida.rs/prodaja-placeva/visnjak-gradske-lokacije-kragujevac/gradjevinsko-zemljiste/653fbc2c175887d34d04785d,graÄ‘evinsko zemljiÅ¡te ,8.5 a ,uknjiÅ¾eno ,PZ3010231445VJ ,pre 4 meseca ,32.000,ViÅ¡njak,"ViÅ¡njak, Gradske lokacije, Kragujevac","<h2 _ngcontent-ng-c3151048826 class=""mat-headline-5"">Opis oglasa</h2><div _ngcontent-ng-c3151048826 class=""prose max-h-64 overflow-hidden text-gray-800 ng-star-inserted""><p>Prodaje se plac u Kragujevcu - naselje ViÅ¡njak","GraÄ‘evinsko zemljiÅ¡te na prodaju, ViÅ¡njak, 32.000â‚¬, 8a - 4zida",2024-03-02
