,link,Tip,PovrÅ¡ina,UknjiÅ¾enost,Å ifra oglasa,Oglas aÅ¾uriran,price,street,address,description,title,end_date
215,https://www.4zida.rs/prodaja-placeva/zeleznik-cukarica-cukarica-opstina-beograd/gradjevinsko-zemljiste/6585807b92964bf81d00b846,graÄ‘evinsko zemljiÅ¡te ,6 a ,uknjiÅ¾eno ,1972 ,pre 11 dana ,45.000,Bosiljke JaniÄ‡,"Å½eleznik, ÄŒukarica, ÄŒukarica opÅ¡tina, Beograd","<h2 _ngcontent-ng-c3151048826 class=""mat-headline-5"">Opis oglasa</h2><div _ngcontent-ng-c3151048826 class=""prose max-h-64 overflow-hidden text-gray-800 ng-star-inserted""><p>Plac je ravan,ograÄ‘en i pravilnog oblika.Ulica je asfaltirana i njom prolazi struja,voda i kanalizacija. .","GraÄ‘evinsko zemljiÅ¡te na prodaju, Bosiljke JaniÄ‡, 45.000â‚¬, 6a - 4zida",2024-03-02
216,https://www.4zida.rs/prodaja-placeva/jajinci-vozdovac-opstina-beograd/gradjevinsko-zemljiste/65ba2628f67349ca45005c21,,,,,,,,,,"GraÄ‘evinsko zemljiÅ¡te na prodaju, Zorice Bozovic 13, 70.000â‚¬, 5a - 4zida",2024-03-02
217,https://www.4zida.rs/prodaja-placeva/donji-matejevac-okolne-lokacije-nis/gradjevinsko-zemljiste/63ff6c2f836e4fe94007f5fc,graÄ‘evinsko zemljiÅ¡te ,13.08 a ,uknjiÅ¾eno ,p,pre 10 meseci ,7.550,Donji Matejevac,"Donji Matejevac, Okolne lokacije, NiÅ¡","<h2 _ngcontent-ng-c3151048826 class=""mat-headline-5"">Opis oglasa</h2><div _ngcontent-ng-c3151048826 class=""prose max-h-64 overflow-hidden text-gray-800 ng-star-inserted""><p>Na prodaju odliÄan plac u Donjem Matejevcu. Plac je poljoprivredno zemljiÅ¡te, ukupne povrÅ¡ine 1308m2. UknjiÅ¾en, Äisto vlasniÅ¡tvo. Ovo je samo deo naÅ¡e ponude, ovu kao i ostale ponude sa veÄ‡im brojem fotografija moÅ¾ete pogledati na naÅ¡em sajtu.","GraÄ‘evinsko zemljiÅ¡te na prodaju, Donji Matejevac, 7.550â‚¬, 13a - 4zida",2024-03-02
218,https://www.4zida.rs/prodaja-placeva/ropocevo-sopot-opstina-beograd/gradjevinsko-zemljiste/650ad662cd05ffbfca0567ff,,,,,,,,,,"Prodaja placeva RopoÄevo, Sopot opÅ¡tina, Beograd, GraÄ‘evinsko zemljiÅ¡te - 4zida",2024-03-02
219,https://www.4zida.rs/prodaja-placeva/korman-okolne-lokacije-kragujevac/gradjevinsko-zemljiste/64e5f890a150d78775020456,graÄ‘evinsko zemljiÅ¡te ,31.26 a ,,p,pre 6 meseci ,17.000,Kormanski put,"Korman, Okolne lokacije, Kragujevac","<h2 _ngcontent-ng-c3151048826 class=""mat-headline-5"">Opis oglasa</h2><div _ngcontent-ng-c3151048826 class=""prose max-h-64 overflow-hidden text-gray-800 ng-star-inserted""><p>Na prodaju zemljiÅ¡te u Kormanu - Korman polje. ZemljiÅ¡te je njiva druge klase u graÄ‘evinskom podruÄju. Na parceli nema struja i voda.Prilaz do parcele seoskim putem. Ovo je topla preporuka Bulevar grupe. Za sve informacije i razgledanje stojimo vam na raspolaganju, radnim danima od 09-19h i subotom od 09-17h. Ovu i druge nekretnine sa veÄ‡im brojem fotografija moÅ¾ete pogledati na naÅ¡em sajtu: bulevarnekretnine.rs, kontakt: info@bulevarnekretnine.rs, usluga besplatna. ÄŒekamo Vas. Telefon 034/330808 i 060/0544253. Bulevar Nekretnine 034, Kragujevac, broj u registru posrednika: 1278.","GraÄ‘evinsko zemljiÅ¡te na prodaju, Kormanski put, 17.000â‚¬, 31a - 4zida",2024-03-02
220,https://www.4zida.rs/prodaja-placeva/cerat-okolne-lokacije-sremski-karlovci/gradjevinsko-zemljiste/655dc8d6d0d8a71e4d060a39,,,,,,,,,,"Prodaja placeva ÄŒerat, Okolne lokacije, Sremski Karlovci, GraÄ‘evinsko zemljiÅ¡te - 4zida",2024-03-02
221,https://www.4zida.rs/prodaja-placeva/sremska-kamenica-gradske-lokacije-novi-sad/gradjevinsko-zemljiste/5cac878f9a309162ca3a6f12,,,,,,,,,,"GraÄ‘evinsko zemljiÅ¡te na prodaju, Sremska Kamenica, 110.000â‚¬, 21a - 4zida",2024-03-02
222,https://www.4zida.rs/prodaja-placeva/zeleznicki-most-gradske-lokacije-jagodina/gradjevinsko-zemljiste/64dbaeee1d2b6c5b1d05daf6,,,,,,,,,,"Prodaja placeva Å½elezniÄki most, Gradske lokacije, Jagodina, GraÄ‘evinsko zemljiÅ¡te - 4zida",2024-03-02
223,https://www.4zida.rs/prodaja-placeva/petrovac-gradske-lokacije-kragujevac/gradjevinsko-zemljiste/61a8b4ef12d9c1512273e547,graÄ‘evinsko zemljiÅ¡te ,116.23 a ,,p,pre 10 meseci ,72.100,Internacionalnih brigada,"Petrovac, Gradske lokacije, Kragujevac","<h2 _ngcontent-ng-c3151048826 class=""mat-headline-5"">Opis oglasa</h2><div _ngcontent-ng-c3151048826 class=""prose max-h-64 overflow-hidden text-gray-800 ng-star-inserted""><p>Na prodaju plac od 116,23 ari. Plac se nalazi u naselju Petrovac nedaleko od magistralnog puta Kragujevac Topola. Plac se sastoji iz 4 parcele od kojih je 20,99 ari pod Å¡umom a 95,24 ari su njive. Prelep osunÄani plac. Ovo je topla preporuka Bulevar grupe. Za sve informacije i razgledanje stojimo vam na raspolaganju, radnim danom od 09-19h i subotom od 09-17h. Ovu i druge nekretnine sa veÄ‡im brojem fotografija moÅ¾ete pogledati na naÅ¡em sajtu: bulevarnekretnine.rs, kontakt: info@bulevarnekretnine.rs, usluga besplatna. Äekamo Vas. Telefon 034/330808, 060/0544253. Bulevar nekretnine 034 Kragujevac, broj u registru posrednika: 1278.","GraÄ‘evinsko zemljiÅ¡te na prodaju, Internacionalnih brigada, 72.100â‚¬, 116a - 4zida",2024-03-02
224,https://www.4zida.rs/prodaja-placeva/mihajlovo-okolne-lokacije-zrenjanin/gradjevinsko-zemljiste/62d1137a406c99a326061405,graÄ‘evinsko zemljiÅ¡te ,7.21 a ,,24859 ,pre 5 meseci ,4.000,Mihajlovo,"Mihajlovo, Okolne lokacije, Zrenjanin","<h2 _ngcontent-ng-c3151048826 class=""mat-headline-5"">Opis oglasa</h2><div _ngcontent-ng-c3151048826 class=""prose max-h-64 overflow-hidden text-gray-800 ng-star-inserted""><p>Mihajlovo - zapoÄeta trosobna kuÄ‡a povrÅ¡ine oko 80m2 na placu od 7,21 ar. KuÄ‡a je zapoÄeta 80-ih i graÄ‘ena je od giter blokova, zavrÅ¡ena do prve ploÄe, neodrÅ¾avana, nije omalterisana, nema prikljuÄak struje i vode, nema kolski ulaz, uliÄni front oko 13m, ima prikljuÄak plina do parcele.<br>Agencijska provizija za kupca je 1,5%, odnosno minimalno 300 evra.","GraÄ‘evinsko zemljiÅ¡te na prodaju, Mihajlovo, 4.000â‚¬, 7a - 4zida",2024-03-02
225,https://www.4zida.rs/prodaja-placeva/industrijska-zona-gradske-lokacije-jagodina/gradjevinsko-zemljiste/644d2a8eba5267636405bca1,graÄ‘evinsko zemljiÅ¡te ,80 a ,,2986 ,pre 10 meseci ,78.500,Industrijska Zona,"Industrijska Zona, Gradske lokacije, Jagodina","<h2 _ngcontent-ng-c3151048826 class=""mat-headline-5"">Opis oglasa</h2><div _ngcontent-ng-c3151048826 class=""prose max-h-64 overflow-hidden text-gray-800 ng-star-inserted""><p>*nema objekata na placu<br>*postoji moguÄ‡nost prikljuÄka za struju i vodu","GraÄ‘evinsko zemljiÅ¡te na prodaju, Industrijska Zona, 78.500â‚¬, 80a - 4zida",2024-03-02
226,https://www.4zida.rs/prodaja-placeva/zdraljica-belosevac-gradske-lokacije-kragujevac/gradjevinsko-zemljiste/64ad1e83892e1e07cd0145cb,graÄ‘evinsko zemljiÅ¡te ,17.01 a ,uknjiÅ¾eno ,2846 ,pre 7 meseci ,22.000,Å½draljica,"Å½draljica, BeloÅ¡evac, Gradske lokacije, Kragujevac","<h2 _ngcontent-ng-c3151048826 class=""mat-headline-5"">Opis oglasa</h2><div _ngcontent-ng-c3151048826 class=""prose max-h-64 overflow-hidden text-gray-800 ng-star-inserted""><p>Plac se nalazi u Å½draljici, deo bliÅ¾e Bresnici,Â  povrÅ¡ine 17,01 ar, moguÄ‡nost za sve prikljuÄke za koje postoji odobrenje. ZemljiÅ¡te je u graÄ‘evinskom podruÄju i postoji graÄ‘evinska dozvola za 117 kvm. UKNJIÅ½ENO","GraÄ‘evinsko zemljiÅ¡te na prodaju, Å½draljica, 22.000â‚¬, 17a - 4zida",2024-03-02
227,https://www.4zida.rs/prodaja-placeva/gradske-lokacije-kraljevo/gradjevinsko-zemljiste/641d9c4ce1ab45798006e7fd,,,,,,,,,,"GraÄ‘evinsko zemljiÅ¡te na prodaju, BaÅ¡tovanska, 1â‚¬, 75a - 4zida",2024-03-02
228,https://www.4zida.rs/prodaja-placeva/temerinska-pijaca-salajka-gradske-lokacije-novi-sad/gradjevinsko-zemljiste/6419bac0ab5ea0793e0484ad,,,,,,,,,,"GraÄ‘evinsko zemljiÅ¡te na prodaju, Temerinska 74, 500.000â‚¬, 17a - 4zida",2024-03-02
229,https://www.4zida.rs/prodaja-placeva/kremna-okolne-lokacije-uzice/gradjevinsko-zemljiste/5e42967b0c7cde09326a1893,,,,,,,,,,"GraÄ‘evinsko zemljiÅ¡te na prodaju, Centar Bb, 30.000â‚¬, 14a - 4zida",2024-03-02
230,https://www.4zida.rs/prodaja-placeva/novi-futog-futog-okolne-lokacije-novi-sad/gradjevinsko-zemljiste/624697c1c70748006643a405,,,,,,,,,,"GraÄ‘evinsko zemljiÅ¡te na prodaju, Futog, 30.000â‚¬, 6a - 4zida",2024-03-02
231,https://www.4zida.rs/prodaja-placeva/ducina-sopot-opstina-beograd/gradjevinsko-zemljiste/63b82fa68ff3f570300679b9,graÄ‘evinsko zemljiÅ¡te ,20.77 a ,uknjiÅ¾eno ,3511 ,pre 10 meseci ,19.000,Ljubomira IvkoviÄ‡a - Å uce,"DuÄina, Sopot opÅ¡tina, Beograd","<h2 _ngcontent-ng-c3151048826 class=""mat-headline-5"">Opis oglasa</h2><div _ngcontent-ng-c3151048826 class=""prose max-h-64 overflow-hidden text-gray-800 ng-star-inserted""><p>Na prodaju plac u graÄ‘evinskom podruÄju,u Kosmajskom selu DuÄina, PovrÅ¡ine 20.77 ari. Izuzetna lokacija, blizina centra sela, prodavnica, Å¡kole, ambulante,autobuskog stajaliÅ¡ta,igraliÅ¡ta. Plac ravan, uz opÅ¡tinski put, gradska voda i elektriÄna energija uz plac. Lepa nadmorska visina oko 350 m, sa pogledom na Kosmaj. MoguÄ‡nost dokupljivanja joÅ¡ jednog placa od 13 ari uz ovaj opisan. Cena nije fiksna. ","GraÄ‘evinsko zemljiÅ¡te na prodaju, Ljubomira IvkoviÄ‡a - Å uce, 19.000â‚¬, 20a - 4zida",2024-03-02
232,https://www.4zida.rs/prodaja-placeva/rusanj-cukarica-opstina-beograd/gradjevinsko-zemljiste/652d2ed941960f3477093150,,,,,,,,,,"GraÄ‘evinsko zemljiÅ¡te na prodaju, Moravska, 36.000â‚¬, 8a - 4zida",2024-03-02
233,https://www.4zida.rs/prodaja-placeva/kosmaj-sopot-opstina-beograd/gradjevinsko-zemljiste/63e527f64db5f57156072cbc,,,,,,,,,,"Prodaja placeva Kosmaj, Sopot opÅ¡tina, Beograd, GraÄ‘evinsko zemljiÅ¡te - 4zida",2024-03-02
234,https://www.4zida.rs/prodaja-placeva/barajevo-barajevo-opstina-beograd/gradjevinsko-zemljiste/6598b89c883da4248d05af06,graÄ‘evinsko zemljiÅ¡te ,0.34 a ,uknjiÅ¾eno ,41627 ,pre 1 mesec ,25.000,Barajevo,"Barajevo, Barajevo opÅ¡tina, Beograd","<h2 _ngcontent-ng-c3151048826 class=""mat-headline-5"">Opis oglasa</h2><div _ngcontent-ng-c3151048826 class=""prose max-h-64 overflow-hidden text-gray-800 ng-star-inserted""><p>Njiva na Å¡irem podruÄju urbanog dela naselja Barajevo u ulici GranÄarica, na potezu prema BaÄ‡evcu, Za svaku preporuku. (agencijska provizija 2%)","GraÄ‘evinsko zemljiÅ¡te na prodaju, Barajevo, 25.000â‚¬, 0a - 4zida",2024-03-02
235,https://www.4zida.rs/prodaja-placeva/nemenikuce-sopot-opstina-beograd/gradjevinsko-zemljiste/650d79f00fe8b898e106bb91,,,,,,,,,,"Prodaja placeva NemenikuÄ‡e, Sopot opÅ¡tina, Beograd, GraÄ‘evinsko zemljiÅ¡te - 4zida",2024-03-02
236,https://www.4zida.rs/prodaja-placeva/marsic-okolne-lokacije-kragujevac/gradjevinsko-zemljiste/61f448691f12dd4c60383b18,,,,,,,,,,"Prodaja placeva MarÅ¡iÄ‡, Okolne lokacije, Kragujevac, GraÄ‘evinsko zemljiÅ¡te - 4zida",2024-03-02
237,https://www.4zida.rs/prodaja-placeva/barajevo-barajevo-opstina-beograd/gradjevinsko-zemljiste/65326168148bfc640a04a2bd,,,,,,,,,,"GraÄ‘evinsko zemljiÅ¡te na prodaju, RadniÄka bb, 15.660â‚¬, 10a - 4zida",2024-03-02
238,https://www.4zida.rs/prodaja-placeva/malca-okolne-lokacije-nis/gradjevinsko-zemljiste/64536df238bb5eae5408cc06,graÄ‘evinsko zemljiÅ¡te ,166 a ,uknjiÅ¾eno ,p,pre 9 meseci ,340.000,MalÄa,"MalÄa, Okolne lokacije, NiÅ¡","<h2 _ngcontent-ng-c3151048826 class=""mat-headline-5"">Opis oglasa</h2><div _ngcontent-ng-c3151048826 class=""prose max-h-64 overflow-hidden text-gray-800 ng-star-inserted""><p>Na prodaju plac u neposrednoj blizini Malcanske petlje.								","GraÄ‘evinsko zemljiÅ¡te na prodaju, MalÄa, 340.000â‚¬, 166a - 4zida",2024-03-02
239,https://www.4zida.rs/prodaja-placeva/erdec-okolne-lokacije-kragujevac/gradjevinsko-zemljiste/65002105539176db80097c19,graÄ‘evinsko zemljiÅ¡te ,115 a ,uknjiÅ¾eno ,PZ0807231530VJ ,pre 5 meseci ,53.000,ErdeÄ,"ErdeÄ, Okolne lokacije, Kragujevac","<h2 _ngcontent-ng-c3151048826 class=""mat-headline-5"">Opis oglasa</h2><div _ngcontent-ng-c3151048826 class=""prose max-h-64 overflow-hidden text-gray-800 ng-star-inserted""><p>Prodaje se plac u Kragujevcu - naselje ErdeÄ","GraÄ‘evinsko zemljiÅ¡te na prodaju, ErdeÄ, 53.000â‚¬, 115a - 4zida",2024-03-02
240,https://www.4zida.rs/prodaja-placeva/sremska-kamenica-gradske-lokacije-novi-sad/gradjevinsko-zemljiste/64a5bb8c1025fad8450ed456,,,,,,,,,,"GraÄ‘evinsko zemljiÅ¡te na prodaju, Sremska Kamenica, 240.000â‚¬, 42a - 4zida",2024-03-02
241,https://www.4zida.rs/prodaja-placeva/niska-banja-gradske-lokacije-nis/gradjevinsko-zemljiste/61409b48c665fc06c1764668,graÄ‘evinsko zemljiÅ¡te ,10.67 a ,uknjiÅ¾eno ,p,pre 10 meseci ,52.000,NiÅ¡ka Banja,"NiÅ¡ka Banja, Gradske lokacije, NiÅ¡","<h2 _ngcontent-ng-c3151048826 class=""mat-headline-5"">Opis oglasa</h2><div _ngcontent-ng-c3151048826 class=""prose max-h-64 overflow-hidden text-gray-800 ng-star-inserted""><p>Na prodaju plac u NiÅ¡koj banji, povrÅ¡ine 1067 m2. Gradsko graÄ‘evinsko zemljiÅ¡te je,nalazi se na samom  jelaÅ¡niÄkom putu, na lokaciji pogodnoj za gradnju kako stambenog tako i poslovnog objekta.Tamponiran je i ima moguÄ‡nost prikljuÄka na vodovod, struju i kanalizaciju. UknjiÅ¾en je, Äisto vlasniÅ¡tvo. Ovo je samo deo naÅ¡e ponude, za viÅ¡e informacija, stojimo vam na raspolaganju.","GraÄ‘evinsko zemljiÅ¡te na prodaju, NiÅ¡ka Banja, 52.000â‚¬, 10a - 4zida",2024-03-02
242,https://www.4zida.rs/prodaja-placeva/baljkovac-okolne-lokacije-kragujevac/gradjevinsko-zemljiste/63a31619a1d58accb903a11d,graÄ‘evinsko zemljiÅ¡te ,62 a ,,p,pre 10 meseci ,13.000,BrÄ‘anska,"Baljkovac, Okolne lokacije, Kragujevac","<h2 _ngcontent-ng-c3151048826 class=""mat-headline-5"">Opis oglasa</h2><div _ngcontent-ng-c3151048826 class=""prose max-h-64 overflow-hidden text-gray-800 ng-star-inserted""><p>Na prodaju plac,  poljoprivredno zemljiÅ¡te u graÄ‘evinskom podruÄju, povrÅ¡ine 60 ari u Baljkovcu  . Prodaje se polovina njive. Nalazi se pored glavnog puta u neposrednoj blizini Å¡kole, prodavnice, autobuskog stajaliÅ¡ta, u tihom i mirnom okruÅ¾enju,  ima direktan ulaz sa asfaltiranog puta. MoguÄ‡nost prikljuÄka na celokupnu infrastrukturu. Za sve informacije i razgledanje stojimo vam na raspolaganju, radnim danima od 09-19h i subotom od 09-17h. Ovu i druge nekretnine sa veÄ‡im brojem fotografija moÅ¾ete pogledati na naÅ¡em sajtu: bulevarnekretnine.rs, kontakt: info@bulevarnekretnine.rs, usluga besplatna. ÄŒekamo Vas. Telefon 034/330808 i 060/0544253. Bulevar Nekretnine 034, Kragujevac, broj u registru posrednika: 1278.","GraÄ‘evinsko zemljiÅ¡te na prodaju, BrÄ‘anska, 13.000â‚¬, 62a - 4zida",2024-03-02
243,https://www.4zida.rs/prodaja-placeva/tometino-polje-okolne-lokacije-pozega/gradjevinsko-zemljiste/650724ca907cfb8872074325,,,,,,,,,,"GraÄ‘evinsko zemljiÅ¡te na prodaju, Tometino Polje, 61.000â‚¬, 122a - 4zida",2024-03-02
244,https://www.4zida.rs/prodaja-placeva/gabrovac-okolne-lokacije-nis/gradjevinsko-zemljiste/63f38fe6c09ff1cbca099d61,graÄ‘evinsko zemljiÅ¡te ,10.25 a ,,1827 ,pre 10 meseci ,27.500,Gabrovac,"Gabrovac, Okolne lokacije, NiÅ¡","<h2 _ngcontent-ng-c3151048826 class=""mat-headline-5"">Opis oglasa</h2><div _ngcontent-ng-c3151048826 class=""prose max-h-64 overflow-hidden text-gray-800 ng-star-inserted""><p>na prodaju plac u vikend naselju Gabrovac, do asvaltnog puta,povrÅ¡ine 10.25ari, do placa vodi asvaltni put, na placu je bunar i montaÅ¾na garaÅ¾a, blizu je struja... za viÅ¡e informacije pozvati:065/222 3922, 065/883 3446. Libo agencija upisana u registar posrednika pod brojem 495.","GraÄ‘evinsko zemljiÅ¡te na prodaju, Gabrovac, 27.500â‚¬, 10a - 4zida",2024-03-02
245,https://www.4zida.rs/prodaja-placeva/gradske-lokacije-vrbas/gradjevinsko-zemljiste/652bc33346a9e8c55e0b6601,,,,,,,,,,"GraÄ‘evinsko zemljiÅ¡te na prodaju, Save Kovacevica 128, 85.000â‚¬, 6a - 4zida",2024-03-02
246,https://www.4zida.rs/prodaja-placeva/borca-palilula-opstina-beograd/gradjevinsko-zemljiste/63b81efa8e78b2c3e804f472,,,,,,,,,,"Prodaja placeva BorÄa, Palilula opÅ¡tina, Beograd, GraÄ‘evinsko zemljiÅ¡te - 4zida",2024-03-02
247,https://www.4zida.rs/prodaja-placeva/donje-medjurovo-okolne-lokacije-nis/gradjevinsko-zemljiste/6470a4a3f76c3409a70ff075,graÄ‘evinsko zemljiÅ¡te ,25.11 a ,uknjiÅ¾eno ,3511 ,pre 3 meseca ,65.000,Donje MeÄ‘urovo,"Donje MeÄ‘urovo, Okolne lokacije, NiÅ¡","<h2 _ngcontent-ng-c3151048826 class=""mat-headline-5"">Opis oglasa</h2><div _ngcontent-ng-c3151048826 class=""prose max-h-64 overflow-hidden text-gray-800 ng-star-inserted""><p>Prodaje se graÄ‘evinska parcela na odliÄnoj lokaciji u naselju Donje MeÄ‘urovo. Parcela je pravougaonog obilka, povrÅ¡ine 25,11a. Nalazi se u blizini iskljuÄenja za autoput E-75 NiÅ¡- jug. Hvala Vam Å¡to ste pogledali oglas. Za viÅ¡e informacija o ovoj ili drugim nekretninama i zakazivanje razgledanja kontaktirajte agenta na broj telefona iz oglasa (poziv, sms, viber) ili putem e-maila. Kompletnu ponudu dostupnih nekretnina moÅ¾ete pronaÄ‡i na naÅ¡em sajtu.","GraÄ‘evinsko zemljiÅ¡te na prodaju, Donje MeÄ‘urovo, 65.000â‚¬, 25a - 4zida",2024-03-02
248,https://www.4zida.rs/prodaja-placeva/uciteljsko-naselje-zvezdara-opstina-beograd/gradjevinsko-zemljiste/6571f3aec5cf316a96079850,graÄ‘evinsko zemljiÅ¡te ,3.71 a ,uknjiÅ¾eno ,68499 ,pre 20 dana ,300.000,Paje JovanoviÄ‡a,"UÄiteljsko Naselje, Zvezdara opÅ¡tina, Beograd","<h2 _ngcontent-ng-c3151048826 class=""mat-headline-5"">Opis oglasa</h2><div _ngcontent-ng-c3151048826 class=""prose max-h-64 overflow-hidden text-gray-800 ng-star-inserted""><p>GraÄ‘evinska parcela u UÄiteljskom naselju, 200 metara od Doma zdravlja Zvezdara, ukupne povrÅ¡ine 3.71 ari. Plac je pravilnog oblika, uknjiÅ¾en, sa upisanim starim objektom u osnovi 51m2. Prema informaciji o lokaciji, dozvoljena spratnost P+2+Ps(Pk). ID oglasa: 68499. Agencijska provizija 2% od kupoprodajne cene.","GraÄ‘evinsko zemljiÅ¡te na prodaju, Paje JovanoviÄ‡a, 300.000â‚¬, 3a - 4zida",2024-03-02
249,https://www.4zida.rs/prodaja-placeva/nemenikuce-sopot-opstina-beograd/gradjevinsko-zemljiste/63caea4668df1d783c002b6f,,,,,,,,,,"GraÄ‘evinsko zemljiÅ¡te na prodaju, Kosmajskog odreda, 195.000â‚¬, 134a - 4zida",2024-03-02
250,https://www.4zida.rs/prodaja-placeva/gradske-lokacije-merosina/gradjevinsko-zemljiste/61f2adc5d269f103f9133c53,graÄ‘evinsko zemljiÅ¡te ,103 a ,uknjiÅ¾eno ,1580 ,pre 10 meseci ,62.000,Gradske lokacije,"Gradske lokacije, MeroÅ¡ina","<h2 _ngcontent-ng-c3151048826 class=""mat-headline-5"">Opis oglasa</h2><div _ngcontent-ng-c3151048826 class=""prose max-h-64 overflow-hidden text-gray-800 ng-star-inserted""><p>Prodajemo plac u MeriÅ¡ini u blizini hladnjaÄe, povrÅ¡ine 103 ara. plac je u industriskoj zoni, pogodan za gradnju hladnjaca, fabrika.. nalazi se na 100m od magistralnog puta.","GraÄ‘evinsko zemljiÅ¡te na prodaju, Gradske lokacije, 62.000â‚¬, 103a - 4zida",2024-03-02
251,https://www.4zida.rs/prodaja-placeva/radiofar-surcin-opstina-beograd/gradjevinsko-zemljiste/64ef6fbee4212a536e00f15f,,,,,,,,,,"Prodaja placeva Radiofar, SurÄin opÅ¡tina, Beograd, GraÄ‘evinsko zemljiÅ¡te - 4zida",2024-03-02
252,https://www.4zida.rs/prodaja-placeva/vinogradi-gradske-lokacije-kragujevac/gradjevinsko-zemljiste/65a78c4729437a63720a9171,graÄ‘evinsko zemljiÅ¡te ,10 a ,uknjiÅ¾eno ,,pre 1 mesec ,90.000,Vinogradi,"Vinogradi, Gradske lokacije, Kragujevac","<h2 _ngcontent-ng-c3151048826 class=""mat-headline-5"">Opis oglasa</h2><div _ngcontent-ng-c3151048826 class=""prose max-h-64 overflow-hidden text-gray-800 ng-star-inserted""><p>Prodaje se prazan plac blizu restorana ""Pevac""-","GraÄ‘evinsko zemljiÅ¡te na prodaju, Vinogradi, 90.000â‚¬, 10a - 4zida",2024-03-02
253,https://www.4zida.rs/prodaja-placeva/divcibare-okolne-lokacije-valjevo/gradjevinsko-zemljiste/645d1d9902d03c04140e64f4,,,,,,,,,,"GraÄ‘evinsko zemljiÅ¡te na prodaju, Kneza MiloÅ¡a, 100.000â‚¬, 10a - 4zida",2024-03-02
254,https://www.4zida.rs/prodaja-placeva/rudjinci-okolne-lokacije-vrnjacka-banja/gradjevinsko-zemljiste/65785272f7e58aecd20278b4,graÄ‘evinsko zemljiÅ¡te ,32 a ,uknjiÅ¾eno ,,pre 2 meseca ,48.585,Nemanjina 15v,"RuÄ‘inci, Okolne lokacije, VrnjaÄka Banja","<h2 _ngcontent-ng-c3151048826 class=""mat-headline-5"">Opis oglasa</h2><div _ngcontent-ng-c3151048826 class=""prose max-h-64 overflow-hidden text-gray-800 ng-star-inserted""><p>Na prodaju graÄ‘evinski plac, povrÅ¡ine 32,39ari. Plac se nalazi u naselju RuÄ‘inci, koje se istiÄe svojom prirodnom lepotom.","GraÄ‘evinsko zemljiÅ¡te na prodaju, Nemanjina 15v, 48.585â‚¬, 32a - 4zida",2024-03-02
255,https://www.4zida.rs/prodaja-placeva/dobanovci-surcin-opstina-beograd/gradjevinsko-zemljiste/6375e0ef380a74d8520eb147,,,,,,,,,,"Prodaja placeva Dobanovci, SurÄin opÅ¡tina, Beograd, GraÄ‘evinsko zemljiÅ¡te - 4zida",2024-03-02
256,https://www.4zida.rs/prodaja-placeva/velika-mostanica-cukarica-opstina-beograd/gradjevinsko-zemljiste/65d544124a224d99d708991a,graÄ‘evinsko zemljiÅ¡te ,28 a ,,5143 ,pre 10 dana ,30.000,Velika MoÅ¡tanica,"Velika MoÅ¡tanica, ÄŒukarica opÅ¡tina, Beograd","<h2 _ngcontent-ng-c3151048826 class=""mat-headline-5"">Opis oglasa</h2><div _ngcontent-ng-c3151048826 class=""prose max-h-64 overflow-hidden text-gray-800 ng-star-inserted""><p>Lep plac u Mostanici od 28a od Äega je 13.7 a gradsko graÄ‘evinsko zemljiÅ¡te, a 14.3a poljoprivredno.<br>Plac je udaljen oko 800m od centra Mostanice, skole,  Å umadija marketa...<br>Plac je deljiv i ima lep pogled. Na sredini placa postoji bunar. Gradska voda je na ulazu u Plac, kao i bandera sa strujom.<br>Za sve dodatne informacije pozvati.","GraÄ‘evinsko zemljiÅ¡te na prodaju, Velika MoÅ¡tanica, 30.000â‚¬, 28a - 4zida",2024-03-02
257,https://www.4zida.rs/prodaja-placeva/gradske-lokacije-ruma/gradjevinsko-zemljiste/635e70c0aef32068d20bcef4,,,,,,,,,,"GraÄ‘evinsko zemljiÅ¡te na prodaju, Milosa crnjanskog 00, 29.900â‚¬, 6a - 4zida",2024-03-02
258,https://www.4zida.rs/prodaja-placeva/gornja-toponica-okolne-lokacije-nis/gradjevinsko-zemljiste/61545766cb7174177b7ae1d8,graÄ‘evinsko zemljiÅ¡te ,104.74 a ,uknjiÅ¾eno ,p,pre 10 meseci ,366.000,Stevana SinÄ‘eliÄ‡a,"Gornja Toponica, Okolne lokacije, NiÅ¡","<h2 _ngcontent-ng-c3151048826 class=""mat-headline-5"">Opis oglasa</h2><div _ngcontent-ng-c3151048826 class=""prose max-h-64 overflow-hidden text-gray-800 ng-star-inserted""><p>Na prodaju velike parcele, trenutno se vode kao poljoprivredno zemljiÅ¡te, ali moguÄ‡e je uraditi prenamenu,  ukupna povrÅ¡ina je 10474m2. Parcele se nalaze na odliÄnoj lokaciji iznad hotela NAIS, u blizini pumpe i izlaze na asfaltni put. Njihova cena je 366000eura, uknjiÅ¾ene su.","GraÄ‘evinsko zemljiÅ¡te na prodaju, Stevana SinÄ‘eliÄ‡a, 366.000â‚¬, 104a - 4zida",2024-03-02
259,https://www.4zida.rs/prodaja-placeva/aleksandrovo-okolne-lokacije-merosina/gradjevinsko-zemljiste/637f8f65f60b4b12f7063a2c,graÄ‘evinsko zemljiÅ¡te ,12 a ,,p,pre 8 meseci ,22.000,Aleksandrovo,"Aleksandrovo, Okolne lokacije, MeroÅ¡ina","<h2 _ngcontent-ng-c3151048826 class=""mat-headline-5"">Opis oglasa</h2><div _ngcontent-ng-c3151048826 class=""prose max-h-64 overflow-hidden text-gray-800 ng-star-inserted""><p>Prodaje se polac povrsine 1200m2, na odlicnoj poziciji pored asfaltnog puta. Plac je na ravnom mestu. Vodi se kao poljoprivredno zemljiÅ¡te.<br>Ovo je samo deo nase ponude za vise informacija, slobodno nas kontaktirajte.","GraÄ‘evinsko zemljiÅ¡te na prodaju, Aleksandrovo, 22.000â‚¬, 12a - 4zida",2024-03-02
260,https://www.4zida.rs/prodaja-placeva/banstol-okolne-lokacije-sremski-karlovci/gradjevinsko-zemljiste/6558c96b2253415e3a071a00,graÄ‘evinsko zemljiÅ¡te ,80 a ,uknjiÅ¾eno ,519732 ,pre 3 meseca ,411.200,Banstol,"Banstol, Okolne lokacije, Sremski Karlovci","<h2 _ngcontent-ng-c3151048826 class=""mat-headline-5"">Opis oglasa</h2><div _ngcontent-ng-c3151048826 class=""prose max-h-64 overflow-hidden text-gray-800 ng-star-inserted""><p>Plac sa prelepim pogledom na tok Dunava od mosta na BeÅ¡koj do Novog Sada. Ovaj prostor je idealan za gradnju porodiÄne kuÄ‡e koja Ä‡e vam pruÅ¾iti mir, opuÅ¡tanje i bekstvo od gradske guÅ¾ve. Nalazi se na samo 20-tak minuta voÅ¾nje od centra grada. Plac je u graÄ‘evisnkom podruÄju. Nalazi se u prelepom oruÅ¾enju i do njega se dolazi asfaltnim putem. Struja i voda su na samom placu a gas je ispred placa. Na nekih 200 metara od placa je uraÄ‘ena nova trafostanica, a 300m je udaljen od glavnog puta koji vodi od Sremskih Karlovaca ka Beogradu. Za viÅ¡e informacija i razgledanja placa pozovite naÅ¡e agente...","GraÄ‘evinsko zemljiÅ¡te na prodaju, Banstol, 411.200â‚¬, 80a - 4zida",2024-03-02
261,https://www.4zida.rs/prodaja-placeva/zaovine-tara/gradjevinsko-zemljiste/659d90263f3a40e770002dba,graÄ‘evinsko zemljiÅ¡te ,13 a ,uknjiÅ¾eno ,3641 ,pre 1 mesec ,33.550,Tara,"Zaovine, Tara",,"GraÄ‘evinsko zemljiÅ¡te na prodaju, Tara, 33.550â‚¬, 13a - 4zida",2024-03-02
262,https://www.4zida.rs/prodaja-placeva/jugovo-vikend-naselje-okolne-lokacije-smederevo/gradjevinsko-zemljiste/633a9af94d2d66535c06aa91,,,,,,,,,,"Prodaja placeva Jugovo Vikend Naselje, Okolne lokacije, Smederevo, GraÄ‘evinsko zemljiÅ¡te - 4zida",2024-03-02
