,link,Tip,Površina,Uknjiženost,Šifra oglasa,Oglas ažuriran,price,street,address,title,end_date,description
112,https://www.4zida.rs/prodaja-placeva/pasi-poljana-palilula-gradske-lokacije-nis/gradjevinsko-zemljiste/628badf426f08a17f27fff8a,građevinsko zemljište ,29.13 a ,uknjiženo ,p,pre 8 meseci ,65.000,Pasi poljana,"Pasi Poljana, Palilula, Gradske lokacije, Niš","Građevinsko zemljište na prodaju, Pasi poljana, 65.000€, 29a - 4zida",2024-01-07,"<h2 _ngcontent-ng-c3151048826 class=""mat-headline-5"">Opis oglasa</h2><div _ngcontent-ng-c3151048826 class=""prose max-h-64 overflow-hidden text-gray-800 ng-star-inserted""><p>Na prodaju plac u Pasi Poljani, u blizini Novog groblja, na glavnom putu za Malošište. Ukupna površina placa je 2913m2. Plac je poljoprivredno zemljište. Ulazni front je oko 25m, a dužina parcele oko116m. Pogodan je za gradnju poslovno proizvodnih, skladišnih, trgovinskih kao i ugostiteljskih objekata. Uknjižen, privatna svojina, čisto vlasništvo. Za više informacija slobodno pozovite."
113,https://www.4zida.rs/prodaja-placeva/veternik-gradske-lokacije-pristina/gradjevinsko-zemljiste/65794b04c6deccf47a07ed7b,građevinsko zemljište ,7.3 a ,uknjiženo ,,pre 3 dana ,65.000,Veternik,"Veternik, Gradske lokacije, Novi Sad","Građevinsko zemljište na prodaju, Veternik, 65.000€, 7a - 4zida",2024-01-07,"<h2 _ngcontent-ng-c3151048826 class=""mat-headline-5"">Opis oglasa</h2><div _ngcontent-ng-c3151048826 class=""prose max-h-64 overflow-hidden text-gray-800 ng-star-inserted""><p>Plac 1/1,za gradnju kuće u lepoj ulici u blzini nove škole Marija Trandafil i vrtića,retko velika površina,dozvoljena gradnja.Pozovite da pogledate,063/808-69-62"
114,https://www.4zida.rs/prodaja-placeva/cortanovci-okolne-lokacije-indjija/gradjevinsko-zemljiste/63ff623ca2fd4e88c60eeb4c,građevinsko zemljište ,10 a ,uknjiženo ,503149 ,pre 29 dana ,16.000,Srednji breg,"Čortanovci, Okolne lokacije, Inđija","Građevinsko zemljište na prodaju, Srednji breg, 16.000€, 10a - 4zida",2024-01-07,"<h2 _ngcontent-ng-c3151048826 class=""mat-headline-5"">Opis oglasa</h2><div _ngcontent-ng-c3151048826 class=""prose max-h-64 overflow-hidden text-gray-800 ng-star-inserted""><p>Ako tražite mesto za odmor i beg od gradske buke na pravom ste mestu. Fantastičan ravan plac na potesu Srednji Breg - vikend naselje, može da se zida u osnovi cca 100m2, pored placa su priključci za struju i vodu prošao je i MTS, prilaz do placa je tucanik, ništa ne zaklanja pogled sve u svemu vredno pažnje. Pozovite nas za svaku pomoć.<br>Kontakt: 064/803-3305"
115,https://www.4zida.rs/prodaja-placeva/mali-bajmok-gradske-lokacije-subotica/gradjevinsko-zemljiste/64cbb8f2ed474beb2d0ae91f,građevinsko zemljište ,229.21 a ,,1665 ,pre 5 meseci ,230.000,Franje Kluza,"Mali Bajmok, Gradske lokacije, Subotica","Građevinsko zemljište na prodaju, Franje Kluza, 230.000€, 229a - 4zida",2024-01-07,"<h2 _ngcontent-ng-c3151048826 class=""mat-headline-5"">Opis oglasa</h2><div _ngcontent-ng-c3151048826 class=""prose max-h-64 overflow-hidden text-gray-800 ng-star-inserted""><p>Građevinsko zemljište u Malom Bajmoku na dobroj lokaciji u blizini industrijske zone. Čine ga tri parcele od kojih su dve spojene."
116,https://www.4zida.rs/prodaja-placeva/banja-koviljaca-okolne-lokacije-loznica/gradjevinsko-zemljiste/6585807992964bf81d00b83d,građevinsko zemljište ,75 a ,uknjiženo ,1986 ,pre 16 dana ,175.000,Narodnog fronta,"Banja Koviljača, Okolne lokacije, Loznica","Građevinsko zemljište na prodaju, Narodnog fronta, 175.000€, 75a - 4zida",2024-01-07,"<h2 _ngcontent-ng-c3151048826 class=""mat-headline-5"">Opis oglasa</h2><div _ngcontent-ng-c3151048826 class=""prose max-h-64 overflow-hidden text-gray-800 ng-star-inserted""><p>Odličan plac od 75ari u blizini centra Banje. ."
117,https://www.4zida.rs/prodaja-placeva/stipljanski-put-gradske-lokacije-jagodina/gradjevinsko-zemljiste/6507005b3f0c556e0b065e50,građevinsko zemljište ,5 a ,uknjiženo ,,pre 7 dana ,20.000,Štipljanski Put 1614/6,"Štipljanski Put, Gradske lokacije, Jagodina","Građevinsko zemljište na prodaju, Štipljanski Put 1614/6, 20.000€, 5a - 4zida",2024-01-07,"<h2 _ngcontent-ng-c3151048826 class=""mat-headline-5"">Opis oglasa</h2><div _ngcontent-ng-c3151048826 class=""prose max-h-64 overflow-hidden text-gray-800 ng-star-inserted""><p>Prodaje se plac površine 5 ari na gradskoj lokaciji Štipljanski put plac je uknjižen 1/1 dozvoljena je gradnja mogućnost priključenja na elektro mrežu vodovodnu mrežu telefon internet i gas nalazi se na glavnom putu blizu industrijske zone i letelišta pogodan za porodičnu kuću i pivredni objekat nepostoji mogućnost plavljenja"
118,https://www.4zida.rs/prodaja-placeva/gradske-lokacije-merosina/gradjevinsko-zemljiste/63d799f6a3b22a6b32010818,,,,,,,,,"Građevinsko zemljište na prodaju, Aleksandrovo, 9.000€, 41a - 4zida",2024-01-07,
119,https://www.4zida.rs/prodaja-placeva/jajinci-vozdovac-opstina-beograd/gradjevinsko-zemljiste/61b89cb1e236065a7f74aeac,građevinsko zemljište ,11 a ,uknjiženo ,,pre 3 meseca ,170.000,Milice Ribnikar,"Jajinci, Voždovac opština, Beograd","Građevinsko zemljište na prodaju, Milice Ribnikar, 170.000€, 11a - 4zida",2024-01-07,"<h2 _ngcontent-ng-c3151048826 class=""mat-headline-5"">Opis oglasa</h2><div _ngcontent-ng-c3151048826 class=""prose max-h-64 overflow-hidden text-gray-800 ng-star-inserted""><p>Prodaju se dva placa, svaki po 5,5 ara, na jednom započeta gradnja, predato za legalizaciju. Placevi se nalaze na dobroj lokaciji, miran, porodičan kraj, udaljen 6 km od Autokomande, zaštićen od gradske buke i gužve, moguće i za studente, u blizinu su Farmaceutski fakultet, Saobraćajni, FON i Fakultet političkih nauka, VMA i Ortopedska klinika. U blizini, na bivšem Bulevaru JNA, sadašnji Bulevar Oslobođenja, prolazi 9 bus linija. Za sva ostala pitanja, pozvati lično"
120,https://www.4zida.rs/prodaja-placeva/kremna-okolne-lokacije-uzice/gradjevinsko-zemljiste/60c77a6385fbc83f765e22bf,građevinsko zemljište ,100 a ,uknjiženo ,,pre 28 dana ,60.000,Kremna,"Kremna, Okolne lokacije, Užice","Građevinsko zemljište na prodaju, Kremna, 60.000€, 100a - 4zida",2024-01-07,"<h2 _ngcontent-ng-c3151048826 class=""mat-headline-5"">Opis oglasa</h2><div _ngcontent-ng-c3151048826 class=""prose max-h-64 overflow-hidden text-gray-800 ng-star-inserted""><p>Prodaju se placevi u Kremnima<br>Delice,Rajcevina,Sume,placevi razlicitih povrsina od 20 ari do 66 ara.<br>Parcele pogodne za izgradnju vikendice ,vece parcele pogodne za etno selo<br>Placevi u suncu na divnim lokacijama.<br>Svaki dogovor moguc"
121,https://www.4zida.rs/prodaja-placeva/hum-okolne-lokacije-nis/gradjevinsko-zemljiste/62c2bd52aa10132acb101820,,,,,,,,,"Građevinsko zemljište na prodaju, Hum, 18.000€, 17a - 4zida",2024-01-07,
122,https://www.4zida.rs/prodaja-placeva/begaljica-grocka-opstina-beograd/gradjevinsko-zemljiste/5ecbd0b2273171667065e6aa,građevinsko zemljište ,10 a ,uknjiženo ,46956 ,pre 8 meseci ,7.000,Potez Mala Banjica,"Begaljica, Grocka opština, Beograd","Građevinsko zemljište na prodaju, Potez Mala Banjica, 7.000€, 10a - 4zida",2024-01-07,"<h2 _ngcontent-ng-c3151048826 class=""mat-headline-5"">Opis oglasa</h2><div _ngcontent-ng-c3151048826 class=""prose max-h-64 overflow-hidden text-gray-800 ng-star-inserted""><p>Plac u neposrednoj blizini auto-puta,poljoprivredno zemljište. Agencijska provizija 600 eura. ID oglasa: 46956. Agencijska provizija 2% od kupoprodajne cene."
123,https://www.4zida.rs/prodaja-placeva/avala-vrcin-grocka-opstina-beograd/gradjevinsko-zemljiste/643080a79c03b1bc890b709b,građevinsko zemljište ,58.3 a ,uknjiženo ,,pre 1 mesec ,75.000,Durmitorska bb,"Avala, Vrčin, Grocka opština, Beograd","Građevinsko zemljište na prodaju, Durmitorska bb, 75.000€, 58a - 4zida",2024-01-07,"<h2 _ngcontent-ng-c3151048826 class=""mat-headline-5"">Opis oglasa</h2><div _ngcontent-ng-c3151048826 class=""prose max-h-64 overflow-hidden text-gray-800 ng-star-inserted""><p>Plac se nalazi u Vrcinu,  naselje Ramnice 30m od asfaltnog puta. Prilaz tucanik. Plac je na uzvisenju i ima pogled na Avalski toranj. Postoji mogucnost prikljucenja na struju, vodu i gas. Na placu je dozvoljena gradnja.<br>Vlasnik 1/1."
124,https://www.4zida.rs/prodaja-placeva/babe-sopot-opstina-beograd/gradjevinsko-zemljiste/63822ea3602010b48c07de1d,,,,,,,,,"Prodaja placeva Babe, Sopot opština, Beograd, Građevinsko zemljište - 4zida",2024-01-07,
125,https://www.4zida.rs/prodaja-placeva/stari-futog-futog-okolne-lokacije-novi-sad/gradjevinsko-zemljiste/65255dbee450d00b1800c38b,,,,,,,,,"Građevinsko zemljište na prodaju, Velebitska, 45.320€, 5a - 4zida",2024-01-07,
126,https://www.4zida.rs/prodaja-placeva/velika-remeta-okolne-lokacije-irig/gradjevinsko-zemljiste/65128f35f61ca1842d044b46,građevinsko zemljište ,50 a ,uknjiženo ,,pre 11 dana ,1,Velika Remeta bb BB,"Velika Remeta, Okolne lokacije, Irig","Građevinsko zemljište na prodaju, Velika Remeta bb BB, 1€, 50a - 4zida",2024-01-07,"<h2 _ngcontent-ng-c3151048826 class=""mat-headline-5"">Opis oglasa</h2><div _ngcontent-ng-c3151048826 class=""prose max-h-64 overflow-hidden text-gray-800 ng-star-inserted""><p>FRUSKA GORA SRBIJA"
127,https://www.4zida.rs/prodaja-placeva/lipovica-barajevo-opstina-beograd/gradjevinsko-zemljiste/648d6ca5885a04d0f30f9bd1,građevinsko zemljište ,45.72 a ,uknjiženo ,,pre 30 dana ,100,Lipovica,"Lipovica, Barajevo opština, Beograd","Građevinsko zemljište na prodaju, Lipovica, 100€, 45a - 4zida",2024-01-07,"<h2 _ngcontent-ng-c3151048826 class=""mat-headline-5"">Opis oglasa</h2><div _ngcontent-ng-c3151048826 class=""prose max-h-64 overflow-hidden text-gray-800 ng-star-inserted""><p>Prodajem dve parcele u Lipovici u građevinskom području u neposrednoj blizini ulice Lipovački put, a na 2km od izlaza na Magistalni put. "
128,https://www.4zida.rs/prodaja-placeva/branko-bjegovic-crveni-krst-gradske-lokacije-nis/gradjevinsko-zemljiste/64391a10e29e10fa81039cab,,,,,,,,,"Građevinsko zemljište na prodaju, Pribojska, 26.000€, 21a - 4zida",2024-01-07,
129,https://www.4zida.rs/prodaja-placeva/ravni-do-okolne-lokacije-nis/gradjevinsko-zemljiste/64d215f8d6feae4fa501bdb7,,,,,,,,,"Građevinsko zemljište na prodaju, Avalska, 7.500€, 37a - 4zida",2024-01-07,
130,https://www.4zida.rs/prodaja-placeva/delijski-vis-palilula-gradske-lokacije-nis/gradjevinsko-zemljiste/645239a98b87921ff10707ac,građevinsko zemljište ,3 a ,uknjiženo ,,pre 2 meseca ,21.000,Jovanke Boncic,"Delijski Vis, Palilula, Gradske lokacije, Niš","Građevinsko zemljište na prodaju, Jovanke Boncic, 21.000€, 3a - 4zida",2024-01-07,"<h2 _ngcontent-ng-c3151048826 class=""mat-headline-5"">Opis oglasa</h2><div _ngcontent-ng-c3151048826 class=""prose max-h-64 overflow-hidden text-gray-800 ng-star-inserted""><p>Plac je na odlicnom mestu u blizini stop shop-a."
131,https://www.4zida.rs/prodaja-placeva/divcibare-okolne-lokacije-valjevo/gradjevinsko-zemljiste/64d24773806d57a64d0cfc75,građevinsko zemljište ,384 a ,uknjiženo ,1588 ,pre 4 meseca ,150.000,Divčibare,"Divčibare, Okolne lokacije, Valjevo","Građevinsko zemljište na prodaju, Divčibare, 150.000€, 384a - 4zida",2024-01-07,"<h2 _ngcontent-ng-c3151048826 class=""mat-headline-5"">Opis oglasa</h2><div _ngcontent-ng-c3151048826 class=""prose max-h-64 overflow-hidden text-gray-800 ng-star-inserted""><p>Lepa parcela u blizini puta Divčibare-Požega.Prelep pogled na Maljen i celu okolinu.<br>Uknjiženo!<br>Dobra investicija! Agencijska provizija 2%"
132,https://www.4zida.rs/prodaja-placeva/palilula-gradske-lokacije-nis/gradjevinsko-zemljiste/649199ace3f747eadc0fd9cd,,,,,,,,,"Građevinsko zemljište na prodaju, Kovanlučka, 108.000€, 13a - 4zida",2024-01-07,
133,https://www.4zida.rs/prodaja-placeva/vocareve-livade-gradske-lokacije-kraljevo/gradjevinsko-zemljiste/5f74aac104d14e63391dca86,,,,,,,,,"Građevinsko zemljište na prodaju, Voćareve Livade, 50.000€, 25a - 4zida",2024-01-07,
134,https://www.4zida.rs/prodaja-placeva/vapa-okolne-lokacije-cacak/gradjevinsko-zemljiste/63e3e2920c25ceeb9c02249f,građevinsko zemljište ,204.45 a ,uknjiženo ,,pre 11 dana ,30.000,Vapa,"Vapa, Okolne lokacije, Čačak","Građevinsko zemljište na prodaju, Vapa, 30.000€, 204a - 4zida",2024-01-07,"<h2 _ngcontent-ng-c3151048826 class=""mat-headline-5"">Opis oglasa</h2><div _ngcontent-ng-c3151048826 class=""prose max-h-64 overflow-hidden text-gray-800 ng-star-inserted""><p>Prodajem porodično imanje sa kućom,štalom,okućnicom i poljoprivrednim zemljištem (njive 2.klase) uz asfaltni put u mestu okoline Čačka selo Vapa.Ukupna površina porodičnog imanja je 204,45 ari. Sve je u jednom komadu, sve je uknjiženo. Za sve dodatne informacije pozovite."
135,https://www.4zida.rs/prodaja-placeva/deguric-okolne-lokacije-valjevo/gradjevinsko-zemljiste/62e7f793f9d11402550b16f2,građevinsko zemljište ,20 a ,uknjiženo ,,pre 28 dana ,25.000,Uzicka bb,"Degurić, Okolne lokacije, Valjevo","Građevinsko zemljište na prodaju, Uzicka bb, 25.000€, 20a - 4zida",2024-01-07,"<h2 _ngcontent-ng-c3151048826 class=""mat-headline-5"">Opis oglasa</h2><div _ngcontent-ng-c3151048826 class=""prose max-h-64 overflow-hidden text-gray-800 ng-star-inserted""><p>Plac od 20 ari, pored asfaltiranog magistralnog puta za Užice (iza Europroma), odlična lokacija kako za gradnju stambenog tako i poslovnog objekta."
136,https://www.4zida.rs/prodaja-placeva/zorka-gradske-lokacije-subotica/gradjevinsko-zemljiste/6427dd1943717361a4001ca9,građevinsko zemljište ,196.74 a ,,101 ,pre 30 dana ,236.088,Sutjeska,"Zorka, Gradske lokacije, Subotica","Građevinsko zemljište na prodaju, Sutjeska, 236.088€, 196a - 4zida",2024-01-07,"<h2 _ngcontent-ng-c3151048826 class=""mat-headline-5"">Opis oglasa</h2><div _ngcontent-ng-c3151048826 class=""prose max-h-64 overflow-hidden text-gray-800 ng-star-inserted""><p>Prodaje se gradsko građevinsko zemljište ukupne površine 19674 m2 u Sutjeskoj ulici u Subotici. Predmet prodaje je pobodan za izgradnju poslovnih objekata, objekata namenjenih za malu privrednu i zanatsvo, stambeno- poslovnih objekata, stambenih objekata i pratećih sadržaja.<br>Maksimalan indeks zauzetosti parcela je 40%. Maksimalna spratnost objekata je P+1 za poslovne objekte, a P+1+PK za objekte namenjenim stanovanju.<br>Blizina autoputa (oko 13km), međunarodnog graničnog prelaza sa Mađarskom (oko 9km) i  grada Subotica (oko 4 km) omoguće obavljanje praktično svih vrsta privrednih delatnosti.<br>Na predmetu prodaje se nalazi pomoćni objekat površine 18m2 sa priključkom na trofazno struju."
137,https://www.4zida.rs/prodaja-placeva/11-kongres-gradske-lokacije-paracin/gradjevinsko-zemljiste/6479fc039a7293703c0cc779,građevinsko zemljište ,10.58 a ,,7070 ,pre 6 meseci ,27.000,11. Kongres,"11. Kongres, Gradske lokacije, Paraćin","Građevinsko zemljište na prodaju, 11. Kongres, 27.000€, 10a - 4zida",2024-01-07,"<h2 _ngcontent-ng-c3151048826 class=""mat-headline-5"">Opis oglasa</h2><div _ngcontent-ng-c3151048826 class=""prose max-h-64 overflow-hidden text-gray-800 ng-star-inserted""><p>upisan objekat od 62m2<br>mogucnost gradnje , prikljucenje struje i vode<br>nije fiksna cena"
138,https://www.4zida.rs/prodaja-placeva/skrobara-gradske-lokacije-pancevo/gradjevinsko-zemljiste/65020c0427554bf0c200ccf0,građevinsko zemljište ,85.36 a ,uknjiženo ,,pre 2 meseca ,190.000,Skrobara,"Skrobara, Gradske lokacije, Pančevo","Građevinsko zemljište na prodaju, Skrobara, 190.000€, 85a - 4zida",2024-01-07,"<h2 _ngcontent-ng-c3151048826 class=""mat-headline-5"">Opis oglasa</h2><div _ngcontent-ng-c3151048826 class=""prose max-h-64 overflow-hidden text-gray-800 ng-star-inserted""><p>Prodaje se plac na Jabučkom putu, do puta, površine 85,36 ari. Na placu se nalaze uknjižena kuća od 46 m2 i 3 pomoćna objekta ukupne povšine 175 m2. U kući ima trofazne struje a na placu je bunar. Cena je 190000 evra. Agencija Mustang 062226901"
139,https://www.4zida.rs/prodaja-placeva/futog-okolne-lokacije-novi-sad/gradjevinsko-zemljiste/65671257f7f7715672097b3b,,,,,,,,,"Prodaja placeva Futog, Okolne lokacije, Novi Sad, Građevinsko zemljište - 4zida",2024-01-07,
140,https://www.4zida.rs/prodaja-placeva/velika-ivanca-mladenovac-opstina-beograd/gradjevinsko-zemljiste/654a01b76a52d5ebd30a6f27,građevinsko zemljište ,370 a ,uknjiženo ,19100 ,pre 1 mesec ,183.500,Velika Ivanča,"Velika Ivanča, Mladenovac opština, Beograd","Građevinsko zemljište na prodaju, Velika Ivanča, 183.500€, 370a - 4zida",2024-01-07,"<h2 _ngcontent-ng-c3151048826 class=""mat-headline-5"">Opis oglasa</h2><div _ngcontent-ng-c3151048826 class=""prose max-h-64 overflow-hidden text-gray-800 ng-star-inserted""><p>Kosmaj - Velika Ivanča<br>Na izuzetnoj lokaciji, u podnožju Kosmaja, prodaje se predivan prostran plac površine 3ha 70a. Osunčani proplanak, u netaknutom prirodnom ambijentu okružen šumom sa pogledom na Bukulju i Kosmaj. Plac je pod blagim nagibom.<br>Ispod placa protiče potok. Poseduje bunar i struju (elektro-mreža je provučena preko placa što daje mogućnost brzog i jakog priključka). Nalazi se na par minuta od glavnog puta a do placa se dolazi putem kroz šumu (put će takođe biti asfaltiran). Zimi se održavaju i čiste putevi. Moguć priključak na internet.<br>Blizina Mladenovca, Aranđelovca, Sopota (na15-ak minuta vožnje). Moguć priključak na gas.<br>Izuzetna investicija."
141,https://www.4zida.rs/prodaja-placeva/pinosava-vozdovac-opstina-beograd/gradjevinsko-zemljiste/63b5ad0649aa91a76c0510b7,,,,,,,,,"Građevinsko zemljište na prodaju, Pinosava, 161.000€, 46a - 4zida",2024-01-07,
142,https://www.4zida.rs/prodaja-placeva/futog-okolne-lokacije-novi-sad/gradjevinsko-zemljiste/6571f3313d225cd66104b78a,,,,,,,,,"Prodaja placeva Futog, Okolne lokacije, Novi Sad, Građevinsko zemljište - 4zida",2024-01-07,
143,https://www.4zida.rs/prodaja-placeva/kremna-okolne-lokacije-uzice/gradjevinsko-zemljiste/645b9d50949abcaf9c08d0a2,građevinsko zemljište ,19 a ,uknjiženo ,1410 ,pre 7 meseci ,20.000,Kremna,"Kremna, Okolne lokacije, Užice","Građevinsko zemljište na prodaju, Kremna, 20.000€, 19a - 4zida",2024-01-07,"<h2 _ngcontent-ng-c3151048826 class=""mat-headline-5"">Opis oglasa</h2><div _ngcontent-ng-c3151048826 class=""prose max-h-64 overflow-hidden text-gray-800 ng-star-inserted""><p>Na prodaju 19 ari placa, zemljišta na obroncima Tare. Idealan za gradnju vikend kuće ili apartmana. Nalazi se u blizini puta koji vodi ka hotelu ""Omorika"". Plac je na 800m vazdušne linije od hotela. Do placa vodi seoski put, sprovedena je struja. Netaknuta priroda,okruženo šumom."
144,https://www.4zida.rs/prodaja-placeva/bocke-sremska-kamenica-gradske-lokacije-novi-sad/gradjevinsko-zemljiste/6328956b78ff9c85090a9bb0,građevinsko zemljište ,8 a ,uknjiženo ,465097 ,pre 1 godinu ,102.840,Bocke,"Bocke, Sremska Kamenica, Gradske lokacije, Novi Sad","Građevinsko zemljište na prodaju, Bocke, 102.840€, 8a - 4zida",2024-01-07,"<h2 _ngcontent-ng-c3151048826 class=""mat-headline-5"">Opis oglasa</h2><div _ngcontent-ng-c3151048826 class=""prose max-h-64 overflow-hidden text-gray-800 ng-star-inserted""><p>Perfektni placevi, na idealnok poziciji! Građevinsko zemljište! Iskoristite priliku."
145,https://www.4zida.rs/prodaja-placeva/desimirovac-okolne-lokacije-kragujevac/gradjevinsko-zemljiste/64d3918dbc9c6e571c0e0ed0,građevinsko zemljište ,2.94 a ,,p,pre 4 meseca ,3.999,Desimirovac,"Desimirovac, Okolne lokacije, Kragujevac","Građevinsko zemljište na prodaju, Desimirovac, 3.999€, 2a - 4zida",2024-01-07,"<h2 _ngcontent-ng-c3151048826 class=""mat-headline-5"">Opis oglasa</h2><div _ngcontent-ng-c3151048826 class=""prose max-h-64 overflow-hidden text-gray-800 ng-star-inserted""><p>Na prodaju plac u naselju Desimirovac, u blizini magistralnog puta Kragujevac Topola. Pogodan za izgradnju. Postoji mogućnost kupovine i susedne parcele. Vlasnik 1/1.  Plac je uknjižen.<br>Za sve informacije i razgledanje stojimo vam na raspolaganju, radnim danima od 09-19h i subotom od 09-17h. Ovu i druge nekretnine sa većim brojem fotografija možete pogledati na našem sajtu: bulevarnekretnine.rs, kontakt: info@bulevarnekretnine.rs, usluga besplatna. Čekamo Vas. Telefon 034/330808 i 060/0544253. Bulevar Nekretnine 034, Kragujevac, broj u registru posrednika: 1278."
146,https://www.4zida.rs/prodaja-placeva/sicevo-okolne-lokacije-nis/gradjevinsko-zemljiste/648c995e40f70bc155029b87,građevinsko zemljište ,5.57 a ,,p,pre 6 meseci ,9.250,Sićevo,"Sićevo, Okolne lokacije, Niš","Građevinsko zemljište na prodaju, Sićevo, 9.250€, 5a - 4zida",2024-01-07,"<h2 _ngcontent-ng-c3151048826 class=""mat-headline-5"">Opis oglasa</h2><div _ngcontent-ng-c3151048826 class=""prose max-h-64 overflow-hidden text-gray-800 ng-star-inserted""><p>Na  prodaju  plac  za  gradnju  u  selu  Sićevo, pored  puta  i  blizu  komunalnih priključaka. Plac  je  zahvalnog  oblika  i  dobre  lokacije  za  gradnju. Vredi  videti."
147,https://www.4zida.rs/prodaja-placeva/veternik-gradske-lokacije-novi-sad/gradjevinsko-zemljiste/64d34e403aa7c66ea7071e93,,,,,,,,,"Prodaja placeva Veternik, Gradske lokacije, Novi Sad, Građevinsko zemljište - 4zida",2024-01-07,
148,https://www.4zida.rs/prodaja-placeva/palic-okolne-lokacije-subotica/gradjevinsko-zemljiste/64fa1013a65233deb601e109,,,,,,,,,"Građevinsko zemljište na prodaju, Park fizičke kulture 4, 500.000€, 15a - 4zida",2024-01-07,
149,https://www.4zida.rs/prodaja-placeva/gornji-grad-gradske-lokacije-pancevo/gradjevinsko-zemljiste/61fa85411397f368b2267a98,,,,,,,,,"Građevinsko zemljište na prodaju, Mihajla Pupina 10, 330.000€, 9a - 4zida",2024-01-07,
150,https://www.4zida.rs/prodaja-placeva/streliste-gradske-lokacije-jagodina/gradjevinsko-zemljiste/62821c58904f07f8f80e4c16,građevinsko zemljište ,11 a ,uknjiženo ,,pre 10 dana ,33.000,Bukovački Put,"Strelište, Gradske lokacije, Jagodina","Građevinsko zemljište na prodaju, Bukovački Put, 33.000€, 11a - 4zida",2024-01-07,"<h2 _ngcontent-ng-c3151048826 class=""mat-headline-5"">Opis oglasa</h2><div _ngcontent-ng-c3151048826 class=""prose max-h-64 overflow-hidden text-gray-800 ng-star-inserted""><p>Nalazi se 500 m od naselja."
151,https://www.4zida.rs/prodaja-placeva/palilula-gradske-lokacije-nis/gradjevinsko-zemljiste/64e89b6ba6d034f13005f157,građevinsko zemljište ,16 a ,uknjiženo ,p,pre 4 meseca ,16.000,Kovanlučka,"Palilula, Gradske lokacije, Niš","Građevinsko zemljište na prodaju, Kovanlučka, 16.000€, 16a - 4zida",2024-01-07,"<h2 _ngcontent-ng-c3151048826 class=""mat-headline-5"">Opis oglasa</h2><div _ngcontent-ng-c3151048826 class=""prose max-h-64 overflow-hidden text-gray-800 ng-star-inserted""><p>Na prodaju plac na međi između Palilule i D. Vlasa.<br>Ukupna povšina placa je 16a, ulazni front placa je 35m2, pravougaonog oblika.<br>Nije na glavnoj sobraćajnici, ali je odlično lociran u neposrednom okruženju brojnih objekata različitih namena.<br>Prelep prirodni ambijent, izolovan od buke i gužve, idealan za relaksaciju i beg od svakodnevnice.<br>Komunalni pričključci (voda, struja, kanalizacija) su dostupni.<br>Uknjižen (u postupku preknjiženja). Za više informacija slobodno pozovite."
152,https://www.4zida.rs/prodaja-placeva/brzi-brod-medijana-gradske-lokacije-nis/gradjevinsko-zemljiste/6373abdc2ed5de7df2047dfc,građevinsko zemljište ,102 a ,uknjiženo ,,pre 12 dana ,500.000,Bulevar Svetog Cara Konstantina,"Brzi Brod, Medijana, Gradske lokacije, Niš","Građevinsko zemljište na prodaju, Bulevar Svetog Cara Konstantina, 500.000€, 102a - 4zida",2024-01-07,"<h2 _ngcontent-ng-c3151048826 class=""mat-headline-5"">Opis oglasa</h2><div _ngcontent-ng-c3151048826 class=""prose max-h-64 overflow-hidden text-gray-800 ng-star-inserted""><p>EXKLUZIVNA PARCELA - BULEVAR SVETOG CARA KONSTANTINA "
153,https://www.4zida.rs/prodaja-placeva/mezgraja-okolne-lokacije-nis/gradjevinsko-zemljiste/62e13b8662711e769f0a8b8a,građevinsko zemljište ,49.54 a ,,p,pre 8 meseci ,11.000,Toponička,"Mezgraja, Okolne lokacije, Niš","Građevinsko zemljište na prodaju, Toponička, 11.000€, 49a - 4zida",2024-01-07,"<h2 _ngcontent-ng-c3151048826 class=""mat-headline-5"">Opis oglasa</h2><div _ngcontent-ng-c3151048826 class=""prose max-h-64 overflow-hidden text-gray-800 ng-star-inserted""><p>Prodaje se plac u selu Mezgraja, površine 4954m2. Plac se koristi kao obradivo zemljište na kome se uzgaja određena kultura i nalazi se uz naseljeni deo sela. Ovo je samo deo naše ponude, za više informacija slobondo nas nazovite."
154,https://www.4zida.rs/prodaja-placeva/artiljevo-popovica-sremska-kamenica-gradske-lokacije-novi-sad/gradjevinsko-zemljiste/64d20a59133c957b080a2116,,,,,,,,,"Građevinsko zemljište na prodaju, Grigovački put, 33.000€, 800a - 4zida",2024-01-07,
155,https://www.4zida.rs/prodaja-placeva/meljak-barajevo-opstina-beograd/gradjevinsko-zemljiste/632d8869fbd66a1d490db047,građevinsko zemljište ,111 a ,,1454 ,pre 8 meseci ,90.000,Meljak,"Meljak, Barajevo opština, Beograd","Građevinsko zemljište na prodaju, Meljak, 90.000€, 111a - 4zida",2024-01-07,"<h2 _ngcontent-ng-c3151048826 class=""mat-headline-5"">Opis oglasa</h2><div _ngcontent-ng-c3151048826 class=""prose max-h-64 overflow-hidden text-gray-800 ng-star-inserted""><p>Продаје се имање 1ха и 11 ари у Мељаку: 3 парцеле које чине једну целину и то:"
