,link,Tip,Površina,Šifra oglasa,Oglas ažuriran,price,street,address,description,title,end_date,Uknjiženost
199,https://www.4zida.rs/prodaja-placeva/borca-palilula-opstina-beograd/gradjevinsko-zemljiste/63644bf1a5c296286b0d8a15,građevinsko zemljište ,121 a ,1768 ,pre 8 meseci ,130.000,Borča,"Borča, Palilula opština, Beograd","<h2 _ngcontent-ng-c3151048826 class=""mat-headline-5"">Opis oglasa</h2><div _ngcontent-ng-c3151048826 class=""prose max-h-64 overflow-hidden text-gray-800 ng-star-inserted""><p>Plac u naselju Borča ukupne površine 121 ar.Uknjiženo.","Građevinsko zemljište na prodaju, Borča, 130.000€, 121a - 4zida",2024-01-12,uknjiženo 
200,https://www.4zida.rs/prodaja-placeva/bacevac-barajevo-opstina-beograd/gradjevinsko-zemljiste/64ff3304924f4b0c0e00c242,građevinsko zemljište ,9.13 a ,1578 ,pre 4 meseca ,25.000,Bratstva i jedinstva,"Baćevac, Barajevo opština, Beograd","<h2 _ngcontent-ng-c3151048826 class=""mat-headline-5"">Opis oglasa</h2><div _ngcontent-ng-c3151048826 class=""prose max-h-64 overflow-hidden text-gray-800 ng-star-inserted""><p>Plac se nalazi 5km posle restorana ,, Srbija"" a 300m posle motela ,,Kneževina"", sa desne strane Ibarske magistrale, u zoni dozvoljene gradnje. Na placu postoji bunar i gradska voda.","Građevinsko zemljište na prodaju, Bratstva i jedinstva, 25.000€, 9a - 4zida",2024-01-12,uknjiženo 
201,https://www.4zida.rs/prodaja-placeva/gornji-tavankut-tavankut-okolne-lokacije-subotica/gradjevinsko-zemljiste/65156650826a62896d00e5f1,,,,,,,,,"Građevinsko zemljište na prodaju, Gornji Tavankut, 20.000€, 70a - 4zida",2024-01-12,
202,https://www.4zida.rs/prodaja-placeva/popovic-sopot-opstina-beograd/gradjevinsko-zemljiste/65393e5d74b154e053001b81,građevinsko zemljište ,39 a ,6118 ,pre 1 mesec ,46.000,Popović,"Popović, Sopot opština, Beograd","<h2 _ngcontent-ng-c3151048826 class=""mat-headline-5"">Opis oglasa</h2><div _ngcontent-ng-c3151048826 class=""prose max-h-64 overflow-hidden text-gray-800 ng-star-inserted""><p>Odličan plac, struja, voda, gas. 2 prilazna puta. Mir, tišina a blizu Beograda. Uknjižen.<br>Agenc. provizija 2%<br>Agent: Milivoje  Đorđević   br. licence 2498<br>“Art nekretnine“ d.o.o. Beograd.<br>Reg. br. 339.<br>011/4016-237<br>011/4016-236 .","Građevinsko zemljište na prodaju, Popović, 46.000€, 39a - 4zida",2024-01-12,uknjiženo 
203,https://www.4zida.rs/prodaja-placeva/slanci-palilula-opstina-beograd/gradjevinsko-zemljiste/62e8dedea959a106b3003f62,,,,,,,,,"Prodaja placeva Slanci, Palilula opština, Beograd, Građevinsko zemljište - 4zida",2024-01-12,
204,https://www.4zida.rs/prodaja-placeva/ripanj-vozdovac-opstina-beograd/gradjevinsko-zemljiste/6470daf7195a493ff101d844,građevinsko zemljište ,70 a ,,pre 22 dana ,70.000,Avalska bb,"Ripanj, Voždovac opština, Beograd","<h2 _ngcontent-ng-c3151048826 class=""mat-headline-5"">Opis oglasa</h2><div _ngcontent-ng-c3151048826 class=""prose max-h-64 overflow-hidden text-gray-800 ng-star-inserted""><p>Prodajem plac u Ripnju  300 met pre centra na samom putu. Plac ima 70 ari i prodaje se. u celosti. Pored placa prolazi glavni put struja , voda i gas. Cena. po aru 1000 eur. Oglas je usluzan kontakt za plac 0654248113","Građevinsko zemljište na prodaju, Avalska bb, 70.000€, 70a - 4zida",2024-01-12,uknjiženo 
205,https://www.4zida.rs/prodaja-placeva/gradske-lokacije-jagodina/gradjevinsko-zemljiste/644d2e25907868fcdb0b52ff,građevinsko zemljište ,63 a ,3062 ,pre 8 meseci ,97.335,Gradske lokacije,"Gradske lokacije, Jagodina","<h2 _ngcontent-ng-c3151048826 class=""mat-headline-5"">Opis oglasa</h2><div _ngcontent-ng-c3151048826 class=""prose max-h-64 overflow-hidden text-gray-800 ng-star-inserted""><p>*širina placa 27m<br>*1500eur/a","Građevinsko zemljište na prodaju, Gradske lokacije, 97.335€, 63a - 4zida",2024-01-12,uknjiženo 
206,https://www.4zida.rs/prodaja-placeva/dudova-suma-gradske-lokacije-subotica/gradjevinsko-zemljiste/59a90af17ce3af43cb338930,građevinsko zemljište ,62 a ,,pre 18 dana ,150.000,Bagremova,"Dudova Šuma, Gradske lokacije, Subotica","<h2 _ngcontent-ng-c3151048826 class=""mat-headline-5"">Opis oglasa</h2><div _ngcontent-ng-c3151048826 class=""prose max-h-64 overflow-hidden text-gray-800 ng-star-inserted""><p>plac iz jednog dela, ograđeno sa zidanom ogradom, dva kamionska ulaza, asvaltna ulica, na placu ima zidana portirnica.","Građevinsko zemljište na prodaju, Bagremova, 150.000€, 62a - 4zida",2024-01-12,uknjiženo 
207,https://www.4zida.rs/prodaja-placeva/nemenikuce-sopot-opstina-beograd/gradjevinsko-zemljiste/6425723a79f7f37b4905ecf1,građevinsko zemljište ,65.17 a ,3807 ,pre 8 meseci ,230.000,Kursulina,"Nemenikuće, Sopot opština, Beograd","<h2 _ngcontent-ng-c3151048826 class=""mat-headline-5"">Opis oglasa</h2><div _ngcontent-ng-c3151048826 class=""prose max-h-64 overflow-hidden text-gray-800 ng-star-inserted""><p>Na prodaju plac, u građevinskom području, površine 65,17ari na Kosmaju, opština Sopot, u blizini raskrsnice za Rogaču i manastir Tresije. Plac je pravougaonog oblika, sa blagim nagibom, održavan, oivičen sa dri puta. Uz zemljište su svi priključci: električna energija, gas, gradska voda, ulično svetlo i optički kabal. Plac je lako deljiv, bez gubitka površine za ostavljanje prilaznog puta, širine do asfalta preko 100m, ali se prodaje u celosti, fenomenalna lokacija, nadmorska visina je oko 400m, do vrha Kosmaja nepuna 2 km, jedan od malobrojnih preostalih placeva na toj lokaciji. Vlasnik uknjižen bez tereta. Cena nije fiksna.","Građevinsko zemljište na prodaju, Kursulina, 230.000€, 65a - 4zida",2024-01-12,uknjiženo 
208,https://www.4zida.rs/prodaja-placeva/cuprijski-put-gradske-lokacije-jagodina/gradjevinsko-zemljiste/63bfe190de5561bfcd0812ef,građevinsko zemljište ,66.92 a ,6650 ,pre 3 meseca ,53.000,Ćuprijski put,"Ćuprijski put, Gradske lokacije, Jagodina","<h2 _ngcontent-ng-c3151048826 class=""mat-headline-5"">Opis oglasa</h2><div _ngcontent-ng-c3151048826 class=""prose max-h-64 overflow-hidden text-gray-800 ng-star-inserted""><p>Velika parcela, na aktuelnoj zoni na glavnom regionalnom putu Jagodina-Ćuprija, pogodna za podizanje industrijskog objekta, svaka vrsta delatnosti. Dozvoljena gradnja, industrijska zona 3. Parcela poseduje izveštaj o lokaciji iz Direkcije za urbanizam u Jagodini.<br>Ekskluzivna prodaja -agencija Heroldo  0658222445","Građevinsko zemljište na prodaju, Ćuprijski put, 53.000€, 66a - 4zida",2024-01-12,uknjiženo 
209,https://www.4zida.rs/prodaja-placeva/male-pcelice-gradske-lokacije-kragujevac/gradjevinsko-zemljiste/65084f17212d58ce150b2ced,građevinsko zemljište ,3.81 a ,PZ1809231003SL ,pre 3 meseca ,6.500,Male Pčelice,"Male Pčelice, Gradske lokacije, Kragujevac","<h2 _ngcontent-ng-c3151048826 class=""mat-headline-5"">Opis oglasa</h2><div _ngcontent-ng-c3151048826 class=""prose max-h-64 overflow-hidden text-gray-800 ng-star-inserted""><p>Na prodaju plac u Kragujevcu naselje Male Pčelice.","Građevinsko zemljište na prodaju, Male Pčelice, 6.500€, 3a - 4zida",2024-01-12,uknjiženo 
210,https://www.4zida.rs/prodaja-placeva/donji-matejevac-okolne-lokacije-nis/gradjevinsko-zemljiste/63ff50f72bb17163bd08790c,građevinsko zemljište ,31.05 a ,p,pre 8 meseci ,12.000,Donji Matejevac,"Donji Matejevac, Okolne lokacije, Niš","<h2 _ngcontent-ng-c3151048826 class=""mat-headline-5"">Opis oglasa</h2><div _ngcontent-ng-c3151048826 class=""prose max-h-64 overflow-hidden text-gray-800 ng-star-inserted""><p>Na prodaju odličan plac u Donjem Matejevcu. Plac je poljoprivredno zemljište, ukupne površine 3105m2. Prednji front je 15,21m širine, dužina placa je 184,20m. Nalazi se pored puta. Uknjižen, čisto vlasništvo.Ovo je samo deo naše ponude, ovu kao  i ostale ponude sa većim brojem fotografija možete pogledati na našem sajtu.","Građevinsko zemljište na prodaju, Donji Matejevac, 12.000€, 31a - 4zida",2024-01-12,uknjiženo 
211,https://www.4zida.rs/prodaja-placeva/vlaska-mladenovac-opstina-beograd/gradjevinsko-zemljiste/637698812853c7d80908dd17,,,,,,,,,"Prodaja placeva Vlaška, Mladenovac opština, Beograd, Građevinsko zemljište - 4zida",2024-01-12,
212,https://www.4zida.rs/prodaja-placeva/pasi-poljana-palilula-gradske-lokacije-nis/gradjevinsko-zemljiste/64ef7db7cf2b19255705a25d,građevinsko zemljište ,29.58 a ,p,pre 4 meseca ,55.800,Pasi poljana,"Pasi Poljana, Palilula, Gradske lokacije, Niš","<h2 _ngcontent-ng-c3151048826 class=""mat-headline-5"">Opis oglasa</h2><div _ngcontent-ng-c3151048826 class=""prose max-h-64 overflow-hidden text-gray-800 ng-star-inserted""><p>Na prodaju  veliki plac na periferiji nedaleko od Novog groblja, na putu za Belotinac.  Nalazi se do asvaltnog puta. Uknjižene površine 2958m2, poljoprivredno  je zemljište, postoji mogućnost prenamene zemljišta za izgradnju, na kome je izvršena konverzija u gradsko građevinsko, ostaje sadašnjem vlasniku samo da izmiri taksu za prenamenu. Na odličnom je mestu za obavljanje  više delatnosti, ima mogućnosti za izgradnju proizvodne hale ili magacina. Uknjižen kao privatna svojina.<br> Ovo je samo deo naše ponude, za više informacija javite se i posetite nas sajt.","Građevinsko zemljište na prodaju, Pasi poljana, 55.800€, 29a - 4zida",2024-01-12,uknjiženo 
213,https://www.4zida.rs/prodaja-placeva/aleksandrovo-gradske-lokacije-subotica/gradjevinsko-zemljiste/638221a0e7d5114d7d011166,građevinsko zemljište ,5.8 a ,,pre 13 dana ,14.000,Juraja Arnolda,"Aleksandrovo, Gradske lokacije, Subotica","<h2 _ngcontent-ng-c3151048826 class=""mat-headline-5"">Opis oglasa</h2><div _ngcontent-ng-c3151048826 class=""prose max-h-64 overflow-hidden text-gray-800 ng-star-inserted""><p>Prodajem plac od 580 m2 u Aleksandrovu u ulici Juraja Arnolda izuzetno pogodan za gradnju stambenog objekta. U ulici ima gas, struja, voda, kanalizacija, telefon.","Građevinsko zemljište na prodaju, Juraja Arnolda, 14.000€, 5a - 4zida",2024-01-12,uknjiženo 
214,https://www.4zida.rs/prodaja-placeva/mali-mokri-lug-zvezdara-opstina-beograd/gradjevinsko-zemljiste/6596890772167e68fa03983d,građevinsko zemljište ,3 a ,2348 ,pre 8 dana ,90.000,Đorđa Ilića,"Mali Mokri Lug, Zvezdara opština, Beograd","<h2 _ngcontent-ng-c3151048826 class=""mat-headline-5"">Opis oglasa</h2><div _ngcontent-ng-c3151048826 class=""prose max-h-64 overflow-hidden text-gray-800 ng-star-inserted""><p>Optimist Nekretnine Vam nude plac  od 3 ara sa kućom za rušenje. ","Građevinsko zemljište na prodaju, Đorđa Ilića, 90.000€, 3a - 4zida",2024-01-12,uknjiženo 
215,https://www.4zida.rs/prodaja-placeva/blok-53-kvantas-novi-beograd-beograd/gradjevinsko-zemljiste/63359bddf0d06bf03607ac37,građevinsko zemljište ,100 a ,1279 ,pre 8 meseci ,1.700.000,Autoput za Zagreb,"Blok 53 - Kvantaš, Novi Beograd, Beograd","<h2 _ngcontent-ng-c3151048826 class=""mat-headline-5"">Opis oglasa</h2><div _ngcontent-ng-c3151048826 class=""prose max-h-64 overflow-hidden text-gray-800 ng-star-inserted""><p>Prodajemo gradjevinski plac 10.000m2 - 1ha,auto put bg-zg, asfalt, sleperski prilaz, struja, gradski prevoz. Opticki kabal, parking. Pogodno za svaku namenu.","Građevinsko zemljište na prodaju, Autoput za Zagreb, 1.700.000€, 100a - 4zida",2024-01-12,uknjiženo 
216,https://www.4zida.rs/prodaja-placeva/palilula-palilula-opstina-beograd/gradjevinsko-zemljiste/64529932d94e0418b10b0e92,građevinsko zemljište ,2.43 a ,123260 ,pre 1 mesec ,630.000,Albanske spomenice,"Palilula, Palilula opština, Beograd","<h2 _ngcontent-ng-c3151048826 class=""mat-headline-5"">Opis oglasa</h2><div _ngcontent-ng-c3151048826 class=""prose max-h-64 overflow-hidden text-gray-800 ng-star-inserted""><p>Na vrhunskoj lokaciji prodaje se plac. Dozvoljena gradnja  spratnosti  P + 4, stepen izgrađenosti 60 %, bruto 800m2. agencijska provizija 2%","Građevinsko zemljište na prodaju, Albanske spomenice, 630.000€, 2a - 4zida",2024-01-12,uknjiženo 
217,https://www.4zida.rs/prodaja-placeva/bezanijska-kosa-novi-beograd-beograd/gradjevinsko-zemljiste/63f7bd9c78f9549d7b0e928b,građevinsko zemljište ,754 a ,15015 ,pre 8 meseci ,26.390.000,Bežanijska kosa,"Bežanijska kosa, Novi Beograd, Beograd","<h2 _ngcontent-ng-c3151048826 class=""mat-headline-5"">Opis oglasa</h2><div _ngcontent-ng-c3151048826 class=""prose max-h-64 overflow-hidden text-gray-800 ng-star-inserted""><p>Parcela sastavljena od tri parcele,zauzeće 50%,  na placu 12  uknjiženih objekata. Lokacija je namenjena za privrednu i komercijalnu delatnost.","Građevinsko zemljište na prodaju, Bežanijska kosa, 26.390.000€, 754a - 4zida",2024-01-12,uknjiženo 
218,https://www.4zida.rs/prodaja-placeva/meljak-barajevo-opstina-beograd/gradjevinsko-zemljiste/63eb9ae50b71938df00da19a,građevinsko zemljište ,15 a ,3639 ,pre 8 meseci ,20.000,Ustanička,"Meljak, Barajevo opština, Beograd","<h2 _ngcontent-ng-c3151048826 class=""mat-headline-5"">Opis oglasa</h2><div _ngcontent-ng-c3151048826 class=""prose max-h-64 overflow-hidden text-gray-800 ng-star-inserted""><p>Odličan, sunčan plac, pravougaonog oblika, sa prelepim pogledom, 100 metara do asfalta. Pogodan za gradnju, moguća prenamena iz poljoprivrednog u građevinsko zemljište.","Građevinsko zemljište na prodaju, Ustanička, 20.000€, 15a - 4zida",2024-01-12,uknjiženo 
219,https://www.4zida.rs/prodaja-placeva/duvanika-gradske-lokacije-zrenjanin/gradjevinsko-zemljiste/6363864d7324f231c6091f63,građevinsko zemljište ,190.37 a ,26248 ,pre 4 meseca ,50.000,Duvanika,"Duvanika, Gradske lokacije, Zrenjanin","<h2 _ngcontent-ng-c3151048826 class=""mat-headline-5"">Opis oglasa</h2><div _ngcontent-ng-c3151048826 class=""prose max-h-64 overflow-hidden text-gray-800 ng-star-inserted""><p>Duvanika - put ka Elemiru - plac površine 1,9ha ili 190,37 ara. Parcela se vodi kao poljoprivredno zemljište, njiva I klase, nalazi se uz magistralni put ka Elemiru. Mogućnost pretvaranja u građevinsko zemljište, niskonaponska struja do parcele, moguće priključenje na gas i kanalizaciju, ograđen plac, širina od 54m do 57m, uknjižen, jedan vlasnik.<br>Agencijska provizija za kupca je 1,5%, odnosno minimalno 300 evra.","Građevinsko zemljište na prodaju, Duvanika, 50.000€, 190a - 4zida",2024-01-12,
220,https://www.4zida.rs/prodaja-placeva/centar-gradske-lokacije-sombor/gradjevinsko-zemljiste/63514a0e86d8aa0b7f07037c,građevinsko zemljište ,708.34 a ,,pre 25 dana ,1,Ivana Antunovića bb,"Centar, Gradske lokacije, Sombor","<h2 _ngcontent-ng-c3151048826 class=""mat-headline-5"">Opis oglasa</h2><div _ngcontent-ng-c3151048826 class=""prose max-h-64 overflow-hidden text-gray-800 ng-star-inserted""><p>Prodaje se gradjevinsko zemljište u Somboru na samo kilometar od centra grada.<br>Veoma retko u ponudi, veličina placa od čak 70834m2. Uknjiženo.<br>U neposrednoj blizini sa zapadne strane predvidjena je izgradnja projekta obilaznice koja će povezati Sombor na severu sa Madjarskom, a na zapadu sa Hrvatskom, tako da će plac biti povezan sa najvažnijim evropskim putevima.<br>Plac je pogodan i za investitore i gradnju stambeno-poslovnih objekata.<br>Za više informacija budite slobodni da se obratite na email: zemljiste.sombor@gmail.com, ili na telefon : +381631748501<br>Cena dogovor.","Građevinsko zemljište na prodaju, Ivana Antunovića bb, 1€, 708a - 4zida",2024-01-12,uknjiženo 
221,https://www.4zida.rs/prodaja-placeva/klupci-okolne-lokacije-loznica/gradjevinsko-zemljiste/6500bdd7d22b0cc53e02ad14,građevinsko zemljište ,19 a ,,pre 2 meseca ,15.990,Marka Milanovića,"Klupci, Okolne lokacije, Loznica","<h2 _ngcontent-ng-c3151048826 class=""mat-headline-5"">Opis oglasa</h2><div _ngcontent-ng-c3151048826 class=""prose max-h-64 overflow-hidden text-gray-800 ng-star-inserted""><p>Prodajem plac pogodan za izgradnju stambenog objekta.","Građevinsko zemljište na prodaju, Marka Milanovića, 15.990€, 19a - 4zida",2024-01-12,uknjiženo 
222,https://www.4zida.rs/prodaja-placeva/gradske-lokacije-kikinda/gradjevinsko-zemljiste/655265a5f6478d0487066220,,,,,,,,,"Prodaja placeva Gradske lokacije, Kikinda, Građevinsko zemljište - 4zida",2024-01-12,
223,https://www.4zida.rs/prodaja-placeva/djurinci-sopot-opstina-beograd/gradjevinsko-zemljiste/64e480759595b748360239b5,građevinsko zemljište ,23.65 a ,4355 ,pre 4 meseca ,25.000,Slobodana Penezića-Krcuna,"Đurinci, Sopot opština, Beograd","<h2 _ngcontent-ng-c3151048826 class=""mat-headline-5"">Opis oglasa</h2><div _ngcontent-ng-c3151048826 class=""prose max-h-64 overflow-hidden text-gray-800 ng-star-inserted""><p>Na prodaju plac u građevinskom području, u Đurincima, opština Sopot, površine 23.65ari.<br>Zemljište je uz put koji spaja Sopot i Mladenovac, dimenzija 20x120m, iznad puta, održavan redovno i osunčan čitavog dana.<br>Sva infrastruktura je uz ivicu placa (struja, voda, gas, ulično svetlo, telefon), pa je pogodan za stambenu gradnju ili poslovne sadržaje.<br>Sa placa se pruža jako lep pogled na Kosmaj.","Građevinsko zemljište na prodaju, Slobodana Penezića-Krcuna, 25.000€, 23a - 4zida",2024-01-12,uknjiženo 
224,https://www.4zida.rs/prodaja-placeva/makis-cukarica-cukarica-opstina-beograd/gradjevinsko-zemljiste/63ee5bb9695b3ae2680e89b0,,,,,,,,,"Građevinsko zemljište na prodaju, Bore Stankovića, 156.105€, 34a - 4zida",2024-01-12,
225,https://www.4zida.rs/prodaja-placeva/draca-okolne-lokacije-kragujevac/gradjevinsko-zemljiste/5d6fb24227317160db70d123,građevinsko zemljište ,51 a ,1797 ,pre 8 meseci ,40.800,Drača,"Drača, Okolne lokacije, Kragujevac","<h2 _ngcontent-ng-c3151048826 class=""mat-headline-5"">Opis oglasa</h2><div _ngcontent-ng-c3151048826 class=""prose max-h-64 overflow-hidden text-gray-800 ng-star-inserted""><p>Plac se nalazi u Drači , veličine 51 ar, sa arteriskim bunarom i mogućnošću priključka za struju, koja je prošla pored placa. Sa jedne strane plac se graniči sa Gornjomilanovačkom ulicom - front od 70 metara do ulice. Plac je ravan . UKNJIŽEN","Građevinsko zemljište na prodaju, Drača, 40.800€, 51a - 4zida",2024-01-12,nije uknjiženo 
226,https://www.4zida.rs/prodaja-placeva/beska-okolne-lokacije-indjija/gradjevinsko-zemljiste/6075c0db51d1057ece354ad3,građevinsko zemljište ,232 a ,1252 ,pre 8 meseci ,1.272.000,Potez pod brdom,"Beška, Okolne lokacije, Inđija","<h2 _ngcontent-ng-c3151048826 class=""mat-headline-5"">Opis oglasa</h2><div _ngcontent-ng-c3151048826 class=""prose max-h-64 overflow-hidden text-gray-800 ng-star-inserted""><p>Izuzetan plac uz sami auto-put Beograd-Novi Sad kod petlje Beška .Na odličnoj lokaciji.<br>Trenutno je poljoprivredno zemljhište u perspektivi se predviđa da to bude građevinsko zemljište.<br>za sada prilaz zemljištu je sa sporednog makadamskog puta.<br>Uknjižen!<br>Odlična investicija! Agencijska provizija 2%","Građevinsko zemljište na prodaju, Potez pod brdom, 1.272.000€, 232a - 4zida",2024-01-12,uknjiženo 
227,https://www.4zida.rs/prodaja-placeva/pancevacki-put-krnjaca-palilula-opstina-beograd/gradjevinsko-zemljiste/650b19c78a1c93de4b00e3e7,građevinsko zemljište ,126 a ,6097 ,pre 3 meseca ,1.100.000,Zage Malivuk,"Pančevački put, Krnjača, Palilula opština, Beograd","<h2 _ngcontent-ng-c3151048826 class=""mat-headline-5"">Opis oglasa</h2><div _ngcontent-ng-c3151048826 class=""prose max-h-64 overflow-hidden text-gray-800 ng-star-inserted""><p>Gradjevinska  parcela podeljena na 4 dela ,  vlasništvo 1/1, u površinama  komercijalne  gradnje.<br>Odlicna  lokacija - neposredna  blizina kako  Pančevackog  puta  tako  I   novog  puta    ka  Zrenjaninskom  putu  I  mostu  Mihajla  Pupina.","Građevinsko zemljište na prodaju, Zage Malivuk, 1.100.000€, 126a - 4zida",2024-01-12,uknjiženo 
228,https://www.4zida.rs/prodaja-placeva/streliste-gradske-lokacije-pancevo/gradjevinsko-zemljiste/62951bdfac900d39240d7346,građevinsko zemljište ,90 a ,,pre 3 meseca ,405.000,Mileševska,"Strelište, Gradske lokacije, Pančevo","<h2 _ngcontent-ng-c3151048826 class=""mat-headline-5"">Opis oglasa</h2><div _ngcontent-ng-c3151048826 class=""prose max-h-64 overflow-hidden text-gray-800 ng-star-inserted""><p>Na prodaju građevinsko zemljište na Strelištu, na mirnoj lokaciji, Mileševska ulica, parcela je površine 9002m2, front je oko 35m, struja i voda u blizini placa. Za više informacija slobodno nas pozovite.","Građevinsko zemljište na prodaju, Mileševska, 405.000€, 90a - 4zida",2024-01-12,uknjiženo 
229,https://www.4zida.rs/prodaja-placeva/nemenikuce-sopot-opstina-beograd/gradjevinsko-zemljiste/63caea4668df1d783c002b6f,građevinsko zemljište ,134 a ,,pre 24 dana ,195.000,Kosmajskog odreda,"Nemenikuće, Sopot opština, Beograd","<h2 _ngcontent-ng-c3151048826 class=""mat-headline-5"">Opis oglasa</h2><div _ngcontent-ng-c3151048826 class=""prose max-h-64 overflow-hidden text-gray-800 ng-star-inserted""><p>Plac se nalazi 50m od glavnog puta.Duzinom placa ide put makadam koji je potreban da se ponovo nasipa. Ususkan i na mirnom mestu. parcele su 1570 i 1560/2. 130 ari. Vrlo lep plac. Ko zeli tisinu i da uziva u prirodi ovo je mesto za njega. Po mom misljenju onaj ko zeli kucu sa vinogradom recimo ili nekim drugim zasadom ovo je idealno mesto za to. Takodje moguce je napraviti i seoski turizam,s'obzirom da je Kosmaj zadnjih godina dosta razvijen po tom pitanju. Cena nije fiksna,moguca je mala korekcija.","Građevinsko zemljište na prodaju, Kosmajskog odreda, 195.000€, 134a - 4zida",2024-01-12,u procesu uknjižavanja 
230,https://www.4zida.rs/prodaja-placeva/lalinac-okolne-lokacije-nis/gradjevinsko-zemljiste/64d637010a50583e1a08c118,građevinsko zemljište ,14.95 a ,p,pre 5 meseci ,6.000,Novo selo,"Lalinac, Okolne lokacije, Niš","<h2 _ngcontent-ng-c3151048826 class=""mat-headline-5"">Opis oglasa</h2><div _ngcontent-ng-c3151048826 class=""prose max-h-64 overflow-hidden text-gray-800 ng-star-inserted""><p>Na prodaju poljoprivredno zemljište tj. njiva u blizini sela Lalinac. Površine 1495m2. Pravilnog pravouganog oblika, sa zemljanim pomoćnim putevima sa obe strane njive. Uknjižen, privatna svojina, čisto vlasništvo 1 kroz 1. Za više informacija slobodno pozovite.","Građevinsko zemljište na prodaju, Novo selo, 6.000€, 14a - 4zida",2024-01-12,
231,https://www.4zida.rs/prodaja-placeva/gradske-lokacije-smederevska-palanka/gradjevinsko-zemljiste/6530dba72c9670ab430628b6,građevinsko zemljište ,400 a ,,pre 22 dana ,565.000,Fruskogorska 31,"Gradske lokacije, Smederevska Palanka","<h2 _ngcontent-ng-c3151048826 class=""mat-headline-5"">Opis oglasa</h2><div _ngcontent-ng-c3151048826 class=""prose max-h-64 overflow-hidden text-gray-800 ng-star-inserted""><p>NA PRODAJU POLJOPRIVREDNO GRADJEVINSKO ZEMLJISTE OD 3.80h.NA KUDRECKOM JEZERU 1.U SMEDEREVSKOJ PALANCI.","Građevinsko zemljište na prodaju, Fruskogorska 31, 565.000€, 400a - 4zida",2024-01-12,uknjiženo 
232,https://www.4zida.rs/prodaja-placeva/makis-cukarica-cukarica-opstina-beograd/gradjevinsko-zemljiste/650d57f02aa590fa8807b776,,,,,,,,,"Građevinsko zemljište na prodaju, Bore Stankovica, 299.000€, 20a - 4zida",2024-01-12,
233,https://www.4zida.rs/prodaja-placeva/rumenka-okolne-lokacije-novi-sad/gradjevinsko-zemljiste/60b615f618271863335bbbd7,građevinsko zemljište ,11700 a ,,pre 3 meseca ,235.000,Kisački put bb,"Rumenka, Okolne lokacije, Novi Sad","<h2 _ngcontent-ng-c3151048826 class=""mat-headline-5"">Opis oglasa</h2><div _ngcontent-ng-c3151048826 class=""prose max-h-64 overflow-hidden text-gray-800 ng-star-inserted""><p>Građevinski plac uz glavni put, na izlasku iz Rumenke prema Kisaču, prilaz sa dve strane.<br>Za više informacija, pozovite...","Građevinsko zemljište na prodaju, Kisački put bb, 235.000€, 11700a - 4zida",2024-01-12,uknjiženo 
234,https://www.4zida.rs/prodaja-placeva/hum-okolne-lokacije-nis/gradjevinsko-zemljiste/62c2bd52aa10132acb101820,građevinsko zemljište ,17.19 a ,p,pre 8 meseci ,18.000,Hum,"Hum, Okolne lokacije, Niš","<h2 _ngcontent-ng-c3151048826 class=""mat-headline-5"">Opis oglasa</h2><div _ngcontent-ng-c3151048826 class=""prose max-h-64 overflow-hidden text-gray-800 ng-star-inserted""><p>Na prodaju domaćinstvo u selu Hum, koji se sastoji od 2 parcele, ukupne površine 17,19 ari. Na jednoj parceli se nalaze 2 stare kuće koje nisu uslovne za život, od kojih je jedna uknjižena na 74m2, kao i pomoćni objekat. U jednoj od kuća postoji strujomer koji je u funkciji, na parceli postoji priključak za vodu i postoji septička jama. Plac se nalazi na obodu sela, u podnožju Humske čuke, tako da izlazi na asfaltni put. Druga parcela koja je 20m daleko od prve je u samom podnožju Humske čuke, pa je okružena prirodom. Obe parcele su lepog pravilnog oblika i pogodne su za gradnju kuće ili vikendice za svakoga ko želi da uživa u zvucima prirode i ko želi beg od gradske buke.","Građevinsko zemljište na prodaju, Hum, 18.000€, 17a - 4zida",2024-01-12,
235,https://www.4zida.rs/prodaja-placeva/gradske-lokacije-smederevska-palanka/gradjevinsko-zemljiste/6470de30b128837c9a0b04c0,građevinsko zemljište ,11 a ,,pre 2 meseca ,11.000,Hajdučki potok,"Gradske lokacije, Smederevska Palanka","<h2 _ngcontent-ng-c3151048826 class=""mat-headline-5"">Opis oglasa</h2><div _ngcontent-ng-c3151048826 class=""prose max-h-64 overflow-hidden text-gray-800 ng-star-inserted""><p>Odlična lokacija, prelep pogled, zasad voća, brvnara, poljski toalet, ograđen. Strujni priključak ispred placa. Za sve dodatne informacije smo na raspolaganju.","Građevinsko zemljište na prodaju, Hajdučki potok, 11.000€, 11a - 4zida",2024-01-12,uknjiženo 
