,link,Površina,Broj etaža,Broj soba,Grejanje,Stanje,Godina izgradnje,Infrastruktura,Unutrašnje prostorije,Nameštenost,Opremljenost,Šifra oglasa,Oglas ažuriran,price,street,address,description,title,end_date,Uknjiženost,Garaža,Parking,Plac,Tip,Vodoinstalacija,Pogled na,Orijentacija nekretnine,Internet
237,https://www.4zida.rs/prodaja-kuca/gradska-bolnica-zvezdara-opstina-beograd/kuca/648064de2f4ec57b2d0eeed9,300 m² ,,8 soba ,grejanje na struju ,,1960,podrum ,,,telefon ,68156 ,pre 7 meseci ,430.000,Lovranska,"Gradska Bolnica, Zvezdara opština, Beograd","<h2 _ngcontent-ng-c3151048826 class=""mat-headline-5"">Opis oglasa</h2><div _ngcontent-ng-c3151048826 class=""prose max-h-64 overflow-hidden text-gray-800 ng-star-inserted""><p>U samoj Zvezdarskoj šumi kuća sagrađena 60-ih godina sa dve garaže i pomoćnom kućom.U zelenilu za svaku preporuku.Agencijska provizija 2% 1/2 Lovranska  -imamo slicne NEKRETNINE BEOGRAD https://www.gigant.rs/property-detail.php?id=68156","Kuća na prodaju, Lovranska, 430.000€, 300m² - 4zida",2024-01-16,uknjiženo ,,,3a plac ,,,,,
238,https://www.4zida.rs/prodaja-kuca/okolne-lokacije-nis/kuca/649ad4d63688852d4306e516,,,,,,,,,,,,,,,,,Pretraga Nekretnina za Prodaju i Izdavanje · 4zida,2024-01-16,,,,,,,,,
239,https://www.4zida.rs/prodaja-kuca/palilule-gradske-lokacije-kragujevac/jednoetazna/653d6cd1c04637c108001aa9,30 m² ,1,2 sobe ,grejanje na struju ,potrebno renoviranje ,,terasa ,kupatilo ,prazno ,Kanalizacija ,,pre 2 meseca ,18.500,Palilule,"Palilule, Gradske lokacije, Kragujevac","<h2 _ngcontent-ng-c3151048826 class=""mat-headline-5"">Opis oglasa</h2><div _ngcontent-ng-c3151048826 class=""prose max-h-64 overflow-hidden text-gray-800 ng-star-inserted""><p>Na prodaju kuća za renoviranje u naselju Palilule. Kuća je površine 30 m2 i ima pripadajući deo u zajedničkom dvorištu od 0.5 ari.","1-etažna kuća na prodaju, Palilule, 18.500€, 30m² - 4zida",2024-01-16,uknjiženo ,,,0.5a plac ,Kuća u nizu ,gradska voda ,,,
240,https://www.4zida.rs/prodaja-kuca/dudova-suma-gradske-lokacije-subotica/jednoetazna/641db4851f2aa28966059cff,274 m² ,1,5 soba ,etažno grejanje ,,,,"kuhinja, ostava ",,Kanalizacija ,8237 ,pre 2 meseca ,210.000,Dudova Šuma,"Dudova Šuma, Gradske lokacije, Subotica","<h2 _ngcontent-ng-c3151048826 class=""mat-headline-5"">Opis oglasa</h2><div _ngcontent-ng-c3151048826 class=""prose max-h-64 overflow-hidden text-gray-800 ng-star-inserted""><p>Prodaju se 2 kuće građene od čvrstog materijala sa lepo uređenim dvorištem. Prva kuća površine 202 m2 je renovirana i  u svom sastavu u prizemlju ima predsoblje, dnevnu, dečiju i spavaću sobu, gardarober, kupatilo, kuhinju sa trpezarijom i garažu. Na spratu se nalazi 1 soba i kupatilo. Podovi su tarket i pločice, stolarija drvena. Druga kuća površine 72 m2 u svom sastavu ima 1 sobu, kupatilo i 3 prostorije koje se trenutno koriste kao ostava. Podovi su laminat, pločice i beton u ostavama. Grejanje je podno na toplotne pumpe. Postoji priključak za gas. Struja je trofazna (dvotarifno brojilo) sa posebnim satovima za svaki objekat. Ugrađen je alarmni sistem, kamere i interfon. Kuća se prodaje sa nameštajem.","1-etažna kuća na prodaju, Dudova Šuma, 210.000€, 274m² - 4zida",2024-01-16,,,,6.97a plac ,Samostalna kuća ,gradska voda ,,,
241,https://www.4zida.rs/prodaja-kuca/futog-okolne-lokacije-novi-sad/kuca/63e60e5ca64768ce3b07d1d0,133 m² ,,5 soba ,grejanje na gas ,uobičajeno stanje ,,,,,,3000048 ,pre 8 meseci ,128.700,Futog,"Futog, Okolne lokacije, Novi Sad","<h2 _ngcontent-ng-c3151048826 class=""mat-headline-5"">Opis oglasa</h2><div _ngcontent-ng-c3151048826 class=""prose max-h-64 overflow-hidden text-gray-800 ng-star-inserted""><p>Odličnu petosobna kuća od 133 m2 u Futogu na placu od 611 m2. Kvalitetno građena – fasadna cigla. Može da funkcioniše kao 2 odvojena stana. Kuća ima kupatilo i zaseban toalet, kao i prostranu dvorišnu terasu. Većina soba u kući su prolazne kao kod salonskog tipa. Od podnih obloga u kući je postavljen parket, sem jedne sobe u kojoj je laminat. Iznad stambenog dela nalazi se tavanski prostor, a ispod jednog dela kuće i podrumski. Spoljna stolarija kao i unutrašnja je drvena. U dvorištu je kolski ulaz. Grejanje u kući je na gas, ali nije sprovedeno centralno grejanje već postoje gasne peći, kao i kaljeva peć. Iza kuće su 2 garaže, pomoćne prostorije, podrum (ukupno sa kućom oko 180 m2) i plodna bašta sa bunarom tehničke vode. Ima video nadzor i sve potrebne priključke: struju, vodu, kanalizaciju, fiksni telefon, kablovsku, internet i gas. Uknjižena 1/1 na vlasnika. Moguća zamena po dogovoru za manju kuću. Useljiva po dogovoru.<br>Kontakt 0693831003","Kuća na prodaju, Futog, 128.700€, 133m² - 4zida",2024-01-16,uknjiženo ,,,,,,,,
242,https://www.4zida.rs/prodaja-kuca/draca-okolne-lokacije-kragujevac/dvoetazna/63f5d2a88e2d271f34070da5,,,,,,,,,,,,,,,,,"Prodaja kuća Drača, Okolne lokacije, Kragujevac, Dvoetažna - 4zida",2024-01-16,,,,,,,,,
243,https://www.4zida.rs/prodaja-kuca/gradske-lokacije-sokobanja/jednoetazna/6352d38644e92c58720e9eef,58 m² ,1,4 sobe ,TA peć ,uobičajeno stanje ,,,,,,p,pre 8 meseci ,35.000,Sokobanja,"Gradske lokacije, Sokobanja","<h2 _ngcontent-ng-c3151048826 class=""mat-headline-5"">Opis oglasa</h2><div _ngcontent-ng-c3151048826 class=""prose max-h-64 overflow-hidden text-gray-800 ng-star-inserted""><p>Na prodaju seosko domaćinstvo nadomak Sokobanje u selu Nikolinac, u prelepom, prirodnom okruženju planina Ozren i Rtanj. U sklopu domaćinstva nalazi se jednoetažna kuća, starije gradnje sa podrumom, kovanica, površine u osnovi 58m2, jedan objekat za rušenje i dva pomoćna objekta, čvrste gradnje, od pune cigle sa betonskim pločama. Domaćinstvo se napaja vodom iz seoskog vodovoda, pored toga, na placu postoje i dva bunara, jedan sa pijaćom, a drugi sa tehničkom vodom. Domaćinstvo se prostire na placu veličine 6935m2, od toga je 1030m2 građevinsko zemljište, kao posebna parcela na kojoj se nalazi kuća. Kuća ima struju. Kuća i plac su uknjiženi, privatna svojina 1 kroz 2. Ovo je samo deo naše ponude, ovu kao i druge nekretnine sa većim brojem fotografija možete pogledati na našem sajtu.","1-etažna kuća na prodaju, Sokobanja, 35.000€, 58m² - 4zida",2024-01-16,uknjiženo ,,1 parking mesto ,,,,,,
244,https://www.4zida.rs/prodaja-kuca/gradske-lokacije-nova-crnja/jednoetazna/655b38db2af335c0c705f222,114 m² ,1,3 sobe ,grejanje na struju ,,1970,"dvorište, tavan, lođa ","kupatilo, toalet, kuhinja, ostava ",namešteno ,"kuhinjski elementi, rerna, šporet, ležaj, plakar ",,pre 1 mesec ,13.000,Marsala Tita 108,"Gradske lokacije, Nova Crnja","<h2 _ngcontent-ng-c3151048826 class=""mat-headline-5"">Opis oglasa</h2><div _ngcontent-ng-c3151048826 class=""prose max-h-64 overflow-hidden text-gray-800 ng-star-inserted""><p>Kuća u Novoj Crnji, 200 metara od centra naselja, dve sobe, dnevna soba, dve kuhinje, kupatilo, hodnik, pomoćne prostorije, veliko dvorište, bašta je velika. Zrenjanin je na 40 km, Kikinda na 25 km. Kuća je opremljena sa novim nameštajem (kuhinjski elementi i kreveti) jedino nedostaje frižider. Uz kuću dajem i nekoliko kupljenih radijatora. U svim prostorijama je laminat osim u letnjoj kuhinji.","1-etažna kuća na prodaju, Marsala Tita 108, 13.000€, 114m² - 4zida",2024-01-16,uknjiženo ,,javni parking van zone ,600a plac ,Seoska kuća ,gradska voda ,"ulicu, dvorište ",,
245,https://www.4zida.rs/prodaja-kuca/gat-gradske-lokacije-subotica/kuca/63e6199878b26c9812049265,,,,,,,,,,,,,,,,,Pretraga Nekretnina za Prodaju i Izdavanje · 4zida,2024-01-16,,,,,,,,,
246,https://www.4zida.rs/prodaja-kuca/tesla-gradske-lokacije-pancevo/kuca/644175fcce9f329abf089c4f,,,,,,,,,,,,,,,,,Pretraga Nekretnina za Prodaju i Izdavanje · 4zida,2024-01-16,,,,,,,,,
247,https://www.4zida.rs/prodaja-kuca/popovac-okolne-lokacije-nis/jednoetazna/64fb10988b2d64c753002a11,80 m² ,1,3 sobe ,grejanje na struju ,potrebno renoviranje ,,terasa ,kupatilo ,,,p,pre 4 meseca ,35.000,Popovac,"Popovac, Okolne lokacije, Niš","<h2 _ngcontent-ng-c3151048826 class=""mat-headline-5"">Opis oglasa</h2><div _ngcontent-ng-c3151048826 class=""prose max-h-64 overflow-hidden text-gray-800 ng-star-inserted""><p>Na prodaju kuća u Popovcu, na samo 5 km od centra, 81 m2 na 23 ara placa. Nalazi se u samom centru sela ali ipak izolovana od gužve i buke. Kuća se sastoji od starog i novog dela. Stari deo čini ulazni hodnik, dnevni boravak sa kuhinjom, spavaća soba i kupatilo, dok je noviji deo kuće u funkciji jednoiposobnog stana, sa zasebnim ulazom. Ispod novog dela nalazi se podrumska prostorija. Dvorište je prostrano, pod blagim nagibom, puno zelenila i idealno za beg od gradske vreve. Na placu se nalaze i pomoćni objekti. Kuća ima gradski vodovod, struju i kanalizaciju. Uknjižena je, uredno vlasništvo. Ovo je samo deo naše ponude, za više informacija, stojimo vam na raspolaganju.","1-etažna kuća na prodaju, Popovac, 35.000€, 80m² - 4zida",2024-01-16,uknjiženo ,1 garažno mesto ,,,,,,,
248,https://www.4zida.rs/prodaja-kuca/bagljas-gradske-lokacije-zrenjanin/kuca/627a5cc592b8a70b505c3208,131 m² ,,,,,,,kupatilo ,,,12611414 ,pre 10 meseci ,92.000,Bagljaš,"Bagljaš, Gradske lokacije, Zrenjanin","<h2 _ngcontent-ng-c3151048826 class=""mat-headline-5"">Opis oglasa</h2><div _ngcontent-ng-c3151048826 class=""prose max-h-64 overflow-hidden text-gray-800 ng-star-inserted""><p>Ekskluzivna prodaja! Prizemna trosobna kuća 106m2 građena kompletno čvrstim materijalima<br>(temelji rađen za spratnu kuću, betonska ploča) - jednosoban stan 24 m2. Pre godinu dana zamenjen<br>kompletan krov, parket podovi, centralno grejanje, plin, trofazna struja. Lokacija je sam centar naselja<br>Bagljaš tj. na minut hoda od pijace, škole, marketa... Cena nije fiksna, moguć dogovor.","Kuća na prodaju, Bagljaš, 92.000€, 131m² - 4zida",2024-01-16,,,,5a plac ,,,,,
249,https://www.4zida.rs/prodaja-kuca/novi-slankamen-okolne-lokacije-indjija/jednoetazna/64e48403041c740dce08a0cb,99 m² ,1,3 sobe ,etažno grejanje ,,,,"kupatilo, kuhinja, ostava ",prazno ,,I,pre 4 meseca ,45.000,Novi Slankamen,"Novi Slankamen, Okolne lokacije, Inđija","<h2 _ngcontent-ng-c3151048826 class=""mat-headline-5"">Opis oglasa</h2><div _ngcontent-ng-c3151048826 class=""prose max-h-64 overflow-hidden text-gray-800 ng-star-inserted""><p>Prizemna kuća 99 m2, na placu od 7,5 ari (širina placa preko 17 m). Struktura prostora: predsoblje, dnevni boravak sa kuhinjom i ostavom, dve sobe, kupatilo. PVC stolarija; podovi: laminat i keramika; struja monofazna; voda iz mreže. Pomoćne prostorije: šupa, pušnica Bašta. I-959/NS","1-etažna kuća na prodaju, Novi Slankamen, 45.000€, 99m² - 4zida",2024-01-16,uknjiženo ,,,7.5a plac ,Samostalna kuća ,gradska voda ,,,
250,https://www.4zida.rs/prodaja-kuca/25-maj-gradske-lokacije-sremska-mitrovica/kuca/64ca1278990dc0a36e0b8799,220 m² ,,5 soba ,centralno grejanje ,,1988,"podrum, terasa ",kupatilo ,prazno ,telefon ,18618 ,pre 10 dana ,220.000,25. Maj,"25. Maj, Gradske lokacije, Sremska Mitrovica","<h2 _ngcontent-ng-c3151048826 class=""mat-headline-5"">Opis oglasa</h2><div _ngcontent-ng-c3151048826 class=""prose max-h-64 overflow-hidden text-gray-800 ng-star-inserted""><p>U ponudi je jedinstvena, fenomenalna kuća, prizemlje sa potkrovljem. Četiri komotne sobe u prizemlju i jedna velike prostorija sa dve manje u potkrovlju.<br>U sklopu kuće je još jedna stambena jedinica sa dnevno-trpezarijskim delom, još jednom kuhinjom i delom koji služi kao kotlarnica u kojoj se nalazi sistem grejanja na čvrsto gorivo i struju. Uveden gas i instaliran kotao za gasno grejanje.<br>Kuća je izgrađena od kvalitetnih materijala, uglavnom uvezenih iz Nemačke. Stolarija je kompletno iz uvoza - unikatna i visokokvalitetna. Uvozni parket i luksuzna, prvoklasna keramika.<br>Stepenište napravljeno od čistog drveta i kovanog gvožđa, nameštaj specijalne izrade.<br>U sklopu kuće, na placu od 5 ari nalaze se vinski podrum, garaža, prostorija koja je služila kao radionica i posebna prostorija za ogrev.<br>Kuća se prodaje kompletno nameštena i sa svim aparatima za domaćinstvo.<br>Savetujemo da zakažete gledanje ove kuće, jer je teško samo na osnovu opisa i slika sagledati kvalitet gradnje, nameštaja, uređenje dvorišta i funkcionalnost celog objekta.","Kuća na prodaju, 25. Maj, 220.000€, 220m² - 4zida",2024-01-16,uknjiženo ,1 garažno mesto ,,,,,,,
251,https://www.4zida.rs/prodaja-kuca/makova-sedmica-gradske-lokacije-subotica/kuca/65549a98db04b11706055d22,164 m² ,,4 sobe ,,,,,kupatilo ,,telefon ,770347 ,pre 2 meseca ,64.000,Makova Sedmica,"Makova Sedmica, Gradske lokacije, Subotica","<h2 _ngcontent-ng-c3151048826 class=""mat-headline-5"">Opis oglasa</h2><div _ngcontent-ng-c3151048826 class=""prose max-h-64 overflow-hidden text-gray-800 ng-star-inserted""><p>Prodaje se prizemna samostalna kuća površine 164m2 na placu ukupne površine 1363m2.<br>Kuća je građena od čvrstog materijala, sa toplim podom na podovima i pvc stolarijom. Struja je trofazna, grejanje je etažno na gas i čvrsto gorivo, vodom se snabdeva iz bušenog bunara dubine 52m, a u dvorištu se nalazi septička jama. Kuća se sastoji iz dnevnog boravka, kuhinje sa trpezarijom, ostave, tri spavaće sobe, kupatila i hodnika. U dvorištu kuće se nalaze dve garaže. Ev.Br. 5474","Kuća na prodaju, Makova Sedmica, 64.000€, 164m² - 4zida",2024-01-16,,1 garažno mesto ,,,,,,,
252,https://www.4zida.rs/prodaja-kuca/gradske-lokacije-sremska-mitrovica/dvoetazna/649d67a2a8caf2e1f30aef93,,,,,,,,,,,,,,,,,"2-etažna kuća na prodaju, Gradske lokacije, 98.000€, 100m² - 4zida",2024-01-16,,,,,,,,,
253,https://www.4zida.rs/prodaja-kuca/banja-vrdnik-okolne-lokacije-irig/jednoetazna/653d6b6a84253d1d050f2954,79 m² ,1,3 sobe ,,renovirano ,,"dvorište, podrum, terasa ","kupatilo, ostava ",namešteno ,"veš mašina, kuhinjski elementi, sudo mašina, frižider, zamrzivač, rerna, šporet, ležaj, plakar, ugradni plakar, Kanalizacija ",8002 ,pre 3 dana ,218.000,Banja Vrdnik,"Banja Vrdnik, Okolne lokacije, Irig","<h2 _ngcontent-ng-c3151048826 class=""mat-headline-5"">Opis oglasa</h2><div _ngcontent-ng-c3151048826 class=""prose max-h-64 overflow-hidden text-gray-800 ng-star-inserted""><p>Na prodaju je očaravajuća kuća i plac smešteni u srcu prirode, u termalnoj i vazdušnoj banji Vrdnik, na čarobnoj Fruškoj Gori. Ova ponuda dolazi sa dve izvanredne opcije.","1-etažna kuća na prodaju, Banja Vrdnik, 218.000€, 79m² - 4zida",2024-01-16,uknjiženo ,,,40a plac ,Samostalna kuća ,gradska voda ,,,
254,https://www.4zida.rs/prodaja-kuca/gornja-toponica-okolne-lokacije-nis/jednoetazna/611bb1c86cbf93595664cecc,170 m² ,1,4 sobe ,grejanje na struju ,,,terase (3,,,,p,pre 8 meseci ,60.000,Berčinac,"Gornja Toponica, Okolne lokacije, Niš","<h2 _ngcontent-ng-c3151048826 class=""mat-headline-5"">Opis oglasa</h2><div _ngcontent-ng-c3151048826 class=""prose max-h-64 overflow-hidden text-gray-800 ng-star-inserted""><p>Na prodaju lepa kuća u Gornjoj Topinici koja se nalazi na placu od 8.5 ara. Plac je u kaskadama, do kuce se dolazi stepenicama. Dvoriste i kuca su pokriveni sa video nadzorom, kao i lampama koje osvetljavaju celo dvoriste.							","1-etažna kuća na prodaju, Berčinac, 60.000€, 170m² - 4zida",2024-01-16,,1 garažno mesto ,,,,,,,
255,https://www.4zida.rs/prodaja-kuca/klisa-gradske-lokacije-novi-sad/kuca/64a2cafaabedce0c8b0e0131,116 m² ,,3 sobe ,,uobičajeno stanje ,,terasa ,,,,3089994 ,pre 6 meseci ,144.200,Klisa,"Klisa, Gradske lokacije, Novi Sad","<h2 _ngcontent-ng-c3151048826 class=""mat-headline-5"">Opis oglasa</h2><div _ngcontent-ng-c3151048826 class=""prose max-h-64 overflow-hidden text-gray-800 ng-star-inserted""><p>Agencijska oznaka 3089994<br>Na prodaju, uknjižen deo kuće na Klisi.<br>Kuća se sastoji od kupatila, tri spavaće sobe, prostranog dnevnog boravka, uvučene kuhinje sa ostavom, dve terase. Potkrovlje od 97m2 je u sirovom stanju.<br>Kuća ima odvojen ulaz i svu infrastukturu. Grejanje je centralno na gas. U blizini se nalazi osnovna škola, vrtić, marketi, autobuska stajališta.<br>Za više informacija 066493438 INA","Kuća na prodaju, Klisa, 144.200€, 116m² - 4zida",2024-01-16,uknjiženo ,,,,,,,,
256,https://www.4zida.rs/prodaja-kuca/novo-selo-gradske-lokacije-subotica/kuca/630c9218fe1145f1ad06ae67,,,,,,,,,,,,,,,,,Pretraga Nekretnina za Prodaju i Izdavanje · 4zida,2024-01-16,,,,,,,,,
257,https://www.4zida.rs/prodaja-kuca/veliko-polje-okolne-lokacije-kragujevac/kuca/65020b755e2d86164e0c202c,277 m² ,,6 soba ,grejanje na gas ,,,terasa ,kupatila (2) ,,,2619 ,pre 4 meseca ,92.000,Veliko Polje,"Veliko Polje, Okolne lokacije, Kragujevac","<h2 _ngcontent-ng-c3151048826 class=""mat-headline-5"">Opis oglasa</h2><div _ngcontent-ng-c3151048826 class=""prose max-h-64 overflow-hidden text-gray-800 ng-star-inserted""><p>Kuća u Velikom polju, pogodna za život dve porodice. Etažirana na dve stambene jedinice i svaka od njih ima deo pomoćnih prostorija. Struktura prizemlja: hodnik, kupatilo, kuhinja sa trpezarijom, dnevni boravak, spavaća soba. U okviru prizemlja garaža. Unutrašnje stepenice za sprat. Struktura sprata: hodnik, kupatilo, četiri spavaće sobe od kojih tri izlaze na terasu. Prizemlje kuće je useljivo, dok su sprat i potkrovlje nezavršeni. Mogućnost kupovine putem stambenog kredita.","Kuća na prodaju, Veliko Polje, 92.000€, 277m² - 4zida",2024-01-16,uknjiženo ,1 garažno mesto ,,5a plac ,,,,,
258,https://www.4zida.rs/prodaja-kuca/radnicko-naselje-gradske-lokacije-leskovac/kuca/6458e9b2eee963fb7c09f7a6,100 m² ,,10 soba ,,,,,,prazno ,,3451 ,pre 8 meseci ,32.000,Radničko Naselje,"Radničko Naselje, Gradske lokacije, Leskovac","<h2 _ngcontent-ng-c3151048826 class=""mat-headline-5"">Opis oglasa</h2><div _ngcontent-ng-c3151048826 class=""prose max-h-64 overflow-hidden text-gray-800 ng-star-inserted""><p>Prodaje se prizemna kuća u Radničkom naselju, u blizini NIS-ove pumpe. Kuća je površine 100m2, nalazi se na placu površine 2,82a. Na placu se nalazi i pomoćni objekat i garaža od 24m2. Kuća se sastoji od dva hodnika, dve spavaće sobe, kupatila i velike dnevne sobe sa kuhinjom. Poseduje dva ulaza. Polovina kuće je karatavan, a polovina je betonska ploča. Hvala Vam što ste pogledali oglas. Za više informacija o ovoj ili drugim nekretninama i zakazivanje razgledanja kontaktirajte agenta na broj telefona iz oglasa (poziv, sms, viber) ili putem e-maila. Kompletnu ponudu dostupnih nekretnina možete pronaći na našem sajtu.","Kuća na prodaju, Radničko Naselje, 32.000€, 100m² - 4zida",2024-01-16,uknjiženo ,1 garažno mesto ,,3a plac ,,,,,
259,https://www.4zida.rs/prodaja-kuca/stari-banovci-okolne-lokacije-stara-pazova/troeatazna/5fa707367cdcf552481b22d2,470 m² ,3,10 soba ,centralno grejanje ,novo ,2001,terase (3,"kupatila (4), toaleti (2) ",prazno ,,,pre 4 dana ,235.000,Stari Banovci,"Stari Banovci, Okolne lokacije, Stara Pazova","<h2 _ngcontent-ng-c3151048826 class=""mat-headline-5"">Opis oglasa</h2><div _ngcontent-ng-c3151048826 class=""prose max-h-64 overflow-hidden text-gray-800 ng-star-inserted""><p>Kuća se sastoji od dva odvojena poslovno stambena objekta, u prizemlju su lokala od po 70 m/2, koje je moguće spojiti, na spratu dva stana od po 150 m/2. U dvorištu garaža od 25 m/2.Pogodno za poslovno stambeni objekt, hostel ili pretvarawe u 6-8 stanova.","3-etažna kuća na prodaju, Stari Banovci, 235.000€, 470m² - 4zida",2024-01-16,uknjiženo ,1 garažno mesto ,"10 parking mesta, u dvorištu zgrade ",7a plac ,Dvojna kuća ,,,,
260,https://www.4zida.rs/prodaja-kuca/sangaj-batajnica-zemun-opstina-beograd/dvoetazna/5a1efbebadb11423e250c406,200 m² ,2,6 soba ,etažno grejanje ,novo ,2000,"dvorište, tavan, podrum, terase (2), lođe (2) ","kupatila (2), kuhinja, ostava ",polunamešteno ,"telefon, kablovska, internet, TV, kuhinjski elementi, rerna, šporet, ležaj ",,pre 3 meseca ,200.000,Šangaj,"Šangaj, Batajnica, Zemun opština, Beograd","<h2 _ngcontent-ng-c3151048826 class=""mat-headline-5"">Opis oglasa</h2><div _ngcontent-ng-c3151048826 class=""prose max-h-64 overflow-hidden text-gray-800 ng-star-inserted""><p>Zamena za 2 manje nekretnine, poželjno u Batajnici ili Beogradu. Na placu od 6 ari kuća, u osnovi 10x10 m, 200 kvadrata, garaža 50 m2, plac oko kuće i garaže, 4.5 ara. Sve je uknjiženo. Parcela je 1/1. Legalizacija u toku. Kuća je sagrađena 2005. god. Dupla temeljna ploča. Na placu trešnje, višnje, kajsija, loza. Fasada je termoizolovana. Prizemlje ima dopunsku termoizolaciju sa unutrašnje strane. Gasovod. Optički kabl Telekoma (Supernova) - internet 100 mbps, TV, telefon. Infostan oko 500 din. 10 minuta do beogradskog aerodroma, 20 minuta do Novog Beograda. 1,5 km do Beovoza. 2 km do centra Batajnice. Miran kraj. Odlične komšije.","2-etažna kuća na prodaju, Šangaj, 200.000€, 200m² - 4zida",2024-01-16,uknjiženo ,1 garažno mesto ,"3 parking mesta, u dvorištu zgrade ",6a plac ,Samostalna kuća ,gradska voda ,,,Optički 
261,https://www.4zida.rs/prodaja-kuca/malo-golovode-gradske-lokacije-krusevac/dvoetazna/65535ddc766180f4a7098c42,230 m² ,2,5 soba ,centralno grejanje ,uobičajeno stanje ,,terasa ,kupatilo ,prazno ,,,pre 1 mesec ,73.000,Trg Fontana,"Malo Golovode, Gradske lokacije, Kruševac","<h2 _ngcontent-ng-c3151048826 class=""mat-headline-5"">Opis oglasa</h2><div _ngcontent-ng-c3151048826 class=""prose max-h-64 overflow-hidden text-gray-800 ng-star-inserted""><p>Na prodaju kuca velicine 230 m2 korisne povrsine,na placu od 4 ara,kuca je legalizovana nalazi se u Malom Golovodu,odlicna investicija za zivot.","2-etažna kuća na prodaju, Trg Fontana, 73.000€, 230m² - 4zida",2024-01-16,uknjiženo ,,,4a plac ,Samostalna kuća ,,,,
262,https://www.4zida.rs/prodaja-kuca/borca-palilula-opstina-beograd/dvoetazna/6436be53e58fccfa910e68a2,122 m² ,2,3 sobe ,grejanje na struju ,uobičajeno stanje ,,"dvorište, tavan, terasa ",kupatila (2) ,prazno ,telefon ,1831 ,pre 8 meseci ,103.000,Atovi nova 13.,"Borča, Palilula opština, Beograd","<h2 _ngcontent-ng-c3151048826 class=""mat-headline-5"">Opis oglasa</h2><div _ngcontent-ng-c3151048826 class=""prose max-h-64 overflow-hidden text-gray-800 ng-star-inserted""><p>Plac 10 ari 1/1, Odlična lokacija .Na placu su izgradjene dve stambene jedinice 79m2 uknjiženo,a druga 42 m2 u fazi ozakonjenja.Struja odvojena.Više pomoćnih objekata . širina placa do ulice 22 m.","2-etažna kuća na prodaju, Atovi nova 13., 103.000€, 122m² - 4zida",2024-01-16,,1 garažno mesto ,1 parking mesto ,10a plac ,,,,,
263,https://www.4zida.rs/prodaja-kuca/ker-gradske-lokacije-subotica/kuca/6401e5e0edb1b7efc404968b,145 m² ,,3 sobe ,,,,,,,,NK,pre 8 meseci ,72.000,Ker,"Ker, Gradske lokacije, Subotica","<h2 _ngcontent-ng-c3151048826 class=""mat-headline-5"">Opis oglasa</h2><div _ngcontent-ng-c3151048826 class=""prose max-h-64 overflow-hidden text-gray-800 ng-star-inserted""><p>Prodaje se 3s kuća u Keru, povrsine 145m2,na placu od 201m2, kuća se sastoji iz dve spavaće sobe, velikog dnevnog boravka, kuhinje sa prostranom trpezarijom i ostavom,kupatilo i odvojen toalet. Grejanje centralno na gas, struju i čvrsto gorivo. Kuća je građena od čvrstog materijala, legalizovana, na podovima parketi i keramira, stolarija drvena u odličnom stanju. Može zamena za dvosoban stan, prioritet su stanovi na Prozivci.","Kuća na prodaju, Ker, 72.000€, 145m² - 4zida",2024-01-16,,,,,,,,,
264,https://www.4zida.rs/prodaja-kuca/kupusina-okolne-lokacije-apatin/kuca/6526693cb6e782fa790800e5,,,,,,,,,,,,,,,,,Pretraga Nekretnina za Prodaju i Izdavanje · 4zida,2024-01-16,,,,,,,,,
265,https://www.4zida.rs/prodaja-kuca/ribare-okolne-lokacije-jagodina/dvoetazna/65034dca93f0a94c300854a9,49 m² ,2,3 sobe ,grejanje na struju ,potrebno renoviranje ,,,,prazno ,,,pre 18 dana ,32.000,Ribare,"Ribare, Okolne lokacije, Jagodina","<h2 _ngcontent-ng-c3151048826 class=""mat-headline-5"">Opis oglasa</h2><div _ngcontent-ng-c3151048826 class=""prose max-h-64 overflow-hidden text-gray-800 ng-star-inserted""><h3><strong>NA 7KM OD JAGODINE</strong></h3><p>Vikend kuća od 49m2 na placu od 5ari pored Velike Morave na samo 7km od Jagodine.Kuća ima struju,gradsku vodu,betonsku ploču i asfaltni prilaz.Prodaje se sa svim stvarima.","2-etažna kuća na prodaju, Ribare, 32.000€, 49m² - 4zida",2024-01-16,uknjiženo ,,,5a plac ,Vikendica ,,,,
266,https://www.4zida.rs/prodaja-kuca/centa-okolne-lokacije-zrenjanin/dvoetazna/643f9e6523075c296d010291,94 m² ,2,3 sobe ,grejanje na struju ,,,"dvorište, terasa ",kupatilo ,prazno ,Kanalizacija ,,pre 8 meseci ,25.000,Čenta,"Čenta, Okolne lokacije, Zrenjanin","<h2 _ngcontent-ng-c3151048826 class=""mat-headline-5"">Opis oglasa</h2><div _ngcontent-ng-c3151048826 class=""prose max-h-64 overflow-hidden text-gray-800 ng-star-inserted""><p>Spratna kuća u Čenti na dobroj lokciji, od prostorija sadrži hodnik, kuhinja, ostava, soba, kupatilo; na spratu se nalaze 2 sobe i natkrivena terasa. Kuća treba da se završi iznutra, postavljena PVC stolarija, urađen veći deo fasade, grejanje na struju. Površina kuće 94m2, plac 353m2, na placu se nalaze pomoćni objekti ( garaža i šupa).","2-etažna kuća na prodaju, Čenta, 25.000€, 94m² - 4zida",2024-01-16,uknjiženo ,1 garažno mesto ,,3.53a plac ,Samostalna kuća ,gradska voda ,,,
