,link,Površina,Broj soba,Uknjiženost,Stanje,Parking,Infrastruktura,Unutrašnje prostorije,Šifra oglasa,Oglas ažuriran,price,street,address,description,title,end_date,Tip,Broj etaža,Plac,Grejanje,Opremljenost,Nameštenost,Godina izgradnje,Vodoinstalacija,Garaža,Internet,Orijentacija nekretnine,Pogled na
331,https://www.4zida.rs/prodaja-kuca/gradske-lokacije-zlatibor/kuca/644d2e25907868fcdb0b5338,111 m² ,,,,,,,5093 ,pre 7 meseci ,300.000,Gradske lokacije,"Gradske lokacije, Zlatibor","<h2 _ngcontent-ng-c3754543513 class=""mat-headline-5"">Opis oglasa</h2><div _ngcontent-ng-c3754543513 class=""prose max-h-64 overflow-hidden text-gray-800 ng-star-inserted""><p>Prodajemo jedinstvenu drvenu kuću na Zlatiboru od sibirskog kedra, 111m2, puna ručno obrađena oblica (prečnik 35cm).<br>Savršena lokacija: 2,5 km od hotela Mona i Palisad, na periferiji naseljenog mesta Zlatibor sa prelepim pogledom na dva najviša Zlatiborska vrha Tornik i Cigotu, 20m od hotela i apartmanskog naselja Hemel. Kuća se može iznajmljivati preko hotelske službe. Vikendica se prodaje bez zemljišta, postoji mogućnost kupovine zemljištaa po ceni 6500 e /ar. Cena : 300.000 eura.","Kuća na prodaju, Gradske lokacije, 300.000€, 111m² - 4zida",2023-12-19,,,,,,prazno ,,,,,,
332,https://www.4zida.rs/prodaja-kuca/koracica-mladenovac-opstina-beograd/troeatazna/6425c6ee8ab17184d40f28ee,160 m² ,9 soba ,uknjiženo ,,,"dvorište, terasa ",kupatilo ,1189 ,pre 8 meseci ,120.000,Koraćica,"Koraćica, Mladenovac opština, Beograd","<h2 _ngcontent-ng-c3754543513 class=""mat-headline-5"">Opis oglasa</h2><div _ngcontent-ng-c3754543513 class=""prose max-h-64 overflow-hidden text-gray-800 ng-star-inserted""><p>Šifra: K581<br>Prodaje se velika nameštena kuća površine 160 m², koja se nalazi na Kosmaju na placu od 16 ari. Ima asfaltni prilaz i gradsku vodu. Udaljena je oko 20 km od centra Mladenovca i oko 60 km od Beograda. Kosmaj predstavlja idealnu lokaciju za odmor i uživanje u prirodi.<br>Ukoliko želite više informacija, pozovite broj:<br>  063/70-30-538 - Nataša<br>  062/80-10-641 - Tanja","3-etažna kuća na prodaju, Koraćica, 120.000€, 160m² - 4zida",2023-12-19,,3,16a plac ,centralno grejanje ,telefon ,prazno ,,,,,,
333,https://www.4zida.rs/prodaja-kuca/elemir-okolne-lokacije-zrenjanin/jednoetazna/6481e2c7a73d9515970f2472,,,,,,,,,,,,,,"Prodaja kuća Elemir, Okolne lokacije, Zrenjanin, Jednoetažna - 4zida",2023-12-19,,,,,,,,,,,,
334,https://www.4zida.rs/prodaja-kuca/curug-okolne-lokacije-zabalj/jednoetazna/62d4f9c83ff53d9da7061ae7,,,,,,,,,,,,,,"1-etažna kuća na prodaju, Cara Dušana, 160.000€, 816m² - 4zida",2023-12-19,,,,,,,,,,,,
335,https://www.4zida.rs/prodaja-kuca/aleksandrovo-gradske-lokacije-subotica/jednoetazna/649dd4b7fda0f9b157045e40,134 m² ,2 sobe ,uknjiženo ,,,"dvorište, tavan, alarm, lođa ","kupatilo, toalet, kuhinja, ostava ",Agencija ,pre 22 dana ,75.000,Aleksandrovo,"Aleksandrovo, Gradske lokacije, Subotica","<h2 _ngcontent-ng-c3754543513 class=""mat-headline-5"">Opis oglasa</h2><div _ngcontent-ng-c3754543513 class=""prose max-h-64 overflow-hidden text-gray-800 ng-star-inserted""><p><strong>Porodična stambena zgrada površine 130 m2, u blizini svetilišta Bunarić. Sastoji</strong> se od dnevnog boravka, spavaće sobe, kuhinje sa trpezarijom , nelika lođa ili veranda, kupatilo, hodnik i dve garaže, od kojih se jedna može jednostavno pretvoriti u treću sobu, zamenom garažnih vrata sa prozorom. Garažna vrata su na daljinsko upravljanje. <strong>Dvorište je uređen park površine 1211 m2.</strong>","1-etažna kuća na prodaju, Aleksandrovo, 75.000€, 134m² - 4zida",2023-12-19,Samostalna kuća ,1,12a plac ,grejanje na gas ,"telefon, TV, klima, veš mašina, kuhinjski elementi, frižider, zamrzivač, rerna, šporet, ležaj, plakar, Kanalizacija ",polunamešteno ,2000,gradska voda ,2 garažna mesta ,Satelitski ,"istok, zapad ","ulicu, dvorište "
336,https://www.4zida.rs/prodaja-kuca/petlovo-brdo-rakovica-opstina-beograd/dvoetazna/63c69f9399d5c75efc049377,,,,,,,,,,,,,,"Prodaja kuća Petlovo Brdo, Rakovica opština, Beograd, Dvoetažna - 4zida",2023-12-19,,,,,,,,,,,,
337,https://www.4zida.rs/prodaja-kuca/grocka-grocka-opstina-beograd/dvoetazna/638498c410b7c9a9fa033d18,210 m² ,5 soba ,uknjiženo ,uobičajeno stanje ,,,,7469 ,pre 5 meseci ,152.000,Đure Đakovića,"Grocka, Grocka opština, Beograd","<h2 _ngcontent-ng-c3754543513 class=""mat-headline-5"">Opis oglasa</h2><div _ngcontent-ng-c3754543513 class=""prose max-h-64 overflow-hidden text-gray-800 ng-star-inserted""><p>OPIS NEPOKRETNOSTI: Vertikala kuće u samom centru Kaluđerice, sa dvorištem ispred i iza kuće, odvojena fizički od druge polovine sa ogradom. U desnom uglu ispred kuće nalazi se lokal površine 30kvm, koji se izdaje. U neposrednoj blizini su Dom zdravlja, škola, preko puta vrtić. Autobus 309, stanica u blizini kuće, tržni centar Point. PROSTORIJE: I nivo: spavaća soba, dnevni boravak sa kuhinjom, kupatilo II nivo: soba spavaća, dnevni boravak sa kuhinjom, kupatilo III nivo: nezavršen, samo grubi radovi.","2-etažna kuća na prodaju, Đure Đakovića, 152.000€, 210m² - 4zida",2023-12-19,,2,,grejanje na struju ,telefon ,,,,,,,
338,https://www.4zida.rs/prodaja-kuca/futog-okolne-lokacije-novi-sad/kuca/62fc24ea66e294c0e405f824,155 m² ,6 soba ,,uobičajeno stanje ,,terasa ,,3090182 ,pre 3 meseca ,190.000,"FUTOG, FUTOG","Futog, Okolne lokacije, Novi Sad","<h2 _ngcontent-ng-c3754543513 class=""mat-headline-5"">Opis oglasa</h2><div _ngcontent-ng-c3754543513 class=""prose max-h-64 overflow-hidden text-gray-800 ng-star-inserted""><p>Agencijska oznaka 3090182<br>Na prodaju kuća u Futogu izgradjena 2019-te godine. Kuća je gradjena blok+stiropor 10 cm. Prizemlje se sastoji od odvojene kuhinje sa svojim prozorom, trpezarije u sklopu dnevnog boravka, jedne spavaće sobe, kupatila i garaže. Na spratu se nalaze 4 sobe i kupatilo.  Kuća ima vodu, struju, kanalizaciju, gas je prošao pored kuće. U donjem delu je podno grejanje, na spratu radijatori. Grejanje centralno na pelet. Plac je dimenzija 20x30.<br>Kontakt 0638901299 Nataša","Kuća na prodaju, FUTOG, FUTOG, 190.000€, 155m² - 4zida",2023-12-19,,,,etažno grejanje ,,,,,,,,
339,https://www.4zida.rs/prodaja-kuca/misa-gradske-lokacije-pancevo/troeatazna/6516d4031731967c2a012618,,,,,,,,,,,,,,Pretraga Nekretnina za Prodaju i Izdavanje · 4zida,2023-12-19,,,,,,,,,,,,
340,https://www.4zida.rs/prodaja-kuca/metino-brdo-okolne-lokacije-kragujevac/troeatazna/636645f07b7dca635607ff77,275 m² ,7 soba ,nije uknjiženo ,uobičajeno stanje ,,"dvorište, terase (3","kupatila (2), kuhinja ",2704161 ,pre 1 mesec ,200.000,Metino Brdo,"Metino Brdo, Okolne lokacije, Kragujevac","<h2 _ngcontent-ng-c3754543513 class=""mat-headline-5"">Opis oglasa</h2><div _ngcontent-ng-c3754543513 class=""prose max-h-64 overflow-hidden text-gray-800 ng-star-inserted""><p>Kuca se nalazi na uglu dve mirne ulice, gradjena je sa gradjevinskom dozvolom, svojina privatna na zemljistu i kuci, uveden gas. Na prizemlju je trosoban stan od 108m2, na spratu trosoban stan od 108m2 +potkrovlje sa tri spavace sobe i kupatilom.Na kuci je radjena izolacija 10-ka stiropor.U dvoristu se nalazi pomocni objekat od 50m2 i garaza.","3-etažna kuća na prodaju, Metino Brdo, 200.000€, 275m² - 4zida",2023-12-19,Samostalna kuća ,3,5a plac ,grejanje na gas ,,namešteno ,,,1 garažno mesto ,,,
341,https://www.4zida.rs/prodaja-kuca/kozujevo-gradske-lokacije-kragujevac/jednoetazna/647f8e67acf04299f7004ddd,72 m² ,3 sobe ,uknjiženo ,uobičajeno stanje ,,terasa ,"kupatilo, toalet ",HZKKG,pre 1 mesec ,57.000,Kozujevo,"Kozujevo, Gradske lokacije, Kragujevac","<h2 _ngcontent-ng-c3754543513 class=""mat-headline-5"">Opis oglasa</h2><div _ngcontent-ng-c3754543513 class=""prose max-h-64 overflow-hidden text-gray-800 ng-star-inserted""><p>Na prodaju kuća u naselju Kozujevo na manje od 5 kilometara od centra grada u mirnom okruženju.","1-etažna kuća na prodaju, Kozujevo, 57.000€, 72m² - 4zida",2023-12-19,Samostalna kuća ,1,12a plac ,,kablovska ,prazno ,,gradska voda ,,ADSL ,,
342,https://www.4zida.rs/prodaja-kuca/gradske-lokacije-indjija/jednoetazna/639f7cb72afccc45470b5e5d,160 m² ,7 soba ,uknjiženo ,uobičajeno stanje ,,terasa ,kupatilo ,I,pre 10 meseci ,55.000,Gradske lokacije,"Gradske lokacije, Inđija","<h2 _ngcontent-ng-c3754543513 class=""mat-headline-5"">Opis oglasa</h2><div _ngcontent-ng-c3754543513 class=""prose max-h-64 overflow-hidden text-gray-800 ng-star-inserted""><p>Prizemna kuća, 160 m2 (podeljena na tri celine), na placu od 2,5 ari. Struktura prostora: natkrivena terasa, predsoblje, kupatilo, ostava, kuhinja sa trpezarijom, dve sobe do ulice. U dvorišnom delu kuće: predsoblje, kupatilo, dve sobe. Dvorišni stan: predsoblje, kupatilo, dnevni boravak sa kuhinjom, soba. Podovi: itison, laminat, parket. Nusprostorija - šupa. Gas. I-938","1-etažna kuća na prodaju, Gradske lokacije, 55.000€, 160m² - 4zida",2023-12-19,Samostalna kuća ,1,2.5a plac ,grejanje na gas ,,prazno ,,,,,,
343,https://www.4zida.rs/prodaja-kuca/srpski-sor-zorka-gradske-lokacije-subotica/jednoetazna/64dc8de406c68042350d3a88,,,,,,,,,,,,,,"1-etažna kuća na prodaju, Srpski Šor, 45.000€, 102m² - 4zida",2023-12-19,,,,,,,,,,,,
344,https://www.4zida.rs/prodaja-kuca/tokio-centar-3-gradske-lokacije-subotica/jednoetazna/6536db81e1807e00450054f7,367 m² ,8 soba ,uknjiženo ,potrebno renoviranje ,,"dvorište, tavan, podrum ",,,pre 26 dana ,120.000,Zaharija Orfelina 4,"Tokio, Centar 3, Gradske lokacije, Subotica","<h2 _ngcontent-ng-c3754543513 class=""mat-headline-5"">Opis oglasa</h2><div _ngcontent-ng-c3754543513 class=""prose max-h-64 overflow-hidden text-gray-800 ng-star-inserted""><p>samostalna kuca na 502m2 placa sa 367m2 uknjizenih objekata, tri strujomera, dva vodomera, prikljucak gasa, moguca adaptacija u apartmane, stanove, garazna mesta…","1-etažna kuća na prodaju, Zaharija Orfelina 4, 120.000€, 367m² - 4zida",2023-12-19,Samostalna kuća ,1,5a plac ,,Kanalizacija ,prazno ,1970,,1 garažno mesto ,,,
345,https://www.4zida.rs/prodaja-kuca/zeleznik-cukarica-cukarica-opstina-beograd/dvoetazna/64affd03d05d00fb780b0dfb,186 m² ,6 soba ,,,,"podrum, terasa ",kupatilo ,1494 ,pre 5 meseci ,80.000,Avalska,"Železnik, Čukarica, Čukarica opština, Beograd","<h2 _ngcontent-ng-c3754543513 class=""mat-headline-5"">Opis oglasa</h2><div _ngcontent-ng-c3754543513 class=""prose max-h-64 overflow-hidden text-gray-800 ng-star-inserted""><p>Kuća na odličnoj lokaciji u Železniku. Porodična kuća na 3 ara placa, u mirnom delu naselja. U blizini sva infrastruktura i sadržaji potrebni za žvito kao i javni prevoz. Na placu i pomoćni objekti i garaža. Plac je uknjižen, a kuća nije uknjižena.<br>PROSTORIJE: PR - predsoblje, dnevna soba, kuhinja, 2 sobe, kupatilo, terasa. I sprat - predsoblje, kuhinja, 3 sobe, kupatilo, terasa. PTK - nedovršeno, POMOĆNI OBJEKAT: garaža  i soba sa kupatilom.","2-etažna kuća na prodaju, Avalska, 80.000€, 186m² - 4zida",2023-12-19,,2,3a plac ,grejanje na struju ,telefon ,prazno ,,,1 garažno mesto ,,,
346,https://www.4zida.rs/prodaja-kuca/cortanovci-okolne-lokacije-indjija/kuca/65267e9cfe78e80ebf091b85,25 m² ,,,,,,,2888 ,pre 2 meseca ,61.800,Čortanovci,"Čortanovci, Okolne lokacije, Inđija","<h2 _ngcontent-ng-c3754543513 class=""mat-headline-5"">Opis oglasa</h2><div _ngcontent-ng-c3754543513 class=""prose max-h-64 overflow-hidden text-gray-800 ng-star-inserted""><p>Na prodaju vikendica koja se nalazi u Čortanovcima, uknjižene površine 25m2 (u prirodi 60m2), na ograđenom placu od 709m2.<br>Struja, voda, grejanje na gas.<br>Vočnjak (šljive, kajsije, kruške, grožđe)<br>Za više informacija možete nas kontaktirati na 066 82 92 400 ili 065/27-27-091, N-NEKRETNINE, broj u registru posrednika 1405, Bulevar Evrope 44 Novi Sad.","Kuća na prodaju, Čortanovci, 61.800€, 25m² - 4zida",2023-12-19,,,7.09a plac ,,,namešteno ,,,,,,
347,https://www.4zida.rs/prodaja-kuca/misa-gradske-lokacije-pancevo/troeatazna/6512e25e7e06a87086059497,225 m² ,7 soba ,uknjiženo ,,,"dvorište, tavan, terase (2) ",kupatila (3,,pre 1 mesec ,220.000,Misa,"Misa, Gradske lokacije, Pančevo","<h2 _ngcontent-ng-c3754543513 class=""mat-headline-5"">Opis oglasa</h2><div _ngcontent-ng-c3754543513 class=""prose max-h-64 overflow-hidden text-gray-800 ng-star-inserted""><p>Predstavljamo Vam kuću (SUTEREN, PRIZEMLJE, SPRAT i POTKROVLJE) u naselju Misa na placu od 2,10 Ara.","3-etažna kuća na prodaju, Misa, 220.000€, 225m² - 4zida",2023-12-19,Samostalna kuća ,3,210a plac ,etažno grejanje ,Kanalizacija ,prazno ,1990,gradska voda ,,Optički ,,
348,https://www.4zida.rs/prodaja-kuca/gradske-lokacije-zlatibor/kuca/627e761837fe787170067ea3,210 m² ,,uknjiženo ,,,terasa ,,5958 ,pre 8 meseci ,349.000,Vojvodjanska,"Gradske lokacije, Zlatibor","<h2 _ngcontent-ng-c3754543513 class=""mat-headline-5"">Opis oglasa</h2><div _ngcontent-ng-c3754543513 class=""prose max-h-64 overflow-hidden text-gray-800 ng-star-inserted""><p>Luksuzna kuca na 4,47 ari placa. Prelepo dvoriste. Kompletno je namestena i opremljena. Kuca se nalazi relativno blizu hotela Palisad, a nalazi se u kraju koji ima svoj mir i tisinu. Nepokretnost za svaku preporuku.","Kuća na prodaju, Vojvodjanska, 349.000€, 210m² - 4zida",2023-12-19,,,4a plac ,etažno grejanje ,,,2007,,,,,
349,https://www.4zida.rs/prodaja-kuca/mladenovac-centar-mladenovac-opstina-beograd/kuca/6516d6a91731967c2a012bc4,,,,,,,,,,,,,,Pretraga Nekretnina za Prodaju i Izdavanje · 4zida,2023-12-19,,,,,,,,,,,,
350,https://www.4zida.rs/prodaja-kuca/veliko-krcmare-okolne-lokacije-raca/jednoetazna/64f2365ce979c7edc800f0b4,,,,,,,,,,,,,,"1-etažna kuća na prodaju, Veliko Krčmare, 33.000€, 120m² - 4zida",2023-12-19,,,,,,,,,,,,
351,https://www.4zida.rs/prodaja-kuca/stepojevac-lazarevac-opstina-beograd/kuca/6516d31d1731967c2a01241d,,,,,,,,,,,,,,Pretraga Nekretnina za Prodaju i Izdavanje · 4zida,2023-12-19,,,,,,,,,,,,
352,https://www.4zida.rs/prodaja-kuca/novo-berbersko-gradske-lokacije-zrenjanin/kuca/5d35cdd527317110344751fd,190 m² ,,,,,,,271 ,pre 1 godinu ,125.000,Novo Berbersko,"Novo Berbersko, Gradske lokacije, Zrenjanin","<h2 _ngcontent-ng-c3754543513 class=""mat-headline-5"">Opis oglasa</h2><div _ngcontent-ng-c3754543513 class=""prose max-h-64 overflow-hidden text-gray-800 ng-star-inserted""><p>Kuća sa potkrovljem površine 190m2 + trosobna kuća od 90m2, sve na placu od 25 ari, Novo Berbersko. Veća kuća: prizemlje - veliki dnevni boravak, kuhinja sa trpezarijom, WC, predsoblje. Gore: četiri spavaće sobe i kupatilo. Velika terasa i garaža u sklopu kuće. Po podovima je parket, CG na gas i čvrsto gorivo, dve klime. U dvorištu trosobna zasebna kuća od 90m2, CG, parket. Na placu se nalazi još dve garaže, pokrivena terasa, pomoćne prostorije, kotlarnica. Sam plac je u mirnom delu naselja, sa manjim voćnjakom i parkom na njemu. ","Kuća na prodaju, Novo Berbersko, 125.000€, 190m² - 4zida",2023-12-19,,,25a plac ,,,,,,,,,
353,https://www.4zida.rs/prodaja-kuca/stulac-okolne-lokacije-vrnjacka-banja/dvoetazna/64a5dd43cda146c1b308dcf2,220 m² ,6 soba ,uknjiženo ,,,"dvorište, tavan, terase (2) ","kupatilo, kuhinja, ostava ",,pre 2 meseca ,70.000,Gocka,"Štulac, Okolne lokacije, Vrnjačka Banja","<h2 _ngcontent-ng-c3754543513 class=""mat-headline-5"">Opis oglasa</h2><div _ngcontent-ng-c3754543513 class=""prose max-h-64 overflow-hidden text-gray-800 ng-star-inserted""><p>Kuca se nalazi u naselju Štulac na mirnom mestu 5 min od Vrnjacke Banje i Trstenika.Kuca ima 220m2 i plac od 18 ari.Na placu je i pomocni objekat sa garazom od 37m2.Kuca je legalizovana ima struju,vodu ,telefon.","2-etažna kuća na prodaju, Gocka, 70.000€, 220m² - 4zida",2023-12-19,Samostalna kuća ,2,18a plac ,kaljeva peć ,"telefon, TV, veš mašina, kuhinjski elementi, frižider, rerna, ležaj, plakar ",polunamešteno ,1990,gradska voda ,1 garažno mesto ,,jugozapad ,dvorište 
354,https://www.4zida.rs/prodaja-kuca/verusic-okolne-lokacije-subotica/jednoetazna/64d09a44bd23e7f246089768,,,,,,,,,,,,,,"1-etažna kuća na prodaju, Stari Žednik Salaši 458, 255.000€, 141m² - 4zida",2023-12-19,,,,,,,,,,,,
355,https://www.4zida.rs/prodaja-kuca/mala-ivanca-sopot-opstina-beograd/dvoetazna/653ff322898c38a3250358b9,560 m² ,10 soba ,uknjiženo ,novo ,,"prilaz za invalide, dvorište, alarm, podrum, terasa ",kupatila (3,,pre 5 dana ,1.150.000,Mala Ivanča,"Mala Ivanča, Sopot opština, Beograd","<h2 _ngcontent-ng-c3754543513 class=""mat-headline-5"">Opis oglasa</h2><div _ngcontent-ng-c3754543513 class=""prose max-h-64 overflow-hidden text-gray-800 ng-star-inserted""><p><strong>Novoizgradjena kuća u elitnoj zoni Male Ivanče (31,5 km od Slavije, Centar Beograda)</strong> ","2-etažna kuća na prodaju, Mala Ivanča, 1.150.000€, 560m² - 4zida",2023-12-19,Samostalna kuća ,2,39a plac ,podno grejanje ,"internet, TV, klima, ventilacija, veš mašina, kuhinjski elementi, sudo mašina, frižider, zamrzivač, mikrotalasna rerna, rerna, šporet, ležaj, plakar ",namešteno ,2020,gradska voda ,,,,
356,https://www.4zida.rs/prodaja-kuca/pajsijevic-okolne-lokacije-knic/dvoetazna/64614a182d16d957fe02a83b,267 m² ,6 soba ,uknjiženo ,potrebno renoviranje ,,"dvorište, tavan, podrum, terasa ","kupatilo, kuhinja, ostava ",HZKKG,pre 1 mesec ,21.000,Pajsijević ,"Pajsijević , Okolne lokacije, Knić","<h2 _ngcontent-ng-c3754543513 class=""mat-headline-5"">Opis oglasa</h2><div _ngcontent-ng-c3754543513 class=""prose max-h-64 overflow-hidden text-gray-800 ng-star-inserted""><p>Na prodaju seosko domaćinstvo u Pajsijeviću, opština Knić, na oko 25 kilometara od Kragujevca.","2-etažna kuća na prodaju, Pajsijević , 21.000€, 267m² - 4zida",2023-12-19,Domaćinstvo ,2,80a plac ,,"kuhinjski elementi, ležaj, plakar ",polunamešteno ,,bunarska voda ,,,,
357,https://www.4zida.rs/prodaja-kuca/gradac-gradske-lokacije-valjevo/kuca/648092b27c44b9f70a02ed8c,350 m² ,6 soba ,uknjiženo ,,,terasa ,kupatila (3,18290 ,pre 2 meseca ,105.000,Gradac,"Gradac, Gradske lokacije, Valjevo","<h2 _ngcontent-ng-c3754543513 class=""mat-headline-5"">Opis oglasa</h2><div _ngcontent-ng-c3754543513 class=""prose max-h-64 overflow-hidden text-gray-800 ng-star-inserted""><p>Na tri etaže južni deo grada, u izvornom dobro održavnom stanju, uknjižena na osnovu i vlasnik uknjižen na placu.<br>Ograđeno dvorište, grejanje etažno na čvrsto gorivo, useljiva, za preporuku.","Kuća na prodaju, Gradac, 105.000€, 350m² - 4zida",2023-12-19,,,7.2a plac ,etažno grejanje ,telefon ,prazno ,1980,,1 garažno mesto ,,,
358,https://www.4zida.rs/prodaja-kuca/gradske-lokacije-srbobran/kuca/64888aaddb00fd4d2e051871,232 m² ,,uknjiženo ,novo ,,terasa ,kuhinja ,1621 ,pre 13 dana ,120.000,Gradske lokacije,"Gradske lokacije, Srbobran","<h2 _ngcontent-ng-c3754543513 class=""mat-headline-5"">Opis oglasa</h2><div _ngcontent-ng-c3754543513 class=""prose max-h-64 overflow-hidden text-gray-800 ng-star-inserted""><p>Prodaje se lepa nova kuća sa izlazom na kanal, blizu centra Srbobrana. Kuća je energetski efikasna, kvalitetno sagrađena 2016. godine, sa funkcionalnim rasporedom prostorija.Kuća je potpuno opremljena, CG, klima, pogodna za veću porodicu. Kuća izlazi na obalu kanala, što pruža poseban kvalitet života. Kuća ima tri spavaće sobe i veliki dnevni boravak, kuhiju, ostavu, garderober, toalet u prizemlju i kupatilo u potkrovlju.Ima i poseban stambeni prostor kome trebaju završni radovi.. Odlična kuća! Tel. 065/424 55 77. Više fotografija na našem sajtu.","Kuća na prodaju, Gradske lokacije, 120.000€, 232m² - 4zida",2023-12-19,,,6.29a plac ,centralno grejanje ,klima ,prazno ,,,1 garažno mesto ,,,
359,https://www.4zida.rs/prodaja-kuca/gradske-lokacije-kikinda/kuca/64649b00c8128d97e80b79d3,30 m² ,,uknjiženo ,,,,,20289 ,pre 4 meseca ,13.500,Gradske lokacije,"Gradske lokacije, Kikinda","<h2 _ngcontent-ng-c3754543513 class=""mat-headline-5"">Opis oglasa</h2><div _ngcontent-ng-c3754543513 class=""prose max-h-64 overflow-hidden text-gray-800 ng-star-inserted""><p>Plac od 1789 m2 i Vikendica, nedaleko od glavnog puta.<br>Veoma lep kraj u vikend naselju za odmor i uživanje.<br>Plac je uknjižen na vlasnika 1/1, dok vikendicu je potrebno legalizovati.<br>Postoji dogovor oko svega.<br>ww.status-nekretnine.com A57-20289<br>Kontakt:065/3858-888 Dančo lic. br.322","Kuća na prodaju, Gradske lokacije, 13.500€, 30m² - 4zida",2023-12-19,,,17.89a plac ,,,prazno ,,,,,,
360,https://www.4zida.rs/prodaja-kuca/lazarica-gradske-lokacije-krusevac/jednoetazna/64303d0c5e79df10da028295,70 m² ,5 soba ,uknjiženo ,,,dvorište ,"kuhinja, ostava ",,pre 27 dana ,80.000,Voislava Ilica,"Lazarica, Gradske lokacije, Kruševac","<h2 _ngcontent-ng-c3754543513 class=""mat-headline-5"">Opis oglasa</h2><div _ngcontent-ng-c3754543513 class=""prose max-h-64 overflow-hidden text-gray-800 ng-star-inserted""><p>Prodajem dve kuce sa namestajem i razradjenu perionicu na 4 ara placa na dobroj lokaciji naselje Bare","1-etažna kuća na prodaju, Voislava Ilica, 80.000€, 70m² - 4zida",2023-12-19,Dvojna kuća ,1,4a plac ,TA peć ,Kanalizacija ,prazno ,,,,,,
361,https://www.4zida.rs/prodaja-kuca/gradske-lokacije-knic/jednoetazna/638861f0f10525385f092cb4,70 m² ,2 sobe ,uknjiženo ,,,terasa ,kupatilo ,,pre 1 godinu ,60.000,Donja mala,"Gradske lokacije, Knić","<h2 _ngcontent-ng-c3754543513 class=""mat-headline-5"">Opis oglasa</h2><div _ngcontent-ng-c3754543513 class=""prose max-h-64 overflow-hidden text-gray-800 ng-star-inserted""><p>Kuća sa okućnicom u Kniću, blizu jezera. Pomoćni objekti starije gradnje. Ukupno 1,3 hektara zemljišta. Idealno za odmor ili seoski turizam, kao i za bavljenje poljoprivredom.","1-etažna kuća na prodaju, Donja mala, 60.000€, 70m² - 4zida",2023-12-19,Vikendica ,1,13000a plac ,,,prazno ,,,,,,
362,https://www.4zida.rs/prodaja-kuca/bresnica-gradske-lokacije-kragujevac/kuca/622722e393cf415f1d11cf90,240 m² ,7 soba ,u procesu uknjižavanja ,,,"podrum, terasa ",,410 ,pre 8 meseci ,100.000,Bresnica,"Bresnica, Gradske lokacije, Kragujevac","<h2 _ngcontent-ng-c3754543513 class=""mat-headline-5"">Opis oglasa</h2><div _ngcontent-ng-c3754543513 class=""prose max-h-64 overflow-hidden text-gray-800 ng-star-inserted""><p>Kuća u Bresnici u blizini ambulante, pogodna za život višečlane porodice. Poseduje suterenski deo, prizemlje, sprat i potkrovlje. Sve sem potkrovlja je renovirano, najsavremenijim materijalima. U kupatilima granitna keramika, kao i na podovima pojedinih prostorija. Poseduje prelep plac od 5a.","Kuća na prodaju, Bresnica, 100.000€, 240m² - 4zida",2023-12-19,,,5a plac ,grejanje na gas ,"telefon, klima ",prazno ,1981,,1 garažno mesto ,,,
363,https://www.4zida.rs/prodaja-kuca/centar-gradske-lokacije-sremski-karlovci/jednoetazna/64d4d488ebd5b681e701139d,,,,,,,,,,,,,,"1-etažna kuća na prodaju, Centar, 163.700€, 67m² - 4zida",2023-12-19,,,,,,,,,,,,
364,https://www.4zida.rs/prodaja-kuca/bubanj-palilula-gradske-lokacije-nis/jednoetazna/650ab863fd45161bb9081bba,267 m² ,4 sobe ,uknjiženo ,uobičajeno stanje ,1 parking mesto ,terasa ,kupatila (3,p,pre 2 meseca ,237.000,Vojvode Putnika,"Bubanj, Palilula, Gradske lokacije, Niš","<h2 _ngcontent-ng-c3754543513 class=""mat-headline-5"">Opis oglasa</h2><div _ngcontent-ng-c3754543513 class=""prose max-h-64 overflow-hidden text-gray-800 ng-star-inserted""><p>Na  prodaju  izuzetno  kvalitetno  građena  moderna  kuća  za  komforno  stanovanje  ili  biznis,  na  Bubnju,  u  prirodnom  okruženju  a  blizu  centa  grada.  Na  popločanom  placu  od  501 m2, nalazi  se  kuća  koja, zbog  kvaliteta  gradnje, izgleda i  izbora  materijala, čini  zanimljivu  i  retrku  ponudu  na  tržištu. U  ulaznom  delu  prizemlja   je  manji  apartman  za  goste, sa  zasebnim  kupatilom, potom  prostrana  dnevna  soba  sa  kuhinjom  i  trpezarijom,  iz  koje  se  ulazi  u  jednu  veću  i  dve  manje  spavaće  sobe  i  kupatilo, a  unutrašnjim  drvenim   stepenicama  se  dolazi  do  potkrovlja. U  tom  delu  kuće  su  tri  manje  spavaće  sobe,  jedna  ima  dodatni prostor  u  galeriji  a  iz  dve  se  izlazi  na  prostranu  terasu  ( do  koje  se  može  doći  i  spoljašnjim  stepenicama).  Ispod  dela  kuće  je    odličan  ozidani  podrum  od  45  m2,  sa centralnim  bojlerom  i  prirodnom  ventilacijom.  Zidovi  kuće  su  od  pune  cigle  sa  obe  strane  i  između  je  kamena  vuna,  te  je  zagrevanje  celog  objekta  moguće  i  kaminom  u  centralnom  delu  kuće  a  po  potrebi, koristi  se  i  klima  ili  mermerne  ploče  u  sobama.  Spoljašna  stolarija  je  aluminijumska. U  dvorištu  se  nalazi  letnja  kuhinja,  opremljena  roštiljem. Pored  kuće  je  nova  hala  montažnog  tipa  od  panela  sa  izolacijom   površine  100 m2  i  visine  6 m, sa  velikim  rolo-vratima. Odlična  lokacija, blizu  bitnih  saobraćajnica, sem  za  život  višečlane  porodice, moguća  je  upotreba  za  izdavanje  firmama, za  restoran, hostel  ili  slično. Uknjižena, sa  upotrebnom  dozvolom,  te  je  moguća  kupovina  i  stambenim  kreditom. Za  više  informacija  i  zakazivanje  razgledanja, pozovite  agenciju.","1-etažna kuća na prodaju, Vojvode Putnika, 237.000€, 267m² - 4zida",2023-12-19,,1,,grejanje na struju ,"kablovska, internet, klima ",polunamešteno ,,,,,,
