,link,Površina,Broj etaža,Grejanje,Šifra oglasa,Oglas ažuriran,price,street,address,description,title,end_date,Plac,Uknjiženost,Stanje,Parking,Infrastruktura,Unutrašnje prostorije,Nameštenost,Opremljenost,Garaža,Broj soba,Tip,Godina izgradnje,Internet,Vodoinstalacija,Orijentacija nekretnine,Pogled na,Dozvoljeni kućni ljubimci
306,https://www.4zida.rs/prodaja-kuca/durlan-pantelej-gradske-lokacije-nis/jednoetazna/614893bcba08ed5a814b1550,216 m² ,1,TA peć ,8005 ,pre 1 godinu ,173.500,Durlan,"Durlan, Pantelej, Gradske lokacije, Niš","<h2 _ngcontent-ng-c3151048826 class=""mat-headline-5"">Opis oglasa</h2><div _ngcontent-ng-c3151048826 class=""prose max-h-64 overflow-hidden text-gray-800 ng-star-inserted""><p>Niš, Durlan, Kuća, 216m2<br>U prilici smo da vam ponudimo kuću u Durlanu u blizini osnovne škole Njegoš, Benetona i velikog broja trgovina. Prema strukturi kuća se sastoji iz prizemlja i sprata, uknjižena površina je u osnovi je 108m2 sa placem 206m2.<br>U pitanju je izuzetno kvalitetna, čvrsta gradnja sa uradjenom fasadom, a izgrađena je 1995. godine. Sastoji se iz dve etaže, prizemlja i sprata. Pogodna za dve porodice. U prizemlju kuće nalazi se lokal koji je portalom okrenut prema ulici i obezbeđen je rešetkama. Trenutno, taj prostor nema funkciju lokala već se u njemu nalaze kuhinja sa trpezarijom i dnevnom sobom. Pored ove velike prostorije prizemlje se sastoji još iz dve spavaće sobe, prostranim hodnikom sa ostavom, kupatilom i odvojenim mokrim čvorom.<br>Do prvog sprata ide se unutrašnjim drvenim stepeništem, raspored prostorija je kao i na prizemlju, jedna velika i osvetljena prostorija namenjena za kuhinju sa trpezarijom i dnevnim boravkom koji ima izlaz na veliku i lepu terasu, dve spavaće sobe, kupatilo i odvojeni mokri čvor. Prema rečima prodavca ukupna površina kuće iznosi 270m2.<br>Uz samu kuću sagrađena je još jedna stambena jedinica, koja se sastoji iz hodnika, velike prostorije koja ima izlaz na još jednu lepu i veliku terasu i nalazi se iznad velike garaže.<br>Grejanje je TA ili na čvrsta goriva, a kuća poseduje izuzetno kvalitetnu drvenu stolariju sa roletnama što doprinosi značajnim energetskim uštedama. Na podovima su parket i keramika. Ispred jednog dela kuće je dvorište koje ujedno predstavlja i prilaz za garažu.<br>Odvojite malo slobodnog vremena i zakažite razgledanje ove nepokretnosti sa agencijom AVENIJA NEKRETNINE putem telefona: 018/272-212, 067/7000-111. Svojim klijentima garantujemo potpunu pravnu sigurnost pri kupovini i zakupu nepokretnosti. Kompletnu ponudu nekretnina možete videti na našem portalu: avenijanekretninenis.rs<br>Registarski broj posrednika: 669<br>ODRICANJE OD ODGOVORNOSTI:<br>Politika poslovanja Avenija nekretnine jeste da u opisu oglasa o nepokretnostima ne prikazuje tačnu lokaciju, već približnu lokaciju nepokretnosti. Zakazivanjem terena sa našim agentima bićete upoznati sa tačnom lokacijom nepokretnosti, pri čemu Avenija nekretnine ne snosi odgovornost ukoliko je Vaš lični utisak da lokacija navedena u oglasu ne odgovara lokaciji na terenu.Avenija nekretnine nastoji da bude što preciznija u opisu nepokretnosti, prikazu slika i samih cena. Međutim, ne može garantovati da su sve informacije kompletne i bez propusta, kako u pogledu tehničkih grešaka, opisa karakteristika, tako i cena, niti garantuje da su sve nepokretnosti dostupne za kupoprodaju/zakup.  Avenija nekretnine zadržava pravo da promeni sadržaj ovog oglasa i cene navedene na oglasu u bilo koje vreme i bez prethodnog upozorenja. Takođe, može se desiti da sadržaj bude zastareo, međutim, Avenija nekretnine se ne obavezuje da redovno ažurira informacije sadržane na ovom sajtu.Avenija nekretnine ne snosi odgovornost za promene cena koje mogu da nastanu u svakom momentu od objavljivanja oglasa, niti garantuje tačnost istih. Veoma čest slučaj u praksi jeste da vlasnici ne obaveštavaju ažurno posrednika o promeni cene, pa Avenija nekretnine ne snosi odgovornost za promene istih.<br> ID oglasa: 8005.","1-etažna kuća na prodaju, Durlan, 173.500€, 216m² - 4zida",2024-03-22,,uknjiženo ,uobičajeno stanje ,,"terasa, lođa ",,prazno ,"telefon, klima ",1 garažno mesto ,,,,,,,,
307,https://www.4zida.rs/prodaja-kuca/kelebija-gradske-lokacije-subotica/kuca/652d9a52d67120c54f050a03,121 m² ,,etažno grejanje ,724 ,pre 18 sati ,90.000,Kelebija,"Kelebija, Okolne lokacije, Subotica","<h2 _ngcontent-ng-c3151048826 class=""mat-headline-5"">Opis oglasa</h2><div _ngcontent-ng-c3151048826 class=""prose max-h-64 overflow-hidden text-gray-800 ng-star-inserted""><p>Subotica, Kelebija, prodaje se prizemna kuća sa potkrovljem površine 121m², na placu površine 894m². Kuća je useljiva i komforna, a sastoji se od predsoblja, prostranog dnevnog boravka sa trpezarijom, kuhinje, ostave, spavaće sobe, dva kupatila i terase. Grejanje je etažno na čvrsto gorivo, struja je trofazna, stolarija je PVC, na podovima su keramika i laminat, kanalizacija je septička jama, dok je voda bušeni bunar (dva bunara). Na placu se još nalaze pomoćni objekti ukupne površine 120m² u okviru kojeg se nalaze garsonjera, letnja kuhinja, ostava i radionica.","Kuća na prodaju, Kelebija, 90.000€, 121m² - 4zida",2024-03-22,8.94a plac ,,uobičajeno stanje ,1 parking mesto ,"dvorište, terasa ",kupatila (2) ,prazno ,"telefon, klima ",1 garažno mesto ,2 sobe ,,,,,,,
308,https://www.4zida.rs/prodaja-kuca/jajinci-vozdovac-opstina-beograd/kuca/659d4b81a8fac72b390ac313,328 m² ,,etažno grejanje ,2083 ,pre 31 dana ,1.300.000,Jajinci,"Jajinci, Voždovac opština, Beograd","<h2 _ngcontent-ng-c3151048826 class=""mat-headline-5"">Opis oglasa</h2><div _ngcontent-ng-c3151048826 class=""prose max-h-64 overflow-hidden text-gray-800 ng-star-inserted""><p>Luksuzna devetosobna vila površine 328m2 (275m2 korisne površine) na 4.55 ari placa u ulici Bulevar JNA u Jajincima.<br>Struktura:<br>Pr- veliki maganciski prostor 70m2 i odvojena kotlarnica.<br>Vpr- antre, dnevna soba spojena sa kuhinjom i trpezarijom, spavaća soba, radna soba, kupatilo sa đakuzijem i velika zatvorena terasa pretvorena u relax prostoriju (10,44m2).<br>Sprat- dve odvojene jedinice poslovna i stambena.<br>Poslovna: Kancelarja, velika prostorija za edukaciju, kupatilo sa đakuzijem i velika terasa sa panoramskim pogledom na Beograd i Avalu.<br>Stambena: Dupleks sa dve spavaće sobe, dve dnevne sobe, kuhinje, trpezarije i kupatila sa tuš kabinom.","Kuća na prodaju, Jajinci, 1.300.000€, 328m² - 4zida",2024-03-22,4.55a plac ,uknjiženo ,,1 parking mesto ,terasa ,,prazno ,"kablovska, internet, interfon, klima ",,,,,,,,,
309,https://www.4zida.rs/prodaja-kuca/curug-okolne-lokacije-zabalj/jednoetazna/64346cacd7b6e13a6b0530c6,52 m² ,1,grejanje na struju ,,pre 5 dana ,82.400,Biserno ostrvo,"Čurug, Okolne lokacije, Žabalj","<h2 _ngcontent-ng-c3151048826 class=""mat-headline-5"">Opis oglasa</h2><div _ngcontent-ng-c3151048826 class=""prose max-h-64 overflow-hidden text-gray-800 ng-star-inserted""><p>Biserno ostrvo. Solari 2,2kw. Bunar 80m. Ogradjeno. Plaža. Ponton za pecanje. Front na vodi 14m","1-etažna kuća na prodaju, Biserno ostrvo, 82.400€, 52m² - 4zida",2024-03-22,12.95a plac ,uknjiženo ,,,,kupatilo ,,,,2 sobe ,Vikendica ,,,,,,
310,https://www.4zida.rs/prodaja-kuca/rasadnik-gradske-lokacije-krusevac/jednoetazna/636a711e1f02662b1d00961c,119 m² ,1,,,pre 11 meseci ,60.000,Rasadnik,"Rasadnik, Gradske lokacije, Kruševac","<h2 _ngcontent-ng-c3151048826 class=""mat-headline-5"">Opis oglasa</h2><div _ngcontent-ng-c3151048826 class=""prose max-h-64 overflow-hidden text-gray-800 ng-star-inserted""><p>Agencija CITY prodaje kucu na prelepoj lokaciji u Rasadniku, povrsine 119 mkv + pomocna zgrada 22 mkv na placu od 2.91 ar. Kuca se nalazi na jednoj od najlepsih lokacija u Kruševcu, blizina ambulante, marketa, autobuske stanice. U dvoristu se nalazi bunar.","1-etažna kuća na prodaju, Rasadnik, 60.000€, 119m² - 4zida",2024-03-22,3a plac ,uknjiženo ,,,,,prazno ,,,3 sobe ,Samostalna kuća ,,,,,,
311,https://www.4zida.rs/prodaja-kuca/dorcol-stari-grad-opstina-beograd/kuca/64f468b5599c609be30110e7,,,,,,,,,,Pretraga Nekretnina za Prodaju i Izdavanje · 4zida,2024-03-22,,,,,,,,,,,,,,,,,
312,https://www.4zida.rs/prodaja-kuca/ribnica-gradske-lokacije-kraljevo/jednoetazna/65d1f872ece94aead70656bb,103 m² ,1,,,pre 33 dana ,55.000,jablanicka,"Ribnica, Gradske lokacije, Kraljevo","<h2 _ngcontent-ng-c3151048826 class=""mat-headline-5"">Opis oglasa</h2><div _ngcontent-ng-c3151048826 class=""prose max-h-64 overflow-hidden text-gray-800 ng-star-inserted""><p>Prodaje se prostrana kuca u Ribnici.Sadrzi dnevni boravak sa kuhinjom,tri spavace sobe,ostavu i kupatilo.Kuca ima i podrum sa instaliranim parnim grejanjem.Povrsina podruma je 20 kvadrata.Sama kuca gradjena je od duple cigle.","1-etažna kuća na prodaju, jablanicka, 55.000€, 103m² - 4zida",2024-03-22,5.5a plac ,uknjiženo ,uobičajeno stanje ,,,,,,,3 sobe ,Samostalna kuća ,,,,,,
313,https://www.4zida.rs/prodaja-kuca/raj-gradske-lokacije-vrnjacka-banja/jednoetazna/654f577d63ffced1790fcb2b,,,,,,,,,,"Prodaja kuća Raj, Gradske lokacije, Vrnjačka Banja, Jednoetažna - 4zida",2024-03-22,,,,,,,,,,,,,,,,,
314,https://www.4zida.rs/prodaja-kuca/levac-gradske-lokacije-jagodina/kuca/644d29ecba5267636405bb5a,350 m² ,,norveški radijatori ,3501 ,pre 10 meseci ,290.000,Levač,"Levač, Gradske lokacije, Jagodina","<h2 _ngcontent-ng-c3151048826 class=""mat-headline-5"">Opis oglasa</h2><div _ngcontent-ng-c3151048826 class=""prose max-h-64 overflow-hidden text-gray-800 ng-star-inserted""><p>Stambeno poslovni objekat, sastoji se od 2 lokala površine po 55m2, 3 garsonjere, jednosobnog stana 53m2 i dva dvosobna stana od 65m2. ","Kuća na prodaju, Levač, 290.000€, 350m² - 4zida",2024-03-22,5a plac ,uknjiženo ,,,"podrum, terasa ",,prazno ,"klima, Kanalizacija ",,,,,,,,,
315,https://www.4zida.rs/prodaja-kuca/gradske-lokacije-backa-palanka/jednoetazna/655255b216ec96f75c06943f,,,,,,,,,,"Prodaja kuća Gradske lokacije, Bačka Palanka, Jednoetažna - 4zida",2024-03-22,,,,,,,,,,,,,,,,,
316,https://www.4zida.rs/prodaja-kuca/divcibare-okolne-lokacije-valjevo/dvoetazna/6473bb808af862d38508c155,,,,,,,,,,"Prodaja kuća Divčibare, Okolne lokacije, Valjevo, Dvoetažna - 4zida",2024-03-22,,,,,,,,,,,,,,,,,
317,https://www.4zida.rs/prodaja-kuca/petlovo-brdo-rakovica-opstina-beograd/dvoetazna/65c359c11734c1591c0caf4d,,,,,,,,,,"Prodaja kuća Petlovo Brdo, Rakovica opština, Beograd, Dvoetažna - 4zida",2024-03-22,,,,,,,,,,,,,,,,,
318,https://www.4zida.rs/prodaja-kuca/palic-okolne-lokacije-subotica/dvoetazna/6540c4f9e6492b620e0b73b8,515 m² ,2,etažno grejanje ,,pre 1 mesec ,550.000,Zelengorska,"Palić, Okolne lokacije, Subotica","<h2 _ngcontent-ng-c3151048826 class=""mat-headline-5"">Opis oglasa</h2><div _ngcontent-ng-c3151048826 class=""prose max-h-64 overflow-hidden text-gray-800 ng-star-inserted""><p>Na prelepoj Palićkoj lokaciji, u mirnoj Zelengorskoj ulici, nalazi se ova prostrana kuća koja čeka novog vlasnika. ","2-etažna kuća na prodaju, Zelengorska, 550.000€, 515m² - 4zida",2024-03-22,30a plac ,uknjiženo ,potrebno renoviranje ,,,"kupatilo, toalet ",,Kanalizacija ,,11 soba ,Samostalna kuća ,,,gradska voda ,,,
319,https://www.4zida.rs/prodaja-kuca/kelebija-okolne-lokacije-subotica/kuca/65afaee7bbdac64bdc0d2161,100 m² ,,,770077 ,pre 1 mesec ,100.000,Kelebija,"Kelebija, Okolne lokacije, Subotica","<h2 _ngcontent-ng-c3151048826 class=""mat-headline-5"">Opis oglasa</h2><div _ngcontent-ng-c3151048826 class=""prose max-h-64 overflow-hidden text-gray-800 ng-star-inserted""><p>Prodaje se prizemna kuća sa potkrovljem/vikendica površine 100m2 na ograđenom placu površine 754m2.<br>Kuća je građena od čvrstog materijala sa PVC stolarijom, laminatom i pločicama na podovima i betonskom pločom na plafonu. Grejanje je na čvrsto gorivo, struja je trofazna, a u dvorištu se nalazi bušeni bunar dubine 50m i prelivna septička jama. Kuća se sastoji iz hodnika, kuhinje sa trpezarijom i dnevnim boravkom, kupatila i dve spavaće sobe. Kuća se prodaje sa kompletnim nameštajem, belom tehinikom i dve inverter klime. Dvorište je lepo uređeno, a kuća se nalazi u mirnom delu vikend naselju na Kelebiji uz samu ivicu šume. Asfaltni put je udaljen cca 750m. Ev.Br. 5285","Kuća na prodaju, Kelebija, 100.000€, 100m² - 4zida",2024-03-22,,,,,,kupatilo ,,klima ,,3 sobe ,,,,,,,
320,https://www.4zida.rs/prodaja-kuca/rakovac-okolne-lokacije-beocin/kuca/626a7e91787b0a7dc4144fe0,,,,,,,,,,Pretraga Nekretnina za Prodaju i Izdavanje · 4zida,2024-03-22,,,,,,,,,,,,,,,,,
321,https://www.4zida.rs/prodaja-kuca/centar-gradske-lokacije-vrsac/kuca/636ba9d59088418eb30a0d27,127 m² ,,grejanje na gas ,1056 ,pre 11 meseci ,62.000,Branka Radičevića,"Centar, Gradske lokacije, Vršac","<h2 _ngcontent-ng-c3151048826 class=""mat-headline-5"">Opis oglasa</h2><div _ngcontent-ng-c3151048826 class=""prose max-h-64 overflow-hidden text-gray-800 ng-star-inserted""><p>Na prodaju prizemna kuća površine 114m2  sa pomoćnim objektom površine 13m2 smešteno na placu ukupne površine 180m2. Kuću čine hodnik, četiri sobe, trpezarija sa kuhinjom, kupatilo, ostava, podrum i tavan. Zidovi zdravi, bez vlage. Podovi obloženi laminatom i pločicama. Objekat ima struju, vodu, plin i priključen je na gradsku kanalizaciju. Kuća je praktično odmah useljiva , ne iziskuje ulaganja i nalazi se na veoma povoljnoj lokaciji.Cena nije fiksna.","Kuća na prodaju, Branka Radičevića, 62.000€, 127m² - 4zida",2024-03-22,,uknjiženo ,uobičajeno stanje ,,"dvorište, tavan, podrum ",kupatilo ,prazno ,,,5 soba ,,,,,,,
322,https://www.4zida.rs/prodaja-kuca/sumica-gradske-lokacije-zrenjanin/jednoetazna/64d2db334998a799cd09a9f9,,,,,,,,,,"Prodaja kuća Šumica, Gradske lokacije, Zrenjanin, Jednoetažna - 4zida",2024-03-22,,,,,,,,,,,,,,,,,
323,https://www.4zida.rs/prodaja-kuca/gradske-lokacije-jagodina/kuca/644d2a43ba5267636405bbfc,41 m² ,,,6730 ,pre 25 dana ,35.000,Gradske lokacije,"Gradske lokacije, Jagodina","<h2 _ngcontent-ng-c3151048826 class=""mat-headline-5"">Opis oglasa</h2><div _ngcontent-ng-c3151048826 class=""prose max-h-64 overflow-hidden text-gray-800 ng-star-inserted""><p>Kuća se sastoji od 2 spavaće sobe, dnevnog boravka sa trpazarijom i kuhinjom, kupatilo i ostava. U pomoćnom objektu je jedna velika prostorija od 47m2.<br>Kuća ima ploču, hidrofor (pijaća voda), gradsku kanalizaciju, podna obloga laminat, PVC stolarija, izolacija stiropor 5cm.<br>Grejanje je na čvrsta goriva.<br>Plac ravan četvrtastog oblika, ograđen. U donjem delu placa su posađene raznovrsne voćke.<br>Legalizovana je kuća i pomoćni objekat.<br>Preporuka!","Kuća na prodaju, Gradske lokacije, 35.000€, 41m² - 4zida",2024-03-22,22.31a plac ,uknjiženo ,renovirano ,1 parking mesto ,terasa ,kuhinja ,prazno ,"šporet, ležaj, Kanalizacija ",,,,1990,,,,,
324,https://www.4zida.rs/prodaja-kuca/sakule-okolne-lokacije-opovo/jednoetazna/65de3e98eda8c80e890cf92d,,,,,,,,,,"Prodaja kuća Sakule, Okolne lokacije, Opovo, Jednoetažna - 4zida",2024-03-22,,,,,,,,,,,,,,,,,
325,https://www.4zida.rs/prodaja-kuca/cardak-sremska-kamenica-gradske-lokacije-novi-sad/kuca/63fcc86a99c714074f0ae1c9,,,,,,,,,,Pretraga Nekretnina za Prodaju i Izdavanje · 4zida,2024-03-22,,,,,,,,,,,,,,,,,
326,https://www.4zida.rs/prodaja-kuca/donji-milanovac-okolne-lokacije-majdanpek/dvoetazna/64bd03a58ce589096100fe85,,,,,,,,,,"2-etažna kuća na prodaju, Donji Milanovac, 145.000€, 138m² - 4zida",2024-03-22,,,,,,,,,,,,,,,,,
327,https://www.4zida.rs/prodaja-kuca/sremska-kamenica-gradske-lokacije-novi-sad/kuca/65e6c66f9f5d1bb8b00d987a,222 m² ,,,3003118 ,pre 17 dana ,309.000,Sremska Kamenica,"Sremska Kamenica, Gradske lokacije, Novi Sad","<h2 _ngcontent-ng-c3151048826 class=""mat-headline-5"">Opis oglasa</h2><div _ngcontent-ng-c3151048826 class=""prose max-h-64 overflow-hidden text-gray-800 ng-star-inserted""><p>Serbian:","Kuća na prodaju, Sremska Kamenica, 309.000€, 222m² - 4zida",2024-03-22,,uknjiženo ,uobičajeno stanje ,,terasa ,,,,,4 sobe ,,,,,,,
328,https://www.4zida.rs/prodaja-kuca/kosmaj-sopot-opstina-beograd/kuca/641c88a8f4437ee14f0741a8,164 m² ,,centralno grejanje ,4989 ,pre 7 dana ,324.720,Kosmaj,"Kosmaj, Sopot opština, Beograd","<h2 _ngcontent-ng-c3151048826 class=""mat-headline-5"">Opis oglasa</h2><div _ngcontent-ng-c3151048826 class=""prose max-h-64 overflow-hidden text-gray-800 ng-star-inserted""><p>Sopot, Kosmaj - Tremovi Kosmaja<br>4.0,  164 m2, terasa, bazen, 11 ari placa","Kuća na prodaju, Kosmaj, 324.720€, 164m² - 4zida",2024-03-22,11a plac ,,u izgradnji ,,"dvorište, terasa ",kupatilo ,prazno ,telefon ,,4 sobe ,,,,,,,
329,https://www.4zida.rs/prodaja-kuca/cardak-sremska-kamenica-gradske-lokacije-novi-sad/dvoetazna/65d8f6ff3bc4789acc07ba36,,,,,,,,,,"Prodaja kuća Čardak, Sremska Kamenica, Gradske lokacije, Novi Sad, Dvoetažna - 4zida",2024-03-22,,,,,,,,,,,,,,,,,
330,https://www.4zida.rs/prodaja-kuca/avala-beli-potok-vozdovac-opstina-beograd/jednoetazna/6429cd2f6f3f542b2f0f151b,,,,,,,,,,"1-etažna kuća na prodaju, Avala, 300.000€, 140m² - 4zida",2024-03-22,,,,,,,,,,,,,,,,,
331,https://www.4zida.rs/prodaja-kuca/centar-1-gradske-lokacije-subotica/kuca/651eba744500f9ef75010087,348 m² ,,grejanje na gas ,226 ,pre 10 dana ,350.000,Centar 1,"Centar 1, Gradske lokacije, Subotica","<h2 _ngcontent-ng-c3151048826 class=""mat-headline-5"">Opis oglasa</h2><div _ngcontent-ng-c3151048826 class=""prose max-h-64 overflow-hidden text-gray-800 ng-star-inserted""><p>Prodaje se stambeni-poslovni objekat u MZ Centar 3, blizu centar grada na placu od 304 m2. Kuća ima 348m2 korisnu površinu. Sastoji se iz prizemlja i potkrovlje. Na prizemlju je poslovni objekat sa ulazom, 3 kancelarije, kuhinje sa trpezarijom, sanitarnom čvorom. Sa ulice je poseban poslovni prostor sa sanitarnim čvorom i posebna garaža sa ulazom sa ulice.<br>Na potkrovlju ima dva stana, jedan manji sa 2 sobe i jedan veći koji sastoji od predsoblja, kupatila, Wc-a, kuhinje, ostave, dve spavaće sobe, dnevne sobe i trpezarije sa terasom.<br>Objekat je građen od opeke, izolovan stiroporom, podovi su parket i keramičke pločice, stolarija je klasična drvena i od PVC-a, postoji alarmni sistem, grejanje je etažno grejanje na gas. Voda je iz gradske vodovodne mreže, kanalizacija je priključena na gradsku kanalizacionu mrežu.<br>U dvorištu ima parking mesta za 3 auta.<br>Objekat ima izlaz na tri ulice.<br>Objekat je pogodan za razne vrste delatnosti, kao privatna ordinacija, dom za stare, kancelarije, za investitore(stanove).","Kuća na prodaju, Centar 1, 350.000€, 348m² - 4zida",2024-03-22,3.04a plac ,,,1 parking mesto ,terasa ,kuhinja ,prazno ,Kanalizacija ,,,,2003,,,,,
332,https://www.4zida.rs/prodaja-kuca/sopot-sopot-opstina-beograd/dvoetazna/64fb9a98f66ad9d1d8012856,,,,,,,,,,"Prodaja kuća Sopot, Sopot opština, Beograd, Dvoetažna - 4zida",2024-03-22,,,,,,,,,,,,,,,,,
333,https://www.4zida.rs/prodaja-kuca/sojka-medijana-gradske-lokacije-nis/jednoetazna/647da8d034fb207406010ac7,76 m² ,1,,p,pre 9 meseci ,170.200,Stevana Nemanje,"Šojka, Medijana, Gradske lokacije, Niš","<h2 _ngcontent-ng-c3151048826 class=""mat-headline-5"">Opis oglasa</h2><div _ngcontent-ng-c3151048826 class=""prose max-h-64 overflow-hidden text-gray-800 ng-star-inserted""><p>Na prodaju prizemna kuća u centru, u neposrednoj blizini Pravnog, Ekonomskog fakulteta. Kuća je je površne 76m2. Sastoji se od ulaznog hodnika, dnevne sobe sa uvučenom manjom kuhinjom, spavaće sobe i kupatila, nalazi se na placu površine 404m2. Kuća je starije gradnje i potrebano je renoviranje, na placu se nalazio i pomoćni objekat koj je srušen. Uknjižena, vlasništvo 1/1. Ovo je samo deo naše ponude, ovaj kao i druge nekretnine sa većim brojem fotografija možete pogledati na našem sajtu.","1-etažna kuća na prodaju, Stevana Nemanje, 170.200€, 76m² - 4zida",2024-03-22,,uknjiženo ,,,,,,,1 garažno mesto ,3 sobe ,,,,,,,
334,https://www.4zida.rs/prodaja-kuca/gradske-lokacije-sombor/kuca/65e0cc3fba4edca5350979db,70 m² ,,,1316 ,pre 22 dana ,38.200,Gradske lokacije,"Gradske lokacije, Sombor","<h2 _ngcontent-ng-c3151048826 class=""mat-headline-5"">Opis oglasa</h2><div _ngcontent-ng-c3151048826 class=""prose max-h-64 overflow-hidden text-gray-800 ng-star-inserted""><p>Blizu Vidovdanske ulice se prodaje kaća od 70m2 sa pomoćnim objektima od 19m2 na parceli od 278m2.<br>Kuća je čvrste gradnje, ima pretsoblje, dve sobe, trpezariju sa kuhinjom, ostavu, kupatilo, terasu. Gradska voda, struja, kanalizacija.<br>Cena 38.200e za dogovor.","Kuća na prodaju, Gradske lokacije, 38.200€, 70m² - 4zida",2024-03-22,3a plac ,,,,,,prazno ,,,,,,,,,,
335,https://www.4zida.rs/prodaja-kuca/obrenovac-obrenovac-opstina-beograd/jednoetazna/6521471333a12659e80c3d6e,,,,,,,,,,"Prodaja kuća Obrenovac, Obrenovac opština, Beograd, Jednoetažna - 4zida",2024-03-22,,,,,,,,,,,,,,,,,
336,https://www.4zida.rs/prodaja-kuca/tatarsko-brdo-sremska-kamenica-gradske-lokacije-novi-sad/kuca/6489cdb6624505f3fe003058,,,,,,,,,,Pretraga Nekretnina za Prodaju i Izdavanje · 4zida,2024-03-22,,,,,,,,,,,,,,,,,
337,https://www.4zida.rs/prodaja-kuca/cardak-sremska-kamenica-gradske-lokacije-novi-sad/kuca/6489cdce624505f3fe003082,177 m² ,,grejanje na gas ,3079568 ,pre 8 meseci ,154.500,Čardak,"Čardak, Sremska Kamenica, Gradske lokacije, Novi Sad","<h2 _ngcontent-ng-c3151048826 class=""mat-headline-5"">Opis oglasa</h2><div _ngcontent-ng-c3151048826 class=""prose max-h-64 overflow-hidden text-gray-800 ng-star-inserted""><p>Agencijska oznaka - 3079568 - Uknjižena kuća u Sremskoj Kamenici na placu od 580 m2. Šestosobna po strukturi. U katastru je upisana samo osnova od 57 m2. U dva nivoa se nalazi po dnevni boravak sa kuhinjom i trpezarijom, po veća soba i tri kupatila na svakom nivou po jedno. Kuća je okružena sa puno terasa, sa kojih puca pogled na grad i Popovicu. Dole je velika terasa, koja je dograđena. Kuća zahtava izvesna ulaganja i okružena je sa puno zelenila i raznih stabala starih 20 - 30 godina. Grejanje je na gasne peći. Ispred kuće ima parking mesto. Zvati na 064 823 66 36. Buda","Kuća na prodaju, Čardak, 154.500€, 177m² - 4zida",2024-03-22,,uknjiženo ,uobičajeno stanje ,,terasa ,,,,,6 soba ,,,,,,,
338,https://www.4zida.rs/prodaja-kuca/gradske-lokacije-zlatibor/jednoetazna/654b44f2d9b112ce930993f0,116 m² ,1,,2285,pre 4 meseca ,168.000,Crvenog Gloga,"Gradske lokacije, Zlatibor","<h2 _ngcontent-ng-c3151048826 class=""mat-headline-5"">Opis oglasa</h2><div _ngcontent-ng-c3151048826 class=""prose max-h-64 overflow-hidden text-gray-800 ng-star-inserted""><p>Na prodaju kuća na Zlatiboru, u neposrednoj blizini apartmanskog naselja Zlatiborski konaci. Kuća je zidana termo blokom, obložena spolja vunom i daskom od najkvalitetnijeg starog bora; dok je unutrašnjost obložena izolacijom i belim borom. Kuća poseduje 3ara placa sa parkingom i dvorištem, i podeljena je u dve smeštajne jedinice, prizemlje (57m2) i sprat sa potkrovljem (60m2 sa galerijom) sa fizički odvojenim ulazima. Instalacije su rađene tako da se kuća može podeliti u dva aprtmana. Navedene su neto površine. Terase ne ulaze u ukupnu površinu kuća. Atraktivna spoljašnjost, prostrana i odlično organizovana unutrašnjost, kompaktan dizajn, čine ovu planinsku lepoticu idealnim izborom za svakoga ko je u potražnji za atraktivnom i funkcionalnom nekretninom!Pozovite nas i rado ćemo Vam je i uživo prezentovati.Umerena klima i sudar kontinentalnih I mediteranskih vazdušnih strujanja na ovoj planini stvaraju čuvenu “ružu vetrova”, koja ubrzava regeneraciju i izlečenje. Veliki broj sunčanih sati godišnje, prijatna klima, ali i bogat biljni i životinjski svet učinili su zlatnu planinu mestom poznatom kao banja za sve one koji hoće da investiraju u svoje zdravlja, što je veoma pogodno ukoliko želite da povratite svoju investiciju izdavanjem, imajući u vidu da je Zlatibor  jedna od najposećenijih turističkih destinacija u zemlji.","1-etažna kuća na prodaju, Crvenog Gloga, 168.000€, 116m² - 4zida",2024-03-22,2.98a plac ,uknjiženo ,u izgradnji ,1 parking mesto ,dvorište ,kupatila (2) ,,,,4 sobe ,,,,,,,
339,https://www.4zida.rs/prodaja-kuca/sremska-kamenica-gradske-lokacije-novi-sad/kuca/64ca1e91546d2bd87e0a54f4,,,,,,,,,,Pretraga Nekretnina za Prodaju i Izdavanje · 4zida,2024-03-22,,,,,,,,,,,,,,,,,
