,link,Površina,Broj soba,Uknjiženost,Stanje,Parking,Infrastruktura,Unutrašnje prostorije,Šifra oglasa,Oglas ažuriran,price,street,address,description,title,end_date,Tip,Broj etaža,Plac,Grejanje,Opremljenost,Nameštenost,Godina izgradnje,Vodoinstalacija,Garaža,Internet,Orijentacija nekretnine,Pogled na
0,https://www.4zida.rs/prodaja-kuca/cibutkovica-lazarevac-opstina-beograd/kuca/658043a862e8ac17900e7493,50 m² ,3 sobe ,uknjiženo ,renovirano ,1 parking mesto ,"podrum, terasa ",kuhinja ,6131 ,pre 9 sati ,99.000,Čibutkovica,"Čibutkovica, Lazarevac opština, Beograd","<h2 _ngcontent-ng-c3754543513 class=""mat-headline-5"">Opis oglasa</h2><div _ngcontent-ng-c3754543513 class=""prose max-h-64 overflow-hidden text-gray-800 ng-star-inserted""><p>Prodajemo kompletno sređenu kuću za život 50m2 sa pogledom i imanjem od 10 ha u Čibutkovici 14km od Lazarevca.<br>Letnjikovac od 40m2 i kompletan sistem za navodnjavanje, kao i opremljen funkcionalan bunar sa protokom vode 1,5l u sekundi.<br>U selu postoje dva izvora mineralne vode, vrtić, škola, fudbalsko igralište, bazen<br>Blizina Ibarske magistrale, asfalt do kuće, blizina Banje Vrujci.<br>Agencijska provizija 2%<br>Šta podrazumeva agencijska provizija od 2%:<br>Agencija, zajedno sa agentom, je tu za Vas vezano za:","Kuća na prodaju, Čibutkovica, 99.000€, 50m² - 4zida",2023-12-19,,,,,,,,,,,,
1,https://www.4zida.rs/prodaja-kuca/centar-gradske-lokacije-sremski-karlovci/jednoetazna/657d541f70d28deac20b886f,300 m² ,5 soba ,uknjiženo ,potrebno renoviranje ,,"tavan, terasa ","toaleti (2), kuhinja, ostava ",,pre 1 sat ,206.000,Centar Karlovaca,"Centar, Gradske lokacije, Sremski Karlovci","<h2 _ngcontent-ng-c3754543513 class=""mat-headline-5"">Opis oglasa</h2><div _ngcontent-ng-c3754543513 class=""prose max-h-64 overflow-hidden text-gray-800 ng-star-inserted""><p>PRODAJE SE PRIZEMNA VELIKA KUĆA, U SAMOM CENTRU SREMSKIH KARLOVACA. KUĆA JE VELIKA, PROSTRANA I POSEDUJE VIŠE OD 5 PROSTRANIH SOBA ZA SPAVANJE (KOJE BI MOGLE DA SE PRETVORE U APARTMANE). SAMA POZICIJA KUĆE JE FANTASTIČNA ZA ONE SA VIZIJOM; NALAZI SE NA 200 METARA OD FONTANE I KARLOVAČKE GIMNAZIJE. SA PROZORA SE PRUŽA VELIČANSTVEN POGLED NA DUNAV I KROVOVE CRKVE I GIMNAZIJE. ","1-etažna kuća na prodaju, Centar Karlovaca, 206.000€, 300m² - 4zida",2023-12-19,Samostalna kuća ,1,600a plac ,kaljeva peć ,"klima, kuhinjski elementi, frižider, rerna, ležaj, Kanalizacija ",,,,,,,
2,https://www.4zida.rs/prodaja-kuca/lestane-grocka-opstina-beograd/kuca/65804be7c36a0c6b17098f38,314 m² ,,uknjiženo ,uobičajeno stanje ,1 parking mesto ,terasa ,"kuhinja, ostava ",585 ,pre 1 dan ,220.000,Leštane,"Leštane, Grocka opština, Beograd","<h2 _ngcontent-ng-c3754543513 class=""mat-headline-5"">Opis oglasa</h2><div _ngcontent-ng-c3754543513 class=""prose max-h-64 overflow-hidden text-gray-800 ng-star-inserted""><p>Prodaje se kuća smeštenu u neposrednoj blizini obilaznice i autoputa. Leštane, smeštene na jugoistoku Beograda, predstavljaju pravu oazu mira i spokoja, savršenu kombinaciju prirodnih lepota i urbanog života. ","Kuća na prodaju, Leštane, 220.000€, 314m² - 4zida",2023-12-19,,,7a plac ,,"kablovska, internet, TV, klima, veš mašina, sudo mašina, frižider, šporet, ležaj ",polunamešteno ,,,,,,
3,https://www.4zida.rs/prodaja-kuca/rakovac-okolne-lokacije-beocin/kuca/65819631165a5d857d003a69,176 m² ,6 soba ,uknjiženo ,uobičajeno stanje ,,,,3014973 ,pre 5 sati ,293.500,Rakovac,"Rakovac, Okolne lokacije, Beočin","<h2 _ngcontent-ng-c3754543513 class=""mat-headline-5"">Opis oglasa</h2><div _ngcontent-ng-c3754543513 class=""prose max-h-64 overflow-hidden text-gray-800 ng-star-inserted""><p>Renovirana samostalna spratna kuća na ulazu u Rakovac.  U  prizemlju ima dnevni boravak, kuhinju sa trpezarijom, dve sobe i kupatilo. Na spratu tri sobe i kupatilo. Miran kraj sa lepim dvorištem iza kuće. Bez ulaganja. Kontakt 0611709234","Kuća na prodaju, Rakovac, 293.500€, 176m² - 4zida",2023-12-19,,,,,,,,,,,,
