,link,Površina,Broj etaža,Broj soba,Grejanje,Stanje,Godina izgradnje,Infrastruktura,Unutrašnje prostorije,Nameštenost,Opremljenost,Šifra oglasa,Oglas ažuriran,price,street,address,description,title,end_date,Uknjiženost,Garaža,Parking,Plac,Tip,Vodoinstalacija,Pogled na,Orijentacija nekretnine,Internet
394,https://www.4zida.rs/prodaja-kuca/bajnat-gradske-lokacije-subotica/kuca/648a20e7df42baea9d0fc2f2,120 m² ,,3 sobe ,kaljeva peć ,uobičajeno stanje ,,"dvorište, terasa ",kupatilo ,prazno ,"telefon, kablovska, klima ",696 ,pre 4 dana ,150.000,Bajnat,"Bajnat, Gradske lokacije, Subotica","<h2 _ngcontent-ng-c3151048826 class=""mat-headline-5"">Opis oglasa</h2><div _ngcontent-ng-c3151048826 class=""prose max-h-64 overflow-hidden text-gray-800 ng-star-inserted""><p>Subotica, Bajnat, prodaje se prizemna kuća sa potkrovljem površine 120m² na placu površine 473m². Kuća se sastoji od predsoblja, kuhinje sa trpezarijom, ostave, dnevnog boravka, kupatila, dve spavaće sobe, kupatila i terase. U istom dvorištu prodaje se i poslovni prostor-pekara površine 72m², koja ima zasebne satove za vodu i struju.","Kuća na prodaju, Bajnat, 150.000€, 120m² - 4zida",2024-01-16,uknjiženo ,,1 parking mesto ,4.73a plac ,,,,,
395,https://www.4zida.rs/prodaja-kuca/futog-okolne-lokacije-novi-sad/kuca/64d25ab1383c214a090efbcd,78 m² ,,3 sobe ,,uobičajeno stanje ,,,,,,3045829 ,pre 28 dana ,82.400,Futog,"Futog, Okolne lokacije, Novi Sad","<h2 _ngcontent-ng-c3151048826 class=""mat-headline-5"">Opis oglasa</h2><div _ngcontent-ng-c3151048826 class=""prose max-h-64 overflow-hidden text-gray-800 ng-star-inserted""><p>Kuća čvrste gradnje, na super lokaciji u Futogu, za adaptaciju. Povoljno ! +++  Agencijska oznaka nekretnine 3045829, Futog. Prodajemo nekretninu na odličnoj lokaciji u Futogu , na 500m od glavne ulice, ispred kuće je autobusko stajalište. Kuća je prizemna, trosobna, sa odvojenom kuhinjom i kupatilom, uknjižena na 78m2. U dvorištu ima pomoćnih objekata a parcela je površine 669m2. Plac je pravilnog oblika , a front 18m. Ima struju i vodu a gas ispred kuće. Odlična prilika da sredite nekretninu po svojoj meri. Pozovite, Ljiljana Knežević 0613195394, 021546645, 021546282( House nekretnine Novi Sad Reg. br200)","Kuća na prodaju, Futog, 82.400€, 78m² - 4zida",2024-01-16,uknjiženo ,,,,,,,,
396,https://www.4zida.rs/prodaja-kuca/donja-kamenica-sremska-kamenica-gradske-lokacije-novi-sad/jednoetazna/658d4286fef52088510c8263,165 m² ,1,3 sobe ,,staro ,,terasa ,"kupatilo, kuhinja, ostava ",,"telefon, kablovska, Kanalizacija ",521931 ,pre 19 dana ,103.000,Donja Kamenica,"Donja Kamenica, Sremska Kamenica, Gradske lokacije, Novi Sad","<h2 _ngcontent-ng-c3151048826 class=""mat-headline-5"">Opis oglasa</h2><div _ngcontent-ng-c3151048826 class=""prose max-h-64 overflow-hidden text-gray-800 ng-star-inserted""><p>Prodaje se prizemna kuća na fantastičnoj lokaciji u samom centru Sremske Kamenice sa koje se pruža pogled na Novi Sad, plac poseduje izuzetan potencijal. Ne propustite ovu nesvakidašnju priliku i pozovite nas za dodatne informacije.","1-etažna kuća na prodaju, Donja Kamenica, 103.000€, 165m² - 4zida",2024-01-16,uknjiženo ,,,5a plac ,Samostalna kuća ,gradska voda ,,,
397,https://www.4zida.rs/prodaja-kuca/divcibare-okolne-lokacije-valjevo/dvoetazna/65a1d7bc2afe72540a0afe6f,100 m² ,2,5 soba ,,,,"podrum, terase (2), lođa ","kupatilo, kuhinja, ostava ",prazno ,,,pre 1 dan ,125.000,Kraljev sto 36,"Divčibare, Okolne lokacije, Valjevo","<h2 _ngcontent-ng-c3151048826 class=""mat-headline-5"">Opis oglasa</h2><div _ngcontent-ng-c3151048826 class=""prose max-h-64 overflow-hidden text-gray-800 ng-star-inserted""><p>Vila Ruzica, jedna od najlepsih vikendica na Divcibarima, vrhunsko arhitektonsko resenje.","2-etažna kuća na prodaju, Kraljev sto 36, 125.000€, 100m² - 4zida",2024-01-16,uknjiženo ,,,5a plac ,Vikendica ,,,,
398,https://www.4zida.rs/prodaja-kuca/stara-zvezda-palilule-gradske-lokacije-kragujevac/kuca/65002096539176db80097ba1,120 m² ,,4 sobe ,,uobičajeno stanje ,1989,terasa ,kupatila (2) ,,"telefon, kablovska, internet, klima ",PK3008231743VJ ,pre 4 meseca ,72.000,Stara zvezda,"Stara zvezda, Palilule, Gradske lokacije, Kragujevac","<h2 _ngcontent-ng-c3151048826 class=""mat-headline-5"">Opis oglasa</h2><div _ngcontent-ng-c3151048826 class=""prose max-h-64 overflow-hidden text-gray-800 ng-star-inserted""><p>Prodaje se kuća u Kragujevcu - naselje Zvezda","Kuća na prodaju, Stara zvezda, 72.000€, 120m² - 4zida",2024-01-16,nije uknjiženo ,1 garažno mesto ,1 parking mesto ,3a plac ,,,,,
399,https://www.4zida.rs/prodaja-kuca/crepaja-okolne-lokacije-kovacica/dvoetazna/646233cbe214b3289d0d2ec0,230 m² ,2,5 soba ,,,,dvorište ,"kupatila (2), ostava ",,,,pre 2 meseca ,130.000,29. novembar,"Crepaja, Okolne lokacije, Kovačica","<h2 _ngcontent-ng-c3151048826 class=""mat-headline-5"">Opis oglasa</h2><div _ngcontent-ng-c3151048826 class=""prose max-h-64 overflow-hidden text-gray-800 ng-star-inserted""><p>Ima 6 betoniranih šupa.<br>Može i kao poslovni prostor.<br>Za više informacija pozovite.","2-etažna kuća na prodaju, 29. novembar, 130.000€, 230m² - 4zida",2024-01-16,uknjiženo ,,,3a plac ,Samostalna kuća ,,,,
400,https://www.4zida.rs/prodaja-kuca/ribnica-gradske-lokacije-kraljevo/troeatazna/6422f78ff1fd8e494c06d80e,,,,,,,,,,,,,,,,,Pretraga Nekretnina za Prodaju i Izdavanje · 4zida,2024-01-16,,,,,,,,,
401,https://www.4zida.rs/prodaja-kuca/peti-puk-gradske-lokacije-valjevo/dvoetazna/657811085f0ab2b27e0043c1,150 m² ,2,3 sobe ,centralno grejanje ,luksuzno ,,"dvorište, tavan, terase (3","kupatilo, toalet, kuhinja, ostava ",prazno ,"telefon, kablovska, internet, klima, kuhinjski elementi, Kanalizacija ",,pre 32 dana ,125.000,Banatska 18,"Peti Puk, Gradske lokacije, Valjevo","<h2 _ngcontent-ng-c3151048826 class=""mat-headline-5"">Opis oglasa</h2><div _ngcontent-ng-c3151048826 class=""prose max-h-64 overflow-hidden text-gray-800 ng-star-inserted""><p>-Na prodaju naša porodična kuća u koju je uloženo puno novca, ljubavi i vremena.","2-etažna kuća na prodaju, Banatska 18, 125.000€, 150m² - 4zida",2024-01-16,uknjiženo ,,,4a plac ,Samostalna kuća ,gradska voda ,,,Optički 
402,https://www.4zida.rs/prodaja-kuca/gradske-lokacije-merosina/jednoetazna/6206b7801bea46731732be33,127 m² ,1,4 sobe ,,uobičajeno stanje ,,,"kupatila (2), toalet ",,,p,pre 8 meseci ,119.000,Baličevac,"Gradske lokacije, Merošina","<h2 _ngcontent-ng-c3151048826 class=""mat-headline-5"">Opis oglasa</h2><div _ngcontent-ng-c3151048826 class=""prose max-h-64 overflow-hidden text-gray-800 ng-star-inserted""><p>Na prodaju kuća u selu Baličevac, udaljenom oko 15km od Niša, u opštini Merošina, sa okućnicom i pomoćnim ekonomskim objektima. Kuća je savremene arhitekture, moderne i kvalitetne gradnje, površine u osnovi 127m2, 9.4m puta 13.6m, korisne površine 240m2. Sastoji se od četiri stepenasto izgrađenih nivoa u poluspratovima povezanih unutrašnjim stepeništem. Prvi nivo sastoji se od podruma i garaže, sa ovog nivoa, iz bilo koje prostorije stepeništem se stiže na sledeći nivo koji je dnevni boravak, a koji se sastoji od dnevne sobe, kuhinje, trpezarije i toaleta. Sledeći nivo je spavaći deo, koji čine tri spavaće sobe i kupatilo. Iz spavaćeg dela, stepenište vodi na naredni nivo koji predstavlja radni deo. U radnom delu nalazi se radni kabinet, dve spavaće sobe, jedna manja i jedna veća i kupatilo. Sve prostorije u kući imaju izlaz na pokrivene terase. U svim sobama je kvalitetan parket, a u sanitarnim prostorijama keramičke pločice, stolarija je drvena, grejanje u celoj kući radijatorima kotlom na čvrsto gorivo i struju. Stepenice su obložene kvalitetnim drvetom i  zaštićene drvenom ogradom. Spoljna izolacija kuće urađena je stiroporom, te zadovoljava propise o termičkoj opremljenosti objekta. Dvorište kuće je uređeni park sa održavanim travnjakom, na kome se nalaze letnjikovac za odmor i roštilj sa pekarom. Ekonomski deo dvorišta je urađen u betonu, a čine ga četiri ekonomske zgrade, koš i ambar sa podrumom dimenzije 8m puta 5m, ekonomska zgrada veličine 24m puta 9m u čijem sastavu je i stolarska radionica, ekonomska zgrada dimenzija 16m puta 8m i nadstrešnica veličine 24m puta 5.5m. Sve ove zgrade mogu biti višenamenske. Treći deo placa čine bašta i mali voćnjak. Kuća i plac se snabdevaju vodom iz dva vodovoda, a na samom placu postoje i dva bunara. Kuća ima kanalizacionu mrežu. Ceo plac je ograđen. Ukupna površina placa je 33 ara, uknjižen, privatna svojina. Ukoliko imate dodatnih pitanja budite slobodni da nas kontaktirate.","1-etažna kuća na prodaju, Baličevac, 119.000€, 127m² - 4zida",2024-01-16,uknjiženo ,1 garažno mesto ,,,,,,,
