,link,Površina,Broj soba,Uknjiženost,Stanje,Parking,Infrastruktura,Unutrašnje prostorije,Šifra oglasa,Oglas ažuriran,price,street,address,description,title,end_date,Tip,Broj etaža,Plac,Grejanje,Opremljenost,Nameštenost,Godina izgradnje,Vodoinstalacija,Garaža,Internet,Orijentacija nekretnine,Pogled na
227,https://www.4zida.rs/prodaja-kuca/kamenica-okolne-lokacije-nis/troeatazna/6184315a1f1e8f0f4f77d863,403 m² ,4 sobe ,uknjiženo ,u izgradnji ,,terase (4) ,kupatila (3,p,pre 8 meseci ,115.000,Pribojska,"Kamenica, Okolne lokacije, Niš","<h2 _ngcontent-ng-c3754543513 class=""mat-headline-5"">Opis oglasa</h2><div _ngcontent-ng-c3754543513 class=""prose max-h-64 overflow-hidden text-gray-800 ng-star-inserted""><p>Na prodaju odlična porodična kuća novije gradnje u sivoj fazi, u blizini nove OŠ u naselju Branko Bjegović. Nalazi se na finoj lokaciji za miran porodični život, a poslednjih godina sve više atraktivnoj zbog odlične povezanosti sa centrom grada. Novo naselje je  poprilično infrastrukturno uređeno. Marketi, nova OŠ, vrtić, ambulanta i novi stambeni objekti, direktna autobuska linija kroz naselje, sve to su prednosti ovog zanimljivog dela grada.							<br>Kuća  je samostojeća površine 403m2, osnova je 125m2, spratnosti podrum, prizemlje i dva sprata. Nalazi se na placu ukupne površine 4.36 ari. Podeljena je u 3 zasebne stambene jedinice, koje su nezavisne. Suteren je predviđen za više namena, kao kotlarnica, letnja kuhinja, podrumska ostava ili kao magacinski prostor za potrebe određenih delatnosti. Pri ulazu u suteren je izdvojen prostor oko 40m2 sa svojim zasebnim ulazom. Postoji mogućnost uređenja u jednoiposoban stan ili letnju kuhinju. Na prvom spratu je komforan četvorosoban stan 129m2, sastoji se od ulaznog hodnika, velikog dnevnog boravka sa trpezarijom, izdvojene kuhinje sa ostavom, tri spavaće sobe i kupatila. Iz boravka i veće spavaće sobe je izlaz na veliku terasu sa fantastičnim otvorenim pogledom na grad. Na drugom spratu su dve stambene jedinice, garsonjera i komforan trosoban stan. Iznad je potkrovlje, koje ima mogućnost proširenja. Iza kuće je garaža za dva vozila. Prilaz do kuće je nasipan i od asvalta udaljen oko 100m. 							<br>Objekat je  kvalitetne novije gradnje u sivoj fazi. Postavljena je kvalitetna spoljna pvc stolarija sa roletnama na svim etažama. Struja i voda su razvedeni u celom objektu. 							<br>Uknjižena, čisto vlasništvo, upisana u katastru sa građevinskom dozvolom. 							<br>Ovo je samo deo naše ponude, ovu kao i druge nekretnine sa većim brojem fotografija možete pogledati na našem sajtu.","3-etažna kuća na prodaju, Pribojska, 115.000€, 403m² - 4zida",2023-12-19,,3,,TA peć ,,,,,1 garažno mesto ,,,
228,https://www.4zida.rs/prodaja-kuca/radanovac-gradske-lokacije-subotica/kuca/631a6a90727e2e52ff05a85f,,,,,,,,,,,,,,Pretraga Nekretnina za Prodaju i Izdavanje · 4zida,2023-12-19,,,,,,,,,,,,
229,https://www.4zida.rs/prodaja-kuca/gradske-lokacije-gadzin-han/troeatazna/64036ebee072f3c1cf037c06,315 m² ,4 sobe ,uknjiženo ,u izgradnji ,1 parking mesto ,,kupatilo ,p,pre 6 meseci ,36.000,Zaplanjska toponica,"Gradske lokacije, Gadžin Han","<h2 _ngcontent-ng-c3754543513 class=""mat-headline-5"">Opis oglasa</h2><div _ngcontent-ng-c3754543513 class=""prose max-h-64 overflow-hidden text-gray-800 ng-star-inserted""><p>Na  prodaju  kuća  u  Zaplanjskoj  Toponici,  na  tri  etaže, pored  asvalta,  sa  potrebnim  priključcima, započeta  kao  objekat  za  proizvodnu  radionicu  ili  pomoćnu  ekonomsku    zgradu  a   sa  useljivim  stambenim  delom. Odlična  prilika  za  ljude  sa  idejom  i  planom  za  investiranje. Privatna  svojina, uknjižena,  sa  građevinskom  dozvolom. Za   više  informacija  pozovite  ili  zakažite  razgledanje.","3-etažna kuća na prodaju, Zaplanjska toponica, 36.000€, 315m² - 4zida",2023-12-19,,3,,grejanje na struju ,,,,,,,,
230,https://www.4zida.rs/prodaja-kuca/rakovac-okolne-lokacije-beocin/kuca/62f58d92d2f3760388042538,,,,,,,,,,,,,,Pretraga Nekretnina za Prodaju i Izdavanje · 4zida,2023-12-19,,,,,,,,,,,,
231,https://www.4zida.rs/prodaja-kuca/borca-palilula-opstina-beograd/troeatazna/5be59a9e273171521b048102,210 m² ,5 soba ,uknjiženo ,luksuzno ,,terasa ,,,pre 23 dana ,320.000,Dimitrija T Leka 7,"Borča, Palilula opština, Beograd","<h2 _ngcontent-ng-c3754543513 class=""mat-headline-5"">Opis oglasa</h2><div _ngcontent-ng-c3754543513 class=""prose max-h-64 overflow-hidden text-gray-800 ng-star-inserted""><p>Porodična uknjižena kuća u Borči, Pr+Sprat+Pk, sa placem od 6.86 ari.<br>ALU stolarija u celoj kući. Klasičan jasenov parket.","3-etažna kuća na prodaju, Dimitrija T Leka 7, 320.000€, 210m² - 4zida",2023-12-19,,3,6a plac ,etažno grejanje ,"kablovska, internet, klima ",prazno ,,,1 garažno mesto ,,,
232,https://www.4zida.rs/prodaja-kuca/sremska-kamenica-gradske-lokacije-novi-sad/dvoetazna/607fd9d1d6f3b60b0c2e4219,,,,,,,,,,,,,,"Prodaja kuća Sremska Kamenica, Gradske lokacije, Novi Sad, Dvoetažna - 4zida",2023-12-19,,,,,,,,,,,,
233,https://www.4zida.rs/prodaja-kuca/surcin-surcin-opstina-beograd/dvoetazna/656ba572a60f9df39e07ab7c,100 m² ,3 sobe ,u procesu uknjižavanja ,u izgradnji ,,terasa ,kupatilo ,,pre 15 dana ,49.999,Dubrovacka 58,"Surčin, Surčin opština, Beograd","<h2 _ngcontent-ng-c3754543513 class=""mat-headline-5"">Opis oglasa</h2><div _ngcontent-ng-c3754543513 class=""prose max-h-64 overflow-hidden text-gray-800 ng-star-inserted""><p>Surcin Dubrovacka 100 kvadrata, Ekstra lokacija 400 metara od centra vlasnik uvedena trofazna struja i razvedena po kuci pre dve godine, lep plac ravan ulica nov asvalt,kanalizacija .","2-etažna kuća na prodaju, Dubrovacka 58, 49.999€, 100m² - 4zida",2023-12-19,Samostalna kuća ,2,5.5a plac ,,Kanalizacija ,prazno ,2000,,,,,
234,https://www.4zida.rs/prodaja-kuca/gundulicev-venac-donji-dorcol-dorcol-stari-grad-opstina-beograd/kuca/636cdca3b397e396100ad93d,,,,,,,,,,,,,,Pretraga Nekretnina za Prodaju i Izdavanje · 4zida,2023-12-19,,,,,,,,,,,,
235,https://www.4zida.rs/prodaja-kuca/tatarsko-brdo-sremska-kamenica-gradske-lokacije-novi-sad/kuca/650d761f3b878433750a9ef8,560 m² ,10 soba ,uknjiženo ,uobičajeno stanje ,,terasa ,,3045135 ,pre 2 meseca ,750.000,Tatarsko Brdo,"Tatarsko Brdo, Sremska Kamenica, Gradske lokacije, Novi Sad","<h2 _ngcontent-ng-c3754543513 class=""mat-headline-5"">Opis oglasa</h2><div _ngcontent-ng-c3754543513 class=""prose max-h-64 overflow-hidden text-gray-800 ng-star-inserted""><p>Savršena vila na prestižnoj  lokaciji ! Fenomenalna nekretnina  na Tatrskom brdu .   +++  Agencijska oznaka nekretnine 3045135 , Sremska Kamenica , Tatarsko brdo . U prilici smo da vam ponudimo izuzetnu vilu na najboljem delu Tatarskog brda . Nekretnina od 560m2 sa tri  nadzemne etaže , suterenskim prostorom i  sa prostranim lepo uređenim dvorištem . Ograđena  je visokom  betonskom  ogradom sa tri strane i ulaznom kapijom od kovanog gvožđa sa prednje strane sa daljinskim upravljanjem ,  opremljena video nadzorom, te odaje utisak potpune privatnosti i zaštićenosti od pogleda prolaznika . Ovaj miran, luksuzan dom građen je visokokvalitetno sa puno ljubavi i stila od strane vlasnika koji i dalje u njoj žive. Kuća i imanje su održavani i u besprekornom su stanju . Unutrašnja dekoracija je izvedena od strane vrhunskih majstora  najkvalitetnijim materijalima. Unutrašnja stolarija od bukovog drveta je ručno rađena , a spoljašnja visokokvalitetna PVC . Kuća je opremljena izuzetno kvalitetnim nameštajem koji u dogovoru sa prodavcem može i da ostane u kući .  Prizemlje predstavlja četvorosoban zaseban stan od 146m2, sa izlazom na prelepu dvorišno orijentisanu terasu . Prostrana dnevna soba  sa kaminom , kuhinjom i trpezarijom ,  tri spavaće sobe, dva kupatila . Izuzetno stepenište je  svojevrstan ukras doma a  iz ulaznog hola vodi do sprata na kojem se nalazi drugi, veći stan od 196m2 . Takođe , i ovde se nalazi ogroman moderan dnevni boravak u koji se nestvarno uklopila starinska peć zidana blatom i starom ciglom . Izuzetna svetla kuhinja , trpezarija , ostava, tri spavaće sobe i dva kupatila . Neobično stepenište kojim se dolazi do poslednje , treće etaže , a ona predstavlja neverovatan vidikovac sa kojeg pogled puca na Frušku goru i grad . i takođe je deo ovog stana .Vidikovac je zastakljen velikim staklenim portalima, koji se u letnjim mesecima mogu skroz otvoriti . Suterenski deo čini teretana, sauna, tehničke prostorije ( kotlarnica, ostava , ..) Spoljna rasveta u večernjim satima ovu inače prelepu kuću i divno uređeno dvorište  čini još lepšim . Nekretnina  je za veću porodicu , ali da pri tom svako ima svoju intimu i zasebnost . Vila je idealna  za onog kupca koji želi mir i tišinu , a ujedno i blizinu gradu . Nekretnina je uknjižena , bez tereta . Za sve dodatne informacije i gledanje uz prethodnu najavu , pozovite ! Ljiljana Knežević 0613195394, 021546645 , 021546282 ( House nekretnine Novi Sad , Reg.  br 200)","Kuća na prodaju, Tatarsko Brdo, 750.000€, 560m² - 4zida",2023-12-19,,,,grejanje na gas ,,,,,,,,
236,https://www.4zida.rs/prodaja-kuca/borca-palilula-opstina-beograd/kuca/63134cf36ec84b69a90e1fe8,333 m² ,,uknjiženo ,,1 parking mesto ,"podrum, terasa ",,19387 ,pre 6 meseci ,140.000,Put za Ovču,"Borča, Palilula opština, Beograd","<h2 _ngcontent-ng-c3754543513 class=""mat-headline-5"">Opis oglasa</h2><div _ngcontent-ng-c3754543513 class=""prose max-h-64 overflow-hidden text-gray-800 ng-star-inserted""><p>Palilula, Borča - Put za Ovču","Kuća na prodaju, Put za Ovču, 140.000€, 333m² - 4zida",2023-12-19,,,,TA peć ,kablovska ,prazno ,,,,,,
237,https://www.4zida.rs/prodaja-kuca/novo-selo-gradske-lokacije-subotica/jednoetazna/653f9d1156dc5ee233006b21,90 m² ,3 sobe ,uknjiženo ,,,podrum ,,,pre 1 mesec ,48.000,Gajeva,"Novo Selo, Gradske lokacije, Subotica","<h2 _ngcontent-ng-c3754543513 class=""mat-headline-5"">Opis oglasa</h2><div _ngcontent-ng-c3754543513 class=""prose max-h-64 overflow-hidden text-gray-800 ng-star-inserted""><p>Prodajem kuću u Subotici, okolina Gajeve, nedaleko od grada. Osnovna škola u blizini, prodavnice, apoteke, dom zdravlja...","1-etažna kuća na prodaju, Gajeva, 48.000€, 90m² - 4zida",2023-12-19,Samostalna kuća ,1,6a plac ,,Kanalizacija ,prazno ,,gradska voda ,,,,
238,https://www.4zida.rs/prodaja-kuca/begec-okolne-lokacije-novi-sad/troeatazna/60f5bcf3a2c43440fb0fad7c,148 m² ,10 soba ,uknjiženo ,,,terasa ,kupatilo ,1762 ,pre 8 meseci ,113.300,Begeč,"Begeč, Okolne lokacije, Novi Sad","<h2 _ngcontent-ng-c3754543513 class=""mat-headline-5"">Opis oglasa</h2><div _ngcontent-ng-c3754543513 class=""prose max-h-64 overflow-hidden text-gray-800 ng-star-inserted""><p>NA PRODAJU ODLIČNA SPRATNA KUCA U BEGEČU KOJA SE NALAZI NA GLAVNOM PUTU.IDEALNA ZA POSLOVNE DELATNOSTI KAO I ZA STANOVANJE. TRI VRSTE GREJANJA KOTAO NA GAS,KOTAO NA ČVRSTO GORIVO ,KOTAO NA STRUJU. PO CELOJ KUCI RAZVEDENI RADIJATORI.SASTOJI SE OD POLU SUTERENSKOG DELA,PRVOG I DRUGOG SPRATA. DNEVNI BORAVAK 50m2. 5 SOBA ,VELIKO KUPATILO 16m2,KOMFORNA KUHINJA,TRI TERASE OD KOJIH JE JEDNA OD OKO 30m2.U SUTERENSKOM DELU SE NALAZI VIŠE ZASEBNIH  PROSTORIJA OD KOJIH JE JEDNA VECA PROSTORIJA KOJA SE KORISTILA KAO POSLOVNI PROSTOR.U SUTERENSKOM DELU JE TAKODJE SMEŠTENA KOTLARNICA.LEPO DVORIŠTE IDEALNO ZA ODMOR I UŽIVANJE.SVE U SVEMU IDEALNA NEKRETNINA PO POVOLJNOJ CENI U BLIZINI NOVOG SADA.VREDI POGLEDATI.","3-etažna kuća na prodaju, Begeč, 113.300€, 148m² - 4zida",2023-12-19,,3,4.04a plac ,grejanje na gas ,telefon ,prazno ,,,,,,
239,https://www.4zida.rs/prodaja-kuca/palilula-gradske-lokacije-nis/jednoetazna/6551f739fc2ebaf0a101a937,200 m² ,4 sobe ,uknjiženo ,,,,,p,pre 1 mesec ,145.000,Mokranjčeva,"Palilula, Gradske lokacije, Niš","<h2 _ngcontent-ng-c3754543513 class=""mat-headline-5"">Opis oglasa</h2><div _ngcontent-ng-c3754543513 class=""prose max-h-64 overflow-hidden text-gray-800 ng-star-inserted""><p>Na prodaju kuća na Paliluli, u blizini NKC-a.<br>Plac ima 2,2 ara, kuća ima 200m2 (90m2 u osnovi), Su+P+II+Pk. U suturenu su garaža i podrum, na prizemlju se nalaze ulazni hodnik, dnevna soba, trpezarija, kuhinja, spavaća soba, kupatilo i velika terasa. Na I. i II. spratu se nalaze dva dvoiposobna stana.	Kuća je građena po visokim standardima, ima CG na sve vrste goriva. U dvorištu se nalazi i pomoćna zgrada. Topla preporuka naše agencije.	Uknjižena, čisto vlasništvo.<br>Ovo je samo deo naše ponude, ovaj kao i druge stanove sa većim brojem fotografija možete pogledati na našem sajtu.","1-etažna kuća na prodaju, Mokranjčeva, 145.000€, 200m² - 4zida",2023-12-19,,1,,,,,,,1 garažno mesto ,,,
240,https://www.4zida.rs/prodaja-kuca/misa-vinogradi-gradske-lokacije-pancevo/troeatazna/6362b75298c150c39d0c5079,300 m² ,9 soba ,uknjiženo ,,,"dvorište, tavan, terase (3",kupatila (3,,pre 18 dana ,220.000,Kozaračka 93,"Misa Vinogradi, Gradske lokacije, Pančevo","<h2 _ngcontent-ng-c3754543513 class=""mat-headline-5"">Opis oglasa</h2><div _ngcontent-ng-c3754543513 class=""prose max-h-64 overflow-hidden text-gray-800 ng-star-inserted""><p>Kuća na prodaju 300m2, 3 odvojene etaže po 100m2. Prizemlje (nije suteren), prvi sprat i drugi sprat (nije potkrovlje). Svaka etaža ima kupatilo, kuhinju, predsoblje i 3 sobe. Legalizovana, na placu je ucrtan još jedan objekat. Plac je 3.5 ari. Vlasnik","3-etažna kuća na prodaju, Kozaračka 93, 220.000€, 300m² - 4zida",2023-12-19,Samostalna kuća ,3,3.5a plac ,centralno grejanje ,"telefon, kablovska, klima, Kanalizacija ",polunamešteno ,2000,gradska voda ,,Kablovska ,,"ulicu, dvorište "
241,https://www.4zida.rs/prodaja-kuca/muzlja-gradske-lokacije-zrenjanin/jednoetazna/5d1c6d31273171311f04bc09,,,,,,,,,,,,,,"Prodaja kuća Mužlja, Gradske lokacije, Zrenjanin, Jednoetažna - 4zida",2023-12-19,,,,,,,,,,,,
242,https://www.4zida.rs/prodaja-kuca/gradske-lokacije-sombor/kuca/64be5fe8d738599e84067f59,282 m² ,,,,,,,1200 ,pre 4 meseca ,155.000,Gradske lokacije,"Gradske lokacije, Sombor","<h2 _ngcontent-ng-c3754543513 class=""mat-headline-5"">Opis oglasa</h2><div _ngcontent-ng-c3754543513 class=""prose max-h-64 overflow-hidden text-gray-800 ng-star-inserted""><p>Na dobroj lokaciji se prodaje nekretnina od 282m2 na parceli od 351m2.<br>Prednji deo kuće sa ulice ima dva lokala, svaki lokal ima svoj mokri čvor. Deo kuće koji je uz lokale ima odvojen ulaz iz dvorišta, poseduje hodnik, kupatilo, trpezariju sa kuhinjom i ostavom, spavaću sobu, letnju kuhinju.<br>Novija kuća, građena ´90-tih, sa posebnim ulazom, ima hodnik, trpezariju, kuhinju, kupatilo i sobu. Iz hodnika vode stepenice na sprat, gde postoji kupatilo i dve sobe i izlaz na terasu.  Ispod novog dela kuće se nalazi podrum.<br>U dvorištu je garaža.<br>Struja trofazna. Grejanje je na struju.","Kuća na prodaju, Gradske lokacije, 155.000€, 282m² - 4zida",2023-12-19,,,3a plac ,,,prazno ,1990,,,,,
243,https://www.4zida.rs/prodaja-kuca/zvezdara-zvezdara-opstina-beograd/kuca/648f918b7c9b6e7c720480f4,,,,,,,,,,,,,,Pretraga Nekretnina za Prodaju i Izdavanje · 4zida,2023-12-19,,,,,,,,,,,,
244,https://www.4zida.rs/prodaja-kuca/starcevo-okolne-lokacije-pancevo/jednoetazna/642c086ac91d5536e00e367b,191 m² ,4 sobe ,uknjiženo ,renovirano ,,,,,pre 8 meseci ,120.000,Starčevo,"Starčevo, Okolne lokacije, Pančevo","<h2 _ngcontent-ng-c3754543513 class=""mat-headline-5"">Opis oglasa</h2><div _ngcontent-ng-c3754543513 class=""prose max-h-64 overflow-hidden text-gray-800 ng-star-inserted""><p>Spratna kuća sa garažom i pomoćnim objektima sa nepunih 10 ari placa u centru Starčeva.","1-etažna kuća na prodaju, Starčevo, 120.000€, 191m² - 4zida",2023-12-19,Domaćinstvo ,1,10a plac ,etažno grejanje ,"telefon, kablovska, Kanalizacija ",,,,,,,
245,https://www.4zida.rs/prodaja-kuca/stari-ledinci-budisava-okolne-lokacije-novi-sad/kuca/640a0557771d7d2496001a51,,,,,,,,,,,,,,Pretraga Nekretnina za Prodaju i Izdavanje · 4zida,2023-12-19,,,,,,,,,,,,
246,https://www.4zida.rs/prodaja-kuca/centar-gradske-lokacije-zrenjanin/jednoetazna/6538f73745240fe64001668e,157 m² ,,,,,terasa ,kupatila (2) ,12611499 ,pre 1 mesec ,150.000,Centar,"Centar, Gradske lokacije, Zrenjanin","<h2 _ngcontent-ng-c3754543513 class=""mat-headline-5"">Opis oglasa</h2><div _ngcontent-ng-c3754543513 class=""prose max-h-64 overflow-hidden text-gray-800 ng-star-inserted""><p>Prodaje se salonska kuća na dobroj lokaciji - 10 minuta hoda od strogog centra, neposredna blizina<br>osnovene škole, glavne gradske pijace i nekoliko marketa. Kuća je podeljena u dve stambene<br>jedinice tj. četvorosoban stan od 89m2 i dvosoban stan od 68m2 na placu ukupne površine 6,33 ara.<br>U kuću je ulagano, nova drvena stolarija do ulice, polovina kuće u demit fasadi, centralno grejanje sa<br>dva kotla na plin, dva sata za struju i vodu, rađeno kupatilo. U dvorištu pored stambenih objekata<br>postoje još dva podruma, dve ostave, poljski wc i tri garaže.","1-etažna kuća na prodaju, Centar, 150.000€, 157m² - 4zida",2023-12-19,,1,6a plac ,,,,,,,,,
247,https://www.4zida.rs/prodaja-kuca/gradske-lokacije-aleksinac/troeatazna/60e5d21945d1ae71d3341b49,87 m² ,4 sobe ,,,,,kupatilo ,p,pre 8 meseci ,36.000,Žitkovac,"Gradske lokacije, Aleksinac","<h2 _ngcontent-ng-c3754543513 class=""mat-headline-5"">Opis oglasa</h2><div _ngcontent-ng-c3754543513 class=""prose max-h-64 overflow-hidden text-gray-800 ng-star-inserted""><p>Prodaje se kuća u Žitkovcu, površine 87m2. Kuća se nalazi u mirnoj ulici u centru. Na oko 100m od kuće nalaze se škola, pijaca, marketi, železnička i autobuska stanica. U dvorištu kuće nalazi se garaža. Kuća je veoma kvalitetne gradnje, sa debelim zidovima i visokim plafonom. Grejanje je na struju. Ovo je samo deo naše ponude. Za više informacija posetite naš sajt.","3-etažna kuća na prodaju, Žitkovac, 36.000€, 87m² - 4zida",2023-12-19,,3,,grejanje na struju ,,,,,1 garažno mesto ,,,
248,https://www.4zida.rs/prodaja-kuca/rakovac-okolne-lokacije-beocin/kuca/6425a8e104d93fd4300041d4,,,,,,,,,,,,,,Pretraga Nekretnina za Prodaju i Izdavanje · 4zida,2023-12-19,,,,,,,,,,,,
249,https://www.4zida.rs/prodaja-kuca/lazarevo-selo-okolne-lokacije-nis/jednoetazna/64145a00dcbac32e4605725e,230 m² ,4 sobe ,uknjiženo ,novo ,1 parking mesto ,,kupatila (2) ,p,pre 13 dana ,135.000,Lazarevo selo,"Lazarevo Selo, Okolne lokacije, Niš","<h2 _ngcontent-ng-c3754543513 class=""mat-headline-5"">Opis oglasa</h2><div _ngcontent-ng-c3754543513 class=""prose max-h-64 overflow-hidden text-gray-800 ng-star-inserted""><p>Na prodaju luksuzna kuća namenjena za veću porodicu, nalazi se na samo 12km od centra Niša. Neverovatna klima i cist vazduh sve neophodno za prelep,zdrav  život u mirnom lepom okruženju.								","1-etažna kuća na prodaju, Lazarevo selo, 135.000€, 230m² - 4zida",2023-12-19,,1,,etažno grejanje ,"kablovska, internet, interfon, klima ",,,,,,,
250,https://www.4zida.rs/prodaja-kuca/ledena-stena-palilula-gradske-lokacije-nis/kuca/651c076958c5dbec0c06e476,,,,,,,,,,,,,,Pretraga Nekretnina za Prodaju i Izdavanje · 4zida,2023-12-19,,,,,,,,,,,,
251,https://www.4zida.rs/prodaja-kuca/beograd-centar-stari-grad-opstina-beograd/kuca/6425c1f38ab17184d40f27fc,276 m² ,5 soba ,uknjiženo ,,,terasa ,,30258 ,pre 8 meseci ,1.200.000,Cetinjska,"Beograd centar, Stari Grad opština, Beograd","<h2 _ngcontent-ng-c3754543513 class=""mat-headline-5"">Opis oglasa</h2><div _ngcontent-ng-c3754543513 class=""prose max-h-64 overflow-hidden text-gray-800 ng-star-inserted""><p>Na odlicnoj lokaciji, nedaleko od Skadarlije.<br>Odlicna povezanost sa svim delovima grada.<br>Prema informaciji o lokaciji dozvoljena gradnja je PR+5 spratova plus polusuteren i potkrovlje. Uknjizena na 92m2 mereno 276m2.<br>Prikaz na mapi je informativnog karaktera.<br>Ag provizija 2% Uknjizena PR/1 Cetinjska  -imamo slicne NEKRETNINE BEOGRAD http://www.favoritnekretnine.co.rs/stan-beograd/kartica.php?id=30258","Kuća na prodaju, Cetinjska, 1.200.000€, 276m² - 4zida",2023-12-19,,,2a plac ,,,,,,,,,
252,https://www.4zida.rs/prodaja-kuca/batajnica-zemun-opstina-beograd/kuca/5c9ebd1f2731714f7e1b210d,290 m² ,1 soba ,uknjiženo ,,,,kupatilo ,98904 ,pre 13 dana ,140.000,Branka Živkovića,"Batajnica, Zemun opština, Beograd","<h2 _ngcontent-ng-c3754543513 class=""mat-headline-5"">Opis oglasa</h2><div _ngcontent-ng-c3754543513 class=""prose max-h-64 overflow-hidden text-gray-800 ng-star-inserted""><p>Velika kuća na tri nivoa, II i III nivo na 14a placa, pogodno za veliku porodicu ili poslovni objekat. u procesu legalizacije.<br>Prostorije: Predsoblje, dnevna soba + trpezarija, spavaća soba, kupatilo, wc, ostava, vešernica.<br>Prvi sprat - isti raspored kao u prizemlju. Potkrovlje - pregradni zidovi. Kuća je legalizovana. agencijska provizija 2%","Kuća na prodaju, Branka Živkovića, 140.000€, 290m² - 4zida",2023-12-19,,,14a plac ,,telefon ,prazno ,,,,,,
253,https://www.4zida.rs/prodaja-kuca/durlan-pantelej-gradske-lokacije-nis/jednoetazna/6527c949ecd43433dc0f1818,220 m² ,,uknjiženo ,renovirano ,,terasa ,,10123 ,pre 2 meseca ,200.000,Durlan,"Durlan, Pantelej, Gradske lokacije, Niš","<h2 _ngcontent-ng-c3754543513 class=""mat-headline-5"">Opis oglasa</h2><div _ngcontent-ng-c3754543513 class=""prose max-h-64 overflow-hidden text-gray-800 ng-star-inserted""><p>Porodična kuća na prodaju - Durlan - 220m2 - 200.000e","1-etažna kuća na prodaju, Durlan, 200.000€, 220m² - 4zida",2023-12-19,,1,,grejanje na gas ,"telefon, kablovska, internet, klima ",prazno ,,,1 garažno mesto ,,,
254,https://www.4zida.rs/prodaja-kuca/niska-banja-gradske-lokacije-nis/jednoetazna/6427ea828830522310067f90,486 m² ,4 sobe ,,,,,,p,pre 8 meseci ,103.000,Carigradska,"Niška Banja, Gradske lokacije, Niš","<h2 _ngcontent-ng-c3754543513 class=""mat-headline-5"">Opis oglasa</h2><div _ngcontent-ng-c3754543513 class=""prose max-h-64 overflow-hidden text-gray-800 ng-star-inserted""><p>Na prodaju kuća u Niškoj Banji. Kuća se nalazi u opštini Niška Banja, u blizini teniskih terena i poznatog restorana Gurmanova tajna. Nalazi se na placu površine 6a, ima mogucnost povećanja površine do 23 ara. Kuća u osnovi ima 162m2 a sastoji se od suterena, prizemlja, sprata i potkrovlja, po rečima prodavca kuća ima preko 486m2 korisne površine. Kuća je u sivoj fazi sa postojećim priključcima za struju i vodu bez kanalizacije. Plac ima izlaz na asfaltiran put, a u blizini je i put koja vodi do banjskog šetališta. Zemliste  je građevinsko. Državina. Ima projekat, ima građevinsku dozvolu ali se mora podnti u katastar. Odlična nekretnina koja uz dodatna ulaganja može biti pretvorena u mini hotel, stambeno poslovni objekat ili nešto treće. Vredi pogledati.","1-etažna kuća na prodaju, Carigradska, 103.000€, 486m² - 4zida",2023-12-19,,1,,,,,,,1 garažno mesto ,,,
255,https://www.4zida.rs/prodaja-kuca/apelovac-palilula-gradske-lokacije-nis/kuca/64dba5bb8cccf19c150d7cbe,320 m² ,10 soba ,uknjiženo ,,,terasa ,,3730 ,pre 4 meseca ,230.000,Apelovac,"Apelovac, Palilula, Gradske lokacije, Niš","<h2 _ngcontent-ng-c3754543513 class=""mat-headline-5"">Opis oglasa</h2><div _ngcontent-ng-c3754543513 class=""prose max-h-64 overflow-hidden text-gray-800 ng-star-inserted""><p>Na prodaju porodična kuća u Apelovcu, u urbanom delu grada, na 2km od centra grada, 1km od parka Čair, u blizini je i srednja medicinska škola(800m) i Medicinski fakultet (2km). Sve što je potrebno je u blizini, izvanredna lokacija. Kuća se nalazi na placu od 3.9a, sastoji se od 3 nivoa, podruma i garaže. Poseduje dve terase. Svaki sprat ima zaseban stan. Prostrano dvorište sa dva velika ulaza za vozila. Hvala Vam što ste pogledali oglas. Za više informacija o ovoj ili drugim nekretninama i zakazivanje razgledanja kontaktirajte agenta na broj telefona iz oglasa (poziv, sms, viber) ili putem e-maila. Kompletnu ponudu dostupnih nekretnina možete pronaći na našem sajtu.","Kuća na prodaju, Apelovac, 230.000€, 320m² - 4zida",2023-12-19,,,3.9a plac ,,,prazno ,,,,,,
256,https://www.4zida.rs/prodaja-kuca/trupale-okolne-lokacije-nis/kuca/6286117b4353af7dae7d1443,94 m² ,,,,,,kupatilo ,G103800 ,pre 8 meseci ,39.500,Trupale,"Trupale, Okolne lokacije, Niš","<h2 _ngcontent-ng-c3754543513 class=""mat-headline-5"">Opis oglasa</h2><div _ngcontent-ng-c3754543513 class=""prose max-h-64 overflow-hidden text-gray-800 ng-star-inserted""><p>Prodaja kuce u Vrtištu (Vrtište)<br>Prodaja kuce u okolini Niša, oko 12 km od Niša na placu od 14 ari, vocnjak iza kuce objekat uknjizen sa upotrebnom dozvolom.Ima struja,uvedena voda.<br>Za dodatne informacije pozovite agenciju Gigant na tel. 018-299-229  064-538-1199<br>Agencija Gigant lux je upisana u registar posrednika pod brojem 1094","Kuća na prodaju, Trupale, 39.500€, 94m² - 4zida",2023-12-19,,,,grejanje na struju ,,,,,,,,
257,https://www.4zida.rs/prodaja-kuca/vinik-pantelej-gradske-lokacije-nis/dvoetazna/63fde9c348d8907dcf0c9d6b,102 m² ,4 sobe ,uknjiženo ,,,"dvorište, terasa, lođa ","kupatila (2), ostava ",,pre 4 sata ,105.000,Vinik,"Vinik, Pantelej, Gradske lokacije, Niš","<h2 _ngcontent-ng-c3754543513 class=""mat-headline-5"">Opis oglasa</h2><div _ngcontent-ng-c3754543513 class=""prose max-h-64 overflow-hidden text-gray-800 ng-star-inserted""><p>Kuca bruto povrsine 102 m2 novijeg datuma sa placem 9,5 ari nalazi se na odlicnoj lokaciji u naselju vinik, cist vazduh i priroda na samo 5 km od narodnog pozorista.<br>Izolacija od 10cm,oluci ,kupaila i pvc stolarija uradjeno pre 2,3 god,prizemlje i sprat sa posebnim ulazom...2 kupatila,na placu je pomocna prostorija i ostava  u donjem delu placa sa razvedenom strujom.<br>Za sve dodatne informacije pozivati, Igor<br>Vlasnik 1/1,kuća uknjižena krajem prosle godine","2-etažna kuća na prodaju, Vinik, 105.000€, 102m² - 4zida",2023-12-19,Samostalna kuća ,2,950a plac ,grejanje na struju ,,polunamešteno ,,gradska voda ,,Optički ,,
