,link,Površina,Broj soba,Uknjiženost,Stanje,Parking,Infrastruktura,Unutrašnje prostorije,Šifra oglasa,Oglas ažuriran,price,street,address,description,title,end_date,Tip,Broj etaža,Plac,Grejanje,Opremljenost,Nameštenost,Godina izgradnje,Vodoinstalacija,Garaža,Internet,Orijentacija nekretnine,Pogled na
83,https://www.4zida.rs/prodaja-kuca/trnava-gradske-lokacije-jagodina/kuca/6468840c8a5af5b5ee092789,150 m² ,,,,,,,6788 ,pre 5 meseci ,150.000,Trnava,"Trnava, Gradske lokacije, Jagodina","<h2 _ngcontent-ng-c3754543513 class=""mat-headline-5"">Opis oglasa</h2><div _ngcontent-ng-c3754543513 class=""prose max-h-64 overflow-hidden text-gray-800 ng-star-inserted""><p>Kuca sa dva ulaza, pogodna za zivot jedne ili dve porodice . Poseduje veliki dnevni boravak, cetiri spavace sobe, kupatilo. Ista struktura je i u drugom ulazu. Takodje postoji mogućnost spajanja. Grejanje na čvrsto gorivo, moguce i na kotao na struju, fasada 10cm bez završnog sloja, video nadzor.","Kuća na prodaju, Trnava, 150.000€, 150m² - 4zida",2023-12-19,,,4.89a plac ,,,polunamešteno ,2000,,,,,
84,https://www.4zida.rs/prodaja-kuca/centar-gradske-lokacije-zrenjanin/jednoetazna/62eb8ddbf74c379ff10dfedb,183 m² ,4 sobe ,uknjiženo ,potrebno renoviranje ,,,,,pre 1 godinu ,47.500,Centar,"Centar, Gradske lokacije, Zrenjanin","<h2 _ngcontent-ng-c3754543513 class=""mat-headline-5"">Opis oglasa</h2><div _ngcontent-ng-c3754543513 class=""prose max-h-64 overflow-hidden text-gray-800 ng-star-inserted""><p>Kuća za rušenje ili ozbiljnije adaptacije površine 183m2, na placu od 393 m2, Centar. Od priključaka ima monafazna struja, voda i gas. Na placu se nalaze i još dve uknjižene  pomoćne prostorije ukupne površine  38m2. Kuća je na dobroj lokaciji na uglu dve ulice. Dimenzije placa sa ulice su 16m X 30m.","1-etažna kuća na prodaju, Centar, 47.500€, 183m² - 4zida",2023-12-19,Samostalna kuća ,1,3.93a plac ,grejanje na gas ,,prazno ,,,,,,
85,https://www.4zida.rs/prodaja-kuca/mali-radanovac-gradske-lokacije-subotica/jednoetazna/64b7ae037752b8c34007e4d9,154 m² ,4 sobe ,,,,"tavan, terasa ",kupatilo ,124 ,pre 2 meseca ,73.000,Eduarda Rusijana,"Mali Radanovac, Gradske lokacije, Subotica","<h2 _ngcontent-ng-c3754543513 class=""mat-headline-5"">Opis oglasa</h2><div _ngcontent-ng-c3754543513 class=""prose max-h-64 overflow-hidden text-gray-800 ng-star-inserted""><p>Prodaje se prizemna kuća u mirnom delu grada( Mali Radanovac) i  sa velikim dvorišnim prostorom.<br>Kuća je građena od mešanog materijala i postoje priključci: struja, kanalizacija, gradska voda.<br>Površina porodične kuće iznosi 154 m2. Površina placa je 881m2.<br>Raspored prostorija kuće je sledeći: dva predsoblja, četri sobe, kuhinja sa trpezarijom, kupatilo i špajz.<br>Grejanje na čvrsto gorivo u individualnim grejnim telima .<br>Podovi od betona, brodskog poda i keramičkih pločica. Stolarija je drvena.","1-etažna kuća na prodaju, Eduarda Rusijana, 73.000€, 154m² - 4zida",2023-12-19,,1,881a plac ,,,prazno ,,,,,,
86,https://www.4zida.rs/prodaja-kuca/gradske-lokacije-indjija/dvoetazna/5cae240f9a309130cf3da8d6,,,,,,,,,,,,,,"2-etažna kuća na prodaju, Gradske lokacije, 104.000€, 150m² - 4zida",2023-12-19,,,,,,,,,,,,
87,https://www.4zida.rs/prodaja-kuca/bogutovacka-banja-okolne-lokacije-kraljevo/dvoetazna/641606a65e97b103c20ef8fb,,,,,,,,,,,,,,"2-etažna kuća na prodaju, Bogutovacka banja, 85.000€, 160m² - 4zida",2023-12-19,,,,,,,,,,,,
88,https://www.4zida.rs/prodaja-kuca/lipov-gaj-adice-gradske-lokacije-novi-sad/kuca/6421a401ab23cff2c000dbb1,200 m² ,5 soba ,,u izgradnji ,,,kupatilo ,3045586 ,pre 5 meseci ,226.600,"LIPOV GAJ, NOVI SAD","Lipov Gaj, Adice, Gradske lokacije, Novi Sad","<h2 _ngcontent-ng-c3754543513 class=""mat-headline-5"">Opis oglasa</h2><div _ngcontent-ng-c3754543513 class=""prose max-h-64 overflow-hidden text-gray-800 ng-star-inserted""><p>Kuća u sivoj fazi Lipov gaj  +++  Agencijska oznaka nekretnine 3045586 Novi Sad. Oglašavamo prodaju dvoetažne kuće (pr+po), u mirnoj asfaltiranoj ulici, slepoj ulici, u kojoj nema ni jedna zgrada niti ima praznih placeva na kojima se može graditi. Kuća ima funkcionalan raspored prostorija. U prizemlju se nalaze dve spavaće sobe, degažman za dva kupatila, kao i kuhinja sa trpezarijom i dnevno sobom koje su otvorenog koncepta sa portal prozorima i vratima koja izlaze na terasu sa zadnje strane dvorišta. Stepenište je kod ulaznih vrata, ima dosta prirodne svetlosti  i vodi na sprat gde se nalazi jos jedna velika prostorija i spavaća soba, ali po želji  kupca može dodatno da se pregradi. Na spratu se nalazi još jedno kupatilo i terasa. Kuća je zidana kvalitetnim materijalom, ima priključke za struju, vodu i kanalizaciju. Za sve informacije pozovite Dušica Vasić 063514639, 021546645, 021546282 ( House nekretnine Novi Sad, Reg.br. 200)","Kuća na prodaju, LIPOV GAJ, NOVI SAD, 226.600€, 200m² - 4zida",2023-12-19,,,,,,,,,,,,
89,https://www.4zida.rs/prodaja-kuca/gornja-varos-gradske-lokacije-sombor/dvoetazna/61814779ce50b36e19107290,138 m² ,4 sobe ,uknjiženo ,,1 parking mesto ,"dvorište, terasa ",kupatilo ,,pre 6 dana ,102.000,Gornja Varoš,"Gornja Varoš, Gradske lokacije, Sombor","<h2 _ngcontent-ng-c3754543513 class=""mat-headline-5"">Opis oglasa</h2><div _ngcontent-ng-c3754543513 class=""prose max-h-64 overflow-hidden text-gray-800 ng-star-inserted""><p>Prodaje se komforna kuća površine 138m2. ","2-etažna kuća na prodaju, Gornja Varoš, 102.000€, 138m² - 4zida",2023-12-19,Samostalna kuća ,2,25a plac ,grejanje na gas ,internet ,prazno ,,,,,,
90,https://www.4zida.rs/prodaja-kuca/centar-1-gradske-lokacije-subotica/kuca/64430c8e05b617d50b08820b,230 m² ,9 soba ,,,,,,NK,pre 7 meseci ,250.000,Centar 1,"Centar 1, Gradske lokacije, Subotica","<h2 _ngcontent-ng-c3754543513 class=""mat-headline-5"">Opis oglasa</h2><div _ngcontent-ng-c3754543513 class=""prose max-h-64 overflow-hidden text-gray-800 ng-star-inserted""><p>Prodaje se 9s,spratna kuća u blizini centra od 230kvm, na placu od 1100kvm, 9 soba,veliki dnevni boravak, kuhinja sa trpezarijom, dole podno grejanje, gore grejanje na gas+struja, samostalna, pogodno za gerontoloski centar.","Kuća na prodaju, Centar 1, 250.000€, 230m² - 4zida",2023-12-19,,,,,,,,,,,,
91,https://www.4zida.rs/prodaja-kuca/veternik-gradske-lokacije-novi-sad/jednoetazna/63618be5470cca34890ac508,,,,,,,,,,,,,,"Prodaja kuća Veternik, Gradske lokacije, Novi Sad, Jednoetažna - 4zida",2023-12-19,,,,,,,,,,,,
92,https://www.4zida.rs/prodaja-kuca/gradske-lokacije-backa-palanka/cetveroetazna/63944f13c2eb80d0e9089db0,180 m² ,4 sobe ,uknjiženo ,,u dvorištu zgrade ,"dvorište, podrum, terasa ","kupatilo, kuhinja, ostava ",,pre 1 dan ,400.000,Gradske lokacije,"Gradske lokacije, Bačka Palanka","<h2 _ngcontent-ng-c3754543513 class=""mat-headline-5"">Opis oglasa</h2><div _ngcontent-ng-c3754543513 class=""prose max-h-64 overflow-hidden text-gray-800 ng-star-inserted""><p>Konforna kuća sa tri spavaće sobe dnevnim boravkom, trpezarijom ,kuhinjom i kupatilom.U sastav kuće ulazi ulični lokal površine 80m2 i nadzidani dvosoban stan površine 60m2 tu je i  prelepo dvorište u kojem se nalazi natkriveni deo koji se može koristiti kao garažno mesto ili kao magacinski prostor.Trenutno kuća se greje na struju i čvrsto gorivo(kaljava peć) ali postoji mogućnost uvodjenja gasa.Kuća je u  dobrom stanju i zahteva veoma mala ulaganja.","4-etažna kuća na prodaju, Gradske lokacije, 400.000€, 180m² - 4zida",2023-12-19,Kuća u nizu ,4,600a plac ,kaljeva peć ,"telefon, Kanalizacija ",prazno ,1900,gradska voda ,2 garažna mesta ,,,
93,https://www.4zida.rs/prodaja-kuca/streliste-gradske-lokacije-pancevo/jednoetazna/6316e6b80b49cb1c440bbc6c,268 m² ,3 sobe ,uknjiženo ,novo ,,"dvorište, alarm ","kupatilo, toalet ",,pre 2 meseca ,210.000,Strelište,"Strelište, Gradske lokacije, Pančevo","<h2 _ngcontent-ng-c3754543513 class=""mat-headline-5"">Opis oglasa</h2><div _ngcontent-ng-c3754543513 class=""prose max-h-64 overflow-hidden text-gray-800 ng-star-inserted""><p>Prodaje se stambeni objekat ukupne površine 268,21m2 na placu površine 15a (30x50m2) u blizini Bavaništansog puta. Objekat se sastoji od stambenog dela (prizemlje + potkrovlje), površine 75m2 i tri odvojene hale, površina 80m2, 55m2 i 55m2. U prizemlju stambenog objekta nalazi se jedna spavaća soba i kupatilo, a u potkrovlju dnevna soba sa kuhinjom i kupatilom, francuski balkon. Hala ima jednu prostoriju u funkciji kancelarije, sa svojim kupatilom (kompletno sređeno). Grejanje je na struju, a u potkrovlju postoji kamin na pelet. Objekat nije povezan na kanalizaciju, ima septički tank. Voda je bunarska, ima dva brojila za struju. Postoji i video nadzor, internet je ADSL. Dvorište je veliko i lepo uređeno, sa puno zelenila. Sam objekat je praktično nov, stambeni deo je upravo kompletno sređen (nova keramika, instalacije, kompletna kupatila, stolarija), ima video nadzor, spoljnu ambijentalnu rasvetu).","1-etažna kuća na prodaju, Strelište, 210.000€, 268m² - 4zida",2023-12-19,Samostalna kuća ,1,15a plac ,,"telefon, internet ",prazno ,2020,bunarska voda ,,ADSL ,,
94,https://www.4zida.rs/prodaja-kuca/gradske-lokacije-arandjelovac/kuca/62b0b6f377f09e7cc2485e78,122 m² ,5 soba ,uknjiženo ,,1 parking mesto ,"dvorište, terasa ","kupatila (2), kuhinja, ostava ",4197 ,pre 1 mesec ,88.000,Bore Stankovića,"Gradske lokacije, Aranđelovac","<h2 _ngcontent-ng-c3754543513 class=""mat-headline-5"">Opis oglasa</h2><div _ngcontent-ng-c3754543513 class=""prose max-h-64 overflow-hidden text-gray-800 ng-star-inserted""><p>U veoma mirnoj ulici u neposrednoj blizini pošte, čuvenog aranđelovačkog parka i Starog zdanja, u strogom centru, prodaje se lepa troetažna kuća sa dve jedinice, lepo uređenim dvorištem i parkingom.<br>Na visokom prizemlju i spratu nalazi se stan, duplex (84m2) sa 3 sobe, dva kupatila, kuhinjom, trpezarijom, hodnikom, ostavom, stepeništem i dve prelepe terase pozicionirane na uglu objekta. Trostrano je orijentisan (Z,J,I). Iznad je tavanski prostor. U nivou dvorišta nalazi se nezavisna jedinica površine (38.5m2) sa zasebnim ulazom, mokrim čvorom, dve prostorije, ostavom i hodnikom, trenutno u funkciji ateljea. Prostor je veoma lepo osvetljen, trostrane orijentacije sa 3 normalna prozora, na visini oko 1.5m od zemlje i može biti i stambeni i poslovni prostor.  (samo je delimično ukopan). Kuća je dobro izolovana (5cm), ima grejanje na gas.<br>Dvorište je ograđeno sa svih strana, veoma prijatno, intimno, oplemenjeno zelenilom i mobilijarom i omogućava formiranje parkinga. Ceo plac je površine 2 ara. Ucrtana je i šupa kao zaseban objekat osnove 20m2 iako trenutno ne postoji.  Kuća je u vlasništvu 1/1, uknjižena kao zaseban objekat koji se bočnom (severnom) stranom naslanja na susedni objekat, takođe zasebno uknjižen sa udelom 1/1. Vlasnik kuće je i suvlasnik parcele od 4 ara sa udelom ½ gde je sprovedena  fizička deoba sa susedom i postavljena ograda u skladu sa ugovorom o fizičkoj deobi parcele.<br>Provizija agencije je 2% od prodajne cene.<br>Šta podrazumeva agencijska provizija od 2%:","Kuća na prodaju, Bore Stankovića, 88.000€, 122m² - 4zida",2023-12-19,,,1.5a plac ,grejanje na gas ,klima ,,,,,,"istok, zapad, jug ",
95,https://www.4zida.rs/prodaja-kuca/cerat-okolne-lokacije-sremski-karlovci/dvoetazna/6437e1cbad899d2d860b1119,258 m² ,5 soba ,uknjiženo ,,,,,499770 ,pre 8 meseci ,669.500,Čerat,"Čerat, Okolne lokacije, Sremski Karlovci","<h2 _ngcontent-ng-c3754543513 class=""mat-headline-5"">Opis oglasa</h2><div _ngcontent-ng-c3754543513 class=""prose max-h-64 overflow-hidden text-gray-800 ng-star-inserted""><p>Moderna, novoizgrađena, luksuzna nekretnina na idealno pozicioniranom placu sa pogledom na Dunav i okolinu. Kuća je neuseljavana, spratnosti Su+P+1, idealnog rasporeda. Poseduje pet spavaćih soba. Svi materijali korišćeni u toku izgradnje su vrhunskog kvaliteta. Grejanje je podno na gas, svuda u kući su postavljene keramičke pločice. Ne propustite ovu jednistvenu ponudu i pozovite naše agente prodaje.","2-etažna kuća na prodaju, Čerat, 669.500€, 258m² - 4zida",2023-12-19,Samostalna kuća ,2,6a plac ,grejanje na gas ,,prazno ,,,,,,
96,https://www.4zida.rs/prodaja-kuca/medijana-gradske-lokacije-nis/jednoetazna/637223f51ac454c624050bad,,,,,,,,,,,,,,"Prodaja kuća Medijana, Gradske lokacije, Niš, Jednoetažna - 4zida",2023-12-19,,,,,,,,,,,,
97,https://www.4zida.rs/prodaja-kuca/durlan-pantelej-gradske-lokacije-nis/jednoetazna/655b4f5338b3608ed5086fb8,50 m² ,3 sobe ,uknjiženo ,potrebno renoviranje ,,,kupatilo ,p,pre 29 dana ,75.000,Studenička,"Durlan, Pantelej, Gradske lokacije, Niš","<h2 _ngcontent-ng-c3754543513 class=""mat-headline-5"">Opis oglasa</h2><div _ngcontent-ng-c3754543513 class=""prose max-h-64 overflow-hidden text-gray-800 ng-star-inserted""><p>Na prodaju kuća u Durlanu, u blizini pošte i tri solitera. Nalazi se u mirnom okruženju za porodično stanovanje. Površina je 50m2, prizemna, na polovini placa, 163m2 od 327m2 ukupno. Grejanje na struju. U funkciji je trosobnog stana. Sastoji se od ulaznog hodnika, kupatila, kuhinje, dnevne sobe sa trpezarijom i dve spavaće sobe. Pre par godina je zamenjena kompletna instalacija ( struja,voda) ,zemenjena stolarija (postavljena PVC). Potrebna adaptacija. Cena kuće je 75.000EUR, uknjižena, svojina privatna. Zanimljiva ponuda za klijente koji žele lep i miran porodičan život. Ovo je samo deo naše ponude, ovu kao i druge nekretnine sa većim brojem fotografija možete pogledati na našem sajtu","1-etažna kuća na prodaju, Studenička, 75.000€, 50m² - 4zida",2023-12-19,,1,,grejanje na struju ,,,,,1 garažno mesto ,,,
98,https://www.4zida.rs/prodaja-kuca/perlez-okolne-lokacije-zrenjanin/kuca/61c05e3668b1fc65e86728d8,45 m² ,2 sobe ,uknjiženo ,uobičajeno stanje ,,terasa ,,42780 ,pre 8 meseci ,15.000,Perlez,"Perlez, Okolne lokacije, Zrenjanin","<h2 _ngcontent-ng-c3754543513 class=""mat-headline-5"">Opis oglasa</h2><div _ngcontent-ng-c3754543513 class=""prose max-h-64 overflow-hidden text-gray-800 ng-star-inserted""><p>Kuća za odmor u vikend zoni kod Perleza, površine 45m2 na placu površine 11,75a. Kuća je nedovršena i sastoji se od dve veće sobe od kojih je jedna predviđena za dnevni boravak a druga za kuhinju sa trpezarijom. Kuća je građena od čvrstog materijala, pokrivena, priključena struja, nalazi se u neposrednoj blizini asfaltnog puta sa jedne strane i reke Begej sa druge strane. Na placu je posađeno 30 mladih stabala.<br>Agencijska provizija 1,5% od kupoprodajne cene<br>Za više informacija pozvati    063 851 8888    063 854 9999 Agencijska provizija 300 eur.  ID oglasa: 42780.","Kuća na prodaju, Perlez, 15.000€, 45m² - 4zida",2023-12-19,,,11.75a plac ,grejanje na struju ,,prazno ,,,,,,
99,https://www.4zida.rs/prodaja-kuca/fon-vozdovac-vozdovac-vozdovac-opstina-beograd/kuca/6516d5011731967c2a01284f,,,,,,,,,,,,,,Pretraga Nekretnina za Prodaju i Izdavanje · 4zida,2023-12-19,,,,,,,,,,,,
100,https://www.4zida.rs/prodaja-kuca/gradske-lokacije-indjija/kuca/623a02340335c512f74ff033,380 m² ,5 soba ,uknjiženo ,novo ,,"podrum, terasa ",kupatilo ,15231 ,pre 32 dana ,450.000,Gradske lokacije,"Gradske lokacije, Inđija","<h2 _ngcontent-ng-c3754543513 class=""mat-headline-5"">Opis oglasa</h2><div _ngcontent-ng-c3754543513 class=""prose max-h-64 overflow-hidden text-gray-800 ng-star-inserted""><p>Na prodaju nova, luksuzna kuća u najatraktivnijoj ulici u centru Inđije. Kuća je napravljena po vrhunskim standardima gradnje od prvoklasnih materijala i uz angažovanje stručnog nadzora tokom cele gradnje. Podrum je površine 135 m2 i poseduje garažu za 3 automobila, kotlarnicu i 3 prostorije. Prizemlje je površine 146 m2 i sadrži veliku dnevnu sobu spojenu sa kuhinjom, trpezarijom, ostavom, 1 spavaću sobu, kupatilo i 3 terase. Potkrovlje je površine 99 m2 i ima 3 spavaće sobe, kupatilo, garderober i terasu. Zid je sendvič (termo blok, parna brana, stiropor 8 cm, cigla). Ploče su pune betonske. Stolarija aluminijumska, krovna Velux. Unutrašnjost je kompletno završena. Svi podovi odradjeni su u italijanskoj keramici. U svim sobama priključci za telefon, internet, kablovsku tv na više pozicija. Odradjeno kvalitetno kabliranje za alarmni sistem, video nadzor. Ugrađen Panasonic inverter multi split sistem hladjenja i zagrevanja (2 spoljne i 6 unutrašnjih jedinica). Odradjeno podno grejanje na gas. U dnevnoj sobi ugradjen i kamin. Opcija dodavanja toplotnih pumpi bez prepravki postojeće instalacije grejanja. Topla voda u kuhinji i kupatilima preko Stiebel protočnih bojlera. Ceo unutrašnji odvod odrađen u bešumnim Geberit cevima. Potkrovlje moze da funkcioniše kao posebna stambena jedinica pošto je kompletna instalacija (struja, voda, grejanje) razdvojena. Behaton Semmelrock. Kapije i ograde na terasama od aluminijumskih profila. Zadnji deo placa miran, preko celog dana osunčan i idealan za izgradnju bazena. Preostali samo spoljašnji radovi: fasada, keramika na terasama i montaža video nadzora i alarmnog sistema. Postoji obimna foto dokumentacija celokupnih radova. ","Kuća na prodaju, Gradske lokacije, 450.000€, 380m² - 4zida",2023-12-19,,,7.7a plac ,,"telefon, kablovska, interfon, klima ",prazno ,,,1 garažno mesto ,,,
101,https://www.4zida.rs/prodaja-kuca/novi-futog-futog-okolne-lokacije-novi-sad/jednoetazna/656f04a3d7577c737a008829,89 m² ,3 sobe ,uknjiženo ,,,,kupatilo ,519818 ,pre 14 dana ,159.648,Novi Futog,"Novi Futog, Futog, Okolne lokacije, Novi Sad","<h2 _ngcontent-ng-c3754543513 class=""mat-headline-5"">Opis oglasa</h2><div _ngcontent-ng-c3754543513 class=""prose max-h-64 overflow-hidden text-gray-800 ng-star-inserted""><p>Predstavljamo vam odličnu kuću u Futogu. Uknjižena je na 89m2. Na donjoj etaži se nalaze prostran dnevni boravak sa kuhinjom i trpezarijom, kupatilo i dve prelepe spavaće sobe. Gornji nivo je isti kao i donji ali je nedovršen, postavljen je samo PVC. U dvorištu se nalaze još nusprostorije u vidu kupatila koje je nedovršeno i još dve sobe. Lokacija je odlična. Ulica je mirna, prohodna. Glavni put je na svega par stotina metara. U neposrednoj okolini se nalaze autobska stanica, marketi,mesare. Veoma je bitno da je i osnovna škola u blizini. Ovo je odlična ponuda i vredi pogledati, to je naš topli savet. Ukoliko vas zanima još informacija o ovoj nekretnini, pozovite nas.","1-etažna kuća na prodaju, Novi Futog, 159.648€, 89m² - 4zida",2023-12-19,Samostalna kuća ,1,,grejanje na struju ,,prazno ,,,,,,
102,https://www.4zida.rs/prodaja-kuca/karlovcic-okolne-lokacije-pecinci/kuca/654bdc6fed5c44afc504797b,190 m² ,3 sobe ,uknjiženo ,,,terasa ,,3187 ,pre 1 mesec ,29.500,Gornjanska,"Karlovčić, Okolne lokacije, Pećinci","<h2 _ngcontent-ng-c3754543513 class=""mat-headline-5"">Opis oglasa</h2><div _ngcontent-ng-c3754543513 class=""prose max-h-64 overflow-hidden text-gray-800 ng-star-inserted""><p>Stara kuća za adaptaciju u blizini škole i stadiona. Plac 41 ar. Sve uknjiženo.","Kuća na prodaju, Gornjanska, 29.500€, 190m² - 4zida",2023-12-19,,,41a plac ,,,,,,,,,
103,https://www.4zida.rs/prodaja-kuca/sremska-kamenica-gradske-lokacije-novi-sad/jednoetazna/6464b622f08fa86b8007c0c1,272 m² ,5 soba ,uknjiženo ,novo ,,"prilaz za invalide, dvorište ",kupatila (3,430731 ,pre 1 mesec ,1.060.000,Vase Stajica 29,"Sremska Kamenica, Gradske lokacije, Novi Sad","<h2 _ngcontent-ng-c3754543513 class=""mat-headline-5"">Opis oglasa</h2><div _ngcontent-ng-c3754543513 class=""prose max-h-64 overflow-hidden text-gray-800 ng-star-inserted""><p>Predstavljamo vam zadivljujuće utočište koje se nalazi u živopisnom delu Sremske Kamenice, na samo par koraka od Novog Sada. Ova izvanredna nekretnina je zaista jedinstvena rezidencija, koja kombinuje mir prirode sa udobnošću modernog doma. Dobrodošli u svet gde se spokoj i sofisticiranost besprekorno prepliću. U srcu ovog imanja stoji izuzetna kuća, sa pet prostranih spavaćih soba za smeštaj vaše porodice i gostiju. Dok se približavate, dočekaće vas prizor koji podseća na idilično seosko povlačenje. Prostrano zemljište koje se prostire na preko 4000 m2 obuhvata suštinu prirodne lepote. Vrhunac ovog očaravajućeg pejzaža je očaravajuće jezero, ukrašeno nežnim stvorenjima kao što su žabe, patke i živahne ribe, donoseći harmoniju divljih životinja na vaš prag. Privlačnost se nastavlja dok istražujete teren, vođeni vijugavim potokom koji prolazi kroz celo imanje. Privlačan most se graciozno nadvija nad tekućim vodama, vodeći vas do ulaznih vrata kuće. Uđite unutra i bićete očarani besprekornom mešavinom rustičnog šarma i savremenog dizajna. Unutrašnjost kuće odiše atmosferom topline i udobnosti, sa obiljem prirodne svetlosti koja kaskadno prolazi kroz velike prozore koji uokviruju zadivljujući pogled na okolnu prirodu. Pažljivo izrađeni životni prostori neprimetno se spajaju sa spoljnim pejzažom, stvarajući privlačan ambijent koji vas zaista povezuje sa spokojnim okruženjem. Bilo da zabavljate goste ili provodite kvalitetno vreme sa svojim najmilijima, ova nekretnina nudi mnoštvo mogućnosti. Prostrano dvorište vas mami da se opustite u zagrljaju prirode, gde možete uživati u piknicima, šetnjama duž ivice vode ili se jednostavno opustiti u senci visokog drveća. Privlačnost ove kuće leži u njenoj sposobnosti da vas preveze u svet daleko od gužve i užurbanosti, a istovremeno pruža lak pristup sadržajima Novog Sada. Sa svojom izvanrednom parcelom sa zadivljujućim jezerom, vijugavim potokom i ambijentom koji se neprimetno stapa sa prirodom, ovo imanje je utočište koje bez napora obuhvata suštinu mirnog života. Ne propustite ovu neverovatnu priliku da ovo harmonično utočište učinite svojim. Zagrlite lepotu Sremske Kamenice i iskoristite priliku da stvorite večne uspomene u ovoj izuzetnoj rezidenciji.<br>Moguca kupovina i sa kriptovalutama!","1-etažna kuća na prodaju, Vase Stajica 29, 1.060.000€, 272m² - 4zida",2023-12-19,Samostalna kuća ,1,4000a plac ,,"telefon, kablovska, TV, klima, veš mašina, kuhinjski elementi, sudo mašina, frižider, zamrzivač, mikrotalasna rerna, rerna, šporet, ležaj, plakar, ugradni plakar, Kanalizacija ",namešteno ,2010,gradska voda ,1 garažno mesto ,,,
104,https://www.4zida.rs/prodaja-kuca/futog-okolne-lokacije-novi-sad/kuca/64e5dca3146172044c065e8d,80 m² ,3 sobe ,,uobičajeno stanje ,,,,3090568 ,pre 3 meseca ,51.500,Futog,"Futog, Okolne lokacije, Novi Sad","<h2 _ngcontent-ng-c3754543513 class=""mat-headline-5"">Opis oglasa</h2><div _ngcontent-ng-c3754543513 class=""prose max-h-64 overflow-hidden text-gray-800 ng-star-inserted""><p>Agencijska oznaka - 3090568 - Manja trosobna kuća u blizini Glavnog puta. Uknjiženo je 40m2, a još 40m2 se može legalizovati. Grejanje je na čvrsto gorivo,ali je gas na ulici. Kuća je pogodna za renoviranje, a obzirom na lokaciju može biti interesantna nekretnina. Zvati na 064 823 66 36. Buda","Kuća na prodaju, Futog, 51.500€, 80m² - 4zida",2023-12-19,,,,,,,,,,,,
105,https://www.4zida.rs/prodaja-kuca/ivanovo-okolne-lokacije-pancevo/jednoetazna/6521090fbce516d56f0e4f6d,,,,,,,,,,,,,,"Prodaja kuća Ivanovo, Okolne lokacije, Pančevo, Jednoetažna - 4zida",2023-12-19,,,,,,,,,,,,
106,https://www.4zida.rs/prodaja-kuca/sirine-petrovaradin-gradske-lokacije-novi-sad/dvoetazna/64552bb33f83df975c05e394,42 m² ,,,,,,,3003291 ,pre 7 meseci ,82.400,Širine,"Širine, Petrovaradin, Gradske lokacije, Novi Sad","<h2 _ngcontent-ng-c3754543513 class=""mat-headline-5"">Opis oglasa</h2><div _ngcontent-ng-c3754543513 class=""prose max-h-64 overflow-hidden text-gray-800 ng-star-inserted""><p>ŠIFRA:3003291, PETROVARADIN  ŠIRINE  VK KUĆA 42M2 .… Vikendica fantastičnog pogleda! Mir Fruške gore i priroda koja okružuje vikendicu upotpunjuje sve ono sto vam ova nekretnina pruža!. Dve zasebne celine, sa sobom i kupatilom. Plac površine 1520m2, većim delom pod uredjenim voćnjakom i vinovom lozom. Prednje dvorište idealno za porodične trenutke. Za više informacija kontaktirajte: Radmila Gavrić, licenca br.2826, mob:063/786-12-74.  (Solis nekretnine, Novi Sad, upisan u Registar posrednika br. 544, tel: 021/520-231)","2-etažna kuća na prodaju, Širine, 82.400€, 42m² - 4zida",2023-12-19,,2,,centralno grejanje ,,,2000,,,,,
107,https://www.4zida.rs/prodaja-kuca/sumarice-gradske-lokacije-kragujevac/jednoetazna/645550d0243d880e53013898,,,,,,,,,,,,,,"Prodaja kuća Šumarice, Gradske lokacije, Kragujevac, Jednoetažna - 4zida",2023-12-19,,,,,,,,,,,,
108,https://www.4zida.rs/prodaja-kuca/petrovac-gradske-lokacije-kragujevac/kuca/622721cb93cf415f1d11cdf4,255 m² ,9 soba ,uknjiženo ,novo ,1 parking mesto ,terasa ,ostava ,185 ,pre 7 meseci ,95.000,Petrovac,"Petrovac, Gradske lokacije, Kragujevac","<h2 _ngcontent-ng-c3754543513 class=""mat-headline-5"">Opis oglasa</h2><div _ngcontent-ng-c3754543513 class=""prose max-h-64 overflow-hidden text-gray-800 ng-star-inserted""><p>Na nivou tri 3.0 stana je struktura ove kuce, legalizovana i svaka od celina etaznih je upisana kao zaseban stan, prizemlje i sprat zavrseni, tavanski prostor samo ozidan, nije uradjena fasada. Moguća zamena za lokal ili kuću u cecntru grada uz doplatu.","Kuća na prodaju, Petrovac, 95.000€, 255m² - 4zida",2023-12-19,,,5.9a plac ,grejanje na struju ,Kanalizacija ,prazno ,,,1 garažno mesto ,,,
109,https://www.4zida.rs/prodaja-kuca/gradske-lokacije-velika-plana/jednoetazna/652430635ab0456cb2058d56,,,,,,,,,,,,,,"Prodaja kuća Gradske lokacije, Velika Plana, Jednoetažna - 4zida",2023-12-19,,,,,,,,,,,,
